"2207.00779","Aaron Chan","Aaron Chan, Shaoliang Nie, Liang Tan, Xiaochang Peng, Hamed Firooz,
  Maziar Sanjabi, Xiang Ren","FRAME: Evaluating Rationale-Label Consistency Metrics for Free-Text
  Rationales","BlackboxNLP Workshop at EMNLP 2022",,,,"cs.CL cs.AI cs.LG","http://arxiv.org/licenses/nonexclusive-distrib/1.0/","  Following how humans communicate, free-text rationales aim to use natural
language to explain neural language model (LM) behavior. However, free-text
rationales' unconstrained nature makes them prone to hallucination, so it is
important to have metrics for free-text rationale quality. Existing free-text
rationale metrics measure how consistent the rationale is with the LM's
predicted label, but there is no protocol for assessing such metrics'
reliability. Thus, we propose FRAME, a framework for evaluating rationale-label
consistency (RLC) metrics for free-text rationales. FRAME is based on three
axioms: (1) good metrics should yield highest scores for reference rationales,
which maximize RLC by construction; (2) good metrics should be appropriately
sensitive to semantic perturbation of rationales; and (3) good metrics should
be robust to variation in the LM's task performance. Across three text
classification datasets, we show that existing RLC metrics cannot satisfy all
three FRAME axioms, since they are implemented via model pretraining which
muddles the metric's signal. Then, we introduce a non-pretraining RLC metric
that greatly outperforms baselines on (1) and (3), while performing
competitively on (2). Finally, we discuss the limitations of using RLC to
evaluate free-text rationales.
","[{""version"":""v1"",""created"":""Sat, 2 Jul 2022 09:25:29 GMT""},{""version"":""v2"",""created"":""Fri, 2 Dec 2022 20:24:20 GMT""}]","2022-12-21"
"2207.00780","Makoto Kobayashi","M. Kobayashi, K. Yumino, T. Ogawa, A. Shoji, Y. Aoki, K. Ikematsu, P.
  Gros, T. Kawaguchi, D. Arai, M. Iwamura, K. Katsuki, A. Koto, M. Yoshikai, K.
  Fujii, T. Fusayasu, Y. Kato, S. Kawada, T. Matsuda, T. Mizuno, J. Nakajima,
  S. Narita, K. Negishi, H. Qi, R. D. Settles, A. Sugiyama, T. Takahashi, J.
  Tian, T. Watanabe, R. Yonamine","A novel technique for the measurement of the avalanche fluctuations of a
  GEM stack using a gating foil","39 pages including 11 figures","Nuclear Instruments and Methods in Physics Research A 1039 (2022)
  166872","10.1016/j.nima.2022.166872",,"physics.ins-det","http://arxiv.org/licenses/nonexclusive-distrib/1.0/","  We have developed a novel technique for the measurement of the size of
avalanche fluctuations of gaseous detectors using a gating device (gating foil)
prepared for the time projection chamber in the international linear collider
experiment (ILD-TPC). In addition to the gating function, the gating foil is
capable of controlling the average fraction of drift electrons detected after
gas amplification. The signal charge width and shape (skewness) for
electron-ion pairs created by a pulsed UV laser as a function of the
transmission rate of the gating foil can be used to determine the relative
variance of gas gain for single electrons. We present the measurement principle
and the result obtained using a stack of gas electron multipliers (GEMs)
operated in a gas mixture of Ar-CF$_4$(3%)-isobutane(2%) at atmospheric
pressure. Also discussed is the influence of the avalanche fluctuations on the
spatial resolution of the ILD-TPC.
","[{""version"":""v1"",""created"":""Sat, 2 Jul 2022 09:27:04 GMT""}]","2022-08-23"
"2207.00781","Dapeng Deng","Zhengchuan Chen, Dapeng Deng, Howard H. Yang, Nikolaos Pappas, Limei
  Hu, Yunjian Jia, Min Wang, Tony Q. S. Quek","Analysis of Age of Information in Dual Updating Systems",,,,,"cs.IT cs.NI math.IT","http://arxiv.org/licenses/nonexclusive-distrib/1.0/","  We study the average Age of Information (AoI) and peak AoI (PAoI) of a
dual-queue status update system that monitors a common stochastic process.
Although the double queue parallel transmission is instrumental in reducing
AoI, the out of order of data arrivals also imposes a significant challenge to
the performance analysis. We consider two settings: the M-M system where the
service time of two servers is exponentially distributed; the M-D system in
which the service time of one server is exponentially distributed and that of
the other is deterministic. For the two dual-queue systems, closed-form
expressions of average AoI and PAoI are derived by resorting to the graphic
method and state flow graph analysis method. Our analysis reveals that compared
with the single-queue system with an exponentially distributed service time,
the average PAoI and the average AoI of the M-M system can be reduced by 33.3%
and 37.5%, respectively. For the M-D system, the reduction in average PAoI and
the average AoI are 27.7% and 39.7%, respectively. Numerical results show that
the two dual-queue systems also outperform the M/M/2 single queue dual-server
system with optimized arrival rate in terms of average AoI and PAoI.
","[{""version"":""v1"",""created"":""Sat, 2 Jul 2022 09:29:15 GMT""}]","2022-07-05"
"2207.00782","Bin Guo","Hao Wang, Bin Guo, Yating Zeng, Yasan Ding, Chen Qiu, Ying Zhang, Lina
  Yao, Zhiwen Yu","Enabling Harmonious Human-Machine Interaction with Visual-Context
  Augmented Dialogue System: A Review","33pages, 4pages",,,,"cs.AI cs.HC","http://arxiv.org/licenses/nonexclusive-distrib/1.0/","  The intelligent dialogue system, aiming at communicating with humans
harmoniously with natural language, is brilliant for promoting the advancement
of human-machine interaction in the era of artificial intelligence. With the
gradually complex human-computer interaction requirements (e.g., multimodal
inputs, time sensitivity), it is difficult for traditional text-based dialogue
system to meet the demands for more vivid and convenient interaction.
Consequently, Visual Context Augmented Dialogue System (VAD), which has the
potential to communicate with humans by perceiving and understanding multimodal
information (i.e., visual context in images or videos, textual dialogue
history), has become a predominant research paradigm. Benefiting from the
consistency and complementarity between visual and textual context, VAD
possesses the potential to generate engaging and context-aware responses. For
depicting the development of VAD, we first characterize the concepts and unique
features of VAD, and then present its generic system architecture to illustrate
the system workflow. Subsequently, several research challenges and
representative works are detailed investigated, followed by the summary of
authoritative benchmarks. We conclude this paper by putting forward some open
issues and promising research trends for VAD, e.g., the cognitive mechanisms of
human-machine dialogue under cross-modal dialogue context, and
knowledge-enhanced cross-modal semantic interaction.
","[{""version"":""v1"",""created"":""Sat, 2 Jul 2022 09:31:37 GMT""}]","2022-07-05"
"2207.00783","Hai-Hu Wen","Huazhou Li, Han Li, Zhaohui Wang, Siyuan Wan, Huan Yang, Hai-Hu Wen","Real-space pairing through a confined local nematic state in cuprate
  superconductors","23 pages, 5 figures, plus Supplementary Materials 6 figures",,,,"cond-mat.supr-con","http://creativecommons.org/licenses/by/4.0/","  The pairing mechanism of high temperature superconductivity in cuprates is
regarded as one of the most challenging issues that we are facing now. The core
issue is about how the Cooper pairs are formed. There are plenty pictures
concerning the pairing manner, and some of them postulate local pairing of
charge freedom through the strong correlation effect. Here we report the spin
resolved tunnelling measurements on extremely underdoped Bi2Sr2-xLaxCuO6-delta.
Our data reveal that, when holes are doped into the system, the
antiferromagnetic order is destroyed together with the filling up of the charge
transfer gap by some density of states (DOS) with a maximum at about 200 meV.
Consequently, an electronic structure with 4a0x4a0 basic plaquettes gradually
emerges, and they become more populated versus further hole doping. In the
central part of each plaquette, there are three unidirectional bars (along the
Cu-O bond) enlightened by the enhanced peaks of coherence-like DOS at about
+-25 meV, and the intensity is especially pronounced at oxygen sites. For the
first time, we reveal an internal nematic pattern of these pairing related
states which exhibit a feature of precursor gap for superconductivity. We argue
that this confined nematic state within one 4a0x4a0 plaquette constitutes
naturally the local pairing format. Our work shed new light in unraveling the
longstanding puzzle of pairing mechanism in cuprate superconductors.
","[{""version"":""v1"",""created"":""Sat, 2 Jul 2022 09:38:46 GMT""},{""version"":""v2"",""created"":""Wed, 13 Jul 2022 02:08:27 GMT""}]","2022-07-14"
"2207.00784","Bo Zhang","Bo Zhang, Jiakang Yuan, Baopu Li, Tao Chen, Jiayuan Fan, Botian Shi","Learning Cross-Image Object Semantic Relation in Transformer for
  Few-Shot Fine-Grained Image Classification","Accepted by ACM MM-2022",,,,"cs.CV","http://arxiv.org/licenses/nonexclusive-distrib/1.0/","  Few-shot fine-grained learning aims to classify a query image into one of a
set of support categories with fine-grained differences. Although learning
different objects' local differences via Deep Neural Networks has achieved
success, how to exploit the query-support cross-image object semantic relations
in Transformer-based architecture remains under-explored in the few-shot
fine-grained scenario. In this work, we propose a Transformer-based
double-helix model, namely HelixFormer, to achieve the cross-image object
semantic relation mining in a bidirectional and symmetrical manner. The
HelixFormer consists of two steps: 1) Relation Mining Process (RMP) across
different branches, and 2) Representation Enhancement Process (REP) within each
individual branch. By the designed RMP, each branch can extract fine-grained
object-level Cross-image Semantic Relation Maps (CSRMs) using information from
the other branch, ensuring better cross-image interaction in semantically
related local object regions. Further, with the aid of CSRMs, the developed REP
can strengthen the extracted features for those discovered semantically-related
local regions in each branch, boosting the model's ability to distinguish
subtle feature differences of fine-grained objects. Extensive experiments
conducted on five public fine-grained benchmarks demonstrate that HelixFormer
can effectively enhance the cross-image object semantic relation matching for
recognizing fine-grained objects, achieving much better performance over most
state-of-the-art methods under 1-shot and 5-shot scenarios. Our code is
available at: https://github.com/JiakangYuan/HelixFormer
","[{""version"":""v1"",""created"":""Sat, 2 Jul 2022 09:43:38 GMT""}]","2022-07-05"
"2207.00785","Ebrahim Chekol Jibril","Ebrahim Chekol Jibril and A. C\""uneyd Tant\u{g}","ANEC: An Amharic Named Entity Corpus and Transformer Based Recognizer","22 pages including references and indexes, 10 figures and 6 tables",,,,"cs.CL cs.AI cs.LG","http://creativecommons.org/licenses/by-nc-sa/4.0/","  Named Entity Recognition is an information extraction task that serves as a
preprocessing step for other natural language processing tasks, such as machine
translation, information retrieval, and question answering. Named entity
recognition enables the identification of proper names as well as temporal and
numeric expressions in an open domain text. For Semitic languages such as
Arabic, Amharic, and Hebrew, the named entity recognition task is more
challenging due to the heavily inflected structure of these languages. In this
paper, we present an Amharic named entity recognition system based on
bidirectional long short-term memory with a conditional random fields layer. We
annotate a new Amharic named entity recognition dataset (8,070 sentences, which
has 182,691 tokens) and apply Synthetic Minority Over-sampling Technique to our
dataset to mitigate the imbalanced classification problem. Our named entity
recognition system achieves an F_1 score of 93%, which is the new
state-of-the-art result for Amharic named entity recognition.
","[{""version"":""v1"",""created"":""Sat, 2 Jul 2022 09:50:37 GMT""}]","2022-07-05"
"2207.00786","Elena Yarovaya","Yuliana Linke, Igor Borisov, Pavel Ruzankin, Vladimir Kutsenko, Elena
  Yarovaya, and Svetlana Shalnova","Universal local linear kernel estimators in nonparametric regression","30 pages, 8 figures",,,,"math.ST math.PR stat.TH","http://arxiv.org/licenses/nonexclusive-distrib/1.0/","  New local linear estimators are proposed for a wide class of nonparametric
regression models. The estimators are uniformly consistent regardless of
satisfying traditional conditions of depen\-dence of design elements.
  The estimators are the solutions of a specially weighted least-squares
method. The design can be fixed or random and does not need to meet classical
regularity or independence conditions. As an application, several estimators
are constructed for the mean of dense functional data. The theoretical results
of the study are illustrated by simulations. An example of processing real
medical data from the epidemiological cross-sectional study ESSE-RF is
included. We compare the new estimators with the estimators best known for such
studies.
","[{""version"":""v1"",""created"":""Sat, 2 Jul 2022 09:53:39 GMT""}]","2022-07-05"
"2207.00787","Michael Chang","Michael Chang, Thomas L. Griffiths, Sergey Levine","Object Representations as Fixed Points: Training Iterative Refinement
  Algorithms with Implicit Differentiation","19 pages, 13 figures, Accepted to the 36th Conference on Neural
  Information Processing Systems (NeurIPS 2022)",,,,"cs.LG cs.AI cs.CV cs.NE","http://arxiv.org/licenses/nonexclusive-distrib/1.0/","  Iterative refinement -- start with a random guess, then iteratively improve
the guess -- is a useful paradigm for representation learning because it offers
a way to break symmetries among equally plausible explanations for the data.
This property enables the application of such methods to infer representations
of sets of entities, such as objects in physical scenes, structurally
resembling clustering algorithms in latent space. However, most prior works
differentiate through the unrolled refinement process, which can make
optimization challenging. We observe that such methods can be made
differentiable by means of the implicit function theorem, and develop an
implicit differentiation approach that improves the stability and tractability
of training by decoupling the forward and backward passes. This connection
enables us to apply advances in optimizing implicit layers to not only improve
the optimization of the slot attention module in SLATE, a state-of-the-art
method for learning entity representations, but do so with constant space and
time complexity in backpropagation and only one additional line of code.
","[{""version"":""v1"",""created"":""Sat, 2 Jul 2022 10:00:35 GMT""},{""version"":""v2"",""created"":""Mon, 10 Oct 2022 21:30:48 GMT""},{""version"":""v3"",""created"":""Sun, 1 Jan 2023 02:31:43 GMT""}]","2023-01-03"
"2207.00788","Weitao Zhou","Weitao Zhou, Zhong Cao, Yunkang Xu, Nanshan Deng, Xiaoyu Liu, Kun
  Jiang and Diange Yang","Long-Tail Prediction Uncertainty Aware Trajectory Planning for
  Self-driving Vehicles",,,,,"cs.AI","http://arxiv.org/licenses/nonexclusive-distrib/1.0/","  A typical trajectory planner of autonomous driving commonly relies on
predicting the future behavior of surrounding obstacles. Recently, deep
learning technology has been widely adopted to design prediction models due to
their impressive performance. However, such models may fail in the ""long-tail""
driving cases where the training data is sparse or unavailable, leading to
planner failures. To this end, this work proposes a trajectory planner to
consider the prediction model uncertainty arising from insufficient data for
safer performance. Firstly, an ensemble network structure estimates the
prediction model's uncertainty due to insufficient training data. Then a
trajectory planner is designed to consider the worst-case arising from
prediction uncertainty. The results show that the proposed method can improve
the safety of trajectory planning under the prediction uncertainty caused by
insufficient data. At the same time, with sufficient data, the framework will
not lead to overly conservative results. This technology helps to improve the
safety and reliability of autonomous vehicles under the long-tail data
distribution of the real world.
","[{""version"":""v1"",""created"":""Sat, 2 Jul 2022 10:17:31 GMT""},{""version"":""v2"",""created"":""Thu, 28 Jul 2022 04:28:23 GMT""}]","2022-07-29"
"2207.00789","Sang-Eun Lee","Sang-Eun Lee, Yoav William Windsor, Alexander Fedorov, Kristin Kliemt,
  Cornelius Krellner, Christian Sch\""u{\ss}ler-Langeheine, Niko Pontius, Martin
  Wolf, Unai Atxitia, Denis V. Vyalikh, and Laurenz Rettig","Robust magnetic order upon ultrafast excitation of an antiferromagnet","19 pages, 10 figures",,,,"cond-mat.str-el cond-mat.mtrl-sci","http://creativecommons.org/licenses/by/4.0/","  The ultrafast manipulation of magnetic order due to optical excitation is
governed by the intricate flow of energy and momentum between the electron,
lattice and spin subsystems. While various models are commonly employed to
describe these dynamics, a prominent example being the microscopic three
temperature model (M3TM), systematic, quantitative comparisons to both the
dynamics of energy flow and magnetic order are scarce. Here, we apply a M3TM to
the ultrafast magnetic order dynamics of the layered antiferromagnet
GdRh$_2$Si$_2$. The femtosecond dynamics of electronic temperature, surface
ferromagnetic order, and bulk antiferromagnetic order were explored at various
pump fluences employing time- and angle-resolved photoemission spectroscopy and
time-resolved resonant magnetic soft x-ray diffraction, respectively. After
optical excitation, both the surface ferromagnetic order and the bulk
antiferromagnetic order dynamics exhibit two-step demagnetization behaviors
with two similar timescales (<1 ps, ~10 ps), indicating a strong exchange
coupling between localized 4f and itinerant conduction electrons. Despite a
good qualitative agreement, the M3TM predicts larger demagnetization than our
experimental observation, which can be phenomenologically described by a
transient, fluence-dependent increased N\'eel temperature. Our results indicate
that effects beyond a mean-field description have to be considered for a
quantitative description of ultrafast magnetic order dynamics.
","[{""version"":""v1"",""created"":""Sat, 2 Jul 2022 10:34:44 GMT""}]","2022-07-05"
"2207.00790","Adriano Barra","Elena Agliari, Miriam Aquaro, Adriano Barra, Alberto Fachechi, Chiara
  Marullo","Pavlov Learning Machines",,,,,"cond-mat.dis-nn q-bio.NC stat.ML","http://creativecommons.org/licenses/by/4.0/","  As well known, Hebb's learning traces its origin in Pavlov's Classical
Conditioning, however, while the former has been extensively modelled in the
past decades (e.g., by Hopfield model and countless variations on theme), as
for the latter modelling has remained largely unaddressed so far; further, a
bridge between these two pillars is totally lacking. The main difficulty
towards this goal lays in the intrinsically different scales of the information
involved: Pavlov's theory is about correlations among \emph{concepts} that are
(dynamically) stored in the synaptic matrix as exemplified by the celebrated
experiment starring a dog and a ring bell; conversely, Hebb's theory is about
correlations among pairs of adjacent neurons as summarized by the famous
statement {\em neurons that fire together wire together}. In this paper we rely
on stochastic-process theory and model neural and synaptic dynamics via
Langevin equations, to prove that -- as long as we keep neurons' and synapses'
timescales largely split -- Pavlov mechanism spontaneously takes place and
ultimately gives rise to synaptic weights that recover the Hebbian kernel.
","[{""version"":""v1"",""created"":""Sat, 2 Jul 2022 10:43:41 GMT""}]","2022-07-05"
"2207.00791","Carlo A. Trugenberger","A. Mironov, M. C. Diamantini, C. A. Trugenberger and V. M. Vinokur","Relaxation electrodynamics of superinsulators",,"Scientific Reports 12:19918 (2022)",,,"cond-mat.supr-con cond-mat.mtrl-sci cond-mat.str-el","http://arxiv.org/licenses/nonexclusive-distrib/1.0/","  Superinsulators offer a unique laboratory realizing strong interaction
phenomena like confinement and asymptotic freedom in quantum materials. Recent
experiments evidenced that superinsulators are the mirror-twins of
superconductors with reversed electric and magnetic field effects. Cooper pairs
and Cooper holes in the superinsulator are confined into neutral electric pions
by electric strings, with the Cooper pairs playing the role of quarks. Here we
report the non-equilibrium relaxation of the electric pions in superinsulating
films. We find that the time delay $t_{\mathrm{sh}}$ of the current passage in
the superinsulator is related to the applied voltage $V$ via the power law,
$t_{\mathrm{sh}}\propto (V-V_{\mathrm p})^{-\mu}$, where $V_{\mathrm p}$ is the
effective threshold voltage. Two distinct critical exponents, $\mu=1/2$ and
$\mu=3/4$, correspond to jumps from the electric Meissner state to the mixed
state and to the superinsulating resistive state with broken charge
confinement, respectively. The $\mu=1/2$ value establishes a direct
experimental evidence for the electric strings' linear potential confining the
charges of opposite signs in the electric Meissner state and effectively rules
out disorder-induced localization as a mechanism for superinsulation. We
further report the memory effects and their corresponding dynamic critical
exponents arising upon the sudden reversal of the applied voltage. Our
observations open routes for exploring fundamental strong interaction charge
confinement via desktop experiments.
","[{""version"":""v1"",""created"":""Sat, 2 Jul 2022 10:44:47 GMT""},{""version"":""v2"",""created"":""Sat, 19 Nov 2022 18:35:44 GMT""}]","2022-11-22"
"2207.00792","Chenyu Wu","Chenyu Wu, Changsheng You, Yuanwei Liu, Shuo Shi, Marco Di Renzo","Two-Timescale Design for STAR-RIS Aided NOMA Systems","30 pages, 10 figures",,,,"cs.IT eess.SP math.IT","http://arxiv.org/licenses/nonexclusive-distrib/1.0/","  Simultaneously transmitting and reflecting reconfigurable intelligent
surfaces (STAR-RISs) have emerged as a promising technology for achieving
full-space coverage. Prior works on STAR-RISs mostly assumed the full and
instantaneous channel state information (CSI) is available, which, however, is
practically difficult to obtain due to the large number of elements. To address
it, we investigate STAR-RIS aided NOMA systems, where two efficient
two-timescale transmission protocols are proposed for different channel setups
to maximize the average sum-rate. Specifically, 1) for line-of-sight (LoS)
dominant channels, we propose the beamforming-then-estimate (BTE) Protocol,
where the long-term STAR-RIS coefficients are optimized based on the
statistical CSI, while the short-term power allocation at the base station (BS)
is designed based on the effective channels; 2) for the rich scattering
environment, we propose an alternative partition-then-estimate (PTE) Protocol,
where the BS determines the long-term STAR-RIS surface-partition strategy; then
the BS estimates the instantaneous subsurface channels and designs its power
allocation and STAR-RIS phase-shifts accordingly. Simulation results validate
the superiority of our proposed transmission protocols as compared to various
benchmarks. It is shown that the BTE Protocol outperforms the PTE Protocol when
the number of STAR-RIS elements is large and/or the LoS channel components are
dominant, and vice versa.
","[{""version"":""v1"",""created"":""Sat, 2 Jul 2022 10:45:06 GMT""}]","2022-07-05"
"2207.00793","Malte Krack","Carlo Monjaraz-Tec, Lukas Kohlmann, Stefan Schwarz, Andreas Hartung,
  Johann Gross, Malte Krack","Prediction and validation of the strongly modulated forced response of
  two beams undergoing frictional impacts",,,"10.1016/j.ymssp.2022.109410",,"eess.SY cs.SY","http://creativecommons.org/licenses/by-nc-sa/4.0/","  We consider two cantilevered beams undergoing frictional impacts at the free
end. The beams are designed to be of similar geometry so that they have
distinct but close natural frequencies. Under harmonic base excitation near the
primary resonance with the higher-frequency fundamental bending mode, the
system shows a strongly modulated non-periodic response. The purpose of this
work is to analyze to what extent the non-periodic vibro-impact dynamics can be
predicted. To this end, we use a recently developed modeling and simulation
approach. The approach relies on component mode synthesis, the massless
boundary concept and an appropriate time stepping scheme. Unilateral contact
and dry friction are modeled as set-valued laws and imposed locally within the
spatially resolved contact area. A linear model updating is carried out based
on the natural frequencies and damping ratios identified in the regime without
impacts. The nonlinear simulation of the steady-state response to forward and
backward stepped sine excitation is compared against measurements. The results
are in very good agreement, especially in the light of the uncertainty
associated with the observed material loss in the contact region and the
nonlinear behavior of the clamping.
","[{""version"":""v1"",""created"":""Sat, 2 Jul 2022 10:46:07 GMT""}]","2022-07-05"
