"2207.00703","Bin Chen","Bin Chen, Nan Li and Siwei Liu","K\""ahler Finsler manifolds with curvatures bounded from below",,,,,"math.DG","http://arxiv.org/licenses/nonexclusive-distrib/1.0/","  We obtain a partial parallelism of the complex structure on K\""ahler Finsler
manifolds. As applications, we prove Synge-Tsukamoto theorem and Bonnet-Myers
theorem for positively curved K\""ahler Finsler manifolds. Moreover, we
generalize a comparison theorem due to Ni-Zheng by introducing the notion of
orthogonal Ricci curvature to K\""ahler Finsler geometry.
","[{""version"":""v1"",""created"":""Sat, 2 Jul 2022 00:49:27 GMT""},{""version"":""v2"",""created"":""Sat, 24 Dec 2022 04:52:22 GMT""}]","2022-12-27"
"2207.00704","Yi Shi","Andrey Gogolev, Yi Shi","Joint integrability and spectral rigidity for Anosov diffeomorphisms",,,,,"math.DS math.GT","http://arxiv.org/licenses/nonexclusive-distrib/1.0/","  Let $f\colon\mathbb{T}^d\to\mathbb{T}^d$ be an Anosov diffeomorphism whose
linearization $A\in{\rm GL}(d,\mathbb{Z})$ is irreducible. Assume that $f$ is
also absolutely partially hyperbolic where a weak stable subbundle is
considered as the center subbundle. We show that if the strong stable and
unstable subbundles are jointly integrable, then $f$ is dynamically coherent
and all foliations match corresponding linear foliation under the conjugacy to
the linearization $A$. Moreover, $f$ admits the finest dominated splitting in
weak stable subbundle with dimensions matching those for $A$, and it has
spectral rigidity along all these subbundles.
  In dimension 4 we are also able to obtain a similar result which allows to
group the weak stable and unstable subbundles into a center subbundle and
assumes joint integrability of strong stable and unstable subbundles. As an
application, we show that for every symplectic diffeomorphism $f\in{\rm
Diff}^2_{\omega}(\mathbb{T}^4)$ which is $C^1$-close to an irreducible
non-conformal automorphism $A\in{\rm Sp}(4,\mathbb{Z})$, the extremal
subbundles of $f$ are jointly integrable if and only if $f$ is smoothly
conjugate to $A$.
","[{""version"":""v1"",""created"":""Sat, 2 Jul 2022 00:52:52 GMT""}]","2022-07-05"
"2207.00705","Feng Xue","Feng Xue, Weizhong Yan","Multivariate Time Series Anomaly Detection with Few Positive Samples","Accepted by the 2022 International Joint Conference on Neural
  Networks (IJCNN 2022). arXiv admin note: text overlap with arXiv:2205.02100",,,,"cs.LG cs.AI cs.NE","http://arxiv.org/licenses/nonexclusive-distrib/1.0/","  Given the scarcity of anomalies in real-world applications, the majority of
literature has been focusing on modeling normality. The learned representations
enable anomaly detection as the normality model is trained to capture certain
key underlying data regularities under normal circumstances. In practical
settings, particularly industrial time series anomaly detection, we often
encounter situations where a large amount of normal operation data is available
along with a small number of anomaly events collected over time. This practical
situation calls for methodologies to leverage these small number of anomaly
events to create a better anomaly detector. In this paper, we introduce two
methodologies to address the needs of this practical situation and compared
them with recently developed state of the art techniques. Our proposed methods
anchor on representative learning of normal operation with autoregressive (AR)
model along with loss components to encourage representations that separate
normal versus few positive examples. We applied the proposed methods to two
industrial anomaly detection datasets and demonstrated effective performance in
comparison with approaches from literature. Our study also points out
additional challenges with adopting such methods in practical applications.
","[{""version"":""v1"",""created"":""Sat, 2 Jul 2022 00:58:52 GMT""}]","2022-07-05"
"2207.00706","Theresa Breiner","Theresa Breiner, Swaroop Ramaswamy, Ehsan Variani, Shefali Garg, Rajiv
  Mathews, Khe Chai Sim, Kilol Gupta, Mingqing Chen, Lara McConnaughey","UserLibri: A Dataset for ASR Personalization Using Only Text","Accepted for publication in Interspeech 2022. 9 total pages with
  appendix, 9 total tables, 5 total figures",,,,"eess.AS cs.CL cs.LG","http://creativecommons.org/licenses/by/4.0/","  Personalization of speech models on mobile devices (on-device
personalization) is an active area of research, but more often than not, mobile
devices have more text-only data than paired audio-text data. We explore
training a personalized language model on text-only data, used during inference
to improve speech recognition performance for that user. We experiment on a
user-clustered LibriSpeech corpus, supplemented with personalized text-only
data for each user from Project Gutenberg. We release this User-Specific
LibriSpeech (UserLibri) dataset to aid future personalization research.
LibriSpeech audio-transcript pairs are grouped into 55 users from the
test-clean dataset and 52 users from test-other. We are able to lower the
average word error rate per user across both sets in streaming and nonstreaming
models, including an improvement of 2.5 for the harder set of test-other users
when streaming.
","[{""version"":""v1"",""created"":""Sat, 2 Jul 2022 01:03:01 GMT""}]","2022-07-05"
"2207.00707","David Stoutemyer","David R. Stoutemyer","Inverse spherical Bessel functions generalize Lambert W and solve
  similar equations containing trigonometric or hyperbolic subexpressions or
  their inverses","29 pages, 13 figures, 6 tables",,,,"math.GM","http://creativecommons.org/licenses/by/4.0/","  A strict integer Laurent polynomial in a variable $x$ is 0 or a sum of one or
more terms having integer coefficients times $x$ raised to a negative integer
exponent. Equations that can be transformed to certain such polynomials times
$\exp(-x)=\mathit{constant}$ are exactly solvable by inverses of modified
spherical Bessel functions of the second kind $k_{n}(x)$ where $n$ is the
order, generalizing the Lambert $W$ function when $n>0.$ Equations that can be
converted to certain such polynomials times $\cos(x)$ or such polynomials times
$\sin(x)$ or a sum thereof $=\mathit{constant}$ are exactly solvable by
inverses of spherical Bessel functions $y_{n}(x)$ or $j_{n}(x)$. Such equations
include $\cos(x)/x=\mathit{constant}$, for which the solution
$\mathrm{inverse}_{1}(y_{0})(\mathit{-constant})$ is Dottie's number when
$\mathit{constant}=1$, where subscript 1 is the branch number. Equations that
can be converted to certain strict integer Laurent polynomials times $\sinh(x)$
and possibly also plus such a polynomial times $\cosh(x)$ are exactly solvable
by inverses of modified spherical Bessel functions of the first kind
$i_{n}(x)$.
  These discoveries arose from the AskConstants program surprisingly proposing
the explicit exact closed form $\mathrm{inverse}_{1}(y_{0})(-1)$ for the
approximate input 0.739085133215160642, because no explicit exact closed form
representation was known for Dottie's number from approximately 1865 to 2022.
This article includes descriptions of how to implement these spherical Bessel
functions and their multi-branched real inverses.
","[{""version"":""v1"",""created"":""Sat, 2 Jul 2022 01:09:01 GMT""},{""version"":""v2"",""created"":""Thu, 28 Jul 2022 17:38:28 GMT""},{""version"":""v3"",""created"":""Thu, 1 Sep 2022 00:01:27 GMT""},{""version"":""v4"",""created"":""Fri, 2 Sep 2022 19:21:51 GMT""}]","2022-09-07"
"2207.00708","Ziwen Han","Ziwen Han, Evgeniya Gorobets, Pan Chen","Parameter efficient dendritic-tree neurons outperform perceptrons",,,,,"cs.NE cs.LG","http://creativecommons.org/licenses/by/4.0/","  Biological neurons are more powerful than artificial perceptrons, in part due
to complex dendritic input computations. Inspired to empower the perceptron
with biologically inspired features, we explore the effect of adding and tuning
input branching factors along with input dropout. This allows for parameter
efficient non-linear input architectures to be discovered and benchmarked.
Furthermore, we present a PyTorch module to replace multi-layer perceptron
layers in existing architectures. Our initial experiments on MNIST
classification demonstrate the accuracy and generalization improvement of
dendritic neurons compared to existing perceptron architectures.
","[{""version"":""v1"",""created"":""Sat, 2 Jul 2022 01:22:39 GMT""}]","2022-07-05"
"2207.00709","Mar\'ia Fernanda S\'anchez Puig","Fernanda S\'anchez-Puig, Rogelio Lozano-Aranda, Dante
  P\'erez-M\'endez, Ewan Colman, Alfredo J. Morales-Guzm\'an, Carlos Pineda,
  Pedro Juan Rivera Torres and Carlos Gershenson","Language statistics at different spatial, temporal, and grammatical
  scales",,,,,"cs.CL physics.soc-ph","http://arxiv.org/licenses/nonexclusive-distrib/1.0/","  Statistical linguistics has advanced considerably in recent decades as data
has become available. This has allowed researchers to study how statistical
properties of languages change over time. In this work, we use data from
Twitter to explore English and Spanish considering the rank diversity at
different scales: temporal (from 3 to 96 hour intervals), spatial (from 3km to
3000+km radii), and grammatical (from monograms to pentagrams). We find that
all three scales are relevant. However, the greatest changes come from
variations in the grammatical scale. At the lowest grammatical scale
(monograms), the rank diversity curves are most similar, independently on the
values of other scales, languages, and countries. As the grammatical scale
grows, the rank diversity curves vary more depending on the temporal and
spatial scales, as well as on the language and country. We also study the
statistics of Twitter-specific tokens: emojis, hashtags, and user mentions.
These particular type of tokens show a sigmoid kind of behaviour as a rank
diversity function. Our results are helpful to quantify aspects of language
statistics that seem universal and what may lead to variations.
","[{""version"":""v1"",""created"":""Sat, 2 Jul 2022 01:38:48 GMT""},{""version"":""v2"",""created"":""Tue, 26 Jul 2022 15:30:15 GMT""}]","2022-07-27"
"2207.00710","Michael Chavrimootoo","Benjamin Carleton, Michael C. Chavrimootoo, Lane A. Hemaspaandra,
  David E. Narv\'aez, Conor Taliancich, Henry B. Welles","Separating and Collapsing Electoral Control Types","The arXiv.org metadata abstract is an abridged version; please see
  the paper for the full abstract",,,,"cs.MA cs.GT","http://arxiv.org/licenses/nonexclusive-distrib/1.0/","  [HHM20] discovered, for 7 pairs (C,D) of seemingly distinct standard
electoral control types, that C and D are identical: For each input I and each
election system, I is a Yes instance of both C and D, or of neither.
Surprisingly this had gone undetected, even as the field was score-carding how
many std. control types election systems were resistant to; various ""different""
cells on such score cards were, unknowingly, duplicate effort on the same
issue. This naturally raises the worry that other pairs of control types are
also identical, and so work still is being needlessly duplicated.
  We determine, for all std. control types, which pairs are, for elections
whose votes are linear orderings of the candidates, always identical. We show
that no identical control pairs exist beyond the known 7. We for 3 central
election systems determine which control pairs are identical (""collapse"") with
respect to those systems, and we explore containment/incomparability
relationships between control pairs. For approval voting, which has a different
""type"" for its votes, [HHM20]'s 7 collapses still hold. But we find 14
additional collapses that hold for approval voting but not for some election
systems whose votes are linear orderings. We find 1 additional collapse for
veto and none for plurality. We prove that each of the 3 election systems
mentioned have no collapses other than those inherited from [HHM20] or added
here. But we show many new containment relationships that hold between some
separating control pairs, and for each separating pair of std. control types
classify its separation in terms of containment (always, and strict on some
inputs) or incomparability.
  Our work, for the general case and these 3 important election systems,
clarifies the landscape of the 44 std. control types, for each pair collapsing
or separating them, and also providing finer-grained information on the
separations.
","[{""version"":""v1"",""created"":""Sat, 2 Jul 2022 01:46:23 GMT""},{""version"":""v2"",""created"":""Mon, 15 Aug 2022 12:46:40 GMT""},{""version"":""v3"",""created"":""Mon, 24 Oct 2022 22:54:14 GMT""},{""version"":""v4"",""created"":""Mon, 27 Feb 2023 18:45:19 GMT""}]","2023-02-28"
"2207.00711","Adriana Briozzo","Targyn A. Nauryz and Adriana C. Briozzo","Two-phase Stefan problem for generalized heat equation with nonlinear
  thermal coefficients",,,,,"math.AP math-ph math.MP","http://creativecommons.org/licenses/by/4.0/","  In this article we study a mathematical model of the heat transfer in semi
infinite material with a variable cross section, when the radial component of
the temperature gradient can be neglected in comparison with the axial
component is considered. In particular, the temperature distribution in liquid
and solid phases of such kind of body can be modelled by Stefan problem for the
generalized heat equation. The method of solution is based on similarity
principle, which enables us to reduce generalized heat equation to nonlinear
ordinary differential equation. Moreover, we determine temperature solution for
two phases and free boundaries which describe the position of boiling and
melting interfaces. Existence and uniqueness of the solution is provided by
using the fixed point Banach theorem.
","[{""version"":""v1"",""created"":""Sat, 2 Jul 2022 01:58:48 GMT""}]","2022-07-05"
"2207.00712","Yang Zhao","Yang Zhao and Yan Song","Turning to a Teacher for Timestamp Supervised Temporal Action
  Segmentation","6 pages, ICME 2022 oral",,"10.1109/ICME52920.2022.9859626",,"cs.CV","http://creativecommons.org/licenses/by-nc-sa/4.0/","  Temporal action segmentation in videos has drawn much attention recently.
Timestamp supervision is a cost-effective way for this task. To obtain more
information to optimize the model, the existing method generated pseudo
frame-wise labels iteratively based on the output of a segmentation model and
the timestamp annotations. However, this practice may introduce noise and
oscillation during the training, and lead to performance degeneration. To
address this problem, we propose a new framework for timestamp supervised
temporal action segmentation by introducing a teacher model parallel to the
segmentation model to help stabilize the process of model optimization. The
teacher model can be seen as an ensemble of the segmentation model, which helps
to suppress the noise and to improve the stability of pseudo labels. We further
introduce a segmentally smoothing loss, which is more focused and cohesive, to
enforce the smooth transition of the predicted probabilities within action
instances. The experiments on three datasets show that our method outperforms
the state-of-the-art method and performs comparably against the
fully-supervised methods at a much lower annotation cost.
","[{""version"":""v1"",""created"":""Sat, 2 Jul 2022 02:00:55 GMT""}]","2022-12-14"
"2207.00713","Yanwei Jia","Yanwei Jia and Xun Yu Zhou","q-Learning in Continuous Time","64 pages, 4 figures",,,,"cs.LG cs.AI q-fin.CP","http://creativecommons.org/licenses/by/4.0/","  We study the continuous-time counterpart of Q-learning for reinforcement
learning (RL) under the entropy-regularized, exploratory diffusion process
formulation introduced by Wang et al. (2020). As the conventional (big)
Q-function collapses in continuous time, we consider its first-order
approximation and coin the term ``(little) q-function"". This function is
related to the instantaneous advantage rate function as well as the
Hamiltonian. We develop a ``q-learning"" theory around the q-function that is
independent of time discretization. Given a stochastic policy, we jointly
characterize the associated q-function and value function by martingale
conditions of certain stochastic processes, in both on-policy and off-policy
settings. We then apply the theory to devise different actor-critic algorithms
for solving underlying RL problems, depending on whether or not the density
function of the Gibbs measure generated from the q-function can be computed
explicitly. One of our algorithms interprets the well-known Q-learning
algorithm SARSA, and another recovers a policy gradient (PG) based
continuous-time algorithm proposed in Jia and Zhou (2022b). Finally, we conduct
simulation experiments to compare the performance of our algorithms with those
of PG-based algorithms in Jia and Zhou (2022b) and time-discretized
conventional Q-learning algorithms.
","[{""version"":""v1"",""created"":""Sat, 2 Jul 2022 02:20:41 GMT""},{""version"":""v2"",""created"":""Tue, 18 Apr 2023 15:03:47 GMT""},{""version"":""v3"",""created"":""Mon, 24 Apr 2023 00:18:09 GMT""}]","2023-04-25"
"2207.00714","Yuan-Ze Yang","Yuan-Ze Yang, Tian-Xiang Zhu, Zhi-Peng Li, Xiao-Dong Zeng, Nai-Jie
  Guo, Shang Yu, Yu Meng, Zhao-An Wang, Lin-Ke Xie, Zong-Quan Zhou, Qiang Li,
  Jin-Shi Xu, Xiao-Ying Gao, Wei Liu, Yi-Tao Wang, Jian-Shun Tang, Chuan-Feng
  Li, Guang-Can Guo","Laser Direct Writing of Visible Spin Defects in Hexagonal Boron Nitride
  for Applications in Spin-Based Technologies",,,,,"physics.optics cond-mat.mes-hall","http://arxiv.org/licenses/nonexclusive-distrib/1.0/","  Optically addressable spins in two-dimensional hexagonal boron nitride (hBN)
attract widespread attention for their potential advantage in on-chip quantum
devices, such as quantum sensors and quantum network. A variety of spin defects
have been found in hBN, but no convenient and deterministic generation methods
have been reported for other defects except negatively charged boron vacancy
($V_B^-$). Here we report that by using femtosecond laser direct writing
technology, we can deterministically create spin defect ensembles with spectra
range from 550 nm to 800 nm on nanoscale hBN flakes. Positive single-peak
optically detected magnetic resonance (ODMR) signals are detected in the
presence of magnetic field perpendicular to the substrate, and the contrast can
reach 0.8%. With the appropriate thickness of hBN flakes, substrate and
femtosecond laser pulse energy, we can deterministically and efficiently
generate bright spin defect array. Our results provide a convenient
deterministic method to create spin defects in hBN, which will motivate more
endeavors for future researches and applications of spin-based technologies
such as quantum magnetometer array.
","[{""version"":""v1"",""created"":""Sat, 2 Jul 2022 02:25:11 GMT""},{""version"":""v2"",""created"":""Sat, 11 Mar 2023 10:00:44 GMT""}]","2023-03-14"
"2207.00715","Suresh Narayanarao","Suresh N, Pooja M","A study on Determinants of Dividend Policy and its Impact on Financial
  Performances: A Panel Data Analysis for Indian Listed Firms",,"Journal of Seybold Report, 2020 15 2791 2799",,,"q-fin.GN","http://creativecommons.org/licenses/by/4.0/","  Determination of the correct mix of dividend and retained earnings and its
effect on profitability has been a subject of controversy in financial
management literature. This paper seeks to contribute to the ongoing debate by
examining the relationship between dividend payout policy and the financial
performance of 60 firms listed on the National Stock Exchange between
2009-2018. The Return on Assets (ROA) served as a surrogate for the dependent
variable, profitability, while the Dividend Pay-out ratio proxied for dividend
policy and was the only explanatory variable. Control variables include firm
size, asset tangibility, and leverage. Regression result reveals a positive and
significant relationship between dividend payout policy (DPO) and firm
performance (ROA). It is recommended that companies should endeavor to put in
place a robust dividend payout policy that would encourage investment in
projects that give positive Net Present Value.
","[{""version"":""v1"",""created"":""Sat, 2 Jul 2022 02:26:13 GMT""}]","2022-07-18"
"2207.00716","Suresh Narayanarao","Nandini E.S, Sudharani R, Suresh N","A Study on Impact of Environmental Accounting on Profitability of
  Companies listed in Bombay Stock Exchange",,"Bulletin Monumental 21 2020 46 51","10.37896/BMJ21.08/2905",,"q-fin.GN","http://creativecommons.org/licenses/by/4.0/","  The study focuses on the Impact of Environmental Accounting on the
Profitability of Companies listed on the Bombay Stock Exchange. The study has
considered the Amount spent on Environmental protection as an Independent
variable and Return on Capital Employed, Return on Assets, Return on Net
worth/equity, Net Profit Margin, and Dividend per Share as the Dependent
variable. The present study is to analyses the relationship between Amounts
spent on Environmental protection costs and Return on Capital Employed, Return
on Assets, Return on Net worth/equity, Net Profit Margin, and Dividend per
Share. The data is collected from 18 companies listed on the Bombay Stock
Exchange for 10 years from the Annual reports of companies. The data collected
were analysed using Panel data Regression in E-Views. Results revealed that
there is a significant Relationship between Environmental protection Cost and
Return on Capital Employed, Return on Assets, Return on Net worth/equity, Net
Profit Margin, and Dividend per Share. The study shows that Environmental
accounting impact positively on Firms profitability.
","[{""version"":""v1"",""created"":""Sat, 2 Jul 2022 02:38:43 GMT""}]","2022-07-12"
"2207.00717","Stephen Melczer","Yuliy Baryshnikov, Stephen Melczer, Robin Pemantle","Asymptotics of multivariate sequences IV: generating functions with
  poles on a hyperplane arrangement",,,,,"math.CO cs.SC","http://arxiv.org/licenses/nonexclusive-distrib/1.0/","  Let F be the quotient of an analytic function with a product of linear
functions. Working in the framework of analytic combinatorics in several
variables, we compute asymptotic formulae for the Taylor coefficients of F
using multivariate residues and saddle-point approximations. Because the
singular set of F is the union of hyperplanes, we are able to make explicit the
topological decompositions which arise in the multivariate singularity
analysis. In addition to effective and explicit asymptotic results, we provide
the first results on transitions between different asymptotic regimes, and
provide the first software package to verify and compute asymptotics in
non-smooth cases of analytic combinatorics in several variables. It is also our
hope that this paper will serve as an entry to the more advanced corners of
analytic combinatorics in several variables for combinatorialists.
","[{""version"":""v1"",""created"":""Sat, 2 Jul 2022 02:39:21 GMT""},{""version"":""v2"",""created"":""Sat, 23 Jul 2022 21:12:53 GMT""}]","2022-07-26"
"2207.00718","Guangliang Gao","Guangliang Gao, Weichao Liang, Ming Yuan, Hanwei Qian, Qun Wang, Jie
  Cao","Triangle-oriented Community Detection considering Node Features and
  Network Topology",,,,,"cs.SI","http://arxiv.org/licenses/nonexclusive-distrib/1.0/","  The joint use of node features and network topology to detect communities is
called community detection in attributed networks. Most of the existing work
along this line has been carried out through objective function optimization
and has proposed numerous approaches. However, they tend to focus only on
lower-order details, i.e., capture node features and network topology from node
and edge views, and purely seek a higher degree of optimization to guarantee
the quality of the found communities, which exacerbates unbalanced communities
and free-rider effect. To further clarify and reveal the intrinsic nature of
networks, we conduct triangle-oriented community detection considering node
features and network topology. Specifically, we first introduce a
triangle-based quality metric to preserve higher-order details of node features
and network topology, and then formulate so-called two-level constraints to
encode lower-order details of node features and network topology. Finally, we
develop a local search framework based on optimizing our objective function
consisting of the proposed quality metric and two-level constraints to achieve
both non-overlapping and overlapping community detection in attributed
networks. Extensive experiments demonstrate the effectiveness and efficiency of
our framework and its potential in alleviating unbalanced communities and
free-rider effect.
","[{""version"":""v1"",""created"":""Sat, 2 Jul 2022 02:42:02 GMT""},{""version"":""v2"",""created"":""Mon, 11 Jul 2022 07:59:43 GMT""}]","2022-07-12"
