"2207.00613","Michael Anshelevich","Michael Anshelevich, Austin Pritchett","Product of exponentials concentrates around the exponential of the sum","This is an expanded version of the article. It contains 7 additional
  figures",,,,"math.CO math.PR math.RA","http://creativecommons.org/licenses/by/4.0/","  For two matrices $A$ and $B$, and large $n$, we show that most products of
$n$ factors of $e^{A/n}$ and $n$ factors of $e^{B/n}$ are close to $e^{A + B}$.
This extends the Lie-Trotter formula. The elementary proof is based on the
relation between words and lattice paths, asymptotics of binomial coefficients,
and matrix inequalities. The result holds for more than two matrices.
","[{""version"":""v1"",""created"":""Fri, 1 Jul 2022 18:16:37 GMT""},{""version"":""v2"",""created"":""Mon, 18 Jul 2022 14:18:10 GMT""}]","2022-07-19"
"2207.00614","Ron Amit","Ron Amit, Baruch Epstein, Shay Moran, Ron Meir","Integral Probability Metrics PAC-Bayes Bounds","Accepted to NeurIPS 2022",,,,"stat.ML cs.LG","http://arxiv.org/licenses/nonexclusive-distrib/1.0/","  We present a PAC-Bayes-style generalization bound which enables the
replacement of the KL-divergence with a variety of Integral Probability Metrics
(IPM). We provide instances of this bound with the IPM being the total
variation metric and the Wasserstein distance. A notable feature of the
obtained bounds is that they naturally interpolate between classical uniform
convergence bounds in the worst case (when the prior and posterior are far away
from each other), and improved bounds in favorable cases (when the posterior
and prior are close). This illustrates the possibility of reinforcing classical
generalization bounds with algorithm- and data-dependent components, thus
making them more suitable to analyze algorithms that use a large hypothesis
space.
","[{""version"":""v1"",""created"":""Fri, 1 Jul 2022 18:22:44 GMT""},{""version"":""v2"",""created"":""Wed, 6 Jul 2022 11:04:20 GMT""},{""version"":""v3"",""created"":""Tue, 2 Aug 2022 18:26:31 GMT""},{""version"":""v4"",""created"":""Wed, 5 Oct 2022 13:38:53 GMT""},{""version"":""v5"",""created"":""Sat, 8 Oct 2022 23:02:35 GMT""},{""version"":""v6"",""created"":""Sun, 23 Oct 2022 06:51:37 GMT""},{""version"":""v7"",""created"":""Tue, 22 Nov 2022 17:05:33 GMT""},{""version"":""v8"",""created"":""Sun, 25 Dec 2022 11:24:45 GMT""}]","2023-01-02"
"2207.00615","Binbin Yang","Binbin Yang","Synthesis of General Decoupling Networks Using Transmission Lines","4 pages",,,,"eess.SY cs.SY","http://arxiv.org/licenses/nonexclusive-distrib/1.0/","  In this paper, we introduce a synthesis technique for transmission line based
decoupling networks, which find application in coupled systems such as
multiple-antenna systems and antenna arrays. Employing the generalized
$\pi$-network and the transmission line analysis technique, we reduce the
decoupling network design into simple matrix calculations. The synthesized
decoupling network is essentially a generalized $\pi$-network with transmission
lines at all branches. The advantage of this proposed decoupling network is
that it can be implemented using transmission lines, ensuring better control on
loss, performance consistency and higher power handling capability, when
compared with lumped components, and can be easily scaled for operation at
different frequencies.
","[{""version"":""v1"",""created"":""Fri, 1 Jul 2022 18:23:56 GMT""}]","2022-07-05"
"2207.00616","Paul Herringer","Paul Herringer, Robert Raussendorf","Classification of measurement-based quantum wire in stabilizer PEPS","15 pages, 7 figures",,,,"quant-ph","http://creativecommons.org/licenses/by/4.0/","  We consider a class of translation-invariant 2D tensor network states with a
stabilizer symmetry, which we call stabilizer PEPS. The cluster state, GHZ
state, and states in the toric code belong to this class. We investigate the
transmission capacity of stabilizer PEPS for measurement-based quantum wire,
and arrive at a complete classification of transmission behaviors. The
transmission behaviors fall into 13 classes, one of which corresponds to
Clifford quantum cellular automata. In addition, we identify 12 other classes.
","[{""version"":""v1"",""created"":""Fri, 1 Jul 2022 18:27:57 GMT""},{""version"":""v2"",""created"":""Tue, 26 Jul 2022 16:49:55 GMT""},{""version"":""v3"",""created"":""Mon, 15 May 2023 21:20:11 GMT""}]","2023-05-17"
"2207.00617","Stefano Trivini","Stefano Trivini, Jon Ortuzar, Katerina Vaxevani, Jingchen Li, F.
  Sebastian Bergeret, Miguel A. Cazalilla, Jose Ignacio Pascual","Pair excitations of a quantum spin on a proximitized superconductor","14 pages, 11 figures","Phys. Rev. Lett. 130 (2023) 136004","10.1103/PhysRevLett.130.136004",,"cond-mat.mes-hall cond-mat.supr-con","http://creativecommons.org/licenses/by/4.0/","  A magnetic impurity interacting with a superconductor develops a rich
excitation spectrum formed by superposition of quasiparticles and spin states,
which appear as Yu-Shiba-Rusinov and spin-flip excitations in tunneling
spectra. Here, we show that tunneling electrons can also excite a
superconducting pair-breaking transition in the presence of magnetic
impurities, which is hidden for electrons on bare superconductors. Combining
scanning tunneling spectroscopy with theoretical modeling, we map the
excitation spectrum of a Fe-porphyrin molecule on the Au/V(100) proximitized
surface into a manifold of many-body excitations and follow their behavior
across a parity-changing transition. Pair excitations emerge in the tunneling
spectra as peaks outside the gap in the strong interaction regime, scaling with
the pair correlation. Our results unravel the quantum nature of magnetic
impurities on superconductors and prove that pair excitations are parity
detectors for magnetic impurities.
","[{""version"":""v1"",""created"":""Fri, 1 Jul 2022 18:31:39 GMT""}]","2023-05-16"
"2207.00618","Anthony Almudevar","Anthony Almudevar","A Stochastic Contraction Mapping Theorem","27 pages, one figure",,,,"math.PR math.ST stat.TH","http://creativecommons.org/licenses/by-nc-nd/4.0/","  In this paper we define contractive and nonexpansive properties for adapted
stochastic processes $X_1, X_2, \ldots $ which can be used to deduce limiting
properties. In general, nonexpansive processes possess finite limits while
contractive processes converge to zero $a.e.$ Extensions to multivariate
processes are given. These properties may be used to model a number of
important processes, including stochastic approximation and least-squares
estimation of controlled linear models, with convergence properties derivable
from a single theory. The approach has the advantage of not in general
requiring analytical regularity properties such as continuity and
differentiability.
","[{""version"":""v1"",""created"":""Fri, 1 Jul 2022 18:37:47 GMT""}]","2022-07-05"
"2207.00619","Corey Bregman","Rachael Boyd, Corey Bregman","Embedding spaces of split links","38 pages, 6 figures; comments welcome",,,,"math.GT math.AT math.GR","http://arxiv.org/licenses/nonexclusive-distrib/1.0/","  We study the homotopy type of the space $\mathcal{E}(L)$ of unparametrised
embeddings of a split link $L=L_1\sqcup \ldots \sqcup L_n$ in $\mathbb{R}^3$.
Inspired by work of Brendle and Hatcher, we introduce a semi-simplicial space
of separating systems and show that this is homotopy equivalent to
$\mathcal{E}(L)$. This combinatorial object provides a gateway to studying the
homotopy type of $\mathcal{E}(L)$ via the homotopy type of the spaces
$\mathcal{E}(L_i)$. We apply this tool to find a simple description of the
fundamental group, or motion group, of $\mathcal{E}(L)$, and extend this to a
description of the motion group of embeddings in $S^3$.
","[{""version"":""v1"",""created"":""Fri, 1 Jul 2022 18:45:08 GMT""}]","2022-07-05"
"2207.00621","Madeline Wade","Madeline Wade, Aaron D. Viets, Theresa Chmiel, Madeline Stover, Leslie
  Wade","Improving LIGO calibration accuracy by using time-dependent filters to
  compensate for temporal variations","17 pages, 13 figures, 3 tables","Class. Quantum Grav. 40 035001 (2023)","10.1088/1361-6382/acabf6",,"astro-ph.IM gr-qc","http://creativecommons.org/licenses/by/4.0/","  The response of the Advanced LIGO interferometers is known to vary with time
[arXiv:1608.05134]. Accurate calibration of the interferometers must therefore
track and compensate for temporal variations in calibration model parameters.
These variations were tracked during the first three Advanced LIGO observing
runs, and compensation for some of them has been implemented in the calibration
procedure. During the second observing run, multiplicative corrections to the
interferometer response were applied while producing calibrated strain data
both in real-time and in high-latency. In a high-latency calibration produced
after the second observing run and during the entirety of the third observing
run, a correction involving updating filters was applied to the calibration --
the time dependence of the coupled cavity pole frequency $f_{\rm cc}$. This
paper describes the methods developed to compensate for variations in the
interferometer response requiring time-dependent filters, including variable
zeros, poles, gains, and time delays. The described methods were used to
provide compensation for well-modeled time dependence of the interferometer
response, which has helped to reduce systematic errors in the calibration to
$<2$% in magnitude and $<2^{\circ}$ in phase across LIGO's most sensitive
frequency band of 20 - 2000 Hz [arXiv:2005.02531, arXiv:2107.00129].
Additionally, this paper shows how such compensation is relevant for
astrophysical inference studies by reducing uncertainty and bias in the sky
localization for a simulated binary neutron star merger.
","[{""version"":""v1"",""created"":""Fri, 1 Jul 2022 18:46:14 GMT""},{""version"":""v2"",""created"":""Tue, 10 Jan 2023 14:38:13 GMT""}]","2023-01-11"
"2207.00623","Rima Hazra","Rima Hazra, Arpit Dwivedi, Animesh Mukherjee","Is this bug severe? A text-cum-graph based model for bug severity
  prediction","Accepted at ECML PKDD 2022, Research and ADS Track",,,,"cs.IR cs.SE","http://arxiv.org/licenses/nonexclusive-distrib/1.0/","  Repositories of large software systems have become commonplace. This massive
expansion has resulted in the emergence of various problems in these software
platforms including identification of (i) bug-prone packages, (ii) critical
bugs, and (iii) severity of bugs. One of the important goals would be to mine
these bugs and recommend them to the developers to resolve them. The first step
to this is that one has to accurately detect the extent of severity of the
bugs. In this paper, we take up this task of predicting the severity of bugs in
the near future. Contextualized neural models built on the text description of
a bug and the user comments about the bug help to achieve reasonably good
performance. Further information on how the bugs are related to each other in
terms of the ways they affect packages can be summarised in the form of a graph
and used along with the text to get additional benefits.
","[{""version"":""v1"",""created"":""Fri, 1 Jul 2022 18:48:29 GMT""}]","2022-07-05"
"2207.00624","Jerome Petri","P\'etri J\'er\^ome","Particle acceleration and radiation reaction in a strongly magnetized
  rotating dipole","accepted for publication in A&A","A&A 666, A5 (2022)","10.1051/0004-6361/202243634",,"astro-ph.HE hep-ph","http://arxiv.org/licenses/nonexclusive-distrib/1.0/","  Abridged. Neutron stars are surrounded by ultra-relativistic particles
efficiently accelerated by ultra strong electromagnetic fields. However so far,
no numerical simulations were able to handle such extreme regimes of very high
Lorentz factors and magnetic field strengths. It is the purpose of this paper
to study particle acceleration and radiation reaction damping in a rotating
magnetic dipole with realistic field strengths typical of millisecond and young
pulsars as well as of magnetars. To this end, we implemented an exact
analytical particle pusher including radiation reaction in the reduced
Landau-Lifshitz approximation where the electromagnetic field is assumed
constant in time and uniform in space during one time step integration. The
position update is performed using a velocity Verlet method. We extensively
tested our algorithm against time independent background electromagnetic fields
like the electric drift in cross electric and magnetic fields and the magnetic
drift and mirror motion in a dipole. Eventually, we apply it to realistic
neutron star environments. We investigated particle acceleration and the impact
of radiation reaction for electrons, protons and iron nuclei plunged around
millisecond pulsars, young pulsars and magnetars, comparing it to situations
without radiation reaction. We found that the maximum Lorentz factor depends on
the particle species but only weakly on the neutron star type. Electrons reach
energies up to $\gamma_e \approx 10^8-10^9$ whereas protons energies up to
$\gamma_p \approx 10^5-10^6$ and iron up to $\gamma \approx 10^4-10^5$. While
protons and irons are not affected by radiation reaction, electrons are
drastically decelerated, reducing their maximum Lorentz factor by 2 orders of
magnitude. We also found that the radiation reaction limit trajectories fairly
agree with the reduced Landau-Lifshitz approximation in almost all cases.
","[{""version"":""v1"",""created"":""Fri, 1 Jul 2022 18:54:07 GMT""}]","2022-09-28"
"2207.00625","Felix Weitk\""amper","Felix Weitk\""amper","Projectivity revisited","30 pages",,,,"cs.AI math.PR math.ST stat.TH","http://creativecommons.org/licenses/by/4.0/","  The behaviour of statistical relational representations across differently
sized domains has become a focal area of research from both a modelling and a
complexity viewpoint.Recently, projectivity of a family of distributions
emerged as a key property, ensuring that marginal probabilities are independent
of the domain size. However, the formalisation used currently assumes that the
domain is characterised only by its size. This contribution extends the notion
of projectivity from families of distributions indexed by domain size to
functors taking extensional data from a database. This makes projectivity
available for the large range of applications taking structured input. We
transfer key known results on projective families of distributions to the new
setting. This includes a characterisation of projective fragments in different
statistical relational formalisms as well as a general representation theorem
for projective families of distributions. Furthermore, we prove a
correspondence between projectivity and distributions on countably infinite
domains, which we use to unify and generalise earlier work on statistical
relational representations in infinite domains. Finally, we use the extended
notion of projectivity to define a further strengthening, which we call
$\sigma$-projectivity, and which allows the use of the same representation in
different modes while retaining projectivity.
","[{""version"":""v1"",""created"":""Fri, 1 Jul 2022 18:54:36 GMT""},{""version"":""v2"",""created"":""Sat, 10 Sep 2022 19:53:37 GMT""},{""version"":""v3"",""created"":""Tue, 29 Nov 2022 16:28:19 GMT""}]","2022-11-30"
"2207.00626","Karapet Mkrtchyan","Karapet Mkrtchyan and Fridrich Valach","Democratic actions for type II supergravities","4+2 pages (modified title, minor improvements, published version)","Phys.Rev.D 107 (2023) 6, 066027","10.1103/PhysRevD.107.066027","Imperial-TP-KM-2022-03","hep-th","http://creativecommons.org/licenses/by/4.0/","  We present a universal democratic Lagrangian for the bosonic sector of
ten-dimensional type II supergravities, treating ""electric"" and ""magnetic""
potentials of all RR fields on equal footing. For type IIB, this includes the
five-form whose self-duality equation is derived from the Lagrangian. We also
present an alternative form of the action for type IIB, with manifest $SL(2,\mb
R)$ symmetry.
","[{""version"":""v1"",""created"":""Fri, 1 Jul 2022 18:55:28 GMT""},{""version"":""v2"",""created"":""Thu, 27 Apr 2023 19:05:30 GMT""}]","2023-05-01"
"2207.00627","Sara Mohammadinejad","Sara Mohammadinejad, Jesse Thomason, Jyotirmoy V. Deshmukh","Interactive Learning from Natural Language and Demonstrations using
  Signal Temporal Logic",,,,,"cs.FL cs.CL","http://creativecommons.org/licenses/by/4.0/","  Natural language is an intuitive way for humans to communicate tasks to a
robot. While natural language (NL) is ambiguous, real world tasks and their
safety requirements need to be communicated unambiguously. Signal Temporal
Logic (STL) is a formal logic that can serve as a versatile, expressive, and
unambiguous formal language to describe robotic tasks. On one hand, existing
work in using STL for the robotics domain typically requires end-users to
express task specifications in STL, a challenge for non-expert users.
  On the other, translating from NL to STL specifications is currently
restricted to specific fragments. In this work, we propose DIALOGUESTL, an
interactive approach for learning correct and concise STL formulas from (often)
ambiguous NL descriptions. We use a combination of semantic parsing,
pre-trained transformer-based language models, and user-in-the-loop
clarifications aided by a small number of user demonstrations to predict the
best STL formula to encode NL task descriptions. An advantage of mapping NL to
STL is that there has been considerable recent work on the use of reinforcement
learning (RL) to identify control policies for robots. We show we can use Deep
Q-Learning techniques to learn optimal policies from the learned STL
specifications. We demonstrate that DIALOGUESTL is efficient, scalable, and
robust, and has high accuracy in predicting the correct STL formula with a few
number of demonstrations and a few interactions with an oracle user.
","[{""version"":""v1"",""created"":""Fri, 1 Jul 2022 19:08:43 GMT""}]","2022-07-05"
"2207.00628","R. Torsten Clay","Jeong-Pil Song, R. Torsten Clay, Sumit Mazumdar","Valence Transition Theory of the Pressure-Induced Dimensionality
  Crossover in Superconducting Sr$_{14-x}$Ca$_x$Cu$_{24}$O$_{41}$","17 pages, 3 figures",,,,"cond-mat.str-el cond-mat.supr-con","http://arxiv.org/licenses/nonexclusive-distrib/1.0/","  More than three decades after the discovery of superconductivity (SC) in the
cuprates, the nature of the ""normal"" state and the mechanism of SC remain
mysterious. One popular theoretical approach has been to treat the CuO$_2$
layer as coupled two-leg one-band Hubbard ladders. In the undoped two-leg
ladder spin-singlets occupy ladder rungs, and doped ladders are characterized
by superconducting correlations with quasi-long range order (quasi-LRO).
Pressure-induced SC in Sr$_{14-x}$Ca$_x$Cu$_{24}$O$_{41}$ (SCCO) has long been
explained within one-band ladder theories. The dramatic pressure-driven
crossover from quasi one-to-two dimensional (1D-to-2D) transport and the
simultaneous vanishing of the spin gap due to ladder singlets in the metallic
state preceding SC however lie outside the scope of ladder-based theories.
Recent demonstration of rapid decay of superconducting correlations with
distance within a realistic multiband model of the cuprate ladder gives
additional credence to this viewpoint. Here we show that the assumption of
pressure-driven increase in hole concentration in the ladders cannot explain
the dimensionality crossover. The dimensionality crossover is due to discrete
change in Cu-ion ionicity accompanied by transfer of holes from the Cu to
O-ions, leading to ""negative charge-transfer gap"". Our theory of valence
transition driven dimensionality crossover in SCCO provides a generic
explanation of the very large increase in charge carrier density at critical
doping concentrations in both hole and electron doped layered cuprates We
propose a falsifiable experimental test of our theory.
","[{""version"":""v1"",""created"":""Fri, 1 Jul 2022 19:08:44 GMT""}]","2022-07-05"
"2207.00629","Surjeet Singh Dr.","Nashra Pistawala, Suman Karmakar, Rajeev Rawat, and Surjeet Singh","Crystal growth and magnetic behavior of J_eff = 1/2 quantum
  antiferromagnet CeCl_3","Seven figures",,,,"cond-mat.str-el","http://creativecommons.org/licenses/by/4.0/","  We have grown high-quality single crystals of CeCl_3 using a modified
Bridgman Stockbarger method in an infrared image furnace. These crystals are
characterized using single-crystal x-ray diffraction, Laue x-ray diffraction,
Raman spectroscopy, magnetic susceptibility, and heat capacity probes. CeCl_3
crystallizes with a trigonal crystal structure (space group P-3, number 147).
The crystal field split J = 5/2 manifold of Ce ion in CeCl_3 has an effective
spin 1/2 Kramers doublet ground. The exchange coupling between the Ce moments
is rather weak (Weiss temperature = 0.2 K). The magnetic susceptibility shows a
broad peak centred around 50 K due to the crystal field splitting. The magnetic
specific heat shows a Schottky anomaly around 30 K due to the excited crystal
field doublets located near 55 K and 155 K. The Raman spectra at 300 K exhibit
five, clearly resolvable, modes at 106.8, 181.2, 189, 213, and 219.7
wavenumbers.
","[{""version"":""v1"",""created"":""Fri, 1 Jul 2022 19:08:46 GMT""},{""version"":""v2"",""created"":""Tue, 18 Apr 2023 05:21:19 GMT""}]","2023-04-19"
"2207.00630","William Cohen","Wenhu Chen, William W. Cohen, Michiel De Jong, Nitish Gupta,
  Alessandro Presta, Pat Verga, John Wieting","QA Is the New KR: Question-Answer Pairs as Knowledge Bases",,,,,"cs.AI","http://creativecommons.org/licenses/by/4.0/","  In this position paper, we propose a new approach to generating a type of
knowledge base (KB) from text, based on question generation and entity linking.
We argue that the proposed type of KB has many of the key advantages of a
traditional symbolic KB: in particular, it consists of small modular
components, which can be combined compositionally to answer complex queries,
including relational queries and queries involving ""multi-hop"" inferences.
However, unlike a traditional KB, this information store is well-aligned with
common user information needs.
","[{""version"":""v1"",""created"":""Fri, 1 Jul 2022 19:09:08 GMT""}]","2022-07-05"
"2207.00631","Vyacheslav Vandeev","V.P. Vandeev, A.N. Semenova","Tidal properties of D-dimensional Tangherlini black holes","17 pages. Indian J Phys (2022)",,"10.1007/s12648-022-02543-5",,"gr-qc","http://creativecommons.org/publicdomain/zero/1.0/","  This paper investigates tidal forces in multidimensional spherically
symmetric spacetimes. We consider geodesic deviation equation in
Schwarzschild-Tangherlini metric and its electrically charged analog. It was
shown that for radial geodesics these equations can be solved explicitly as
quadratures in spaces of any dimension. In the case of five, six and seven
dimensional spaces, these solutions can be represented in terms of elliptic
integrals. For spacetimes of higher dimension, we find the asymptotics of the
solution. It was found that in the physical singularity vicinity tidal stretch
along the radial direction is the stronger the greater the dimension of space.
Whereas the tidal compression in transverse to radial directions, starting from
a certain dimension, does not change in the main order. Also in the case of
non-radial geodesics, the presence of black hole electric charge does not
affect the force of transverse compression in the leading order. For non-radial
geodesics with non-zero angular momentum, the local properties of solutions of
geodesic deviation equations in the vicinity of a singularity are studied.
","[{""version"":""v1"",""created"":""Fri, 1 Jul 2022 19:15:26 GMT""}]","2023-01-09"
"2207.00632","Yannis Flet-Berliac","Yao Liu, Yannis Flet-Berliac, Emma Brunskill","Offline Policy Optimization with Eligible Actions","Accepted at the 38th Conference on Uncertainty in Artificial
  Intelligence (UAI 2022)",,,,"cs.LG","http://arxiv.org/licenses/nonexclusive-distrib/1.0/","  Offline policy optimization could have a large impact on many real-world
decision-making problems, as online learning may be infeasible in many
applications. Importance sampling and its variants are a commonly used type of
estimator in offline policy evaluation, and such estimators typically do not
require assumptions on the properties and representational capabilities of
value function or decision process model function classes. In this paper, we
identify an important overfitting phenomenon in optimizing the importance
weighted return, in which it may be possible for the learned policy to
essentially avoid making aligned decisions for part of the initial state space.
We propose an algorithm to avoid this overfitting through a new
per-state-neighborhood normalization constraint, and provide a theoretical
justification of the proposed algorithm. We also show the limitations of
previous attempts to this approach. We test our algorithm in a
healthcare-inspired simulator, a logged dataset collected from real hospitals
and continuous control tasks. These experiments show the proposed method yields
less overfitting and better test performance compared to state-of-the-art batch
reinforcement learning algorithms.
","[{""version"":""v1"",""created"":""Fri, 1 Jul 2022 19:18:15 GMT""}]","2022-07-05"
