"2207.04392","Maksim Kukushkin","Maksim V. Kukushkin","Abstract evolution equations with an operator function in the second
  term","arXiv admin note: text overlap with arXiv:2112.10396",,,,"math.FA","http://creativecommons.org/licenses/by/4.0/","  In this paper, having introduced a convergence of a series on the root
vectors in the Abel-Lidskii sense, we present a valuable application to the
evolution equations. The main issue of the paper is an approach allowing us to
principally broaden conditions imposed upon the right-hand side of the
evolution equation in the abstract Hilbert space.
  In this way, we come to the definition of the function of an unbounded
non-selfadjoint operator. Meanwhile, considering the main issue we involve an
additional concept that is a generalization of the spectral theorem for a
non-selfadjoint operator.
","[{""version"":""v1"",""created"":""Sun, 10 Jul 2022 06:22:27 GMT""},{""version"":""v2"",""created"":""Tue, 20 Dec 2022 12:55:04 GMT""}]","2022-12-21"
"2207.04393","Nils Bruin","Nils Bruin and Eugene Filatov","Twists of the Burkhardt Quartic Threefold","16 pages; corrections of some typos and minor changes to exposition","Research in Number Theory 9, 73 (2022)","10.1007/s40993-022-00372-3",,"math.NT math.AG","http://arxiv.org/licenses/nonexclusive-distrib/1.0/","  We study twists of the Burkhardt quartic threefold over non-algebraically
closed base fields of characteristic different from 2,3,5. We show they all
admit quartic models in projective four-space. We identify a
Galois-cohomological obstruction that measures if a given twist is birational
to a moduli space of abelian varieties. This obstruction has implications for
the rational points on these varieties. As a result, we see that all possible
3-level structures can be realized by abelian surfaces, whereas Kummer 3-level
structures that group-theoretically may be admissible, may not be realizable
over certain base fields. We give an example of a Burkhardt quartic over a
bivariate function field whose desingularization has no rational points at all.
  Our methods are based on the representation theory of Sp(4,3), Galois
cohomology, and the classical algebraic geometry of the Burkhardt quartic.
","[{""version"":""v1"",""created"":""Sun, 10 Jul 2022 06:31:14 GMT""},{""version"":""v2"",""created"":""Tue, 23 Aug 2022 23:33:22 GMT""}]","2022-09-23"
"2207.04394","Yan Han","Yan Han, Gregory Holste, Ying Ding, Ahmed Tewfik, Yifan Peng, and
  Zhangyang Wang","Radiomics-Guided Global-Local Transformer for Weakly Supervised
  Pathology Localization in Chest X-Rays",,,,,"cs.CV","http://arxiv.org/licenses/nonexclusive-distrib/1.0/","  Before the recent success of deep learning methods for automated medical
image analysis, practitioners used handcrafted radiomic features to
quantitatively describe local patches of medical images. However, extracting
discriminative radiomic features relies on accurate pathology localization,
which is difficult to acquire in real-world settings. Despite advances in
disease classification and localization from chest X-rays, many approaches fail
to incorporate clinically-informed domain knowledge. For these reasons, we
propose a Radiomics-Guided Transformer (RGT) that fuses \textit{global} image
information with \textit{local} knowledge-guided radiomics information to
provide accurate cardiopulmonary pathology localization and classification
\textit{without any bounding box annotations}. RGT consists of an image
Transformer branch, a radiomics Transformer branch, and fusion layers that
aggregate image and radiomic information. Using the learned self-attention of
its image branch, RGT extracts a bounding box for which to compute radiomic
features, which are further processed by the radiomics branch; learned image
and radiomic features are then fused and mutually interact via cross-attention
layers. Thus, RGT utilizes a novel end-to-end feedback loop that can bootstrap
accurate pathology localization only using image-level disease labels.
Experiments on the NIH ChestXRay dataset demonstrate that RGT outperforms prior
works in weakly supervised disease localization (by an average margin of 3.6\%
over various intersection-over-union thresholds) and classification (by 1.1\%
in average area under the receiver operating characteristic curve). We publicly
release our codes and pre-trained models at
\url{https://github.com/VITA-Group/chext}.
","[{""version"":""v1"",""created"":""Sun, 10 Jul 2022 06:32:56 GMT""},{""version"":""v2"",""created"":""Tue, 12 Jul 2022 01:05:22 GMT""},{""version"":""v3"",""created"":""Thu, 14 Jul 2022 09:16:33 GMT""},{""version"":""v4"",""created"":""Wed, 19 Oct 2022 17:53:44 GMT""}]","2022-10-20"
"2207.04395","Kazuki Yamamoto","Kazuki Yamamoto and Norio Kawakami","Universal description of dissipative Tomonaga-Luttinger liquids with
  SU($N$) spin symmetry: Exact spectrum and critical exponents","18 pages, 3 figures","Phys. Rev. B 107, 045110 (2023)","10.1103/PhysRevB.107.045110",,"cond-mat.quant-gas cond-mat.stat-mech cond-mat.str-el hep-th quant-ph","http://arxiv.org/licenses/nonexclusive-distrib/1.0/","  Universal scaling relations for dissipative Tomonaga-Luttinger (TL) liquids
with SU($N$) spin symmetry are obtained for both fermions and bosons, by using
asymptotic Bethe-ansatz solutions and conformal field theory (CFT) in
one-dimensional non-Hermitian quantum many-body systems with SU($N$) symmetry.
We uncover that the spectrum of dissipative TL liquids with SU($N$) spin
symmetry is described by the sum of one charge mode characterized by a complex
generalization of $c=1$ U(1) Gaussian CFT, and $N-1$ spin modes characterized
by level-$1$ SU($N$) Kac-Moody algebra with the conformal anomaly $c=N-1$, and
thereby dissipation only affects the charge mode as a result of spin-charge
separation in one-dimensional non-Hermitian quantum systems. The derivation is
based on a complex generalization of Haldane's ideal-gas description, which is
implemented by the SU($N$) Calogero-Sutherland model with inverse-square
long-range interactions.
","[{""version"":""v1"",""created"":""Sun, 10 Jul 2022 06:34:51 GMT""},{""version"":""v2"",""created"":""Tue, 10 Jan 2023 01:42:21 GMT""}]","2023-01-11"
"2207.04396","Minji Yoon","Minji Yoon, Yue Wu, John Palowitch, Bryan Perozzi, Ruslan
  Salakhutdinov","Graph Generative Model for Benchmarking Graph Neural Networks",,,,,"cs.LG cs.AI cs.CR","http://creativecommons.org/licenses/by/4.0/","  As the field of Graph Neural Networks (GNN) continues to grow, it experiences
a corresponding increase in the need for large, real-world datasets to train
and test new GNN models on challenging, realistic problems. Unfortunately, such
graph datasets are often generated from online, highly privacy-restricted
ecosystems, which makes research and development on these datasets hard, if not
impossible. This greatly reduces the amount of benchmark graphs available to
researchers, causing the field to rely only on a handful of publicly-available
datasets. To address this problem, we introduce a novel graph generative model,
Computation Graph Transformer (CGT) that learns and reproduces the distribution
of real-world graphs in a privacy-controlled way. More specifically, CGT (1)
generates effective benchmark graphs on which GNNs show similar task
performance as on the source graphs, (2) scales to process large-scale graphs,
(3) incorporates off-the-shelf privacy modules to guarantee end-user privacy of
the generated graph. Extensive experiments across a vast body of graph
generative models show that only our model can successfully generate
privacy-controlled, synthetic substitutes of large-scale real-world graphs that
can be effectively used to benchmark GNN models.
","[{""version"":""v1"",""created"":""Sun, 10 Jul 2022 06:42:02 GMT""},{""version"":""v2"",""created"":""Tue, 11 Oct 2022 23:37:49 GMT""},{""version"":""v3"",""created"":""Mon, 20 Feb 2023 14:12:53 GMT""}]","2023-02-21"
"2207.04397","Xu Yan","Xu Yan, Jiantao Gao, Chaoda Zheng, Chao Zheng, Ruimao Zhang, Shenghui
  Cui, Zhen Li","2DPASS: 2D Priors Assisted Semantic Segmentation on LiDAR Point Clouds","ECCV2022",,,,"cs.CV","http://arxiv.org/licenses/nonexclusive-distrib/1.0/","  As camera and LiDAR sensors capture complementary information used in
autonomous driving, great efforts have been made to develop semantic
segmentation algorithms through multi-modality data fusion. However,
fusion-based approaches require paired data, i.e., LiDAR point clouds and
camera images with strict point-to-pixel mappings, as the inputs in both
training and inference, which seriously hinders their application in practical
scenarios. Thus, in this work, we propose the 2D Priors Assisted Semantic
Segmentation (2DPASS), a general training scheme, to boost the representation
learning on point clouds, by fully taking advantage of 2D images with rich
appearance. In practice, by leveraging an auxiliary modal fusion and
multi-scale fusion-to-single knowledge distillation (MSFSKD), 2DPASS acquires
richer semantic and structural information from the multi-modal data, which are
then online distilled to the pure 3D network. As a result, equipped with
2DPASS, our baseline shows significant improvement with only point cloud
inputs. Specifically, it achieves the state-of-the-arts on two large-scale
benchmarks (i.e. SemanticKITTI and NuScenes), including top-1 results in both
single and multiple scan(s) competitions of SemanticKITTI.
","[{""version"":""v1"",""created"":""Sun, 10 Jul 2022 06:52:09 GMT""},{""version"":""v2"",""created"":""Fri, 16 Sep 2022 07:00:04 GMT""},{""version"":""v3"",""created"":""Fri, 14 Oct 2022 14:30:29 GMT""}]","2022-10-17"
"2207.04398","Ashraful Islam","Ashraful Islam, Ben Lundell, Harpreet Sawhney, Sudipta Sinha, Peter
  Morales, Richard J. Radke","Self-supervised Learning with Local Contrastive Loss for Detection and
  Semantic Segmentation","accepted to WACV 2023",,,,"cs.CV cs.AI","http://creativecommons.org/licenses/by/4.0/","  We present a self-supervised learning (SSL) method suitable for semi-global
tasks such as object detection and semantic segmentation. We enforce local
consistency between self-learned features, representing corresponding image
locations of transformed versions of the same image, by minimizing a
pixel-level local contrastive (LC) loss during training. LC-loss can be added
to existing self-supervised learning methods with minimal overhead. We evaluate
our SSL approach on two downstream tasks -- object detection and semantic
segmentation, using COCO, PASCAL VOC, and CityScapes datasets. Our method
outperforms the existing state-of-the-art SSL approaches by 1.9% on COCO object
detection, 1.4% on PASCAL VOC detection, and 0.6% on CityScapes segmentation.
","[{""version"":""v1"",""created"":""Sun, 10 Jul 2022 06:53:15 GMT""},{""version"":""v2"",""created"":""Thu, 8 Dec 2022 01:55:51 GMT""}]","2022-12-09"
"2207.04399","Litao Yu","Litao Yu, Jian Zhang","Horizontal and Vertical Attention in Transformers",,,,,"cs.CV","http://arxiv.org/licenses/nonexclusive-distrib/1.0/","  Transformers are built upon multi-head scaled dot-product attention and
positional encoding, which aim to learn the feature representations and token
dependencies. In this work, we focus on enhancing the distinctive
representation by learning to augment the feature maps with the self-attention
mechanism in Transformers. Specifically, we propose the horizontal attention to
re-weight the multi-head output of the scaled dot-product attention before
dimensionality reduction, and propose the vertical attention to adaptively
re-calibrate channel-wise feature responses by explicitly modelling
inter-dependencies among different channels. We demonstrate the Transformer
models equipped with the two attentions have a high generalization capability
across different supervised learning tasks, with a very minor additional
computational cost overhead. The proposed horizontal and vertical attentions
are highly modular, which can be inserted into various Transformer models to
further improve the performance. Our code is available in the supplementary
material.
","[{""version"":""v1"",""created"":""Sun, 10 Jul 2022 07:08:18 GMT""}]","2022-07-12"
"2207.04400","Waleed Abdel Kareem Prof.","Waleed Abdel Kareem, Pietro Asinari, Sauro Succi, Seiichiro Izawa, Yu
  Fukunishi","Single Relaxation Time and Multiple Revised Matrix Lattice Boltzmann
  Simulations of Forced Isotropic Turbulence","I have to add more figures and discussions",,,,"physics.flu-dyn math-ph math.MP","http://creativecommons.org/licenses/by/4.0/","  The single relaxation time (SRT) and the revised matrix (RM) lattice
Boltzmann models are compared for simulations of three dimensional forced
isotropic turbulence with resolutions of 128^3 and 256^3, respectively. The
forcing technique by Guo et al. (2002) is applied with the two models using the
same parameters and conditions. Some new aspects and results have been
confirmed such as the superiority of the MRT model to simulate forced
turbulence and using the Courant-Friedichs-Lewy condition (CFL) (Courant et
al., 1967) by multiplying the velocity input with the coefficient CFL < 1.0 to
overcome the stability problem and divide the output velocity data by the same
CFL. The initial velocity field is chosen as u(x; 0) = 0 and the force is
injected at low wave-numbers with a fixed forcing amplitude to 10^-4 for all
cases. The single relaxation time is set to 0.503 in all SRT simulations.
Results show that the obtained turbulent velocity fields yield universal
characteristics as proven in previous theoretical, experimental and numerical
studies. The Taylor Reynolds number for the simulations are found as SRT: R =
62 and MRT : R = 65 for 1283 and SRT: R= 107 and MRT: R = 82 for the case of
2563, respectively. To test the weak incompressibility for the SRT model in
comparison to the MRT model, the density probability distribution function
(PDF) is depicted and it is found that ? is almost unity at all timesteps for
the MRT case, while a clear disturbance about unity is observed for the SRT
case.
","[{""version"":""v1"",""created"":""Sun, 10 Jul 2022 07:19:26 GMT""},{""version"":""v2"",""created"":""Wed, 7 Jun 2023 10:05:28 GMT""}]","2023-06-08"
"2207.04401","Alex Margolis","Alex Margolis","Discretisable quasi-actions I: Topological completions and hyperbolicity","71 pages. Comments are welcome! v2. Fixed typos. Corrected the
  conclusion of Theorem M from ""virtually a direct product"" to ""virtually
  isomorphic to a direct product""",,,,"math.GR","http://creativecommons.org/licenses/by/4.0/","  We define and develop the notion of a discretisable quasi-action. It is shown
that a cobounded quasi-action on a proper non-elementary hyperbolic space $X$
not fixing a point of $\partial X$ is quasi-conjugate to an isometric action on
either a rank one symmetric space or a locally finite graph. Topological
completions of quasi-actions are also introduced.
  Discretisable quasi-actions are used to give several instances where
commensurated subgroups are preserved by quasi-isometries. For example, the
class of $\mathbb{Z}$-by-hyperbolic groups is shown to be quasi-isometrically
rigid. We characterise the class of finitely generated groups quasi-isometric
to either $\mathbb{Z}^n\times \Gamma_1$ or $\Gamma_1\times \Gamma_2$, where
$\Gamma_1$ and $\Gamma_2$ are non-elementary hyperbolic groups.
","[{""version"":""v1"",""created"":""Sun, 10 Jul 2022 07:27:41 GMT""},{""version"":""v2"",""created"":""Fri, 15 Jul 2022 00:35:49 GMT""}]","2022-07-18"
"2207.04402","Yong Zhang","Guowei Dai, Yong Zhang","Global bifurcation structure and geometric properties for steady
  periodic water waves with vorticity",,,,,"math.AP","http://creativecommons.org/licenses/by/4.0/","  This paper studies the classical water wave problem with vorticity described
by the Euler equations with a free surface under the influence of gravity over
a flat bottom. Based on fundamental work \cite{ConstantinStrauss}, we first
obtain two continuous bifurcation curves which meet the laminar flow only one
time by using modified analytic bifurcation theorem. They are symmetric waves
whose profiles are monotone between each crest and trough. Furthermore, we find
that there is at least one inflection point on the wave profile between
successive crests and troughs and the free surface is strictly concave at any
crest and strictly convex at any trough. In addition, for favorable vorticity,
we prove that the vertical displacement of water waves decreases with depth.
","[{""version"":""v1"",""created"":""Sun, 10 Jul 2022 07:28:20 GMT""}]","2022-07-12"
"2207.04403","Litao Yu","Litao Yu, Zhibin Li, Jian Zhang, Qiang Wu","Self-attention on Multi-Shifted Windows for Scene Segmentation",,,,,"cs.CV","http://arxiv.org/licenses/nonexclusive-distrib/1.0/","  Scene segmentation in images is a fundamental yet challenging problem in
visual content understanding, which is to learn a model to assign every image
pixel to a categorical label. One of the challenges for this learning task is
to consider the spatial and semantic relationships to obtain descriptive
feature representations, so learning the feature maps from multiple scales is a
common practice in scene segmentation. In this paper, we explore the effective
use of self-attention within multi-scale image windows to learn descriptive
visual features, then propose three different strategies to aggregate these
feature maps to decode the feature representation for dense prediction. Our
design is based on the recently proposed Swin Transformer models, which totally
discards convolution operations. With the simple yet effective multi-scale
feature learning and aggregation, our models achieve very promising performance
on four public scene segmentation datasets, PASCAL VOC2012, COCO-Stuff 10K,
ADE20K and Cityscapes.
","[{""version"":""v1"",""created"":""Sun, 10 Jul 2022 07:36:36 GMT""}]","2022-07-12"
"2207.04404","Yilong Yang","Yilong Yang","Reduced Power Graphs of $\mathrm{PGL}_n(\mathbb{F}_q)$",,,,,"math.GR math.CO","http://creativecommons.org/licenses/by/4.0/","  Given a group $G$, let us connect two non-identity elements by an edge if and
only if one is a power of another. This gives a graph structure on $G$ minus
identity, called the reduced power graph. It is conjectured by Akbari and
Ashrafi that if a non-abelian finite simple group has a connected reduced power
graph, then it must be an alternating group.
  In this paper, we shall give a complete description of when the reduced power
graphs of $\mathrm{PGL}_n(\mathbb{F}_q)$ are connected for all $q$ and all
$n\geq 3$. In particular, the conjectured by Akbari and Ashrafi is false. We
shall also provide an upper bound in their diameters, and in case of
disconnection, provide a description of all connected components.
","[{""version"":""v1"",""created"":""Sun, 10 Jul 2022 07:38:38 GMT""}]","2022-07-12"
"2207.04405","Marc-Henri Julien","I. Vinograd, R. Zhou, H. Mayaffre, S. Kr\""amer, S. K. Ramakrishna, A.
  P. Reyes, T. Kurosawa, N. Momono, M. Oda, S. Komiya, S. Ono, M. Horio, J.
  Chang, M.-H. Julien","Competition between spin ordering and superconductivity near the
  pseudogap boundary in La2-xSrxCuO4: insights from NMR",,,"10.1103/PhysRevB.106.054522",,"cond-mat.supr-con cond-mat.str-el","http://creativecommons.org/licenses/by/4.0/","  When superconductivity is suppressed by high magnetic fields in La2-xSrxCuO4,
striped antiferromagnetic (AFM) order becomes the magnetic ground state of the
entire pseudogap regime, up to its end at the doping p* [M. Frachet, I.
Vinograd et al., Nat. Phys. 16, 1064 (2020)]. Glass-like freezing of this state
is detected in 139La NMR measurements of the spin-lattice relaxation rate 1/T1.
Here, we present a quantitative analysis of 1/T1 data in the hole-doping range
p=x=0.12-0.171, based on the Bloembergen-Purcell-Pound (BPP) theory, modified
to include statistical distribution of parameters arising from strong spatial
inhomogeneity. We observe spin fluctuations to slow down at temperatures T near
the onset of static charge order and, overall, the effect of the field B may be
seen as equivalent to strengthening stripe order by approaching p=0.12 doping.
In details however, our analysis reveals significant departure from usual
field-induced magnetic transitions. The continuous growth of the amplitude of
the fluctuating moment with increasing B suggests a nearly-critical state in
the B->0 limit, with very weak quasi-static moments possibly confined in small
areas like vortex cores. Further, the nucleation of spin order in the vortex
cores is shown to account quantitatively for both the value and the p
dependence of a field scale characterizing bulk spin freezing. The correlation
time of the fluctuating moment appears to depend exponentially on B/T (over the
investigated range). This explains the timescale dependence of various
experimental manifestations, including why, for transport measurements, the AFM
moments may be considered static over a considerable range of B and T. These
results make the high-field magnetic ground state up to p* an integral part of
the discussion on putative quantum criticality.
","[{""version"":""v1"",""created"":""Sun, 10 Jul 2022 07:47:40 GMT""}]","2022-09-14"
"2207.04406","Yang Huang","Qing-Zheng Li, Yang Huang, Xiao-Bo Dong, Hua-Wei Zhang, Timothy C.
  Beers and Zhen Yuan","On the origins of extreme velocity stars as revealed by large-scale
  Galactic surveys","19 pages, 12 figures and 4 tables; accpected by the Astronomical
  Journal",,,,"astro-ph.GA","http://arxiv.org/licenses/nonexclusive-distrib/1.0/","  We assemble a large sample of 12,784 high-velocity stars with total velocity
$\it{V}_{\rm{GSR}}\ge {\rm 300}$ km s$^{-1}$, selected from RAVE DR5, SDSS
DR12, LAMOST DR8, APOGEE DR16, GALAH DR2, and $Gaia$ EDR3. In this sample, 52
are marginally hypervelocity star (HVS) candidates that have
$\it{V}_{\rm{GSR}}$ exceeding their local escape velocities within $2\sigma$
confidence levels, 40 of which are discovered for the first time. All
candidates are metal-poor, late-type halo stars, significantly different from
the previous identified HVSs, which are largely massive early-type stars,
discovered by extreme radial velocity. This finding suggests that our newly
identified HVS candidates are ejected by different mechanisms from the previous
population. To investigate their origins, for 547 extreme velocity stars with
${V}_{\rm{GSR}}\ge0.8V_{\rm{esc}}$, we reconstruct their backward-integrated
trajectories in the Galactic potential. According to the orbital analysis, no
candidates are found to be definitely ejected from the Galactic-center (GC),
while 8 metal-poor extreme velocity stars are found to have a closest distance
to the GC within 1kpc. Intriguingly, 15 extreme velocity stars (including 2 HVS
candidates) are found to have experienced close encounters with the Sagittarius
dSph, suggesting that they originated from this dSph. This hypothesis is
supported by an analysis of the [$\alpha$/Fe]--[Fe/H] diagram. From a
preliminary analysis of all the 547 extreme velocity stars, we propose a
general picture: Star ejection from Galactic subsystems such as dwarf galaxies
and globular clusters can be an important channel to produce extreme velocity
stars or even HVSs, particularly the metal-poor late-type halo population.
","[{""version"":""v1"",""created"":""Sun, 10 Jul 2022 07:48:46 GMT""},{""version"":""v2"",""created"":""Sat, 29 Apr 2023 05:45:05 GMT""}]","2023-05-02"
"2207.04407","Izhar Oppenheim","Izhar Oppenheim","Banach property (T) for $\rm SL_n (\mathbb{Z})$ and its applications","Major revision compared to the previous version. 35 pages",,,,"math.GR math.FA","http://creativecommons.org/licenses/by/4.0/","  We prove that a large family of higher rank simple Lie groups (including $\rm
SL_n (\mathbb{R})$ for $n \geq 3$) and their lattices have Banach property (T)
with respect to all super-reflexive Banach spaces.
  Two consequences of this result are: First, we deduce Banach fixed point
properties with respect to all super-reflexive Banach spaces for a large family
of higher rank simple Lie groups. For example, we show that for every $n \geq
4$, the group $\rm SL_n (\mathbb{R})$ and all its lattices have the Banach
fixed point property with respect to all super-reflexive Banach spaces. Second,
we settle a long standing open problem and show that the Margulis expanders
(Cayley graphs of $\rm SL_{n} (\mathbb{Z} / m \mathbb{Z} )$ for a fixed $n \geq
3$ and $m$ tending to infinity) are super-expanders.
  All of our results stem from proving Banach property (T) for $\rm SL_3
(\mathbb{Z})$. Our method of proof for $\rm SL_3 (\mathbb{Z})$ relies on a
novel proof for relative Banach property (T) for the uni-triangular subgroup of
$\rm SL_3 (\mathbb{Z})$. This proof of relative property (T) is new even in the
classical Hilbert setting and is interesting in its own right.
","[{""version"":""v1"",""created"":""Sun, 10 Jul 2022 07:53:12 GMT""},{""version"":""v2"",""created"":""Sun, 17 Jul 2022 08:12:59 GMT""},{""version"":""v3"",""created"":""Thu, 2 Mar 2023 06:23:31 GMT""},{""version"":""v4"",""created"":""Tue, 30 May 2023 05:16:59 GMT""}]","2023-05-31"
"2207.04408","Anna Bot","Anna Bot","The ordinal of dynamical degrees of birational maps of the projective
  plane","Added a chapter on the Weyl group and the ordinal of the Weyl
  spectrum, giving a second proof for the lower bound",,,,"math.AG math.DS","http://arxiv.org/licenses/nonexclusive-distrib/1.0/","  We show that the ordinal of the dynamical degrees of all complex birational
maps of the projective plane is $\omega^\omega$.
","[{""version"":""v1"",""created"":""Sun, 10 Jul 2022 07:55:27 GMT""},{""version"":""v2"",""created"":""Thu, 1 Sep 2022 07:43:57 GMT""}]","2022-09-02"
