"2207.04442","Nils Schl\""uter","Nils Schl\""uter, Matthias Neuhaus, Moritz Schulze Darup","Encrypted extremum seeking for privacy-preserving PID tuning
  as-a-Service",,,,,"eess.SY cs.SY","http://creativecommons.org/licenses/by-nc-nd/4.0/","  Wireless communication offers many benefits for control such as substantially
reduced deployment costs, higher flexibility, as well as easier data access. It
is thus not surprising that smart and wireless sensors and actuators are
increasingly used in industry. With these enhanced possibilities, exciting new
technologies such as Control-as-a-Service arise, where (for example) controller
design or tuning based on input-output-data can be outsourced to a cloud or
mobile device. This implies, however, that sensitive plant information may
become available to service providers or, possibly, attackers.
  Against this background, we focus on privacy-preserving optimal PID tuning
as-a-Service here. In particular, we combine homomorphic encryption with
extremum seeking in order to provide a purely data-driven and confidential
tuning algorithm. The encrypted realization requires several adaptions of
established extremum seekers. These encompass relative parameter updates,
stochastic gradient approximations, and a normalized objective function. As a
result, and as illustrated by various numerical examples, the proposed
encrypted extremum seeker is able to tune PID controllers for a wide variety of
plants without being too conservative.
","[{""version"":""v1"",""created"":""Sun, 10 Jul 2022 11:37:17 GMT""}]","2022-07-12"
"2207.04443","Stefan Schoder","Stefan Schoder, Klaus Roppert","openCFS: Open Source Finite Element Software for Coupled Field
  Simulation -- Part Acoustics","8 pages, 4 figures, software description, working paper",,,"01","math.NA cs.NA physics.comp-ph","http://creativecommons.org/licenses/by/4.0/","  Although many numerical simulation tools have been developed and are on the
market, there is still a strong need for appropriate tools capable to simulate
multi-field problems. Therefore, openCFS provides an open-source framework for
implementing partial differential equations using the finite element method.
Since 2000, the software has been developed continuously. The result of is
openCFS (before 2020 known as CFS++ Coupled Field Simulations written in C++).
In this paper, we present for the first time the open-source software with a
focus on the acoustic module.
","[{""version"":""v1"",""created"":""Sun, 10 Jul 2022 11:44:09 GMT""}]","2022-07-12"
"2207.04444","Gunnar Fl{\o}ystad","Gunnar Fl{\o}ystad","Partitons of vertices and facets in trees and stacked simplicial
  complexes","18 pages",,,,"math.CO","http://creativecommons.org/licenses/by/4.0/","  For stacked simplicial complexes, (where trees are a special subclass), we
give an explicit bijection between partitions of facets (for trees: edges), and
partitions of vertices into independent sets. More generally we give bijections
between facet partitions whose parts have minimal distance $\geq s$ and vertex
partitions whose parts have minimal distance $\geq s+1$. A consequence is
results on partitions of natural numbers, where the parts have minimal bounds
on spacing.
","[{""version"":""v1"",""created"":""Sun, 10 Jul 2022 11:50:56 GMT""},{""version"":""v2"",""created"":""Tue, 20 Dec 2022 07:58:08 GMT""}]","2022-12-21"
"2207.04445","Anat Hashavit","Anat Hashavit, Hongning Wang, Tamar Stern, Sarit Kraus","Not Just Skipping. Understanding the Effect of Sponsored Content on
  Users' Decision-Making in Online Health Search","10 pages, double column",,,,"cs.IR cs.HC","http://creativecommons.org/licenses/by-nc-sa/4.0/","  Advertisements (ads) are an innate part of search engine business models.
Advertisers are willing to pay search engines to promote their content to a
prominent position in the search result page (SERP). This raises concerns about
the search engine manipulation effect (SEME): the opinions of users can be
influenced by the way search results are presented. In this work, we
investigate the connection between SEME and sponsored content in the health
domain. We conduct a series of user studies in which participants need to
evaluate the effectiveness of different non-prescription natural remedies for
various medical conditions. We present participants SERPs with different
intentionally created biases towards certain viewpoints, with or without
sponsored content, and ask them to evaluate the effectiveness of the treatment
only based on the information presented to them. We investigate two types of
sponsored content: 1. Direct marketing ads that directly market the product
without expressing an opinion about its effectiveness, and 2. Indirect
marketing ads that explicitly advocate the product's effectiveness on the
condition in the query. Our results reveal a significant difference between the
influence on users from these two ad types. Though direct marketing ads are
mostly skipped by users, they can tilt users decision making towards more
positive viewpoints. Indirect marketing ads affect both the users' examination
behaviour and their perception of the treatment's effectiveness. We further
discover that the contrast between the indirect marketing ads and the viewpoint
presented in the organic search results plays an important role in users'
decision-making. When the contrast is high, users exhibit a strong preference
towards a negative viewpoint, and when the contrast is low or none, users
exhibit preference towards a more positive viewpoint.
","[{""version"":""v1"",""created"":""Sun, 10 Jul 2022 11:51:12 GMT""}]","2022-07-12"
"2207.04446","Maurizio Quadrio","Federica Gattere, Alessandro Chiarini and Maurizio Quadrio","Dimples for skin-friction drag reduction: status and perspectives",,,,,"physics.flu-dyn","http://creativecommons.org/licenses/by-nc-nd/4.0/","  Dimples are small concavities imprinted on a flat surface, known to affect
heat transfer and also flow separation and aerodynamic drag on bluff bodies
when acting as a standard roughness. Recently, dimples have been proposed as a
roughness pattern that is capable to reduce the turbulent drag of a flat plate,
by providing a reduction of skin friction that compensates the dimple-induced
pressure drag, and leads to a global benefit.
  The question whether dimples do actually work to reduce friction drag is
still unsettled. In this paper, we provide a comprehensive review of the
available information, touching upon the many parameters that characterize the
problem. A number of reasons that contribute to explaining the contrasting
literature information are discussed. We also provide guidelines for future
studies, by highlighting key methodological steps required for a meaningful
comparison between a flat and dimpled surface in view of drag reduction.
","[{""version"":""v1"",""created"":""Sun, 10 Jul 2022 11:57:52 GMT""}]","2022-07-12"
"2207.04447","Kiril Gashteovski","Bhushan Kotnis, Kiril Gashteovski, Julia Gastinger, Giuseppe Serra,
  Francesco Alesiani, Timo Sztyler, Ammar Shaker, Na Gong, Carolin Lawrence,
  Zhao Xu","Human-Centric Research for NLP: Towards a Definition and Guiding
  Questions",,,,,"cs.CL","http://creativecommons.org/licenses/by-nc-nd/4.0/","  With Human-Centric Research (HCR) we can steer research activities so that
the research outcome is beneficial for human stakeholders, such as end users.
But what exactly makes research human-centric? We address this question by
providing a working definition and define how a research pipeline can be split
into different stages in which human-centric components can be added.
Additionally, we discuss existing NLP with HCR components and define a series
of guiding questions, which can serve as starting points for researchers
interested in exploring human-centric research approaches. We hope that this
work would inspire researchers to refine the proposed definition and to pose
other questions that might be meaningful for achieving HCR.
","[{""version"":""v1"",""created"":""Sun, 10 Jul 2022 12:02:27 GMT""}]","2022-07-12"
"2207.04448","Lei Yang","Lei Yang, Xinyu Zhang, Li Wang, Minghan Zhu, Chuang Zhang, Jun Li","Mix-Teaching: A Simple, Unified and Effective Semi-Supervised Learning
  Framework for Monocular 3D Object Detection","11 pages, 5 figures, 7 tables",,,,"cs.CV","http://arxiv.org/licenses/nonexclusive-distrib/1.0/","  Monocular 3D object detection is an essential perception task for autonomous
driving. However, the high reliance on large-scale labeled data make it costly
and time-consuming during model optimization. To reduce such over-reliance on
human annotations, we propose Mix-Teaching, an effective semi-supervised
learning framework applicable to employ both labeled and unlabeled images in
training stage. Mix-Teaching first generates pseudo-labels for unlabeled images
by self-training. The student model is then trained on the mixed images
possessing much more intensive and precise labeling by merging instance-level
image patches into empty backgrounds or labeled images. This is the first to
break the image-level limitation and put high-quality pseudo labels from multi
frames into one image for semi-supervised training. Besides, as a result of the
misalignment between confidence score and localization quality, it's hard to
discriminate high-quality pseudo-labels from noisy predictions using only
confidence-based criterion. To that end, we further introduce an
uncertainty-based filter to help select reliable pseudo boxes for the above
mixing operation. To the best of our knowledge, this is the first unified SSL
framework for monocular 3D object detection. Mix-Teaching consistently improves
MonoFlex and GUPNet by significant margins under various labeling ratios on
KITTI dataset. For example, our method achieves around +6.34% AP@0.7
improvement against the GUPNet baseline on validation set when using only 10%
labeled data. Besides, by leveraging full training set and the additional 48K
raw images of KITTI, it can further improve the MonoFlex by +4.65% improvement
on AP@0.7 for car detection, reaching 18.54% AP@0.7, which ranks the 1st place
among all monocular based methods on KITTI test leaderboard. The code and
pretrained models will be released at
https://github.com/yanglei18/Mix-Teaching.
","[{""version"":""v1"",""created"":""Sun, 10 Jul 2022 12:07:25 GMT""}]","2022-07-12"
"2207.04449","Georgy Prokhorov","G. Yu. Prokhorov, O. V. Teryaev and V. I. Zakharov","Hydrodynamic manifestations of gravitational chiral anomaly","6 pages",,"10.1103/PhysRevLett.129.151601",,"hep-th gr-qc nucl-th","http://creativecommons.org/licenses/by/4.0/","  The conservation of an axial current modified by the gravitational chiral
anomaly implies the universal transport phenomenon (Kinematical Vortical
Effect) dependent solely on medium vorticity and acceleration but not dependent
explicitly on its temperature and density. This general analysis is verified
for the case of massless fermions with spin 1/2.
","[{""version"":""v1"",""created"":""Sun, 10 Jul 2022 12:09:58 GMT""},{""version"":""v2"",""created"":""Mon, 3 Oct 2022 12:40:07 GMT""}]","2022-10-19"
"2207.04450","Javier Majadas","Samuel Alvite, Nerea G. Barral and Javier Majadas","Formally regular rings and descent of regularity","Substantial improvements in sections 2 and 3. Title changed",,,,"math.AC","http://arxiv.org/licenses/nonexclusive-distrib/1.0/","  Valuation rings and perfectoid rings are examples of (usually non-noetherian)
rings that behave in some sense like regular rings. We give and study an
extension of the concept of regular local rings to non-noetherian rings so that
it includes valuation and perfectoid rings and it is related to Grothendieck's
definition of formal smoothness as in the noetherian case. For that, we have to
take into account the topologies. We prove a descent theorem for regularity
along flat homomorphisms (in fact for homomorphisms of finite flat dimension),
extending some known results from the noetherian to the non-noetherian case, as
well as generalizing some recent results in the non-noetherian case, such as
the descent of regularity from perfectoid rings by B. Bhatt, S. Iyengar and L.
Ma.
","[{""version"":""v1"",""created"":""Sun, 10 Jul 2022 12:11:52 GMT""},{""version"":""v2"",""created"":""Sun, 25 Sep 2022 20:36:54 GMT""}]","2022-09-27"
"2207.04451","Yanping He","Yanping He, Qi Shao, Shih-chi Chen, Renjie Zhou","Characterization of Two-photon Photopolymerization Fabrication using
  High-speed Optical Diffraction Tomography",,,,,"physics.optics physics.app-ph","http://creativecommons.org/licenses/by-nc-sa/4.0/","  Two-photon photopolymerization (TPP) has recently become a popular method for
the fabrication of three-dimensional (3D) micro- and nanostructures. The
reproduction fidelity of the designed micro- and nanostructures is influenced
by experimental writing conditions, including laser power, exposure time, etc.
To determine the appropriate writing parameters, characterization of
morphological features and surface roughness during the experiment is needed.
Traditional characterization methods for TPP, e.g., scanning electron
microscopy and atomic force microscopy, have limited speed and cannot study
internal structures without invasive approaches. Optical diffraction tomography
(ODT) is an emerging label-free 3D imaging technique based on reconstructing
the object's 3D refractive index (RI) distribution with diffraction-limited
resolution. Here, we propose a non-invasive solution to fully characterize the
TPP-fabricated structures using a high-speed ODT technique, which can eliminate
the need for complex sample preparation, such as fluorescence labelling or
metal-coating, and achieve a full 3D measurement time of 6 ms. By visualizing
and studying different TPP-fabricated structures, including embedded spirals
and cubes, via the ODT system, the fabrication quality, including 3D
morphological features, exposure levels, and surface roughness, can be examined
quantitatively. The results suggest our method can effectively improve the
fabrication quality and reproducibility of TPP, generating impacts on the
nanofabrication community.
","[{""version"":""v1"",""created"":""Sun, 10 Jul 2022 12:22:07 GMT""}]","2022-07-12"
"2207.04452","Kunal Dahiya","Kunal Dahiya, Nilesh Gupta, Deepak Saini, Akshay Soni, Yajun Wang,
  Kushal Dave, Jian Jiao, Gururaj K, Prasenjit Dey, Amit Singh, Deepesh Hada,
  Vidit Jain, Bhawna Paliwal, Anshul Mittal, Sonu Mehta, Ramachandran Ramjee,
  Sumeet Agarwal, Purushottam Kar, Manik Varma","NGAME: Negative Mining-aware Mini-batching for Extreme Classification",,,,,"cs.LG cs.IR","http://arxiv.org/licenses/nonexclusive-distrib/1.0/","  Extreme Classification (XC) seeks to tag data points with the most relevant
subset of labels from an extremely large label set. Performing deep XC with
dense, learnt representations for data points and labels has attracted much
attention due to its superiority over earlier XC methods that used sparse,
hand-crafted features. Negative mining techniques have emerged as a critical
component of all deep XC methods that allow them to scale to millions of
labels. However, despite recent advances, training deep XC models with large
encoder architectures such as transformers remains challenging. This paper
identifies that memory overheads of popular negative mining techniques often
force mini-batch sizes to remain small and slow training down. In response,
this paper introduces NGAME, a light-weight mini-batch creation technique that
offers provably accurate in-batch negative samples. This allows training with
larger mini-batches offering significantly faster convergence and higher
accuracies than existing negative sampling techniques. NGAME was found to be up
to 16% more accurate than state-of-the-art methods on a wide array of benchmark
datasets for extreme classification, as well as 3% more accurate at retrieving
search engine queries in response to a user webpage visit to show personalized
ads. In live A/B tests on a popular search engine, NGAME yielded up to 23%
gains in click-through-rates.
","[{""version"":""v1"",""created"":""Sun, 10 Jul 2022 12:32:12 GMT""}]","2022-07-12"
"2207.04453","Mika H\""am\""al\""ainen","Teemu P\""oyh\""onen, Mika H\""am\""al\""ainen, Khalid Alnajjar","Multilingual Persuasion Detection: Video Games as an Invaluable Data
  Source for NLP","DiGRA 2022",,,,"cs.CL","http://creativecommons.org/licenses/by-nc-sa/4.0/","  Role-playing games (RPGs) have a considerable amount of text in video game
dialogues. Quite often this text is semi-annotated by the game developers. In
this paper, we extract a multilingual dataset of persuasive dialogue from
several RPGs. We show the viability of this data in building a persuasion
detection system using a natural language processing (NLP) model called BERT.
We believe that video games have a lot of unused potential as a datasource for
a variety of NLP tasks. The code and data described in this paper are available
on Zenodo.
","[{""version"":""v1"",""created"":""Sun, 10 Jul 2022 12:38:02 GMT""}]","2022-07-12"
"2207.04454","Lukas Graf","Lukas Graf, Tobias Harks, Prashant Palkar","Dynamic Traffic Assignment for Electric Vehicles","42 pages",,,,"cs.GT math.OC","http://arxiv.org/licenses/nonexclusive-distrib/1.0/","  We initiate the study of dynamic traffic assignment for electrical vehicles
addressing the specific challenges such as range limitations and the
possibility of battery recharge at predefined charging locations. We pose the
dynamic equilibrium problem within the deterministic queueing model of Vickrey
and as our main result, we establish the existence of an energy-feasible
dynamic equilibrium. There are three key modeling-ingredients for obtaining
this existence result:
  * We introduce a walk-based definition of dynamic traffic flows which allows
for cyclic routing behavior as a result of recharging events en route.
  * We use abstract convex feasibility sets in an appropriate function space to
model the energy-feasibility of used walks.
  * We introduce the concept of capacitated dynamic equilibrium walk-flows
which generalize the former unrestricted dynamic equilibrium path-flows.
  Viewed in this framework, we show the existence of an energy-feasible dynamic
equilibrium by applying an infinite dimensional variational inequality, which
in turn requires a careful analysis of continuity properties of the network
loading as a result of injecting flow into walks. We complement our theoretical
results by a computational study in which we design a fixed-point algorithm
computing energy-feasible dynamic equilibria. We apply the algorithm to
standard real-world instances from the traffic assignment community
illustrating the complex interplay of resulting travel times, energy
consumption and prices paid at equilibrium.
","[{""version"":""v1"",""created"":""Sun, 10 Jul 2022 12:40:15 GMT""}]","2022-07-12"
"2207.04455","Yaonan Jin","Yaonan Jin and Pinyan Lu","The Price of Stability for First Price Auction","Complement results from the earlier work ""First Price Auction is
  1-1/e^2 Efficient"" (arXiv:2207.01761)",,,,"cs.GT","http://creativecommons.org/licenses/by/4.0/","  This paper establishes the Price of Stability (PoS) for First Price Auctions,
for all equilibrium concepts that have been studied in the literature: Bayes
Nash Equilibrium $\subsetneq$ Bayes Correlated Equilibrium $\subsetneq$ Bayes
Coarse Correlated Equilibrium}
  $\bullet$ Bayes Nash Equilibrium: For independent valuations, the tight PoS
is $1 - 1/ e^{2} \approx 0.8647$, matching the counterpart Price of Anarchy
(PoA) bound \cite{JL22}. For correlated valuations, the tight $\PoS$ is $1 - 1
/ e \approx 0.6321$, matching the counterpart PoA bound \cite{ST13,S14}. This
result indicates that, in the worst cases, efficiency degradation depends not
on different selections among Bayes Nash Equilibria.
  $\bullet$ Bayesian Coarse Correlated Equilibrium: For independent or
correlated valuations, the tight PoS is always $1 = 100\%$, i.e., no efficiency
degradation, different from the counterpart PoA bound $1 - 1 / e \approx
0.6321$ \cite{ST13,S14}. This result indicates that First Price Auctions can be
fully efficient when we allow the more general equilibrium concepts.
","[{""version"":""v1"",""created"":""Sun, 10 Jul 2022 12:49:36 GMT""}]","2022-07-12"
"2207.04456","Leone Di Mauro Villari Dr","Leone Di Mauro Villari and Alessandro Principi","Optotwistronic of bilayer graphene",,"Phys. Rev. B 106, 035401, 2022","10.1103/PhysRevB.106.035401",,"cond-mat.mes-hall","http://creativecommons.org/licenses/by-nc-nd/4.0/","  We present a study of the nonlinear optical response of twisted bilayer
graphene. We discuss the contribution of the Berry phase to the non-linearity
when inversion symmetry is broken, thus underlining the interplay between band
and real space geometry, and nonlinear response. We also highlight an effect
which is characteristic of extreme nonlinear optics: the generation of
harmonics in disguise. This effect emerges in twisted bilayer graphene at
relatively moderate fields strengths because of the much reduced band width.
Our findings contribute to the understanding of the link between geometry and
optical properties, as well as of the extreme nonlinear optical regime in
twisted bilayer graphene
","[{""version"":""v1"",""created"":""Sun, 10 Jul 2022 12:51:13 GMT""}]","2022-07-12"
"2207.04457","Jie Gao","Jie Gao, Jing Hu, Wanqing Sun, Yili Shen, Xiaonan Zhang, Xiaomin Fang,
  Fan Wang, and Guodong Zhao","TCR: A Transformer Based Deep Network for Predicting Cancer Drugs
  Response","11 pages,7 figures",,,,"cs.LG cs.AI q-bio.QM","http://arxiv.org/licenses/nonexclusive-distrib/1.0/","  Predicting clinical outcomes to anti-cancer drugs on a personalized basis is
challenging in cancer treatment due to the heterogeneity of tumors. Traditional
computational efforts have been made to model the effect of drug response on
individual samples depicted by their molecular profile, yet overfitting occurs
because of the high dimension for omics data, hindering models from clinical
application. Recent research shows that deep learning is a promising approach
to build drug response models by learning alignment patterns between drugs and
samples. However, existing studies employed the simple feature fusion strategy
and only considered the drug features as a whole representation while ignoring
the substructure information that may play a vital role when aligning drugs and
genes. Hereby in this paper, we propose TCR (Transformer based network for
Cancer drug Response) to predict anti-cancer drug response. By utilizing an
attention mechanism, TCR is able to learn the interactions between drug
atom/sub-structure and molecular signatures efficiently in our study.
Furthermore, a dual loss function and cross sampling strategy were designed to
improve the prediction power of TCR. We show that TCR outperformed all other
methods under various data splitting strategies on all evaluation matrices
(some with significant improvement). Extensive experiments demonstrate that TCR
shows significantly improved generalization ability on independent in-vitro
experiments and in-vivo real patient data. Our study highlights the prediction
power of TCR and its potential value for cancer drug repurpose and precision
oncology treatment.
","[{""version"":""v1"",""created"":""Sun, 10 Jul 2022 13:01:54 GMT""}]","2022-07-12"
"2207.04458","Andrea Cattaneo","Andrea Cattaneo, Antonella Nannicini and Adriano Tomassini","Almost complex parallelizable manifolds: Kodaira dimension and special
  structures","19 pages. Comments are welcome!",,,,"math.DG","http://arxiv.org/licenses/nonexclusive-distrib/1.0/","  We study the Kodaira dimension of a real parallelizable manifold $M$, with an
almost complex structure $J$ in standard form with respect to a given
parallelism. For $X = (M, J)$ we give conditions under which
$\operatorname{kod}(X) = 0$. We provide examples in the case $M = G \times G$,
where $G$ is a compact connected real Lie group. Finally we describe
geometrical properties of real parallelizable manifolds in the framework of
statistical geometry.
","[{""version"":""v1"",""created"":""Sun, 10 Jul 2022 13:06:16 GMT""}]","2022-07-12"
