"2207.04342","Haotian Jiang","Deeparnab Chakrabarty, Andrei Graur, Haotian Jiang, Aaron Sidford","Improved Lower Bounds for Submodular Function Minimization","To appear in FOCS 2022",,,,"cs.DS cs.CC cs.DC cs.DM math.OC","http://arxiv.org/licenses/nonexclusive-distrib/1.0/","  We provide a generic technique for constructing families of submodular
functions to obtain lower bounds for submodular function minimization (SFM).
Applying this technique, we prove that any deterministic SFM algorithm on a
ground set of $n$ elements requires at least $\Omega(n \log n)$ queries to an
evaluation oracle. This is the first super-linear query complexity lower bound
for SFM and improves upon the previous best lower bound of $2n$ given by [Graur
et al., ITCS 2020]. Using our construction, we also prove that any (possibly
randomized) parallel SFM algorithm, which can make up to $\mathsf{poly}(n)$
queries per round, requires at least $\Omega(n / \log n)$ rounds to minimize a
submodular function. This improves upon the previous best lower bound of
$\tilde{\Omega}(n^{1/3})$ rounds due to [Chakrabarty et al., FOCS 2021], and
settles the parallel complexity of query-efficient SFM up to logarithmic
factors due to a recent advance in [Jiang, SODA 2021].
","[{""version"":""v1"",""created"":""Sat, 9 Jul 2022 21:54:15 GMT""}]","2022-07-12"
"2207.04343","Oana-Maria Camburu","Maxime Kayser, Cornelius Emde, Oana-Maria Camburu, Guy Parsons,
  Bartlomiej Papiez, Thomas Lukasiewicz","Explaining Chest X-ray Pathologies in Natural Language",,"MICCAI 2022",,,"cs.CV cs.AI cs.CL","http://arxiv.org/licenses/nonexclusive-distrib/1.0/","  Most deep learning algorithms lack explanations for their predictions, which
limits their deployment in clinical practice. Approaches to improve
explainability, especially in medical imaging, have often been shown to convey
limited information, be overly reassuring, or lack robustness. In this work, we
introduce the task of generating natural language explanations (NLEs) to
justify predictions made on medical images. NLEs are human-friendly and
comprehensive, and enable the training of intrinsically explainable models. To
this goal, we introduce MIMIC-NLE, the first, large-scale, medical imaging
dataset with NLEs. It contains over 38,000 NLEs, which explain the presence of
various thoracic pathologies and chest X-ray findings. We propose a general
approach to solve the task and evaluate several architectures on this dataset,
including via clinician assessment.
","[{""version"":""v1"",""created"":""Sat, 9 Jul 2022 22:09:37 GMT""}]","2022-07-12"
"2207.04344","Franklin Mingzhe Li","Franklin Mingzhe Li, Michael Xieyang Liu, Yang Zhang, Patrick
  Carrington","Freedom to Choose: Understanding Input Modality Preferences of People
  with Upper-body Motor Impairments for Activities of Daily Living","ASSETS 2022",,"10.1145/3517428.3544814",,"cs.HC","http://creativecommons.org/licenses/by/4.0/","  Many people with upper-body motor impairments encounter challenges while
performing Activities of Daily Living (ADLs) and Instrumental Activities of
Daily Living (IADLs), such as toileting, grooming, and managing finances, which
have impacts on their Quality of Life (QOL). Although existing assistive
technologies enable people with upper-body motor impairments to use different
input modalities to interact with computing devices independently (e.g., using
voice to interact with a computer), many people still require Personal Care
Assistants (PCAs) to perform ADLs. Multimodal input has the potential to enable
users to perform ADLs without human assistance. We conducted 12 semi-structured
interviews with people who have upper-body motor impairments to capture their
existing practices and challenges of performing ADLs, identify opportunities to
expand the input possibilities for assistive devices, and understand user
preferences for multimodal interaction during everyday tasks. Finally, we
discuss implications for the design and use of multimodal input solutions to
support user independence and collaborative experiences when performing daily
living tasks.
","[{""version"":""v1"",""created"":""Sat, 9 Jul 2022 22:18:02 GMT""}]","2022-07-12"
"2207.04345","Soham Basu","Soham Basu, Sayantan Mukherjee, Ankit Bhattacharya, Anindya Sen","Segmentation of Blood Vessels, Optic Disc Localization, Detection of
  Exudates and Diabetic Retinopathy Diagnosis from Digital Fundus Images","RAAI 2020, 11 pages, 12 figures, 2 tables","Proceedings of Research and Applications in Artificial
  Intelligence. Advances in Intelligent Systems and Computing, vol. 1355 (2021)
  pp.173-184. Springer, Singapore","10.1007/978-981-16-1543-6_16",,"eess.IV cs.CV","http://creativecommons.org/licenses/by-nc-sa/4.0/","  Diabetic Retinopathy (DR) is a complication of long-standing, unchecked
diabetes and one of the leading causes of blindness in the world. This paper
focuses on improved and robust methods to extract some of the features of DR,
viz. Blood Vessels and Exudates. Blood vessels are segmented using multiple
morphological and thresholding operations. For the segmentation of exudates,
k-means clustering and contour detection on the original images are used.
Extensive noise reduction is performed to remove false positives from the
vessel segmentation algorithm's results. The localization of Optic Disc using
k-means clustering and template matching is also performed. Lastly, this paper
presents a Deep Convolutional Neural Network (DCNN) model with 14 Convolutional
Layers and 2 Fully Connected Layers, for the automatic, binary diagnosis of DR.
The vessel segmentation, optic disc localization and DCNN achieve accuracies of
95.93%, 98.77% and 75.73% respectively. The source code and pre-trained model
are available https://github.com/Sohambasu07/DR_2021
","[{""version"":""v1"",""created"":""Sat, 9 Jul 2022 22:26:04 GMT""}]","2022-07-12"
"2207.04346","Marcelo Tedesco","M. S. Tedesco, M. A. Nunez-Ochoa, F. Ramos, O. Medrano, K Beuchot","A proposal for measuring the structure of economic ecosystems: a
  mathematical and complex network analysis approach","22 pages",,,,"econ.TH","http://creativecommons.org/licenses/by/4.0/","  The benefits of using complex network analysis (CNA) to study complex
systems, such as an economy, have become increasingly evident in recent years.
However, the lack of a single comparative index that encompasses the overall
wellness of a structure can hinder the simultaneous analysis of multiple
ecosystems. A formula to evaluate the structure of an economic ecosystem is
proposed here, implementing a mathematical approach based on CNA metrics to
construct a comparative measure that reflects the collaboration dynamics and
its resultant structure. This measure provides the relevant actors with an
enhanced sense of the social dynamics of an economic ecosystem, whether related
to business, innovation, or entrepreneurship. Available graph metrics were
analysed, and 14 different formulas were developed. The efficiency of these
formulas was evaluated on real networks from 11 different innovation-driven
entrepreneurial economic ecosystems in six countries from Latin America and
Europe and on 800 random graphs simulating similarly constructed networks.
","[{""version"":""v1"",""created"":""Sat, 9 Jul 2022 22:41:19 GMT""}]","2022-07-12"
"2207.04347","Ramona Vogt","R. Vogt","Energy Dependence of Intrinsic Charm Production: What is the Best Energy
  for Observation?","32 pages, 16 figures",,"10.1103/PhysRevC.106.025201","LLNL-JRNL-837220","hep-ph","http://creativecommons.org/licenses/by/4.0/","  Background: A nonperturbative charm production contribution, known as
intrinsic charm, was predicted in the early 1980s. Recent results have provided
new evidence for its existence but further confirmation is needed. Purpose:
$J/\psi$ and $\bar D$ meson production are calculated with a combination of
perturbative QCD and intrinsic charm to determine the best energy range to
study intrinsic charm production. Methods: $J/\psi$ and $\bar D$ meson
production are calculated in perturbative QCD to next-to-leading order in the
cross section. Cold nuclear matter effects, including nuclear modification of
the parton densities and $p_T$ broadening by multiple scattering are taken into
account in the production of both; absorption by nucleons is also included for
the $J/\psi$. Contributions from intrinsic charm are calculated assuming
production from a $|uud c \bar c \rangle$ Fock state. Results: The $J/\psi$ and
$\bar D$ meson rapidity and $p_T$ distributions are calculated as a function of
rapidity and transverse momentum $p_T$ over a wide range of center-of-mass
energies with and without intrinsic charm in $p+p$ collisions. The nuclear
modification factor, $R_{pA}$, is also calculated for $p+{\rm Pb}$ interactions
at appropriate energies. Previous fixed-target data as a function of Feynman
$x$, $x_F$, are also compared to calculations within the approach. Good
agreement with the data is found when intrinsic charm is included. Conclusions:
The intrinsic charm signal may be largest at midrapidity for future low energy
fixed target experiments such as the proposed NA60+.
","[{""version"":""v1"",""created"":""Sat, 9 Jul 2022 22:55:56 GMT""}]","2022-08-31"
"2207.04348","Runxuan Gao","Runxuan Gao","A Zariski dense exceptional set in Manin's conjecture: dimension 2","14 pages, final version to appear in Research in Number Theory",,,,"math.AG math.NT","http://arxiv.org/licenses/nonexclusive-distrib/1.0/","  Recently, Lehmann, Sengupta, and Tanimoto proposed a conjectural construction
of the exceptional set in Manin's Conjecture, which we call the geometric
exceptional set. We construct a del Pezzo surface of degree $1$ whose geometric
exceptional set is Zariski dense. In particular, this provides the first
counterexample to the original version of Manin's Conjecture in dimension $2$
in characteristic $0$. Assuming the finiteness of Tate-Shafarevich groups of
elliptic curves over $\mathbb{Q}$ with $j$-invariant $0$, we show that there
are infinitely many such counterexamples.
","[{""version"":""v1"",""created"":""Sat, 9 Jul 2022 23:02:57 GMT""},{""version"":""v2"",""created"":""Fri, 12 Aug 2022 05:05:34 GMT""},{""version"":""v3"",""created"":""Thu, 18 May 2023 03:28:09 GMT""}]","2023-05-19"
"2207.04349","James Finley","James P. Finley","Fields and Equations of Classical Mechanics for Quantum Mechanics","Rewrote abstract, introduction, discussion and summary. An equation
  with an energy and pressure field are shown to be equivalent to the
  continuity equation. A discussion of one of the velocities and its kinetic
  energy is given, with possible modifications of the velocity field. The final
  equations have all terms identified as corresponding to a property of
  classical mechanics",,,,"quant-ph physics.flu-dyn","http://creativecommons.org/licenses/by/4.0/","  A generalized Euler equation of fluid dynamics is derived for describing
many-body states of quantum mechanics. The Eulerian Eq. can be viewed as
representing the interaction of two substates, where each substate has its own
velocity and pressure fields. These field quantities are given by maps of the
wavefunction. For one-body systems, the Eulerian Eq. can model either a fluid
or particle description of quantum states. The generalized Euler Eq. is shown
to be the gradient of an equation representing the total-energy of the two
substates, having two energy fields. This total-energy Eq. is a generalization
of the Bernoulli Eq. of fluid dynamics. The total-energy Eq., along with a
continuity-equation, is equivalent to the time-dependent Schroedinger Eq. An
equation is also derived that is equivalent to the main equation of Bohmian
mechanics with additional identifications: The quantum potential of Bohmian
mechanics is given as a sum of a kinetic energy and pressure fields. Also, the
time derivative of the wavefunction phase is replaced by an energy field. In
the formalism, field quantities are identified from their placement in
equations of classical mechanics and separately, by definitions that involve
the wavefunction and operators of quantum mechanics. This approach yields,
unintended, and unknown energy and pressure fields. These fields, however, are
shown to satisfy a continuity Eq., an equation that is equivalent to the other
equation of Bohmian mechanics. It is also demonstrated that energy conservation
holds for both of these energy fields, if the wavefunction is a
linear-combination of eigenvectors, where the eigenvectors can be
nondegenerate. A detailed investigation is given on the possible behavior, or
source, of an electron that has one of the velocity fields. Alternate formulae
for this velocity fields are also considered.
","[{""version"":""v1"",""created"":""Sat, 9 Jul 2022 23:28:27 GMT""},{""version"":""v2"",""created"":""Sun, 1 Jan 2023 18:02:29 GMT""}]","2023-01-03"
"2207.04350","Giulia Guidi","Giulia Guidi, Gabriel Raulet, Daniel Rokhsar, Leonid Oliker, Katherine
  Yelick, Aydin Buluc","Distributed-Memory Parallel Contig Generation for De Novo Long-Read
  Genome Assembly","ICPP22, August 29-September 1, 2022, Bordeaux, France","ICPP22, August 29-September 1, 2022, Bordeaux, France","10.1145/3545008.3545050",,"cs.DC q-bio.GN","http://creativecommons.org/licenses/by/4.0/","  De novo genome assembly, i.e., rebuilding the sequence of an unknown genome
from redundant and erroneous short sequences, is a key but computationally
intensive step in many genomics pipelines. The exponential growth of genomic
data is increasing the computational demand and requires scalable,
high-performance approaches. In this work, we present a novel
distributed-memory algorithm that, from a string graph representation of the
genome and using sparse matrices, generates the contig set, i.e., overlapping
sequences that form a map representing a region of a chromosome. Using matrix
abstraction, we mask branches in the string graph and compute the connected
component to group genomic sequences that belong to the same linear chain
(i.e., contig). Then, we perform multiway number partitioning to minimize the
load imbalance in local assembly, i.e., concatenation of sequences from a given
contig. Based on the assignment obtained by partitioning, we compute the induce
subgraph function to redistribute sequences between processes, resulting in a
set of local sparse matrices. Finally, we traverse each matrix using
depth-first search to concatenate sequences. Our algorithm shows good scaling
with parallel efficiency up to 80% on 128 nodes, resulting in uniform genome
coverage and showing promising results in terms of assembly quality. Our contig
generation algorithm localizes the assembly process to significantly reduce the
amount of computation spent on this step. Our work is a step forward for
efficient de novo long read assembly of large genomes in a distributed memory.
","[{""version"":""v1"",""created"":""Sun, 10 Jul 2022 00:03:03 GMT""}]","2022-07-12"
"2207.04351","Wayne Hayes","Tingyin Ding, Utsav Jain, Wayne B. Hayes","BLANT: Basic Local Alignment of Network Topology, Part 2: Topology-only
  Extension Beyond Graphlet Seeds","8 pages, 5 Figures, 3 Tables",,,,"q-bio.MN","http://creativecommons.org/licenses/by/4.0/","  BLAST is a standard tool in bioinformatics for creating local sequence
alignments using a ""seed-and-extend"" approach. Here we introduce an analogous
seed-and-extend algorithm that produces local network alignments: BLANT (Basic
Local Alignment of Network Topology). In Part 1, we introduced BLANT-seed,
which generates graphlet-based seeds using only topological information. Here,
in Part 2, we describe BLANT-extend, which ""grows"" seeds to larger local
alignments using only topological information. We allow the user to specify
bounds on several measures an alignment must satisfy, including the edge
density, edge commonality (i.e., aligned edges), and node-pair similarity if
such a measure is used; the latter allows the inclusion of sequence-based
similarity, if desired, as well as local topological constraints. BLANT-extend
is able to enumerate all possible alignments satisfying the bounds that can be
grown from each seed, within a specified CPU time or number of generated
alignments. While topology-driven local network alignment has a wide variety of
potential applications outside bioinformatics, here we focus on the alignment
of Protein-Protein Interaction (PPI) networks. We show that BLANT is capable of
finding large, high-quality local alignments when the networks are known to
have high topological similarity -- for example recovering hundreds of
orthologs between networks of the recent Integrated Interaction Database (IID).
Predictably, however, it performs less well when true topological similarity is
absent, as is the case in most current experimental PPI networks that are noisy
and have wide disparity in edge density which results in low common coverage.
","[{""version"":""v1"",""created"":""Sun, 10 Jul 2022 00:20:24 GMT""}]","2022-07-12"
"2207.04352","Faye Jackson","Faye Jackson and Misheel Otgonbayar","Biases among Congruence Classes for Parts in k-regular Partitions","25 pages, 3 figures",,,,"math.CO math.NT","http://arxiv.org/licenses/nonexclusive-distrib/1.0/","  For integers $k,t \geq 2$ and $1\leq r \leq t$ let $D_k(r,t;n)$ be the number
of parts among all $k$-regular partitions (i.e., partitions of $n$ where all
parts have multiplicity less than $k$) of $n$ that are congruent to $r$ modulo
$t$. Using the circle method, we obtain the asymptotic
  \[
  D_{k}(r,t;n) = \frac{3^{\frac{1}{4}}e^{\pi\sqrt{\frac{2Kn}{3}}}}{\pi t
2^{\frac{3}{4}}K^{\frac{1}{4}}n^{\frac{1}{4}}\sqrt{k}}\left(\log k +
\left(\frac{3\sqrt{K}\log k}{8\sqrt{6}\pi} -
\frac{t\pi(k-1)K^{\frac{1}{2}}}{2\sqrt{6}}\left(\frac{r}{t}-
\frac{1}{2}\right)\right)n^{-\frac{1}{2}} + O(n^{-1})\right),
  \] where $K = 1 - \frac{1}{k}$. The main term of this asymptotic does not
depend on $r$, and so if $P_k(n)$ is the total number of parts among all
$k$-regular partitions of $n$, we have that $\frac{D_k(r,t;n)}{P_k(n)} \to
\frac{1}{t}$ as $n \to \infty$. Thus, in a weak asymptotic sense, the parts are
equidistributed among congruence classes. However, inspection of the lower
order terms indicates a bias towards the lower congruence classes; that is, for
$1\leq r < s \leq t$ we have $D_k(r,t;n) \geq D_k(s,t;n)$ for sufficiently
large $n$. We make this inequality explicit, showing that for $3 \leq k \leq
10$ and $2 \leq t \leq 10$ the inequality $D_k(r,t;n) \geq D_k(s,t;n)$ holds
for all $n \geq 1$ and the strict inequality $D_k(r,t;n) > D_k(s,t;n)$ holds
for all $n \geq 17$.
","[{""version"":""v1"",""created"":""Sun, 10 Jul 2022 00:38:37 GMT""}]","2022-07-12"
"2207.04353","Wayne Hayes","Patrick Wang and Henry Ye and Wayne B Hayes","BLANT: Basic Local Alignment of Network Topology, Part 1: Seeding local
  alignments with unambiguous 8-node graphlets","13 pages, 12 Figures, 2 Tables",,,,"q-bio.MN","http://creativecommons.org/licenses/by/4.0/","  BLAST is a standard tool in bioinformatics for creating local sequence
alignments using a ""seed-and-extend"" approach. Here we introduce an analogous
seed-and-extend algorithm that produces local network alignments: BLANT, for
Basic Local Alignment of Network Topology. This paper introduces BLANT-seed:
given an input graph, BLANT-seed uses network topology alone to create a
limited, high-specificity index of k-node induced subgraphs called k-graphlets
(analogous to BLASTS's k-mers). The index is constructed so that, if
significant common network topology exists between two graphs, their indexes
are likely to overlap. BLANT-seed then queries the indexes of two networks to
generate a list of common k-graphlets which, when paired, form a seed pair. Our
companion paper (submitted elsewhere) describes BLANT-extend, which ""grows""
these seeds to larger local alignments, again using only topological
information.
","[{""version"":""v1"",""created"":""Sun, 10 Jul 2022 00:44:33 GMT""}]","2022-07-12"
"2207.04354","Shagun Sodhani","Shagun Sodhani, Mojtaba Faramarzi, Sanket Vaibhav Mehta, Pranshu
  Malviya, Mohamed Abdelsalam, Janarthanan Janarthanan, Sarath Chandar","An Introduction to Lifelong Supervised Learning","Lifelong Learning Primer",,,,"cs.LG cs.AI","http://creativecommons.org/licenses/by/4.0/","  This primer is an attempt to provide a detailed summary of the different
facets of lifelong learning. We start with Chapter 2 which provides a
high-level overview of lifelong learning systems. In this chapter, we discuss
prominent scenarios in lifelong learning (Section 2.4), provide 8 Introduction
a high-level organization of different lifelong learning approaches (Section
2.5), enumerate the desiderata for an ideal lifelong learning system (Section
2.6), discuss how lifelong learning is related to other learning paradigms
(Section 2.7), describe common metrics used to evaluate lifelong learning
systems (Section 2.8). This chapter is more useful for readers who are new to
lifelong learning and want to get introduced to the field without focusing on
specific approaches or benchmarks. The remaining chapters focus on specific
aspects (either learning algorithms or benchmarks) and are more useful for
readers who are looking for specific approaches or benchmarks. Chapter 3
focuses on regularization-based approaches that do not assume access to any
data from previous tasks. Chapter 4 discusses memory-based approaches that
typically use a replay buffer or an episodic memory to save subset of data
across different tasks. Chapter 5 focuses on different architecture families
(and their instantiations) that have been proposed for training lifelong
learning systems. Following these different classes of learning algorithms, we
discuss the commonly used evaluation benchmarks and metrics for lifelong
learning (Chapter 6) and wrap up with a discussion of future challenges and
important research directions in Chapter 7.
","[{""version"":""v1"",""created"":""Sun, 10 Jul 2022 00:48:42 GMT""},{""version"":""v2"",""created"":""Tue, 12 Jul 2022 15:47:04 GMT""}]","2022-07-13"
"2207.04355","Pin-Gao Gu","Pin-Gao Gu, Che-Yu Chen, Emma Shen, Chien-Chang Yen, Min-Kai Lin","Revealing the drag instability in one-fluid nonideal MHD simulations of
  a 1D isothermal C-shock","19 pages, 10 figures","ApJ 2022, 935, 95","10.3847/1538-4357/ac7de9",,"astro-ph.GA astro-ph.SR physics.flu-dyn physics.plasm-ph","http://creativecommons.org/licenses/by/4.0/","  C-type shocks are believed to be ubiquitous in turbulent molecular clouds
thanks to ambipolar diffusion. We investigate whether the drag instability in
1D isothermal C-shocks, inferred from the local linear theory of Gu & Chen, can
appear in non-ideal magnetohydrodynamic simulations. Two C-shock models (with
narrow and broad steady-state shock widths) are considered to represent the
typical environment of star-forming clouds. The ionization-recombination
equilibrium is adopted for the one-fluid approach. In the 1D simulation, the
inflow gas is continuously perturbed by a sinusoidal density fluctuation with a
constant frequency. The perturbations clearly grow after entering the C-shock
region until they start being damped at the transition to the postshock region.
We show that the profiles of a predominant Fourier mode extracted locally from
the simulated growing perturbation match those of the growing mode derived from
the linear analysis. Moreover, the local growth rate and wave frequency derived
from the predominant mode generally agree with those from the linear theory.
Therefore, we confirm the presence of the drag instability in simulated 1D
isothermal C-shocks. We also explore the nonlinear behavior of the instability
by imposing larger-amplitude perturbations to the simulation. We find that the
drag instability is subject to wave steepening, leading to saturated
perturbation growth. Issues concerning local analysis, nonlinear effects,
one-fluid approach, and astrophysical applications are discussed.
","[{""version"":""v1"",""created"":""Sun, 10 Jul 2022 00:58:15 GMT""},{""version"":""v2"",""created"":""Sat, 20 Aug 2022 00:36:19 GMT""}]","2022-08-23"
"2207.04356","Wen-Chin Huang","Wen-Chin Huang, Shu-Wen Yang, Tomoki Hayashi, Tomoki Toda","A Comparative Study of Self-supervised Speech Representation Based Voice
  Conversion","Accepted to IEEE Journal of Selected Topics in Signal Processing.
  arXiv admin note: substantial text overlap with arXiv:2110.06280",,"10.1109/JSTSP.2022.3193761",,"cs.SD cs.LG eess.AS","http://creativecommons.org/licenses/by/4.0/","  We present a large-scale comparative study of self-supervised speech
representation (S3R)-based voice conversion (VC). In the context of
recognition-synthesis VC, S3Rs are attractive owing to their potential to
replace expensive supervised representations such as phonetic posteriorgrams
(PPGs), which are commonly adopted by state-of-the-art VC systems. Using
S3PRL-VC, an open-source VC software we previously developed, we provide a
series of in-depth objective and subjective analyses under three VC settings:
intra-/cross-lingual any-to-one (A2O) and any-to-any (A2A) VC, using the voice
conversion challenge 2020 (VCC2020) dataset. We investigated S3R-based VC in
various aspects, including model type, multilinguality, and supervision. We
also studied the effect of a post-discretization process with k-means
clustering and showed how it improves in the A2A setting. Finally, the
comparison with state-of-the-art VC systems demonstrates the competitiveness of
S3R-based VC and also sheds light on the possible improving directions.
","[{""version"":""v1"",""created"":""Sun, 10 Jul 2022 01:02:22 GMT""}]","2022-11-23"
