"2207.11669","Wenda Chu","Wenda Chu","Distributed Robust Principal Component Analysis","13 pages",,,,"cs.DC cs.LG","http://creativecommons.org/licenses/by/4.0/","  We study the robust principal component analysis (RPCA) problem in a
distributed setting. The goal of RPCA is to find an underlying low-rank
estimation for a raw data matrix when the data matrix is subject to the
corruption of gross sparse errors. Previous studies have developed RPCA
algorithms that provide stable solutions with fast convergence. However, these
algorithms are typically hard to scale and cannot be implemented distributedly,
due to the use of either SVD or large matrix multiplication. In this paper, we
propose the first distributed robust principal analysis algorithm based on
consensus factorization, dubbed DCF-PCA. We prove the convergence of DCF-PCA
and evaluate DCF-PCA on various problem setting
","[{""version"":""v1"",""created"":""Sun, 24 Jul 2022 05:45:07 GMT""},{""version"":""v2"",""created"":""Sat, 13 Aug 2022 03:59:40 GMT""}]","2022-08-16"
"2207.11670","Haibo Shen","Haibo Shen, Yihao Luo, Xiang Cao, Liangqi Zhang, Juyu Xiao, Tianjiang
  Wang","Training Stronger Spiking Neural Networks with Biomimetic Adaptive
  Internal Association Neurons","Accepted by ICASSP 2023",,,,"cs.NE cs.CV cs.LG q-bio.NC","http://creativecommons.org/licenses/by/4.0/","  As the third generation of neural networks, spiking neural networks (SNNs)
are dedicated to exploring more insightful neural mechanisms to achieve
near-biological intelligence. Intuitively, biomimetic mechanisms are crucial to
understanding and improving SNNs. For example, the associative long-term
potentiation (ALTP) phenomenon suggests that in addition to learning mechanisms
between neurons, there are associative effects within neurons. However, most
existing methods only focus on the former and lack exploration of the internal
association effects. In this paper, we propose a novel Adaptive Internal
Association~(AIA) neuron model to establish previously ignored influences
within neurons. Consistent with the ALTP phenomenon, the AIA neuron model is
adaptive to input stimuli, and internal associative learning occurs only when
both dendrites are stimulated at the same time. In addition, we employ weighted
weights to measure internal associations and introduce intermediate caches to
reduce the volatility of associations. Extensive experiments on prevailing
neuromorphic datasets show that the proposed method can potentiate or depress
the firing of spikes more specifically, resulting in better performance with
fewer spikes. It is worth noting that without adding any parameters at
inference, the AIA model achieves state-of-the-art performance on
DVS-CIFAR10~(83.9\%) and N-CARS~(95.64\%) datasets.
","[{""version"":""v1"",""created"":""Sun, 24 Jul 2022 06:12:23 GMT""},{""version"":""v2"",""created"":""Tue, 14 Mar 2023 02:51:07 GMT""}]","2023-03-15"
"2207.11671","Takahiro Morishita","Takahiro Morishita (IPAC), Massimo Stiavelli (STScI)","Physical Characterization of Early Galaxies in the Webb's First Deep
  Field SMACS J0723.3-7323","Resubmitted to ApJL after having addressed the reviewer's comments.
  This version includes a few updates, 1. identification of z>10 galaxy
  candidates, 2. estimates of number densities, and 3. comparison of the final
  candidates to those in other studies, all of which were pointed out during
  the review process. The analyses in this version are based on the latest
  stable version of NIRCam zeropoints",,"10.3847/2041-8213/acbf50",,"astro-ph.GA","http://creativecommons.org/licenses/by/4.0/","  This paper highlights initial photometric analyses of JWST NIRCam imaging
data in the sightline of SMACS0723, aiming to identify galaxies at redshift
$z>7$. By applying a conservative Lyman-break selection followed by photometric
redshift analysis and visual inspection, we identify four F090W-dropout and two
F150W-dropout sources, three of which were recently confirmed in an independent
spectroscopic analysis to $z=7.663$, 7.665, and 8.499. We then supplement our
sample with a photometric-redshift selection, and identify five additional
candidates at $7<z_{\rm phot}<13$. The NIRCam images clearly resolve all
sources and reveal their sub-galactic components that were not
resolved/detected in the previous imaging by Hubble Space Telescope. Our
spectral energy distribution analysis reveals that the selected galaxies are
characterized by young stellar populations (median age of $\sim50$ Myr) of
sub-solar metallicity ($\sim0.2\,Z_\odot$) and little dust attenuation
($A_{V}\sim0.5$). In several cases, we observe extreme Hb+[OIII] lines being
captured in the F444W band and seen as color excess, which is consistent with
their observed high star formation rate surface density. Eight of the 11
sources identified in this study appear in at least one of the recent studies
of the same fields (Adams et al., Atek et al., Donnan et al., Harikane et al.,
Yan et al.), implying the high fidelity of our selection. We cross-match all
high-$z$ galaxy candidates presented in the five studies with our catalog and
discuss the possible causes of discrepancy in the final lists.
","[{""version"":""v1"",""created"":""Sun, 24 Jul 2022 06:30:59 GMT""},{""version"":""v2"",""created"":""Thu, 1 Dec 2022 20:54:37 GMT""}]","2023-04-12"
"2207.11672","Ezekiel Olayiwola Arogunjo","Ezekiel Olayiwola Arogunjo, Joseph Olorunfemi Ojo","An Insight into the Dynamics of a Dual Active Bridge",,,,,"eess.SY cs.SY","http://arxiv.org/licenses/nonexclusive-distrib/1.0/","  This paper aims at analyzing the effect of the zero dynamics of the Dual
Active Bridge Isolated Bidirectional dc-dc converter (DAB) on the dynamics of
the complete DAB system. It also explains its influence on controller design
for the DAB system. In carrying out these analyses, the state space model of
the DAB, as well as the first harmonic approximation (FHA) of the model are
derived. The ZVS and the stability analysis of the system are undertaken based
on the FHA model of the system. The system is shown to be stable for a constant
output voltage operation for the entire power range while it is unstable for
the constant power load (CPL) operation for load demands close to the system
maximum power. It is also shown that the transformer winding currents are part
of the zero dynamic states and are always stable regardless of the operating
conditions of the system.
","[{""version"":""v1"",""created"":""Sun, 24 Jul 2022 06:41:48 GMT""},{""version"":""v2"",""created"":""Tue, 2 Aug 2022 19:29:57 GMT""}]","2022-08-04"
"2207.11673","Hansi Yang","Hansi Yang, Yongqi Zhang, Quanming Yao","AutoWeird: Weird Translational Scoring Function Identified by Random
  Search",,,,,"cs.AI cs.CL","http://creativecommons.org/licenses/by-sa/4.0/","  Scoring function (SF) measures the plausibility of triplets in knowledge
graphs. Different scoring functions can lead to huge differences in link
prediction performances on different knowledge graphs. In this report, we
describe a weird scoring function found by random search on the open graph
benchmark (OGB). This scoring function, called AutoWeird, only uses tail entity
and relation in a triplet to compute its plausibility score. Experimental
results show that AutoWeird achieves top-1 performance on ogbl-wikikg2 data
set, but has much worse performance than other methods on ogbl-biokg data set.
By analyzing the tail entity distribution and evaluation protocol of these two
data sets, we attribute the unexpected success of AutoWeird on ogbl-wikikg2 to
inappropriate evaluation and concentrated tail entity distribution. Such
results may motivate further research on how to accurately evaluate the
performance of different link prediction methods for knowledge graphs.
","[{""version"":""v1"",""created"":""Sun, 24 Jul 2022 06:43:06 GMT""}]","2022-07-26"
"2207.11674","Anbang Wu","Anbang Wu, Hezi Zhang, Gushu Li, Alireza Shabani, Yuan Xie, Yufei Ding","AutoComm: A Framework for Enabling Efficient Communication in
  Distributed Quantum Programs","The original version. The paper is accepted to MICRO 2022",,,,"quant-ph","http://creativecommons.org/licenses/by/4.0/","  Distributed quantum computing (DQC) is a promising approach to extending the
computational power of near-term quantum devices. However, the non-local
quantum communication between quantum devices is much more expensive and
error-prone than the local quantum communication within each quantum device.
Previous work on the DQC communication optimization focus on optimizing the
communication protocol for each individual non-local gate and then adopt
quantum compilation designs which are designed for local multi-qubit gates
(such as controlled-x or CX gates) in a single quantum computer. The
communication patterns in distributed quantum programs are not yet well
studied, leading to a far-from-optimal communication cost. In this paper, we
identify burst communication, a specific qubit-node communication pattern that
widely exists in many distributed programs and can be leveraged to guide
communication overhead optimization. We then propose AutoComm, an automatic
compiler framework to first extract the burst communication patterns from the
input programs, and then optimize the communication steps of burst
communication discovered. Experimental results show that our proposed AutoComm
can reduce the communication resource consumption and the program latency by
75.6% and 71.4% on average, respectively.
","[{""version"":""v1"",""created"":""Sun, 24 Jul 2022 06:49:58 GMT""},{""version"":""v2"",""created"":""Fri, 21 Oct 2022 21:01:07 GMT""}]","2022-10-25"
"2207.11675","Kazem Ardaneh","Kazem Ardaneh, Mostafa Hassan, Benoit Morel, Remi Meyer, Remo Giust,
  Arnaud Couairon, Guy Bonnaud, Francois Courvoisier","Femtosecond laser-induced sub-wavelength plasma inside dielectrics: II.
  Second-harmonic generation","10 pages, 4 figures, published in Physics of Plasmas","Phys. Plasmas 29, 072716 (2022)","10.1063/5.0090270",,"physics.plasm-ph physics.comp-ph physics.optics","http://creativecommons.org/licenses/by/4.0/","  Second-harmonic emission at a frequency that is twice the laser frequency is
an important diagnostic for nonlinear laser-plasma interaction. It is forbidden
for centrosymmetric materials such as the bulk of sapphire. The symmetry,
however, can be broken by dielectric discontinuities as a result of plasma
generation inside a solid dielectric. In the present work, we explore the basic
characteristics of experimentally observed second-harmonic emission during
focusing a femtosecond Bessel beam inside sapphire. We employ three-dimensional
particle-in-cell simulations and the Helmholtz wave equation for theoretical
investigations. We analyze how the efficiency of second-harmonic generation and
its polarization depend on the plasma parameters. We find that the
second-harmonic is generated either due to the coalescence of two surface
electromagnetic waves or nonlinear interaction between the transverse
electromagnetic wave and the longitudinal electron plasma wave driven by linear
mode conversion. Experimental results agree with the theoretical predictions
and confirm the existence of over-critical plasma inside the sapphire that is
essential for the resonance of plasma waves or excitation of surface plasmons.
","[{""version"":""v1"",""created"":""Sun, 24 Jul 2022 06:53:29 GMT""},{""version"":""v2"",""created"":""Fri, 29 Jul 2022 19:07:16 GMT""}]","2022-08-02"
"2207.11676","Ezekiel Olayiwola Arogunjo","Ezekiel Olayiwola Arogunjo, Olivia Nnadi, Joseph Olorunfemi Ojo","Harmonic-Balance Based Power Flow and ZVS Analysis of a Quad-Active
  Bridge DC-DC Converter",,,,,"eess.SY cs.SY","http://arxiv.org/licenses/nonexclusive-distrib/1.0/","  The power flow control of multi-active bridge converters requires a
comprehensive steady-state analysis of the converter and the determination of
conditions for zero voltage switching of all switching in the converter which
result in minimum switching loss. This paper aims to model and carry out the
power flow and Zero Voltage Switching (ZVS) analyses of Quad-active-bridge
(QAB) dc-dc converter. The dynamic as well as the steady state analyses of the
converter were carried out, thereby determining the phase shifts required to
meet commanded load powers. The full equivalent circuit model of the converter
which include winding resistances and magnetizing inductances is used rather
than the popular lossless star-equivalent circuit model that may introduce
significant error in the converter's analysis. The conditions which ensure the
converter working in ZVS mode are determined and experimentally verified.
","[{""version"":""v1"",""created"":""Sun, 24 Jul 2022 06:56:19 GMT""}]","2022-07-26"
"2207.11677","Mang Ye","Junwu Zhang, Mang Ye, Yao Yang","Learnable Privacy-Preserving Anonymization for Pedestrian Images","Accepted by ACMMM2022 \url{https://github.com/whuzjw/privacy-reid}",,"10.1145/3503161.3548766",,"cs.CV cs.MM","http://creativecommons.org/licenses/by/4.0/","  This paper studies a novel privacy-preserving anonymization problem for
pedestrian images, which preserves personal identity information (PII) for
authorized models and prevents PII from being recognized by third parties.
Conventional anonymization methods unavoidably cause semantic information loss,
leading to limited data utility. Besides, existing learned anonymization
techniques, while retaining various identity-irrelevant utilities, will change
the pedestrian identity, and thus are unsuitable for training robust
re-identification models. To explore the privacy-utility trade-off for
pedestrian images, we propose a joint learning reversible anonymization
framework, which can reversibly generate full-body anonymous images with little
performance drop on person re-identification tasks. The core idea is that we
adopt desensitized images generated by conventional methods as the initial
privacy-preserving supervision and jointly train an anonymization encoder with
a recovery decoder and an identity-invariant model. We further propose a
progressive training strategy to improve the performance, which iteratively
upgrades the initial anonymization supervision. Experiments further demonstrate
the effectiveness of our anonymized pedestrian images for privacy protection,
which boosts the re-identification performance while preserving privacy. Code
is available at \url{https://github.com/whuzjw/privacy-reid}.
","[{""version"":""v1"",""created"":""Sun, 24 Jul 2022 07:04:16 GMT""}]","2022-07-26"
"2207.11678","Hongming Shan","Zilong Li, Qi Gao, Yaping Wu, Chuang Niu, Junping Zhang, Meiyun Wang,
  Ge Wang, Hongming Shan","Quad-Net: Quad-domain Network for CT Metal Artifact Reduction",,,,,"eess.IV cs.CV","http://creativecommons.org/licenses/by-nc-nd/4.0/","  Metal implants and other high-density objects in patients introduce severe
streaking artifacts in CT images, compromising image quality and diagnostic
performance. Although various methods were developed for CT metal artifact
reduction over the past decades, including the latest dual-domain deep
networks, remaining metal artifacts are still clinically challenging in many
cases. Here we extend the state-of-the-art dual-domain deep network approach
into a quad-domain counterpart so that all the features in the sinogram, image,
and their corresponding Fourier domains are synergized to eliminate metal
artifacts optimally without compromising structural subtleties. Our proposed
quad-domain network for MAR, referred to as Quad-Net, takes little additional
computational cost since the Fourier transform is highly efficient, and works
across the four receptive fields to learn both global and local features as
well as their relations. Specifically, we first design a Sinogram-Fourier
Restoration Network (SFR-Net) in the sinogram domain and its Fourier space to
faithfully inpaint metal-corrupted traces. Then, we couple SFR-Net with an
Image-Fourier Refinement Network (IFR-Net) which takes both an image and its
Fourier spectrum to improve a CT image reconstructed from the SFR-Net output
using cross-domain contextual information. Quad-Net is trained on clinical
datasets to minimize a composite loss function. Quad-Net does not require
precise metal masks, which is of great importance in clinical practice. Our
experimental results demonstrate the superiority of Quad-Net over the
state-of-the-art MAR methods quantitatively, visually, and statistically. The
Quad-Net code is publicly available at
https://github.com/longzilicart/Quad-Net.
","[{""version"":""v1"",""created"":""Sun, 24 Jul 2022 07:20:39 GMT""},{""version"":""v2"",""created"":""Thu, 1 Jun 2023 01:52:26 GMT""}]","2023-06-02"
"2207.11679","Yifan Li","Yifan Li, Haomiao Sun, Zhaori Liu, Hu Han","Affective Behaviour Analysis Using Pretrained Model with Facial Priori",,,,,"cs.CV","http://creativecommons.org/licenses/by/4.0/","  Affective behaviour analysis has aroused researchers' attention due to its
broad applications. However, it is labor exhaustive to obtain accurate
annotations for massive face images. Thus, we propose to utilize the prior
facial information via Masked Auto-Encoder (MAE) pretrained on unlabeled face
images. Furthermore, we combine MAE pretrained Vision Transformer (ViT) and
AffectNet pretrained CNN to perform multi-task emotion recognition. We notice
that expression and action unit (AU) scores are pure and intact features for
valence-arousal (VA) regression. As a result, we utilize AffectNet pretrained
CNN to extract expression scores concatenating with expression and AU scores
from ViT to obtain the final VA features. Moreover, we also propose a
co-training framework with two parallel MAE pretrained ViT for expression
recognition tasks. In order to make the two views independent, we random mask
most patches during the training process. Then, JS divergence is performed to
make the predictions of the two views as consistent as possible. The results on
ABAW4 show that our methods are effective.
","[{""version"":""v1"",""created"":""Sun, 24 Jul 2022 07:28:08 GMT""},{""version"":""v2"",""created"":""Sat, 17 Sep 2022 10:36:48 GMT""}]","2022-09-20"
"2207.11680","Chaozheng Wang","Chaozheng Wang, Yuanhang Yang, Cuiyun Gao, Yun Peng, Hongyu Zhang,
  Michael R. Lyu","No More Fine-Tuning? An Experimental Evaluation of Prompt Tuning in Code
  Intelligence","Accepted in ESEC/FSE 2022",,"10.1145/3540250.3549113",,"cs.SE cs.AI","http://arxiv.org/licenses/nonexclusive-distrib/1.0/","  Pre-trained models have been shown effective in many code intelligence tasks.
These models are pre-trained on large-scale unlabeled corpus and then
fine-tuned in downstream tasks. However, as the inputs to pre-training and
downstream tasks are in different forms, it is hard to fully explore the
knowledge of pre-trained models. Besides, the performance of fine-tuning
strongly relies on the amount of downstream data, while in practice, the
scenarios with scarce data are common. Recent studies in the natural language
processing (NLP) field show that prompt tuning, a new paradigm for tuning,
alleviates the above issues and achieves promising results in various NLP
tasks. In prompt tuning, the prompts inserted during tuning provide
task-specific knowledge, which is especially beneficial for tasks with
relatively scarce data. In this paper, we empirically evaluate the usage and
effect of prompt tuning in code intelligence tasks. We conduct prompt tuning on
popular pre-trained models CodeBERT and CodeT5 and experiment with three code
intelligence tasks including defect prediction, code summarization, and code
translation. Our experimental results show that prompt tuning consistently
outperforms fine-tuning in all three tasks. In addition, prompt tuning shows
great potential in low-resource scenarios, e.g., improving the BLEU scores of
fine-tuning by more than 26\% on average for code summarization. Our results
suggest that instead of fine-tuning, we could adapt prompt tuning for code
intelligence tasks to achieve better performance, especially when lacking
task-specific data.
","[{""version"":""v1"",""created"":""Sun, 24 Jul 2022 07:29:17 GMT""}]","2022-07-26"
"2207.11681","Yongcheng Jing","Yongcheng Jing, Yining Mao, Yiding Yang, Yibing Zhan, Mingli Song,
  Xinchao Wang, Dacheng Tao","Learning Graph Neural Networks for Image Style Transfer","Accepted to ECCV 2022",,,,"cs.CV","http://arxiv.org/licenses/nonexclusive-distrib/1.0/","  State-of-the-art parametric and non-parametric style transfer approaches are
prone to either distorted local style patterns due to global statistics
alignment, or unpleasing artifacts resulting from patch mismatching. In this
paper, we study a novel semi-parametric neural style transfer framework that
alleviates the deficiency of both parametric and non-parametric stylization.
The core idea of our approach is to establish accurate and fine-grained
content-style correspondences using graph neural networks (GNNs). To this end,
we develop an elaborated GNN model with content and style local patches as the
graph vertices. The style transfer procedure is then modeled as the
attention-based heterogeneous message passing between the style and content
nodes in a learnable manner, leading to adaptive many-to-one style-content
correlations at the local patch level. In addition, an elaborated deformable
graph convolutional operation is introduced for cross-scale style-content
matching. Experimental results demonstrate that the proposed semi-parametric
image stylization approach yields encouraging results on the challenging style
patterns, preserving both global appearance and exquisite details. Furthermore,
by controlling the number of edges at the inference stage, the proposed method
also triggers novel functionalities like diversified patch-based stylization
with a single model.
","[{""version"":""v1"",""created"":""Sun, 24 Jul 2022 07:41:31 GMT""},{""version"":""v2"",""created"":""Mon, 13 Feb 2023 09:46:49 GMT""}]","2023-02-14"
"2207.11682","Paolo Girardi PhD","Victor Muthama Musau, Carlo Gaetan and Paolo Girardi","Clustering of bivariate satellite time series: a quantile approach",,,,,"stat.ME stat.AP","http://creativecommons.org/licenses/by-sa/4.0/","  Clustering has received much attention in Statistics and Machine learning
with the aim of developing statistical models and autonomous algorithms which
are capable of acquiring information from raw data in order to perform
exploratory analysis.Several techniques have been developed to cluster sampled
univariate vectors only considering the average value over the whole period and
as such they have not been able to explore fully the underlying distribution as
well as other features of the data, especially in presence of structured time
series. We propose a model-based clustering technique that is based on quantile
regression permitting us to cluster bivariate time series at different quantile
levels. We model the within cluster density using asymmetric Laplace
distribution allowing us to take into account asymmetry in the distribution of
the data. We evaluate the performance of the proposed technique through a
simulation study. The method is then applied to cluster time series observed
from Glob-colour satellite data related to trophic status indices with aim of
evaluating their temporal dynamics in order to identify homogeneous areas, in
terms of trophic status, in the Gulf of Gabes.
","[{""version"":""v1"",""created"":""Sun, 24 Jul 2022 07:45:05 GMT""}]","2022-07-26"
"2207.11683","Zihang Xu","Zihang Xu, Zhenghua Xu, Shuo Zhang, Thomas Lukasiewicz","PCA: Semi-supervised Segmentation with Patch Confidence Adversarial
  Training",,,,,"eess.IV cs.CV cs.LG","http://creativecommons.org/licenses/by/4.0/","  Deep learning based semi-supervised learning (SSL) methods have achieved
strong performance in medical image segmentation, which can alleviate doctors'
expensive annotation by utilizing a large amount of unlabeled data. Unlike most
existing semi-supervised learning methods, adversarial training based methods
distinguish samples from different sources by learning the data distribution of
the segmentation map, leading the segmenter to generate more accurate
predictions. We argue that the current performance restrictions for such
approaches are the problems of feature extraction and learning preference. In
this paper, we propose a new semi-supervised adversarial method called Patch
Confidence Adversarial Training (PCA) for medical image segmentation. Rather
than single scalar classification results or pixel-level confidence maps, our
proposed discriminator creates patch confidence maps and classifies them at the
scale of the patches. The prediction of unlabeled data learns the pixel
structure and context information in each patch to get enough gradient
feedback, which aids the discriminator in convergent to an optimal state and
improves semi-supervised segmentation performance. Furthermore, at the
discriminator's input, we supplement semantic information constraints on
images, making it simpler for unlabeled data to fit the expected data
distribution. Extensive experiments on the Automated Cardiac Diagnosis
Challenge (ACDC) 2017 dataset and the Brain Tumor Segmentation (BraTS) 2019
challenge dataset show that our method outperforms the state-of-the-art
semi-supervised methods, which demonstrates its effectiveness for medical image
segmentation.
","[{""version"":""v1"",""created"":""Sun, 24 Jul 2022 07:45:47 GMT""}]","2022-07-26"
