"2207.11717","Jason Armitage","Jason Armitage, Leonardo Impett, Rico Sennrich","A Priority Map for Vision-and-Language Navigation with Trajectory Plans
  and Feature-Location Cues","Accepted to WACV 2023",,,,"cs.LG","http://creativecommons.org/licenses/by/4.0/","  In a busy city street, a pedestrian surrounded by distractions can pick out a
single sign if it is relevant to their route. Artificial agents in outdoor
Vision-and-Language Navigation (VLN) are also confronted with detecting
supervisory signal on environment features and location in inputs. To boost the
prominence of relevant features in transformer-based architectures without
costly preprocessing and pretraining, we take inspiration from priority maps -
a mechanism described in neuropsychological studies. We implement a novel
priority map module and pretrain on auxiliary tasks using low-sample datasets
with high-level representations of routes and environment-related references to
urban features. A hierarchical process of trajectory planning - with subsequent
parameterised visual boost filtering on visual inputs and prediction of
corresponding textual spans - addresses the core challenges of cross-modal
alignment and feature-level localisation. The priority map module is integrated
into a feature-location framework that doubles the task completion rates of
standalone transformers and attains state-of-the-art performance on the
Touchdown benchmark for VLN. Code and data are referenced in Appendix C.
","[{""version"":""v1"",""created"":""Sun, 24 Jul 2022 11:09:45 GMT""},{""version"":""v2"",""created"":""Sat, 3 Sep 2022 10:52:50 GMT""},{""version"":""v3"",""created"":""Sat, 22 Oct 2022 11:32:22 GMT""},{""version"":""v4"",""created"":""Fri, 18 Nov 2022 11:24:07 GMT""}]","2022-11-21"
"2207.11718","Prasun Roy","Prasun Roy, Subhankar Ghosh, Saumik Bhattacharya, Umapada Pal, Michael
  Blumenstein","TIPS: Text-Induced Pose Synthesis","Accepted in The European Conference on Computer Vision (ECCV) 2022",,,,"cs.CV cs.MM","http://creativecommons.org/licenses/by/4.0/","  In computer vision, human pose synthesis and transfer deal with probabilistic
image generation of a person in a previously unseen pose from an already
available observation of that person. Though researchers have recently proposed
several methods to achieve this task, most of these techniques derive the
target pose directly from the desired target image on a specific dataset,
making the underlying process challenging to apply in real-world scenarios as
the generation of the target image is the actual aim. In this paper, we first
present the shortcomings of current pose transfer algorithms and then propose a
novel text-based pose transfer technique to address those issues. We divide the
problem into three independent stages: (a) text to pose representation, (b)
pose refinement, and (c) pose rendering. To the best of our knowledge, this is
one of the first attempts to develop a text-based pose transfer framework where
we also introduce a new dataset DF-PASS, by adding descriptive pose annotations
for the images of the DeepFashion dataset. The proposed method generates
promising results with significant qualitative and quantitative scores in our
experiments.
","[{""version"":""v1"",""created"":""Sun, 24 Jul 2022 11:14:46 GMT""}]","2022-07-26"
"2207.11719","Can Chen","Can Chen, Xi Chen, Chen Ma, Zixuan Liu, Xue Liu","Gradient-based Bi-level Optimization for Deep Learning: A Survey","AI4Science; Bi-level Optimization; Hyperparameter Optimization; Meta
  Learning; Implicit Function",,,,"cs.LG math.OC","http://creativecommons.org/licenses/by-nc-nd/4.0/","  Bi-level optimization, especially the gradient-based category, has been
widely used in the deep learning community including hyperparameter
optimization and meta knowledge extraction. Bi-level optimization embeds one
problem within another and the gradient-based category solves the outer level
task by computing the hypergradient, which is much more efficient than
classical methods such as the evolutionary algorithm. In this survey, we first
give a formal definition of the gradient-based bi-level optimization. Secondly,
we illustrate how to formulate a research problem as a bi-level optimization
problem, which is of great practical use for beginners. More specifically,
there are two formulations: the single-task formulation to optimize
hyperparameters such as regularization parameters and the distilled data, and
the multi-task formulation to extract meta knowledge such as the model
initialization. With a bi-level formulation, we then discuss four bi-level
optimization solvers to update the outer variable including explicit gradient
update, proxy update, implicit function update, and closed-form update. Last
but not least, we conclude the survey by pointing out the great potential of
gradient-based bi-level optimization on science problems (AI4Science).
","[{""version"":""v1"",""created"":""Sun, 24 Jul 2022 11:23:31 GMT""},{""version"":""v2"",""created"":""Thu, 4 Aug 2022 11:22:23 GMT""},{""version"":""v3"",""created"":""Tue, 7 Feb 2023 15:15:36 GMT""}]","2023-02-08"
"2207.11720","Xuqian Ren","Xuqian Ren, Saihui Hou, Chunshui Cao, Xu Liu and Yongzhen Huang","Progressive Feature Learning for Realistic Cloth-Changing Gait
  Recognition",,,,,"cs.CV cs.LG","http://arxiv.org/licenses/nonexclusive-distrib/1.0/","  Gait recognition is instrumental in crime prevention and social security, for
it can be conducted at a long distance without the cooperation of subjects.
However, existing datasets and methods cannot deal with the most challenging
problem in realistic gait recognition effectively: walking in different clothes
(CL). In order to tackle this problem, we propose two benchmarks: CASIA-BN-RCC
and OUMVLP-RCC, to simulate the cloth-changing condition in practice. The two
benchmarks can force the algorithm to realize cross-view and cross-cloth with
two sub-datasets. Furthermore, we propose a new framework that can be applied
with off-the-shelf backbones to improve its performance in the Realistic
Cloth-Changing problem with Progressive Feature Learning. Specifically, in our
framework, we design Progressive Mapping and Progressive Uncertainty to extract
the cross-view features and then extract cross-cloth features on the basis. In
this way, the features from the cross-view sub-dataset can first dominate the
feature space and relieve the uneven distribution caused by the adverse effect
from the cross-cloth sub-dataset. The experiments on our benchmarks show that
our framework can effectively improve the recognition performance in CL
conditions. Our codes and datasets will be released after accepted.
","[{""version"":""v1"",""created"":""Sun, 24 Jul 2022 11:26:53 GMT""}]","2022-07-26"
"2207.11721","Shu-Min Wu","Shu-Min Wu, Chun-Xu Wang, Dan-Dan Liu, Xiao-Li Huang, Hao-Sheng Zeng","Would quantum coherence be increased by curvature effect in de Sitter
  space?","24 pages, 5 figures","JHEP 02 (2023) 115","10.1007/JHEP02(2023)115",,"gr-qc hep-th quant-ph","http://creativecommons.org/licenses/by/4.0/","  We study the quantum coherence in de Sitter space for the bipartite system of
Alice and Bob who initially share an entangled state between the two modes of a
free massive scalar field. It is shown that the space-curvature effect can
produce both local coherence and correlated coherence, leading to the increase
of the total coherence of the bipartite system. These results are sharp
different from the Unruh effect or Hawking effect, which, in the single mode
approximation, cannot produce local coherence and at the same time destroy
correlated coherence, leading to the decrease of the total coherence of the
bipartite systems. Interestingly, we find that quantum coherence has the
opposite behavior compared with the quantum correlation in de Sitter space. We
also find that quantum coherence is most severely affected by the curvature
effect of de Sitter space for the cases of conformal invariance and
masslessness. Our result reveals the difference between the curvature effect in
the de Sitter space and the Unruh effect in Rindler spacetime or the Hawking
effect in black hole spacetime on quantum coherence.
","[{""version"":""v1"",""created"":""Sun, 24 Jul 2022 11:35:06 GMT""},{""version"":""v2"",""created"":""Sun, 12 Feb 2023 08:25:04 GMT""}]","2023-03-01"
"2207.11722","Xuqian Ren","Xuqian Ren, Yifan Liu","Semantic-guided Multi-Mask Image Harmonization",,,,,"cs.CV eess.IV","http://arxiv.org/licenses/nonexclusive-distrib/1.0/","  Previous harmonization methods focus on adjusting one inharmonious region in
an image based on an input mask. They may face problems when dealing with
different perturbations on different semantic regions without available input
masks. To deal with the problem that one image has been pasted with several
foregrounds coming from different images and needs to harmonize them towards
different domain directions without any mask as input, we propose a new
semantic-guided multi-mask image harmonization task. Different from the
previous single-mask image harmonization task, each inharmonious image is
perturbed with different methods according to the semantic segmentation masks.
Two challenging benchmarks, HScene and HLIP, are constructed based on $150$ and
$19$ semantic classes, respectively. Furthermore, previous baselines focus on
regressing the exact value for each pixel of the harmonized images. The
generated results are in the `black box' and cannot be edited. In this work, we
propose a novel way to edit the inharmonious images by predicting a series of
operator masks. The masks indicate the level and the position to apply a
certain image editing operation, which could be the brightness, the saturation,
and the color in a specific dimension. The operator masks provide more
flexibility for users to edit the image further. Extensive experiments verify
that the operator mask-based network can further improve those state-of-the-art
methods which directly regress RGB images when the perturbations are
structural. Experiments have been conducted on our constructed benchmarks to
verify that our proposed operator mask-based framework can locate and modify
the inharmonious regions in more complex scenes. Our code and models are
available at
https://github.com/XuqianRen/Semantic-guided-Multi-mask-Image-Harmonization.git.
","[{""version"":""v1"",""created"":""Sun, 24 Jul 2022 11:48:49 GMT""}]","2022-07-26"
"2207.11723","Najma Taimoor","Najma Taimoor and Semeen Rehman","On the Validation of Multi-Level Personalised Health Condition Model",,,,,"cs.SE cs.LO","http://creativecommons.org/licenses/by/4.0/","  This paper presents a verification-based methodology to validate the model of
personalized health conditions. The model identifies the values that may result
in unsafe, un-reachable, in-exhaustive, and overlapping states that otherwise
threaten patients' life by producing false alarms by accepting suspicious
behaviour of the target health condition. Contemporary approaches to validating
a model employ various testing, simulation and model checking techniques to
recognise such values and corresponding vulnerabilities. However, these
approaches are neither systematic nor exhaustive and thus fail to identify
those false values or vulnerabilities that estimate the health condition at
run-time based on the sensor or input data received from various IoT medical
devices. We have demonstrated the validation methodology by validating our
example multi-level model that describes three different scenarios of Diabetes
health conditions.
","[{""version"":""v1"",""created"":""Sun, 24 Jul 2022 11:51:52 GMT""}]","2022-07-26"
"2207.11724","Zirui Li","Xianqi He, Lin Yang, Chao Lu, Zirui Li, Jianwei Gong","Adaptive Decision Making at the Intersection for Autonomous Vehicles
  Based on Skill Discovery","Accepted by IEEE ITSC 2022",,,,"cs.RO cs.AI","http://creativecommons.org/licenses/by/4.0/","  In urban environments, the complex and uncertain intersection scenarios are
challenging for autonomous driving. To ensure safety, it is crucial to develop
an adaptive decision making system that can handle the interaction with other
vehicles. Manually designed model-based methods are reliable in common
scenarios. But in uncertain environments, they are not reliable, so
learning-based methods are proposed, especially reinforcement learning (RL)
methods. However, current RL methods need retraining when the scenarios change.
In other words, current RL methods cannot reuse accumulated knowledge. They
forget learned knowledge when new scenarios are given. To solve this problem,
we propose a hierarchical framework that can autonomously accumulate and reuse
knowledge. The proposed method combines the idea of motion primitives (MPs)
with hierarchical reinforcement learning (HRL). It decomposes complex problems
into multiple basic subtasks to reduce the difficulty. The proposed method and
other baseline methods are tested in a challenging intersection scenario based
on the CARLA simulator. The intersection scenario contains three different
subtasks that can reflect the complexity and uncertainty of real traffic flow.
After offline learning and testing, the proposed method is proved to have the
best performance among all methods.
","[{""version"":""v1"",""created"":""Sun, 24 Jul 2022 11:56:45 GMT""}]","2022-07-26"
"2207.11725","Shai Bagon","Eyal Naor and Itai Antebi and Shai Bagon and Michal Irani","Combining Internal and External Constraints for Unrolling Shutter in
  Videos","Accepted to ECCV 2022",,,,"cs.CV","http://creativecommons.org/licenses/by-nc-nd/4.0/","  Videos obtained by rolling-shutter (RS) cameras result in spatially-distorted
frames. These distortions become significant under fast camera/scene motions.
Undoing effects of RS is sometimes addressed as a spatial problem, where
objects need to be rectified/displaced in order to generate their correct
global shutter (GS) frame. However, the cause of the RS effect is inherently
temporal, not spatial. In this paper we propose a space-time solution to the RS
problem. We observe that despite the severe differences between their xy
frames, a RS video and its corresponding GS video tend to share the exact same
xt slices -- up to a known sub-frame temporal shift. Moreover, they share the
same distribution of small 2D xt-patches, despite the strong temporal aliasing
within each video. This allows to constrain the GS output video using
video-specific constraints imposed by the RS input video. Our algorithm is
composed of 3 main components: (i) Dense temporal upsampling between
consecutive RS frames using an off-the-shelf method, (which was trained on
regular video sequences), from which we extract GS ""proposals"". (ii) Learning
to correctly merge an ensemble of such GS ""proposals"" using a dedicated
MergeNet. (iii) A video-specific zero-shot optimization which imposes the
similarity of xt-patches between the GS output video and the RS input video.
Our method obtains state-of-the-art results on benchmark datasets, both
numerically and visually, despite being trained on a small synthetic RS/GS
dataset. Moreover, it generalizes well to new complex RS videos with motion
types outside the distribution of the training set (e.g., complex non-rigid
motions) -- videos which competing methods trained on much more data cannot
handle well. We attribute these generalization capabilities to the combination
of external and internal constraints.
","[{""version"":""v1"",""created"":""Sun, 24 Jul 2022 12:01:27 GMT""}]","2022-07-26"
"2207.11726","Tarek A. Elsayed Dr","Tarek A. Elsayed","Measurement-based cooling of many-body quantum systems","6 pages, 3 figures",,,,"quant-ph cond-mat.stat-mech","http://arxiv.org/licenses/nonexclusive-distrib/1.0/","  We introduce a new technique for cooling many-body quantum systems of unknown
Hamiltonians to their ground states with a high fidelity. The technique works
by switching on a strong field and applying a sequence of projective
measurements and RF pulses to polarize the system along the direction of the
external field before we adiabatically switch the field off. The evolution of
the system towards its ground state is governed by the quantum adiabatic
theorem. The proposed technique is particularly relevant to the field of NMR
state preparation. We present numerical simulation results for the technique
applied to quantum spin chains with long and short range interactions.
","[{""version"":""v1"",""created"":""Sun, 24 Jul 2022 12:06:04 GMT""}]","2022-07-26"
"2207.11727","Nikolaos Tsilivis","Nikolaos Tsilivis, Jingtong Su, Julia Kempe","Can we achieve robustness from data alone?",,,,,"cs.LG cs.CV","http://creativecommons.org/licenses/by/4.0/","  We introduce a meta-learning algorithm for adversarially robust
classification. The proposed method tries to be as model agnostic as possible
and optimizes a dataset prior to its deployment in a machine learning system,
aiming to effectively erase its non-robust features. Once the dataset has been
created, in principle no specialized algorithm (besides standard gradient
descent) is needed to train a robust model. We formulate the data optimization
procedure as a bi-level optimization problem on kernel regression, with a class
of kernels that describe infinitely wide neural nets (Neural Tangent Kernels).
We present extensive experiments on standard computer vision benchmarks using a
variety of different models, demonstrating the effectiveness of our method,
while also pointing out its current shortcomings. In parallel, we revisit prior
work that also focused on the problem of data optimization for robust
classification \citep{Ily+19}, and show that being robust to adversarial
attacks after standard (gradient descent) training on a suitable dataset is
more challenging than previously thought.
","[{""version"":""v1"",""created"":""Sun, 24 Jul 2022 12:14:48 GMT""},{""version"":""v2"",""created"":""Tue, 31 Jan 2023 02:09:16 GMT""}]","2023-02-01"
"2207.11728","Jaeduk Han","Taeho Shin, Dongjun Lee, Dongwhee Kim, Gaeryun Sung, Wookjin Shin,
  Yunseong Jo, Hyungjoo Park, Jaeduk Han","A Custom IC Layout Generation Engine Based on Dynamic Templates and
  Grids","10 pages, 6 figures",,,,"eess.SP cs.AR","http://arxiv.org/licenses/nonexclusive-distrib/1.0/","  This paper presents an automatic layout generation framework in advanced CMOS
technologies. The framework extends the template-and-grid-based layout
generation methodology with the following additional techniques applied to
produce optimal layouts more effectively. First, layout templates and grids are
dynamically created and adjusted during runtime to serve various structural,
functional, and design requirements. Virtual instances support the dynamic
template-and-grid-based layout generation process. The framework also
implements various post-processing functions to handle process-specific
requirements efficiently. The post-processing functions include cut/dummy
pattern generation and multiple-patterning adjustment. The generator
description capability is enhanced with circular grid indexing/slicing and
conditional conversion operators. The layout generation framework is applied to
various design examples and generates DRC/LVS clean layouts automatically in
multiple CMOS technologies.
","[{""version"":""v1"",""created"":""Sun, 24 Jul 2022 12:15:19 GMT""}]","2022-07-26"
"2207.11729","Nikolay Kuznetsov G.","Nikolay Kuznetsov","On relations between harmonic functions and solutions of the modified
  Helmholtz equation","8 pages, no figures",,,,"math.AP","http://arxiv.org/licenses/nonexclusive-distrib/1.0/","  We consider the $m$-dimensional modified Helmholtz equation and establish two
relations between its solutions in a bounded domain and harmonic functions.
Both relations essentially rely on properties of the Newtonian potential. Some
other characteristics of these solutions are also obtained.
","[{""version"":""v1"",""created"":""Sun, 24 Jul 2022 12:20:16 GMT""}]","2022-07-26"
"2207.11730","Praveen Kumar","Praveen Kumar, Sudhan Majhi, Subhabrata Paul","A Direct Construction of Cross Z-Complementary Sets with Flexible
  Lengths and Large Zero Correlation Zone",,,,,"cs.IT math.IT","http://creativecommons.org/licenses/by/4.0/","  This letter proposes a direct construction for cross Z-complementary sets
(CZCSs) with flexible lengths and a large zero correlation zone (ZCZ). CZCS is
an extension of the cross Z-complementary pair (CZCP). The maximum possible ZCZ
width of a CZCP is half of its sequence length. In this letter, for the first
time, a generalized Boolean function based construction of CZCSs with a large
number of constituent sequences and a ZCZ ratio of $2/3$ is presented. For
integers $m$ and $\delta$, the proposed construction produces CZCS with length
expressed as $2^{m-1}+2^\delta$ ($0 \leq \delta <m-1,m\geq 4$), where both odd
and even lengths CZCS can be obtained. Additionally, the constructed CZCS also
feature a complementary set of the same length. Finally, the proposed
construction is compared with the existing works.
","[{""version"":""v1"",""created"":""Sun, 24 Jul 2022 12:22:11 GMT""}]","2022-07-26"
"2207.11731","Matheus Brito","Matheus Brito and Vyjayanthi Chari","Higher order Kirillov-Reshetikhin modules, Imaginary modules and
  Monoidal Categorification for $U_q(A_n^{(1)})$","37 pages. Results on section 4 are vastly generalized. We show that
  for every non-fundamental (higher order) KR-module, we can canonically define
  an irreducible imaginary module and describe its Drinfeld polynomial. Theorem
  2 has been strengthened and is shown to be valid for arbitrary snake modules.
  The exposition throughout the paper has been improved and proofs have been
  streamlined",,,,"math.QA math.RT","http://arxiv.org/licenses/nonexclusive-distrib/1.0/","  We study the family of irreducible modules for quantum affine
$\lie{sl}_{n+1}$ whose Drinfeld polynomials are supported on just one node of
the Dynkin diagram. We identify all the prime modules in this family and prove
a unique factorization theorem. The Drinfeld polynomials of the prime modules
encode information coming from the points of reducibility of tensor products of
the fundamental modules associated to $A_m$ with $m\le n$. These prime modules
are a special class of the snake modules studied by Mukhin and Young. We relate
our modules to the work of Hernandez and Leclerc and define generalizations of
the category $\mathscr C^-$. This leads naturally to the notion of an inflation
of the corresponding Grothendieck ring. In the last section we show that the
tensor product of a (higher order) Kirillov--Reshetikhin module with its dual
always contains an imaginary module in its Jordan--Holder series and give an
explicit formula for its Drinfeld polynomial. Together with the results of
\cite{HL13a} this gives examples of a product of cluster variables which are
not in the span of cluster monomials. We also discuss the connection of our
work with the examples arising from the work of \cite{LM18}.
  Finally, we use our methods to give a family of imaginary modules in type
$D_4$ which do not arise from an embedding of $A_r$ with $r\le 3$ in $D_4$.
","[{""version"":""v1"",""created"":""Sun, 24 Jul 2022 12:41:02 GMT""},{""version"":""v2"",""created"":""Thu, 1 Dec 2022 15:06:22 GMT""}]","2022-12-02"
"2207.11732","Dominykas Norgilas","Erhan Bayraktar, Shuoqing Deng and Dominykas Norgilas","Supermartingale shadow couplings: the decreasing case","31 pages, 2 figures",,,,"math.PR","http://arxiv.org/licenses/nonexclusive-distrib/1.0/","  For two measures $\mu$ and $\nu$ that are in convex-decreasing order, Nutz
and Stebegg (Canonical supermartingale couplings, Ann. Probab.,
46(6):3351--3398, 2018) studied the optimal transport problem with
supermartingale constraints and introduced two canonical couplings, namely the
increasing and decreasing transport plans, that are optimal for a large class
of cost functions. In the present paper we provide an explicit construction of
the decreasing coupling $\pi^D$ by establishing a Brenier-type result: (a
generalised version of) $\pi^D$ concentrates on the graphs of two functions.
  Our construction is based on the concept of the supermartingale
\textit{shadow} measure and requires a suitable extension of the results by
Juillet (Stability of the shadow projection and the left-curtain coupling, Ann.
Inst. H. Poincar\'e Probab. Statist., 52(4):1823--1843, November 2016) and
Beiglb\""ock and Juillet (Shadow couplings, Trans. Amer. Math. Soc.,
374:4973--5002, 2021) established in the martingale setting. In particular, we
prove the stability of the supermartingale shadow measure with respect to
initial and target measures $\mu,\nu$, introduce an infinite family of lifted
supermartingale couplings that arise via shadow measure, and show how to
explicitly determine the `martingale points' of each such coupling.
","[{""version"":""v1"",""created"":""Sun, 24 Jul 2022 12:46:18 GMT""}]","2022-07-26"
