"2207.11608","Amr Elsayed Abdelfattah","Amr S.Abdelfattah, Tamer Abdelkader, EI-Sayed M. EI-Horbaty","RMAWS: An Hybrid Architecture for achieving Web Services Reliability in
  Mobile Cloud Computing","It is presented at EEDE (Energy, Environment, Development and
  Economics) Conference 2018",,,,"cs.SE","http://creativecommons.org/licenses/by-nc-nd/4.0/","  The intermittent wireless connectivity in Mobiles limits the spread of mobile
applications usage over the web, such that the web services are the independent
protocol that used to achieve the mobile connectivity with the cloud services.
Achieving the web service reliability results in two aspects. The first is low
communication overhead and retrieving the appropriate response to prevent the
duplicate request execution. The second is overcoming the request time out
problem that is one of the most effected issues in the mobile experience. This
paper proposes Reliable Mobile Agent and Web Socket approach (RMAWS) that
achieves the reliable web services consumption. The enhanced architecture is
hybrid between the mobile agent approach and web socket open connection
communication protocol. This approach recovers the data lose because of the
intermittent connections, overcomes the Time-out problem, and enhances the
mobile experience by achieving this service consumption reliability.
","[{""version"":""v1"",""created"":""Sat, 23 Jul 2022 21:23:17 GMT""}]","2022-07-26"
"2207.11609","Hossein A. Rahmani","Hossein A. Rahmani, Mohammadmehdi Naghiaei, Ali Tourani, Yashar
  Deldjoo","Exploring the Impact of Temporal Bias in Point-of-Interest
  Recommendation","RecSys 2022",,"10.1145/3523227.3551481",,"cs.IR","http://creativecommons.org/licenses/by/4.0/","  Recommending appropriate travel destinations to consumers based on contextual
information such as their check-in time and location is a primary objective of
Point-of-Interest (POI) recommender systems. However, the issue of contextual
bias (i.e., how much consumers prefer one situation over another) has received
little attention from the research community. This paper examines the effect of
temporal bias, defined as the difference between users' check-in hours, leisure
vs.~work hours, on the consumer-side fairness of context-aware recommendation
algorithms. We believe that eliminating this type of temporal (and
geographical) bias might contribute to a drop in traffic-related air pollution,
noting that rush-hour traffic may be more congested. To surface effective POI
recommendations, we evaluated the sensitivity of state-of-the-art context-aware
models to the temporal bias contained in users' check-in activities on two POI
datasets, namely Gowalla and Yelp. The findings show that the examined
context-aware recommendation models prefer one group of users over another
based on the time of check-in and that this preference persists even when users
have the same amount of interactions.
","[{""version"":""v1"",""created"":""Sat, 23 Jul 2022 21:25:19 GMT""}]","2022-07-26"
"2207.11610","Martin Ukrop","Martin Ukrop, Lydia Kraus, Vashek Matyas","Will You Trust This TLS Certificate? Perceptions of People Working in IT
  (Extended Version)",,"Digital Threats: Research and Practice, Volume 1, Issue 4,
  December 2020, Article No.: 25, pp 1-29","10.1145/3419472",,"cs.CR cs.CY","http://arxiv.org/licenses/nonexclusive-distrib/1.0/","  Flawed TLS certificates are not uncommon on the Internet. While they signal a
potential issue, in most cases they have benign causes (e.g., misconfiguration
or even deliberate deployment). This adds fuzziness to the decision on whether
to trust a connection or not. Little is known about perceptions of flawed
certificates by IT professionals, even though their decisions impact high
numbers of end users. Moreover, it is unclear how much the content of error
messages and documentation influences these perceptions. To shed light on these
issues, we observed 75 attendees of an industrial IT conference investigating
different certificate validation errors. We also analyzed the influence of
reworded error messages and redesigned documentation. We find that people
working in IT have very nuanced opinions, with trust decisions being far from
binary. The self-signed and the name-constrained certificates seem to be
over-trusted (the latter also being poorly understood). We show that even small
changes in existing error messages can positively influence resource use,
comprehension, and trust assessment. At the end of the article, we summarize
lessons learned from conducting usable security studies with IT professionals.
","[{""version"":""v1"",""created"":""Sat, 23 Jul 2022 21:33:21 GMT""}]","2022-07-26"
"2207.11611","Amlan Banaji","Amlan Banaji and Jonathan M. Fraser","Assouad type dimensions of infinitely generated self-conformal sets","26 pages, 1 figure",,,,"math.DS math.CA math.MG","http://arxiv.org/licenses/nonexclusive-distrib/1.0/","  We study the dimension theory of limit sets of iterated function systems
consisting of a countably infinite number of conformal contractions. Our focus
is on the Assouad type dimensions, which give information about the local
structure of sets. Under natural separation conditions, we prove a formula for
the Assouad dimension and prove sharp bounds for the Assouad spectrum in terms
of the Hausdorff dimension of the limit set and dimensions of the set of fixed
points of the contractions. The Assouad spectra of the family of examples which
we use to show that the bounds are sharp display interesting behaviour, such as
having two phase transitions. Our results apply in particular to sets of real
or complex numbers which have continued fraction expansions with restricted
entries, and to certain parabolic attractors.
","[{""version"":""v1"",""created"":""Sat, 23 Jul 2022 21:43:24 GMT""}]","2022-07-26"
"2207.11612","F\'elix Foutel-Rodier","Florin Boenkost, F\'elix Foutel-Rodier, Emmanuel Schertzer","The genealogy of nearly critical branching processes in varying
  environment","43 pages, 2 figures",,,,"math.PR","http://creativecommons.org/licenses/by-nc-nd/4.0/","  Building on the spinal decomposition technique in Foutel-Rodier and Schertzer
(2022) we prove a Yaglom limit law for the rescaled size of a nearly critical
branching process in varying environment conditional on survival. In addition,
our spinal approach allows us to prove convergence of the genealogical
structure of the population at a fixed time horizon - where the sequence of
trees are envisioned as a sequence of metric spaces - in the
Gromov-Hausdorff-Prokorov (GHP) topology. We characterize the limiting metric
space as a time-changed version of the Brownian coalescent point process of
Popovic (2004).
  Beyond our specific model, we derive several general results allowing to go
from spinal decompositions to convergence of random trees in the GHP topology.
As a direct application, we show how this type of convergence naturally
condenses the limit of several interesting genealogical quantities: the
population size, the time to the most-recent common ancestor, the reduced tree
and the tree generated by $k$ uniformly sampled individuals. As in a recent
article by the authors (Foutel-Rodier and Schertzer 2022), we hope that our
specific example illustrates a general methodology that could be applied to
more complex branching processes.
","[{""version"":""v1"",""created"":""Sat, 23 Jul 2022 21:47:45 GMT""},{""version"":""v2"",""created"":""Thu, 20 Oct 2022 19:27:01 GMT""}]","2022-10-24"
"2207.11613","Sudeshna Patra","Sudeshna Patra, Neal J. Evans II, Kee-Tae Kim, Mark Heyer, Jens
  Kauffmann, Jessy Jose, Manash R. Samal, Swagat R. Das","Tracers of Dense Gas in the Outer Galaxy","20 pages, 8 figures, 5 tables, accepted for publication in The
  Astronomical Journal",,"10.3847/1538-3881/ac83af",,"astro-ph.GA","http://arxiv.org/licenses/nonexclusive-distrib/1.0/","  We have mapped HCN and HCO$^{+}$ (J = 1 $\to$ 0) line emission toward a
sample of seven star-forming regions (with 12 + log[O/H] range from 8.34 to
8.69) in the outer Milky Way (Galactocentric distance > 9.5 kpc), using the
14-meter radio telescope of the Taeduk Radio Astronomy Observatory (TRAO). We
compare these two molecular lines with other conventional tracers of dense gas,
millimeter-wave continuum emission from dust and extinction thresholds ($A_{V}
\geq 8$ mag), inferred from the $^{13}$CO line data. HCN and HCO$^{+}$
correlate better with the millimeter emission than with the extinction
criterion. A significant amount of luminosity comes from regions below the
extinction criterion and outside the millimeter clump for all the clouds. The
average fraction of HCN luminosity from within the regions with $A_{V} \geq 8$
mag is $0.343\pm0.225$; for the regions of millimeter emission, it is
$0.478\pm0.149$. Based on a comparison with column density maps from Herschel,
HCN and HCO$^{+}$ trace dense gas in high column density regions better than
does $^{13}$CO. HCO$^{+}$ is less concentrated than HCN for outer Galaxy
targets, in contrast with the inner Galaxy sample, suggesting that metallicity
may affect the interpretation of tracers of dense gas. The conversion factor
between the dense gas mass ($M_{dense}$) and line luminosities of HCN and
HCO$^{+}$, when integrated over the whole cloud, is comparable with factors
used in extragalactic studies.
","[{""version"":""v1"",""created"":""Sat, 23 Jul 2022 21:49:57 GMT""}]","2022-09-14"
"2207.11614","Luke Conaboy","Luke Conaboy, Ilian T. Iliev, Anastasia Fialkov, Keri L. Dixon, David
  Sullivan","Relative baryon-dark matter velocities in cosmological zoom simulations","12 pages, 10 figures. Submitted to MNRAS, comments welcome",,,,"astro-ph.CO","http://arxiv.org/licenses/nonexclusive-distrib/1.0/","  Supersonic relative motion between baryons and dark matter due to the
decoupling of baryons from the primordial plasma after recombination affects
the growth of the first small-scale structures. Large box sizes (greater than a
few hundred Mpc) are required to sample the full range of scales pertinent to
the relative velocity, while the effect of the relative velocity is strongest
on small scales (less than a few hundred kpc). This separation of scales
naturally lends itself to the use of `zoom' simulations, and here we present
our methodology to self-consistently incorporate the relative velocity at the
start time of the simulation as well as its cumulative effect from
recombination through to the start time of the simulation. We also apply our
methodology to a large-scale cosmological zoom simulation. In qualitative
agreement with previous works, we find that the halo mass function and halo
baryon fraction is suppressed when the relative velocity is included compared
to when it is not. We also find a small delay, of the order of the lifetime of
a $\sim$9 M$_\odot$ Population III star, in the onset of star formation in the
case where the relative velocity is included.
","[{""version"":""v1"",""created"":""Sat, 23 Jul 2022 21:55:32 GMT""}]","2022-07-26"
"2207.11615","J\'er\'emie Decouchant","O\u{g}uzhan Ersoy and J\'er\'emie Decouchant and Satwik Prabhu Kimble
  and Stefanie Roos","SyncPCN/PSyncPCN: Payment Channel Networks without Blockchain Synchrony","Preprint of a paper accepted at the ACM conference on Advances in
  Financial Technologies (AFT 2022)",,,,"cs.CR cs.DC","http://creativecommons.org/licenses/by/4.0/","  Payment channel networks (PCNs) enhance the scalability of blockchains by
allowing parties to conduct transactions off-chain, i.e, without broadcasting
every transaction to all blockchain participants. To conduct transactions, a
sender and a receiver can either establish a direct payment channel with a
funding blockchain transaction or leverage existing channels in a multi-hop
payment. The security of PCNs usually relies on the synchrony of the underlying
blockchain, i.e., evidence of misbehavior needs to be published on the
blockchain within a time limit. Alternative payment channel proposals that do
not require blockchain synchrony rely on quorum certificates and use a
committee to register the transactions of a channel. However, these proposals
do not support multi-hop payments, a limitation we aim to overcome. In this
paper, we demonstrate that it is in fact impossible to design a multi-hop
payment protocol with both network asynchrony and faulty channels, i.e.,
channels that may not correctly follow the protocol. We then detail two
committee-based multi-hop payment protocols that respectively assume
synchronous communications and possibly faulty channels, or asynchronous
communication and correct channels. The first protocol relies on possibly
faulty committees instead of the blockchain to resolve channel disputes, and
enforces privacy properties within a synchronous network. The second one relies
on committees that contain at most f faulty members out of 3f+1 and
successively delegate to each other the role of eventually completing a
multi-hop payment. We show that both protocols satisfy the security
requirements of a multi-hop payment and compare their communication complexity
and latency.
","[{""version"":""v1"",""created"":""Sat, 23 Jul 2022 22:16:37 GMT""},{""version"":""v2"",""created"":""Thu, 4 Aug 2022 12:58:36 GMT""}]","2022-08-05"
"2207.11616","Ruslan Prozorov","Kamal R. Joshi, Sunil Ghimire, Makariy A. Tanatar, Amlan Datta, Jin-Su
  Oh, Lin Zhou, Cameron J. Kopas, Jayss Marshall, Josh Y. Mutus, Julie
  Slaughter, Matthew J. Kramer, James A. Sauls, Ruslan Prozorov","Quasiparticle spectroscopy, transport, and magnetic properties of Nb
  films used in superconducting transmon qubits",,,,,"cond-mat.supr-con quant-ph","http://creativecommons.org/licenses/by/4.0/","  Niobium thin films on silicon substrate used in the fabrication of
superconducting qubits have been characterized using scanning and transmission
electron microscopy, electrical transport, magnetization, quasiparticle
spectroscopy, and real-space real-time magneto-optical imaging. We study
niobium films to provide an example of a comprehensive analytical set that may
benefit superconducting circuits such as those used in quantum computers. The
films show outstanding superconducting transition temperature of $T_{c}=9.35$ K
and a fairly clean superconducting gap, along with superfluid density enhanced
at intermediate temperatures. These observations are consistent with the recent
theory of anisotropic strong-coupling superconductivity in Nb. However, the
response to the magnetic field is complicated, exhibiting significantly
irreversible behavior and insufficient heat conductance leading to
thermo-magnetic instabilities. These may present an issue for further
improvement of transmon quantum coherence. Possible mitigation strategies are
discussed.
","[{""version"":""v1"",""created"":""Sat, 23 Jul 2022 22:45:23 GMT""}]","2022-07-26"
"2207.11617","Wei-Sheng Lai","Wei-Sheng Lai, YiChang Shih, Lun-Cheng Chu, Xiaotong Wu, Sung-Fang
  Tsai, Michael Krainin, Deqing Sun, Chia-Kai Liang","Face Deblurring using Dual Camera Fusion on Mobile Phones","Accepted to SIGGRAPH 2022 (ACM TOG). Project websit:
  https://www.wslai.net/publications/fusion_deblur/",,,,"cs.CV cs.GR","http://creativecommons.org/licenses/by-nc-sa/4.0/","  Motion blur of fast-moving subjects is a longstanding problem in photography
and very common on mobile phones due to limited light collection efficiency,
particularly in low-light conditions. While we have witnessed great progress in
image deblurring in recent years, most methods require significant
computational power and have limitations in processing high-resolution photos
with severe local motions. To this end, we develop a novel face deblurring
system based on the dual camera fusion technique for mobile phones. The system
detects subject motion to dynamically enable a reference camera, e.g.,
ultrawide angle camera commonly available on recent premium phones, and
captures an auxiliary photo with faster shutter settings. While the main shot
is low noise but blurry, the reference shot is sharp but noisy. We learn ML
models to align and fuse these two shots and output a clear photo without
motion blur. Our algorithm runs efficiently on Google Pixel 6, which takes 463
ms overhead per shot. Our experiments demonstrate the advantage and robustness
of our system against alternative single-image, multi-frame, face-specific, and
video deblurring algorithms as well as commercial products. To the best of our
knowledge, our work is the first mobile solution for face motion deblurring
that works reliably and robustly over thousands of images in diverse motion and
lighting conditions.
","[{""version"":""v1"",""created"":""Sat, 23 Jul 2022 22:50:46 GMT""}]","2022-07-27"
"2207.11618","Roumen Anguelov","Roumen Anguelov, Jean Lubuma","Second-order nonstandard finite difference schemes for a class of models
  in bioscience","12 pages",,,,"math.NA cs.NA math.DS","http://creativecommons.org/licenses/by/4.0/","  We consider a dynamical system, defined by a system of autonomous
differential equations, on $\Omega\subset\mathbb{R}^n$. By using Mickens' rule
on the nonlocal approximation of nonlinear terms, we construct an implicit
Nonstandard Finite Difference (NSFD) scheme that, under an existence and
uniqueness condition, is an explicit time reversible scheme. Apart from being
elementary stable, we show that the NSFD scheme is of second-order and
domain-preserving, thereby solving a pending problem on the construction of
higher-order nonstandard schemes without spurious solutions, and extending the
tangent condition to discrete dynamical systems. It is shown that the new
scheme applies directly for mass action-based models of biological and chemical
processes.
","[{""version"":""v1"",""created"":""Sat, 23 Jul 2022 22:51:25 GMT""}]","2022-07-26"
"2207.11619","Gabriel Fernandes","Gabriel P. L. M. Fernandes, Alexandre C. Ricardo, Fernando R. Cardoso,
  Celso J. Villas-Boas","Trapped Ions as an Architecture for Quantum Computing","18 pages, in Portuguese language, 8 figures",,,,"quant-ph","http://arxiv.org/licenses/nonexclusive-distrib/1.0/","  In this paper we describe one of the most promising platforms for the
construction of a universal quantum computer, which consists of a chain of $N$
ions trapped in a harmonic potential, whose internal states work out as qubits,
and are coupled to collective vibrational modes of the chain. From such
coupling, it is possible to build interactions between different ions of the
chain, that is, qubit-qubit interactions that, together with individual
operations on the ions, allow building a quantum computer as first proposed by
Cirac and Zoller in the 1990s [Phys. Rev. Lett. 74, 4091 (1995)]. Here we
discuss from the physics involved in trapping ions in electromagnetic
potentials to the Hamiltonian engineering needed to generate a universal set of
logic gates, fundamental for the execution of more complex quantum algorithms.
Finally, we present the current state of the art of quantum computing in
trapped ion systems, highlighting recent advances made by companies and
government projects that use such architecture, such as IonQ and AQTION.
","[{""version"":""v1"",""created"":""Sat, 23 Jul 2022 22:58:50 GMT""}]","2022-07-26"
"2207.11620","Qi Wu","Qi Wu, David Bauer, Michael J. Doyle, Kwan-Liu Ma","Instant Neural Representation for Interactive Volume Rendering","This manuscript was submitted to IEEE VIS 2022 (March 31 2022), then
  resubmitted to IEEE TVCG (October 21 2022). We have modified our manuscript
  in response to previous reviews. There is also a supplementary video for this
  manuscript, which can be accessed via this link:
  https://drive.google.com/file/d/17wSgIm_VsoeGhfyZwMpOnCYy2Mj3ydGv/view?usp=sharing",,,,"cs.GR cs.LG","http://creativecommons.org/licenses/by/4.0/","  Neural networks have shown great potential in compressing volume data for
visualization. However, due to the high cost of training and inference, such
volumetric neural representations have thus far only been applied to offline
data processing and non-interactive rendering. In this paper, we demonstrate
that by simultaneously leveraging modern GPU tensor cores, a native CUDA neural
network framework, and a well-designed rendering algorithm with macro-cell
acceleration, we can interactively ray trace volumetric neural representations
(10-60fps). Our neural representations are also high-fidelity (PSNR > 30dB) and
compact (10-1000x smaller). Additionally, we show that it is possible to fit
the entire training step inside a rendering loop and skip the pre-training
process completely. To support extreme-scale volume data, we also develop an
efficient out-of-core training strategy, which allows our volumetric neural
representation training to potentially scale up to terascale using only an
NVIDIA RTX 3090 workstation.
","[{""version"":""v1"",""created"":""Sat, 23 Jul 2022 23:04:19 GMT""},{""version"":""v2"",""created"":""Mon, 24 Oct 2022 00:26:39 GMT""}]","2022-10-25"
"2207.11621","Nikhil Ghosh","Nikhil Ghosh, Mikhail Belkin","A Universal Trade-off Between the Model Size, Test Loss, and Training
  Loss of Linear Predictors","Further polished writing",,,,"stat.ML cs.LG","http://creativecommons.org/licenses/by/4.0/","  In this work we establish an algorithm and distribution independent
non-asymptotic trade-off between the model size, excess test loss, and training
loss of linear predictors. Specifically, we show that models that perform well
on the test data (have low excess loss) are either ""classical"" -- have training
loss close to the noise level, or are ""modern"" -- have a much larger number of
parameters compared to the minimum needed to fit the training data exactly.
  We also provide a more precise asymptotic analysis when the limiting spectral
distribution of the whitened features is Marchenko-Pastur. Remarkably, while
the Marchenko-Pastur analysis is far more precise near the interpolation peak,
where the number of parameters is just enough to fit the training data, it
coincides exactly with the distribution independent bound as the level of
overparametrization increases.
","[{""version"":""v1"",""created"":""Sat, 23 Jul 2022 23:25:16 GMT""},{""version"":""v2"",""created"":""Mon, 7 Nov 2022 04:50:13 GMT""},{""version"":""v3"",""created"":""Tue, 18 Apr 2023 20:27:33 GMT""}]","2023-04-20"
"2207.11622","Huandong Chen","Huandong Chen, Batyr Ilyas, Boyang Zhao, Emre Ergecen, Josh Mutch,
  Gwan Yeong Jung, Qian Song, Connor A. Occhialini, Guodong Ren, Sara Shabani,
  Eric Seewald, Shanyuan Niu, Jiangbin Wu, Nan Wang, Mythili Surendran,
  Shantanu Singh, Jiang Luo, Sanae Ohtomo, Gemma Goh, Bryan C. Chakoumakos,
  Simon J. Teat, Brent Melot, Han Wang, Di Xiao, Abhay N. Pasupathy, Riccardo
  Comin, Rohan Mishra, Jiun-Haw Chu, Nuh Gedik, Jayakanth Ravichandran","Unconventional Charge-density-wave Order in a Dilute d-band
  Semiconductor",,,,,"cond-mat.mtrl-sci","http://creativecommons.org/licenses/by/4.0/","  Electron-lattice coupling effects in low dimensional materials give rise to
charge density wave (CDW) order and phase transitions. These phenomena are
critical ingredients for superconductivity and predominantly occur in metallic
model systems such as doped cuprates, transition metal dichalcogenides, and
more recently, in Kagome lattice materials. However, CDW in semiconducting
systems, specifically at the limit of low carrier concentration region, is
uncommon. Here, we combine electrical transport, synchrotron X-ray diffraction
and optical spectroscopy to discover CDW order in a quasi-one-dimensional (1D),
dilute d-band semiconductor, BaTiS3, which suggests the existence of strong
electron-phonon coupling. The CDW state further undergoes an unusual transition
featuring a sharp increase in carrier mobility. Our work establishes BaTiS3 as
a unique platform to study the CDW physics in the dilute filling limit to
explore novel electronic phases.
","[{""version"":""v1"",""created"":""Sat, 23 Jul 2022 23:44:56 GMT""}]","2022-07-26"
