"2202.00982","Nirian Mart\'in","Mar\'ia Jaenada, Elena Castilla, Nirian Mart\'in and Leandro Pardo","Robust approach for comparing two dependent normal populations through
  Wald-type tests based on R\'enyi's pseudodistance estimators",,,,,"math.ST stat.TH","http://creativecommons.org/licenses/by/4.0/","  Since the two seminal papers by Fisher (1915, 1921) were published, the test
under a fixed value correlation coefficient null hypothesis for the bivariate
normal distribution constitutes an important statistical problem. In the
framework of asymptotic robust statistics, it remains being a topic of great
interest to be investigated. For this and other tests, focused on paired
correlated normal random samples, R\'{e}nyi's pseudodistance estimators are
proposed, their asymptotic distribution is established and an iterative
algorithm is provided for their computation. From them the Wald-type test
statistics are constructed for different problems of interest and their
influence function is theoretically studied. For testing null correlation in
different contexts, an extensive simulation study and two real data based
examples support the robust properties of our proposal.
","[{""version"":""v1"",""created"":""Wed, 2 Feb 2022 12:04:09 GMT""},{""version"":""v2"",""created"":""Sat, 24 Sep 2022 00:25:10 GMT""}]","2022-09-27"
"2202.00983","Vladimir Mikhailenko St","V. S. Mikhailenko, V. V. Mikhailenko, Hae June Lee","Anomalous convective transport of the tokamak edge plasma, caused by the
  inhomogeneous ion cyclotron parametric turbulence","25",,"10.1063/5.0087763",,"physics.plasm-ph","http://creativecommons.org/licenses/by/4.0/","  In this paper, we develop the kinetic and hydrodynamic theories of the
convective mesoscale flows driven by the spatially inhomogeneous electrostatic
ion cyclotron parametric microturbulence in the pedestal plasma with a sheared
poloidal flow. The developed kinetic theory predicts the generation of the
sheared poloidal convective flow, and of the radial compressed flow with radial
flow velocity gradient. The developed hydrodynamic theory of the convective
flows reveals the radial compressed convective flow as the dominant factor in
the formation of the steep pedestal density profile with density gradient
exponentially growing with time. This gradient density growth is limited by the
formation of the radial oscillating with time ion outflow of pedestal plasma to
scrape-off layer.
","[{""version"":""v1"",""created"":""Wed, 2 Feb 2022 12:09:05 GMT""},{""version"":""v2"",""created"":""Tue, 7 Jun 2022 05:07:08 GMT""}]","2022-07-20"
"2202.00984","Fam Le Kien","Fam Le Kien, Sile Nic Chormaic, and Thomas Busch","Optical force between two coupled identical parallel optical nanofibers","arXiv admin note: text overlap with arXiv:2012.06078",,"10.1103/PhysRevA.105.063517",,"physics.optics quant-ph","http://creativecommons.org/licenses/by/4.0/","  We study the optical force between two coupled parallel identical nanofibers
using the rigorous array mode theory. We show that the forces of the even array
modes are attractive, while the forces of the odd array modes are repulsive. We
examine the dependencies of the optical forces on the array mode type, the
fiber radius, the light wavelength, and the fiber separation distance. We show
that, for a given power and a given separation distance, the absolute value of
the force achieves a peak when the fiber radius and the light wavelength are
appropriate.
","[{""version"":""v1"",""created"":""Wed, 2 Feb 2022 12:09:52 GMT""},{""version"":""v2"",""created"":""Thu, 3 Mar 2022 09:58:42 GMT""}]","2022-07-13"
"2202.00985","Chandan Mondal","Yiping Liu, Siqi Xu, Chandan Mondal, Xingbo Zhao, James P. Vary","Angular momentum and generalized parton distributions for the proton
  with basis light-front quantization","14 pages, 4 figures",,"10.1103/PhysRevD.105.094018",,"hep-ph","http://creativecommons.org/licenses/by/4.0/","  We study the unpolarized and the helicity dependent generalized parton
distributions (GPDs) for the valence quarks of the proton in both momentum
space and position space within the basis light-front quantization (BLFQ)
framework. The GPDs for the valence quarks are computed from the eigenvectors
of a light-front effective Hamiltonian in the valence Fock sector consisting of
a three-dimensional confinement potential and a one-gluon exchange interaction
with fixed coupling. Employing these GPDs, we obtain the spatial distributions
of quark angular momentum inside the proton. In our BLFQ approach, we explore
various definitions of angular momentum density and illustrate the differences
between them arising from terms that integrate to zero. We also discuss the
flavor contributions to the quark angular momentum densities.
","[{""version"":""v1"",""created"":""Wed, 2 Feb 2022 12:10:34 GMT""}]","2022-06-01"
"2202.00986","Max-Heinrich Laves","Max-Heinrich Laves, Malte T\""olle, Alexander Schlaefer, Sandy
  Engelhardt","Posterior temperature optimized Bayesian models for inverse problems in
  medical imaging","Accepted at Medical Image Analysis",,,,"eess.IV cs.LG","http://creativecommons.org/licenses/by-nc-nd/4.0/","  We present Posterior Temperature Optimized Bayesian Inverse Models (POTOBIM),
an unsupervised Bayesian approach to inverse problems in medical imaging using
mean-field variational inference with a fully tempered posterior. Bayesian
methods exhibit useful properties for approaching inverse tasks, such as
tomographic reconstruction or image denoising. A suitable prior distribution
introduces regularization, which is needed to solve the ill-posed problem and
reduces overfitting the data. In practice, however, this often results in a
suboptimal posterior temperature, and the full potential of the Bayesian
approach is not being exploited. In POTOBIM, we optimize both the parameters of
the prior distribution and the posterior temperature with respect to
reconstruction accuracy using Bayesian optimization with Gaussian process
regression. Our method is extensively evaluated on four different inverse tasks
on a variety of modalities with images from public data sets and we demonstrate
that an optimized posterior temperature outperforms both non-Bayesian and
Bayesian approaches without temperature optimization. The use of an optimized
prior distribution and posterior temperature leads to improved accuracy and
uncertainty estimation and we show that it is sufficient to find these
hyperparameters per task domain. Well-tempered posteriors yield calibrated
uncertainty, which increases the reliability in the predictions. Our source
code is publicly available at github.com/Cardio-AI/mfvi-dip-mia.
","[{""version"":""v1"",""created"":""Wed, 2 Feb 2022 12:16:33 GMT""}]","2022-02-03"
"2202.00987","Xueyi Huang","Xueyi Huang, Lu Lu, Katja M\""onius","Splitting fields of mixed Cayley graphs over abelian groups","12 pages",,,,"math.CO math.NT","http://arxiv.org/licenses/nonexclusive-distrib/1.0/","  The splitting field $\mathbb{SF}(\Gamma)$ of a mixed graph $\Gamma$ is the
smallest field extension of $\mathbb{Q}$ which contains all eigenvalues of the
Hermitian adjacency matrix of $\Gamma$. The extension degree
$[\mathbb{SF}(\Gamma):\mathbb{Q}]$ is called the algebraic degree of $\Gamma$.
In this paper, we determine the splitting fields and algebraic degrees of mixed
Cayley graphs over abelian groups. This generalizes the main results of [K.
M\""{o}nius, Splitting fields of spectra of circulant graphs, J. Algebra 594(15)
(2022) 154--169] and [M. Kadyan, B. Bhattacharjya, Integral mixed Cayley graphs
over abelian groups, Electron. J. Combin. 28(4) (2021) \#P4.46].
","[{""version"":""v1"",""created"":""Wed, 2 Feb 2022 12:17:38 GMT""},{""version"":""v2"",""created"":""Thu, 24 Mar 2022 05:50:45 GMT""}]","2022-03-25"
"2202.00988","Bhaswati Mookerjea","Bhaswati Mookerjea (TIFR, Mumbai, India)","Star Formation Triggered by the expanding bubble S111","Accepted for publication in the Astrophysical Journal on 30 November
  2021",,"10.3847/1538-4357/ac4258",,"astro-ph.GA","http://creativecommons.org/licenses/by/4.0/","  This paper investigates the impact of radiative and mechanical feedback from
O-type stars on their parent molecular clouds and the triggering of formation
of future generation of stars. We study the infrared bubble S111 created by the
embedded massive stellar cluster G316.80-0.05. A significant fraction of gas in
shells created due to the compression of the ambient medium by expanding
bubbles is photodissociated by the stellar radiation. The kinematics of the
shells are thus best studied using spectroscopic observations of singly ionized
carbon, the most dominant species. We have used the velocity-resolved maps of
the $^2{\rm P}_{3/2}\rightarrow ^2{\rm P}_{1/2}$ transition of [C II] at 158
micron, the J=2-1 transition of 13CO and C18O, and the J=1-0 transition of
HCO^+ to study the rim of the bubble S111 that partly coincides with the
southern part of the infrared dark ridge G316.75. The [C II] spectra
conclusively show evidence of a shell expanding with a moderate velocity of ~7
km/s, which amounts to a kinetic energy that is ~0.5-40 times the thermal
energy of the H II region. The pressure causing the expansion of the H II
region arises mainly from the hydrogen ionization and the dust-processed
radiation. Among the far-infrared sources located in the compressed shells, we
find the core G316.7799-0.0942 to show broad spectral features consistent with
outflow activity and conclude that it is a site of active star formation. Based
on the age of the H II region we conclude that this expanding H II region is
responsible for the triggering of the current star formation activity in the
region.
","[{""version"":""v1"",""created"":""Wed, 2 Feb 2022 12:19:31 GMT""}]","2022-02-16"
"2202.00989","Mehrasa Ahmadipour","Mehrasa Ahmadipour, Michele Wigger, and Mari Kobayashi","Coding for Sensing: An Improved Scheme for Integrated Sensing and
  Communication over MACs",,,,,"cs.IT math.IT","http://arxiv.org/licenses/nonexclusive-distrib/1.0/","  A memoryless state-dependent multiple-access channel (MAC) is considered,
where two transmitters wish to convey their messages to a single receiver while
simultaneously sensing (estimating) the respective states via generalized
feedbacks. For this channel, an improved inner bound is provided on the
fundamental rate-distortions tradeoff which characterizes the communication
rates the transmitters can achieve while simultaneously ensuring that their
state-estimates satisfy desired distortion criteria. The new inner bound is
based on a scheme where each transmitter codes over the generalized feedback so
as to improve the state estimation at the other transmitter. This is in
contrast to the schemes proposed for point-to-point and broadcast channels
where coding is used only for the transmission of messages and the optimal
estimators operate on a symbol-by-symbol basis on the sequences of channel
inputs and feedback outputs.
","[{""version"":""v1"",""created"":""Wed, 2 Feb 2022 12:21:03 GMT""},{""version"":""v2"",""created"":""Thu, 31 Mar 2022 09:15:32 GMT""}]","2022-04-01"
"2202.00990","Joshua Bruton","Joshua Bruton and Hairong Wang","Dictionary learning for clustering on hyperspectral images","Springer Machine Learning Journal, 8 pages, 3 figures","Signal, Image and Video Processing 15.2 (2021): 255-261","10.1007/s11760-020-01750-z",,"eess.IV cs.CV cs.LG","http://creativecommons.org/licenses/by/4.0/","  Dictionary learning and sparse coding have been widely studied as mechanisms
for unsupervised feature learning. Unsupervised learning could bring enormous
benefit to the processing of hyperspectral images and to other remote sensing
data analysis because labelled data are often scarce in this field. We propose
a method for clustering the pixels of hyperspectral images using sparse
coefficients computed from a representative dictionary as features. We show
empirically that the proposed method works more effectively than clustering on
the original pixels. We also demonstrate that our approach, in certain
circumstances, outperforms the clustering results of features extracted using
principal component analysis and non-negative matrix factorisation.
Furthermore, our method is suitable for applications in repetitively clustering
an ever-growing amount of high-dimensional data, which is the case when working
with hyperspectral satellite imagery.
","[{""version"":""v1"",""created"":""Wed, 2 Feb 2022 12:22:33 GMT""}]","2022-02-03"
"2202.00991","Sudeep Ghosh","Sudeep K. Ghosh, P. K. Biswas, Chunqiang Xu, B. Li, J. Z. Zhao, A. D.
  Hillier and Xiaofeng Xu","Time-Reversal Symmetry Breaking Superconductivity in Three-Dimensional
  Dirac Semimetallic Silicides","7 pages, 4 figures","Phys. Rev. Research 4, L012031 (2022)","10.1103/PhysRevResearch.4.L012031",,"cond-mat.supr-con","http://creativecommons.org/licenses/by/4.0/","  Superconductors with broken time-reversal symmetry represent arguably one of
the most promising venues for realizing highly sought-after topological
superconductivity that is vital to fault-tolerant quantum computation. Here, by
using extensive muon-spin relaxation and rotation measurements, we report that
the isostructural silicide superconductors (Ta, Nb)OsSi spontaneously break
time-reversal symmetry at the superconducting transition while surprisingly
showing a fully-gapped superconductivity characteristic of conventional
superconductors. The first-principles calculations show that (Ta, Nb)OsSi are
three-dimensional Dirac semimetals protected by nonsymmorphic symmetries.
Taking advantage of the exceptional low symmetry crystal structure of these
materials, we have performed detailed theoretical calculations to establish
that the superconducting ground state for both (Ta, Nb)OsSi is most likely a
nonunitary triplet state.
","[{""version"":""v1"",""created"":""Wed, 2 Feb 2022 12:23:15 GMT""}]","2022-03-23"
"2202.00992","Maksim Velikanov","Maksim Velikanov and Dmitry Yarotsky","Tight Convergence Rate Bounds for Optimization Under Power Law Spectral
  Conditions",,,,,"math.OC cs.LG cs.NE","http://arxiv.org/licenses/nonexclusive-distrib/1.0/","  Performance of optimization on quadratic problems sensitively depends on the
low-lying part of the spectrum. For large (effectively infinite-dimensional)
problems, this part of the spectrum can often be naturally represented or
approximated by power law distributions, resulting in power law convergence
rates for iterative solutions of these problems by gradient-based algorithms.
In this paper, we propose a new spectral condition providing tighter upper
bounds for problems with power law optimization trajectories. We use this
condition to build a complete picture of upper and lower bounds for a wide
range of optimization algorithms -- Gradient Descent, Steepest Descent, Heavy
Ball, and Conjugate Gradients -- with an emphasis on the underlying schedules
of learning rate and momentum. In particular, we demonstrate how an optimally
accelerated method, its schedule, and convergence upper bound can be obtained
in a unified manner for a given shape of the spectrum. Also, we provide first
proofs of tight lower bounds for convergence rates of Steepest Descent and
Conjugate Gradients under spectral power laws with general exponents. Our
experiments show that the obtained convergence bounds and acceleration
strategies are not only relevant for exactly quadratic optimization problems,
but also fairly accurate when applied to the training of neural networks.
","[{""version"":""v1"",""created"":""Wed, 2 Feb 2022 12:24:03 GMT""},{""version"":""v2"",""created"":""Wed, 26 Apr 2023 11:32:06 GMT""}]","2023-04-27"
"2202.00993","Mostafa M. Mohamed","Mostafa M. Mohamed, Bj\""orn W. Schuller","Normalise for Fairness: A Simple Normalisation Technique for Fairness in
  Regression Machine Learning Problems","12 pages (including references and appendix), 2 Figures, 5 Tables.
  Preprint for submission at ICML 2022",,,,"cs.LG cs.CY","http://creativecommons.org/licenses/by/4.0/","  Algorithms and Machine Learning (ML) are increasingly affecting everyday life
and several decision-making processes, where ML has an advantage due to
scalability or superior performance. Fairness in such applications is crucial,
where models should not discriminate their results based on race, gender, or
other protected groups. This is especially crucial for models affecting very
sensitive topics, like interview hiring or recidivism prediction. Fairness is
not commonly studied for regression problems compared to binary classification
problems; hence, we present a simple, yet effective method based on
normalisation (FaiReg), which minimises the impact of unfairness in regression
problems, especially due to labelling bias. We present a theoretical analysis
of the method, in addition to an empirical comparison against two standard
methods for fairness, namely data balancing and adversarial training. We also
include a hybrid formulation (FaiRegH), merging the presented method with data
balancing, in an attempt to face labelling and sample biases simultaneously.
The experiments are conducted on the multimodal dataset First Impressions (FI)
with various labels, namely personality prediction and interview screening
score. The results show the superior performance of diminishing the effects of
unfairness better than data balancing, also without deteriorating the
performance of the original problem as much as adversarial training.
","[{""version"":""v1"",""created"":""Wed, 2 Feb 2022 12:26:25 GMT""}]","2022-02-03"
"2202.00994","Shishir Pandey Kumar","Shishir K. Pandey, Ashis K. Nandy, Poonam Kumari and Priya Mahadevan","Microscopic Origin Of Room Temperature Ferromagnetism in a Double
  Perovskite Sr$_2$FeReO$_6$: a first principle and model Hamiltonian study",,,,,"cond-mat.str-el cond-mat.mtrl-sci","http://creativecommons.org/licenses/by/4.0/","  The puzzling observation of room temperature ferromagnetism in double
perovskites (A$_2$BB$'$O$_6$), despite having the magnetic lattice of B-ions
diluted by non-magnetic B$'$-ions, have been examined for Sr$_2$FeReO$_6$. {\it
Ab-initio} spin spiral electronic structure calculations along various high
symmetry directions in reciprocal space are used to determine the exchange
interactions entering an extended Heisenberg model, which is then solved
classically using Monte Carlo simulations to determine the ferromagnetic
transition temperature T$_c$. We find that one must consider onsite Coulomb
interactions at the nonmagnetic Re sites ($U$) in order to obtain a T$_c$ close
to the experimental value. Analysis of the $ab$-$initio$ electronic structure
as well as an appropriate model Hamiltonian trace the origin of enhancement in
T$_c$ with $U$ to the enhanced exchange splitting that is introduced at these
sites. This in turn destabilizes the antiferromagnetic exchange channels,
thereby enhancing the T$_c$. The role of occupancy at the non-magnetic sites is
examined by contrasting with the case of Sr$_2$FeMoO$_6$.
","[{""version"":""v1"",""created"":""Wed, 2 Feb 2022 12:26:33 GMT""}]","2022-02-03"
"2202.00995","Kenji Yasuoka","Ryo Kawada, Katsuhiro Endo, Daisuke Yuhara, Kenji Yasuoka","MD-GAN with multi-particle input: the machine learning of long-time
  molecular behavior from short-time MD data",,,,,"physics.chem-ph cs.LG physics.comp-ph stat.ML","http://arxiv.org/licenses/nonexclusive-distrib/1.0/","  MD-GAN is a machine learning-based method that can evolve part of the system
at any time step, accelerating the generation of molecular dynamics data. For
the accurate prediction of MD-GAN, sufficient information on the dynamics of a
part of the system should be included with the training data. Therefore, the
selection of the part of the system is important for efficient learning. In a
previous study, only one particle (or vector) of each molecule was extracted as
part of the system. Therefore, we investigated the effectiveness of adding
information from other particles to the learning process. In the experiment of
the polyethylene system, when the dynamics of three particles of each molecule
were used, the diffusion was successfully predicted using one-third of the time
length of the training data, compared to the single-particle input.
Surprisingly, the unobserved transition of diffusion in the training data was
also predicted using this method.
","[{""version"":""v1"",""created"":""Wed, 2 Feb 2022 12:29:13 GMT""}]","2022-02-03"
"2202.00996","Daniel Locke","Alexander Belyaev, Giacomo Cacciapaglia, Daniel Locke","Minimal Consistent models for systematic Dark Matter exploration","10 pages, 3 figures, contribution to 55th Rencontres de Moriond on
  QCD and High Energy Interactions (Moriond QCD 2021)(C21-03-27), March
  27-April 3, 2021",,,,"hep-ph","http://arxiv.org/licenses/nonexclusive-distrib/1.0/","  Dark Matter searches in collider and non-collider experiments requires
systematic and consistent approach. We suggest and perform classification of
Minimal Consistent Dark Matter models which are aimed to create a solid
framework for Dark Matter exploration.
","[{""version"":""v1"",""created"":""Wed, 2 Feb 2022 12:30:56 GMT""},{""version"":""v2"",""created"":""Thu, 3 Feb 2022 09:45:06 GMT""}]","2022-02-04"
"2202.00997","Lusine Abrahamyan","Lusine Abrahamyan, Anh Minh Truong, Wilfried Philips, Nikos
  Deligiannis","Gradient Variance Loss for Structure-Enhanced Image Super-Resolution","ICASSP 2022",,,,"eess.IV cs.AI cs.CV","http://arxiv.org/licenses/nonexclusive-distrib/1.0/","  Recent success in the field of single image super-resolution (SISR) is
achieved by optimizing deep convolutional neural networks (CNNs) in the image
space with the L1 or L2 loss. However, when trained with these loss functions,
models usually fail to recover sharp edges present in the high-resolution (HR)
images for the reason that the model tends to give a statistical average of
potential HR solutions. During our research, we observe that gradient maps of
images generated by the models trained with the L1 or L2 loss have
significantly lower variance than the gradient maps of the original
high-resolution images. In this work, we propose to alleviate the above issue
by introducing a structure-enhancing loss function, coined Gradient Variance
(GV) loss, and generate textures with perceptual-pleasant details.
Specifically, during the training of the model, we extract patches from the
gradient maps of the target and generated output, calculate the variance of
each patch and form variance maps for these two images. Further, we minimize
the distance between the computed variance maps to enforce the model to produce
high variance gradient maps that will lead to the generation of high-resolution
images with sharper edges. Experimental results show that the GV loss can
significantly improve both Structure Similarity (SSIM) and peak signal-to-noise
ratio (PSNR) performance of existing image super-resolution (SR) deep learning
models.
","[{""version"":""v1"",""created"":""Wed, 2 Feb 2022 12:31:05 GMT""}]","2022-02-03"
"2202.00998","Zhize Li","Peter Richt\'arik, Igor Sokolov, Ilyas Fatkhullin, Elnur Gasanov,
  Zhize Li, Eduard Gorbunov","3PC: Three Point Compressors for Communication-Efficient Distributed
  Training and a Better Theory for Lazy Aggregation","52 pages",,,,"cs.LG cs.DC cs.DS math.OC","http://arxiv.org/licenses/nonexclusive-distrib/1.0/","  We propose and study a new class of gradient communication mechanisms for
communication-efficient training -- three point compressors (3PC) -- as well as
efficient distributed nonconvex optimization algorithms that can take advantage
of them. Unlike most established approaches, which rely on a static compressor
choice (e.g., Top-$K$), our class allows the compressors to {\em evolve}
throughout the training process, with the aim of improving the theoretical
communication complexity and practical efficiency of the underlying methods. We
show that our general approach can recover the recently proposed
state-of-the-art error feedback mechanism EF21 (Richt\'arik et al., 2021) and
its theoretical properties as a special case, but also leads to a number of new
efficient methods. Notably, our approach allows us to improve upon the state of
the art in the algorithmic and theoretical foundations of the {\em lazy
aggregation} literature (Chen et al., 2018). As a by-product that may be of
independent interest, we provide a new and fundamental link between the lazy
aggregation and error feedback literature. A special feature of our work is
that we do not require the compressors to be unbiased.
","[{""version"":""v1"",""created"":""Wed, 2 Feb 2022 12:34:18 GMT""}]","2022-02-03"
"2202.00999","Samuele Marco Silveravalle","Samuele Silveravalle","The gravitational field of isolated objects in quadratic gravity","4 pages, 2 figures","Nuovo Cimento Soc. Ital. Fis. C 05, 153 (2022)","10.1393/ncc/i2022-22153-1",,"gr-qc hep-th","http://arxiv.org/licenses/nonexclusive-distrib/1.0/","  When describing gravity at high energies it is natural to introduce terms
quadratic in the curvature as first corrections to the Einstein-Hilbert action.
Static, spherically symmetric classical solutions are studied in the case of
the quantum-motivated $R+R^2+C^{\mu\nu\rho\sigma}C_{\mu\nu\rho\sigma}$ theory.
In contrast with the case of General Relativity, where the metric is forced to
be the Schwarzschild one, a large spectrum of solutions with different
gravitational potentials has been found. It is shown how these solutions
populate the parameter space of the theory, and some possible phenomenological
implications of this modified potential are discussed.
","[{""version"":""v1"",""created"":""Wed, 2 Feb 2022 12:34:27 GMT""},{""version"":""v2"",""created"":""Tue, 28 Jun 2022 09:07:03 GMT""}]","2022-07-05"
