"2202.00833","Mohammad Mirhosseini","Alkim Bozkurt, Chaitali Joshi, and Mohammad Mirhosseini","Deep sub-wavelength localization of light and sound in dielectric
  resonators",,,"10.1364/OE.455248",,"physics.optics physics.app-ph","http://creativecommons.org/licenses/by-nc-nd/4.0/","  Optomechanical crystals provide coupling between phonons and photons by
confining them to commensurate wavelength-scale dimensions. We present a new
concept for designing optomechanical crystals capable of achieving
unprecedented coupling rates by confining optical and mechanical waves to deep
sub-wavelength dimensions. Our design is based on a dielectric bowtie unit cell
with an effective optical/mechanical mode volume of $7.6 \times 10^{-3}
{(\lambda/n_{\textrm{Si}})}^3$/$ 1.2 \times 10^{-3}
{\lambda_{\textrm{mech}}}^3$. We present results from numerical modeling,
indicating a single-photon optomechanical coupling of 2.2 MHz with
experimentally viable parameters. Monte Carlo simulations are used to
demonstrate the design's robustness against fabrication disorder.
","[{""version"":""v1"",""created"":""Wed, 2 Feb 2022 01:07:53 GMT""}]","2022-04-13"
"2202.00834","Kiran Vodrahalli","Kiran Vodrahalli and Rakesh Shivanna and Maheswaran Sathiamoorthy and
  Sagar Jain and Ed H. Chi","Nonlinear Initialization Methods for Low-Rank Neural Networks","32 pages, 4 figures, in submission. fixed some errors in previous
  versions and re-structured/re-focused the paper",,,,"cs.LG cs.AI cs.DS stat.ML","http://creativecommons.org/licenses/by-nc-sa/4.0/","  We propose a novel low-rank initialization framework for training low-rank
deep neural networks -- networks where the weight parameters are
re-parameterized by products of two low-rank matrices. The most successful
prior existing approach, spectral initialization, draws a sample from the
initialization distribution for the full-rank setting and then optimally
approximates the full-rank initialization parameters in the Frobenius norm with
a pair of low-rank initialization matrices via singular value decomposition.
Our method is inspired by the insight that approximating the function
corresponding to each layer is more important than approximating the parameter
values. We provably demonstrate that there is a significant gap between these
two approaches for ReLU networks, particularly as the desired rank of the
approximating weights decreases, or as the dimension of the inputs to the layer
increases (the latter point holds when the network width is super-linear in
dimension). Along the way, we provide the first provably efficient algorithm
for solving the ReLU low-rank approximation problem for fixed parameter rank
$r$ -- previously, it was unknown that the problem was computationally
tractable to solve even for rank $1$. We also provide a practical algorithm to
solve this problem which is no more expensive than the existing spectral
initialization approach, and validate our theory by training ResNet and
EfficientNet models (He et al., 2016; Tan & Le, 2019) on ImageNet (Russakovsky
et al., 2015).
","[{""version"":""v1"",""created"":""Wed, 2 Feb 2022 01:08:29 GMT""},{""version"":""v2"",""created"":""Thu, 3 Feb 2022 16:27:08 GMT""},{""version"":""v3"",""created"":""Fri, 20 May 2022 02:45:47 GMT""}]","2022-05-23"
"2202.00835","Jordan Lambert Silva","Jordan Lambert, Lonardo Rabelo","A new poset for compositions equivalent to the Bruhat order of the
  symmetric group","17 pages, 8 figures",,,,"math.CO","http://arxiv.org/licenses/nonexclusive-distrib/1.0/","  Lehmer's code gives a bijection between the symmetric group and the set of
staircase compositions. In this paper, we define a new poset for such
compositions and derive its equivalence with the strong Bruhat order of the
symmetric group. This is an intrinsic construction that does not require any
mention of the associated permutations.
","[{""version"":""v1"",""created"":""Wed, 2 Feb 2022 01:16:51 GMT""}]","2022-02-03"
"2202.00836","Yanan Liu","Yanan Liu, Laurie Bose, Yao Lu, Piotr Dudek, Walterio Mayol-Cuevas","On-Sensor Binarized Fully Convolutional Neural Network with A Pixel
  Processor Array","lack of experiments for method validation",,,,"cs.CV cs.ET eess.SP","http://arxiv.org/licenses/nonexclusive-distrib/1.0/","  This work presents a method to implement fully convolutional neural networks
(FCNs) on Pixel Processor Array (PPA) sensors, and demonstrates coarse
segmentation and object localisation tasks. We design and train binarized FCN
for both binary weights and activations using batchnorm, group convolution, and
learnable threshold for binarization, producing networks small enough to be
embedded on the focal plane of the PPA, with limited local memory resources,
and using parallel elementary add/subtract, shifting, and bit operations only.
We demonstrate the first implementation of an FCN on a PPA device, performing
three convolution layers entirely in the pixel-level processors. We use this
architecture to demonstrate inference generating heat maps for object
segmentation and localisation at over 280 FPS using the SCAMP-5 PPA vision
chip.
","[{""version"":""v1"",""created"":""Wed, 2 Feb 2022 01:18:40 GMT""},{""version"":""v2"",""created"":""Sat, 11 Jun 2022 06:41:34 GMT""}]","2022-06-14"
"2202.00837","Sidney Allen Morris","Taboka Prince Chalebgwa and Sidney A. Morris","Topological Transcendental Fields","6 pages",,,,"math.GN","http://creativecommons.org/licenses/by/4.0/","  This article initiates the study of topological transcendental fields $\FF$
which are subfields of the topological field $\CC$ of all complex numbers such
that $\FF$ consists of only rational numbers and a nonempty set of
transcendental numbers. $\FF$, with the topology it inherits as a subspace of
$\CC$, is a topological field. Each topological transcendental field is a
separable metrizable zero-dimensional space and algebraically is $\QQ(T)$, the
extension of the field of rational numbers by a set $T$ of transcendental
numbers. It is proved that there exist precisely $2^{\aleph_0}$ countably
infinite topological transcendental fields and each is homeomorphic to the
space $\QQ$ of rational numbers with its usual topology. It is also shown that
there is a class of $2^{2^{\aleph_0} }$ of topological transcendental fields of
the form $\QQ(T)$ with $T$ a set of Liouville numbers, no two of which are
homeomorphic.
","[{""version"":""v1"",""created"":""Wed, 2 Feb 2022 01:18:56 GMT""}]","2022-02-03"
"2202.00838","Arturo Deza","Anne Harrington and Arturo Deza","Finding Biological Plausibility for Adversarially Robust Features via
  Metameric Tasks","Accepted to ICLR 2022 as a Spotlight",,,,"cs.CV cs.AI q-bio.NC","http://arxiv.org/licenses/nonexclusive-distrib/1.0/","  Recent work suggests that representations learned by adversarially robust
networks are more human perceptually-aligned than non-robust networks via image
manipulations. Despite appearing closer to human visual perception, it is
unclear if the constraints in robust DNN representations match biological
constraints found in human vision. Human vision seems to rely on
texture-based/summary statistic representations in the periphery, which have
been shown to explain phenomena such as crowding and performance on visual
search tasks. To understand how adversarially robust
optimizations/representations compare to human vision, we performed a
psychophysics experiment using a set of metameric discrimination tasks where we
evaluated how well human observers could distinguish between images synthesized
to match adversarially robust representations compared to non-robust
representations and a texture synthesis model of peripheral vision (Texforms).
We found that the discriminability of robust representation and texture model
images decreased to near chance performance as stimuli were presented farther
in the periphery. Moreover, performance on robust and texture-model images
showed similar trends within participants, while performance on non-robust
representations changed minimally across the visual field. These results
together suggest that (1) adversarially robust representations capture
peripheral computation better than non-robust representations and (2) robust
representations capture peripheral computation similar to current
state-of-the-art texture peripheral vision models. More broadly, our findings
support the idea that localized texture summary statistic representations may
drive human invariance to adversarial perturbations and that the incorporation
of such representations in DNNs could give rise to useful properties like
adversarial robustness.
","[{""version"":""v1"",""created"":""Wed, 2 Feb 2022 01:19:40 GMT""},{""version"":""v2"",""created"":""Fri, 4 Feb 2022 00:24:45 GMT""}]","2022-02-07"
"2202.00839","Damian Vergara","Dami\'an Vergara","Minimum Wages and Optimal Redistribution",,,,,"econ.GN q-fin.EC","http://arxiv.org/licenses/nonexclusive-distrib/1.0/","  This paper analyzes whether a minimum wage should be used for redistribution
on top of taxes and transfers. I characterize optimal redistribution for a
government with three policy instruments -- labor income taxes and transfers,
corporate income taxes, and a minimum wage -- using an empirically grounded
model of the labor market with positive firm profits. A minimum wage can
increase social welfare when it increases the average post-tax wages of
low-skill labor market participants and when corporate profit incidence is
large. When chosen together with taxes, the minimum wage can help the
government redistribute efficiently to low-skill workers by preventing firms
from capturing low-wage income subsidies such as the EITC and from enjoying
high profits that cannot be redistributed via corporate taxes due to capital
mobility in unaffected industries. Event studies show that the average US
state-level minimum wage reform over the last two decades increased average
post-tax wages of low-skilled labor market participants and reduced corporate
profits in affected industries, namely low-skill labor-intensive services. A
sufficient statistics analysis implies that US minimum wages typically remain
below their optimum under the current tax and transfer system.
","[{""version"":""v1"",""created"":""Wed, 2 Feb 2022 01:25:27 GMT""},{""version"":""v2"",""created"":""Fri, 6 May 2022 21:08:17 GMT""},{""version"":""v3"",""created"":""Wed, 7 Dec 2022 02:42:46 GMT""}]","2022-12-08"
"2202.00840","Warit Asavanant","Warit Asavanant, Kosuke Fukui, Atsushi Sakaguchi, Akira Furusawa","Switching-free time-domain optical quantum computation with quantum
  teleportation","13 pages, 7 figures. Calculation mistakes are fixed and details of
  the analysis are added to the new version",,"10.1103/PhysRevA.107.032412",,"quant-ph","http://arxiv.org/licenses/nonexclusive-distrib/1.0/","  Optical switches and rerouting network are main obstacles to realize optical
quantum computer. In particular, both components have been considered as
essential components to the measurement-based time-domain optical quantum
computation, which has seen promising developments regarding scalability in the
recent years. Realizing optical switches and rerouting network with sufficient
performance is, however, experimentally challenging as they must have extremely
low loss, small switching time, high repetition rate, and minimum optical
nonlinearity. In this work, we present an optical quantum computation platform
that does not require such optical switches. Our method is based on
continuous-variable measurement-based quantum computation, where instead of the
typical cluster states, we modify the structure of the quantum entanglements,
so that quantum teleportation protocol can be employed instead of the optical
switching and rerouting. We also show that when combined with
Gottesman-Kitaev-Preskill encoding, our architecture can outperform the
architecture with optical switches when the optical losses of the switches are
not low.
","[{""version"":""v1"",""created"":""Wed, 2 Feb 2022 01:26:41 GMT""},{""version"":""v2"",""created"":""Fri, 6 May 2022 07:16:31 GMT""}]","2023-03-29"
"2202.00841","Mingjian He","Mingjian He, Robert Malaney, Ryan Aguinaldo","On the Teleportation of Discrete Variable Qubits Via Continuous Variable
  Lossy Channels","11 pages",,"10.1103/PhysRevA.105.062407",,"quant-ph","http://creativecommons.org/licenses/by/4.0/","  The Continuous-Variable (CV) quantum state of light allows for the
teleportation of a Discrete-Variable (DV) photonic qubit. Such an operation is
useful in the realm of hybrid quantum networks. However, it is known that the
teleportation of a DV qubit via a Gaussian CV resource channel is severely
limited under channel loss, with a teleportation fidelity beyond the classical
limit unattainable for losses exceeding a small threshold of 0.5 dB. In this
work, we present a new non-deterministic teleportation protocol that combines a
Gaussian CV resource channel with a modified form of the Bell State Measurement
that accommodates a DV-qubit fidelity beyond the classical limit for channel
losses up to 20~dB. Beyond this orders of magnitude improvement, we also show
how the use of non-Gaussian operations on the CV resource channel can lead to a
DV-qubit fidelity approaching unity for any channel loss.
","[{""version"":""v1"",""created"":""Wed, 2 Feb 2022 01:26:46 GMT""}]","2022-06-14"
"2202.00842","Naoyuki Kanda","Naoyuki Kanda, Jian Wu, Yu Wu, Xiong Xiao, Zhong Meng, Xiaofei Wang,
  Yashesh Gaur, Zhuo Chen, Jinyu Li, Takuya Yoshioka","Streaming Multi-Talker ASR with Token-Level Serialized Output Training","6 pages, 1 figure, 7 tables, v2: minor fixes, v3: Appendix D has been
  added, v4: citation to [27] has been added, v5: citations to [28][29][30]
  have been added with minor fixes, short version accepted for presentation at
  Interspeech 2022",,,,"eess.AS cs.CL cs.SD","http://arxiv.org/licenses/nonexclusive-distrib/1.0/","  This paper proposes a token-level serialized output training (t-SOT), a novel
framework for streaming multi-talker automatic speech recognition (ASR). Unlike
existing streaming multi-talker ASR models using multiple output branches, the
t-SOT model has only a single output branch that generates recognition tokens
(e.g., words, subwords) of multiple speakers in chronological order based on
their emission times. A special token that indicates the change of ``virtual''
output channels is introduced to keep track of the overlapping utterances.
Compared to the prior streaming multi-talker ASR models, the t-SOT model has
the advantages of less inference cost and a simpler model architecture.
Moreover, in our experiments with LibriSpeechMix and LibriCSS datasets, the
t-SOT-based transformer transducer model achieves the state-of-the-art word
error rates by a significant margin to the prior results. For non-overlapping
speech, the t-SOT model is on par with a single-talker ASR model in terms of
both accuracy and computational cost, opening the door for deploying one model
for both single- and multi-talker scenarios.
","[{""version"":""v1"",""created"":""Wed, 2 Feb 2022 01:27:21 GMT""},{""version"":""v2"",""created"":""Sat, 5 Feb 2022 00:58:12 GMT""},{""version"":""v3"",""created"":""Fri, 25 Feb 2022 19:37:08 GMT""},{""version"":""v4"",""created"":""Thu, 17 Mar 2022 21:09:35 GMT""},{""version"":""v5"",""created"":""Thu, 14 Jul 2022 20:40:04 GMT""}]","2022-07-18"
"2202.00843","Jiawei Lu","Jiawei Lu, He Wang, Tianjia Shao, Yin Yang, Kun Zhou","Pose Guided Image Generation from Misaligned Sources via Residual Flow
  Based Correction",,,,,"cs.CV","http://arxiv.org/licenses/nonexclusive-distrib/1.0/","  Generating new images with desired properties (e.g. new view/poses) from
source images has been enthusiastically pursued recently, due to its wide range
of potential applications. One way to ensure high-quality generation is to use
multiple sources with complementary information such as different views of the
same object. However, as source images are often misaligned due to the large
disparities among the camera settings, strong assumptions have been made in the
past with respect to the camera(s) or/and the object in interest, limiting the
application of such techniques. Therefore, we propose a new general approach
which models multiple types of variations among sources, such as view angles,
poses, facial expressions, in a unified framework, so that it can be employed
on datasets of vastly different nature. We verify our approach on a variety of
data including humans bodies, faces, city scenes and 3D objects. Both the
qualitative and quantitative results demonstrate the better performance of our
method than the state of the art.
","[{""version"":""v1"",""created"":""Wed, 2 Feb 2022 01:30:15 GMT""}]","2022-02-03"
"2202.00844","Toshiaki Shoji","Ying Ma, Toshiaki Shoji and Zhiping Zhou","Diagram automorphisms and canonical bases for quantum affine algebras,
  II","48 PAGES",,,,"math.QA","http://creativecommons.org/licenses/by/4.0/","  Let ${\mathbf U}_q^-$ be the negative part of the quantum enveloping algebra,
and $\sigma$ the algebra automorphism on ${\mathbf U}_q^-$ induced from a
diagram automorphism. Let $\underline{\mathbf U}_q^-$ be the quantum algebra
obtained from $\sigma$, and $\widetilde{\mathbf B}$ (resp.
$\widetilde{\underline{\mathbf B}}$) the canonical signed basis of ${\mathbf
U}_q^-$ (resp. $\underline{\mathbf U}_q^-$). Assume that ${\mathbf U}_q^-$ is
simply-laced of finite or affine type. In our previous papers [SZ1, 2], we have
proved by an elementary method, that there exists a natural bijection
$\widetilde{\mathbf B}^{\sigma} \simeq \widetilde{\underline{\mathbf B}}$ in
the case where $\sigma$ is admissible. In this paper, we show that such a
bijection exists even if $\sigma$ is not admissible, possibly except some small
rank cases.
","[{""version"":""v1"",""created"":""Wed, 2 Feb 2022 01:31:32 GMT""}]","2022-02-03"
"2202.00845","Josh Johnston","Josh Johnston and Tim Andersen","Random Processes with High Variance Produce Scale Free Networks","Submitted to Physica A. 13 pages, 1 figure",,"10.1016/j.physa.2022.127588",,"cs.DM physics.soc-ph","http://creativecommons.org/licenses/by/4.0/","  Real-world networks tend to be scale free, having heavy-tailed degree
distributions with more hubs than predicted by classical random graph
generation methods. Preferential attachment and growth are the most commonly
accepted mechanisms leading to these networks and are incorporated in the
Barab\'asi-Albert (BA) model. We provide an alternative model using a randomly
stopped linking process inspired by a generalized Central Limit Theorem (CLT)
for geometric distributions with widely varying parameters. The common
characteristic of both the BA model and our randomly stopped linking model is
the mixture of widely varying geometric distributions, suggesting the critical
characteristic of scale free networks is high variance, not growth or
preferential attachment. The limitation of classical random graph models is low
variance in parameters, while scale free networks are the natural, expected
result of real-world variance.
","[{""version"":""v1"",""created"":""Wed, 2 Feb 2022 01:36:33 GMT""}]","2022-07-20"
"2202.00846","Zenan Wang","Zenan Wang, Carlos Carrion, Xiliang Lin, Fuhua Ji, Yongjun Bao,
  Weipeng Yan","Adaptive Experimentation with Delayed Binary Feedback","to be published in Proceedings of the ACM Web Conference 2022 (WWW
  '22)",,"10.1145/3485447.3512097",,"cs.IR cs.LG","http://creativecommons.org/licenses/by-nc-sa/4.0/","  Conducting experiments with objectives that take significant delays to
materialize (e.g. conversions, add-to-cart events, etc.) is challenging.
Although the classical ""split sample testing"" is still valid for the delayed
feedback, the experiment will take longer to complete, which also means
spending more resources on worse-performing strategies due to their fixed
allocation schedules. Alternatively, adaptive approaches such as ""multi-armed
bandits"" are able to effectively reduce the cost of experimentation. But these
methods generally cannot handle delayed objectives directly out of the box.
This paper presents an adaptive experimentation solution tailored for delayed
binary feedback objectives by estimating the real underlying objectives before
they materialize and dynamically allocating variants based on the estimates.
Experiments show that the proposed method is more efficient for delayed
feedback compared to various other approaches and is robust in different
settings. In addition, we describe an experimentation product powered by this
algorithm. This product is currently deployed in the online experimentation
platform of JD.com, a large e-commerce company and a publisher of digital ads.
","[{""version"":""v1"",""created"":""Wed, 2 Feb 2022 01:47:10 GMT""}]","2022-02-03"
"2202.00847","Craig Cahillane","Craig Cahillane and Georgia Mansell","Review of the Advanced LIGO gravitational wave observatories leading to
  observing run four","33 pages, 7 figures, 181 references","Galaxies 2022, 10(1), 36;","10.3390/galaxies10010036","LIGO DCC P2100483","gr-qc astro-ph.IM physics.ins-det","http://creativecommons.org/licenses/by/4.0/","  Gravitational waves from binary black hole and neutron star mergers are being
regularly detected. As of 2021, ninety confident gravitational wave detections
have been made by the LIGO and Virgo detectors. Work is ongoing to further
increase the sensitivity of the detectors for the fourth observing run,
including installing some of the A+ upgrades designed to lower the fundamental
noise that limits the sensitivity to gravitational waves. In this review, we
will overview how the LIGO detectors work, including their optical
configuration and lock acquisition procedure, discuss the detectors'
fundamental and technical noise limits and compare to the current measured
sensitivity, and review the A+ upgrades currently being installed in the
detectors.
","[{""version"":""v1"",""created"":""Wed, 2 Feb 2022 01:51:41 GMT""}]","2022-03-15"
"2202.00848","Bo Zhang","Bo Zhang and Jiayao Zhang","Some Reflections on Drawing Causal Inference using Textual Data:
  Parallels Between Human Subjects and Organized Texts","Accepted to CLeaR 2022",,,,"cs.CL cs.LG stat.AP stat.ML","http://creativecommons.org/licenses/by-sa/4.0/","  We examine the role of textual data as study units when conducting causal
inference by drawing parallels between human subjects and organized texts. %in
human population research. We elaborate on key causal concepts and principles,
and expose some ambiguity and sometimes fallacies. To facilitate better framing
a causal query, we discuss two strategies: (i) shifting from immutable traits
to perceptions of them, and (ii) shifting from some abstract concept/property
to its constituent parts, i.e., adopting a constructivist perspective of an
abstract concept. We hope this article would raise the awareness of the
importance of articulating and clarifying fundamental concepts before delving
into developing methodologies when drawing causal inference using textual data.
","[{""version"":""v1"",""created"":""Wed, 2 Feb 2022 01:54:04 GMT""}]","2022-02-03"
"2202.00849","Carolina Salgado","C. Salgado, G. S. Da Costa, D. Yong, R. Salinas, J. E. Norris, A. D.
  Mackey, A.F. Marino, A. P. Milone","Evidence of globular cluster abundance anomalies in the SMC
  intermediate-age cluster Kron 3","20 pages, 21 figures, 7 tables",,"10.1093/mnras/stac1724",,"astro-ph.GA astro-ph.SR","http://arxiv.org/licenses/nonexclusive-distrib/1.0/","  Using spectra obtained with the VLT/FORS2 and Gemini-S/GMOS instruments we
have investigated carbon, nitrogen and sodium abundances in a sample of red
giants in the Small Magellanic Cloud cluster Kron 3. The metallicity and
luminosity of this cluster are comparable to those of Galactic globular
clusters although with a notably younger age of $\sim$ 6.5 Gyr. Specifically we
have investigated the strengths of the CH ($\lambda$ 4300 A) and CN ($\lambda$
3800, $\lambda$ 4215) molecular bands finding a bimodality of CN band-strengths
and a CH/CN anti-correlation. Application of spectrum synthesis techniques
reveals a large spread ($\sim$1.2 dex) in nitrogen abundance and a spread in
[C/Fe] of $\sim$0.3 dex after applying corrections for evolutionary mixing. We
have also estimated sodium abundances from the strengths of the Na D lines
finding a range of $\sim$0.8 dex in [Na/Fe] that correlates positively with the
N abundances. This is the first star-by-star spectroscopic demonstration of
correlated Na, N abundance variations in an intermediate-age star cluster,
adding to existing photometric and spectroscopic indications of the presence of
multiple populations in such clusters with masses in excess of $\sim 10^5$
solar masses. Our results confirm that the mechanism(s) responsible for the
multiple populations observed in globular clusters cannot be an early
cosmological effect applying only in old clusters, and provide a key additional
factor in the quest to understand the origin of the abundance anomalies.
","[{""version"":""v1"",""created"":""Wed, 2 Feb 2022 02:02:12 GMT""},{""version"":""v2"",""created"":""Fri, 17 Jun 2022 16:01:28 GMT""}]","2022-06-29"
