"2202.00683","Vinayak Raj","Debarshi Basu, Himanshu Parihar, Vinayak Raj and Gautam Sengupta","Entanglement negativity, reflected entropy, and anomalous gravitation","49 pages, 14 figures and 1 appendix,v2: minor modifications,
  references added, v3: matches the published version, v4: erratum included","Phys. Rev. D 105, 086013 (2022); Phys. Rev. D 105, 129902(E)
  (2022)","10.1103/PhysRevD.105.086013 10.1103/PhysRevD.105.129902",,"hep-th","http://arxiv.org/licenses/nonexclusive-distrib/1.0/","  We investigate mixed state entanglement measures of entanglement negativity
and reflected entropy for bipartite states in two dimensional conformal field
theories with an anomaly through appropriate replica techniques. Furthermore we
propose holographic constructions for these measures from the corresponding
bulk dual geometries involving topologically massive gravity in AdS$_3$ and
find exact agreement with the field theory results. In this connection we
extend an earlier holographic proposal for the entanglement negativity to the
bulk action with a gravitational Chern-Simons term and compute its contribution
to the entanglement wedge cross section dual to the reflected entropy.
","[{""version"":""v1"",""created"":""Tue, 1 Feb 2022 19:00:00 GMT""},{""version"":""v2"",""created"":""Thu, 17 Feb 2022 10:58:49 GMT""},{""version"":""v3"",""created"":""Mon, 25 Apr 2022 12:00:02 GMT""},{""version"":""v4"",""created"":""Thu, 23 Jun 2022 17:41:04 GMT""}]","2022-06-24"
"2202.00684","Alberto Salvio","Alberto Salvio","BICEP/Keck data and Quadratic Gravity","v2: 21 pages, 5 figures, published version","JCAP 09 (2022) 027","10.1088/1475-7516/2022/09/027",,"astro-ph.CO gr-qc hep-ph hep-th","http://creativecommons.org/licenses/by/4.0/","  The recent results of the BICEP and Keck collaborations have put stringent
bounds on many inflationary models, including some well-motivated ones. This is
certainly the case when gravity remains described by Einstein's theory up to
the inflationary scale, but can be avoided by introducing
quadratic-in-curvature terms that are effective at that scale. Recently it has
also been shown that these terms can UV complete gravity respecting stability
and unitarity. Here the predictions of such quadratic gravity are computed and
compared with the BICEP/Keck constraints by focusing on some of the
inflationary scenarios that are best-motivated from the particle physics point
of view and are already ruled out in Einstein gravity: (critical) Higgs
inflation and natural inflation. The first scenario can be considered as the
most economical option as the inflaton is identified with the only known
elementary scalar field in the Standard Model and the near criticality of the
Standard Model is used to remain in the perturbative regime. In the second one
a pseudo-Nambu-Goldstone boson contributes to the inflationary dynamics and its
potential is naturally flat. It is shown that in both scenarios one can restore
the agreement with the observational constraints in quadratic gravity.
","[{""version"":""v1"",""created"":""Tue, 1 Feb 2022 19:00:01 GMT""},{""version"":""v2"",""created"":""Fri, 9 Sep 2022 06:19:01 GMT""}]","2022-09-12"
"2202.00685","Alessandro Paggi","A. Paggi, G. Fabbiano, E. Nardini, M. Karovska, M. Elvis, J. Wang","Dissecting the Extended X-ray Emission in the Merging Pair NGC 6240","36 pages, 16 figures, 4 tables, accepted for publication on ApJ",,"10.3847/1538-4357/ac5025",,"astro-ph.GA","http://creativecommons.org/licenses/by/4.0/","  We present a detailed spectral and imaging analysis of the central $15''$
radius ($\sim 7.5 \text{ kpc}$) region of the merger galaxy NGC 6240 that makes
use of all the available \textit{Chandra}-ACIS data ($0.3 - 3 \text{ keV}$
effective exposure of $\sim 190 \text{ ks}$). This region shows extended X-ray
structures with lower energy counterparts imaged in CO, [O III] and H$\alpha$
line emission. We find both photo-ionized phases of possible nuclear excitation
and thermal shock-excited emission in the different large-scale components: the
north-west ""loop"" detected in H$\alpha$, the region surrounding the two nuclei,
the large outflow region to the north-east detected in [O III], and the
southern X-ray extensions. The latter could be the ionization cone of the
northern nucleus, with the N counterpart being obscured by the galaxy disk. The
radial distribution of the X-ray surface brightness suggests a confined hot
interstellar medium at $r < 2.5 \text{ kpc}$, with a free-flowing wind at
larger radii; if the confinement is magnetic, we estimate B-field values of
$\sim 100\,\mu \text{G}$ , similar to those measured in the halo of M82. The
thermal gas of the extended halo at $kT \sim 1 \text{ keV}$ absorbs soft X-rays
from the AGN, but not the extreme ultraviolet radiation leading to a rapid
increase in $F_{\text{[O III]}}/F_{\text{X}}$ beyond $\sim 3 \text{ kpc}$. The
$\alpha$ element to Fe abundance ratios of the thermal components in the
different regions of the extended X-ray emission are generally compatible with
SNe II yields, confirming the importance of the active star formation in NGC
6240.
","[{""version"":""v1"",""created"":""Tue, 1 Feb 2022 19:00:01 GMT""}]","2022-03-30"
"2202.00686","Thorsten Buss","Thorsten Buss, Barry M. Dillon, Thorben Finke, Michael Kr\""amer,
  Alessandro Morandini, Alexander M\""uck, Ivan Oleksiyuk, Tilman Plehn","What's Anomalous in LHC Jets?","30 pages",,,,"hep-ph","http://arxiv.org/licenses/nonexclusive-distrib/1.0/","  Searches for anomalies are the main motivation for the LHC and define key
analysis steps, including triggers. We discuss how LHC anomalies can be defined
through probability density estimates, evaluated in a physics space or in an
appropriate neural network latent space. We illustrate this for classical
k-means clustering, a Dirichlet variational autoencoder, and invertible neural
networks. For two especially challenging scenarios of jets from a dark sector
we evaluate the strengths and limitations of each method.
","[{""version"":""v1"",""created"":""Tue, 1 Feb 2022 19:00:01 GMT""},{""version"":""v2"",""created"":""Fri, 11 Feb 2022 14:54:36 GMT""}]","2022-02-14"
"2202.00687","Andrea Amoretti","Andrea Amoretti, Daniel K. Brattan, Nicodemo Magnoli, Luca Martinoia,
  Ioannis Matthaiakakis and Paolo Solinas","Destroying superconductivity in thin films with an electric field","5+5 pages, 13 figs; version published in Physical Review Research","Phys. Rev. Research 4, 033211 (2022)","10.1103/PhysRevResearch.4.033211",,"cond-mat.supr-con cond-mat.mes-hall hep-th","http://arxiv.org/licenses/nonexclusive-distrib/1.0/","  In this paper we use a Ginzburg-Landau approach to show that a suitably
strong electric field can drive a phase transition from a superconductor to a
normal metal. The transition is induced by taking into account corrections to
the permittivity due to the superconductive gap and persists even when
screening effects are considered. We test the model against recent experimental
observations in which a strong electric field has been observed to control the
supercurrent in superconducting thin films. We find excellent agreement with
the experimental data and are able to explain several observed features. We
additionally suggest a way to test our theoretical proposal via
superconductor-superconductor electron tunneling.
","[{""version"":""v1"",""created"":""Tue, 1 Feb 2022 19:00:01 GMT""},{""version"":""v2"",""created"":""Fri, 23 Sep 2022 13:58:56 GMT""}]","2022-09-28"
"2202.00688","Shahar Hod","Shahar Hod","No-short scalar hair theorem for spinning acoustic black holes in a
  photon-fluid model","8 pages","Physical Review D 104, 104041 (2021)","10.1103/PhysRevD.104.104041",,"gr-qc astro-ph.HE hep-th","http://creativecommons.org/licenses/by/4.0/","  It has recently been revealed that spinning black holes of the photon-fluid
model can support acoustic `clouds', stationary density fluctuations whose
spatially regular radial eigenfunctions are determined by the
$(2+1)$-dimensional Klein-Gordon equation of an effective massive scalar field.
Motivated by this intriguing observation, we use {\it analytical} techniques in
order to prove a no-short hair theorem for the composed
acoustic-black-hole-scalar-clouds configurations. In particular, it is proved
that the effective lengths of the stationary bound-state co-rotating acoustic
scalar clouds are bounded from below by the series of inequalities
$r_{\text{hair}}>{{1+\sqrt{5}}\over{2}}\cdot r_{\text{H}}>r_{\text{null}}$,
where $r_{\text{H}}$ and $r_{\text{null}}$ are respectively the horizon radius
of the supporting black hole and the radius of the co-rotating null circular
geodesic that characterizes the acoustic spinning black-hole spacetime.
","[{""version"":""v1"",""created"":""Tue, 1 Feb 2022 19:00:01 GMT""}]","2022-02-09"
"2202.00689","Paolo Glorioso","Paolo Glorioso and Sean A. Hartnoll","Joule heating in bad and slow metals","21+9 pages, 8 figures; v2: minor clarifications","SciPost Phys. 13, 095 (2022)","10.21468/SciPostPhys.13.4.095",,"cond-mat.str-el hep-th","http://arxiv.org/licenses/nonexclusive-distrib/1.0/","  Heat supplied to a metal is absorbed by the electrons and then transferred to
the lattice. In conventional metals energy is released to the lattice by
phonons emitted from the Lindhard continuum. However in a `bad' metal, with
short mean free path, the low energy Lindhard continuum is destroyed.
Furthermore in a `slow' metal, with Fermi velocity less than the sound
velocity, particle-hole pairs are kinematically unable to emit phonons. To
describe energy transfer to the lattice in these cases we obtain a general Kubo
formula for the energy relaxation rate in terms of the electronic density
spectral weight $\text{Im} \, G^R_{nn}(\omega_k,k)$ evaluated on the phonon
dispersion $\omega_k$. We apply our Kubo formula to the high temperature
Hubbard model, using recent data from quantum Monte Carlo and experiments in
ultracold atoms to characterize $\text{Im} \, G^R_{nn}(\omega_k,k)$. We
furthermore use recent data from electron energy-loss spectroscopy to estimate
the energy relaxation rate of the cuprate strange metal to a high energy
optical phonon. As a second, distinct, application of our formalism we consider
`slow' metals. These are defined to have Fermi velocity less than the sound
velocity, so that particle-hole pairs are kinematically unable to emit phonons.
We obtain an expression for the energy relaxation rate of a slow metal in terms
of the optical conductivity.
","[{""version"":""v1"",""created"":""Tue, 1 Feb 2022 19:00:02 GMT""},{""version"":""v2"",""created"":""Thu, 28 Apr 2022 05:32:54 GMT""},{""version"":""v3"",""created"":""Tue, 30 Aug 2022 00:12:25 GMT""}]","2022-10-12"
"2202.00690","Amelie Saintonge","Amelie Saintonge and Barbara Catinella","The cold interstellar medium of galaxies in the Local Universe","46 pages, 11 figures, to appear in Annual Review of Astronomy and
  Astrophysics, Vol. 60, 2022","Annual Review of Astronomy and Astrophysics, 60, 319-361 (2022)","10.1146/annurev-astro-021022-043545",,"astro-ph.GA astro-ph.CO","http://creativecommons.org/licenses/by-nc-nd/4.0/","  The cold interstellar medium (ISM) plays a central role in the galaxy
evolution process. It is the reservoir that fuels galaxy growth via star
formation, the repository of material formed by these stars, and a sensitive
tracer of internal and external processes that affect entire galaxies.
Consequently, significant efforts have gone into systematic surveys of the cold
ISM of the galaxies in the local Universe. This review discusses the resulting
network of scaling relations connecting the atomic and molecular gas masses of
galaxies with their other global properties (stellar masses, morphologies,
metallicities, star formation activity...), and their implications for our
understanding of galaxy evolution. Key take-home messages are as follows: (1)
From a gas perspective, there are three main factors that determine the star
formation rate of a galaxy: the total mass of its cold ISM, how much of that
gas is molecular, and the rate at which any molecular gas is converted into
stars. All three of these factors vary systematically across the local galaxy
population. (2) The shape and scatter of both the star formation main sequence
and the mass-metallicity relation are deeply linked to the availability of
atomic and molecular gas. (3) Future progress will come from expanding our
exploration of scaling relations into new parameter space (in particular the
regime of dwarf galaxies), better connecting the cold ISM of large samples of
galaxies with the environment that feeds them (the circumgalactic medium in
particular), and understanding the impact of these large scales on the
efficiency of the star formation process on molecular cloud scales.
","[{""version"":""v1"",""created"":""Tue, 1 Feb 2022 19:00:02 GMT""}]","2022-09-07"
"2202.00691","Martin Montelius","M. Montelius, R. Forsberg, N. Ryde, H. J\""onsson, M. Af\c{s}ar, A.
  Johanssen, K. F. Kaplan, H. Kim, G. Mace, C. Sneden, B. Thorsbro","Chemical Evolution of Ytterbium in the Galactic Disk","Accepted for publication in A&A. 11 pages, 7 figures",,"10.1051/0004-6361/202243140",,"astro-ph.GA","http://arxiv.org/licenses/nonexclusive-distrib/1.0/","  Measuring the abundances of neutron-capture elements in Galactic disk stars
is an important part of understanding key stellar and galactic processes. In
the optical wavelength regime a number of different neutron-capture elements
have been measured, however from the infrared H-band only the s-process
dominated element cerium has been accurately measured for a large sample of
disk stars. The more r-process dominated element ytterbium has only been
measured in a small subset of stars so far. In this study we aim to measure the
ytterbium (Yb) abundance of local disk giants using the Yb II line at
$\lambda_\text{air}$=16498\AA. We also compare the resulting abundance trend
with Ce and Eu abundances for the same stars to analyse the s- and r-process
contributions. We analyse 30 K-giants with high-resolution H-band spectra using
spectral synthesis. The very same stars have already been analysed using
high-resolution optical spectra using the same method, but the abundance of Yb
was not possible to determine from those spectra due to blending issues for
stars with [Fe/H]>-1. In this present analysis, we utilise the stellar
parameters determined from the optical analysis. We determined the Yb
abundances with an estimated uncertainty for [Yb/Fe] of 0.1 dex. From
comparison, the trend of [Yb/Fe] follows closely the [Eu/Fe] trend and has
clear s-process enrichment in identified s-rich stars. From the comparison,
both the validity of the Yb abundances are ensured, and the theoretical
prediction of a roughly 40/60 s-/r-process contribution to Yb's origin is
supported. These results show that with a careful and detailed analysis of
infrared spectra, reliable Yb abundances can be derived for a wider sample of
cooler giants in the range -1.1<[Fe/H]<0.3. This is promising for further
studies of the production of Yb and for the r-process channel, key for
Galactochemical evolution, in the infrared.
","[{""version"":""v1"",""created"":""Tue, 1 Feb 2022 19:00:03 GMT""}]","2022-09-28"
"2202.00692","Daniel Mortimer","Daniel J. Mortimer, David F. Buscher","Crosstalk in image plane beam combination for optical interferometers","15 pages, 23 figures, accepted for publication in MNRAS",,"10.1093/mnras/stac326",,"astro-ph.IM physics.optics","http://arxiv.org/licenses/nonexclusive-distrib/1.0/","  Image plane beam combination in optical interferometers multiplexes the
interference fringes from multiple baselines onto a single detector. The beams
of starlight are arranged in a non-redundant pattern at the entrance of the
combiner so that the signal from each baseline can be separated from one
another in the frequency domain. If the signals from different baselines
overlap in the frequency domain, this can give rise to a systematic error in
the fringe measurements known as baseline crosstalk. In this paper we quantify
crosstalk arising from the combination of atmospheric seeing and beam
propagation over distances of order hundreds of metres. We find that in
idealised conditions atmospheric wavefront errors and beam propagation do not
contribute to crosstalk. However, when aperture stops are included in the
optical beam train we observe that wavefront errors can result in squared
visibility errors arising from crosstalk as high as $\Delta V^{2} =
6.6\times10^{-3}$ under realistic observing conditions.
","[{""version"":""v1"",""created"":""Tue, 1 Feb 2022 19:00:03 GMT""}]","2022-02-16"
"2202.00693","Dominik Riechers","Dominik A. Riechers, Axel Weiss, Fabian Walter, Christopher L.
  Carilli, Pierre Cox, Roberto Decarli, Roberto Neri","Microwave Background Temperature at a Redshift of 6.34 from H2O
  Absorption","16 pages, 6 figures, 1 table (including Methods and Extended Data).
  The version of record of this article, first published (open access) in
  Nature, is available online at: http://dx.doi.org/10.1038/s41586-021-04294-5",,"10.1038/s41586-021-04294-5",,"astro-ph.GA astro-ph.CO","http://creativecommons.org/licenses/by/4.0/","  Distortions of the observed cosmic microwave background imprinted by the
Sunyaev-Zel'dovich effect toward massive galaxy clusters due to inverse Compton
scattering of microwave photons by high-energy electrons provide a direct
measurement of the microwave background temperature at redshifts from 0 to 1.
Some additional background temperature estimates exist at redshifts from 1.8 to
3.3 based on molecular and atomic line excitation temperatures in quasar
absorption line systems, but are model dependent. To date, no deviations from
the expected (1+z) scaling behavior of the microwave background temperature
have been seen, but the measurements have not extended deeply into the
matter-dominated era of the universe at redshifts z>3.3. Here we report the
detection of sub-millimeter line absorption from the water molecule against the
cosmic microwave background at z=6.34 in a massive starburst galaxy,
corresponding to a lookback time of 12.8 Gyr. Radiative pumping of the upper
level of the ground-state ortho-H2O(110-101) line due to starburst activity in
the dusty galaxy HFLS3 results in a cooling to below the redshifted microwave
background temperature, after the transition is initially excited by the
microwave background. The strength of this effect implies a microwave
background temperature of 16.4-30.2 K (1-sigma range) at z=6.34, which is
consistent with a background temperature increase with redshift as expected
from the standard CDM cosmology.
","[{""version"":""v1"",""created"":""Tue, 1 Feb 2022 19:00:03 GMT""}]","2022-02-03"
"2202.00694","Ali Kheirandish","Francis Halzen and Ali Kheirandish","IceCube and High-Energy Cosmic Neutrinos","To be published in Neutrino Physics and Astrophysics, edited by F. W.
  Stecker, in the Encyclopedia of Cosmology II, edited by G. G. Fazio, World
  Scientific Publishing Company, Singapore, 2022",,,,"astro-ph.HE hep-ex hep-ph","http://creativecommons.org/publicdomain/zero/1.0/","  The IceCube experiment discovered PeV-energy neutrinos originating beyond our
Galaxy with an energy flux that is comparable to that of TeV-energy gamma rays
and EeV-energy cosmic rays. Neutrinos provide the only unobstructed view of the
cosmic accelerators that power the highest energy radiation reaching us from
the universe. We will review the rationale for building kilometer-scale
neutrino detectors that led to the IceCube project, which transformed a cubic
kilometer of deep transparent natural Antarctic ice into a neutrino telescope
of such a scale. We will summarize the results from the first decade of
operations: the status of the observations of cosmic neutrinos and of their
first identified source, the supermassive black hole TXS 0506+056.
Subsequently, we will introduce the phenomenology associated with cosmic
accelerators in some detail. Besides the search for the sources of Galactic and
extragalactic cosmic rays, the scientific missions of IceCube and similar
instruments under construction in the Mediterranean Sea and Lake Baikal include
the observation of Galactic supernova explosions, the search for dark matter,
and the study of neutrinos themselves. This review resulted from notes created
for summer school lectures and should be accessible to nonexperts.
","[{""version"":""v1"",""created"":""Tue, 1 Feb 2022 19:00:03 GMT""}]","2022-02-03"
"2202.00695","Nicholas Rodd","Valerie Domcke, Camilo Garcia-Cely, Nicholas L. Rodd","A novel search for high-frequency gravitational waves with low-mass
  axion haloscopes","7+9 pages, 3+1 figures; v2, added a computation of the PBH binary
  signal",,"10.1103/PhysRevLett.129.041101","DESY-22-017, CERN-TH-2022-010","hep-ph astro-ph.CO astro-ph.IM gr-qc hep-ex","http://creativecommons.org/licenses/by/4.0/","  Gravitational waves (GWs) generate oscillating electromagnetic effects in the
vicinity of external electric and magnetic fields. We discuss this phenomenon
with a particular focus on reinterpreting the results of axion haloscopes based
on lumped-element detectors, which probe GWs in the 100 kHz-100 MHz range.
Measurements from ABRACADABRA and SHAFT already place bounds on GWs, although
the present strain sensitivity is weak. However, we demonstrate that the
sensitivity scaling with the volume of such instruments is significant - faster
than for axions - and so rapid progress will be made in the future. With no
modifications, DMRadio-m$^3$ will have a GW strain sensitivity of $h \sim
10^{-20}$ at 200 MHz. A simple modification of the pickup loop used to readout
the induced magnetic flux can parametrically enhance the GW sensitivity,
particularly at lower frequencies.
","[{""version"":""v1"",""created"":""Tue, 1 Feb 2022 19:00:03 GMT""},{""version"":""v2"",""created"":""Tue, 3 May 2022 18:35:46 GMT""}]","2022-08-31"
"2202.00696","V\'ictor  Jaramillo","V\'ictor Jaramillo, Nicolas Sanchis-Gual, Juan Barranco, Argelia
  Bernal, Juan Carlos Degollado, Carlos Herdeiro, Miguel Megevand, Dar\'io
  N\'u\~nez","Head-on collisions of $\ell$-boson stars","23 pages. Updated version with broader discussion, typos corrected
  and new analyses and figures",,"10.1103/PhysRevD.105.104057",,"gr-qc","http://arxiv.org/licenses/nonexclusive-distrib/1.0/","  Fully non-linear numerical evolutions of the Einstein-(multi)--Klein-Gordon
equations are performed to study head-on collisions of $\ell$-boson stars.
Despite being spherically symmetric, $\ell$-boson stars have a (hidden) frame
of reference, used in defining their individual multipolar fields. To assess
the impact of their relative orientation, we perform simulations with different
angles between the axes of the two colliding stars. Additionally, two scenarios
are considered for the colliding stars: that they are composites of either the
same or different scalar fields. Despite some model-specific behaviours, the
simulations generically indicate that: 1) the collision of two sufficiently
(and equally) massive stars leads to black hole formation; 2) below a certain
mass threshold the end result of the evolution is a bound state of the
composite scalar fields, that neither disperses nor collapses into a black hole
within the simulation time; 3) this end product (generically) deviates from
spherical symmetry and the equipartition of the number of bosonic particles
between the different scalar fields composing the initial boson stars is lost,
albeit not dramatically. This last observation indicates, albeit without being
conclusive, that the end result of these collisions belongs to the previously
reported larger family of equilibrium multi-field boson stars, generically
non-spherical, and of which $\ell$-boson stars are a symmetry enhanced point.
We also extract and discuss the waveforms from the collisions studied.
","[{""version"":""v1"",""created"":""Tue, 1 Feb 2022 19:00:03 GMT""},{""version"":""v2"",""created"":""Fri, 13 May 2022 16:41:46 GMT""}]","2022-06-08"
