"2202.01103","John Sylvester","Cristiano Bocci, Chiara Capresi, Kitty Meeks, John Sylvester","A New Temporal Interpretation of Cluster Editing","26 pages, 2 figures. Extended abstract appeared at IWOCA 2022",,,,"cs.DM cs.CC cs.DS math.CO","http://creativecommons.org/licenses/by/4.0/","  The NP-complete graph problem Cluster Editing seeks to transform a static
graph into a disjoint union of cliques by making the fewest possible edits to
the edges. We introduce a natural interpretation of this problem in temporal
graphs, whose edge sets change over time. This problem is NP-complete even when
restricted to temporal graphs whose underlying graph is a path, but we obtain
two polynomial-time algorithms for restricted cases. In the static setting, it
is well-known that a graph is a disjoint union of cliques if and only if it
contains no induced copy of $P_3$; we demonstrate that no general
characterisation involving sets of at most four vertices can exist in the
temporal setting, but obtain a complete characterisation involving forbidden
configurations on at most five vertices. This characterisation gives rise to an
FPT algorithm parameterised simultaneously by the permitted number of
modifications and the lifetime of the temporal graph.
","[{""version"":""v1"",""created"":""Wed, 2 Feb 2022 16:00:23 GMT""},{""version"":""v2"",""created"":""Tue, 2 Aug 2022 13:02:07 GMT""}]","2022-08-03"
"2202.01104","Charles Puelz","Zan Ahmad, Lynn H. Jin, Daniel J. Penny, Craig G. Rusin, Charles S.
  Peskin, Charles Puelz","Optimal fenestration of the Fontan circulation",,,,,"q-bio.TO","http://creativecommons.org/licenses/by/4.0/","  In this paper, we develop a pulsatile compartmental model of the Fontan
circulation and use it to explore the effects of a fenestration added to this
physiology. A fenestration is a shunt between the systemic and pulmonary veins
that is added either at the time of Fontan conversion or at a later time for
the treatment of complications. This shunt increases cardiac output and
decreases systemic venous pressure. However, these hemodynamic benefits are
achieved at the expense of a decrease in the arterial oxygen saturation. The
model developed this paper incorporates fenestration size as a parameter and
describes both blood flow and oxygen transport. It is calibrated to clinical
data from Fontan patients, and we use it to study the impact of a fenestration
on several hemodynamic variables. In certain scenarios corresponding to
high-risk Fontan physiology, we demonstrate the existence of an optimal
fenestration size that maximizes oxygen delivery to the systemic tissues.
","[{""version"":""v1"",""created"":""Wed, 2 Feb 2022 16:04:12 GMT""},{""version"":""v2"",""created"":""Tue, 21 Jun 2022 19:43:01 GMT""}]","2022-06-23"
"2202.01105","Ingo Tews","Ingo Tews, Zohreh Davoudi, Andreas Ekstr\""om, Jason D. Holt, Kevin
  Becker, Ra\'ul Brice\~no, David J. Dean, William Detmold, Christian
  Drischler, Thomas Duguet, Evgeny Epelbaum, Ashot Gasparyan, Jambul Gegelia,
  Jeremy R. Green, Harald W. Grie{\ss}hammer, Andrew D. Hanlon, Matthias Heinz,
  Heiko Hergert, Martin Hoferichter, Marc Illa, David Kekejian, Alejandro
  Kievsky, Sebastian K\""onig, Hermann Krebs, Kristina D. Launey, Dean Lee, Petr
  Navr\'atil, Amy Nicholson, Assumpta Parre\~no, Daniel R. Phillips, Marek
  P{\l}oszajczak, Xiu-Lei Ren, Thomas R. Richardson, Caroline Robin, Grigor H.
  Sargsyan, Martin Savage, Matthias R. Schindler, Phiala E. Shanahan, Roxanne
  P. Springer, Alexander Tichai, Ubirajara van Kolck, Michael L. Wagman,
  Andr\'e Walker-Loud, Chieh-Jen Yang, Xilin Zhang","Nuclear Forces for Precision Nuclear Physics -- a collection of
  perspectives","Perspective pieces of the virtual INT program 21-1b ""Nuclear Forces
  for Precision Nuclear Physics"", 107 pages","Few-Body Systems 63, 67 (2022)","10.1007/s00601-022-01749-x","INT-PUB-22-002, LA-UR-22-20419, UMD-PP-022-02, FERMILAB-PUB-22-090-T","nucl-th hep-lat hep-ph","http://arxiv.org/licenses/nonexclusive-distrib/1.0/","  This is a collection of perspective pieces contributed by the participants of
the Institute of Nuclear Theory's Program on Nuclear Physics for Precision
Nuclear Physics which was held virtually from April 19 to May 7, 2021. The
collection represents the reflections of a vibrant and engaged community of
researchers on the status of theoretical research in low-energy nuclear
physics, the challenges ahead, and new ideas and strategies to make progress in
nuclear structure and reaction physics, effective field theory, lattice QCD,
quantum information, and quantum computing. The contributed pieces solely
reflect the perspectives of the respective authors and do not represent the
viewpoints of the Institute for Nuclear theory or the organizers of the
program.
","[{""version"":""v1"",""created"":""Wed, 2 Feb 2022 16:04:58 GMT""}]","2022-09-13"
"2202.01106","Peter West","Keith Glennon and Peter West","The string little algebra",,,"10.1142/S0217751X22500518",,"hep-th","http://creativecommons.org/licenses/by/4.0/","  We consider the string, like point particles and branes, to be an irreducible
representation of the semi-direct product of the Cartan involution invariant
subalgebra of E11 and its vector representation. We show that the subalgebra
that preserves the string charges, the string little algebra, is essentially
the Borel subalgebra of E9. We also show that the known string physical states
carry a representation of parts of this algebra.
","[{""version"":""v1"",""created"":""Wed, 2 Feb 2022 16:05:01 GMT""}]","2022-06-29"
"2202.01107","Kayode Olaleye","Kayode Olaleye, Dan Oneata and Herman Kamper","Keyword localisation in untranscribed speech using visually grounded
  speech models","10 figures, 5 tables",,"10.1109/JSTSP.2022.3180220",,"cs.CL cs.SD eess.AS","http://arxiv.org/licenses/nonexclusive-distrib/1.0/","  Keyword localisation is the task of finding where in a speech utterance a
given query keyword occurs. We investigate to what extent keyword localisation
is possible using a visually grounded speech (VGS) model. VGS models are
trained on unlabelled images paired with spoken captions. These models are
therefore self-supervised -- trained without any explicit textual label or
location information. To obtain training targets, we first tag training images
with soft text labels using a pretrained visual classifier with a fixed
vocabulary. This enables a VGS model to predict the presence of a written
keyword in an utterance, but not its location. We consider four ways to equip
VGS models with localisations capabilities. Two of these -- a saliency approach
and input masking -- can be applied to an arbitrary prediction model after
training, while the other two -- attention and a score aggregation approach --
are incorporated directly into the structure of the model. Masked-based
localisation gives some of the best reported localisation scores from a VGS
model, with an accuracy of 57% when the system knows that a keyword occurs in
an utterance and need to predict its location. In a setting where localisation
is performed after detection, an $F_1$ of 25% is achieved, and in a setting
where a keyword spotting ranking pass is first performed, we get a localisation
P@10 of 32%. While these scores are modest compared to the idealised setting
with unordered bag-of-word-supervision (from transcriptions), these models do
not receive any textual or location supervision. Further analyses show that
these models are limited by the first detection or ranking pass. Moreover,
individual keyword localisation performance is correlated with the tagging
performance from the visual classifier. We also show qualitatively how and
where semantic mistakes occur, e.g. that the model locates surfer when queried
with ocean.
","[{""version"":""v1"",""created"":""Wed, 2 Feb 2022 16:14:29 GMT""}]","2022-11-23"
"2202.01108","Yuval Atzmon","Yuval Atzmon, Eli A. Meirom, Shie Mannor, Gal Chechik","Learning to reason about and to act on physical cascading events",,,,,"cs.AI","http://arxiv.org/licenses/nonexclusive-distrib/1.0/","  Reasoning and interacting with dynamic environments is a fundamental problem
in AI, but it becomes extremely challenging when actions can trigger cascades
of cross-dependent events. We introduce a new supervised learning setup called
{\em Cascade} where an agent is shown a video of a physically simulated dynamic
scene, and is asked to intervene and trigger a cascade of events, such that the
system reaches a ""counterfactual"" goal. For instance, the agent may be asked to
""Make the blue ball hit the red one, by pushing the green ball"". The agent
intervention is drawn from a continuous space, and cascades of events makes the
dynamics highly non-linear.
  We combine semantic tree search with an event-driven forward model and devise
an algorithm that learns to search in semantic trees in continuous spaces. We
demonstrate that our approach learns to effectively follow instructions to
intervene in previously unseen complex scenes. It can also reason about
alternative outcomes, when provided an observed cascade of events.
","[{""version"":""v1"",""created"":""Wed, 2 Feb 2022 16:17:42 GMT""}]","2022-02-03"
"2202.01109","Ilse Maillette de Buy Wenniger","I. Maillette de Buy Wenniger, S. E. Thomas, M. Maffei, S. C. Wein, M.
  Pont, N. Belabas, S. Prasad, A. Harouri, A. Lema\^itre, I. Sagnes, N.
  Somaschi, A. Auff\`eves, P. Senellart","Experimental analysis of energy transfers between a quantum emitter and
  light fields",,,,,"quant-ph","http://creativecommons.org/licenses/by/4.0/","  Energy transfer between quantum systems can either be achieved through an
effective unitary interaction or through the generation of entanglement. This
observation defines two types of energy exchange: unitary and correlation
energy. Here we propose and implement experimental protocols to access these
energy transfers in interactions between a quantum emitter and light fields.
Upon spontaneous emission, we measure the unitary energy transfer from the
emitter to the optical field and show that it never exceeds half of the total
energy and is reduced when introducing decoherence. We then study the
interference of the emitted field and a laser field at a beam splitter and show
that the energy transfers quantitatively depend on the quantum purity of the
emitted field.
","[{""version"":""v1"",""created"":""Wed, 2 Feb 2022 16:18:11 GMT""},{""version"":""v2"",""created"":""Fri, 8 Apr 2022 08:30:49 GMT""},{""version"":""v3"",""created"":""Tue, 6 Jun 2023 10:30:39 GMT""}]","2023-06-07"
"2202.01110","Deng Cai","Huayang Li and Yixuan Su and Deng Cai and Yan Wang and Lemao Liu","A Survey on Retrieval-Augmented Text Generation","all authors contributed equally",,,,"cs.CL","http://creativecommons.org/licenses/by/4.0/","  Recently, retrieval-augmented text generation attracted increasing attention
of the computational linguistics community. Compared with conventional
generation models, retrieval-augmented text generation has remarkable
advantages and particularly has achieved state-of-the-art performance in many
NLP tasks. This paper aims to conduct a survey about retrieval-augmented text
generation. It firstly highlights the generic paradigm of retrieval-augmented
generation, and then it reviews notable approaches according to different tasks
including dialogue response generation, machine translation, and other
generation tasks. Finally, it points out some important directions on top of
recent methods to facilitate future research.
","[{""version"":""v1"",""created"":""Wed, 2 Feb 2022 16:18:41 GMT""},{""version"":""v2"",""created"":""Sun, 13 Feb 2022 05:50:10 GMT""}]","2022-02-15"
"2202.01111","Parth Chavan","Parth Chavan, Andrew Lee and Karthik Seetharaman","Hypergraph Fuss-Catalan Numbers","19 pages, 9 figures",,,,"math.CO","http://creativecommons.org/licenses/by/4.0/","  The Catalan numbers $C_n$ are an extremely well-studied sequence of numbers
that appear as the answer to many combinatorial problems. Two generalizations
of these numbers that have been studied are the Fuss-Catalan numbers and the
Hypergraph Catalan numbers. In this paper, we study the combination of these,
the Hypergraph Fuss-Catalan numbers. We provide some combinatorial
interpretations of these numbers, as well as describe their generating
function.
","[{""version"":""v1"",""created"":""Wed, 2 Feb 2022 16:19:19 GMT""}]","2022-02-03"
"2202.01112","Hamdi Joudeh","Han Wu and Hamdi Joudeh","On Joint Communication and Channel Discrimination",,,,,"cs.IT math.IT","http://arxiv.org/licenses/nonexclusive-distrib/1.0/","  We consider a basic communication and sensing setup comprising a transmitter,
a receiver and a sensor. The transmitter sends an encoded sequence to the
receiver through a discrete memoryless channel, and the receiver is interested
in decoding the sequence. On the other hand, the sensor picks up a noisy
version of the transmitted sequence through one of two possible discrete
memoryless channels. The sensor knows the transmitted sequence and wishes to
discriminate between the two possible channels, i.e. to identify the channel
that has generated the output given the input. We study the trade-off between
communication and sensing in the asymptotic regime, captured in terms of the
coding rate to the receiver against the discrimination error exponent at the
sensor. We characterize the optimal rate-exponent trade-off for general
discrete memoryless channels with an input cost constraint.
","[{""version"":""v1"",""created"":""Wed, 2 Feb 2022 16:19:49 GMT""},{""version"":""v2"",""created"":""Mon, 7 Feb 2022 14:15:25 GMT""},{""version"":""v3"",""created"":""Tue, 10 May 2022 14:32:36 GMT""}]","2022-05-11"
"2202.01113","Yongqiang Wang","Yongqiang Wang and Angelia Nedic","Tailoring Gradient Methods for Differentially-Private Distributed
  Optimization","Accepted to IEEE Transactions on Automatic Control as a full paper",,,,"math.OC cs.DC","http://creativecommons.org/licenses/by-nc-nd/4.0/","  Decentralized optimization is gaining increased traction due to its
widespread applications in large-scale machine learning and multi-agent
systems. The same mechanism that enables its success, i.e., information sharing
among participating agents, however, also leads to the disclosure of individual
agents' private information, which is unacceptable when sensitive data are
involved. As differential privacy is becoming a de facto standard for privacy
preservation, recently results have emerged integrating differential privacy
with distributed optimization. However, directly incorporating differential
privacy design in existing distributed optimization approaches significantly
compromises optimization accuracy. In this paper, we propose to redesign and
tailor gradient methods for differentially-private distributed optimization,
and propose two differential-privacy oriented gradient methods that can ensure
both rigorous epsilon-differential privacy and optimality. The first algorithm
is based on static-consensus based gradient methods, and the second algorithm
is based on dynamic-consensus (gradient-tracking) based distributed
optimization methods and, hence, is applicable to general directed interaction
graph topologies. Both algorithms can simultaneously ensure almost sure
convergence to an optimal solution and a finite privacy budget, even when the
number of iterations goes to infinity. To our knowledge, this is the first time
that both goals are achieved simultaneously. Numerical simulations using a
distributed estimation problem and experimental results on a benchmark dataset
confirm the effectiveness of the proposed approaches.
","[{""version"":""v1"",""created"":""Wed, 2 Feb 2022 16:20:07 GMT""},{""version"":""v2"",""created"":""Fri, 1 Apr 2022 16:36:28 GMT""},{""version"":""v3"",""created"":""Sun, 29 May 2022 01:30:37 GMT""},{""version"":""v4"",""created"":""Sat, 5 Nov 2022 22:43:54 GMT""},{""version"":""v5"",""created"":""Mon, 28 Nov 2022 22:02:50 GMT""},{""version"":""v6"",""created"":""Fri, 3 Mar 2023 22:28:01 GMT""},{""version"":""v7"",""created"":""Tue, 7 Mar 2023 02:51:43 GMT""},{""version"":""v8"",""created"":""Mon, 1 May 2023 16:25:12 GMT""}]","2023-05-02"
"2202.01114","Liena Colarte G\'omez","Liena Colarte-G\'omez, Joan Elias and Rosa M. Mir\'o-Roig","Sumsets and Veronese varieties","To appear in Collectanea Mathematica",,,,"math.AG math.AC math.CO","http://arxiv.org/licenses/nonexclusive-distrib/1.0/","  In this paper, to any subset $\mathcal{A} \subset \mathbb{Z}^{n}$ we
explicitly associate a unique monomial projection $Y_{n,d_{\mathcal{A}}}$ of a
Veronese variety, whose Hilbert function coincides with the cardinality of the
$t$-fold sumsets $t\mathcal{A}$. This link allows us to tackle the classical
problem of determining the polynomial $p_{\mathcal{A}} \in \mathbb{Q}[t]$ such
that $|t\mathcal{A}| = p_{\mathcal{A}}(t)$ for all $t \geq t_0$ and the minimum
integer $n_0(\mathcal{A}) \leq t_0$ for which this condition is satisfied, i.e.
the so-called {\em phase transition} of $|t\mathcal{A}|$. We use the
Castelnuovo--Mumford regularity and the geometry of $Y_{n,d_{\mathcal{A}}}$ to
describe the polynomial $p_{\mathcal{A}}(t)$ and to derive new bounds for
$n_0(\mathcal{A})$ under some technical assumptions on the convex hull of
$\mathcal{A}$; and vice versa we apply the theory of sumsets to obtain
geometric information of the varieties $Y_{n,d_{\mathcal{A}}}$.
","[{""version"":""v1"",""created"":""Wed, 2 Feb 2022 16:20:14 GMT""}]","2022-02-03"
"2202.01115","Saeed Boor Boor","Saeed Boorboor, Shawn Mathew, Mala Ananth, David Talmage, Lorna W.
  Role, Arie E. Kaufman","NeuRegenerate: A Framework for Visualizing Neurodegeneration","Accepted for publication in IEEE Transactions on Visualization and
  Computer Graphics",,"10.1109/TVCG.2021.3127132",,"cs.LG cs.GR cs.HC eess.IV q-bio.NC","http://arxiv.org/licenses/nonexclusive-distrib/1.0/","  Recent advances in high-resolution microscopy have allowed scientists to
better understand the underlying brain connectivity. However, due to the
limitation that biological specimens can only be imaged at a single timepoint,
studying changes to neural projections is limited to general observations using
population analysis. In this paper, we introduce NeuRegenerate, a novel
end-to-end framework for the prediction and visualization of changes in neural
fiber morphology within a subject, for specified age-timepoints.To predict
projections, we present neuReGANerator, a deep-learning network based on
cycle-consistent generative adversarial network (cycleGAN) that translates
features of neuronal structures in a region, across age-timepoints, for large
brain microscopy volumes. We improve the reconstruction quality of neuronal
structures by implementing a density multiplier and a new loss function, called
the hallucination loss.Moreover, to alleviate artifacts that occur due to
tiling of large input volumes, we introduce a spatial-consistency module in the
training pipeline of neuReGANerator. We show that neuReGANerator has a
reconstruction accuracy of 94% in predicting neuronal structures. Finally, to
visualize the predicted change in projections, NeuRegenerate offers two modes:
(1) neuroCompare to simultaneously visualize the difference in the structures
of the neuronal projections, across the age timepoints, and (2) neuroMorph, a
vesselness-based morphing technique to interactively visualize the
transformation of the structures from one age-timepoint to the other. Our
framework is designed specifically for volumes acquired using wide-field
microscopy. We demonstrate our framework by visualizing the structural changes
in neuronal fibers within the cholinergic system of the mouse brain between a
young and old specimen.
","[{""version"":""v1"",""created"":""Wed, 2 Feb 2022 16:21:14 GMT""}]","2022-02-03"
"2202.01116","Milena Gazdieva","Milena Gazdieva, Litu Rout, Alexander Korotin, Andrey Kravchenko,
  Alexander Filippov, Evgeny Burnaev","An Optimal Transport Perspective on Unpaired Image Super-Resolution",,,,,"eess.IV cs.CV cs.LG","http://arxiv.org/licenses/nonexclusive-distrib/1.0/","  Real-world image super-resolution (SR) tasks often do not have paired
datasets, which limits the application of supervised techniques. As a result,
the tasks are usually approached by unpaired techniques based on Generative
Adversarial Networks (GANs), which yield complex training losses with several
regularization terms, e.g., content or identity losses. We theoretically
investigate optimization problems which arise in such models and find two
surprizing observations. First, the learned SR map is always an optimal
transport (OT) map. Second, we theoretically prove and empirically show that
the learned map is biased, i.e., it does not actually transform the
distribution of low-resolution images to high-resolution ones. Inspired by
these findings, we propose an algorithm for unpaired SR which learns an
unbiased OT map for the perceptual transport cost. Unlike the existing
GAN-based alternatives, our algorithm has a simple optimization objective
reducing the need for complex hyperparameter selection and an application of
additional regularizations. At the same time, it provides a nearly
state-of-the-art performance on the large-scale unpaired AIM19 dataset.
","[{""version"":""v1"",""created"":""Wed, 2 Feb 2022 16:21:20 GMT""},{""version"":""v2"",""created"":""Tue, 11 Oct 2022 16:15:58 GMT""}]","2022-10-12"
"2202.01117","Hanbin Hong","Hanbin Hong, Yuan Hong, and Yu Kong","An Eye for an Eye: Defending against Gradient-based Attacks with
  Gradients",,,,,"cs.CV cs.CR cs.LG","http://arxiv.org/licenses/nonexclusive-distrib/1.0/","  Deep learning models have been shown to be vulnerable to adversarial attacks.
In particular, gradient-based attacks have demonstrated high success rates
recently. The gradient measures how each image pixel affects the model output,
which contains critical information for generating malicious perturbations. In
this paper, we show that the gradients can also be exploited as a powerful
weapon to defend against adversarial attacks. By using both gradient maps and
adversarial images as inputs, we propose a Two-stream Restoration Network (TRN)
to restore the adversarial images. To optimally restore the perturbed images
with two streams of inputs, a Gradient Map Estimation Mechanism is proposed to
estimate the gradients of adversarial images, and a Fusion Block is designed in
TRN to explore and fuse the information in two streams. Once trained, our TRN
can defend against a wide range of attack methods without significantly
degrading the performance of benign inputs. Also, our method is generalizable,
scalable, and hard to bypass. Experimental results on CIFAR10, SVHN, and
Fashion MNIST demonstrate that our method outperforms state-of-the-art defense
methods.
","[{""version"":""v1"",""created"":""Wed, 2 Feb 2022 16:22:28 GMT""}]","2022-02-03"
"2202.01118","Paul McVay","Paul McVay, Dr. Tie Liu, Dr. Krishna Narayanan","On Linear Separability under Linear Compression with Applications to
  Hard Support Vector Machine","12 pages",,,,"cs.LG math.ST stat.TH","http://creativecommons.org/licenses/by/4.0/","  This paper investigates the theoretical problem of maintaining linear
separability of the data-generating distribution under linear compression.
While it has been long known that linear separability may be maintained by
linear transformations that approximately preserve the inner products between
the domain points, the limit to which the inner products are preserved in order
to maintain linear separability was unknown. In this paper, we show that linear
separability is maintained as long as the distortion of the inner products is
smaller than the squared margin of the original data-generating distribution.
The proof is mainly based on the geometry of hard support vector machines (SVM)
extended from the finite set of training examples to the (possibly) infinite
domain of the data-generating distribution. As applications, we derive bounds
on the (i) compression length of random sub-Gaussian matrices; and (ii)
generalization error for compressive learning with hard-SVM.
","[{""version"":""v1"",""created"":""Wed, 2 Feb 2022 16:23:01 GMT""}]","2022-02-03"
