"2202.01241","Apostolos Zormpas","Apostolos Zormpas, Tilman Birnstiel, Giovanni P. Rosotti, Sean M.
  Andrews","A large population study of protoplanetary disks: Explaining the
  millimeter size-luminosity relation with or without sub-structure","Replaced with the published version in A&A. 19+11 pages, 11+10
  figures","A&A 661, A66 (2022)","10.1051/0004-6361/202142046",,"astro-ph.EP astro-ph.SR","http://creativecommons.org/licenses/by/4.0/","  Recent sub-arcsecond resolution surveys of the dust continuum emission from
nearby protoplanetary disks showed a strong correlation between the sizes and
luminosities of the disks. We aim to explain the origin of the (sub-)millimeter
size-luminosity relation (SLR) between the $68\%$ effective radius ($r_{eff}$)
of disks with their continuum luminosity ($L_{mm}$), with models of gas and
dust evolution in a simple viscous accretion disk and radiative transfer
calculations. We use a large grid of models ($10^{5}$ simulations) with and
without planetary gaps, varying the initial conditions of the key parameters.
We calculate the disk continuum emission and the effective radius for all
models as a function of time. By selecting those simulations that continuously
follow the SLR, we can derive constraints on the input parameters of the
models. We confirm previous results that models of smooth disks in the radial
drift regime are compatible with the observed SLR ($L_{mm}\propto r_{eff}^{2}$)
but only smooth disks cannot be the reality. We show that the SLR is more
widely populated if planets are present. However they tend to follow a
different relation than smooth disks, potentially implying that a mixture of
smooth and sub-structured disks are present in the observed sample. We derive a
SLR ($L_{mm}\propto r_{eff}^{5/4}$) for disks with strong sub-structure. To be
compatible with the SLR, models need to have an initially high disk mass ($\geq
2.5 \cdot 10^{-2}M_{\star}$) and low turbulence-parameter $\alpha$ values
($\leq 10^{-3}$). Furthermore, we find that the grain composition and porosity
drastically affects the evolution of disks on the size-luminosity diagram where
relatively compact grains that include amorphous carbon are favoured. Moreover,
a uniformly optically thick disk with high albedo ($0.9$) that follows the SLR
cannot be formed from an evolutionary procedure.
","[{""version"":""v1"",""created"":""Wed, 2 Feb 2022 19:00:10 GMT""},{""version"":""v2"",""created"":""Mon, 23 May 2022 18:02:58 GMT""}]","2022-05-25"
"2202.01242","Richard Shaw","CHIME Collaboration, Mandana Amiri, Kevin Bandura, Tianyue Chen,
  Meiling Deng, Matt Dobbs, Mateus Fandino, Simon Foreman, Mark Halpern, Alex
  S. Hill, Gary Hinshaw, Carolin H\""ofer, Joseph Kania, T.L. Landecker, Joshua
  MacEachern, Kiyoshi Masui, Juan Mena-Parra, Nikola Milutinovic, Arash
  Mirhosseini, Laura Newburgh, Anna Ordog, Ue-Li Pen, Tristan
  Pinsonneault-Marotte, Ava Polzin, Alex Reda, Andre Renard, J. Richard Shaw,
  Seth R. Siegel, Saurabh Singh, Keith Vanderlinde, Haochen Wang, Donald V.
  Wiebe, Dallas Wulf","Detection of Cosmological 21 cm Emission with the Canadian Hydrogen
  Intensity Mapping Experiment","66 pages, 30 figures",,"10.3847/1538-4357/acb13f",,"astro-ph.CO","http://creativecommons.org/licenses/by/4.0/","  We present a detection of 21-cm emission from large-scale structure (LSS)
between redshift 0.78 and 1.43 made with the Canadian Hydrogen Intensity
Mapping Experiment (CHIME). Radio observations acquired over 102 nights are
used to construct maps which are foreground filtered and stacked on the angular
and spectral locations of luminous red galaxies (LRG), emission line galaxies
(ELG), and quasars (QSO) from the eBOSS clustering catalogs. We find decisive
evidence for a detection when stacking on all three tracers of LSS, with the
logarithm of the Bayes Factor equal to 18.9 (LRG), 10.8 (ELG), and 56.3 (QSO).
An alternative frequentist interpretation, based on the likelihood-ratio test,
yields a detection significance of $7.1\sigma$ (LRG), $5.7\sigma$ (ELG), and
$11.1\sigma$ (QSO). These are the first 21-cm intensity mapping measurements
made with an interferometer. We constrain the effective clustering amplitude of
neutral hydrogen (HI), defined as $\mathcal{A}_{\rm HI}\equiv
10^{3}\,\Omega_\mathrm{HI}\left(b_\mathrm{HI}+\langle\,f\mu^{2}\rangle\right)$,
where $\Omega_\mathrm{HI}$ is the cosmic abundance of HI, $b_\mathrm{HI}$ is
the linear bias of HI, and $\langle\,f\mu^{2}\rangle=0.552$ encodes the effect
of redshift-space distortions at linear order. We find
$\mathcal{A}_\mathrm{HI}=1.51^{+3.60}_{-0.97}$ for LRGs $(z=0.84)$,
$\mathcal{A}_\mathrm{HI}=6.76^{+9.04}_{-3.79}$ for ELGs $(z=0.96)$, and
$\mathcal{A}_\mathrm{HI}=1.68^{+1.10}_{-0.67}$ for QSOs $(z=1.20)$, with
constraints limited by modeling uncertainties at nonlinear scales. We are also
sensitive to bias in the spectroscopic redshifts of each tracer, and find a
non-zero bias $\Delta\,v= -66 \pm 20 \mathrm{km/s}$ for the QSOs. We split the
QSO catalog into three redshift bins and have a decisive detection in each,
with the upper bin at $z=1.30$ producing the highest redshift 21-cm intensity
mapping measurement thus far.
","[{""version"":""v1"",""created"":""Wed, 2 Feb 2022 19:00:11 GMT""}]","2023-05-03"
"2202.01243","Jasper Tan","Jasper Tan, Blake Mason, Hamid Javadi, Richard G. Baraniuk","Parameters or Privacy: A Provable Tradeoff Between Overparameterization
  and Membership Inference","25 pages, 8 figures",,,,"stat.ML cs.LG","http://arxiv.org/licenses/nonexclusive-distrib/1.0/","  A surprising phenomenon in modern machine learning is the ability of a highly
overparameterized model to generalize well (small error on the test data) even
when it is trained to memorize the training data (zero error on the training
data). This has led to an arms race towards increasingly overparameterized
models (c.f., deep learning). In this paper, we study an underexplored hidden
cost of overparameterization: the fact that overparameterized models may be
more vulnerable to privacy attacks, in particular the membership inference
attack that predicts the (potentially sensitive) examples used to train a
model. We significantly extend the relatively few empirical results on this
problem by theoretically proving for an overparameterized linear regression
model in the Gaussian data setting that membership inference vulnerability
increases with the number of parameters. Moreover, a range of empirical studies
indicates that more complex, nonlinear models exhibit the same behavior.
Finally, we extend our analysis towards ridge-regularized linear regression and
show in the Gaussian data setting that increased regularization also increases
membership inference vulnerability in the overparameterized regime.
","[{""version"":""v1"",""created"":""Wed, 2 Feb 2022 19:00:21 GMT""},{""version"":""v2"",""created"":""Wed, 30 Nov 2022 16:34:58 GMT""}]","2022-12-01"
"2202.01244","Nicholas Rubin","Joshua J. Goings, Alec White, Joonho Lee, Christofer S. Tautermann,
  Matthias Degroote, Craig Gidney, Toru Shiozaki, Ryan Babbush, Nicholas C.
  Rubin","Reliably assessing the electronic structure of cytochrome P450 on
  today's classical computers and tomorrow's quantum computers",,,"10.1073/pnas.2203533119",,"quant-ph physics.chem-ph","http://creativecommons.org/licenses/by/4.0/","  An accurate assessment of how quantum computers can be used for chemical
simulation, especially their potential computational advantages, provides
important context on how to deploy these future devices. In order to perform
this assessment reliably, quantum resource estimates must be coupled with
classical simulations attempting to answer relevant chemical questions and to
define the classical simulation frontier. Herein, we explore the quantum and
classical resources required to assess the electronic structure of cytochrome
P450 enzymes (CYPs) and thus define a classical-quantum advantage boundary.
This is accomplished by analyzing the convergence of DMRG+NEVPT2 and coupled
cluster singles doubles with non-iterative triples (CCSD(T)) calculations for
spin-gaps in models of the CYP catalytic cycle that indicate multireference
character. The quantum resources required to perform phase estimation using
qubitized quantum walks are calculated for the same systems. Compilation into
the surface-code provides runtime estimates to compare directly to DMRG
runtimes and to evaluate potential quantum advantage. Both classical and
quantum resource estimates suggest that simulation of CYP models at scales
large enough to balance dynamic and multiconfigurational electron correlation
has the potential to be a quantum advantage problem and emphasizes the
important interplay between classical simulations and quantum algorithms
development for chemical simulation.
","[{""version"":""v1"",""created"":""Wed, 2 Feb 2022 19:01:07 GMT""}]","2022-10-12"
"2202.01245","Marion Farcy","Marion Farcy, Joakim Rosdahl, Yohan Dubois, J\'er\'emy Blaizot, Sergio
  Martin-Alvarez","Radiation-MagnetoHydrodynamics simulations of cosmic ray feedback in
  disc galaxies",,"Monthly Notices of the Royal Astronomical Society 513 (2022)
  5000-5019","10.1093/mnras/stac1196",,"astro-ph.GA","http://arxiv.org/licenses/nonexclusive-distrib/1.0/","  Cosmic rays (CRs) are thought to play an important role in galaxy evolution.
We study their effect when coupled to other important sources of feedback,
namely supernovae and stellar radiation, by including CR anisotropic diffusion
and radiative losses but neglecting CR streaming. Using the RAMSES-RT code, we
perform the first radiation-magnetohydrodynamics simulations of isolated disc
galaxies with and without CRs. We study galaxies embedded in dark matter haloes
of $10^{10}$, $10^{11}$ and $10^{12}\, \rm M_{\odot}$ with a maximum resolution
of $9 \,\rm pc$. We find that CRs reduce star formation rate in our two dwarf
galaxies by a factor 2, with decreasing efficiency with increasing galaxy mass.
They increase significantly the outflow mass loading factor in all our galaxies
and make the outflows colder. We study the impact of the CR diffusion
coefficient, exploring values from $\kappa = 10^{27}$ to $\rm 3\times 10^{29}\,
cm^2\, s^{-1}$. With lower $\kappa$, CRs remain confined for longer on small
scales and are consequently efficient in suppressing star formation, whereas a
higher diffusion coefficient reduces the effect on star formation and increases
the generation of cold outflows. Finally, we compare CR feedback to a
calibrated 'strong' supernova feedback model known to sufficiently regulate
star formation in high-redshift cosmological simulations. We find that CR
feedback is not sufficiently strong to replace this strong supernova feedback.
As they tend to smooth out the ISM and fill it with denser gas, CRs also lower
the escape fraction of Lyman continuum photons from galaxies.
","[{""version"":""v1"",""created"":""Wed, 2 Feb 2022 19:01:09 GMT""},{""version"":""v2"",""created"":""Thu, 26 May 2022 09:36:43 GMT""}]","2022-05-27"
"2202.01246","Pranav Madadi Dr","Pranav Madadi, Jeongho Jeon, Joonyoung Cho, Caleb Lo, Juho Lee,
  Jianzhong Zhang","PolarDenseNet: A Deep Learning Model for CSI Feedback in MIMO Systems",,,,,"cs.IT cs.AI math.IT","http://arxiv.org/licenses/nonexclusive-distrib/1.0/","  In multiple-input multiple-output (MIMO) systems, the high-resolution channel
information (CSI) is required at the base station (BS) to ensure optimal
performance, especially in the case of multi-user MIMO (MU-MIMO) systems. In
the absence of channel reciprocity in frequency division duplex (FDD) systems,
the user needs to send the CSI to the BS. Often the large overhead associated
with this CSI feedback in FDD systems becomes the bottleneck in improving the
system performance. In this paper, we propose an AI-based CSI feedback based on
an auto-encoder architecture that encodes the CSI at UE into a low-dimensional
latent space and decodes it back at the BS by effectively reducing the feedback
overhead while minimizing the loss during recovery. Our simulation results show
that the AI-based proposed architecture outperforms the state-of-the-art
high-resolution linear combination codebook using the DFT basis adopted in the
5G New Radio (NR) system.
","[{""version"":""v1"",""created"":""Wed, 2 Feb 2022 19:04:49 GMT""}]","2022-02-04"
"2202.01247","Solomon Friedberg","Solomon Friedberg and Omer Offen","On the Cubic Shimura lift to $PGL(3)$: The Fundamental Lemma","67 pages. The revised version gives an alternative approach to the
  computation in Section 8 that is a bit shorter",,,,"math.NT math.RT","http://creativecommons.org/licenses/by/4.0/","  The classical Shimura correspondence lifts automorphic representations on the
double cover of $SL_2$ to automorphic representations on $PGL_2$. Here we take
key steps towards establishing a relative trace formula that would give a new
global Shimura lift, from the triple cover of $SL_3$ to $PGL_3$, and also
characterize the image of the lift. The characterization would be through the
nonvanishing of a certain global period involving a function in the space of
the automorphic minimal representation $\Theta_{SO_8}$ for split
$SO_8({\mathbb{A}})$, consistent with a 2001 conjecture of Bump, Friedberg and
Ginzburg. In this paper, we first analyze a global distribution on
$PGL_3({\mathbb{A}})$ involving this period and show that it is a sum of
factorizable orbital integrals. The same is true for the Kuznetsov distribution
attached to the triple cover of $SL_3({\mathbb{A}})$. We then match the
corresponding local orbital integrals for the unit elements of the spherical
Hecke algebras; that is, we establish the Fundamental Lemma.
","[{""version"":""v1"",""created"":""Wed, 2 Feb 2022 19:07:52 GMT""},{""version"":""v2"",""created"":""Fri, 24 Jun 2022 15:53:51 GMT""}]","2022-06-27"
"2202.01248","Meike Neuwohner","Meike Neuwohner","Passing the Limits of Pure Local Search for Weighted $k$-Set Packing","56 pages, 3 figures, 1 table. arXiv admin note: substantial text
  overlap with arXiv:2106.03555, arXiv:2106.03545",,,,"cs.DS","http://creativecommons.org/licenses/by-nc-nd/4.0/","  We study the weighted $k$-Set Packing problem: Given a collection $S$ of
sets, each of cardinality at most $k$, together with a positive weight function
$w:\mathcal{S}\rightarrow\mathbb{Q}_{>0}$, the task is to compute a disjoint
sub-collection $A\subseteq \mathcal{S}$ of maximum total weight. For $k\leq 2$,
the weighted $k$-Set Packing problem can be solved in polynomial time, but for
$k\geq 3$, it becomes $NP$-hard. Recently, Neuwohner has shown how to obtain
approximation guarantees of $\frac{k+\epsilon_k}{2}$ with
$\lim_{k\rightarrow\infty}\epsilon_k=0$. She further showed her result to be
asymptotically best possible in that no algorithm considering local
improvements of logarithmically bounded size with respect to some fixed power
of the weight function can yield an approximation guarantee better than
$\frac{k}{2}$.
  In this paper, we finally show how to beat the threshold of $\frac{k}{2}$ for
the weighted $k$-Set Packing problem by $\Omega(k)$. We achieve this by
combining local search with the application of a black box algorithm for the
unweighted $k$-Set Packing problem to carefully chosen sub-instances. In doing
so, we manage to link the approximation ratio for general weights to the one
achievable in the unweighted case and we obtain guarantees of at most
$\frac{k+1}{2}-2\cdot 10^{-4}$ for all $k\geq 4$.
","[{""version"":""v1"",""created"":""Wed, 2 Feb 2022 19:10:41 GMT""},{""version"":""v2"",""created"":""Wed, 17 Aug 2022 19:43:46 GMT""}]","2022-08-19"
"2202.01249","Michael Raymer","Michael G. Raymer and Tiemo Landes","Theory of Two-Photon Absorption with Broadband Squeezed Vacuum","submitted to PRA",,"10.1103/PhysRevA.106.013717",,"quant-ph","http://creativecommons.org/licenses/by/4.0/","  We present an analytical quantum theoretic model for non-resonant molecular
two-photon absorption (TPA) of broadband, spectrally multi-mode squeezed
vacuum, including low-gain (isolated entangled photon pairs or EPP) and
high-gain (bright squeezed vacuum or BSV) regimes. The results are relevant to
the potential use of entangled-light TPA as a spectroscopic and imaging method.
We treat the scenario that the exciting light is spatially single-mode and is
non-resonant with all intermediate molecular states. In the case of high gain,
we find that in the case that the linewidth of the final molecular state is
much narrower than the bandwidth of the exciting light, bright squeezed vacuum
is found to be equally (but no more) effective in driving TPA as is a
quasi-monochromatic coherent-state (classical) pulse of the same temporal
shape, duration and mean photon number. Therefore, in this case the sought-for
advantage of observing TPA at extremely low optical flux is not provided by
broadband bright squeezed vacuum. In the opposite case that the final-state
linewidth is much broader than the bandwidth of the BSV exciting light, we show
that the TPA rate is proportional to the second-order intensity autocorrelation
function at zero time delay g^(2)(0), as expected. We derive and evaluate
formulas describing the transition between these two limiting cases, that is,
including the regime where the molecular linewidth and optical bandwidth are
comparable, as is often the case in experimental studies. We also show that for
g^(2)(0) to reach the idealized form g^(2)(0) = 3 + 1/n, with n being the mean
number of photons per temporal mode, it is required to compensate the
dispersion inherent in the nonlinear-optical crystal used to generate the BSV.
","[{""version"":""v1"",""created"":""Wed, 2 Feb 2022 19:15:20 GMT""},{""version"":""v2"",""created"":""Fri, 4 Feb 2022 06:28:57 GMT""},{""version"":""v3"",""created"":""Tue, 22 Feb 2022 03:25:06 GMT""},{""version"":""v4"",""created"":""Wed, 23 Feb 2022 04:15:59 GMT""},{""version"":""v5"",""created"":""Fri, 8 Jul 2022 22:02:55 GMT""}]","2022-08-10"
"2202.01250","Hongjian Wang","Hongjian Wang, Aaditya Ramdas","Catoni-style confidence sequences for heavy-tailed mean estimation",,,,,"math.ST stat.ME stat.TH","http://arxiv.org/licenses/nonexclusive-distrib/1.0/","  A confidence sequence (CS) is a sequence of confidence intervals that is
valid at arbitrary data-dependent stopping times. These are useful in
applications like A/B testing, multi-armed bandits, off-policy evaluation,
election auditing, etc. We present three approaches to constructing a
confidence sequence for the population mean, under the minimal assumption that
only an upper bound $\sigma^2$ on the variance is known. While previous works
rely on light-tail assumptions like boundedness or subGaussianity (under which
all moments of a distribution exist), the confidence sequences in our work are
able to handle data from a wide range of heavy-tailed distributions. The best
among our three methods -- the Catoni-style confidence sequence -- performs
remarkably well in practice, essentially matching the state-of-the-art methods
for $\sigma^2$-subGaussian data, and provably attains the $\sqrt{\log \log
t/t}$ lower bound due to the law of the iterated logarithm. Our findings have
important implications for sequential experimentation with unbounded
observations, since the $\sigma^2$-bounded-variance assumption is more
realistic and easier to verify than $\sigma^2$-subGaussianity (which implies
the former). We also extend our methods to data with infinite variance, but
having $p$-th central moment ($1<p<2$).
","[{""version"":""v1"",""created"":""Wed, 2 Feb 2022 19:23:00 GMT""},{""version"":""v2"",""created"":""Mon, 25 Apr 2022 04:30:02 GMT""},{""version"":""v3"",""created"":""Thu, 14 Jul 2022 23:04:38 GMT""},{""version"":""v4"",""created"":""Wed, 8 Feb 2023 05:12:58 GMT""}]","2023-02-09"
"2202.01251","Pratik Kumar","P. Kumar, S. M. White, K. Stovall, J. Dowell and G. B. Taylor","Pulsar Observations at Low Frequencies: Applications to Pulsar Timing
  and Solar Wind Models","Accepted for publication in MNRAS. 15 pages, 7 figures",,"10.1093/mnras/stac316",,"astro-ph.HE astro-ph.SR","http://arxiv.org/licenses/nonexclusive-distrib/1.0/","  Efforts are underway to use high-precision timing of pulsars in order to
detect low-frequency gravitational waves. A limit to this technique is the
timing noise generated by dispersion in the plasma along the line of sight to
the pulsar, including the solar wind. The effects due to the solar wind vary
with time, influenced by the change in solar activity on different time scales,
ranging up to $\sim 11$ years for a solar cycle. The solar wind contribution
depends strongly on the angle between the pulsar line of sight and the solar
disk, and is a dominant effect at small separations. Although solar wind models
to mitigate these effects do exist, they do not account for all the effects of
the solar wind and its temporal changes. Since low-frequency pulsar
observations are most sensitive to these dispersive delays, they are most
suited to test the efficacy of these models and identify alternative
approaches. Here, we investigate the efficacy of some solar wind models
commonly used in pulsar timing using long-term, high-cadence data on 6 pulsars
taken with the Long Wavelength Array, and compare them with an operational
solar wind model. Our results show that stationary models of the solar wind
correction are insufficient to achieve the timing noise desired by pulsar
timing experiments, and we need to use non-stationary models, which are
informed by other solar wind observations, to obtain accurate timing residuals.
","[{""version"":""v1"",""created"":""Wed, 2 Feb 2022 19:27:01 GMT""}]","2022-02-04"
"2202.01252","Itai Gat","Itai Gat, Hagai Aronowitz, Weizhong Zhu, Edmilson Morais, Ron Hoory","Speaker Normalization for Self-supervised Speech Emotion Recognition","ICASSP 22",,,,"cs.LG","http://creativecommons.org/licenses/by/4.0/","  Large speech emotion recognition datasets are hard to obtain, and small
datasets may contain biases. Deep-net-based classifiers, in turn, are prone to
exploit those biases and find shortcuts such as speaker characteristics. These
shortcuts usually harm a model's ability to generalize. To address this
challenge, we propose a gradient-based adversary learning framework that learns
a speech emotion recognition task while normalizing speaker characteristics
from the feature representation. We demonstrate the efficacy of our method on
both speaker-independent and speaker-dependent settings and obtain new
state-of-the-art results on the challenging IEMOCAP dataset.
","[{""version"":""v1"",""created"":""Wed, 2 Feb 2022 19:30:47 GMT""},{""version"":""v2"",""created"":""Sun, 6 Nov 2022 08:21:02 GMT""}]","2022-11-08"
"2202.01253","Jack Carlisle","Jack Carlisle","Complex cobordism with involutions and geometric orientations","Comments welcome!",,,,"math.AT math.KT","http://arxiv.org/licenses/nonexclusive-distrib/1.0/","  We calculate the cobordism ring $\Omega^{C_2}_*$ of stably almost complex
manifolds with involution, and investigate the $C_2$-spectrum $\Omega_{C_2}$
which represents it. We introduce the notion of a geometrically oriented
$C_2$-spectrum, which extends the notion of a complex oriented $C_2$-spectrum,
and of which $\Omega_{C_2}$ is the universal example. Examples, in addition to
$\Omega_{C_2}$, include the Eilenberg-Maclane spectrum $H
\underline{\mathbb{Z}}_{C_2}$ and the connective cover $k_{C_2}$ of
$C_2$-equivariant $K$-theory. On the algebraic side, we define and study
filtered $C_2$-equivariant formal group laws, which are the algebraic
structures determined by geometrically oriented $C_2$-spectra. We prove some of
the fundamental properties of filtered $C_2$-equivariant formal group laws, as
well as a universality statement for the filtered $C_2$-equivariant formal
group law determined by $\Omega_{C_2}$.
","[{""version"":""v1"",""created"":""Wed, 2 Feb 2022 19:30:56 GMT""}]","2022-02-04"
"2202.01254","Thomas Schwemberger","Thomas Schwemberger, Tien-Tien Yu","Detecting Beyond the Standard Model Interactions of Solar Neutrinos in
  Low-Threshold Dark Matter Detectors","39 pages, 20 figures, 3 tables, v2: figures updated for viewer
  compatibility, minor typos corrected, references added",,"10.1103/PhysRevD.106.015002",,"hep-ph","http://creativecommons.org/licenses/by/4.0/","  As low-threshold dark matter detectors advance in development, they will
become sensitive to recoils from solar neutrinos which opens up the possibility
to explore neutrino properties. We predict the enhancement of the event rate of
solar neutrino scattering from Beyond the Standard Model interactions in
low-threshold DM detectors, with a focus on silicon, germanium, gallium
arsenide, xenon, and argon-based detectors. We consider a set of general
neutrino interactions, which fall into five categories: the neutrino magnetic
moment as well as interactions mediated by four types of mediators (scalar,
pseudoscalar, vector, and axial vector), and consider coupling these mediators
to either quarks or electrons. Using these predictions, we place constraints on
the mass and couplings of each mediator and the neutrino magnetic moment from
current low-threshold detectors like SENSEI, Edelweiss, and SuperCDMS, as well
as projections relevant for future experiments such as DAMIC-M, Oscura, Darwin,
and ARGO. We find that such low-threshold detectors can improve current
constraints by up to two orders of magnitude for vector mediators and one order
of magnitude for scalar mediators.
","[{""version"":""v1"",""created"":""Wed, 2 Feb 2022 19:36:23 GMT""},{""version"":""v2"",""created"":""Thu, 24 Feb 2022 23:35:52 GMT""}]","2022-07-20"
