"2202.01548","ALICE publications","ALICE Collaboration","Multiplicity dependence of charged-particle jet production in pp
  collisions at $\sqrt{s} = 13$ TeV","37 pages, 21 captioned figures, 3 tables, authors from page 32,
  published version, figures at http://alice-publications.web.cern.ch/node/7638","Eur.Phys.J.C 82 (2022) 514","10.1140/epjc/s10052-022-10405-x","CERN-EP-2022-011","nucl-ex hep-ex","http://creativecommons.org/licenses/by/4.0/","  The multiplicity dependence of jet production in pp collisions at the
centre-of-mass energy of $\sqrt{s} = 13\ \mathrm{TeV}$ is studied for the first
time. Jets are reconstructed from charged particles using the
anti-$k_\mathrm{T}$ algorithm with resolution parameters $R$ varying from $0.2$
to $0.7$. The jets are measured in the pseudorapidity range $|\eta_{\rm jet}|<
0.9-R$ and in the transverse momentum range $5<p_\mathrm{T,jet}^{\rm ch}<140\
\mathrm{GeV}/c$. The multiplicity intervals are categorised by the ALICE
forward detector V0. The $p_{\mathrm{T}}$ differential cross section of
charged-particle jets are compared to leading order (LO) and next-to-leading
order (NLO) perturbative quantum chromodynamics (pQCD) calculations. It is
found that the data are better described by the NLO calculation, although the
NLO prediction overestimates the jet cross section below $20\ \mathrm{GeV}/c$.
The cross section ratios for different $R$ are also measured and compared to
model calculations. These measurements provide insights into the angular
dependence of jet fragmentation. The jet yield increases with increasing
self-normalised charged-particle multiplicity. This increase shows only a weak
dependence on jet transverse momentum and resolution parameter at the highest
multiplicity. While such behaviour is qualitatively described by the present
version of PYTHIA, quantitative description may require implementing new
mechanisms for multi-particle production in hadronic collisions.
","[{""version"":""v1"",""created"":""Thu, 3 Feb 2022 12:16:40 GMT""},{""version"":""v2"",""created"":""Thu, 1 Dec 2022 16:08:34 GMT""}]","2022-12-02"
"2202.01549","ALICE Publications","ALICE Collaboration","Measurement of of $^{3}\overline{\rm He}$ nuclei absorption in matter
  and impact on their propagation in the galaxy","27 pages, 5 captioned figures, authors from page 22, published
  version, figures at http://alice-publications.web.cern.ch/node/7639",,"10.1038/s41567-022-01804-8","CERN-EP-2022-023","nucl-ex astro-ph.GA hep-ex","http://creativecommons.org/licenses/by/4.0/","  In our Galaxy, light antinuclei composed of antiprotons and antineutrons can
be produced through high-energy cosmic-ray collisions with the interstellar
medium or could also originate from the annihilation of dark-matter particles
that have not yet been discovered. On Earth, the only way to produce and study
antinuclei with high precision is to create them at high-energy particle
accelerators. Although the properties of elementary antiparticles have been
studied in detail, the knowledge of the interaction of light antinuclei with
matter is limited. We determine the disappearance probability of
$^{3}\overline{\rm He}$ when it encounters matter particles and annihilates or
disintegrates within the ALICE detector at the Large Hadron Collider. We
extract the inelastic interaction cross section, which is then used as input to
calculations of the transparency of our Galaxy to the propagation of
$^{3}\overline{\rm He}$ stemming from dark-matter annihilation and cosmic-ray
interactions within the interstellar medium. For a specific dark-matter
profile, we estimate a transparency of about 50%, whereas it varies with
increasing $^{3}\overline{\rm He}$ momentum from 25% to 90% for cosmic-ray
sources. The results indicate that $^{3}\overline{\rm He}$ nuclei can travel
long distances in the Galaxy, and can be used to study cosmic-ray interactions
and dark-matter annihilation.
","[{""version"":""v1"",""created"":""Thu, 3 Feb 2022 12:19:50 GMT""},{""version"":""v2"",""created"":""Fri, 16 Dec 2022 15:41:46 GMT""}]","2022-12-19"
"2202.01550","Matteo Cordioli","Matteo Cordioli","Multi-Objective Optimization, different approach to query a database","7 pages, 11 references",,,,"cs.DB","http://arxiv.org/licenses/nonexclusive-distrib/1.0/","  The datasets available nowadays are very rich and complex, but how do we
reach the information we are looking for? In this survey, two different
approaches to query a dataset are analyzed and algorithms for each type are
explained. Specifically, the TA and NRA have been analyzed for the Top-K query
and the Basic Block Nested Loops has been examined for the skyline query.
Moreover, it's explained the core idea behind the Prioritized and Flexible
skyline. In the end, the pros and cons of each type of analyzed query have been
evaluated based on different criteria.
","[{""version"":""v1"",""created"":""Thu, 3 Feb 2022 12:22:19 GMT""}]","2022-02-04"
"2202.01551","Yang Xu","Yang Xu, Haibin Kan, Guangyue Han","Isometries and MacWilliams Extension Property for Weighted Poset Metric","arXiv admin note: text overlap with arXiv:2201.10828",,,,"cs.IT math.IT","http://creativecommons.org/licenses/by/4.0/","  Let $\mathbf{H}$ be the cartesian product of a family of left modules over a
ring $S$, indexed by a finite set $\Omega$. We are concerned with the
$(\mathbf{P},\omega)$-weight on $\mathbf{H}$, where
$\mathbf{P}=(\Omega,\preccurlyeq_{\mathbf{P}})$ is a poset and
$\omega:\Omega\longrightarrow\mathbb{R}^{+}$ is a weight function. We
characterize the group of $(\mathbf{P},\omega)$-weight isometries of
$\mathbf{H}$, and give a canonical decomposition for semi-simple subcodes of
$\mathbf{H}$ when $\mathbf{P}$ is hierarchical. We then study the MacWilliams
extension property (MEP) for $(\mathbf{P},\omega)$-weight. We show that the MEP
implies the unique decomposition property (UDP) of $(\mathbf{P},\omega)$, which
further implies that $\mathbf{P}$ is hierarchical if $\omega$ is identically
$1$. For the case that either $\mathbf{P}$ is hierarchical or $\omega$ is
identically $1$, we show that the MEP for $(\mathbf{P},\omega)$-weight can be
characterized in terms of the MEP for Hamming weight, and give necessary and
sufficient conditions for $\mathbf{H}$ to satisfy the MEP for
$(\mathbf{P},\omega)$-weight when $S$ is an Artinian simple ring (either finite
or infinite). When $S$ is a finite field, in the context of
$(\mathbf{P},\omega)$-weight, we compare the MEP with other coding theoretic
properties including the MacWilliams identity, Fourier-reflexivity of
partitions and the UDP, and show that the MEP is strictly stronger than all the
rest among them.
","[{""version"":""v1"",""created"":""Thu, 3 Feb 2022 12:23:09 GMT""},{""version"":""v2"",""created"":""Wed, 20 Jul 2022 07:28:46 GMT""}]","2022-07-21"
"2202.01552","Salvador Hidalgo","A. Doblas, D. Flores, S. Hidalgo, N. Moffat, G. Pellegrini, D.
  Quirion, J. Villegas, D. Maneuski, M. Ruat, P. Fajardo","Inverse Low Gain Avalanche Detector (iLGAD) Periphery Design for X-Ray
  Applications",,,,,"physics.ins-det","http://creativecommons.org/licenses/by/4.0/","  LGAD technology is established within the field of particle physics, as the
baseline technology for the timing detectors of both the ATLAS and CMS upgrades
at the HL-LHC. Pixelated LGADs have been proposed for the High Granularity
Timing Detector (HGTD) and for the Endcap Timing Layer (ETL) of the ATLAS and
CMS experiments, respectively. The drawback of segmenting an LGAD is the
non-gain area between pixels and the consequent reduction in the fill factor.
In this sense, inverse LGAD (iLGAD) technology has been proposed by IMB-CNM to
enhance the fill factor and to reach excellent tracking capabilities. In this
work, we explore the use of iLGAD sensors for X-Ray applications by developing
a new generation of iLGADs. The periphery of the first iLGAD generation is
optimized by means of TCAD tools, making them suitable for X-Ray irradiations
thanks to the double side optimization. The fabricated iLGAD sensors exhibit
good electrical performances before and after an X-Ray irradiation. The second
iLGAD generation is able to withstand the same voltage, as contrary to the
first iLGAD generation after irradiation.
","[{""version"":""v1"",""created"":""Thu, 3 Feb 2022 12:24:01 GMT""},{""version"":""v2"",""created"":""Wed, 1 Jun 2022 14:46:22 GMT""}]","2022-06-02"
"2202.01553","Patrick Laurie Davies Mr","Laurie Davies and Lutz D\""umbgen","Covariate Selection Based on a Model-free Approach to Linear Regression
  with Exact Probabilities",,,,,"stat.ME","http://arxiv.org/licenses/nonexclusive-distrib/1.0/","  In this paper we give a completely new approach to the problem of covariate
selection in linear regression. A covariate or a set of covariates is included
only if it is better in the sense of least squares than the same number of
Gaussian covariates consisting of i.i.d. $N(0,1)$ random variables. The
Gaussian P-value is defined as the probability that the Gaussian covariates are
better. It is given in terms of the Beta distribution, it is exact and it holds
for all data making it model-free free. The covariate selection procedures
require only a cut-off value $\alpha$ for the Gaussian P-value: the default
value in this paper is $\alpha=0.01$. The resulting procedures are very simple,
very fast, do not overfit and require only least squares. In particular there
is no regularization parameter, no data splitting, no use of simulations, no
shrinkage and no post selection inference is required. The paper includes the
results of simulations, applications to real data sets and theorems on the
asymptotic behaviour under the standard linear model. Here the step-wise
procedure performs overwhelmingly better than any other procedure we are aware
of. An R-package {\it gausscov} is available.
","[{""version"":""v1"",""created"":""Thu, 3 Feb 2022 12:28:29 GMT""},{""version"":""v2"",""created"":""Wed, 23 Feb 2022 19:45:27 GMT""}]","2022-02-25"
"2202.01554","Sophie Moufawad","Sophie M. Moufawad and Nabil R. Nassif","Newton Type Methods for solving a Hasegawa-Mima Plasma Model","27 pages, 5 figures with 48 subfigures",,,,"math.NA cs.NA","http://creativecommons.org/licenses/by-nc-nd/4.0/","  In [1], the non-linear space-time Hasegawa-Mima plasma equation is formulated
as a coupled system of two linear PDE's, a solution of which is a pair (u, w).
The first equation is of hyperbolic type and the second of elliptic type.
Variational frames for obtaining weak solutions to the initial value
Hasegawa-Mima problem with periodic boundary conditions were also derived. In a
more recent work [2], a numerical approach consisting of a finite element
space-domain combined with an Euler-implicit time scheme was used to discretize
the coupled variational Hasegawa-Mima model. A semi-linear version of this
implicit nonlinear scheme was tested for several types of initial conditions.
This semi-linear scheme proved to lack efficiency for long time, which
necessitates imposing a cap on the magnitude of the solution. To circumvent
this difficulty, in this paper, we use Newton-type methods (Newton, Chord and
an introduced Modified Newton method) to solve numerically the fully-implicit
non-linear scheme. Testing these methods in FreeFEM++ indicates significant
improvements as no cap needs to be imposed for long time. In the sequel, we
demonstrate the validity of these methods by proving several results, in
particular the convergence of the implemented methods.
","[{""version"":""v1"",""created"":""Thu, 3 Feb 2022 12:28:56 GMT""}]","2022-02-04"
"2202.01555","Giorgi Tutberidze","V. Tsagareishvili and G. Tutberidze","Absolute convergence factors of Lipshitz class functions for general
  Fourier series",,,,,"math.CA math.AP","http://creativecommons.org/licenses/by-sa/4.0/","  The main aim of this paper is to investigate the sequences of positive
numbers, for which multiplication with Fourier coefficients of functions $f\in$
Lip1 class provides absolute convergence of Fourier series. In particular we
found special conditions for the functions of orthonormal system, for which the
above sequences are absolute convergence factors of Fourier series of functions
of Lip1 class. It is established that the resulting conditions are best
possible in certain sense.
","[{""version"":""v1"",""created"":""Thu, 3 Feb 2022 12:31:16 GMT""}]","2022-02-04"
"2202.01556","Tymoteusz Chmiel","Tymoteusz Chmiel and S{\l}awomir Cynk","Periods of singular double octic Calabi-Yau threefolds and modular forms",,,,,"math.AG math.NT","http://arxiv.org/licenses/nonexclusive-distrib/1.0/","  By the modularity theorem every rigid Calabi-Yau threefold $X$ has associated
modular form $f$ such that the equality of $L$-functions $L(X,s)=L(f,s)$ holds.
In this case period integrals of $X$ are expected to be expressible in terms of
the special values $L(f,1)$ and $L(f,2)$. We propose a similar interpretation
of period integrals of a nodal model of $X$. It is given in terms of certain
variants of a Mellin transform of $f$. We provide numerical evidence towards
this interpretation based on a case of double octics.
","[{""version"":""v1"",""created"":""Thu, 3 Feb 2022 12:32:32 GMT""}]","2022-02-04"
"2202.01557","Krissia Zawadzki","G. A. Canella, K. Zawadzki, V. V. Fran\c{c}a","Effects of Temperature and Magnetization on the Mott-Anderson Physics in
  one-dimensional Disordered Systems",,"Sci Rep 12, 8709 (2022)","10.1038/s41598-022-12561-2",,"cond-mat.str-el cond-mat.dis-nn cond-mat.mtrl-sci cond-mat.quant-gas quant-ph","http://arxiv.org/licenses/nonexclusive-distrib/1.0/","  We investigate the Mott-Anderson physics in interacting disordered
one-dimensional chains through the average single-site entanglement quantified
by the linear entropy, which is obtained via density-functional theory
calculations. We show that the minimum disorder strength required to the
so-called full Anderson localization $-$ characterized by the real-space
localization of pairs $-$ is strongly dependent on the interaction regime. The
degree of localization is found to be intrinsically related to the interplay
between the correlations and the disorder potential. In magnetized systems, the
minimum entanglement characteristic of the full Anderson localization is split
into two, one for each of the spin species. We show that although all types of
localization eventually disappear with increasing temperature, the full
Anderson localization persists for higher temperatures than the Mott-like
localization.
","[{""version"":""v1"",""created"":""Thu, 3 Feb 2022 12:33:36 GMT""},{""version"":""v2"",""created"":""Tue, 24 May 2022 13:43:04 GMT""}]","2022-05-25"
"2202.01558","Hartmut Lentz","Hartmut H. K. Lentz, Hannes Bergmann, C. Sauter-Louis","The Diffusion Metrics of African Swine Fever in Wild Boar",,,,,"q-bio.PE physics.bio-ph","http://creativecommons.org/licenses/by/4.0/","  To control African swine fever (ASF) efficiently, easily interpretable
metrics of the outbreak dynamics are needed to plan and adapt the required
measures. We found that the spread pattern of African Swine Fever cases in wild
boar follows the mechanics of a diffusion process, at least in the early phase,
for the cases that occurred in Germany. Following incursion into a previously
unaffected area, infection disseminates locally within a naive and abundant
wild boar population. Using real case data for Germany, we derive statistics
about the time differences and distances between consecutive case reports. With
the use of these statistics, we generate an ensemble of random walkers
(continuous time random walks, CTRW) that resemble the properties of the
observed outbreak pattern as one possible realization of all possible disease
dissemination patterns. The trained random walker ensemble yields the diffusion
constant, the affected area, and the outbreak velocity of early ASF spread in
wild boar. These quantities are easy to interpret, robust, and may be
generalized or adapted to different regions. Therefore, diffusion metrics can
be useful descriptors of early disease dynamics and help facilitate efficient
control of African Swine Fever.
","[{""version"":""v1"",""created"":""Thu, 3 Feb 2022 12:34:10 GMT""},{""version"":""v2"",""created"":""Mon, 7 Feb 2022 10:25:23 GMT""},{""version"":""v3"",""created"":""Thu, 30 Jun 2022 08:30:33 GMT""}]","2022-07-01"
"2202.01559","Jongyul Lee","Jongyul Lee and Vasilis Friderikos","Robotic Aerial 6G Small Cells with Grasping End Effectors for mmWave
  Relay Backhauling","6 pages, 4 figures, conference",,,,"cs.NI cs.RO","http://arxiv.org/licenses/nonexclusive-distrib/1.0/","  Deployment of small cells in dense urban areas dedicated to the heterogeneous
network (HetNet) and associated relay nodes for improving backhauling is
expected to be an important structural element in the design of beyond 5G (B5G)
and 6G wireless access networks. A key operational aspect in HetNets is how to
optimally implement the wireless backhaul links to efficiently support the
traffic demand. In this work, we utilize the recently proposed Robotic Aerial
Small Cells (RASCs) that are able to grasp at different tall urban landforms as
wireless relay nodes for backhauling. This can be considered as an alternative
to fixed small cells (FSCs) which lack flexibility since once installed their
position cannot be altered. More specifically, on-demand deployment of RASCs is
considered for constructing a millimeter-wave (mmWave) backhaul network to
optimize available network capacity using a network flow-based mixed integer
linear programming (MILP) formulation. Numerical investigations reveal that for
the same required achievable throughput, the number of RASCs required are 25\%
to 65\% less than the number of required FSCs. This result can have significant
implications in reducing required wireless network equipment (capex) to provide
a given network capacity and allows for an efficient and flexible network
densification.
","[{""version"":""v1"",""created"":""Thu, 3 Feb 2022 12:35:06 GMT""}]","2022-02-04"
"2202.01560","Marcel Matha","Marcel Matha and Christian Morsbach","Extending turbulence model uncertainty quantification using machine
  learning","NeurIPS2021 - Thirty-fifth Conference on Neural Information
  Processing Systems, Fourth Workshop on Machine Learning and the Physical
  Sciences, 5 pages, 4 figures",,,,"cs.CE physics.flu-dyn","http://creativecommons.org/licenses/by/4.0/","  In order to achieve a more virtual design and certification process of jet
engines in aviation industry, the uncertainty bounds for computational fluid
dynamics have to be known. This work shows the application of a machine
learning methodology to quantify the epistemic uncertainties of turbulence
models. The underlying method in order to estimate the uncertainty bounds is
based on an eigenspace perturbation of the Reynolds stress tensor in
combination with random forests.
","[{""version"":""v1"",""created"":""Thu, 3 Feb 2022 12:36:32 GMT""},{""version"":""v2"",""created"":""Fri, 4 Feb 2022 11:47:51 GMT""}]","2022-02-07"
"2202.01561","Giorgi Tutberidze","V. Tsagareishvili and G.Tutberidze","Some problems of convergence of general Fourier series",,,,,"math.CA math.AP","http://creativecommons.org/licenses/by-sa/4.0/","  S. Banach \cite{Banach} proved that good differential properties of function
do not guarantee the a.e. convergence of the Fourier series of this function
with respect to general orthonormal systems (ONS). On the other hand it is very
well known that a sufficient condition for the a.e. convergence of an
orthonormal series is given by the Menshov-Rademacher Theorem.
  The paper deals with sequence of positive numbers $(d_n)$ such that
multiplying the Fourier coefficients $(C_n(f))$ of functions with bounded
variation by these numbers one obtains a.e. convergent series of the form
$\sum_{n=1}^{\infty}d_n C_n(f) \varphi_n (x).$ It is established that the
resulting conditions are best possible.
","[{""version"":""v1"",""created"":""Thu, 3 Feb 2022 12:37:20 GMT""}]","2022-02-04"
"2202.01562","Haruka Kiyohara","Haruka Kiyohara, Yuta Saito, Tatsuya Matsuhiro, Yusuke Narita,
  Nobuyuki Shimizu, Yasuo Yamamoto","Doubly Robust Off-Policy Evaluation for Ranking Policies under the
  Cascade Behavior Model","WSDM2022",,"10.1145/3488560.3498380",,"stat.ML cs.LG","http://arxiv.org/licenses/nonexclusive-distrib/1.0/","  In real-world recommender systems and search engines, optimizing ranking
decisions to present a ranked list of relevant items is critical. Off-policy
evaluation (OPE) for ranking policies is thus gaining a growing interest
because it enables performance estimation of new ranking policies using only
logged data. Although OPE in contextual bandits has been studied extensively,
its naive application to the ranking setting faces a critical variance issue
due to the huge item space. To tackle this problem, previous studies introduce
some assumptions on user behavior to make the combinatorial item space
tractable. However, an unrealistic assumption may, in turn, cause serious bias.
Therefore, appropriately controlling the bias-variance tradeoff by imposing a
reasonable assumption is the key for success in OPE of ranking policies. To
achieve a well-balanced bias-variance tradeoff, we propose the Cascade Doubly
Robust estimator building on the cascade assumption, which assumes that a user
interacts with items sequentially from the top position in a ranking. We show
that the proposed estimator is unbiased in more cases compared to existing
estimators that make stronger assumptions. Furthermore, compared to a previous
estimator based on the same cascade assumption, the proposed estimator reduces
the variance by leveraging a control variate. Comprehensive experiments on both
synthetic and real-world data demonstrate that our estimator leads to more
accurate OPE than existing estimators in a variety of settings.
","[{""version"":""v1"",""created"":""Thu, 3 Feb 2022 12:42:33 GMT""}]","2022-02-04"
"2202.01563","Shahar Stein Ioushua Ms.","Shahar Stein Ioushua and Ofer Shayevitz","On the Number of Graphs with a Given Histogram","40 pages",,,,"cs.IT math.IT","http://arxiv.org/licenses/nonexclusive-distrib/1.0/","  Let $G$ be a large (simple, unlabeled) dense graph on $n$ vertices. Suppose
that we only know, or can estimate, the empirical distribution of the number of
subgraphs $F$ that each vertex in $G$ participates in, for some fixed small
graph $F$. How many other graphs would look essentially the same to us, i.e.,
would have a similar local structure? In this paper, we derive upper and lower
bounds on the number of graphs whose empirical distribution lies close (in the
Kolmogorov-Smirnov distance) to that of $G$. Our bounds are given as solutions
to a maximum entropy problem on random graphs of a fixed size $k$ that does not
depend on $n$, under $d$ global density constraints. The bounds are
asymptotically close, with a gap that vanishes with $d$ at a rate that depends
on the concentration function of the center of the Kolmogorov-Smirnov ball.
","[{""version"":""v1"",""created"":""Thu, 3 Feb 2022 12:43:14 GMT""},{""version"":""v2"",""created"":""Mon, 13 Jun 2022 07:17:07 GMT""},{""version"":""v3"",""created"":""Tue, 16 Aug 2022 07:51:19 GMT""},{""version"":""v4"",""created"":""Wed, 28 Sep 2022 11:38:46 GMT""}]","2022-09-29"
"2202.01564","Weizhen Liu","Weizhen Liu, Qian He, Xuming He","Weakly Supervised Nuclei Segmentation via Instance Learning","Accepted by ISBI 2022 as Oral Presentation",,,,"eess.IV cs.CV q-bio.QM","http://arxiv.org/licenses/nonexclusive-distrib/1.0/","  Weakly supervised nuclei segmentation is a critical problem for pathological
image analysis and greatly benefits the community due to the significant
reduction of labeling cost. Adopting point annotations, previous methods mostly
rely on less expressive representations for nuclei instances and thus have
difficulty in handling crowded nuclei. In this paper, we propose to decouple
weakly supervised semantic and instance segmentation in order to enable more
effective subtask learning and to promote instance-aware representation
learning. To achieve this, we design a modular deep network with two branches:
a semantic proposal network and an instance encoding network, which are trained
in a two-stage manner with an instance-sensitive loss. Empirical results show
that our approach achieves the state-of-the-art performance on two public
benchmarks of pathological images from different types of organs.
","[{""version"":""v1"",""created"":""Thu, 3 Feb 2022 12:51:30 GMT""},{""version"":""v2"",""created"":""Fri, 11 Feb 2022 13:06:29 GMT""}]","2022-02-14"
