"2202.01398","Yasuhiro Miyazawa","Yasuhiro Miyazawa, Chun-Wei Chen, Rajesh Chaunsali, Timothy S.
  Gormley, Gloria Yin, Georgios Theocharis, Jinkyu Yang","Topological state transfer in Kresling origami","24 pages, 5 figures","Commun Mater 3, 62 (2022)","10.1038/s43246-022-00280-0",,"cond-mat.mes-hall","http://arxiv.org/licenses/nonexclusive-distrib/1.0/","  Topological mechanical metamaterials have been widely explored for their
boundary states, which can be robustly isolated or transported in a controlled
manner. However, such systems often require pre-configured design or complex
active actuation for wave manipulation. Here, we present the possibility of
in-situ transfer of topological boundary modes by leveraging the
reconfigurability intrinsic in twisted origami lattices. In particular, we
employ a dimer Kresling origami system consisting of unit cells with opposite
chirality, which couples longitudinal and rotational degrees of freedom in
elastic waves. The quasi-static twist imposed on the lattice alters the strain
landscape of the lattice, thus significantly affecting the wave dispersion
relations and the topology of the underling bands. This in turn facilitates an
efficient topological state transfer from one edge to the other. This simple
and practical approach of energy transfer in origami-inspired lattices can thus
inspire a new class of efficient energy manipulation devices.
","[{""version"":""v1"",""created"":""Thu, 3 Feb 2022 04:18:49 GMT""}]","2022-12-06"
"2202.01399","Xingri Geng","Xingri Geng","Effective Boundary Conditions Arising from the Heat Equation with
  Three-dimensional Interior Inclusion","25 pages, 2 figures, some typos are corrected",,,,"math.AP","http://arxiv.org/licenses/nonexclusive-distrib/1.0/","  We study the initial boundary value problem for a heat equation in a domain
containing a thin layer. The thermal conductivity of the layer is drastically
different from that of the bulk of the domain; moreover, the layer is
anisotropic and ``optimally aligned"" in the sense that the normal direction in
the layer is always an eigenvector of the thermal tensor. To reveal the effects
of the layer, we regard it as a thickless surface on which ``effective boundary
conditions"" (EBCs) are satisfied by the limit of solutions of the initial
boundary value problem as the thickness of the layer shrinks to zero. These
EBCs are rich in variety and type, including some nonstandard ones such as the
Dirichlet-to-Neumann mapping and the fractional Laplacian.
","[{""version"":""v1"",""created"":""Thu, 3 Feb 2022 04:19:32 GMT""},{""version"":""v2"",""created"":""Sat, 1 Oct 2022 02:45:13 GMT""},{""version"":""v3"",""created"":""Wed, 25 Jan 2023 04:26:01 GMT""}]","2023-01-26"
"2202.01400","Daiki Hashimoto","Daiki Hashimoto, Atsushi J. Nishizawa and Masahiro Takada","Constraining Dark matter annihilation with Dark Energy Survey Y3 LSBG
  sample","8 pages, 3 figures, submitted to PRD",,,,"astro-ph.CO","http://creativecommons.org/publicdomain/zero/1.0/","  To reveal natures of the dark matter (DM) particles, a gamma-ray signal
produced in annihilation processes of DM into the standard model particles has
been one of the major probes. The cross-correlation between highly DM dominated
structures, such as local dwarf galaxies, and observed photons in the direction
of the structures, has been explored and provided stringent constraints on the
annihilation rate. In our previous work, we have shown that it is sufficient to
know the distance distribution of the galaxy sample and individual distance
measurement is not required for constraining the annihilation rate. In this
work, we apply the method to low-surface brightness galaxies (LSBGs) with
unknown individual redshifts provided from the Dark Energy Survey (DES) Year 3
data. With all DES-LSBGs of about 24,000 objects, we find that the upper limits
of the cross section for bb channel with 95% C.L. is 3*10^-25 cm^3/s at DM mass
of 100 GeV. To be more conservative, we remove about 7000 LSBGs within 1 degree
from resolved gamma-ray point sources and then the constraint becomes 30 %
weaker than the one with all samples in all DM mass ranges.
","[{""version"":""v1"",""created"":""Thu, 3 Feb 2022 04:19:49 GMT""}]","2022-02-04"
"2202.01401","Megumi Shidatsu","Megumi Shidatsu, Kohei Kobayashi, Hitoshi Negoro, Wataru Iwakiri,
  Satoshi Nakahira, Yoshihiro Ueda, Tatehiro Mihara, Teruaki Enoto, Keith
  Gendreau, Zaven Arzoumanian, John Pope, Bruce Trout, Takashi Okajima, Yang
  Soong","Discovery and Long-term Broadband X-ray monitoring of Galactic Black
  Hole Candidate MAXI J1803-298","13 pages, 10 figures, Accepted for publication in ApJ",,"10.3847/1538-4357/ac517b",,"astro-ph.HE","http://arxiv.org/licenses/nonexclusive-distrib/1.0/","  We report the results from the broad-band X-ray monitoring of the new
Galactic black hole candidate MAXI J1803$-$298 with the MAXI/GSC and Swift/BAT
during its outburst. After the discovery on 2021 May 1, the soft X-ray flux
below 10 keV rapidly increased for $\sim 10$ days and then have been gradually
decreasing over 5 months. At the brightest phase, the source exhibited the
state transition from the low/hard state to the high/soft state via the
intermediate state. The broad-band X-ray spectrum during the outburst was well
described with a disk blackbody plus its thermal or non-thermal Comptonization.
Before the transition the source spectrum was described by a thermal
Comptonization component with a photon index of $\sim 1.7$ and an electron
temperature of $\sim 30$ keV, whereas a strong disk blackbody component was
observed after the transition. The spectral properties in these periods are
consistent with the low/hard state and the high/soft state, respectively. A
sudden flux drop with a few days duration, unassociated with a significant
change in the hardness ratio, was found in the intermediate state. A possible
cause of this variation is that the mass accretion rate rapidly increased at
the disk transition, which induced a strong Compton-thick outflow and scattered
out the X-ray flux. Assuming a non-spinning black hole, we estimated a black
hole mass of MAXI J1803$-$298 as $5.8 \pm 0.4~(\cos i/\cos 70^\circ)^{-1/2}
(D/8~\mathrm{kpc})~M_\odot$ (where $i$ and $D$ are the inclination angle and
the distance) from the inner disk radius obtained in the high/soft state.
","[{""version"":""v1"",""created"":""Thu, 3 Feb 2022 04:29:39 GMT""}]","2022-03-30"
"2202.01402","Jifan Zhang","Jifan Zhang, Julian Katz-Samuels, Robert Nowak","GALAXY: Graph-based Active Learning at the Extreme",,,,,"cs.LG","http://arxiv.org/licenses/nonexclusive-distrib/1.0/","  Active learning is a label-efficient approach to train highly effective
models while interactively selecting only small subsets of unlabelled data for
labelling and training. In ""open world"" settings, the classes of interest can
make up a small fraction of the overall dataset -- most of the data may be
viewed as an out-of-distribution or irrelevant class. This leads to extreme
class-imbalance, and our theory and methods focus on this core issue. We
propose a new strategy for active learning called GALAXY (Graph-based Active
Learning At the eXtrEme), which blends ideas from graph-based active learning
and deep learning. GALAXY automatically and adaptively selects more
class-balanced examples for labeling than most other methods for active
learning. Our theory shows that GALAXY performs a refined form of uncertainty
sampling that gathers a much more class-balanced dataset than vanilla
uncertainty sampling. Experimentally, we demonstrate GALAXY's superiority over
existing state-of-art deep active learning algorithms in unbalanced vision
classification settings generated from popular datasets.
","[{""version"":""v1"",""created"":""Thu, 3 Feb 2022 04:30:59 GMT""},{""version"":""v2"",""created"":""Fri, 27 May 2022 03:31:45 GMT""}]","2022-05-30"
"2202.01403","Tianqi Zhao","Tianqi Zhao, Constantinos Constantinou, Prashanth Jaikumar, Madappa
  Prakash","Quasi-normal g-modes of neutron stars with quarks","14 pages, 10 figures",,"10.1103/PhysRevD.105.103025",,"gr-qc astro-ph.HE astro-ph.SR nucl-th","http://arxiv.org/licenses/nonexclusive-distrib/1.0/","  Quasi-normal oscillation modes of neutron stars provide a means to probe
their interior composition using gravitational wave astronomy. We compute the
frequencies and damping times of composition-dependent core g-modes of neutron
stars containing quark matter employing linearized perturbative equations of
general relativity. We find that ignoring background metric perturbations due
to the oscillating fluid, as in the Cowling approximation, underestimates the
g-mode frequency by up to 10% for higher mass stars, depending on the
parameters of the nuclear equation of state and how the mixed phase is
constructed. The g-mode frequencies are well-described by a linear scaling with
the central lepton (or combined lepton and quark) fraction for nucleonic
(hybrid) stars. Our findings suggest that neutron stars with and without quarks
are manifestly different with regards to their quasi-normal g-mode spectrum,
and may thus be distinguished from one another in future observations of
gravitational waves from merging neutron stars.
","[{""version"":""v1"",""created"":""Thu, 3 Feb 2022 04:33:48 GMT""}]","2022-06-08"
"2202.01404","Junji Hisano","Junji Hisano","Proton Decay in SUSY GUTs","Published in special issues of PTEP in memory of Professor Masatoshi
  Koshiba",,,,"hep-ph hep-ex","http://creativecommons.org/licenses/by/4.0/","  I review proton decay in the SUSY SU(5) GUTs assuming the mini-split SUSY
breaking model. In the mini-split SUSY breaking model, the squark and slepton
masses are O(10^{(2-3)}) TeV while the gaugino masses are O(1) TeV. As the
result, even the minimal SUSY SU(5) GUT is still viable in the model. We
present the motivation of the mini-split SUSY model and discuss the future
prospects of proton decay searches in the SUSY SU(5) GUTs.
","[{""version"":""v1"",""created"":""Thu, 3 Feb 2022 04:42:29 GMT""}]","2022-02-04"
"2202.01405","Chaitanya Prasad Narisetty","Chaitanya Narisetty, Emiru Tsunoo, Xuankai Chang, Yosuke Kashiwagi,
  Michael Hentschel, Shinji Watanabe","Joint Speech Recognition and Audio Captioning","5 pages, 2 figures. Accepted for ICASSP 2022",,,,"eess.AS cs.CL cs.SD","http://creativecommons.org/licenses/by/4.0/","  Speech samples recorded in both indoor and outdoor environments are often
contaminated with secondary audio sources. Most end-to-end monaural speech
recognition systems either remove these background sounds using speech
enhancement or train noise-robust models. For better model interpretability and
holistic understanding, we aim to bring together the growing field of automated
audio captioning (AAC) and the thoroughly studied automatic speech recognition
(ASR). The goal of AAC is to generate natural language descriptions of contents
in audio samples. We propose several approaches for end-to-end joint modeling
of ASR and AAC tasks and demonstrate their advantages over traditional
approaches, which model these tasks independently. A major hurdle in evaluating
our proposed approach is the lack of labeled audio datasets with both speech
transcriptions and audio captions. Therefore we also create a multi-task
dataset by mixing the clean speech Wall Street Journal corpus with multiple
levels of background noises chosen from the AudioCaps dataset. We also perform
extensive experimental evaluation and show improvements of our proposed methods
as compared to existing state-of-the-art ASR and AAC methods.
","[{""version"":""v1"",""created"":""Thu, 3 Feb 2022 04:42:43 GMT""}]","2022-02-04"
"2202.01406","Paul Chichura","P. M. Chichura, A. Foster, C. Patel, N. Ossa-Jaen, P. A. R. Ade, Z.
  Ahmed, A. J. Anderson, M. Archipley, J. E. Austermann, J. S. Avva, L.
  Balkenhol, P. S. Barry, R. Basu Thakur, J. A. Beall, K. Benabed, A. N.
  Bender, B. A. Benson, F. Bianchini, L. E. Bleem, F. R. Bouchet, L. Bryant, K.
  Byrum, J. E. Carlstrom, F. W. Carter, T. W. Cecil, C. L. Chang, P. Chaubal,
  G. Chen, H. C. Chiang, H.-M. Cho, T-L. Chou, R. Citron, J.-F. Cliche, T. M.
  Crawford, A. T. Crites, A. Cukierman, C. M. Daley, E. V. Denison, K. Dibert,
  J. Ding, M. A. Dobbs, D. Dutcher, W. Everett, C. Feng, K. R. Ferguson, J. Fu,
  S. Galli, J. Gallicchio, A. E. Gambrel, R. W. Gardner, E. M. George, N.
  Goeckner-Wald, R. Gualtieri, S. Guns, N. Gupta, R. Guyser, T. de Haan, N. W.
  Halverson, A. H. Harke-Hosemann, N. L. Harrington, J. W. Henning, G. C.
  Hilton, E. Hivon, G. P. Holder, W. L. Holzapfel, J. C. Hood, D. Howe, J. D.
  Hrubes, N. Huang, J. Hubmayr, K. D. Irwin, O. B. Jeong, M. Jonas, A. Jones,
  T. S. Khaire, L. Knox, A. M. Kofman, M. Korman, D. L. Kubik, S. Kuhlmann,
  C.-L. Kuo, A. T. Lee, E. M. Leitch, D. Li, A. Lowitz, C. Lu, D. P. Marrone,
  J. J. McMahon, S. S. Meyer, D. Michalik, M. Millea, L. M. Mocanu, J.
  Montgomery, C. Corbett Moran, A. Nadolski, T. Natoli, H. Nguyen, J. P.
  Nibarger, G. Noble, V. Novosad, Y. Omori, S. Padin, Z. Pan, P. Paschos, S.
  Patil, J. Pearson, K. A. Phadke, C. M. Posada, K. Prabhu, C. Pryke, W. Quan,
  A. Rahlin, C. L. Reichardt, D. Riebel, B. Riedel, M. Rouble, J. E. Ruhl, B.
  R. Saliwanchik, J. T. Sayre, K. K. Schaffer, E. Schiappucci, E. Shirokoff, C.
  Sievers, G. Smecher, J. A. Sobrin, A. Springmann, A. A. Stark, J. Stephen, K.
  T. Story, A. Suzuki, C. Tandoi, K. L. Thompson, B. Thorne, C. Tucker, C.
  Umilta, L. R. Vale, T. Veach, J. D. Vieira, G. Wang, N. Whitehorn, W. L. K.
  Wu, V. Yefremenko, K. W. Yoon, M. R. Young","Asteroid Measurements at Millimeter Wavelengths with the South Pole
  Telescope","21 pages, 9 figures","2022 ApJ 936 173","10.3847/1538-4357/ac89ec",,"astro-ph.EP","http://arxiv.org/licenses/nonexclusive-distrib/1.0/","  We present the first measurements of asteroids in millimeter wavelength (mm)
data from the South Pole Telescope (SPT), which is used primarily to study the
cosmic microwave background (CMB). We analyze maps of two $\sim270$ deg$^2$ sky
regions near the ecliptic plane, each observed with the SPTpol camera $\sim100$
times over one month. We subtract the mean of all maps of a given field,
removing static sky signal, and then average the mean-subtracted maps at known
asteroid locations. We detect three asteroids$\text{ -- }$(324) Bamberga, (13)
Egeria, and (22) Kalliope$\text{ -- }$with signal-to-noise ratios (S/N) of
11.2, 10.4, and 6.1, respectively, at 2.0 mm (150 GHz); we also detect (324)
Bamberga with S/N of 4.1 at 3.2 mm (95 GHz). We place constraints on these
asteroids' effective emissivities, brightness temperatures, and light curve
modulation amplitude. Our flux density measurements of (324) Bamberga and (13)
Egeria roughly agree with predictions, while our measurements of (22) Kalliope
suggest lower flux, corresponding to effective emissivities of $0.66 \pm 0.11$
at 2.0 mm and $<0.47$ at 3.2mm. We predict the asteroids detectable in other
SPT datasets and find good agreement with detections of (772) Tanete and (1093)
Freda in recent data from the SPT-3G camera, which has $\sim10 \times$ the
mapping speed of SPTpol. This work is the first focused analysis of asteroids
in data from CMB surveys, and it demonstrates we can repurpose historic and
future datasets for asteroid studies. Future SPT measurements can help
constrain the distribution of surface properties over a larger asteroid
population.
","[{""version"":""v1"",""created"":""Thu, 3 Feb 2022 04:44:19 GMT""},{""version"":""v2"",""created"":""Fri, 21 Apr 2023 06:07:12 GMT""}]","2023-04-24"
"2202.01407","Mohammad Reza Jokar","Mohammad Reza Jokar, Richard Rines, Ghasem Pasandi, Haolin Cong, Adam
  Holmes, Yunong Shi, Massoud Pedram, Frederic T. Chong","DigiQ: A Scalable Digital Controller for Quantum Computers Using SFQ
  Logic",,,,,"quant-ph","http://arxiv.org/licenses/nonexclusive-distrib/1.0/","  The control of cryogenic qubits in today's superconducting quantum computer
prototypes presents significant scalability challenges due to the massive costs
of generating/routing the analog control signals that need to be sent from a
classical controller at room temperature to the quantum chip inside the
dilution refrigerator. Thus, researchers in industry and academia have focused
on designing in-fridge classical controllers in order to mitigate these
challenges. Superconducting Single Flux Quantum (SFQ) is a classical logic
family proposed for large-scale in-fridge controllers. SFQ logic has the
potential to maximize scalability thanks to its ultra-high speed and very low
power consumption. However, architecture design for SFQ logic poses challenges
due to its unconventional pulse-driven nature and lack of dense memory and
logic. Thus, research at the architecture level is essential to guide
architects to design SFQ-based classical controllers for large-scale quantum
machines.
  In this paper, we present DigiQ, the first system-level design of a Noisy
Intermediate Scale Quantum (NISQ)-friendly SFQ-based classical controller. We
perform a design space exploration of SFQ-based controllers and co-design the
quantum gate decompositions and SFQ-based implementation of those
decompositions to find an optimal SFQ-friendly design point that trades area
and power for latency and control while ensuring good quantum algorithmic
performance. Our co-design results in a single instruction, multiple data
(SIMD) controller architecture, which has high scalability (>42,000-qubit
scales), but imposes new challenges on the calibration of control pulses. We
present software-level solutions to address these challenges, which if
unaddressed would degrade quantum circuit fidelity given the imperfections of
qubit hardware.
","[{""version"":""v1"",""created"":""Thu, 3 Feb 2022 04:52:14 GMT""}]","2022-02-04"
"2202.01408","Ramachandrarao Yalla","Ramachandrarao Yalla, K. Muhammed Shafi, Kali P. Nayak, and Kohzo
  Hakuta","One-sided composite cavity on an optical nanofiber for cavity QED","6 pages, 4 figures","Appl. Phys. Lett. 120, 071108 (2022)","10.1063/5.0079624","071108","quant-ph physics.optics","http://creativecommons.org/licenses/by/4.0/","  We demonstrate a one-sided cavity on an optical nanofiber (ONF) using a
composite method. The one-sided composite cavity is created by mounting an
asymmetric defect mode grating on an ONF. We design the one-sided composite
cavity on an ONF to enhance channeling efficiency into one side of ONF while
operating from under- to critical- and over-coupling regimes using numerical
simulations. Experimentally, we demonstrate coupling characteristics of the
one-sided composite cavity, showing good correspondence with simulation
results.
","[{""version"":""v1"",""created"":""Thu, 3 Feb 2022 04:55:05 GMT""}]","2022-02-17"
"2202.01409","Zhuoran Du","Zhuoran Du, Zhenping Feng, Jiaqi Hu, Yuan Li","Classification of solutions to equations involving Higher-order
  fractional Laplacian","19 pages. arXiv admin note: text overlap with arXiv:2201.00917",,,,"math.AP","http://creativecommons.org/licenses/by/4.0/","  In this paper, we are concerned with the following equation involving
higher-order fractional Lapalacian \begin{equation*} \left\{\begin{aligned}
&(-\Delta)^{p+{\frac{\alpha}{2}}}u(x)=u_+^\gamma~~ \mbox{ in }\mathbb{R}^n,\\
&\int_{\mathbb{R}^n}u_+^\gamma dx<+\infty, \end{aligned}\right. \end{equation*}
where $p\geq 1$ is an integer, $0<\alp<2$, $n> 2p+\alpha$ and $\gamma \in
(1,\frac{n}{n-2p-\alp})$. We establish an integral representation formula for
any nonconstant classical solution satisfying certain growth at infinity. From
this we prove that these solutions are radially symmetric about some point in
$\R^n$ and monotone decreasing in the radial direction via method of moving
planes in integral forms.
","[{""version"":""v1"",""created"":""Thu, 3 Feb 2022 04:56:34 GMT""}]","2022-02-04"
"2202.01410","Po-Lam Yung","Haim Brezis, Andreas Seeger, Jean Van Schaftingen, Po-Lam Yung","Sobolev spaces revisited","21 pages","Atti Accad. Naz. Lincei Rend. Lincei Mat. Appl. 33 (2022), no. 2,
  413--437","10.4171/RLM/976",,"math.CA math.FA","http://arxiv.org/licenses/nonexclusive-distrib/1.0/","  We describe a recent, one-parameter family of characterizations of Sobolev
and BV functions on $\mathbb{R}^n$, using sizes of superlevel sets of suitable
difference quotients. This provides an alternative point of view to the BBM
formula by Bourgain, Brezis and Mironescu, and complements in the case of BV
some results of Cohen, Dahmen, Daubechies and DeVore about the sizes of wavelet
coefficients of such functions. An application towards Gagliardo-Nirenberg
interpolation inequalities is then given. We also establish a related
one-parameter family of formulae for the $L^p$ norm of functions in
$L^p(\mathbb{R}^n)$.
","[{""version"":""v1"",""created"":""Thu, 3 Feb 2022 04:59:58 GMT""}]","2022-12-08"
"2202.01411","Mohammad Reza Jokar","Mohammad Reza Jokar, Richard Rines, Frederic T. Chong","Practical implications of SFQ-based two-qubit gates",,,"10.1109/QCE52317.2021.00061",,"quant-ph","http://arxiv.org/licenses/nonexclusive-distrib/1.0/","  Scalability of today's superconducting quantum computers is limited due to
the huge costs of generating/routing microwave control pulses per qubit from
room temperature. One active research area in both industry and academia is to
push the classical controllers to the dilution refrigerator in order to
increase the scalability of quantum computers. Superconducting Single Flux
Quantum (SFQ) is a classical logic technology with low power consumption and
ultra-high speed, and thus is a promising candidate for in-fridge classical
controllers with maximized scalability. Prior work has demonstrated
high-fidelity SFQ-based single-qubit gates. However, little research has been
done on SFQ-based multi-qubit gates, which are necessary to realize SFQ-based
universal quantum computing.
  In this paper, we present the first thorough analysis of SFQ-based two-qubit
gates. Our observations show that SFQ-based two-qubit gates tend to have high
leakage to qubit non-computational subspace, which presents severe design
challenges. We show that despite these challenges, we can realize gates with
high fidelity by carefully designing optimal control methods and qubit
architectures. We develop optimal control methods that suppress leakage, and
also investigate various qubit architectures that reduce the leakage. After
carefully engineering our SFQ-friendly quantum system, we show that it can
achieve similar gate fidelity and gate time to microwave-based quantum systems.
The promising results of this paper show that (1) SFQ-based universal quantum
computation is both feasible and effective; and (2) SFQ is a promising approach
in designing classical controller for quantum machines because it can increase
the scalability while preserving gate fidelity and performance.
","[{""version"":""v1"",""created"":""Thu, 3 Feb 2022 05:05:24 GMT""}]","2022-02-04"
"2202.01412","Oleg Pikhurko","Andr\'as M\'ath\'e and Jonathan A. Noel and Oleg Pikhurko","Circle Squaring with Pieces of Small Boundary and Low Borel Complexity","49 pages; an error in Lemma 6.9 was corrected, affecting our bounds
  on the dimension of boundaries",,,,"math.MG math.CO","http://creativecommons.org/licenses/by/4.0/","  Tarski's Circle Squaring Problem from 1925 asks whether it is possible to
partition a disk in the plane into finitely many pieces and reassemble them via
isometries to yield a partition of a square of the same area. It was finally
resolved by Laczkovich in 1990 in the affirmative. Recently, several new proofs
have emerged which achieve circle squaring with better structured pieces:
namely, pieces which are Lebesgue measurable and have the property of Baire
(Grabowski-M\'ath\'e-Pikhurko) or even are Borel (Marks-Unger).
  In this paper, we show that circle squaring is possible with Borel pieces of
positive Lebesgue measure whose boundaries have upper Minkowski dimension less
than 2 (in particular, each piece is Jordan measurable). We also improve the
Borel complexity of the pieces: namely, we show that each piece can be taken to
be a Boolean combination of $F_\sigma$ sets. This is a consequence of our more
general result that applies to any two bounded subsets of $R^k$, $k\ge 1$, of
equal positive measure whose boundaries have upper Minkowski dimension smaller
than $k$.
","[{""version"":""v1"",""created"":""Thu, 3 Feb 2022 05:11:48 GMT""},{""version"":""v2"",""created"":""Sat, 16 Apr 2022 09:05:27 GMT""}]","2022-04-19"
