"2202.10832","Pietro Biondi","Giampaolo Bella, Pietro Biondi, Stefano Bognanni","Multi-service Threats: Attacking and Protecting Network Printers and
  VoIP Phones alike","arXiv admin note: text overlap with arXiv:2111.10645,
  arXiv:2111.15468",,"10.1016/j.iot.2022.100507",,"cs.CR","http://arxiv.org/licenses/nonexclusive-distrib/1.0/","  Printing over a network and calling over VoIP technology are routine at
present. This article investigates to what extent these services can be
attacked using freeware in the real world if they are not configured securely.
In finding out that attacks of high impact, termed the Printjack and Phonejack
families, could be mounted at least from insiders, the article also observes
that secure configurations do not appear to be widely adopted.
  Users with the necessary skills may put existing security measures in place
with printers, but would need novel measures, which the article prototypes,
with phones in order for a pair of peers to call each other securely and
without trusting anyone else, including sysadmins.
","[{""version"":""v1"",""created"":""Tue, 22 Feb 2022 11:45:54 GMT""},{""version"":""v2"",""created"":""Mon, 28 Feb 2022 16:15:18 GMT""},{""version"":""v3"",""created"":""Tue, 1 Mar 2022 09:50:03 GMT""}]","2022-03-02"
"2202.10833","Vittoria Bonanzinga","Vittoria Bonanzinga","Some applications of linear algebra and geometry in real life",,,,,"math.HO","http://creativecommons.org/licenses/by/4.0/","  In this paper, some real-world motivated examples are provided illustrating
the power of linear algebra tools as the product of matrices, determinants,
eigenvalues and eigenvectors. In this sense, some practical applications
related to computer graphics, geometry, areas, volumes are presented, along
with some problems connected to sports and investments.
","[{""version"":""v1"",""created"":""Tue, 22 Feb 2022 11:47:23 GMT""}]","2022-02-23"
"2202.10834","Olli Palm\'en","Olli Palm\'en","Macroeconomic Effect of Uncertainty and Financial Shocks: a non-Gaussian
  VAR approach",,,,,"econ.GN q-fin.EC","http://creativecommons.org/licenses/by-nc-nd/4.0/","  The Great Recession highlighted the role of financial and uncertainty shocks
as drivers of business cycle fluctuations. However, the fact that uncertainty
shocks may affect economic activity by tightening financial conditions makes
empirically distinguishing these shocks difficult. This paper examines the
macroeconomic effects of the financial and uncertainty shocks in the United
States in an SVAR model that exploits the non-normalities of the time series to
identify the uncertainty and the financial shock. The results show that
macroeconomic uncertainty and financial shocks seem to affect business cycles
independently as well as through dynamic interaction. Uncertainty shocks appear
to tighten financial conditions, whereas there appears to be no causal
relationship between financial conditions and uncertainty. Moreover, the
results suggest that uncertainty shocks may have persistent effects on output
and investment that last beyond the business cycle.
","[{""version"":""v1"",""created"":""Tue, 22 Feb 2022 11:48:28 GMT""}]","2022-02-23"
"2202.10835","Yash Palan","Yash Palan and Sebastian W\""uster","Density correlations from analogue Hawking radiation in the presence of
  atom losses","9 pages, 5 figures",,"10.1103/PhysRevA.106.053317",,"cond-mat.quant-gas gr-qc","http://creativecommons.org/licenses/by/4.0/","  The sonic analogue of Hawking radiation can now be experimentally recreated
in Bose-Einstein Condensates that contain an acoustic black hole. In these
experiments the signal strength and analogue Hawking temperature increase for
denser condensates, which however also suffer increased atom losses from
inelastic collisions. To determine how these affect analogue Hawking radiation,
we numerically simulate creation of the latter in a Bose-Einstein Condensate in
the presence of atomic losses. In particular we explore modifications of
density-density correlations through which the radiation has been analyzed so
far. We find that losses increase the contrast of the correlation signal, which
we attribute to heating that in turn leads to a component of stimulated
radiation in addition to the spontaneous one. Another indirect consequence is
the modification of the white hole instability pattern.
","[{""version"":""v1"",""created"":""Tue, 22 Feb 2022 11:49:33 GMT""}]","2022-11-30"
"2202.10836","Marcel Risch","Javier Villalobos, Dulce M. Morales, Denis Antipin, G\""otz Schuck,
  Ronny Golnak, Jie Xiao, Marcel Risch","Stabilization of Co oxide during oxygen evolution in alkaline media by
  the introduction of Mn oxide","arXiv admin note: text overlap with arXiv:2010.06957",,,,"cond-mat.mtrl-sci physics.chem-ph","http://creativecommons.org/licenses/by-nc-nd/4.0/","  Improving the stability of electrocatalysts for the oxygen evolution reaction
(OER) through materials design has received less attention than improving their
catalytic activity. We explored the effect of Mn addition to a cobalt oxide for
stabilizing the catalyst by comparing Na-containing CoOx and (Co0.7Mn0.3)Ox
films electrodeposited in alkaline solution. The obtained disordered films were
classified as layered oxides using X-ray absorption spectroscopy (XAS). The
CoOx films showed a constant decrease in the catalytic activity during cycling,
confirmed by oxygen detection, while that of (Co0.7Mn0.3)Ox slightly increased
as measured by electrochemical metrics. These trends were rationalized based on
XAS analysis of the metal oxidation states, which were Co2.8+ and Mn3.7+ near
the surface after cycling. Thus, adding Mn to CoOx successfully stabilized the
catalyst material and its activity during OER cycling. The development of
stabilization approaches is essential to extend the durability of OER
catalysts.
","[{""version"":""v1"",""created"":""Tue, 22 Feb 2022 11:52:02 GMT""}]","2022-02-23"
"2202.10837","Tong Kedeng","Kedeng Tong, Xin Jin, Chen Wang, Fan Jiang","SADN: Learned Light Field Image Compression with Spatial-Angular
  Decorrelation",,,,,"eess.IV cs.CV","http://arxiv.org/licenses/nonexclusive-distrib/1.0/","  Light field image becomes one of the most promising media types for immersive
video applications. In this paper, we propose a novel end-to-end
spatial-angular-decorrelated network (SADN) for high-efficiency light field
image compression. Different from the existing methods that exploit either
spatial or angular consistency in the light field image, SADN decouples the
angular and spatial information by dilation convolution and stride convolution
in spatial-angular interaction, and performs feature fusion to compress spatial
and angular information jointly. To train a stable and robust algorithm, a
large-scale dataset consisting of 7549 light field images is proposed and
built. The proposed method provides 2.137 times and 2.849 times higher
compression efficiency relative to H.266/VVC and H.265/HEVC inter coding,
respectively. It also outperforms the end-to-end image compression networks by
an average of 79.6% bitrate saving with much higher subjective quality and
light field consistency.
","[{""version"":""v1"",""created"":""Tue, 22 Feb 2022 11:53:52 GMT""}]","2022-02-23"
"2202.10838","Marco Spanghero","M. Spanghero, K. Zhang, P. Papadimitratos","Authenticated time for detecting GNSS attacks",,,"10.33012/2020.17719",,"cs.CR","http://creativecommons.org/licenses/by/4.0/","  Information cross-validation can be a powerful tool to detect manipulated,
dubious GNSS data. A promising approach is to leverage time obtained over
networks a mobile device can connect to, and detect discrepancies between the
GNSS-provided time and the network time. The challenge lies in having reliably
both accurate and trustworthy network time as the basis for the GNSS attack
detection. Here, we provide a concrete proposal that leverages, together with
the network time servers, the nearly ubiquitous IEEE 802.11 (Wi-Fi)
infrastructure. Our framework supports application-layer, secure and robust
real time broadcasting by Wi-Fi Access Points (APs), based on hash chains and
infrequent digital signatures verification to minimize computational and
communication overhead, allowing mobile nodes to efficiently obtain
authenticated and rich time information as they roam. We pair this method with
Network Time Security (NTS), for enhanced resilience through multiple sources,
available, ideally, simultaneously. We analyze the performance of our scheme in
a dedicated setup, gauging the overhead for authenticated time data (Wi-Fi
timestamped beacons and NTS). The results show that it is possible to provide
security for the external to GNSS time sources, with minimal overhead for
authentication and integrity, even when the GNSS-equipped nodes are mobile, and
thus have short interactions with the Wi-Fi infrastructure and possibly
intermittent Internet connectivity, as well as limited resources.
","[{""version"":""v1"",""created"":""Tue, 22 Feb 2022 11:54:54 GMT""}]","2022-02-23"
"2202.10839","Xianru Chen","Xianru Chen","Stable approximation of functions from equispaced samples via Jacobi
  frames",,,,,"math.NA cs.NA","http://arxiv.org/licenses/nonexclusive-distrib/1.0/","  In this paper, we study the Jacobi frame approximation with equispaced
samples and derive an error estimation. We observe numerically that the
approximation accuracy gradually decreases as the extended domain parameter
$\gamma$ increases in the uniform norm, especially for differentiable
functions. In addition, we show that when the indexes of Jacobi polynomials
$\alpha$ and $\beta$ are larger (for example $\max\{\alpha,\beta\} > 10$), it
leads to a divergence behavior on the frame approximation error decay.
","[{""version"":""v1"",""created"":""Tue, 22 Feb 2022 11:55:56 GMT""}]","2022-02-23"
"2202.10840","Agostino Stilli","Vanni Consumi, Lukas Lindenroth, Jeref Merlin, Danail Stoyanov,
  Agostino Stilli","Design and Evaluation of the SoftSCREEN Capsule for Colonoscopy","9 pages, 8 figures",,,,"cs.RO","http://arxiv.org/licenses/nonexclusive-distrib/1.0/","  Colonoscopy is considered the golden standard for cancer screening of the
lower gastrointestinal (GI) tract, with screening programs all over the world
considering lowering the recommended screening age. Nonetheless, conventional
colonoscopy can cause discomfort to patients due to the forces occurring
between colonoscopes and the walls of the colon. Robotic solutions have been
proposed to reduce discomfort, and improve accessibility and image quality.
Aiming at addressing the limitations of traditional and robotic colonoscopy, in
this paper, we present the SoftSCREEN System, a novel Soft Shapeshifting
Capsule Robot for Endoscopy based on Eversion Navigation. A plurality of tracks
surrounds the body of the system. These tracks are driven by a single motor
paired with a worm gear and evert from the internal rigid chassis, enabling
fullbody track-based navigation. Two inflatable toroidal chambers enclosing
this rigid chassis and passing through the tracks, cause them to displace when
inflated. This displacement can be used to regulate the contact with the
surrounding wall, thus enabling traction control and adjustment of the overall
system diameter to match the local lumen size. The design of the first tethered
prototype at 2:1 scale of the SoftSCREEN system is presented in this work. The
experimental results show efficient navigation capabilities for different lumen
diameters and curvatures, paving the way for a novel robot capable of robust
navigation and reliable control of the imaging, with potential for applications
beyond colonoscopy, including gastroscopy and capsule endoscopy.
","[{""version"":""v1"",""created"":""Tue, 22 Feb 2022 11:56:20 GMT""},{""version"":""v2"",""created"":""Mon, 19 Sep 2022 14:10:04 GMT""}]","2022-09-20"
"2202.10841","Martin Higgins Dr","Martin Higgins, Wangkun Xu, Fei Teng, Thomas Parisini","Cyber-Physical Risk Assessment for False Data Injection Attacks
  Considering Moving Target Defences",,,,,"eess.SY cs.SY","http://creativecommons.org/licenses/by/4.0/","  In this paper, we examine the factors that influence the success of false
data injection (FDI) attacks in the context of both cyber and physical styles
of reinforcement. Many works consider the FDI attack in the context of the
ability to change a measurement in a static system only. However, successful
attacks will require first intrusion into a system followed by construction of
an attack vector that can bypass bad data detection (BDD). In this way, we
develop a full service framework for FDI risk assessment. The framework
considers both the costs of system intrusion via a weighted graph assessment in
combination with a physical, line overload-based vulnerability assessment. We
present our simulations on a IEEE 14-bus system with an overlain RTU network to
model the true risk of intrusion. The cyber model considers multiple methods of
entry for the FDI attack including meter intrusion, RTU intrusion and combined
style attacks. Post-intrusion our physical reinforcement model analyses the
required level of topology divergence to protect against a branch overload from
an optimised attack vector.
","[{""version"":""v1"",""created"":""Tue, 22 Feb 2022 12:03:51 GMT""},{""version"":""v2"",""created"":""Tue, 20 Sep 2022 11:20:08 GMT""}]","2022-09-21"
"2202.10842","Chongming Gao","Chongming Gao, Shijun Li, Wenqiang Lei, Jiawei Chen, Biao Li, Peng
  Jiang, Xiangnan He, Jiaxin Mao, Tat-Seng Chua","KuaiRec: A Fully-observed Dataset and Insights for Evaluating
  Recommender Systems","CIKM '22 Full Paper",,"10.1145/3511808.3557220",,"cs.IR cs.HC","http://arxiv.org/licenses/nonexclusive-distrib/1.0/","  The progress of recommender systems is hampered mainly by evaluation as it
requires real-time interactions between humans and systems, which is too
laborious and expensive. This issue is usually approached by utilizing the
interaction history to conduct offline evaluation. However, existing datasets
of user-item interactions are partially observed, leaving it unclear how and to
what extent the missing interactions will influence the evaluation. To answer
this question, we collect a fully-observed dataset from Kuaishou's online
environment, where almost all 1,411 users have been exposed to all 3,327 items.
To the best of our knowledge, this is the first real-world fully-observed data
with millions of user-item interactions.
  With this unique dataset, we conduct a preliminary analysis of how the two
factors - data density and exposure bias - affect the evaluation results of
multi-round conversational recommendation. Our main discoveries are that the
performance ranking of different methods varies with the two factors, and this
effect can only be alleviated in certain cases by estimating missing
interactions for user simulation. This demonstrates the necessity of the
fully-observed dataset. We release the dataset and the pipeline implementation
for evaluation at https://kuairec.com
","[{""version"":""v1"",""created"":""Tue, 22 Feb 2022 12:08:14 GMT""},{""version"":""v2"",""created"":""Thu, 19 May 2022 06:14:33 GMT""},{""version"":""v3"",""created"":""Thu, 18 Aug 2022 08:53:37 GMT""}]","2022-08-19"
"2202.10843","Jingqi Liang","Jingqi Liang, Lihe Wang, Chunqin Zhou","Boundary Lipschitz regularity of solutions for general semilinear
  elliptic equations in divergence form","arXiv admin note: text overlap with arXiv:2105.06271",,,,"math.AP","http://arxiv.org/licenses/nonexclusive-distrib/1.0/","  In this paper, we study the nonhomogeneous Dirichlet problem concerning
general semilinear elliptic equations in divergence form. We establish that the
boundary Lipschitz regularity of solutions under some more weaker conditions on
the coefficients, the boundary, the boundary function and the nonhomogeneous
term. In particular, we assume that the nonhomogeneous term satisfies Dini
continuity condition and Lipschitz Newtonian potential condition, which will be
the optimal conditions to obtain the boundary Lipschitz regularity of
solutions.
","[{""version"":""v1"",""created"":""Tue, 22 Feb 2022 12:11:16 GMT""}]","2022-02-23"
"2202.10844","Ansgar Denner","Ansgar Denner, Robert Franken, Timo Schmidt, Christopher Schwan","NLO QCD and EW corrections to vector-boson scattering into $\rm W^+W^-$
  at the LHC","34 pages, 29 pdf figure files, some extra comments added, version
  that appeared in JHEP","JHEP 06 (2022) 098","10.1007/JHEP06(2022)098",,"hep-ph","http://arxiv.org/licenses/nonexclusive-distrib/1.0/","  We present the full next-to-leading-order electroweak and QCD corrections to
vector-boson scattering into a pair of off-shell opposite-sign W bosons
decaying into leptons of different flavour at the LHC. We include full
leading-order predictions for the irreducible background. Explicitly, we
investigate the process ${\rm pp \to e^+ \nu_e\mu^-\bar\nu_\mu jj} + X$ at
leading orders $O(\alpha^6)$, $O(\rm\alpha_s\alpha^5)$,
$O(\rm\alpha_s^2\alpha^4)$, supplemented by the loop-induced
$O(\rm\alpha_s^4\alpha^4)$ contribution, and at next-to-leading orders
$O(\alpha^7)$ and $O(\rm\alpha_s\alpha^6)$ in two setups providing fiducial
cross sections as well as differential distributions. We take full account of
photon-induced next-to-leading-order contributions, which prove to be non
negligible. With $-11.4\%$ and $-6.7\%$ in the two setups, the electroweak
corrections are smaller than for other vector-boson-scattering processes. This
can be traced back to the presence of the Higgs-boson resonance in the fiducial
phase space, whose effects we analyse within an additional unphysical, but
manifestly gauge-invariant setup. The QCD corrections amount to $-5.1\%$ and
$-21.6\%$ in the two setups. The large size of the latter correction, compared
to other vector-boson scattering processes, is explained by a very restrictive
definition of its fiducial phase space.
","[{""version"":""v1"",""created"":""Tue, 22 Feb 2022 12:11:57 GMT""},{""version"":""v2"",""created"":""Mon, 10 Oct 2022 12:26:37 GMT""}]","2022-10-11"
"2202.10845","Kun-Ting Chen","Kun-Ting Chen, Tim Dwyer, Yalong Yang, Benjamin Bach, Kim Marriott","GAN'SDA Wrap: Geographic And Network Structured Data on surfaces that
  Wrap around",,,"10.1145/3491102.3501928",,"cs.HC","http://arxiv.org/licenses/nonexclusive-distrib/1.0/","  There are many methods for projecting spherical maps onto the plane.
Interactive versions of these projections allow the user to centre the region
of interest. However, the effects of such interaction have not previously been
evaluated. In a study with 120 participants we find interaction provides
significantly more accurate area, direction and distance estimation in such
projections. The surface of 3D sphere and torus topologies provides a
continuous surface for uninterrupted network layout. But how best to project
spherical network layouts to 2D screens has not been studied, nor have such
spherical network projections been compared to torus projections. Using the
most successful interactive sphere projections from our first study, we compare
spherical, standard and toroidal layouts of networks for cluster and path
following tasks with 96 participants, finding benefits for both spherical and
toroidal layouts over standard network layouts in terms of accuracy for cluster
understanding tasks.
","[{""version"":""v1"",""created"":""Tue, 22 Feb 2022 12:15:41 GMT""}]","2022-02-23"
"2202.10846","YangGon Kim","JongJin Kim, GwangJin Kim, JongPyo Lee, ShuanHong Wang, Ki-Bong Nam,
  GyungSig Seo, InSu Kim, YangGon Kim","P-class is a proper subclass of NP-class; and more","arXiv admin note: substantial text overlap with arXiv:2003.05321,
  arXiv:1912.10849","Journal of Applied Algebra and Discrete
  Structures,Vol.2(2004),No.1,pp.1-26,SAS international
  publications,URL:www.sasip.net",,,"cs.CC math.AC math.AG math.RA math.RT","http://creativecommons.org/licenses/by/4.0/","  We may give rise to some questions related to the mathematical structures of
$P$-class and $NP$-class. We have seen that one is a proper subclass of the
other. Here we disclose more that $P$- class turns out to be the proper
distributive sublattice of the $NP$- class.
","[{""version"":""v1"",""created"":""Tue, 22 Feb 2022 12:17:58 GMT""},{""version"":""v2"",""created"":""Wed, 23 Feb 2022 07:22:55 GMT""},{""version"":""v3"",""created"":""Fri, 8 Apr 2022 15:22:44 GMT""},{""version"":""v4"",""created"":""Tue, 12 Apr 2022 18:42:29 GMT""},{""version"":""v5"",""created"":""Wed, 20 Apr 2022 19:52:17 GMT""},{""version"":""v6"",""created"":""Sun, 10 Jul 2022 03:11:36 GMT""}]","2022-07-12"
"2202.10847","Francisca Vasconcelos","Francisca Vasconcelos, Bobby He, Nalini Singh, Yee Whye Teh","UncertaINR: Uncertainty Quantification of End-to-End Implicit Neural
  Representations for Computed Tomography","Published in the Transactions on Machine Learning Research (TMLR)
  April 2023 [https://openreview.net/forum?id=jdGMBgYvfX]",,,,"eess.IV cs.CV cs.LG","http://arxiv.org/licenses/nonexclusive-distrib/1.0/","  Implicit neural representations (INRs) have achieved impressive results for
scene reconstruction and computer graphics, where their performance has
primarily been assessed on reconstruction accuracy. As INRs make their way into
other domains, where model predictions inform high-stakes decision-making,
uncertainty quantification of INR inference is becoming critical. To that end,
we study a Bayesian reformulation of INRs, UncertaINR, in the context of
computed tomography, and evaluate several Bayesian deep learning
implementations in terms of accuracy and calibration. We find that they achieve
well-calibrated uncertainty, while retaining accuracy competitive with other
classical, INR-based, and CNN-based reconstruction techniques. Contrary to
common intuition in the Bayesian deep learning literature, we find that INRs
obtain the best calibration with computationally efficient Monte Carlo dropout,
outperforming Hamiltonian Monte Carlo and deep ensembles. Moreover, in contrast
to the best-performing prior approaches, UncertaINR does not require a large
training dataset, but only a handful of validation images.
","[{""version"":""v1"",""created"":""Tue, 22 Feb 2022 12:19:03 GMT""},{""version"":""v2"",""created"":""Fri, 3 Jun 2022 11:25:29 GMT""},{""version"":""v3"",""created"":""Tue, 2 May 2023 20:59:18 GMT""}]","2023-05-04"
"2202.10848","Thilo Hagendorff","Thilo Hagendorff, Leonie Bossert, Tse Yip Fai, Peter Singer","Speciesist bias in AI -- How AI applications perpetuate discrimination
  and unfair outcomes against animals",,,"10.1007/s43681-022-00199-9",,"cs.LG cs.AI cs.CY","http://arxiv.org/licenses/nonexclusive-distrib/1.0/","  Massive efforts are made to reduce biases in both data and algorithms in
order to render AI applications fair. These efforts are propelled by various
high-profile cases where biased algorithmic decision-making caused harm to
women, people of color, minorities, etc. However, the AI fairness field still
succumbs to a blind spot, namely its insensitivity to discrimination against
animals. This paper is the first to describe the 'speciesist bias' and
investigate it in several different AI systems. Speciesist biases are learned
and solidified by AI applications when they are trained on datasets in which
speciesist patterns prevail. These patterns can be found in image recognition
systems, large language models, and recommender systems. Therefore, AI
technologies currently play a significant role in perpetuating and normalizing
violence against animals. This can only be changed when AI fairness frameworks
widen their scope and include mitigation measures for speciesist biases. This
paper addresses the AI community in this regard and stresses the influence AI
systems can have on either increasing or reducing the violence that is
inflicted on animals, and especially on farmed animals.
","[{""version"":""v1"",""created"":""Tue, 22 Feb 2022 12:23:21 GMT""}]","2022-09-01"
"2202.10849","Birgitta Dresp-Langley","Birgitta Dresp-Langley","Brain representation of perceptual stimuli at different levels of
  awareness","arXiv admin note: text overlap with arXiv:1805.09176",,,,"q-bio.NC","http://arxiv.org/licenses/nonexclusive-distrib/1.0/","  This article questions the widespread assumption that there are brain
representations that will always remain unconscious in the sense of being
inaccessible to individual awareness under any circumstances. This implies that
some part of the knowledge generated by the brain is once and for always
excluded from consciousness and, therefore, from being communicated to the
outside world. This standpoint neglects the possibility that the human brain
might have a capacity for generating metarepresentations of nonconscious
knowledge contents at a given moment in time through context sensitive adaptive
learning, and is somewhat difficult to reconcile with experimental findings
showing that initially subliminal targets can be made available to awareness,
or break through to supraliminal levels of processing, when they are embedded
in an appropriate perceptual object context (relevance condition). Specific
properties of neural network architectures, inspired by the functional
organization of the primate cortex, are able to explain how a human brain could
generate this kind of perceptual learning. Signals or knowledge processed
outside awareness could be made available to awareness through adaptive
resonance of bottom-up and top-down signal exchanges in massively parallel
neural network architectures; in other words, on the basis of statistically
significant signal matches in the domain of time and in the domain of memory
content.
","[{""version"":""v1"",""created"":""Tue, 22 Feb 2022 12:23:28 GMT""}]","2022-02-23"
