"2202.10677","Jaemin Yoo","Jaemin Yoo and Lee Sael","Transition Matrix Representation of Trees with Transposed Convolutions","Accepted to SDM 2022",,,,"cs.LG","http://creativecommons.org/licenses/by-nc-sa/4.0/","  How can we effectively find the best structures in tree models? Tree models
have been favored over complex black box models in domains where
interpretability is crucial for making irreversible decisions. However,
searching for a tree structure that gives the best balance between the
performance and the interpretability remains a challenging task. In this paper,
we propose TART (Transition Matrix Representation with Transposed
Convolutions), our novel generalized tree representation for optimal structural
search. TART represents a tree model with a series of transposed convolutions
that boost the speed of inference by avoiding the creation of transition
matrices. As a result, TART allows one to search for the best tree structure
with a few design parameters, achieving higher classification accuracy than
those of baseline models in feature-based datasets.
","[{""version"":""v1"",""created"":""Tue, 22 Feb 2022 05:40:31 GMT""}]","2022-02-23"
"2202.10678","Jibang Wu","Jibang Wu, Zixuan Zhang, Zhe Feng, Zhaoran Wang, Zhuoran Yang, Michael
  I. Jordan, Haifeng Xu","Sequential Information Design: Markov Persuasion Process and Its
  Efficient Reinforcement Learning",,,,,"cs.AI cs.GT cs.LG econ.TH","http://arxiv.org/licenses/nonexclusive-distrib/1.0/","  In today's economy, it becomes important for Internet platforms to consider
the sequential information design problem to align its long term interest with
incentives of the gig service providers. This paper proposes a novel model of
sequential information design, namely the Markov persuasion processes (MPPs),
where a sender, with informational advantage, seeks to persuade a stream of
myopic receivers to take actions that maximizes the sender's cumulative
utilities in a finite horizon Markovian environment with varying prior and
utility functions. Planning in MPPs thus faces the unique challenge in finding
a signaling policy that is simultaneously persuasive to the myopic receivers
and inducing the optimal long-term cumulative utilities of the sender.
Nevertheless, in the population level where the model is known, it turns out
that we can efficiently determine the optimal (resp. $\epsilon$-optimal) policy
with finite (resp. infinite) states and outcomes, through a modified
formulation of the Bellman equation.
  Our main technical contribution is to study the MPP under the online
reinforcement learning (RL) setting, where the goal is to learn the optimal
signaling policy by interacting with with the underlying MPP, without the
knowledge of the sender's utility functions, prior distributions, and the
Markov transition kernels. We design a provably efficient no-regret learning
algorithm, the Optimism-Pessimism Principle for Persuasion Process (OP4), which
features a novel combination of both optimism and pessimism principles. Our
algorithm enjoys sample efficiency by achieving a sublinear $\sqrt{T}$-regret
upper bound. Furthermore, both our algorithm and theory can be applied to MPPs
with large space of outcomes and states via function approximation, and we
showcase such a success under the linear setting.
","[{""version"":""v1"",""created"":""Tue, 22 Feb 2022 05:41:43 GMT""}]","2022-02-23"
"2202.10679","Feng Xia","Ciyuan Peng, Feng Xia, Vidya Saikrishna, Huan Liu","Physics-Informed Graph Learning","8 pages, 3 figures","2022 IEEE International Conference on Data Mining Workshops
  (ICDMW)",,,"cs.LG cs.AI","http://creativecommons.org/licenses/by/4.0/","  An expeditious development of graph learning in recent years has found
innumerable applications in several diversified fields. Of the main associated
challenges are the volume and complexity of graph data. The graph learning
models suffer from the inability to efficiently learn graph information. In
order to indemnify this inefficacy, physics-informed graph learning (PIGL) is
emerging. PIGL incorporates physics rules while performing graph learning,
which has enormous benefits. This paper presents a systematic review of PIGL
methods. We begin with introducing a unified framework of graph learning models
followed by examining existing PIGL methods in relation to the unified
framework. We also discuss several future challenges for PIGL. This survey
paper is expected to stimulate innovative research and development activities
pertaining to PIGL.
","[{""version"":""v1"",""created"":""Tue, 22 Feb 2022 05:46:24 GMT""},{""version"":""v2"",""created"":""Thu, 20 Oct 2022 10:49:45 GMT""}]","2022-10-21"
"2202.10680","Vishal Kaushal","Vishal Kaushal, Ganesh Ramakrishnan, Rishabh Iyer","Submodlib: A Submodular Optimization Library","23 pages with references, 10 figures, 5 tables",,,,"cs.LG cs.IR","http://arxiv.org/licenses/nonexclusive-distrib/1.0/","  Submodular functions are a special class of set functions which naturally
model the notion of representativeness, diversity, coverage etc. and have been
shown to be computationally very efficient. A lot of past work has applied
submodular optimization to find optimal subsets in various contexts. Some
examples include data summarization for efficient human consumption, finding
effective smaller subsets of training data to reduce the model development time
(training, hyper parameter tuning), finding effective subsets of unlabeled data
to reduce the labeling costs, etc. A recent work has also leveraged submodular
functions to propose submodular information measures which have been found to
be very useful in solving the problems of guided subset selection and guided
summarization. In this work, we present Submodlib which is an open-source,
easy-to-use, efficient and scalable Python library for submodular optimization
with a C++ optimization engine. Submodlib finds its application in
summarization, data subset selection, hyper parameter tuning, efficient
training and more. Through a rich API, it offers a great deal of flexibility in
the way it can be used. Source of Submodlib is available at
https://github.com/decile-team/submodlib.
","[{""version"":""v1"",""created"":""Tue, 22 Feb 2022 05:48:12 GMT""},{""version"":""v2"",""created"":""Wed, 23 Feb 2022 06:30:37 GMT""}]","2022-02-24"
"2202.10681","Xiaoshuang Chen","Xiaoshuang Chen, Hongtao Lu","Reinforcing Local Feature Representation for Weakly-Supervised Dense
  Crowd Counting",,,,,"cs.CV","http://arxiv.org/licenses/nonexclusive-distrib/1.0/","  Fully-supervised crowd counting is a laborious task due to the large amounts
of annotations. Few works focus on weekly-supervised crowd counting, where only
the global crowd numbers are available for training. The main challenge of
weekly-supervised crowd counting is the lack of local supervision information.
To address this problem, we propose a self-adaptive feature similarity learning
(SFSL) network and a global-local consistency (GLC) loss to reinforce local
feature representation. We introduce a feature vector which represents the
unbiased feature estimation of persons. The network updates the feature vector
self-adaptively and utilizes the feature similarity for the regression of crowd
numbers. Besides, the proposed GLC loss leverages the consistency between the
network estimations from global and local areas. The experimental results
demonstrate that our proposed method based on different backbones narrows the
gap between weakly-supervised and fully-supervised dense crowd counting.
","[{""version"":""v1"",""created"":""Tue, 22 Feb 2022 05:53:51 GMT""}]","2022-02-23"
"2202.10682","Mudi Wang","Mudi Wang, Qiyun Ma, Shan Liu, Ruo-Yang Zhang, Lei Zhang, Manzhu Ke,
  Zhengyou Liu, and C. T. Chan","Observation of boundary induced chiral anomaly bulk states and their
  transport properties","17 pages, 5 figures",,"10.1038/s41467-022-33447-x",,"cond-mat.mes-hall cond-mat.mtrl-sci physics.app-ph","http://arxiv.org/licenses/nonexclusive-distrib/1.0/","  The robust transport of edge modes is perhaps the most useful property of
topological materials. The existence of edge modes is guaranteed by the
bulk-edge correspondence, which states that the number of topological edge
modes is determined by the bulk topological invariants. To obtain robust
transport on the edge, we need to make volumetric changes to many bulk atoms to
control the properties of a few edge atoms in a lower dimension. We suggest
here that we can do the reverse in some cases: the properties of the edge can
guarantee chiral transport phenomena in some bulk modes, achieving phenomena
that are essentially the same as those observed in topological valley-Hall
systems. Specifically, we show that a topologically trivial 2D hexagonal
phononic crystal slab (waveguide) bounded by hardwall boundaries guarantees the
existence of bulk modes with chiral anomaly inside a pseudogap. We
experimentally observed robust valley-selected transport, complete valley state
conversion, and valley focusing of the chiral anomaly bulk states (CABSs) in
such phononic crystal waveguides.
","[{""version"":""v1"",""created"":""Tue, 22 Feb 2022 05:57:25 GMT""}]","2022-10-26"
"2202.10683","Majd Kosta","Majd Kosta, Alan Muhafra, Ren\'e Pernas Salom\'on, Gal Shmuel, Oded
  Amir","Maximizing the electromomentum coupling in piezoelectric laminates",,,,,"cond-mat.mtrl-sci","http://arxiv.org/licenses/nonexclusive-distrib/1.0/","  Asymmetric piezoelectric composites exhibit coupling between their
macroscopic linear momentum and electric field, a coupling that does not appear
at the microscopic scale. This electromomentum coupling constitutes an
additional knob to tailor the dynamic response of the medium, analogously to
the Willis coupling in elastic composites. Here, we employ topology- and free
material optimization approaches to maximize the electromomentum coupling of
periodic piezoelectric laminates in the low frequency, long-wavelength limit.
We find that the coupling can be enhanced by orders of magnitude, depending on
the degrees of freedom in the optimization process. The optimal compositions
that we find provide guidelines for the design of metamaterials with maximum
electromomentum coupling, paving the way for their integration in wave control
applications.
","[{""version"":""v1"",""created"":""Tue, 22 Feb 2022 06:01:13 GMT""}]","2022-02-23"
"2202.10684","Shan-Ming Ruan","Eivind J{\o}rstad, Robert C. Myers, Shan-Ming Ruan","Holographic Complexity in dS$_{d+1}$","42+11 pages, 2 appendices, N figures",,"10.1007/JHEP05(2022)119","YITP-22-15","hep-th gr-qc","http://creativecommons.org/licenses/by/4.0/","  We study the CV, CA, and CV2.0 approaches to holographic complexity in
$(d+1)$-dimensional de Sitter spacetime. We find that holographic complexity
and corresponding growth rate presents universal behaviour for all three
approaches. In particular, the holographic complexity exhibits `hyperfast'
growth [arXiv:2109.14104] and appears to diverge with a universal power law at
a (finite) critical time. We introduce a cutoff surface to regulate this
divergence, and the subsequent growth of the holographic complexity is linear
in time.
","[{""version"":""v1"",""created"":""Tue, 22 Feb 2022 06:02:31 GMT""}]","2022-06-08"
"2202.10685","Damian Vergara","Patricio Dom\'inguez, Nicol\'as Grau, Dami\'an Vergara","Discrimination Against Immigrants in the Criminal Justice System:
  Evidence from Pretrial Detentions",,,,,"econ.GN q-fin.EC","http://arxiv.org/licenses/nonexclusive-distrib/1.0/","  This paper tests for discrimination against immigrant defendants in the
criminal justice system in Chile using a decade of nationwide administrative
records on pretrial detentions. Observational benchmark regressions show that
immigrant defendants are 8.6 percentage points less likely to be released
pretrial relative to Chilean defendants with similar proxies for pretrial
misconduct potential. Diagnostics for omitted variable bias -- including a
novel test to assess the quality of the proxy vector based on comparisons of
pretrial misconduct rates among released defendants -- suggest that the
discrimination estimates are not driven by omitted variable bias and that, if
anything, failing to fully account for differences in misconduct potential
leads to an underestimation of discrimination. Our estimates suggest that
discrimination stems from an informational problem because judges do not
observe criminal records in origin countries, with stereotypes and taste-based
discrimination playing a role in the problem's resolution. We find that
discrimination is especially large for drug offenses and that discrimination
increased after a recent immigration wave.
","[{""version"":""v1"",""created"":""Tue, 22 Feb 2022 06:03:39 GMT""}]","2022-02-23"
"2202.10686","Koji Matsushita","Koji Matsushita","Torsionfreeness for divisor class groups of toric rings of integral
  polytopes","8 pages, 3 figures",,,,"math.AC math.CO","http://arxiv.org/licenses/nonexclusive-distrib/1.0/","  In the present paper, we give some sufficient conditions for
$\operatorname{Cl}(\Bbbk[P])$ to be torsionfree, where
$\operatorname{Cl}(\Bbbk[P])$ denote the divisor class group of the toric ring
$\Bbbk[P]$ of an integral polytope $P$. We prove that
$\operatorname{Cl}(\Bbbk[P])$ is torsionfree if $P$ is compressed, and
$\operatorname{Cl}(\Bbbk[P])$ is torsionfree if $P$ is a $(0,1)$-polytope which
has at most $\dim P+2$ facets. Moreover, we characterize the toric rings of
$(0,1)$-polytopes in the case $\operatorname{Cl}(\Bbbk[P])\cong \mathbb{Z}$.
","[{""version"":""v1"",""created"":""Tue, 22 Feb 2022 06:06:21 GMT""}]","2022-02-23"
"2202.10687","Sunhee Hwang","Sunhee Hwang, Minsong Ki, Seung-Hyun Lee, Sanghoon Park, Byoung-Ki
  Jeon","Cut and Continuous Paste towards Real-time Deep Fall Detection","Accepted to ICASSP 2022",,,,"cs.CV","http://arxiv.org/licenses/nonexclusive-distrib/1.0/","  Deep learning based fall detection is one of the crucial tasks for
intelligent video surveillance systems, which aims to detect unintentional
falls of humans and alarm dangerous situations. In this work, we propose a
simple and efficient framework to detect falls through a single and small-sized
convolutional neural network. To this end, we first introduce a new image
synthesis method that represents human motion in a single frame. This
simplifies the fall detection task as an image classification task. Besides,
the proposed synthetic data generation method enables to generate a sufficient
amount of training dataset, resulting in satisfactory performance even with the
small model. At the inference step, we also represent real human motion in a
single image by estimating mean of input frames. In the experiment, we conduct
both qualitative and quantitative evaluations on URFD and AIHub airport
datasets to show the effectiveness of our method.
","[{""version"":""v1"",""created"":""Tue, 22 Feb 2022 06:07:16 GMT""}]","2022-02-23"
"2202.10688","Feng Xia","Falih Gozi Febrinanto, Feng Xia, Kristen Moore, Chandra Thapa, Charu
  Aggarwal","Graph Lifelong Learning: A Survey","19 pages, 4 figures","IEEE Computational Intelligence Magazine 2022",,,"cs.LG cs.AI","http://creativecommons.org/licenses/by/4.0/","  Graph learning is a popular approach for performing machine learning on
graph-structured data. It has revolutionized the machine learning ability to
model graph data to address downstream tasks. Its application is wide due to
the availability of graph data ranging from all types of networks to
information systems. Most graph learning methods assume that the graph is
static and its complete structure is known during training. This limits their
applicability since they cannot be applied to problems where the underlying
graph grows over time and/or new tasks emerge incrementally. Such applications
require a lifelong learning approach that can learn the graph continuously and
accommodate new information whilst retaining previously learned knowledge.
Lifelong learning methods that enable continuous learning in regular domains
like images and text cannot be directly applied to continuously evolving graph
data, due to its irregular structure. As a result, graph lifelong learning is
gaining attention from the research community. This survey paper provides a
comprehensive overview of recent advancements in graph lifelong learning,
including the categorization of existing methods, and the discussions of
potential applications and open research problems.
","[{""version"":""v1"",""created"":""Tue, 22 Feb 2022 06:14:07 GMT""},{""version"":""v2"",""created"":""Fri, 4 Nov 2022 00:42:50 GMT""}]","2022-11-07"
"2202.10689","Toshihito Osada","Toshihito Osada, Tomotaka Ochi, and Toshihiro Taen","Thermoelectric Hall Effect at High-Magnetic-Field Quantum Limit in
  Graphite as a Nodal-Line Semimetal","14 pages, 3 figures","J. Phys. Soc. Jpn. 91, No.6, 063701/1-4 (2022)","10.7566/JPSJ.91.063701",,"cond-mat.mes-hall cond-mat.str-el","http://creativecommons.org/licenses/by/4.0/","  The high-magnetic-field thermoelectric effect in nodal-line semimetals with
straight nodal lines was investigated. Three-dimensional (3D) Dirac/Weyl
semimetals exhibit constant thermoelectric Hall conductivity at the
high-magnetic-field quantum limit, resulting in a boundless linear increase of
Seebeck coefficient. This is known as the quantized thermoelectric Hall effect
(QTHE), and is expected to lead to high-performance thermoelectricity at low
temperatures. Here, in addition to Dirac/Weyl semimetals, we demonstrated that
3D semimetals with straight nodal lines can also exhibit the QTHE under high
magnetic fields. As a candidate material for experimental validation, we
discussed the thermoelectric properties of bulk graphite. Furthermore, we
investigated the dimensional crossover of thermoelectricity to two-dimensional
behavior in thin-film graphite.
","[{""version"":""v1"",""created"":""Tue, 22 Feb 2022 06:17:02 GMT""}]","2022-05-03"
"2202.10690","Gang Yu","Haoran Dong, Gang Yu","An Energy-concentrated Wavelet Transform for Time Frequency Analysis of
  Transient Signals",,,,,"eess.SP","http://arxiv.org/licenses/nonexclusive-distrib/1.0/","  Transient signals are often composed of a series of modes that have
multivalued time-dependent instantaneous frequency (IF), which brings
challenges to the development of signal processing technology. Fortunately, the
group delay (GD) of such signal can be well expressed as a single valued
function of frequency. By considering the frequency-domain signal model, we
present a postprocessing method called wavelet transform (WT)-based
time-reassigned synchrosqueezing transform (WTSST). Our proposed method embeds
a two-dimensional GD operator into a synchrosqueezing framework to generate a
time-frequency representation (TFR) of transient signal with high energy
concentration and allows to retrieve the whole or part of the signal. The
theoretical analyses of the WTSST are provided, including the analysis of GD
candidate accuracy and signal reconstruction accuracy. Moreover, based on
WTSST, the WT-based time-reassigned multisynchrosqueezing transform (WTMSST) is
proposed by introducing a stepwise refinement scheme, which further improves
the drawback that the WTSST method is unable to deal with strong
frequency-varying signal. Simulation and real signal analysis illustrate that
the proposed methods have the capacity to appropriately describe the features
of transient signals.
","[{""version"":""v1"",""created"":""Tue, 22 Feb 2022 06:20:07 GMT""}]","2022-02-23"
"2202.10691","Suvidha Tripathi Dr","Suvidha Tripathi and Satish Kumar Singh","An Object Aware Hybrid U-Net for Breast Tumour Annotation",,,,,"eess.IV cs.CV","http://creativecommons.org/licenses/by-nc-sa/4.0/","  In the clinical settings, during digital examination of histopathological
slides, the pathologist annotate the slides by marking the rough boundary
around the suspected tumour region. The marking or annotation is generally
represented as a polygonal boundary that covers the extent of the tumour in the
slide. These polygonal markings are difficult to imitate through CAD techniques
since the tumour regions are heterogeneous and hence segmenting them would
require exhaustive pixel wise ground truth annotation. Therefore, for CAD
analysis, the ground truths are generally annotated by pathologist explicitly
for research purposes. However, this kind of annotation which is generally
required for semantic or instance segmentation is time consuming and tedious.
In this proposed work, therefore, we have tried to imitate pathologist like
annotation by segmenting tumour extents by polygonal boundaries. For polygon
like annotation or segmentation, we have used Active Contours whose vertices or
snake points move towards the boundary of the object of interest to find the
region of minimum energy. To penalize the Active Contour we used modified U-Net
architecture for learning penalization values. The proposed hybrid deep
learning model fuses the modern deep learning segmentation algorithm with
traditional Active Contours segmentation technique. The model is tested against
both state-of-the-art semantic segmentation and hybrid models for performance
evaluation against contemporary work. The results obtained show that the
pathologist like annotation could be achieved by developing such hybrid models
that integrate the domain knowledge through classical segmentation methods like
Active Contours and global knowledge through semantic segmentation deep
learning models.
","[{""version"":""v1"",""created"":""Tue, 22 Feb 2022 06:30:31 GMT""}]","2022-02-23"
"2202.10692","Chengyuan Wang","Yun Chen, Chengyuan Wang, Xin Yang, Zehao Shen, Wei Zhang, Hong Gao,
  and Fuli Li","Generation and characterization of customized perfect Laguerre-Gaussian
  beams with arbitrary profiles","6 pages, 8 figures",,,,"physics.optics quant-ph","http://arxiv.org/licenses/nonexclusive-distrib/1.0/","  We experimentally demonstrate the generation of customized perfect
Laguerre-Gaussian (PLG) beams whose intensity maxima localized around any
desired curves. The principle is to act appropriate algebraic functions on the
angular spectra of PLG beams. We characterize the propagation properties of
these beams and compare them with non-diffraction caustic beams possessing the
same intensity profiles. The results manifest that the customized-PLG beams can
maintain their profiles during propagation and suffer less energy loss than the
non-diffraction caustic beams, and hence are able to propagate a longer
distance. This new structure beam would have potential applications in areas
such as optical communication, soliton routing and steering, optical tweezing
and trapping, atom optics, etc.
","[{""version"":""v1"",""created"":""Tue, 22 Feb 2022 06:38:44 GMT""}]","2022-02-23"
"2202.10693","Zhaoxia Yin","Qingyu Wang, Guorui Feng, Zhaoxia Yin, Bin Luo","Universal adversarial perturbation for remote sensing images","Published in the Twenty-Fourth International Workshop on Multimedia
  Signal Processing, MMSP 2022",,,,"cs.CV","http://arxiv.org/licenses/nonexclusive-distrib/1.0/","  Recently, with the application of deep learning in the remote sensing image
(RSI) field, the classification accuracy of the RSI has been dramatically
improved compared with traditional technology. However, even the
state-of-the-art object recognition convolutional neural networks are fooled by
the universal adversarial perturbation (UAP). The research on UAP is mostly
limited to ordinary images, and RSIs have not been studied. To explore the
basic characteristics of UAPs of RSIs, this paper proposes a novel method
combining an encoder-decoder network with an attention mechanism to generate
the UAP of RSIs. Firstly, the former is used to generate the UAP, which can
learn the distribution of perturbations better, and then the latter is used to
find the sensitive regions concerned by the RSI classification model. Finally,
the generated regions are used to fine-tune the perturbation making the model
misclassified with fewer perturbations. The experimental results show that the
UAP can make the classification model misclassify, and the attack success rate
of our proposed method on the RSI data set is as high as 97.09%.
","[{""version"":""v1"",""created"":""Tue, 22 Feb 2022 06:43:28 GMT""},{""version"":""v2"",""created"":""Tue, 3 Jan 2023 10:59:22 GMT""}]","2023-01-04"
