"2202.10514","Venus Keus","Jaime Hernandez-Sanchez, Venus Keus, Stefano Moretti, Dorota
  Sokolowska","Complementary collider and astrophysical probes of multi-component Dark
  Matter","20 pages, 7 figures, 2 tables. arXiv admin note: substantial text
  overlap with arXiv:2012.11621",,"10.1007/JHEP03(2023)045","DIAS-STP-22-01","hep-ph astro-ph.CO","http://creativecommons.org/licenses/by/4.0/","  We study a new physics scenario with two inert and one active scalar
doublets, hence a 3-Higgs Doublet Model (3HDM). We impose a $Z_2 \times Z'_2$
symmetry onto such a 3HDM with one inert doublet odd under the $Z_2$
transformation and the other odd under the $Z'_2$ one. Such a construction
leads to a two-component Dark Matter (DM) model. It has been shown that, when
there is a sufficient mass difference between the two DM candidates, it is
possible to probe the light DM candidate in the nuclear recoil energy in direct
detection experiments and the heavy DM component in the photon flux in indirect
detection experiments. With the DM masses at the electroweak scale, we show
that, independently of astrophysical probes, this model feature can be tested
at the Large Hadron Collider via scalar cascade decays in $2 \ell +
\cancel{E}_T$ final states. We study several observable distributions whose
shapes hint at the presence of the two different DM candidates.
","[{""version"":""v1"",""created"":""Mon, 21 Feb 2022 20:06:28 GMT""}]","2023-03-29"
"2202.10515","Renee Mirka","Renee Mirka, Devin Smedira, and David P. Williamson","Graph Coloring and Semidefinite Rank","21 pages, 4 figures",,,,"math.OC cs.DS","http://creativecommons.org/licenses/by/4.0/","  This paper considers the interplay between semidefinite programming, matrix
rank, and graph coloring. Karger, Motwani, and Sudan \cite{KMS98} give a vector
program for which a coloring of the graph can be encoded as a semidefinite
matrix of low rank. By complementary slackness conditions of semidefinite
programming, if an optimal dual solution has sufficiently high rank, any
optimal primal solution must have low rank. We attempt to characterize graphs
for which we can show that the corresponding dual optimal solution must have
sufficiently high rank. In the case of the original Karger, Motwani, and Sudan
vector program, we show that any graph which is a $k$-tree has sufficiently
high dual rank, and we can extract the coloring from the corresponding low-rank
primal solution. We can also show that if the graph is not uniquely colorable,
then no sufficiently high rank dual optimal solution can exist. This allows us
to completely characterize the planar graphs for which dual optimal solutions
have sufficiently high dual rank. We then modify the semidefinite program to
have an objective function with costs, and explore when we can create a cost
function whose optimal dual solution has sufficiently high rank. We show that
it is always possible to construct such a cost function given the graph
coloring. The construction of the cost function gives rise to a heuristic for
graph coloring which we show works well in the case of planar graphs. Our
research was motivated by the Colin de Verdi\`ere graph invariant
\cite{CDV90}(and a corresponding conjecture of Colin de Verdi\`ere), in which
matrices that have some similarities to the dual feasible matrices must have
high rank in the case that graphs are of a certain type. We explore the
connection between the conjecture and the rank of the dual solutions.
","[{""version"":""v1"",""created"":""Mon, 21 Feb 2022 20:13:04 GMT""}]","2022-02-23"
"2202.10516","Florian Vigneau","Florian Vigneau, Federico Fedele, Anasua Chatterjee, David Reilly,
  Ferdinand Kuemmeth, Fernando Gonzalez-Zalba, Edward Laird and Natalia Ares","Probing quantum devices with radio-frequency reflectometry","Review paper. 64 pages main text, 15 pages supplementary. 47 figures
  in main text, 5 in the supplementary","Applied Physics Reviews 10, 021305 (2023)","10.1063/5.0088229","NBI QDEV 2023","cond-mat.mes-hall quant-ph","http://arxiv.org/licenses/nonexclusive-distrib/1.0/","  Many important phenomena in quantum devices are dynamic, meaning that they
cannot be studied using time-averaged measurements alone. Experiments that
measure such transient effects are collectively known as fast readout. One of
the most useful techniques in fast electrical readout is radio-frequency
reflectometry, which can measure changes in impedance (both resistive and
reactive) even when their duration is extremely short, down to a microsecond or
less. Examples of reflectometry experiments, some of which have been realised
and others so far only proposed, include projective measurements of qubits and
Majorana devices for quantum computing, real-time measurements of mechanical
motion and detection of non-equilibrium temperature fluctuations. However, all
of these experiments must overcome the central challenge of fast readout: the
large mismatch between the typical impedance of quantum devices (set by the
resistance quantum) and of transmission lines (set by the impedance of free
space). Here, we review the physical principles of radio-frequency
reflectometry and its close cousins, measurements of radio-frequency
transmission and emission. We explain how to optimise the speed and sensitivity
of a radio-frequency measurement, and how to incorporate new tools such as
superconducting circuit elements and quantum-limited amplifiers into advanced
radio-frequency experiments. Our aim is three-fold: to introduce the readers to
the technique, to review the advances to date and to motivate new experiments
in fast quantum device dynamics. Our intended audience includes
experimentalists in the field of quantum electronics who want to implement
radio-frequency experiments or improve them, together with physicists in
related fields who want to understand how the most important radio-frequency
measurements work.
","[{""version"":""v1"",""created"":""Mon, 21 Feb 2022 20:14:21 GMT""}]","2023-05-30"
"2202.10517","Franziska Boenisch","Franziska Boenisch, Christopher M\""uhl, Roy Rinberg, Jannis Ihrig,
  Adam Dziedzic","Individualized PATE: Differentially Private Machine Learning with
  Individual Privacy Guarantees","accepted for publication at PoPETs'23",,,,"cs.LG cs.CR","http://arxiv.org/licenses/nonexclusive-distrib/1.0/","  Applying machine learning (ML) to sensitive domains requires privacy
protection of the underlying training data through formal privacy frameworks,
such as differential privacy (DP). Yet, usually, the privacy of the training
data comes at the cost of the resulting ML models' utility. One reason for this
is that DP uses one uniform privacy budget epsilon for all training data
points, which has to align with the strictest privacy requirement encountered
among all data holders. In practice, different data holders have different
privacy requirements and data points of data holders with lower requirements
can contribute more information to the training process of the ML models. To
account for this need, we propose two novel methods based on the Private
Aggregation of Teacher Ensembles (PATE) framework to support the training of ML
models with individualized privacy guarantees. We formally describe the
methods, provide a theoretical analysis of their privacy bounds, and
experimentally evaluate their effect on the final model's utility using the
MNIST, SVHN, and Adult income datasets. Our empirical results show that the
individualized privacy methods yield ML models of higher accuracy than the
non-individualized baseline. Thereby, we improve the privacy-utility trade-off
in scenarios in which different data holders consent to contribute their
sensitive data at different individual privacy levels.
","[{""version"":""v1"",""created"":""Mon, 21 Feb 2022 20:16:27 GMT""},{""version"":""v2"",""created"":""Wed, 23 Feb 2022 21:27:20 GMT""},{""version"":""v3"",""created"":""Mon, 3 Oct 2022 19:57:57 GMT""},{""version"":""v4"",""created"":""Tue, 8 Nov 2022 15:06:49 GMT""}]","2022-11-09"
"2202.10518","Juan Estrada","Alexis Aguilar-Arevalo, Fabricio Alcalde Bessia, Nicolas Avalos,
  Daniel Baxter, Xavier Bertou, Carla Bonifazi, Ana Botti, Mariano Cababie,
  Gustavo Cancelo, Brenda Aurea Cervantes-Vergara, Nuria Castello-Mor, Alvaro
  Chavarria, Claudio R. Chavez, Fernando Chierchie, Juan Manuel De Egea, Juan
  Carlos D`Olivo, Cyrus E. Dreyer, Alex Drlica-Wagner, Rouven Essig, Juan
  Estrada, Ezequiel Estrada, Erez Etzion, Guillermo Fernandez-Moroni, Marivi
  Fernandez-Serra, Steve Holland, Agustin Lantero Barreda, Andrew Lathrop, Jose
  Lipovetzky, Ben Loer, Edgar Marrufo Villalpando, Jorge Molina, Santiago
  Perez, Paolo Privitera, Dario Rodrigues, Richard Saldanha, Diego Santa Cruz,
  Aman Singal, Nathan Saffold, Leandro Stefanazzi, Miguel Sofo-Haro, Javier
  Tiffenberg, Christian Torres, Sho Uemura, and Rocio Vilar","The Oscura Experiment",,,,,"astro-ph.IM","http://creativecommons.org/licenses/by/4.0/","  The Oscura experiment will lead the search for low-mass dark matter particles
using a very large array of novel silicon Charge Coupled Devices (CCDs) with a
threshold of two electrons and with a total exposure of 30 kg-yr. The R&D
effort, which began in FY20, is currently entering the design phase with the
goal of being ready to start construction in late 2024. Oscura will have
unprecedented sensitivity to sub-GeV dark matter particles that interact with
electrons, probing dark matter-electron scattering for masses down to 500 keV
and dark matter being absorbed by electrons for masses down to 1 eV. The Oscura
R&D effort has made some significant progress on the main technical challenges
of the experiment, of which the most significant are engaging new foundries for
the fabrication of the CCD sensors, developing a cold readout solution, and
understanding the experimental backgrounds.
","[{""version"":""v1"",""created"":""Mon, 21 Feb 2022 20:18:39 GMT""},{""version"":""v2"",""created"":""Wed, 23 Feb 2022 23:38:32 GMT""}]","2022-02-25"
"2202.10519","Alexander Plavin","A. V. Plavin (ASC Lebedev), Z. Paragi (JIVE), B. Marcote (JIVE), A.
  Keimpema (JIVE), J. W. T. Hessels (ASTRON, UvA), K. Nimmo (ASTRON, UvA), H.
  K. Vedantham (ASTRON), L. G. Spitler (MPIfR)","FRB 121102: drastic changes in the burst polarization contrasts with the
  stability of the persistent emission","9 pages, 8 figures; accepted to MNRAS",,"10.1093/mnras/stac500",,"astro-ph.HE","http://arxiv.org/licenses/nonexclusive-distrib/1.0/","  We study milliarcsecond-scale properties of the persistent radio counterpart
to FRB 121102 and investigate the spectro-polarimetric properties of a bright
burst. For the former, we use European VLBI Network (EVN) observations in 2017
at 1.7 and 4.8 GHz. For the latter, we re-analyse the 1.7-GHz data from the
100-m Effelseberg telescope taken in 2016. These observations predate other
polarimetric studies of FRB 121102, and yield the highest burst Faraday
rotation measure (RM) to date, RM = 1.27*10^5 rad m^-2, consistent with the
decreasing RM trend. The fractional polarization of the burst emission is 15%
at 1.7 GHz. This can be reconciled with the high fractional polarization at
higher frequencies if the Faraday width of the burst environment is 150 rad
m^-2 - a bare 0.1% of the total Faraday rotation. The width may originate from
minor non-uniformities in the Faraday screen, or from effects in the emitting
region itself. The upper limit on the persistent source size is 1 pc, barely
consistent with a young supernova (SN) scenario. The flux variability limit of
<10% is not in favor of the young SN scenario, and challenges other
interpretations as well. The fractional polarization of the faint persistent
source is constrained at <25% at 4.8 GHz ruling out a common origin with the
highly polarized individual bursts.
","[{""version"":""v1"",""created"":""Mon, 21 Feb 2022 20:22:20 GMT""}]","2022-03-02"
"2202.10520","Suyun Bae","S. Sandra Bae, Clement Zheng, Mary Etta West, Ellen Yi-Luen Do, Samuel
  Huron, and Danielle Albers Szafir","Making Data Tangible: A Cross-disciplinary Design Space for Data
  Physicalization","To appear in the conference proceedings for ACM CHI 2022",,,,"cs.HC","http://arxiv.org/licenses/nonexclusive-distrib/1.0/","  Designing a data physicalization requires a myriad of different
considerations. Despite the cross-disciplinary nature of these considerations,
research currently lacks a synthesis across the different communities data
physicalization sits upon, including their approaches, theories, and even
terminologies. To bridge these communities synergistically, we present a design
space that describes and analyzes physicalizations according to three facets:
context (end-user considerations), structure (the physical structure of the
artifact), and interactions (interactions with both the artifact and data). We
construct this design space through a systematic review of 47 physicalizations
and analyze the interrelationships of key factors when designing a
physicalization. This design space cross-pollinates knowledge from relevant HCI
communities, providing a cohesive overview of what designers should consider
when creating a data physicalization while suggesting new design possibilities.
We analyze the design decisions present in current physicalizations, discuss
emerging trends, and identify underlying open challenges.
","[{""version"":""v1"",""created"":""Mon, 21 Feb 2022 20:23:30 GMT""}]","2022-02-23"
"2202.10521","Marko Kosti\'c","Marko Kosti\'c","Multi-dimensional Besicovitch almost periodic type functions and
  applications",,,,,"math.FA","http://creativecommons.org/licenses/by/4.0/","  In this paper, we analyze multi-dimensional Besicovitch almost periodic type
functions. We clarify the main structural properties for the introduced classes
of Besicovitch almost periodic type functions, explore the notion of
Besicovitch-Doss almost periodicity in the multi-dimensional setting, and
provide some applications of our results to the abstract Volterra
integro-differential equations and the partial differential equations.
","[{""version"":""v1"",""created"":""Mon, 21 Feb 2022 20:23:39 GMT""}]","2022-02-23"
"2202.10522","Andrew Wood","Andrew Wood, Moshik Hershcovitch, Daniel Waddington, Sarel Cohen,
  Peter Chin","Non-Volatile Memory Accelerated Posterior Estimation",,,,,"cs.LG cs.AR","http://creativecommons.org/licenses/by/4.0/","  Bayesian inference allows machine learning models to express uncertainty.
Current machine learning models use only a single learnable parameter
combination when making predictions, and as a result are highly overconfident
when their predictions are wrong. To use more learnable parameter combinations
efficiently, these samples must be drawn from the posterior distribution.
Unfortunately computing the posterior directly is infeasible, so often
researchers approximate it with a well known distribution such as a Gaussian.
In this paper, we show that through the use of high-capacity persistent
storage, models whose posterior distribution was too big to approximate are now
feasible, leading to improved predictions in downstream tasks.
","[{""version"":""v1"",""created"":""Mon, 21 Feb 2022 20:25:57 GMT""}]","2022-02-23"
"2202.10523","Junghoon Seo","Beomsu Kim, Junghoon Seo","Semi-Implicit Hybrid Gradient Methods with Application to Adversarial
  Robustness","International Conference on Artificial Intelligence and Statistics
  (AISTATS) 2022",,,,"cs.LG cs.AI cs.CV math.OC","http://arxiv.org/licenses/nonexclusive-distrib/1.0/","  Adversarial examples, crafted by adding imperceptible perturbations to
natural inputs, can easily fool deep neural networks (DNNs). One of the most
successful methods for training adversarially robust DNNs is solving a
nonconvex-nonconcave minimax problem with an adversarial training (AT)
algorithm. However, among the many AT algorithms, only Dynamic AT (DAT) and You
Only Propagate Once (YOPO) guarantee convergence to a stationary point. In this
work, we generalize the stochastic primal-dual hybrid gradient algorithm to
develop semi-implicit hybrid gradient methods (SI-HGs) for finding stationary
points of nonconvex-nonconcave minimax problems. SI-HGs have the convergence
rate $O(1/K)$, which improves upon the rate $O(1/K^{1/2})$ of DAT and YOPO. We
devise a practical variant of SI-HGs, and show that it outperforms other AT
algorithms in terms of convergence speed and robustness.
","[{""version"":""v1"",""created"":""Mon, 21 Feb 2022 20:27:10 GMT""}]","2022-02-23"
"2202.10524","Yohei Ema","Yohei Ema, Ting Gao, Maxim Pospelov","Standard Model prediction for paramagnetic EDMs","4 pages, 2 figures. v2: an overall sign error fixed and references
  added",,"10.1103/PhysRevLett.129.231801","UMN-TH-4115/22, FTPI-MINN-22-06","hep-ph hep-ex nucl-th","http://creativecommons.org/licenses/by/4.0/","  Standard Model $CP$ violation associated with the phase of the
Cabibbo-Kobayashi-Maskawa quark mixing matrix is known to give small answers
for the EDM observables. Moreover, predictions for the EDMs of neutrons and
diamagnetic atoms suffer from considerable uncertainties. We point out that the
$CP$-violating observables associated with the electron spin (paramagnetic
EDMs) are dominated by the combination of the electroweak penguin diagrams and
$\Delta I =1/2$ weak transitions in the baryon sector, and are calculable
within chiral perturbation theory. The predicted size of the semileptonic
operator $C_S$ is $7\times 10^{-16}$ which corresponds to the equivalent
electron EDM $d_e^{\rm eq} = 1.0 \times 10^{-35}e\,{\rm cm}$. While still far
from the current observational limits, this result is three orders of magnitude
larger than previously believed.
","[{""version"":""v1"",""created"":""Mon, 21 Feb 2022 20:31:55 GMT""},{""version"":""v2"",""created"":""Fri, 11 Mar 2022 23:24:38 GMT""}]","2022-12-07"
"2202.10525","Kristof Pusztai","Kristof Pusztai","A Probabilistic Approach to The Perfect Sum Problem","22 pages, 6 figures",,,,"cs.DS stat.AP stat.CO","http://creativecommons.org/licenses/by/4.0/","  The subset sum problem is known to be an NP-hard problem in the field of
computer science with the fastest known approach having a run-time complexity
of $O(2^{0.3113n})$. A modified version of this problem is known as the perfect
sum problem and extends the subset sum idea further. This extension results in
additional complexity, making it difficult to compute for a large input. In
this paper, I propose a probabilistic approach which approximates the solution
to the perfect sum problem by approximating the distribution of potential sums.
Since this problem is an extension of the subset sum, our approximation also
grants some probabilistic insight into the solution for the subset sum problem.
We harness distributional approximations to model the number of subsets which
sum to a certain size. These distributional approximations are formulated in
two ways: using bounds to justify normal approximation, and approximating the
empirical distribution via density estimation. These approximations can be
computed in $O(n)$ complexity, and can increase in accuracy with the size of
the input data making it useful for large-scale combinatorial problems. Code is
available at https://github.com/KristofPusztai/PerfectSum.
","[{""version"":""v1"",""created"":""Mon, 21 Feb 2022 20:34:02 GMT""},{""version"":""v2"",""created"":""Wed, 16 Mar 2022 01:23:12 GMT""},{""version"":""v3"",""created"":""Thu, 10 Nov 2022 03:50:18 GMT""},{""version"":""v4"",""created"":""Fri, 25 Nov 2022 19:28:44 GMT""}]","2022-11-29"
"2202.10526","Nazul Jared Lopez-Alamilla Dr","N. J. Lopez-Alamilla and R. U. L. Cachi","Virial-like Thermodynamic Uncertainty Relation in the Tight-Binding
  Regime","7 pages, 10 figures",,"10.1063/5.0107554",,"cond-mat.stat-mech","http://creativecommons.org/licenses/by/4.0/","  We presented a methodology to approximate the entropy production for Brownian
motion in a tilted periodic potential. The approximation stems from the well
known thermodynamic uncertainty relation. By applying a virial-like expansion,
we provided a tighter lower limit solely in terms of the drift velocity and
diffusion. The approach presented is systematically analysed in the
tight-binding regime. We also provide a relatively simple rule to validate
using the tight-binding approach based on drift and diffusion relations rather
than energy barriers and forces. We also discuss the implications of our
results outside the tight-binding regime.
","[{""version"":""v1"",""created"":""Mon, 21 Feb 2022 20:42:24 GMT""},{""version"":""v2"",""created"":""Wed, 23 Feb 2022 20:50:02 GMT""}]","2022-10-26"
"2202.10527","Pablo Terlisky","Francisco J Soulignac and Pablo Terlisky","Loop unrolling of UCA models: distance labeling",,,,,"cs.DS cs.DM","http://arxiv.org/licenses/nonexclusive-distrib/1.0/","  A proper circular-arc (PCA) model is a pair $M = (C, A)$ where $C$ is a
circle and $A$ is a family of inclusion-free arcs on $C$ whose extremes are
pairwise different. The model $M$ represents a digraph $D$ that has one vertex
$v(a)$ for each $a \in A$ and one edge $v(a) \to v(b)$ for each pair of arcs
$a,b \in A(M)$ such that the beginning point of $b$ belongs to $a$. For $k \geq
0$, the $k$-th power $D^k$ of $D$ has the same vertices as $D$ and $v(a) \to
v(b)$ is an edge of $D^k$ when $a\neq b$ and the distance from $v(a)$ to $v(b)$
in $D$ is at most $k$. A unit circular-arc (UCA) model is a PCA model $U =
(C,A)$ in which all the arcs have the same length $\ell+1$. If $\ell$, the
length $c$ of $C$, and the extremes of the arcs of $A$ are integer, then $U$ is
a $(c,\ell)$-CA model. For $i \geq 0$, the model $i \times U$ of $U$ is
obtained by replacing each arc $(s,s+\ell+1)$ with the arc $(s,s+i\ell+1)$. If
$U$ represents a digraph $D$, then $U$ is $k$-multiplicative when $i \times U$
represents $D^i$ for every $0 \leq i \leq k$. In this article we design a
linear time algorithm to decide if a PCA model $M$ is equivalent to a
$k$-multiplicative UCA model when $k$ is given as input. The algorithm either
outputs a $k$-multiplicative UCA model $U$ equivalent to $M$ or a negative
certificate that can be authenticated in linear time.
  Our main technical tool is a new characterization of those PCA models that
are equivalent to $k$-multiplicative UCA models. For $k=1$, this
characterization yields a new algorithm for the classical representation
problem that is simpler than the previously known algorithms.
","[{""version"":""v1"",""created"":""Mon, 21 Feb 2022 20:54:38 GMT""}]","2022-02-23"
"2202.10528","Damir Kinzebulatov","Ryan Gibara and Damir Kinzebulatov","On the vanishing of Green's function, desingularization and Carleman's
  method","Reference added",,,,"math.AP math.PR math.SP","http://arxiv.org/licenses/nonexclusive-distrib/1.0/","  The subject of the present paper is the phenomenon of vanishing of the Green
function of the operator $-\Delta + V$ on $\mathbb R^3$ at the points where a
potential $V$ has positive critical singularities. More precisely, imposing
minimal assumptions on $V$ (i.e. the form-boundedness), we obtain an upper
bound on the order of vanishing of the Green function. As a by-product of our
proof, we improve the existing results on the strong unique continuation for
eigenfunctions of $-\Delta + V$ in dimension $d=3$.
","[{""version"":""v1"",""created"":""Mon, 21 Feb 2022 21:02:28 GMT""},{""version"":""v2"",""created"":""Thu, 24 Feb 2022 20:48:18 GMT""}]","2022-02-28"
"2202.10529","Matthew Ferland","Matthew Ferland and Vikram Kher","NP-Hardness of a 2D, a 2.5D, and a 3D Puzzle Game",,,,,"cs.CC","http://arxiv.org/licenses/nonexclusive-distrib/1.0/","  In this paper, we give simple NP-hardness reductions for three popular video
games. The first is Baba Is You, an award winning 2D block puzzle game with the
key premise being the ability to rewrite the rules of the game. The second is
Fez, a puzzle platformer whose main draw is the ability to swap between four
different 2-dimensional views of the player's position. The final is Catherine,
a 3-dimensional puzzle game where the player must climb a tower of
rearrangeable blocks.
","[{""version"":""v1"",""created"":""Mon, 21 Feb 2022 21:06:55 GMT""}]","2022-02-23"
"2202.10530","Daniel Martin","Daniel Martin","A geometric study of circle packings and ideal class groups","23 pages, 6 figures",,,,"math.NT","http://arxiv.org/licenses/nonexclusive-distrib/1.0/","  A family of fractal arrangements of circles is introduced for each imaginary
quadratic field $K$. Collectively, these arrangements contain (up to an affine
transformation) every set of circles in the extended complex plane with
integral curvatures and Zariski dense symmetry group. When that set is a circle
packing, we show how the ambient structure of our arrangement gives a geometric
criterion for satisfying the almost local-global principle. Connections to the
class group of $K$ are also explored. Among them is a geometric property that
guarantees certain ideal classes are group generators.
","[{""version"":""v1"",""created"":""Mon, 21 Feb 2022 21:07:50 GMT""}]","2022-02-23"
