"2202.10330","Tomislav Pite\v{s}a","O. Travnikova, T. Pite\v{s}a, A. Ponzi, M. Sapunar, R. J. Squibb, R.
  Richter, P. Finetti, M. Di Fraia, A. De Fanis, N. Mahne, M. Manfredda, V.
  Zhaunerchyk, T. Marchenko, R. Guillemin, L. Journel, K. C. Prince, C.
  Callegari, M. Simon, R. Feifel, P. Decleva, N. Do\v{s}li\'c, M. N.
  Piancastelli","The photochemical ring-opening reaction of 1,3-cyclohexadiene: complex
  dynamical evolution of the reactive state","Sumbitted to Nature Communications (under review)",,,,"physics.chem-ph","http://arxiv.org/licenses/nonexclusive-distrib/1.0/","  The photochemically induced ring-opening isomerization reaction of
1,3-cyclohexadiene (CHD) to 1,3,5-hexatriene (HT) is a textbook example of a
pericyclic reaction, and has been amply investigated with advanced
spectroscopic techniques. The generally accepted description of the
isomerization pathway starts with a valence excitation to the lowest-lying
bright state, followed by a passage through a conical intersection to a dark
doubly excited state, and finally a branching between either the return to the
ground state of the cyclic molecule or the actual ring-opening reaction leading
to the open-chain isomer. It was traditionally assumed that the dark reactive
state corresponds to the second excited state of CHD at the Franck-Condon
geometry. Here in a joint experimental and computational effort we demonstrate
that the evolution of the excitation-deexcitation process is much more complex
than usually described. In particular, we show that an initially high-lying
electronic state smoothly decreasing in energy along the reaction path plays a
key role in the ring-opening reaction. The conceptual basis of our work is that
the dynamics to consider here is determined by diabatic states, whose
populations are the ones closely related to the observed photoelectron signal.
","[{""version"":""v1"",""created"":""Mon, 21 Feb 2022 16:00:11 GMT""}]","2022-02-22"
"2202.10331","Eivind Schneider","Boris Kruglikov, Eivind Schneider","ODEs whose symmetry groups are not fiber-preserving","37 pages, 4 figures. V4: Added tables summarizing invariant ODE
  systems and diagrams of relevant Lie algebra inclusions, and formalized
  several results in sect. 3 and appendices. V5: Small correction to Th. 13 and
  Table 2",,,,"math.DG","http://arxiv.org/licenses/nonexclusive-distrib/1.0/","  We observe that, up to conjugation, a majority of symmetric higher order ODEs
(ordinary differential equations) and ODE systems have only fiber-preserving
point symmetries. By exploiting Lie's classification of Lie algebras of vector
fields, we describe all the exceptions to this in the case of scalar ODEs and
systems of ODEs on a pair of functions.
  The scalar ODEs whose symmetry algebra is not fiber preserving can be
expressed via absolute and relative scalar differential invariants, while a
similar description for ODE systems requires us to also invoke conditional
differential invariants and vector-valued relative invariants to deal with
singular orbits of the action.
  Investigating prolongations of the actions, we observe some interesting
relations between different realizations of Lie algebras. We also note that it
may happen that the prolongation of a finite-dimensional Lie algebra acting on
a differential equation never becomes free. An example of an underdetermined
ODE system for which this phenomenon occurs shows limitations of the method of
moving frames.
","[{""version"":""v1"",""created"":""Mon, 21 Feb 2022 16:06:31 GMT""},{""version"":""v2"",""created"":""Fri, 8 Apr 2022 07:51:30 GMT""},{""version"":""v3"",""created"":""Thu, 29 Dec 2022 14:13:37 GMT""},{""version"":""v4"",""created"":""Thu, 11 May 2023 11:35:55 GMT""},{""version"":""v5"",""created"":""Thu, 1 Jun 2023 08:37:48 GMT""}]","2023-06-02"
"2202.10332","Akhil Goyal","Hari Prasad, Akhil Goyal, Shivram Ramasubramanian","Manage risks in complex engagements by leveraging organization-wide
  knowledge using Machine Learning",,,,,"cs.LG","http://creativecommons.org/licenses/by-nc-sa/4.0/","  One of the ways for organizations to continuously get better at executing
projects is to learn from their past experience. In large organizations, the
different accounts and business units often work in silos and tapping the rich
knowledge base across the organization is easier said than done. With easy
access to the collective experience spread across the organization, project
teams and business leaders can proactively anticipate and manage risks in new
engagements. Early discovery and timely management of risks is key to success
in the complex engagements of today. In this paper, the authors describe a
Machine Learning based solution deployed with MLOps principles to solve this
problem in an efficient manner.
","[{""version"":""v1"",""created"":""Mon, 21 Feb 2022 16:09:41 GMT""}]","2022-02-22"
"2202.10333","Joshua Krissansen-Totton","Joshua Krissansen-Totton, Maggie Thompson, Max L. Galloway, and
  Jonathan J. Fortney","Understanding planetary context to enable life detection on exoplanets
  and test the Copernican principle","16 pages, 5 figures, updated with minor formatting corrections","Nat Astron 6, 189-198 (2022)","10.1038/s41550-021-01579-7",,"astro-ph.EP","http://creativecommons.org/licenses/by/4.0/","  The search for life on exoplanets is motivated by the universal ways in which
life could modify its planetary environment. Atmospheric gases such as oxygen
and methane are promising candidates for such environmental modification due to
the evolutionary benefits their production would confer. However, confirming
that these gases are produced by life, rather than by geochemical or
astrophysical processes, will require a thorough understanding of planetary
context, including the expected counterfactual atmospheric evolution for
lifeless planets. Here, we evaluate current understanding of planetary context
for several candidate biosignatures and their upcoming observability. We review
the contextual framework for oxygen and describe how conjectured abiotic oxygen
scenarios may be testable. In contrast to oxygen, current understanding of how
planetary context controls non-biological methane (CH$_4$) production is
limited, even though CH$_4$ biosignatures in anoxic atmospheres may be readily
detectable with the James Webb Space Telescope. We assess environmental context
for CH$_4$ biosignatures and conclude that abundant atmospheric CH$_4$
coexisting with CO$_2$, and CO:CH$_4$ << 1 is suggestive of biological
production, although precise thresholds are dependent on stellar context and
sparsely characterized abiotic CH$_4$ scenarios. A planetary context framework
is also considered for alternative or agnostic biosignatures. Whatever the
distribution of life in the Universe, observations of terrestrial exoplanets in
coming decades will provide a quantitative understanding of the atmospheric
evolution of lifeless worlds. This knowledge will inform future instrument
requirements to either corroborate the presence of life elsewhere or confirm
its apparent absence.
","[{""version"":""v1"",""created"":""Mon, 21 Feb 2022 16:10:34 GMT""},{""version"":""v2"",""created"":""Tue, 1 Mar 2022 21:05:38 GMT""}]","2022-03-03"
"2202.10334","Peter Gibson","Peter C. Gibson","Theorems of Szeg\H{o}-Verblunsky type in the multivariate and almost
  periodic settings","32 pages",,,,"math.FA math-ph math.MP","http://creativecommons.org/licenses/by-nc-nd/4.0/","  The classical Szeg\H{o}-Verblunsky theorem relates integrability of the
logarithm of the absolutely continuous part of a probability measure on the
circle to square summability of the sequence of recurrence coefficients for the
orthogonal polynomials determined by the measure. The present paper constructs
orthogonal polynomials on the torus of arbitrary finite dimension in order to
prove theorems of Szeg\H{o}-Verblunsky type in the multivariate and almost
periodic settings. The results are applied to the one-dimensional Schr\""odinger
equation in impedance form to yield a new trace formula valid for piecewise
constant impedance, a case where the classical trace formula breaks down. As a
byproduct, the analysis gives an explicit formula for the Taylor coefficients
of a bounded holomorphic function on the open disk in terms of its continued
fraction expansion.
","[{""version"":""v1"",""created"":""Mon, 21 Feb 2022 16:11:42 GMT""}]","2022-02-22"
"2202.10335","Andreas Bueff Mr.","Andreas Bueff, Ioannis Papantonis, Auste Simkute, Vaishak Belle","Explainability in Machine Learning: a Pedagogical Perspective",,,,,"cs.HC cs.AI","http://creativecommons.org/licenses/by/4.0/","  Given the importance of integrating of explainability into machine learning,
at present, there are a lack of pedagogical resources exploring this.
Specifically, we have found a need for resources in explaining how one can
teach the advantages of explainability in machine learning. Often pedagogical
approaches in the field of machine learning focus on getting students prepared
to apply various models in the real world setting, but much less attention is
given to teaching students the various techniques one could employ to explain a
model's decision-making process. Furthermore, explainability can benefit from a
narrative structure that aids one in understanding which techniques are
governed by which questions about the data.
  We provide a pedagogical perspective on how to structure the learning process
to better impart knowledge to students and researchers in machine learning,
when and how to implement various explainability techniques as well as how to
interpret the results. We discuss a system of teaching explainability in
machine learning, by exploring the advantages and disadvantages of various
opaque and transparent machine learning models, as well as when to utilize
specific explainability techniques and the various frameworks used to structure
the tools for explainability. Among discussing concrete assignments, we will
also discuss ways to structure potential assignments to best help students
learn to use explainability as a tool alongside any given machine learning
application.
  Data science professionals completing the course will have a birds-eye view
of a rapidly developing area and will be confident to deploy machine learning
more widely. A preliminary analysis on the effectiveness of a recently
delivered course following the structure presented here is included as evidence
supporting our pedagogical approach.
","[{""version"":""v1"",""created"":""Mon, 21 Feb 2022 16:15:57 GMT""}]","2022-02-22"
"2202.10340","Bernhard Meister","Bernhard K. Meister, Henry C.W. Price","Darwin Among the Cryptocurrencies","7 pages, 3 figures",,,,"q-fin.PM","http://creativecommons.org/licenses/by-nc-nd/4.0/","  The paper highlights some commonalities between the development of
cryptocurrencies and the evolution of ecosystems. Concepts from evolutionary
finance embedded in toy models consistent with stylized facts are employed to
understand what survival of the fittest means in cryptofinance. Stylized facts
for ownership, trading volume and market capitalization of cryptocurrencies are
selectively presented in terms of scaling laws.
","[{""version"":""v1"",""created"":""Mon, 21 Feb 2022 16:26:38 GMT""}]","2022-02-22"
"2202.10342","Pietro Steiner","Pietro Steiner, Saqeeb Adnan, Muhammed Said Ergoktas, Julien Barrier,
  Xiaoxiao Yu, Vicente Orts, Gokhan Bakan, Jonathan Aze, Yury Malevich, Kaiyuan
  Wang, Pietro Cataldi, Mark Bisset, Sinan Balci, Sefik Suzer, Marat Khafizov,
  Coskun Kocabas","Electrically controlled heat transport in multilayer graphene","14 pages, 5 figures",,,,"cond-mat.mtrl-sci physics.app-ph","http://arxiv.org/licenses/nonexclusive-distrib/1.0/","  The ability to control heat transport with electrical signals has been an
outstanding challenge due to the lack of efficient electrothermal materials.
Previous attempts have mainly concentrated on phase-change and layered
materials and encountered various problems such as low thermal conductivities
and modest on/off ratios. Here, we demonstrate a graphene-based electrothermal
switch enabling electrically tuneable heat flow. The device uses reversible
electro-intercalation of ions to modulate the in-plane thermal conductivity of
graphene film by over thirteen-fold via electrically tuneable phonon
scattering. We anticipate that our results could provide a realistic pathway
for adaptive thermal transport enabling a new class of electrically driven
thermal devices which would find a broad spectrum of applications in aerospace
and microelectronics.
","[{""version"":""v1"",""created"":""Mon, 21 Feb 2022 16:28:13 GMT""}]","2022-02-22"
"2202.10343","Giancarlo Ferrera","Stefano Camarda, Leandro Cieri, Giancarlo Ferrera and Jesus
  Urtasun-Elizari","Higgs boson production at the LHC: fast and precise predictions in QCD
  at higher orders","12 pages, 5 figures",,"10.1140/epjc/s10052-022-10436-4",,"hep-ph hep-ex","http://arxiv.org/licenses/nonexclusive-distrib/1.0/","  We present a new numerical program, HTurbo, which provides fast and
numerically precise predictions for Higgs boson production cross sections. The
present version of the code implements the perturbative QCD expansion up to the
next-to-next-to-leading order also combined with the resummation of the large
logarithmic corrections at small transverse momenta up to
next-to-next-to-leading logarithmic accuracy and it includes the Higgs boson
production through gluon fusion and decay in two photons with the full
dependence on the final-state kinematics. Arbitrary kinematical cuts can be
applied to the final states in order to obtain fiducial cross sections and
associated kinematical distributions. We present a benchmark comparison with
the predictions obtained with the numerical programs HRes and HNNLO programs
for which HTurbo represents an improved reimplementation.
","[{""version"":""v1"",""created"":""Mon, 21 Feb 2022 16:29:21 GMT""}]","2022-06-15"
"2202.10344","Dario Sansone","Sonia Oreffice and Dario Sansone","Commuting to work and gender-conforming social norms: evidence from
  same-sex couples","arXiv admin note: text overlap with arXiv:2107.06210",,,,"econ.GN q-fin.EC","http://arxiv.org/licenses/nonexclusive-distrib/1.0/","  We analyze work commute time by sexual orientation of partnered or married
individuals, using the American Community Survey 2008-2019. Women in same-sex
couples have a longer commute to work than working women in different-sex
couples, whereas the commute to work of men in same-sex couples is shorter than
the one of working men in different-sex couples, also after controlling for
demographic characteristics, partner characteristics, location, fertility, and
marital status. These differences are particularly stark among married couples
with children: on average, about 3 minutes more one-way to work for married
mothers in same-sex couples, and almost 2 minutes less for married fathers in
same-sex couples, than their corresponding working parents in different-sex
couples. These gaps among men and women amount to 50 percent, and 100 percent,
respectively, of the gender commuting gap estimated in the literature.
Within-couple gaps in commuting time are also significantly smaller in same-sex
couples. We interpret these differences as evidence that it is
gender-conforming social norms boosted by parenthood that lead women in
different-sex couples to specialize into jobs with a shorter commute while
their male partners or spouses hold jobs with a longer commute.
","[{""version"":""v1"",""created"":""Mon, 21 Feb 2022 16:29:47 GMT""}]","2022-02-22"
"2202.10345","Forrest Mozer Professor","Forrest Mozer, Stuart Bale, Cynthia Cattell, Jasper Halekas, Ivan
  Vasko, Jae Verniero, and Paul Kellogg","Core Electron Heating By Triggered Ion Acoustic Waves In The Solar Wind","12 pages, 6 figures. arXiv admin note: substantial text overlap with
  arXiv:2111.07161",,"10.3847/2041-8213/ac5520",,"astro-ph.SR physics.plasm-ph physics.space-ph","http://creativecommons.org/licenses/by/4.0/","  Perihelion passes on Parker Solar Probe orbits six through nine have been
studied to show that solar wind core electrons emerged from 15 solar radii with
a temperature of 55 plus or minus 5 eV, independent of the solar wind speed
which varied from 300 to 800 km/sec. After leaving 15 solar radii and in the
absence of triggered ion acoustic waves at greater distances, the core electron
temperature varied with radial distance, R, in solar radii, as 1900R-4/3
electron volts because of cooling produced by the adiabatic expansion. The
coefficient, 1900, reproduces the minimum core electron perpendicular
temperature observed during the 25 days of observation. In the presence of
triggered ion acoustic waves, the core electrons were isotropically heated as
much as a factor of two above the minimum temperature, 1900R-4/3 eV. Triggered
ion acoustic waves were the only waves observed in coincidence with the
electron core heating. They are the dominant wave mode at frequencies greater
than 100 Hz at solar distances between 15 and 30 solar radii.
","[{""version"":""v1"",""created"":""Mon, 21 Feb 2022 16:30:35 GMT""}]","2022-03-14"
"2202.10346","Leonard Bruns","Leonard Bruns, Patric Jensfelt","On the Evaluation of RGB-D-based Categorical Pose and Shape Estimation","17 pages, 8 figures, submitted to IAS-17",,,,"cs.CV cs.RO","http://arxiv.org/licenses/nonexclusive-distrib/1.0/","  Recently, various methods for 6D pose and shape estimation of objects have
been proposed. Typically, these methods evaluate their pose estimation in terms
of average precision, and reconstruction quality with chamfer distance. In this
work we take a critical look at this predominant evaluation protocol including
metrics and datasets. We propose a new set of metrics, contribute new
annotations for the Redwood dataset and evaluate state-of-the-art methods in a
fair comparison. We find that existing methods do not generalize well to
unconstrained orientations, and are actually heavily biased towards objects
being upright. We contribute an easy-to-use evaluation toolbox with
well-defined metrics, method and dataset interfaces, which readily allows
evaluation and comparison with various state-of-the-art approaches (see
https://github.com/roym899/pose_and_shape_evaluation ).
","[{""version"":""v1"",""created"":""Mon, 21 Feb 2022 16:31:18 GMT""}]","2022-02-22"
"2202.10348","Kenneth Leerbeck","Kenneth Leerbeck, Peder Bacher, Christian Heerup, Henrik Madsen","Estimation of Evaporator Valve Sizes in Supermarket Refrigeration
  Cabinets","Submitted to ""Journal of Process Control""",,,,"eess.SY cs.SY stat.AP","http://arxiv.org/licenses/nonexclusive-distrib/1.0/","  In many applications, e.g. fault diagnostics and optimized control of
supermarket refrigeration systems, it is important to determine the heat demand
of the cabinets. This can easily be achieved by measuring the mass flow through
each cabinet, however, that is expensive and not feasible in large-scale
deployments. Therefore it is important to be able to estimate the valve sizes
from the monitoring data, which is typically measured. The valve size is
measured by an area, which can be used to calculate mass flow through the valve
-- this estimated value is referred to as the valve constant. A novel method
for estimating the cabinet evaporator valve constants is proposed in the
present paper. It is demonstrated using monitoring data from a refrigeration
system in a supermarket consisting of data sampled at a one-minute sampling
rate, however it is shown that a sampling time of around 10-20 minutes is
adequate for the method. Through thermodynamic analysis of a two-stage CO2
refrigeration system, a linear regression model for estimating valve constants
was developed using time series data. The linear regression requires that
transient dynamics are not present in the data, which depends on multiple
factors e.g. the sampling time. If dynamics are not modeled it can be detected
by a significant auto-correlation of the residuals. In order to include the
dynamics in the model, an Auto-Regressive Moving Average model with eXogenous
variables (ARMAX) was applied, and it is shown how it effectively eliminates
the auto-correlation and provides more unbiased estimates, as well as improved
the accuracy estimates. Furthermore, it is shown that the sample time has a
huge impact on the valve estimates. Thus, a method for selecting the optimal
sampling time is introduced. It works individually for each of the evaporators,
by exploring their respective frequency spectrum.
","[{""version"":""v1"",""created"":""Mon, 21 Feb 2022 16:34:18 GMT""}]","2022-02-22"
"2202.10349","Lionel Blatter","Lionel Blatter, Nikolai Kosmatov, Virgile Prevosto, Pascale Le Gall","Certified Verification of Relational Properties",,,,,"cs.SE","http://creativecommons.org/licenses/by/4.0/","  The use of function contracts to specify the behavior of functions often
remains limited to the scope of a single function call. Relational properties
link several function calls together within a single specification. They can
express more advanced properties of a given function, such as non-interference,
continuity, or monotonicity. They can also relate calls to different functions,
for instance, to show that an optimized implementation is equivalent to its
original counterpart. However, relational properties cannot be expressed and
verified directly in the traditional setting of modular deductive verification.
Self-composition has been proposed to overcome this limitation, but it requires
complex transformations and additional separation hypotheses for real-life
languages with pointers. We propose a novel approach that is not based on code
transformation and avoids those drawbacks. It directly applies a verification
condition generator to produce logical formulas that must be verified to ensure
a given relational property. The approach has been fully formalized and proved
sound in the Coq proof assistant.
","[{""version"":""v1"",""created"":""Mon, 21 Feb 2022 16:37:17 GMT""},{""version"":""v2"",""created"":""Tue, 22 Feb 2022 13:04:01 GMT""},{""version"":""v3"",""created"":""Tue, 17 May 2022 11:47:05 GMT""}]","2022-05-18"
"2202.10350","Willian S. Panni","Rui M. P. Almeida, Jos\'e C. M. Duque, Jorge Ferreira, and Willian S.
  Panni","Mixed finite element method for a beam equation with the p-biharmonic
  operator",,,,,"math.NA cs.NA math.AP","http://creativecommons.org/licenses/by-nc-sa/4.0/","  In this paper, we consider a nonlinear beam equation with the p-biharmonic
operator, where $1 < p < \infty$. Using a change of variable, we transform the
problem into a system of differential equations and prove the existence,
uniqueness and regularity of the weak solution by applying the Lax-Milgram
theorem and classical results of functional analysis. We investigate the
discrete formulation for that system and, with the aid of the Brouwer theorem,
we show that the problem has a discrete solution. The uniqueness and stability
of the discrete solution are obtained through classical methods. After
establishing the order of convergence, we apply the mixed finite element method
to obtain an algebraic system of equations. Finally, we implement the
computational codes in Matlab software and perform the comparison between
theory and simulations.
","[{""version"":""v1"",""created"":""Mon, 21 Feb 2022 16:40:32 GMT""}]","2022-02-22"
"2202.10351","Ernesto Perez-Chavela Prof","Toshiaki Fujiwara, Ernesto Perez-Chavela","Three-body relative equilibria on $\mathbb{S}^2$ I: Euler configurations","34 pages",,,,"math.CA","http://arxiv.org/licenses/nonexclusive-distrib/1.0/","  Using the properties of the angular momentum, we develop a new geometrical
technique to study relative equilibria for a system of $3$--bodies with
positive masses, moving on the two sphere under the influence of an attractive
potential depending only on the mutual distances among the bodies. With the
above techniques we do an analysis of the relative equilibria for the case of
three bodies when they are moving on the same geodesic (Euler configurations).
","[{""version"":""v1"",""created"":""Mon, 21 Feb 2022 16:41:29 GMT""}]","2022-02-22"
