"2204.01003","Ba-Phuc Huynh","Ba-Phuc Huynh and Joonbum Bae","Impact Intensity Estimation of a Quadruped Robot without Using a Force
  Sensor","11 pages, 8 figures, 2 tables. The video is available at
  https://www.vinabot.com/2022/04/impact-intensity-estimation-of.html",,,,"cs.RO cs.SY eess.SY","http://creativecommons.org/licenses/by/4.0/","  Estimating the impact intensity is one of the significant tasks of the legged
robot. Accurate feedback of the impact may support the robot to plan a suitable
and efficient trajectory to adapt to unknown complex terrains. Ordinarily, this
task is performed by a force sensor in the robot's foot. In this letter, an
impact intensity estimation without using a force sensor is proposed. An
artificial neural network model is designed to predict the motor torques of the
legs in an instantaneous position in the trajectory without utilizing the
complex kinematic and dynamic models of motion. An unscented Kalman filter is
used during the trajectory to smooth and stabilize the measurement. Based on
the difference between the predicted information and the filtered value, the
state and intensity of the robot foot's impact with the obstacles are
estimated. The simulation and experiment on a quadruped robot are carried out
to verify the effectiveness of the proposed method.
","[{""version"":""v1"",""created"":""Sun, 3 Apr 2022 05:57:07 GMT""}]","2022-04-05"
"2204.01004","Zhilin Huang","Zhilin Huang, Chujun Qin, Zhenyu Weng and Yuesheng Zhu","Region-aware Attention for Image Inpainting",,,,,"cs.CV","http://creativecommons.org/licenses/by/4.0/","  Recent attention-based image inpainting methods have made inspiring progress
by modeling long-range dependencies within a single image. However, they tend
to generate blurry contents since the correlation between each pixel pairs is
always misled by ill-predicted features in holes. To handle this problem, we
propose a novel region-aware attention (RA) module. By avoiding the directly
calculating corralation between each pixel pair in a single samples and
considering the correlation between different samples, the misleading of
invalid information in holes can be avoided. Meanwhile, a learnable region
dictionary (LRD) is introduced to store important information in the entire
dataset, which not only simplifies correlation modeling, but also avoids
information redundancy. By applying RA in our architecture, our methodscan
generate semantically plausible results with realistic details. Extensive
experiments on CelebA, Places2 and Paris StreetView datasets validate the
superiority of our method compared with existing methods.
","[{""version"":""v1"",""created"":""Sun, 3 Apr 2022 06:26:22 GMT""}]","2022-04-05"
"2204.01005","Sung Hwan Mun","Sung Hwan Mun, Jee-weon Jung, Min Hyun Han, and Nam Soo Kim","Frequency and Multi-Scale Selective Kernel Attention for Speaker
  Verification","Accepted by IEEE SLT 2022. 7 pages, 4 figures, 1 table. Code is
  available at https://github.com/msh9184/ska-tdnn.git",,,,"eess.AS cs.AI","http://arxiv.org/licenses/nonexclusive-distrib/1.0/","  The majority of recent state-of-the-art speaker verification architectures
adopt multi-scale processing and frequency-channel attention mechanisms.
Convolutional layers of these models typically have a fixed kernel size, e.g.,
3 or 5. In this study, we further contribute to this line of research utilising
a selective kernel attention (SKA) mechanism. The SKA mechanism allows each
convolutional layer to adaptively select the kernel size in a data-driven
fashion. It is based on an attention mechanism which exploits both frequency
and channel domain. We first apply existing SKA module to our baseline. Then we
propose two SKA variants where the first variant is applied in front of the
ECAPA-TDNN model and the other is combined with the Res2net backbone block.
Through extensive experiments, we demonstrate that our two proposed SKA
variants consistently improves the performance and are complementary when
tested on three different evaluation protocols.
","[{""version"":""v1"",""created"":""Sun, 3 Apr 2022 06:26:50 GMT""},{""version"":""v2"",""created"":""Mon, 25 Jul 2022 02:20:18 GMT""},{""version"":""v3"",""created"":""Mon, 10 Oct 2022 15:02:10 GMT""},{""version"":""v4"",""created"":""Wed, 12 Oct 2022 04:39:27 GMT""}]","2022-10-13"
"2204.01006","Se-Hang Cheong","Se-Hang Cheong, Yain-Whar Si","Force-directed algorithms for schematic drawings and placement: A survey",,,,,"cs.CG cs.NI","http://arxiv.org/licenses/nonexclusive-distrib/1.0/","  Force-directed algorithms have been developed over the last 50 years and used
in many application fields, including information visualisation, biological
network visualisation, sensor networks, routing algorithms, scheduling, and
graph drawing. Our survey provides a comprehensive summary of developments and
a full roadmap for state-of-the-art force-directed algorithms in schematic
drawings and placement. We classified the model of force-directed algorithms
into classical and hybrid. The classical force-directed algorithms are further
classified as follows: (a) accumulated force models, (b) energy function
minimisation models and (c) combinatorial optimisation models. The hybrid
force-directed algorithms are classified as follows: (a) parallel and hardware
accelerated models, (b) multilevel force-directed models and (c)
multidimensional scaling force-directed algorithms. Five categories of
application domains in which force-directed algorithms have been adopted for
schematic drawings and placement are also summarised: (a) aesthetic drawings
for general networks, (b) component placement and scheduling in high-level
synthesis of very-large-scale integration circuits design, (c) information
visualisation, (d) biological network visualisation and (e) node placement and
localisation for sensor networks.
","[{""version"":""v1"",""created"":""Sun, 3 Apr 2022 06:32:47 GMT""}]","2022-04-05"
"2204.01007","Yun Zhi Du","Yun-Zhi Du, Huai-Fan Li, Fang Liu, Li-Chun Zhang","Photon orbits and phase transition for Non-Linear charged Anti-de Sitter
  black holes",,"J. High Energ. Phys. 2023, 137 (2023)","10.1007/JHEP01(2023)137",,"hep-th","http://creativecommons.org/licenses/by/4.0/","  In this work, we investigate the relationship between the photon sphere
radius and the first-order phase transition for the charged EPYM AdS black
hole. Through the analysis, we find with a certain condition there exist the
non-monotonic behaviors between the photon sphere radius, the impact parameter,
the non-linear YM charge parameter, temperature, and pressure. And both the
changes of photon sphere radius and impact parameter before and after phase
transition can be regarded as the order parameter, their critical exponents
near the critical point are equal to the same value $1/2$, just like the
ordinary thermal systems. These indicate that there maybe exists a universal
relationship of gravity nearby the critical point for a black hole
thermodynamical system. Furthermore, the effect of impact parameter on the
deflect angle is also investigated.
","[{""version"":""v1"",""created"":""Sun, 3 Apr 2022 06:44:10 GMT""},{""version"":""v2"",""created"":""Tue, 7 Jun 2022 06:12:49 GMT""}]","2023-02-01"
"2204.01008","Bernhard Heim","Bernhard Heim, Markus Neuhauser and Robert Troeger","Tur\'an inequalities from Chebyshev to Laguerre polynomials",,,,,"math.CA math.NT","http://creativecommons.org/licenses/by/4.0/","  Let $g$ and $h$ be real-valued arithmetic functions, positive and normalized.
Specific choices within the following general scheme of recursively defined
polynomials \begin{equation*} P_n^{g,h}(x):= \frac{x}{h(n)} \sum_{k=1}^{n} g(k)
\, P_{n-k}^{g,h}(x), \end{equation*} with initial value $P_{0}^{g,h}(x)=1$
encode information about several classical, widely studied polynomials. This
includes Chebyshev polynomials of the second kind, associated Laguerre
polynomials, and the Nekrasov--Okounkov polynomials. In this paper we prove
that for $g(n)=n$ and fixed $h$ we obtain orthogonal polynomial sequences for
positive definite functionals. Let $h(n)=n^s$ with $0 \leq s \leq 1 $. Then the
sequence satisfies Tur\'an inequalities for $x \geq 0$.
","[{""version"":""v1"",""created"":""Sun, 3 Apr 2022 06:50:49 GMT""}]","2022-04-05"
"2204.01009","Sepideh Shafiei","Sepideh Shafiei and S. Hakam","A Computational Analysis of Pitch Drift in Unaccompanied Solo Singing
  using DBSCAN Clustering",,,,,"cs.SD cs.LG cs.MM eess.AS","http://creativecommons.org/licenses/by/4.0/","  Unaccompanied vocalists usually change the tuning unintentionally and end up
with a higher or lower pitch than the starting point during a long performance.
This phenomenon is called pitch drift, which is dependent on various elements,
such as the skill of the performer, and the length and difficulty of the
performance. In this paper, we propose a computational method for measuring
pitch drift in the course of an unaccompanied vocal performance, using pitch
histogram and DBSCAN clustering.
","[{""version"":""v1"",""created"":""Sun, 3 Apr 2022 06:54:13 GMT""}]","2022-04-05"
"2204.01010","Amitesh Omar","A. Omar (ARIES, Nainital, India)","Odd Radio Circles as supernovae remnants in the intragroup medium","5 pages, 0 figures or tables, R1 submitted version MNRAS Letters",,"10.1093/mnrasl/slac038",,"astro-ph.GA astro-ph.CO","http://creativecommons.org/licenses/by/4.0/","  A measurable fraction ($\sim8$ per cent) of recently discovered arcmin-size
circular diffuse radio sources termed as Odd Radio Circles or ORCs can be
supernovae remnants in the intragroup medium, within the local group and its
immediate neighbour groups of galaxies. This estimate is based on the optical
detection rate of the intragroup supernovae events in the nearby ($z \sim
0.1-0.2$) galaxy groups. A rate of about 5400 intragroup supernovae per million
year is expected within the local and its immediate neighbour groups of
galaxies. For a radio detectability period of about $10^{4}$ years, on average
1.3 intragroup medium supernovae remnants per 1000 square degree are expected
to be detected in the radio surveys with a sensitivity that led to discovery of
ORCs. The angular size, surface brightness and radio flux of the supernova
remnants up to a distance of $\sim3$ Mpc in the intragroup medium can be
expected to be similar to the five known ORCs. The intragroup supernovae
remnants are not residing in the dense and cold interstellar medium of the
galaxies but evolving in low density ($10^{-4}-10^{-5}$ cm$^{-3}$) warm medium
($10^{5}-10^{6}$ K) in galactic halos or beyond, and may find their progenitors
in the diffuse stellar light associated with various tidal streamers
surrounding the Milky-Way and other nearby galaxies.
","[{""version"":""v1"",""created"":""Sun, 3 Apr 2022 07:07:07 GMT""}]","2022-04-12"
"2204.01011","Tian-Yuan Huang","Tian-Yuan Huang, Yi-Fei Liu, Yuan-Chen Wang, Hai-Qing Guo, Jun Ma, Bin
  Zhao","Eddy Covariance: A Scientometric Review (1981-2018)",,,,,"cs.DL stat.AP","http://creativecommons.org/licenses/by/4.0/","  The history of eddy covariance (EC) measuring system could be dated back to
100 years ago, but it was not until the recent decades that EC gains popularity
and being widely used in global change ecological studies, with explosion of
related work published in papers from various journals. Investigating 8297
literature related with EC from 1981 to 2018, we make a comprehensive and
critical review of scientific development of EC from a scientometric
perspective. First, the paper outlines general bibliometric statistics,
including publication number, country contribution, productive institutions,
active authors, journal distribution, highly cited articles and fund support,
to provide an informative picture of EC studies. Second, research trends are
revealed by network visualization and modeling based on keyword analysis, from
where we could discover the knowledge structure of EC and detect the research
focus and hotspots transitions at different periods. Third, collaboration in EC
research community has been explored. FLUXNET is the largest global network
uniting EC researchers, here we have quantified and evaluated its performance
by using bibliometric indicators of cooperation and citation. Specific
discussions have been given to the historical development of EC, including
technical maturation and application promotion. Considering the current barrier
for collaboration, the review closes by analyzing the reasons hindering data
sharing and makes a prospect of new models for data-intensive collaboration in
the future.
","[{""version"":""v1"",""created"":""Sun, 3 Apr 2022 07:15:42 GMT""},{""version"":""v2"",""created"":""Tue, 5 Apr 2022 02:33:53 GMT""}]","2022-04-06"
"2204.01012","Zhuo Falin","Zhuo Falin, Liu Haihua and Pan Ning","Gastrointestinal Polyps and Tumors Detection Based on Multi-scale
  Feature-fusion with WCE Sequences",,,,,"eess.IV cs.CV","http://arxiv.org/licenses/nonexclusive-distrib/1.0/","  Wireless Capsule Endoscopy(WCE) has been widely used for the screening of
gastrointestinal(GI) diseases, especially the small intestine, due to its
advantages of non-invasive and painless imaging of the entire digestive
tract.However, the huge amount of image data captured by WCE makes manual
reading a process that requires a huge amount of tasks and can easily lead to
missed detection and false detection of lesions.Therefore, In this paper, we
propose a \textbf{T}wo-stage \textbf{M}ulti-scale \textbf{F}eature-fusion
learning network(\textbf{TMFNet}) to automatically detect small intestinal
polyps and tumors in WCE image sequences. Specifically, TMFNet consists of
lesion detection network and lesion identification network. Among them, the
former improves the feature extraction module and detection module based on the
traditional Faster R-CNN network, and readjusts the parameters of the anchor in
the region proposal network(RPN) module;the latter combines residual structure
and feature pyramid structure are used to build a small intestinal lesion
recognition network based on feature fusion, for reducing the false positive
rate of the former and improve the overall accuracy.We used 22,335 WCE images
in the experiment, with a total of 123,092 lesion regions used to train the
detection framework of this paper. In the experiment, the detection framework
is trained and tested on the real WCE image dataset provided by the hospital
gastroenterology department. The sensitivity, false positive and accuracy of
the final model on the RPM are 98.81$\%$, 7.43$\%$ and 92.57$\%$,
respectively.Meanwhile,the corresponding results on the lesion images were
98.75$\%$, 5.62$\%$ and 94.39$\%$. The algorithm model proposed in this paper
is obviously superior to other detection algorithms in detection effect and
performance
","[{""version"":""v1"",""created"":""Sun, 3 Apr 2022 07:24:50 GMT""}]","2022-04-05"
"2204.01013","Julian Mak","Eyal Heifetz, Leo R. M. Maas, Julian Mak","Zero absolute vorticity plane Couette flow as an hydrodynamic
  representation of quantum energy states under perpendicular magnetic field","17 pages, 3 figures; preprint version here; published in Physics of
  Fluids","Physics of Fluids 33, 127120 (2021)","10.1063/5.0075911",,"physics.flu-dyn quant-ph","http://creativecommons.org/licenses/by/4.0/","  Here we extend the Madelung transformation of the Schr\""{o}dinger equation
into a fluid-like form to include the influence of an external electromagnetic
field on a charged particle. The vorticity of the Madelung fluid is then in the
opposite direction to the imposed magnetic field and equal in magnitude to the
cyclotron angular frequency. When the particle motion is confined to a plane,
perpendicular to an imposed magnetic field, the equivalent flow dynamics is
that of zero absolute vorticity obtained in a quasi 2D rotating frame, where
the cyclotron frequency plays a role equivalent to that of the Coriolis
frequency in a rotating frame. We show how the Landau levels and the extended
modes in the integer quantum Hall effect are all mapped into such zero absolute
vorticity-like plane Couette flows, where the latter exhibit a geostrophic-like
balance between the magnetic force and the gradients of the quantum (Bohm)
potential and the electric force.
","[{""version"":""v1"",""created"":""Sun, 3 Apr 2022 07:27:41 GMT""}]","2022-04-05"
"2204.01014","Abel Lacabanne","Nicolas Jacon and Abel Lacabanne","On Calogero-Moser cellular characters for imprimitive complex reflection
  groups","19 pages, comments welcome",,,,"math.RT math.QA","http://arxiv.org/licenses/nonexclusive-distrib/1.0/","  We study the relationship between Calogero-Moser cellular characters and
characters defined from vectors of a Fock space of type $A_{\infty}$. Using
this interpretation, we show that Lusztig's constructible characters of the
Weyl group of type $B$ are sums of Calogero-Moser cellular characters. We also
give an explicit construction of the character of minimal $b$-invariant of a
given Calogero-Moser family of the complex reflection group $G(l,1,n)$.
","[{""version"":""v1"",""created"":""Sun, 3 Apr 2022 07:29:05 GMT""}]","2022-04-05"
"2204.01015","Salvatore Capozziello","Salvatore Capozziello and Rocco D'Agostino","Model-independent reconstruction of $f(Q)$ non-metric gravity","6 pages, 2 figures, accepted for publication in Physics Letters B",,"10.1016/j.physletb.2022.137229",,"gr-qc astro-ph.CO hep-th","http://arxiv.org/licenses/nonexclusive-distrib/1.0/","  We consider gravity mediated by non-metricity, with vanishing curvature and
torsion. The gravitational action, including an arbitrary function of the
non-metric scalar, is investigated in view of characterizing the dark energy
effects. In particular, we present a method to reconstruct the $f(Q)$ action
without resorting to \emph{a priori} assumptions on the cosmological model. To
this purpose, we adopt a method based on rational Pad\'e approximations, which
provides a stable behaviour of the cosmographic series at high redshifts,
alleviating the convergence issues proper of the standard approach. We thus
describe how to reconstruct $f(Q)$ through a numerical inversion procedure
based on the current observational bounds on cosmographic parameters. Our
analysis suggests that the best approximation for describing the accelerated
expansion of the universe is represented by a scenario with $f(Q)=\alpha+\beta
Q^{n}$. Finally, possible deviations from the standard $\Lambda$CDM model are
discussed.
","[{""version"":""v1"",""created"":""Sun, 3 Apr 2022 07:29:54 GMT""},{""version"":""v2"",""created"":""Sun, 5 Jun 2022 10:54:49 GMT""}]","2022-07-13"
"2204.01016","Joel Ruben Antony Moniz","Joel Ruben Antony Moniz, Barun Patra, Matthew R. Gormley","On Efficiently Acquiring Annotations for Multilingual Models","ACL 2022 (Short Paper)",,,,"cs.CL cs.LG","http://arxiv.org/licenses/nonexclusive-distrib/1.0/","  When tasked with supporting multiple languages for a given problem, two
approaches have arisen: training a model for each language with the annotation
budget divided equally among them, and training on a high-resource language
followed by zero-shot transfer to the remaining languages. In this work, we
show that the strategy of joint learning across multiple languages using a
single model performs substantially better than the aforementioned
alternatives. We also demonstrate that active learning provides additional,
complementary benefits. We show that this simple approach enables the model to
be data efficient by allowing it to arbitrate its annotation budget to query
languages it is less certain on. We illustrate the effectiveness of our
proposed method on a diverse set of tasks: a classification task with 4
languages, a sequence tagging task with 4 languages and a dependency parsing
task with 5 languages. Our proposed method, whilst simple, substantially
outperforms the other viable alternatives for building a model in a
multilingual setting under constrained budgets.
","[{""version"":""v1"",""created"":""Sun, 3 Apr 2022 07:42:13 GMT""}]","2022-04-05"
"2204.01017","Md Abdul Khan PhD","M. Hasan and Md. A. Khan","Resonance energy and wave functions of $^{31}$Ne: a calculation using
  supersymmetric quantum mechanics","11 Pages, 3 Tables, 5 Figures",,,,"nucl-th","http://creativecommons.org/licenses/by/4.0/","  In this communication, we present an efficient method for computation of
energy and wave function of weakly bound nuclei by the application of
supersymmetric quantum mechanics (SSQM) and bound states in continuum (BIC)
technique. As a case study the scheme is implemented to the two-body ($^{30}$Ne
+ n) cluster model calculation of neutron-rich nucleus $^{31}$Ne. Woods-Saxon
central potential with spin-orbit component is used as the core-nucleon
interaction. The two-body Schr\""{o}dinger equation in relative coordinate is
solved numerically to get the energy and wave function of the low-lying bound
states. A one-parameter family of isospectral potential (IP) is constructed
from the bound state solutions following algebra of SSQM to find energies and
wave functions of the resonance states. In addition to the 2p$_{3/2^-}$ (-0.33
MeV) ground state, two bound excited states: s$_{1/2}$ (-0.30 MeV), $p_{1/2}$
(-0.15 MeV) are also obtained. Few low-lying resonance states: f$_{7/2_1}$
(2.57 MeV), f$_{7/2_2}$ (4.59 MeV), f$_{5/2_1}$ (5.58 MeV), p$_{1/2_1}$(1.432
MeV), p$_{1/2_2}$ (4.165 MeV), p$_{3/2_1}$ (1.431 MeV), p$_{3/2_2}$ (4.205 MeV)
are predicted. Among the predicted resonance states, the f$_{7/2^{-}}$ state
having resonance energy $E_R \simeq 4.59$ MeV is in excellent agreement with
the one found in the literature.
","[{""version"":""v1"",""created"":""Sun, 3 Apr 2022 07:47:29 GMT""}]","2022-04-05"
"2204.01018","Sixun Dong","Huazhang Hu, Sixun Dong, Yiqun Zhao, Dongze Lian, Zhengxin Li,
  Shenghua Gao","TransRAC: Encoding Multi-scale Temporal Correlation with Transformers
  for Repetitive Action Counting","(Revised) CVPR 2022 Oral. RepCount dataset:
  https://svip-lab.github.io/dataset/RepCount_dataset.html , Code:
  https://github.com/SvipRepetitionCounting/TransRAC",,,,"cs.CV","http://arxiv.org/licenses/nonexclusive-distrib/1.0/","  Counting repetitive actions are widely seen in human activities such as
physical exercise. Existing methods focus on performing repetitive action
counting in short videos, which is tough for dealing with longer videos in more
realistic scenarios. In the data-driven era, the degradation of such
generalization capability is mainly attributed to the lack of long video
datasets. To complement this margin, we introduce a new large-scale repetitive
action counting dataset covering a wide variety of video lengths, along with
more realistic situations where action interruption or action inconsistencies
occur in the video. Besides, we also provide a fine-grained annotation of the
action cycles instead of just counting annotation along with a numerical value.
Such a dataset contains 1,451 videos with about 20,000 annotations, which is
more challenging. For repetitive action counting towards more realistic
scenarios, we further propose encoding multi-scale temporal correlation with
transformers that can take into account both performance and efficiency.
Furthermore, with the help of fine-grained annotation of action cycles, we
propose a density map regression-based method to predict the action period,
which yields better performance with sufficient interpretability. Our proposed
method outperforms state-of-the-art methods on all datasets and also achieves
better performance on the unseen dataset without fine-tuning. The dataset and
code are available.
","[{""version"":""v1"",""created"":""Sun, 3 Apr 2022 07:50:18 GMT""}]","2022-04-05"
"2204.01019","Jiseon Shin","Jiseon Shin, Bheema Lingam Chittari, Yunsu Jang, Hongki Min, and Jeil
  Jung","Nearly flat bands in twisted triple bilayer graphene","15 pages, 10 figures","Phys. Rev. B 105, 245124 (2022)","10.1103/PhysRevB.105.245124",,"cond-mat.mes-hall","http://creativecommons.org/licenses/by/4.0/","  We investigate the electronic structure of alternating-twist triple
Bernal-stacked bilayer graphene (t3BG) as a function of interlayer coupling
$\omega$, twist angle $\theta$, interlayer potential difference $\Delta$, and
top-bottom bilayers sliding vector $\boldsymbol{\tau}$ for three possible
configurations AB/AB/AB, AB/BA/AB, and AB/AB/BA. The parabolic low-energy band
dispersions in a Bernal-stacked bilayer and gap-opening through a finite
interlayer potential difference $\Delta$ allows the flattening of bands in t3BG
down to $\sim 20$~meV for twist angles $\theta \lesssim 2^{\circ}$ regardless
of the stacking types. The easier isolation of the flat bands and associated
reduction of Coulomb screening thanks to the intrinsic gaps of bilayer graphene
for finite $\Delta$ facilitate the formation of correlation-driven gaps when it
is compared to the metallic phases of twisted trilayer graphene under electric
fields. We obtain the stacking dependent Coulomb energy versus bandwidth $U/W
\gtrsim 1$ ratios in the $\theta$ and $\Delta$ parameter space. We also present
the expected $K$-valley Chern numbers for the lowest-energy nearly flat bands.
","[{""version"":""v1"",""created"":""Sun, 3 Apr 2022 07:59:16 GMT""},{""version"":""v2"",""created"":""Mon, 20 Jun 2022 01:47:10 GMT""}]","2022-06-22"
