"2204.00955","Emrah Sariboz","Emrah Sariboz, Gaurav Panwar, Roopa Vishwanathan and Satyajayant Misra","FIRST: FrontrunnIng Resilient Smart ConTracts","16 pages, 5 figures",,,,"cs.CR","http://arxiv.org/licenses/nonexclusive-distrib/1.0/","  Owing to the meteoric rise in the usage of cryptocurrencies, there has been a
widespread adaptation of traditional financial applications such as lending,
borrowing, margin trading, and more, to the cryptocurrency realm. In some
cases, the inherently transparent and unregulated nature of cryptocurrencies
leads to attacks on users of these applications. One such attack is
frontrunning, where a malicious entity leverages the knowledge of currently
unprocessed financial transactions submitted by users and attempts to get its
own transaction(s) executed ahead of the unprocessed ones. The consequences of
this can be financial loss, inaccurate transactions, and even exposure to more
attacks. We propose FIRST, a framework that prevents frontrunning attacks, and
is built using cryptographic protocols including verifiable delay functions and
aggregate signatures. In our design, we have a federated setup for generating
the public parameters of the VDF, thus removing the need for a single trusted
setup. We formally analyze FIRST, prove its security using the Universal
Composability framework and experimentally demonstrate the effectiveness of
FIRST.
","[{""version"":""v1"",""created"":""Sat, 2 Apr 2022 23:30:13 GMT""}]","2022-04-05"
"2204.00956","David Bruns-Smith","David Bruns-Smith","Model-Free and Model-Based Policy Evaluation when Causality is Uncertain","International Conference on Machine Learning. PMLR, 2021",,,,"cs.LG stat.ML","http://creativecommons.org/licenses/by/4.0/","  When decision-makers can directly intervene, policy evaluation algorithms
give valid causal estimates. In off-policy evaluation (OPE), there may exist
unobserved variables that both impact the dynamics and are used by the unknown
behavior policy. These ""confounders"" will introduce spurious correlations and
naive estimates for a new policy will be biased. We develop worst-case bounds
to assess sensitivity to these unobserved confounders in finite horizons when
confounders are drawn iid each period. We demonstrate that a model-based
approach with robust MDPs gives sharper lower bounds by exploiting domain
knowledge about the dynamics. Finally, we show that when unobserved confounders
are persistent over time, OPE is far more difficult and existing techniques
produce extremely conservative bounds.
","[{""version"":""v1"",""created"":""Sat, 2 Apr 2022 23:40:15 GMT""}]","2022-04-05"
"2204.00957","Yumeng Zhang","Yumeng Zhang, Bruno Clerckx","Waveform Design for Wireless Power Transfer with Power Amplifier and
  Energy Harvester Non-Linearities","13 pages, 11 figures",,,,"eess.SP","http://arxiv.org/licenses/nonexclusive-distrib/1.0/","  Waveform optimization has shown its great potential to boost the performance
of far-field wireless power transfer (WPT). Current research has optimized
transmit waveform, adaptive to channel state information (CSI), to maximize the
harvested power in WPT while accounting for energy harvester (EH)'s
non-linearity. However, the existing transmit waveform design disregards the
non-linear high power amplifiers (HPA) at the transmitter. Driven by this, this
paper optimizes the multi-carrier waveform at the input of HPA to maximize the
harvested DC power considering both HPA's and EH's non-linearities. Two
optimization models are formulated based on whether the frequencies of the
multi-carrier waveform are concentrated within the transmit pass band or not.
Analysis and simulations show that, while EH's non-linearity boosts the power
harvesting performance, HPA's non-linearity degrades the harvested power.
Hence, the optimal waveform shifts from multi-carrier that exploits EH's
non-linearity to single-carrier that reduces HPA's detrimental non-linear
distortion as the operational regime of WPT becomes more sensitive to HPA's
non-linearity and less sensitive to EH's non-linearity (and inversely).
Simultaneously, operating towards HPA's non-linear regime by increasing the
input signal power benefits the harvested power since HPA's DC power supply is
better exploited, whereas the end-to-end power transfer efficiency (PTE) might
decrease because of the increasing non-linear degradation. Throughout the
simulations, the proposed waveforms show significant gain over those not
accounting for HPA's non-linearity, especially in frequency-flat channels. We
also compare the two proposed waveforms and show that the severity of HPA's
non-linearity dictates which of the two proposed waveforms is more beneficial.
","[{""version"":""v1"",""created"":""Sat, 2 Apr 2022 23:40:40 GMT""},{""version"":""v2"",""created"":""Wed, 6 Apr 2022 17:20:14 GMT""},{""version"":""v3"",""created"":""Fri, 12 May 2023 02:40:28 GMT""}]","2023-05-15"
"2204.00958","Ruohong Zhang","Ruohong Zhang, Yau-Shian Wang, Yiming Yang, Donghan Yu, Tom Vu, Likun
  Lei","Long-tailed Extreme Multi-label Text Classification with Generated
  Pseudo Label Descriptions",,,,,"cs.LG","http://creativecommons.org/licenses/by/4.0/","  Extreme Multi-label Text Classification (XMTC) has been a tough challenge in
machine learning research and applications due to the sheer sizes of the label
spaces and the severe data scarce problem associated with the long tail of rare
labels in highly skewed distributions. This paper addresses the challenge of
tail label prediction by proposing a novel approach, which combines the
effectiveness of a trained bag-of-words (BoW) classifier in generating
informative label descriptions under severe data scarce conditions, and the
power of neural embedding based retrieval models in mapping input documents (as
queries) to relevant label descriptions. The proposed approach achieves
state-of-the-art performance on XMTC benchmark datasets and significantly
outperforms the best methods so far in the tail label prediction. We also
provide a theoretical analysis for relating the BoW and neural models w.r.t.
performance lower bound.
","[{""version"":""v1"",""created"":""Sat, 2 Apr 2022 23:42:32 GMT""}]","2022-04-05"
"2204.00959","Raymond Maresca","Ray Maresca","Combinatorics of Exceptional Sequences of Type $\tilde{\mathbb{A}}_n$","34 pages, 5 figures, and 2 tables. Added algebraic analogue of
  performing twists on the annulus. Shortened the proof of a key lemma and
  provided algebraic intuition for its statement",,,,"math.RT math.CO","http://creativecommons.org/licenses/by/4.0/","  It is known that there are infinitely many exceptional sequences of quiver
representations for Euclidean quivers. In this paper we study those of type
$\tilde{\mathbb{A}}_n$ and classify them into finitely many parametrized
families. We first give a bijection between exceptional collections and a
combinatorial object known as strand diagrams. We will then realize these
strand diagrams as chord diagrams and then arc diagrams on an annulus. Using
arc diagrams, we will define parametrized families of exceptional collections
and use arc diagrams to show that there are finitely many such families. We
moreover show that these families of exceptional collections are in bijection
with equivalence classes of small arc diagrams. Finally, we provide an
algebraic explanation of parametrized families using the transjective component
of the bounded derived category.
","[{""version"":""v1"",""created"":""Sun, 3 Apr 2022 00:18:35 GMT""},{""version"":""v2"",""created"":""Wed, 27 Jul 2022 18:58:01 GMT""},{""version"":""v3"",""created"":""Tue, 27 Sep 2022 02:04:03 GMT""},{""version"":""v4"",""created"":""Wed, 31 May 2023 20:26:54 GMT""}]","2023-06-02"
"2204.00960","Lior Pachter","Lior Pachter","A decade of molecular cell atlases",,,,,"q-bio.OT","http://creativecommons.org/licenses/by/4.0/","  The recent opinion article ""A decade of molecular cell atlases"" by Stephen
Quake narrates the incredible single-cell genomics technology advances that
have taken place over the last decade, and how they have translated to
increasingly resolved cell atlases. However the sequence of events described is
inaccurate and contains several omissions and errors. The errors are corrected
in this note.
","[{""version"":""v1"",""created"":""Sun, 3 Apr 2022 00:49:54 GMT""}]","2022-04-05"
"2204.00961","Ji Fang","Ji Fang, Vincent CS Lee, Haiyan Wang","Improving Personalised Physical Activity Recommendation on the mHealth
  Information Service Using Deep Reinforcement Learning",,,,,"cs.LG math.OC","http://creativecommons.org/licenses/by/4.0/","  Recently has seen the growth in the use of mobile health (mHealth)
information services, which have rich guides on improving physical activity.
These rich guides evolved from the consideration of various personal
behavioural factors, which often deviate from the user's health conditions. The
behavioural factors include changing fitness preferences, adherence issues, and
uncertainty about future fitness outcomes, which may all lead to a decline in
the quality of the mHealth information services. Many of these mHealth
information services provide limited fitness guidance owing to the dynamics of
the user's health conditions. This paper seeks an adaptive method using deep
reinforcement learning to make personalised physical activity recommendations,
which is learnt from retrospective physical activity data and can simulate
realistic behaviour trajectories. We construct a real-time interaction model
for the mHealth information service system based on scientific knowledge about
physical activity to evaluate its exercise performance. The physical activity
performance evaluation model is used to find the optimal exercise intensity
considering the fitness and fatigue effects to avoid the lack of exercise or
overload. The short-term activity plans are made using deep reinforcement
learning and personal health conditions that change over time. Using this
method, we can dynamically update the physical activity recommendation policy
in accordance with the real implementation behaviour. Our DRL-based recommender
policy was validated by comparison to other benchmark policies. Experimental
results show that this adaptive learning algorithm can improve recommendation
performance over 4.13 percent.
","[{""version"":""v1"",""created"":""Sun, 3 Apr 2022 01:19:20 GMT""},{""version"":""v2"",""created"":""Thu, 4 Aug 2022 05:30:14 GMT""}]","2022-08-05"
"2204.00962","Gaurav Bhatnagar","Gaurav Bhatnagar, Krishnan Rajkumar","Telescoping continued fractions for the error term in Stirling's formula","Comments invited",,,,"math.CA math.NT","http://arxiv.org/licenses/nonexclusive-distrib/1.0/","  In this paper, we introduce telescoping continued fractions to find lower
bounds for the error term $r_n$ in Stirling's approximation $\displaystyle n! =
\sqrt{2\pi}n^{n+1/2}e^{-n}e^{r_n}.$ This improves lower bounds given earlier by
Ces\`{a}ro (1922), Robbins (1955), Nanjundiah (1959), Maria (1965) and Popov
(2017). The expression is in terms of a continued fraction, together with an
algorithm to find successive terms of this continued fraction. The technique we
introduce allows us to experimentally obtain upper and lower bounds for a
sequence of convergents of a continued fraction in terms of a difference of two
continued fractions.
","[{""version"":""v1"",""created"":""Sun, 3 Apr 2022 01:20:45 GMT""}]","2022-04-05"
"2204.00963","Amjed Tahir","Li Sui, Shawn Rasheed, Amjed Tahir, Jens Dietrich","A Study of Single Statement Bugs Involving Dynamic Language Features","Accepted at the 30th IEEE/ACM International Conference on Program
  Comprehension (ICPC 2022) - ERA track",,"10.1145/3524610.3527883",,"cs.SE","http://creativecommons.org/licenses/by/4.0/","  Dynamic language features are widely available in programming languages to
implement functionality that can adapt to multiple usage contexts, enabling
reuse. Functionality such as data binding , object-relational mapping and user
interface builders can be heavily dependent on these features. However, their
use has risks and downsides as they affect the soundness of static analyses and
techniques that rely on such analyses (such as bug detection and automated
program repair). They can also make software more error-prone due to potential
difficulties in understanding reflective code, loss of compile-time safety and
incorrect API usage. In this paper, we set out to quantify some of the effects
of using dynamic language features in Java programs-that is, the
error-proneness of using those features with respect to a particular type of
bug known as single statement bugs. By mining 2,024 GitHub projects, we found
139 single statement bug instances (falling under 10 different bug patterns),
with the highest number of bugs belonging to three specific patterns: Wrong
Function Name, Same Function More Args and Change Identifier Used. These
results can help practitioners to quantify the risk of using dynamic techniques
over alternatives (such as code generation). We hope this classification raises
attention on choosing dynamic APIs that are likely to be error-prone, and
provides developers a better understanding when designing bug detection tools
for such feature.
","[{""version"":""v1"",""created"":""Sun, 3 Apr 2022 01:22:55 GMT""}]","2022-04-05"
"2204.00964","Minchul Kim","Minchul Kim, Anil K. Jain, Xiaoming Liu","AdaFace: Quality Adaptive Margin for Face Recognition","Published in CVPR2022 (Oral)",,,,"cs.CV","http://arxiv.org/licenses/nonexclusive-distrib/1.0/","  Recognition in low quality face datasets is challenging because facial
attributes are obscured and degraded. Advances in margin-based loss functions
have resulted in enhanced discriminability of faces in the embedding space.
Further, previous studies have studied the effect of adaptive losses to assign
more importance to misclassified (hard) examples. In this work, we introduce
another aspect of adaptiveness in the loss function, namely the image quality.
We argue that the strategy to emphasize misclassified samples should be
adjusted according to their image quality. Specifically, the relative
importance of easy or hard samples should be based on the sample's image
quality. We propose a new loss function that emphasizes samples of different
difficulties based on their image quality. Our method achieves this in the form
of an adaptive margin function by approximating the image quality with feature
norms. Extensive experiments show that our method, AdaFace, improves the face
recognition performance over the state-of-the-art (SoTA) on four datasets
(IJB-B, IJB-C, IJB-S and TinyFace). Code and models are released in
https://github.com/mk-minchul/AdaFace.
","[{""version"":""v1"",""created"":""Sun, 3 Apr 2022 01:23:41 GMT""},{""version"":""v2"",""created"":""Thu, 16 Feb 2023 04:09:47 GMT""}]","2023-02-17"
"2204.00965","Hadrian Quan","Hadrian Quan and Gunther Uhlmann","The Calder\'on problem for the fractional Dirac operator",,,,,"math.AP math.DG","http://creativecommons.org/licenses/by/4.0/","  We show that knowledge of the source-to-solution map for the fractional Dirac
operator acting over sections of a Hermitian vector bundle over a smooth closed
connencted Riemannian manifold of dimension $m\geq 2$ determines uniquely the
smooth structure, Riemannian metric, Hermitian bundle and connection, and its
Clifford modulo up to a isometry. We also mention several potential
applications in physics and other fields.
","[{""version"":""v1"",""created"":""Sun, 3 Apr 2022 01:27:00 GMT""}]","2022-04-05"
"2204.00966","Manohar Karigerasi","Manohar H. Karigerasi, Kisung Kang, Jeffrey Huang, Vanessa K.
  Peterson, Kirrily C. Rule, Andrew J. Studer, Andr\'e Schleife, Pinshane Y.
  Huang, Daniel P. Shoemaker","High-resolution diffraction reveals magnetoelastic coupling and coherent
  phase separation in tetragonal CuMnAs","11 pages, 9 figures, added author middle initial, additional text and
  figures in supplementary, and resizing the figures","Phys. Rev. Materials 6, 094405 (2022)","10.1103/PhysRevMaterials.6.094405",,"cond-mat.mtrl-sci","http://creativecommons.org/licenses/by/4.0/","  Tetragonal CuMnAs was the first antiferromagnet where reorientation of the
N\'eel vector was reported to occur by an inverse spin galvanic effect. A
complicating factor in the formation of phase-pure tetragonal CuMnAs is the
formation of an orthorhombic phase with nearly the same stoichiometry.
Pure-phase tetragonal CuMnAs has been reported to require an excess of Cu to
maintain a single phase in traditional solid state synthesis reactions. Here we
show that subtle differences in diffraction patterns signal pervasive
inhomogeneity and phase separation, even in Cu-rich Cu$_{1.18}$Mn$_{0.82}$As.
From calorimetry and magnetometry measurements, we identify two transitions
corresponding to the N\'eel temperature (T$_N$) and an antiferromagnet to weak
ferromagnet transition in Cu$_{1.18}$Mn$_{0.82}$As and
CuMn$_{0.964}$As$_{1.036}$. These transitions have clear crystallographic
signatures, directly observable in the lattice parameters upon in-situ heating
and cooling. The immiscibility and phase separation could arise from a
spinoidal decomposition that occurs at high temperatures, and the presence of a
ferromagnetic transition near room temperature warrants further investigation
of its effect on the electrical switching behavior.
","[{""version"":""v1"",""created"":""Sun, 3 Apr 2022 01:27:11 GMT""},{""version"":""v2"",""created"":""Tue, 5 Apr 2022 05:29:26 GMT""},{""version"":""v3"",""created"":""Sat, 13 Aug 2022 03:14:12 GMT""},{""version"":""v4"",""created"":""Thu, 22 Sep 2022 05:48:03 GMT""}]","2022-09-23"
"2204.00967","Alexander Johnson","Alexander Johnson, Kevin Everson, Vijay Ravi, Anissa Gladney, Mari
  Ostendorf, Abeer Alwan","Automatic Dialect Density Estimation for African American English","5 pages, 2 figures","Interspeech 2022",,,"eess.AS cs.CL cs.SD","http://creativecommons.org/licenses/by/4.0/","  In this paper, we explore automatic prediction of dialect density of the
African American English (AAE) dialect, where dialect density is defined as the
percentage of words in an utterance that contain characteristics of the
non-standard dialect. We investigate several acoustic and language modeling
features, including the commonly used X-vector representation and ComParE
feature set, in addition to information extracted from ASR transcripts of the
audio files and prosodic information. To address issues of limited labeled
data, we use a weakly supervised model to project prosodic and X-vector
features into low-dimensional task-relevant representations. An XGBoost model
is then used to predict the speaker's dialect density from these features and
show which are most significant during inference. We evaluate the utility of
these features both alone and in combination for the given task. This work,
which does not rely on hand-labeled transcripts, is performed on audio segments
from the CORAAL database. We show a significant correlation between our
predicted and ground truth dialect density measures for AAE speech in this
database and propose this work as a tool for explaining and mitigating bias in
speech technology.
","[{""version"":""v1"",""created"":""Sun, 3 Apr 2022 01:34:48 GMT""}]","2022-04-05"
"2204.00968","Salvatore Vitale","Salvatore Vitale, Sylvia Biscoveanu, Colm Talbot","The orientations of the binary black holes in GWTC-3","5 pages, 3 figures, a lot of fun",,,,"gr-qc astro-ph.HE","http://arxiv.org/licenses/nonexclusive-distrib/1.0/","  It is expected that the orbital planes of gravitational-wave (GW) sources are
isotropically distributed. However, both physical and technical factors, such
as alternate theories of gravity with birefringence, catalog contamination, and
search algorithm limitations, could result in inferring a non-isotropic
distribution. Showing that the inferred astrophysical distribution of the
orbital orientations is indeed isotropic can thus be used to rule out some
violations of general relativity, as a null test about the purity of the GW
catalog sample, and as a check that selection effects are being properly
accounted for. We augment the default mass/spins/redshift model used by the
LIGO-Virgo-KAGRA Collaboration in their most recent analysis to also measure
the astrophysical distribution of orbital orientations. We show that the 69
binary black holes in GWTC-3 are consistent with having random orbital
orientations. The inferred distribution is highly symmetric around $\pi/2$,
with skewness $\mathcal{S}_{\rm{post}}=0.01^{+0.17}_{-0.17}$. Meanwhile, the
median of the inferred distribution has a Jensen-Shannon divergence of
$1.4\times 10^{-4}$ bits when compared to the expected isotropic distribution.
","[{""version"":""v1"",""created"":""Sun, 3 Apr 2022 01:38:48 GMT""}]","2022-04-05"
"2204.00969","Wenka Zhu","W. L. Zhen, W. T. Miao, W. L. Zhu, C. J. Zhang, W. K. Zhu","Broadband photoresponse arising from photo-bolometric effect in
  quasi-one-dimensional Ta2Ni3Se8","21 pages, 6 figures and SI",,"10.1088/1361-648X/ac638b",,"cond-mat.mes-hall cond-mat.mtrl-sci physics.optics","http://arxiv.org/licenses/nonexclusive-distrib/1.0/","  In this paper, we report the synthesis of high-quality Ta2Ni3Se8 crystals
free of noble or toxic elements and the fabrication and testing of
photodetectors on the wire samples. A broadband photoresponse from 405 nm to
1550 nm is observed, along with performance parameters including relatively
high photoresponsivity (10 mA W^-1) and specific detectivity (3.5 * 10^7 Jones)
and comparably short response time ({\tau}_rise = 433 ms, {\tau}_decay = 372
ms) for 1064 nm, 0.5 V bias and 1.352 mW mm^-2. Through extensive measurement
and analysis, it is determined that the dominant mechanism for photocurrent
generation is the photo-bolometric effect, which is believed to be responsible
for the very broad spectral detection capability. More importantly, the
pronounced response to 1310 nm and 1550 nm wavelengths manifests its promising
applications in optical communications. Considering the quasi-one-dimensional
structure with layered texture, the potential to build nanodevices on Ta2Ni3Se8
makes it even more important in future electronic and optoelectronic
applications.
","[{""version"":""v1"",""created"":""Sun, 3 Apr 2022 01:51:56 GMT""}]","2022-04-05"
"2204.00970","Krishna Prasad Neupane","Krishna Prasad Neupane, Ervine Zheng, Yu Kong, Qi Yu","A Dynamic Meta-Learning Model for Time-Sensitive Cold-Start
  Recommendations","7 pages, conference",,,,"cs.IR cs.LG","http://arxiv.org/licenses/nonexclusive-distrib/1.0/","  We present a novel dynamic recommendation model that focuses on users who
have interactions in the past but turn relatively inactive recently. Making
effective recommendations to these time-sensitive cold-start users is critical
to maintain the user base of a recommender system. Due to the sparse recent
interactions, it is challenging to capture these users' current preferences
precisely. Solely relying on their historical interactions may also lead to
outdated recommendations misaligned with their recent interests. The proposed
model leverages historical and current user-item interactions and dynamically
factorizes a user's (latent) preference into time-specific and time-evolving
representations that jointly affect user behaviors. These latent factors
further interact with an optimized item embedding to achieve accurate and
timely recommendations. Experiments over real-world data help demonstrate the
effectiveness of the proposed time-sensitive cold-start recommendation model.
","[{""version"":""v1"",""created"":""Sun, 3 Apr 2022 02:04:12 GMT""}]","2022-04-05"
"2204.00971","Takuya Morozumi","Nicholas J. Benoit, Yuta Kawamura, Takuya Morozumi","Time evolution of the lepton number of Majorana neutrinos in the
  Schr\""odinger picture versus Heisenberg picture","10 pages,1 figure,Submitted to the Proceedings of Science,Corfu
  Summer Institute 2021 ""Workshop on Connecting Insights in Fundamental Physics
  the Standard Model and Beyond "" 29 August - 8 September 2021 Corfu,Greece",,,"HUPD2204","hep-ph","http://creativecommons.org/licenses/by/4.0/","  In this paper, we study the time evolution of the expectation value of
Majorana neutrino with the Schr\""odinger picture.The operators with the
definite lepton number and operators with the definite mass are related to each
other by a Bogolyubov transformation. Then the vacuum with the null lepton
number is also related to the vacuum for the massive operator and it is written
by the superposition of the vacuum for massive field and Majorana pairs
condensed states. We choose the state with a definite lepton number $L$ $=1$
and the momentum ${\bf q}\ne 0$ as an initial state. By writing the state in
terms of the superposition of energy eigenstates, we are able to study the time
evolution of the state in the Schr\""odinger picture.The expectation value of
lepton number operator is computed and it reproduces the same result as that
obtained in the corresponding Heisenberg operator.
","[{""version"":""v1"",""created"":""Sun, 3 Apr 2022 02:20:04 GMT""}]","2022-04-05"
