"2204.01054","Laurence Kluge","Laurence Kluge","Combinatorial refinement on circulant graphs","20 pages, 1 figure",,,,"math.CO cs.CC cs.DM","http://arxiv.org/licenses/nonexclusive-distrib/1.0/","  The combinatorial refinement techniques have proven to be an efficient
approach to isomorphism testing for particular classes of graphs. If the number
of refinement rounds is small, this puts the corresponding isomorphism problem
in a low-complexity class. We investigate the round complexity of the
2-dimensional Weisfeiler-Leman algorithm on circulant graphs, i.e. on Cayley
graphs of the cyclic group $\mathbb{Z}_n$, and prove that the number of rounds
until stabilization is bounded by $\mathcal{O}(d(n)\log n)$, where $d(n)$ is
the number of divisors of $n$. As a particular consequence, isomorphism can be
tested in NC for connected circulant graphs of order $p^\ell$ with $p$ an odd
prime, $\ell>3$ and vertex degree $\Delta$ smaller than $p$.
  We also show that the color refinement method (also known as the
1-dimensional Weisfeiler-Leman algorithm) computes a canonical labeling for
every non-trivial circulant graph with a prime number of vertices after
individualization of two appropriately chosen vertices. Thus, the canonical
labeling problem for this class of graphs has at most the same complexity as
color refinement, which results in a time bound of $\mathcal{O}(\Delta n\log
n)$. Moreover, this provides a first example where a sophisticated approach to
isomorphism testing put forward by Tinhofer has a real practical meaning.
","[{""version"":""v1"",""created"":""Sun, 3 Apr 2022 11:41:29 GMT""},{""version"":""v2"",""created"":""Mon, 5 Dec 2022 17:29:46 GMT""}]","2022-12-06"
"2204.01055","Le Ho Bin","Le Bin Ho","Stochastic approach for quantum metrology with generic Hamiltonians","10 pages, 4 figures",,,,"quant-ph","http://creativecommons.org/licenses/by/4.0/","  Recently, variational quantum metrology was proposed for Hamiltonians with
multiplicative parameters, wherein the estimation precision can be optimized
via variational circuits. However, systems with generic Hamiltonians still lack
these variational schemes. This work introduces a quantum-circuit-based
approach for studying quantum metrology with generic Hamiltonians. We present a
time-dependent stochastic parameter-shift rule for the derivatives of evolved
quantum states, whereby the quantum Fisher information can be obtained. The
scheme can be executed in universal quantum computers under the family of
parameterized gates. In magnetic field estimations, we demonstrate the
consistency between the results obtained from the stochastic parameter-shift
rule and the exact results, while the results obtained from a standard
parameter-shift rule slightly deviate from the exact ones. Our work sheds light
on studying quantum metrology with generic Hamiltonians using quantum circuit
algorithms.
","[{""version"":""v1"",""created"":""Sun, 3 Apr 2022 11:46:06 GMT""},{""version"":""v2"",""created"":""Mon, 15 May 2023 01:20:13 GMT""}]","2023-05-16"
"2204.01056","Peter Senger","Peter Senger","Exploring terra incognita in the phase diagram of strongly interacting
  matter -- Experiments at FAIR and NICA","21 pages, 15 figures, ICNFP 21, to be published in Physica Scripta",,,,"nucl-ex nucl-th","http://creativecommons.org/licenses/by/4.0/","  The fundamental properties of dense nuclear matter, as it exists in the core
of massive stellar objects, are still largely unknown. The investigation of the
high-density equation of state (EOS), which determines mass and radii of
neutron stars and the dynamics of neutron star mergers, is in the focus of
astronomical observations and of laboratory experiments with heavy-ion
collisions. Moreover, the microscopic degrees-of-freedom of strongly
interacting matter at high baryon densities are also unknown. While
Quantum-Chromo-Dynamics (QCD) calculations on the lattice find a smooth chiral
crossover between hadronic matter and the quark-gluon plasma for high
temperatures at zero baryon chemical potential, effective models predict a 1st
order chiral transition with a critical endpoint for matter at large baryon
chemical potentials. Up to date, experimental data both on the high-density EOS
and on a possible phase transition in dense baryonic matter are very scarce. In
order to explore this terra incognita, dedicated experimental programs are
planned at future heavy-ion research centres: the CBM experiment at FAIR, and
the MPD and BM@N experiments at NICA. The research programs and the layout of
these experiments will be presented. The future results of these laboratory
experiments will complement astronomical observations concerning the EOS, and,
in addition, will shed light on the microscopic degrees of freedom of QCD
matter at neutron star core densities.
","[{""version"":""v1"",""created"":""Sun, 3 Apr 2022 11:46:50 GMT""}]","2022-04-05"
"2204.01057","Kai Siong Yow","Kai Siong Yow and Ningyi Liao and Siqiang Luo and Reynold Cheng and
  Chenhao Ma and Xiaolin Han","A Survey on Machine Learning Solutions for Graph Pattern Extraction","v1: 41 pages; v2: 40 pages ; v3: This version focuses on just
  subgraph problems (discussions on other classic graph problems can be found
  in the earlier versions)",,,,"math.CO cs.DM cs.LG","http://creativecommons.org/licenses/by/4.0/","  A subgraph is constructed by using a subset of vertices and edges of a given
graph. There exist many graph properties that are hereditary for subgraphs.
Hence, researchers from different communities have paid a great deal of
attention in studying numerous subgraph problems, on top of the ordinary graph
problems. Many algorithms are proposed in studying subgraph problems, where one
common approach is by extracting the patterns and structures of a given graph.
Due to the complex structures of certain types of graphs and to improve overall
performances of the existing frameworks, machine learning techniques have
recently been employed in dealing with various subgraph problems. In this
article, we present a comprehensive review on five well known subgraph problems
that have been tackled by using machine learning methods. They are subgraph
isomorphism (both counting and matching), maximum common subgraph, community
detection and community search problems. We provide an outline of each proposed
method, and examine its designs and performances. We also explore
non-learning-based algorithms for each problem and a brief discussion is given.
We then suggest some promising research directions in this area, hoping that
relevant subgraph problems can be tackled by using a similar strategy. Since
there is a huge growth in employing machine learning techniques in recent
years, we believe that this survey will serve as a good reference point to
relevant research communities.
","[{""version"":""v1"",""created"":""Sun, 3 Apr 2022 11:54:22 GMT""},{""version"":""v2"",""created"":""Sun, 17 Apr 2022 13:21:22 GMT""},{""version"":""v3"",""created"":""Sat, 3 Jun 2023 00:47:06 GMT""}]","2023-06-06"
"2204.01058","Boris Hanin","Boris Hanin","Random Fully Connected Neural Networks as Perturbatively Solvable
  Hierarchies","86p",,,,"math.PR cs.LG stat.ML","http://creativecommons.org/licenses/by/4.0/","  This article considers fully connected neural networks with Gaussian random
weights and biases as well as $L$ hidden layers, each of width proportional to
a large parameter $n$. For polynomially bounded non-linearities we give sharp
estimates in powers of $1/n$ for the joint cumulants of the network output and
its derivatives. Moreover, we show that network cumulants form a perturbatively
solvable hierarchy in powers of $1/n$ in that $k$-th order cumulants in one
layer have recursions that depend to leading order in $1/n$ only on $j$-th
order cumulants at the previous layer with $j\leq k$. By solving a variety of
such recursions, however, we find that the depth-to-width ratio $L/n$ plays the
role of an effective network depth, controlling both the scale of fluctuations
at individual neurons and the size of inter-neuron correlations. Thus, while
the cumulant recursions we derive form a hierarchy in powers of $1/n$,
contributions of order $1/n^k$ often grow like $L^k$ and are hence
non-negligible at positive $L/n$. We use this to study a somewhat simplified
version of the exploding and vanishing gradient problem, proving that this
particular variant occurs if and only if $L/n$ is large. Several key ideas in
this article were first developed at a physics level of rigor in a recent
monograph of Daniel A. Roberts, Sho Yaida, and the author. This article not
only makes these ideas mathematically precise but also significantly extends
them, opening the way to obtaining corrections to all orders in $1/n$.
","[{""version"":""v1"",""created"":""Sun, 3 Apr 2022 11:57:18 GMT""},{""version"":""v2"",""created"":""Sun, 15 Jan 2023 10:13:49 GMT""}]","2023-01-18"
"2204.01059","Wim Hordijk","Wim Hordijk and Stuart Kauffman","Emergence of Autocatalytic Sets in a Simple Model of Technological
  Evolution",,,,,"q-bio.MN","http://creativecommons.org/licenses/by/4.0/","  Two alternative views of an economy are combined and studied. The first view
is that of technological evolution as a process of combinatorial innovation.
Recently a simple mathematical model (TAP) was introduced to study such a
combinatorial process. The second view is that of a network of production
functions forming an autocatalytic set. Autocatalytic (RAF) sets have been
studied extensively in the context of chemical reaction networks.
  Here, we combine the two models (TAP and RAF) and show that they are
compatible. In particular, it is shown that production function networks
resulting from the combinatorial TAP model have a high probability of
containing autocatalytic (RAF) sets. We also study the size distribution and
robustness of such ""economic autocatalytic sets"", and compare our results with
those from the chemical context. These initial results strongly support earlier
claims that the economy can indeed be seen as an autocatalytic set.
","[{""version"":""v1"",""created"":""Sun, 3 Apr 2022 12:04:35 GMT""},{""version"":""v2"",""created"":""Tue, 12 Apr 2022 07:21:56 GMT""}]","2022-04-13"
"2204.01060","Satyendra Kumar Mishra","Apurba Das, Samir Kumar Hazra, and Satyendra Kumar Mishra","Non-abelian extensions of Rota-Baxter Lie algebras and inducibility of
  automorphisms","Any comments/suggestions are welcome",,,,"math.RA math.RT","http://creativecommons.org/licenses/by/4.0/","  A Rota-Baxter Lie algebra $\mathfrak{g}_T$ is a Lie algebra $\mathfrak{g}$
equipped with a Rota-Baxter operator $T : \mathfrak{g} \rightarrow
\mathfrak{g}$. In this paper, we consider non-abelian extensions of a
Rota-Baxter Lie algebra $\mathfrak{g}_T$ by another Rota-Baxter Lie algebra
$\mathfrak{h}_S.$ We define the non-abelian cohomology $H^2_{nab}
(\mathfrak{g}_T, \mathfrak{h}_S)$ which classifies {equivalence classes of}
such extensions. Given a non-abelian extension $$ 0 \rightarrow \mathfrak{h}_S
\xrightarrow{i} \mathfrak{e}_U \xrightarrow{p} \mathfrak{g}_T \rightarrow 0$$
of Rota-Baxter Lie algebras, we also show that the obstruction for a pair of
Rota-Baxter automorphisms in $\mathrm{Aut}(\mathfrak{h}_S ) \times
\mathrm{Aut}(\mathfrak{g}_T)$ to be induced by an automorphism in
$\mathrm{Aut}(\mathfrak{e}_U)$ lies in the cohomology group $H^2_{{nab}}
(\mathfrak{g}_T, \mathfrak{h}_S)$. As a byproduct, we obtain the Wells
short-exact sequence in the context of Rota-Baxter Lie algebras.
","[{""version"":""v1"",""created"":""Sun, 3 Apr 2022 12:12:27 GMT""},{""version"":""v2"",""created"":""Sun, 9 Oct 2022 07:16:06 GMT""},{""version"":""v3"",""created"":""Sun, 2 Apr 2023 08:18:16 GMT""}]","2023-04-04"
"2204.01061","Dimitra Gkatzia","Carl Strathearn and Dimitra Gkatzia","Task2Dial: A Novel Task and Dataset for Commonsense enhanced Task-based
  Dialogue Grounded in Documents",,"Proceedings of The Fourth International Conference on Natural
  Language and Speech Processing (ICNLSP 2021)",,,"cs.CL cs.AI","http://creativecommons.org/licenses/by/4.0/","  This paper proposes a novel task on commonsense-enhanced task-based dialogue
grounded in documents and describes the Task2Dial dataset, a novel dataset of
document-grounded task-based dialogues, where an Information Giver (IG)
provides instructions (by consulting a document) to an Information Follower
(IF), so that the latter can successfully complete the task. In this unique
setting, the IF can ask clarification questions which may not be grounded in
the underlying document and require commonsense knowledge to be answered. The
Task2Dial dataset poses new challenges: (1) its human reference texts show more
lexical richness and variation than other document-grounded dialogue datasets;
(2) generating from this set requires paraphrasing as instructional responses
might have been modified from the underlying document; (3) requires commonsense
knowledge, since questions might not necessarily be grounded in the document;
(4) generating requires planning based on context, as task steps need to be
provided in order. The Task2Dial dataset contains dialogues with an average
$18.15$ number of turns and 19.79 tokens per turn, as compared to 12.94 and 12
respectively in existing datasets. As such, learning from this dataset promises
more natural, varied and less template-like system utterances.
","[{""version"":""v1"",""created"":""Sun, 3 Apr 2022 12:15:56 GMT""}]","2022-04-05"
"2204.01062","Rahee Walambe Dr","Aboli Marathe, Rahee Walambe, Ketan Kotecha","In Rain or Shine: Understanding and Overcoming Dataset Bias for
  Improving Robustness Against Weather Corruptions for Autonomous Vehicles","Under review",,,,"cs.CV","http://creativecommons.org/licenses/by/4.0/","  Several popular computer vision (CV) datasets, specifically employed for
Object Detection (OD) in autonomous driving tasks exhibit biases due to a range
of factors including weather and lighting conditions. These biases may impair a
model's generalizability, rendering it ineffective for OD in novel and unseen
datasets. Especially, in autonomous driving, it may prove extremely high risk
and unsafe for the vehicle and its surroundings. This work focuses on
understanding these datasets better by identifying such ""good-weather"" bias.
Methods to mitigate such bias which allows the OD models to perform better and
improve the robustness are also demonstrated. A simple yet effective OD
framework for studying bias mitigation is proposed. Using this framework, the
performance on popular datasets is analyzed and a significant difference in
model performance is observed. Additionally, a knowledge transfer technique and
a synthetic image corruption technique are proposed to mitigate the identified
bias. Finally, using the DAWN dataset, the findings are validated on the OD
task, demonstrating the effectiveness of our techniques in mitigating
real-world ""good-weather"" bias. The experiments show that the proposed
techniques outperform baseline methods by averaged fourfold improvement.
","[{""version"":""v1"",""created"":""Sun, 3 Apr 2022 12:30:20 GMT""},{""version"":""v2"",""created"":""Wed, 4 Jan 2023 14:36:08 GMT""}]","2023-01-05"
"2204.01063","Gustavo Madeira M. Sc.","Gustavo Madeira and Silvia Maria Giuliatti Winter","Numerical analysis of processes for the formation of moonlets confining
  the arcs of Neptune","Accepted for publication in Monthly Notices of the Royal Astronomical
  Society Main Journal (MNRAS)",,"10.1093/mnras/stac944",,"astro-ph.EP","http://arxiv.org/licenses/nonexclusive-distrib/1.0/","  The arcs of Neptune - Fraternit\'e, Egalit\'e, Libert\'e, and Courage - are
four incomplete rings immersed in the Adams ring. A recent confinement model
for the arcs proposes that the structures are azimuthally confined by four
co-orbital moonlets. In this work, we intend to approach some points related to
the dynamics of co-orbital moonlets and suggest a model for their formation. We
study the equilibrium configurations for 1+N co-orbital satellites under the
42:43 Lindblad resonance with Galatea. We obtained three distinct
configurations with 1+3 and 1+4 moonlets able to confine and reproduce the
location of the arcs. The moonlets' formation is analysed by the disruption of
an ancient body at a Lagrangian point of a moon. The disruption fragments
spread out in horseshoe orbits and collide to form moonlets, which reach an
equilibrium configuration due to a non-conservative effect. In such a scenario,
the arcs likely formed through a mixture of different processes, with impacts
between disruption outcomes and meteoroid impacts with the moonlets being
possibilities.
","[{""version"":""v1"",""created"":""Sun, 3 Apr 2022 12:33:51 GMT""}]","2022-04-13"
"2204.01064","Akhil Ahmed","Akhil Ahmed, Ehecatl Antonio del Rio-Chanona and Mehmet Mercangoz","Learning Linear Representations of Nonlinear Dynamics Using Deep
  Learning",,,,,"eess.SY cs.CE cs.SY","http://arxiv.org/licenses/nonexclusive-distrib/1.0/","  The vast majority of systems of practical interest are characterised by
nonlinear dynamics. This renders the control and optimization of such systems a
complex task due to their nonlinear behaviour. Additionally, standard methods
such as linearizing around a fixed point may not be an effective strategy for
many systems, thus requiring an alternative approach. For this reason, we
propose a new deep learning framework to discover a transformation of a
nonlinear dynamical system to an equivalent higher dimensional linear
representation. We demonstrate that the resulting learned linear representation
accurately captures the dynamics of the original system for a wider range of
conditions than standard linearization. As a result of this, we show that the
learned linear model can subsequently be used for the successful control of the
original system. We demonstrate this by applying the proposed framework to two
examples; one from the literature and a more complex example in the form of a
Continuous Stirred Tank Reactor (CSTR).
","[{""version"":""v1"",""created"":""Sun, 3 Apr 2022 12:49:11 GMT""}]","2022-04-05"
"2204.01065","Roni Stern","A.A. Snarskii, I.V. Bezsudnov","Forward and backward mapping of image to 2D vector field using fiber
  bundle color space",,,,,"cs.GR","http://arxiv.org/licenses/nonexclusive-distrib/1.0/","  We introduce the concept of a fiber bundle color space, which acts according
to the psychophysiological rules of trichromacy perception of colors by a
human. The image resides in the fiber bundle base space and the fiber color
space contains color vectors. Further we propose the decomposition of color
vectors into spectral and achromatic parts. A homomorphism of a color image and
constructed two-dimensional vector field is demonstrated that allows us to
apply well-known advanced methods of vector analysis to a color image, i.e.
ultimately give new numerical characteristics of the image. Appropriate image
to vector field forward mapping is constructed. The proposed backward mapping
algorithm converts a two-dimensional vector field to color image. The type of
image filter is described using sequential forward and backward mapping
algorithms. An example of the color image formation on the base of
two-dimensional magnetic vector field scattered by a typical pipe line defect
is given.
","[{""version"":""v1"",""created"":""Sun, 3 Apr 2022 12:53:16 GMT""}]","2022-04-05"
"2204.01066","Nzar Rauf Abdullah","Sarbast W. Abdulqadir, Hawri O. Majeed, Nzar Rauf Abdullah","Temperature dependence of the single photon source efficiency based on
  QD-cQED","RevTeX - pdfLaTeX, 9 pages with 10 included pdf figures","Physica B: Condensed Matter 638, 413907 (2022)","10.1016/j.physb.2022.413907",,"quant-ph","http://arxiv.org/licenses/nonexclusive-distrib/1.0/","  We study a photonic circuit consisting of a quantum dot, QD, coupled to a
photon cavity over a wide range of temperature up to room temperature. A key
component of such a system is presented here in the form of a Purcell-enhanced
single-photon source based on Cavity Quantum Electrodynamics, cQED. We use a
real set of pure dephasing data extracted from experimental measurements of
InGaAs QD to calculate the effective QD-cavity coupling strength, the Purcell
factor, and the single photon efficiency emerged from the QD-cavity system in
the cases without and with detuning. In the non-detuned system, the effective
coupling strength between the QD and the resonator decreases with increasing
temperature, results in a decrease in efficiency. However, when the temperature
of the QD-cavity system increases under Purcell effect conditions, the detuned
QD-cavity system induces spontaneous emission rate enhancement. As a result, we
found that the increase in efficiency can be obtained under a certain
condition, when the maximum effective coupling strength and the Purcell factor
are related to the spontaneous emission and the pure dephasing rates.
Additionally, the influences of the pumping mechanism on the efficiency of the
QD-system were examined and showed that the pumping process can be used to
further increase in efficiency. Our results can be advantageous for advanced
quantum optics applications once temperature is taken into account.
","[{""version"":""v1"",""created"":""Sun, 3 Apr 2022 12:56:38 GMT""}]","2022-05-31"
"2204.01067","Yi Liu","Yi Liu, Wenbin Chen, Yanqiu Wang","A Weak Galerkin Mixed Finite Element Method for second order elliptic
  equations on 2D Curved Domains",,,"10.4208/cicp.OA-2022-0106",,"math.NA cs.NA math.AP","http://creativecommons.org/licenses/by/4.0/","  This article concerns the weak Galerkin mixed finite element method (WG-MFEM)
for second order elliptic equations on 2D domains with curved boundary. The
Neumann boundary condition is considered since it becomes the essential
boundary condition in this case. It is well-known that the discrepancy between
the curved physical domain and the polygonal approximation domain leads to a
loss of accuracy for discretization with polynomial order $\alpha>1$. The
purpose of this paper is two-fold. First, we present a detailed error analysis
of the original WG-MFEM for solving problems on curved domains, which exhibits
an $O(h^{1/2})$ convergence for all $\alpha\ge 1$. It is a little surprising to
see that even the lowest-order WG-MFEM ($\alpha=1$) experiences a loss of
accuracy. This is different from known results for the finite element method
(FEM) or the mixed FEM, and appears to be a combined effect of the WG-MFEM
design and the fact that the outward normal vector on the polygonal
approximation domain is different from the one on the curved domain. Second, we
propose a remedy to bring the approximation rate back to optimal by employing
two techniques. One is a specially designed boundary correction technique. The
other is to take full advantage of the nice feature that weak Galerkin
discretization can be defined on polygonal meshes, which allows the curved
boundary to be better approximated by multiple short edges without increasing
the total number of mesh elements. Rigorous analysis shows that a combination
of the above two techniques renders optimal convergence for all $\alpha$.
Numerical results further confirm this conclusion.
","[{""version"":""v1"",""created"":""Sun, 3 Apr 2022 12:56:41 GMT""}]","2022-11-09"
"2204.01068","Yining Hu","Yining Hu, Alain Lasjaunias","Period-doubling Continued Fractions are Algebraic in Characteristic $2$",,,,,"math.NT math.CO","http://creativecommons.org/licenses/by/4.0/","  Considering an arbitrary pair of distinct and non constant polynomials, $a$
and $b$ in $\mathbb{F}_2[t]$, we build a continued fraction in
$\mathbb{F}_2((1/t))$ whose partial quotients are only equal to $a$ or $b$. In
a previous work of the first author and Han (to appear in Acta Arithmetica),
the authors considered two cases where the sequence of partial quotients
represents in each case a famous and basic $2$-automatic sequence, both defined
in a similar way by morphisms. They could prove the algebraicity of the
corresponding continued fractions for several pairs $(a,b)$ in the first case
(the Prouhet-Thue-Morse sequence) and gave the proof for a particular pair for
the second case (the period-doubling sequence). Recently Bugeaud and Han
(arXiv:2203.02213) proved the algebraicity for an arbitrary pair in the first
case. Here we give a short proof for an arbitrary pair in the second case.
","[{""version"":""v1"",""created"":""Sun, 3 Apr 2022 13:04:59 GMT""}]","2022-04-05"
