"2204.04247","Wahidur Rahman","Wahidur Rahman, Yisen Xu, Fan Pu, Jifeng Xuan, Xiangyang Jia, Michail
  Basios, Leslie Kanthan, Lingbo Li, Fan Wu and Baowen Xu","Clone Detection on Large Scala Codebases","Presented at IWSC SANER 2020",,,,"cs.SE","http://creativecommons.org/licenses/by-nc-sa/4.0/","  Code clones are identical or similar code segments. The wide existence of
code clones can increase the cost of maintenance and jeopardise the quality of
software. The research community has developed many techniques to detect code
clones, however, there is little evidence of how these techniques may perform
in industrial use cases. In this paper, we aim to uncover the differences when
such techniques are applied in industrial use cases. We conducted large scale
experimental research on the performance of two state-of-the-art code clone
detection techniques, SourcererCC and AutoenCODE, on both open source projects
and an industrial project written in the Scala language. Our results reveal
that both algorithms perform differently on the industrial project, with the
largest drop in precision being 30.7\%, and the largest increase in recall
being 32.4\%. By manually labelling samples of the industrial project by its
developers, we discovered that there are substantially less Type-3 clones in
the aforementioned project than that in the open source projects.
","[{""version"":""v1"",""created"":""Fri, 8 Apr 2022 18:38:02 GMT""}]","2022-04-12"
"2204.04248","Vito Crismale","Vito Crismale, Giuliano Lazzaroni, Riccarda Rossi","Singular limits of a coupled elasto-plastic damage system as viscosity
  and hardening vanish",,,,,"math.AP","http://creativecommons.org/licenses/by/4.0/","  The paper studies the asymptotic analysis of a model coupling
elastoplasticity and damage depending on three parameters -- governing
viscosity, plastic hardening, and convergence rate of plastic strain and
displacement to equilibrium -- as they vanish in different orders. The notion
of limit evolution obtained is proven to coincide in any case with a notion
introduced by Crismale and Rossi in 2019; moreover, such solutions are closely
related to those obtained in the vanishing-viscosity limit by Crismale and
Lazzaroni in 2016, for the analogous model where only the viscosity parameter
was present.
","[{""version"":""v1"",""created"":""Fri, 8 Apr 2022 18:39:54 GMT""}]","2022-04-12"
"2204.04249","Eric Bobrow","Eric Bobrow and Yi Li","Monopole Superconductivity in Magnetically Doped Cd$_3$As$_2$",,,,,"cond-mat.supr-con cond-mat.str-el","http://creativecommons.org/licenses/by/4.0/","  When superconducting pairing occurs between Fermi surfaces with different
Chern numbers, the Cooper pairs experience a nontrivial pair Berry phase and
effective pair monopole charge that enforces nodal monopole harmonic
superconducting order beyond the familiar $s$-, $p$-, and $d$-wave
superconductors. When magnetically doped, the Dirac semimetal Cd$_3$As$_2$
features Fermi pockets enclosing Weyl nodes with chiralities $\chi=\pm1,\pm2$.
This material serves as a candidate platform for realizing monopole
superconductivity with pair monopole charges $q_p=1$ or $2$, depending on the
chemical potential. We demonstrate the distinctions in the superconducting
phase winding due to pairing with different pair monopole charges and due to
pairings in different irreducible representations of the $C_{4h}$ symmetry of
magnetically doped Cd$_3$As$_2$. In all cases, the phase winding patterns are
subject to the topologically invariant total phase winding, which depends only
on the pair monopole charge and guarantees nodes in the superconducting order
for $q_p>0$.
","[{""version"":""v1"",""created"":""Fri, 8 Apr 2022 18:44:48 GMT""}]","2022-04-12"
"2204.04250","Katherine Sytwu","Katherine Sytwu, Catherine Groschner, Mary C. Scott","Understanding the Influence of Receptive Field and Network Complexity in
  Neural-Network-Guided TEM Image Analysis","11 pages, 8 figures",,"10.1017/S1431927622012466",,"cond-mat.mtrl-sci cs.CV eess.IV","http://creativecommons.org/licenses/by/4.0/","  Trained neural networks are promising tools to analyze the ever-increasing
amount of scientific image data, but it is unclear how to best customize these
networks for the unique features in transmission electron micrographs. Here, we
systematically examine how neural network architecture choices affect how
neural networks segment, or pixel-wise separate, crystalline nanoparticles from
amorphous background in transmission electron microscopy (TEM) images. We focus
on decoupling the influence of receptive field, or the area of the input image
that contributes to the output decision, from network complexity, which
dictates the number of trainable parameters. We find that for low-resolution
TEM images which rely on amplitude contrast to distinguish nanoparticles from
background, the receptive field does not significantly influence segmentation
performance. On the other hand, for high-resolution TEM images which rely on a
combination of amplitude and phase contrast changes to identify nanoparticles,
receptive field is a key parameter for increased performance, especially in
images with minimal amplitude contrast. Our results provide insight and
guidance as to how to adapt neural networks for applications with TEM datasets.
","[{""version"":""v1"",""created"":""Fri, 8 Apr 2022 18:45:15 GMT""}]","2022-11-23"
"2204.04251","Yevgeniy Vorobeychik","Jian Low, Chen Hajaj, and Yevgeniy Vorobeychik","A Rotating Proposer Mechanism for Team Formation",,,,,"cs.GT econ.TH","http://creativecommons.org/licenses/by/4.0/","  We present a rotating proposer mechanism for team formation, which implements
a Pareto efficient subgame perfect Nash equilibrium of an extensive-form team
formation game.
","[{""version"":""v1"",""created"":""Fri, 8 Apr 2022 18:54:39 GMT""}]","2022-04-12"
"2204.04252","Alejandra Zaavik Lugo Aranda","A.Z. Lugo-Aranda, S.F. S\'anchez, C. Espinosa-Ponce, C.
  L\'opez-Cob\'a, L. Galbany, J.K. Barrera-Ballesteros, L. S\'anchez-Menguiano,
  J.P. Anderson","pyHIIextractor: A tool to detect and extract physical properties of HII
  regions from Integral Field Spectroscopic data","Submitted for publishing in RASTI, 26 pages, 14 figures",,,,"astro-ph.GA","http://arxiv.org/licenses/nonexclusive-distrib/1.0/","  We present a new code named pyHIIextractor, which detects and extracts the
main features (positions and radii) of clumpy ionized regions, i.e. candidate
HII regions, using H{\alpha} emission line images. Our code is optimized to be
used on the dataproducts provided by the Pipe3D pipeline (or dataproducts with
such a format), applied to high spatial resolution Integral Field Spectroscopy
data (like that provided by the AMUSING++ compilation, using MUSE). The code
provides the properties of both the underlying stellar population and the
emission lines for each detected H ii candidate. Furthermore, the code delivers
a novel estimation of the diffuse ionized gas (DIG) component, independent of
its physical properties, which enables a decontamination of the properties of
the HII regions from the DIG. Using simulated data, mimicking the expected
observations of spiral galaxies, we characterise pyHIIextractor and its ability
to extract the main properties of the H ii regions (and the DIG), including the
line fluxes, ratios and equivalent widths. Finally, we compare our code with
other such tools adopted in the literature, which have been developed or used
for similar purposes: pyhIIexplorer, SourceExtractor, HIIphot, and astrodendro.
We conclude that pyHIIextractor exceeds the performance of previous tools in
aspects such as the number of recovered regions and the distribution of sizes
and fluxes (an improvement that is especially noticeable for the faintest and
smallest regions). pyHIIextractor is therefore an optimals tool to detect
candidate HII regions, offering an accurate estimation of their properties and
a good decontamination of the DIG component.
","[{""version"":""v1"",""created"":""Fri, 8 Apr 2022 18:55:21 GMT""}]","2022-04-12"
"2204.04253","Zeki Kazan","Zeki Kazan and Jerome Reiter","Assessing Statistical Disclosure Risk for Differentially Private,
  Hierarchical Count Data, with Application to the 2020 U.S. Decennial Census","The main document is 40 pages with an additional 23 pages of
  supplemental material and a total of 12 figures. The document has been
  updated to include revisions based on reviewer comments",,,,"stat.ME","http://creativecommons.org/licenses/by/4.0/","  We propose Bayesian methods to assess the statistical disclosure risk of data
released under zero-concentrated differential privacy, focusing on settings
with a strong hierarchical structure and categorical variables with many
levels. Risk assessment is performed by hypothesizing Bayesian intruders with
various amounts of prior information and examining the distance between their
posteriors and priors. We discuss applications of these risk assessment methods
to differentially private data releases from the 2020 decennial census and
perform simulation studies using public individual-level data from the 1940
decennial census. Among these studies, we examine how the data holder's choice
of privacy parameter affects the disclosure risk and quantify the increase in
risk when a hypothetical intruder incorporates substantial amounts of
hierarchical information.
","[{""version"":""v1"",""created"":""Fri, 8 Apr 2022 18:57:00 GMT""},{""version"":""v2"",""created"":""Mon, 30 Jan 2023 19:15:50 GMT""}]","2023-02-01"
"2204.04254","Siamak Layeghy","Mohanad Sarhan, Wai Weng Lo, Siamak Layeghy, Marius Portmann","HBFL: A Hierarchical Blockchain-based Federated Learning Framework for a
  Collaborative IoT Intrusion Detection",,,,,"cs.CR cs.LG cs.NI","http://creativecommons.org/licenses/by/4.0/","  The continuous strengthening of the security posture of IoT ecosystems is
vital due to the increasing number of interconnected devices and the volume of
sensitive data shared. The utilisation of Machine Learning (ML) capabilities in
the defence against IoT cyber attacks has many potential benefits. However, the
currently proposed frameworks do not consider data privacy, secure
architectures, and/or scalable deployments of IoT ecosystems. In this paper, we
propose a hierarchical blockchain-based federated learning framework to enable
secure and privacy-preserved collaborative IoT intrusion detection. We
highlight and demonstrate the importance of sharing cyber threat intelligence
among inter-organisational IoT networks to improve the model's detection
capabilities. The proposed ML-based intrusion detection framework follows a
hierarchical federated learning architecture to ensure the privacy of the
learning process and organisational data. The transactions (model updates) and
processes will run on a secure immutable ledger, and the conformance of
executed tasks will be verified by the smart contract. We have tested our
solution and demonstrated its feasibility by implementing it and evaluating the
intrusion detection performance using a key IoT data set. The outcome is a
securely designed ML-based intrusion detection system capable of detecting a
wide range of malicious activities while preserving data privacy.
","[{""version"":""v1"",""created"":""Fri, 8 Apr 2022 19:06:16 GMT""}]","2022-04-12"
"2204.04255","Joe Johnson","Joseph Johnson and Ricky Ini Liu","Birational Rowmotion and the Octahedron Recurrence",,,,,"math.CO","http://arxiv.org/licenses/nonexclusive-distrib/1.0/","  We use the octahedron recurrence to give a simplified statement and proof of
a formula for iterated birational rowmotion on a product of two chains, first
described by Musiker and Roby. Using this, we show that weights of certain
chains in rectangles shift in a predictable way under the action of rowmotion.
We then define generalized Stanley-Thomas words whose cyclic rotation uniquely
determines birational rowmotion on the product of two chains. We also discuss
the relationship between rowmotion and birational RSK and give a birational
analogue of Greene's theorem in this setting.
","[{""version"":""v1"",""created"":""Fri, 8 Apr 2022 19:11:29 GMT""}]","2022-04-12"
"2204.04256","Leonardo Lucio Custode","Leonardo Lucio Custode and Giovanni Iacca","Interpretable AI for policy-making in pandemics","6 pages, 3 figures, submitted to GECCO 2022","Genetic and Evolutionary Computation Conference Companion (GECCO
  '22 Companion), July 9--13, 2022, Boston, MA, USA","10.1145/3520304.3533959",,"cs.LG cs.AI cs.CY","http://creativecommons.org/licenses/by-nc-nd/4.0/","  Since the first wave of the COVID-19 pandemic, governments have applied
restrictions in order to slow down its spreading. However, creating such
policies is hard, especially because the government needs to trade-off the
spreading of the pandemic with the economic losses. For this reason, several
works have applied machine learning techniques, often with the help of
special-purpose simulators, to generate policies that were more effective than
the ones obtained by governments. While the performance of such approaches are
promising, they suffer from a fundamental issue: since such approaches are
based on black-box machine learning, their real-world applicability is limited,
because these policies cannot be analyzed, nor tested, and thus they are not
trustable. In this work, we employ a recently developed hybrid approach, which
combines reinforcement learning with evolutionary computation, for the
generation of interpretable policies for containing the pandemic. These
policies, trained on an existing simulator, aim to reduce the spreading of the
pandemic while minimizing the economic losses. Our results show that our
approach is able to find solutions that are extremely simple, yet very
powerful. In fact, our approach has significantly better performance (in
simulated scenarios) than both previous work and government policies.
","[{""version"":""v1"",""created"":""Fri, 8 Apr 2022 19:12:02 GMT""},{""version"":""v2"",""created"":""Sat, 30 Apr 2022 16:15:22 GMT""}]","2022-05-03"
"2204.04257","Maggie Thompson","Maggie A. Thompson, Joshua Krissansen-Totton, Nicholas Wogan, Myriam
  Telus, Jonathan J. Fortney","The Case and Context for Atmospheric Methane as an Exoplanet
  Biosignature","10 pages, 5 figures, 15 pages Supplementary Information, 3
  Supplementary Figures","PNAS 119, 14, 1-10 (2022)","10.1073/pnas.2117933119",,"astro-ph.EP","http://creativecommons.org/licenses/by/4.0/","  Methane has been proposed as an exoplanet biosignature. Imminent observations
with the James Webb Space Telescope may enable methane detections on
potentially habitable exoplanets, so it is essential to assess in what
planetary contexts methane is a compelling biosignature. Methane's short
photochemical lifetime in terrestrial planet atmospheres implies that abundant
methane requires large replenishment fluxes. While methane can be produced by a
variety of abiotic mechanisms such as outgassing, serpentinizing reactions, and
impacts, we argue that, in contrast to an Earth-like biosphere, known abiotic
processes cannot easily generate atmospheres rich in CH$_4$ and CO$_2$ with
limited CO due to the strong redox disequilibrium between CH$_4$ and CO$_2$.
Methane is thus more likely to be biogenic for planets with 1) a terrestrial
bulk density, high mean-molecular-weight and anoxic atmosphere, and an old host
star; 2) an abundance of CH$_4$ that implies surface fluxes exceeding what
could be supplied by abiotic processes; and 3) atmospheric CO$_2$ with
comparatively little CO.
","[{""version"":""v1"",""created"":""Fri, 8 Apr 2022 19:14:48 GMT""}]","2022-04-12"
"2204.04258","Erin Aadland","Erin Aadland, Philip Massey, D. John Hillier, Nidia I. Morrell,
  Kathryn F. Neugent, J. J. Eldridge","WO-Type Wolf-Rayet Stars: the Last Hurrah of Massive Star Evolution","55 pages, 22 figures, Accepted into ApJ",,"10.3847/1538-4357/ac66e7",,"astro-ph.SR astro-ph.GA","http://arxiv.org/licenses/nonexclusive-distrib/1.0/","  Are WO-type Wolf Rayet (WR) stars in the final stage of massive star
evolution before core-collapse? Although WC- and WO-type WRs have very similar
spectra, WOs show a much stronger O VI $\lambda \lambda$3811,34 emission-line
feature. This has usually been interpreted to mean that WOs are more oxygen
rich than WCs, and thus further evolved. However, previous studies have failed
to model this line, leaving the relative abundances uncertain, and the
relationship between the two types unresolved. To answer this fundamental
question, we modeled six WCs and two WOs in the LMC using UV, optical, and NIR
spectra with the radiative transfer code CMFGEN in order to determine their
physical properties. We find that WOs are not richer in oxygen; rather, the O
VI feature is insensitive to the abundance. However, the WOs have a
significantly higher carbon and lower helium content than the WCs, and hence
are further evolved. A comparison of our results with single-star Geneva and
binary BPASS evolutionary models show that while many properties match, there
is more carbon and less oxygen in the WOs than either set of evolutionary model
predicts. This discrepancy may be due to the large uncertainty in the
$^{12}$C+$^4$He$\rightarrow^{16}$O nuclear reaction rate; we show that if the
Kunz et al. rate is decreased by a factor of 25-50%, then there would be a good
match with the observations. It would also help explain the LIGO/VIRGO
detection of black holes whose masses are in the theoretical upper mass gap.
","[{""version"":""v1"",""created"":""Fri, 8 Apr 2022 19:16:50 GMT""}]","2022-06-15"
"2204.04259","Pin-Yu Chen","Abolaji D. Adesoji and Pin-Yu Chen","Evaluating the Adversarial Robustness for Fourier Neural Operators","Accepted to Workshop on Socially Responsible Machine Learning (SRML),
  co-located with ICLR 2022",,,,"cs.LG cs.AI","http://arxiv.org/licenses/nonexclusive-distrib/1.0/","  In recent years, Machine-Learning (ML)-driven approaches have been widely
used in scientific discovery domains. Among them, the Fourier Neural Operator
(FNO) was the first to simulate turbulent flow with zero-shot super-resolution
and superior accuracy, which significantly improves the speed when compared to
traditional partial differential equation (PDE) solvers. To inspect the
trustworthiness, we provide the first study on the adversarial robustness of
scientific discovery models by generating adversarial examples for FNO, based
on norm-bounded data input perturbations. Evaluated on the mean squared error
between the FNO model's output and the PDE solver's output, our results show
that the model's robustness degrades rapidly with increasing perturbation
levels, particularly in non-simplistic cases like the 2D Darcy and the Navier
cases. Our research provides a sensitivity analysis tool and evaluation
principles for assessing the adversarial robustness of ML-based scientific
discovery models.
","[{""version"":""v1"",""created"":""Fri, 8 Apr 2022 19:19:42 GMT""}]","2022-04-12"
"2204.04260","Nina Moorman","Nina Moorman, Erin Hedlund-Botti, and Matthew Gombolay","Towards Cognitive Robots That People Accept in Their Home","2022 AAAI Fall Symposium on Artificial Intelligence for Human-Robot
  Interaction (AI-HRI 2022) workshop paper",,,,"cs.RO cs.HC","http://arxiv.org/licenses/nonexclusive-distrib/1.0/","  It is intractable for assistive robots to have all functionalities
pre-programmed prior to deployment. Rather, it is more realistic for robots to
perform supplemental, on-site learning about user's needs and preferences, and
particularities of the environment. This additional learning is especially
helpful for care robots that assist with individualized caregiver activities in
residential or assisted living facilities. As each care receiver has unique
needs and those needs may change over time, robots require the ability to adapt
and learn on-site. In this work, we propose the study design to investigate the
impacts on end-users of observing robot learning. We will assess user attitudes
towards robots that conduct some learning in the home as compared to a baseline
condition where the robot is delivered fully capable. We will additionally
compare different modes of learning to determine whether some are more likely
to instill trust.
","[{""version"":""v1"",""created"":""Fri, 8 Apr 2022 19:20:56 GMT""},{""version"":""v2"",""created"":""Wed, 3 Aug 2022 14:13:33 GMT""},{""version"":""v3"",""created"":""Mon, 17 Oct 2022 18:00:32 GMT""}]","2022-10-19"
"2204.04261","Shannon Harvey","Shannon Harvey","Quantum Dots / Spin Qubits","review article for Oxford Research Encyclopedia of Physics, March
  2022","Oxford Research Encyclopedia of Physics (2022)","10.1093/acrefore/9780190871994.013.83",,"cond-mat.mes-hall quant-ph","http://creativecommons.org/licenses/by/4.0/","  Spin qubits in semiconductor quantum dots represent a prominent family of
solid-state qubits in the effort to build a quantum computer. They are formed
when electrons or holes are confined in a static potential well in a
semiconductor, giving them a quantized energy spectrum. The simplest spin qubit
is a single electron spin located in a quantum dot, but many additional
varieties have been developed, some containing multiple spins in multiple
quantum dots, each of which has different benefits and drawbacks. While these
spins act as simple quantum systems in many ways, they also experience complex
effects due to their semiconductor environment. They can be controlled by both
magnetic and electric fields depending on their configuration and are therefore
dephased by magnetic and electric field noise, with different types of spin
qubits having different control mechanisms and noise susceptibilities. While
initial experiments were primarily performed in gallium arsenide (GaAs) based
materials, silicon qubits have developed substantially and research on qubits
in metal-oxide-semiconductor (Si-MOS), silicon/silicon germanium (Si/SiGe)
heterostructures, and donors in silicon is also being pursued. An increasing
number of spin qubit varieties have attained error rates that are low enough to
be compatible with quantum error correction for single-qubit gates and
two-qubit gates have been performed in several with success rates, or
fidelities, of 90-95%.
","[{""version"":""v1"",""created"":""Fri, 8 Apr 2022 19:21:19 GMT""}]","2022-04-12"
"2204.04262","Chaojie Zhang","Chaojie Zhang, Yipeng Wu, Mitchell Sinclair, Audrey Farrell, Kenneth
  A. Marsh, Jianfei Hua, Irina Petrushina, Navid Vafaei-Najafabadi, Rotem
  Kupfer, Karl Kusche, Mikhail Fedurin, Igor Pogorelsky, Mikhail Polyanskiy,
  Chen-Kang Huang, Wei Lu, Warren B. Mori and Chan Joshi","Electron Weibel instability induced magnetic fields in optical-field
  ionized plasmas","22 pages, 10 figures",,"10.1063/5.0089814",,"physics.plasm-ph","http://creativecommons.org/licenses/by/4.0/","  Generation and amplification of magnetic fields in plasmas is a long-standing
topic that is of great interest to both plasma and space physics. The electron
Weibel instability is a well-known mechanism responsible for self-generating
magnetic fields in plasmas with temperature anisotropy and has been extensively
investigated in both theory and simulations, yet experimental verification of
this instability has been challenging. Recently, we demonstrated a new
experimental platform that enables the controlled initialization of highly
nonthermal and/or anisotropic plasma electron velocity distributions via
optical-field ionization. Using an external electron probe bunch from a linear
accelerator, the onset, saturation and decay of the self-generated magnetic
fields due to electron Weibel instability were measured for the first time to
our knowledge. In this paper, we will first present experimental results on
time-resolved measurements of the Weibel magnetic fields in non-relativistic
plasmas produced by Ti:Sapphire laser pulses (0.8 $\mu m$) and then discuss the
feasibility of extending the study to quasi-relativistic regime by using
intense $\rm CO_2$ (e.g., 9.2 $\mu m$) lasers to produce much hotter plasmas.
","[{""version"":""v1"",""created"":""Fri, 8 Apr 2022 19:21:52 GMT""}]","2022-06-22"
