"2204.04328","Yeinzon Rodriguez Garcia","Alexander Gallego Cadavid (1), Carlos M. Nieto (2), Yeinzon Rodriguez
  (2,3) ((1) Universidad de Valparaiso, (2) Universidad Industrial de
  Santander, (3) Universidad Antonio Narino)","Decoupling-limit consistency of the generalized SU(2) Proca theory","LaTeX file in RevTeX 4-1 style, 13 pages, no figures. v2: some short
  but important additions regarding the structure of the GSU2P. Miscellaneous
  changes. Version to be published in Physical Review D. v3: published version","Phys. Rev. D 105, 104051 (2022)","10.1103/PhysRevD.105.104051","PI/UAN-2022-714FT","hep-th gr-qc","http://arxiv.org/licenses/nonexclusive-distrib/1.0/","  We study the consistency of the decoupling limit of the generalized SU(2)
Proca theory (GSU2P). Namely, we study the healthiness of those terms whose
analysis in the scalar limit was not originally established in the
reconstruction of the full theory (see the work by Gallego Cadavid et. al.
[Phys. Rev. D 102, 104066 (2020)]). Those terms are the parity-violating
$\tilde{\mathcal{L}}_{4,2}^1$ and the parity-conserving beyond SU(2) Proca
terms $\mathcal{L}_{4,2}^3$ and $\mathcal{L}_{4,2}^4$. Using the 3+1
Arnowitt-Deser-Misner formalism, we write down the kinetic Lagrangian of these
terms in the decoupling limit and show that their corresponding kinetic
matrices are degenerate. This degeneracy is a necessary condition for the
propagation of the right number of degrees of freedom, as required by the
primary constraint-enforcing relation. Interestingly, the
$\tilde{\mathcal{L}}_{4,2}^1$ term, which is purely non-Abelian, does not
contribute to the kinetic Lagrangian of the theory, so its contribution is
trivially degenerate. Similarly, but not trivially in these cases, the
contributions of the $\mathcal{L}_{4,2}^3$ and $\mathcal{L}_{4,2}^4$ terms to
the kinetic Lagrangian turn out to be degenerate as well. The results presented
in this paper represent progress in the construction of the fully healthy
GSU2P.
","[{""version"":""v1"",""created"":""Fri, 8 Apr 2022 23:39:13 GMT""},{""version"":""v2"",""created"":""Mon, 16 May 2022 22:08:42 GMT""},{""version"":""v3"",""created"":""Tue, 24 May 2022 17:26:32 GMT""}]","2022-05-25"
"2204.04329","Xinqiao Zhang","Xinqiao Zhang, Huili Chen, Ke Huang, Farinaz Koushanfar","An Adaptive Black-box Backdoor Detection Method for Deep Neural Networks","arXiv admin note: substantial text overlap with arXiv:2102.01815",,,,"cs.CR cs.LG","http://creativecommons.org/licenses/by/4.0/","  With the surge of Machine Learning (ML), An emerging amount of intelligent
applications have been developed. Deep Neural Networks (DNNs) have demonstrated
unprecedented performance across various fields such as medical diagnosis and
autonomous driving. While DNNs are widely employed in security-sensitive
fields, they are identified to be vulnerable to Neural Trojan (NT) attacks that
are controlled and activated by stealthy triggers. In this paper, we target to
design a robust and adaptive Trojan detection scheme that inspects whether a
pre-trained model has been Trojaned before its deployment. Prior works are
oblivious of the intrinsic property of trigger distribution and try to
reconstruct the trigger pattern using simple heuristics, i.e., stimulating the
given model to incorrect outputs. As a result, their detection time and
effectiveness are limited. We leverage the observation that the pixel trigger
typically features spatial dependency and propose the first trigger
approximation based black-box Trojan detection framework that enables a fast
and scalable search of the trigger in the input space. Furthermore, our
approach can also detect Trojans embedded in the feature space where certain
filter transformations are used to activate the Trojan. We perform extensive
experiments to investigate the performance of our approach across various
datasets and ML models. Empirical results show that our approach achieves a
ROC-AUC score of 0.93 on the public TrojAI dataset. Our code can be found at
https://github.com/xinqiaozhang/adatrojan
","[{""version"":""v1"",""created"":""Fri, 8 Apr 2022 23:41:19 GMT""}]","2022-04-12"
"2204.04330","Patrick Lancaster","Patrick Lancaster, Boling Yang, Joshua R. Smith","Improved Object Pose Estimation via Deep Pre-touch Sensing","8 pages, 6 figures",,,,"cs.RO","http://arxiv.org/licenses/nonexclusive-distrib/1.0/","  For certain manipulation tasks, object pose estimation from head-mounted
cameras may not be sufficiently accurate. This is at least in part due to our
inability to perfectly calibrate the coordinate frames of today's high degree
of freedom robot arms that link the head to the end-effectors. We present a
novel framework combining pre-touch sensing and deep learning to more
accurately estimate pose in an efficient manner. The use of pre-touch sensing
allows our method to localize the object directly with respect to the robot's
end effector, thereby avoiding error caused by miscalibration of the arms.
Instead of requiring the robot to scan the entire object with its pre-touch
sensor, we use a deep neural network to detect object regions that contain
distinctive geometric features. By focusing pre-touch sensing on these regions,
the robot can more efficiently gather the information necessary to adjust its
original pose estimate. Our region detection network was trained using a new
dataset containing objects of widely varying geometries and has been labeled in
a scalable fashion that is free from human bias. This dataset is applicable to
any task that involves a pre-touch sensor gathering geometric information, and
has been made publicly available. We evaluate our framework by having the robot
re-estimate the pose of a number of objects of varying geometries. Compared to
two simpler region proposal methods, we find that our deep neural network
performs significantly better. In addition, we find that after a sequence of
scans, objects can typically be localized to within 0.5 cm of their true
position. We also observe that the original pose estimate can often be
significantly improved after collecting a single quick scan.
","[{""version"":""v1"",""created"":""Sat, 9 Apr 2022 00:08:16 GMT""}]","2022-04-12"
"2204.04331","Anupindi Sri Sakti Swarup","Sri Sakti Swarup Anupindi, A. Michael Alphonse","The boundedness of Fractional Hardy-Littlewood maximal operator on
  variable lp(Z) spaces using Calderon-Zygmund decomposition",,,,,"math.FA","http://creativecommons.org/publicdomain/zero/1.0/","  In this paper, we prove strong type, weak type inequalities of
Hardy-Littlewood maximal operator and fractional Hardy-Littlewood maximal
operator on variable sequence spaces lp(Z). This is achieved using
Calderon-Zygmund decomposition for sequences, properties of modular functional
and Log Holder continuity.
","[{""version"":""v1"",""created"":""Sat, 9 Apr 2022 00:12:16 GMT""},{""version"":""v2"",""created"":""Fri, 22 Apr 2022 07:03:51 GMT""},{""version"":""v3"",""created"":""Thu, 19 May 2022 11:27:55 GMT""}]","2022-05-20"
"2204.04332","Bo Tang Dr.","Bo Tang, Zhongrui Huang, Lilong Qin, Hai Wang","Fundamental Limits on Detection With a Dual-function Radar Communication
  System",,,,,"cs.IT eess.SP math.IT","http://arxiv.org/licenses/nonexclusive-distrib/1.0/","  This paper investigates the fundamental limits on the target detection
performance with a dual-function multiple-input-multiple-output (MIMO) radar
communication (RadCom) systems. By assuming the presence of a point-like target
and a communication receiver, closed-form expressions for the maximum detection
probability and the transmit waveforms achieving the optimal performance are
derived. Results show that for the considered case, the dual-function system
should transmit coherent waveforms to achieve the optimal detection
performance. Moreover, the angle separation between the target and
communication receiver has a great impact on the achievable detection
performance.
","[{""version"":""v1"",""created"":""Sat, 9 Apr 2022 00:15:28 GMT""}]","2022-04-12"
"2204.04333","Shih-Kuang Lee","Shih-Kuang Lee, Yu Tsao and Hsin-Min Wang","A Study of Using Cepstrogram for Countermeasure Against Replay Attacks","Submitted to SLT 2022",,,,"eess.AS cs.CR cs.SD","http://arxiv.org/licenses/nonexclusive-distrib/1.0/","  This study investigated the cepstrogram properties and demonstrated their
effectiveness as powerful countermeasures against replay attacks. A cepstrum
analysis of replay attacks suggests that crucial information for anti-spoofing
against replay attacks may be retained in the cepstrogram. When building
countermeasures against replay attacks, experiments on the ASVspoof 2019
physical access database demonstrate that the cepstrogram is more effective
than other features in both single and fusion systems. Our LCNN-based single
and fusion systems with the cepstrogram feature outperformed the corresponding
LCNN-based systems without the cepstrogram feature and several state-of-the-art
single and fusion systems in the literature.
","[{""version"":""v1"",""created"":""Sat, 9 Apr 2022 00:18:53 GMT""},{""version"":""v2"",""created"":""Wed, 26 Oct 2022 13:08:53 GMT""}]","2022-10-27"
"2204.04334","Florian Br\""unig","Florian N. Br\""unig, Manuel Rammler, Ellen M. Adams, Martina Havenith
  and Roland R. Netz","Spectral signatures of excess-proton waiting and transfer-path dynamics
  in aqueous hydrochloric acid solutions",,"Nature Communications 13, 4210 (2022)","10.1038/s41467-022-31700-x",,"physics.chem-ph","http://creativecommons.org/licenses/by/4.0/","  Signatures of solvated excess protons in infrared difference absorption
spectra, such as the continuum band between the water bend and stretch bands,
have been experimentally known for a long time, but the theoretical basis for
linking spectral signatures with the microscopic proton-transfer mechanism so
far relied on normal-mode analysis. We analyze the excess-proton dynamics in ab
initio molecular-dynamics simulations of aqueous hydrochloric acid solutions by
trajectory-decomposition techniques. The continuum band in the 2000 - 3000
cm$^{-1 }$ range is shown to be due to normal-mode oscillations of temporary
H$_3$O$^+$ complexes. An additional prominent peak at 400 cm$^{-1}$ reports on
the coupling of excess-proton motion to the relative vibrations of the two
flanking water molecules. The actual proton transfer between two water
molecules, which for large water separations involves crossing of a barrier and
thus is not a normal mode, is characterized by two characteristic time scales:
Firstly, the waiting time for transfer to occur in the range of 200 - 300 fs,
which leads to a broad weak shoulder around ~100 cm$^{-1}$, consistent with our
experimental THz spectra. Secondly, the mean duration of a transfer event of
about 14 fs, which produces a rather well-defined spectral contribution around
1200 cm$^{-1}$ and agrees in location and width with previous experimental
mid-infrared spectra.
","[{""version"":""v1"",""created"":""Sat, 9 Apr 2022 00:20:10 GMT""}]","2022-07-29"
"2204.04335","Omar Kammouh","Melissa De Iuliis, Omar Kammouh, Gian Paolo Cimellaro","Measuring and improving community resilience: a Fuzzy Logic approach",,,,,"nlin.AO","http://creativecommons.org/licenses/by/4.0/","  Due to the increasing frequency of natural and man-made disasters worldwide,
the scientific community has paid considerable attention to the concept of
resilience engineering in recent years. Authorities and decision-makers, on the
other hand, have been focusing their efforts to develop strategies that can
help increase community resilience to different types of extreme events. Since
it is often impossible to prevent every risk, the focus is on adapting and
managing risks in ways that minimize impacts to communities (e.g., humans and
other systems). Several resilience strategies have been proposed in the
literature to reduce disaster risk and improve community resilience. Generally,
resilience assessment is challenging due to uncertainty and unavailability of
data necessary for the estimation process. This paper proposes a Fuzzy Logic
method for quantifying community resilience. The methodology is based on the
PEOPLES framework, an indicator-based hierarchical framework that defines all
aspects of the community. A fuzzy-based approach is implemented to quantify the
PEOPLES indicators using descriptive knowledge instead of hard data, accounting
also for the uncertainties involved in the analysis. To demonstrate the
applicability of the methodology, data regarding the functionality of the city
San Francisco before and after the Loma Prieta earthquake are used to obtain a
resilience index of the Physical Infrastructure dimension of the PEOPLES
framework. The results show that the methodology can provide good estimates of
community resilience despite the uncertainty of the indicators. Hence, it
serves as a decision-support tool to help decision-makers and stakeholders
assess and improve the resilience of their communities.
","[{""version"":""v1"",""created"":""Sat, 9 Apr 2022 00:23:16 GMT""}]","2022-04-12"
"2204.04336","Robert Zimmerman","Micha\""el Lalancette and Robert Zimmerman","A new family of smooth copulas with arbitrarily irregular densities","12 pages, 3 figures",,,,"math.PR math.ST stat.TH","http://creativecommons.org/licenses/by/4.0/","  Copulas are known to satisfy a number of regularity properties, and one might
therefore believe that their densities, when they exist, admit a certain degree
of regularity themselves. We show that this is not true in general by
constructing a broad family of copulas which admit densities that can hardly be
considered regular. The copula densities are constructed from arbitrary
univariate densities supported on the unit interval, and we show by example
that the copula densities can inherit pathological behaviour from the
underlying univariate densities. In particular, we construct a nontrivial
univariate density which is unbounded in every open set of the unit interval,
and show that it induces a copula density which is finite everywhere but
unbounded in every neighborhood of the unit hypercube. Nevertheless, all of our
copulas are shown to enjoy attractive smoothness properties.
","[{""version"":""v1"",""created"":""Sat, 9 Apr 2022 00:32:43 GMT""}]","2022-04-12"
"2204.04337","Yi Wang Ms.","Xiang Tang, Yi Wang, Dechao Zheng","Helton-Howe Trace, Connes-Chern character and Quantization","72 pages, revised version. Version 1 of this article is split into
  two independent articles, Version 2 of arXiv:2204.04337 and arXiv:2210.04148.
  The main results of Version 1 of this article are presented in Version 2. And
  the results about trace of semicommutators on the unit disk together with
  related topics in Version 1 are included and generalized in a new paper,
  arXiv:2210.04148.",,,,"math.FA math.CV math.KT","http://creativecommons.org/licenses/by/4.0/","  We study the Helton-Howe trace and the Connes-Chern character for Toeplitz
operators on weighted Bergman spaces via the idea of quantization. We prove a
local formula for the large $t$-limit of the Connes-Chern character as the
weight goes to infinity. And we show that the Helton-Howe trace of Toeplitz
operators is independent of the weight $t$ and obtain a local formula for the
Helton-Howe trace for all weighted Bergman spaces using harmonic analysis and
quantization.
","[{""version"":""v1"",""created"":""Sat, 9 Apr 2022 00:35:08 GMT""},{""version"":""v2"",""created"":""Sun, 9 Oct 2022 02:41:27 GMT""}]","2022-10-12"
"2204.04338","Javier Andreu-Perez Dr","Christian Flores Vega, Jonathan Quevedo, Elmer Escand\'on, Mehrin
  Kiani, Weiping Ding, Javier Andreu-Perez","Fuzzy temporal convolutional neural networks in P300-based
  Brain-computer interface for smart home interaction",,"Applied Soft Computing 117 (2022) 108359","10.1016/j.asoc.2021.108359",,"cs.LG cs.AI cs.NE q-bio.NC","http://creativecommons.org/licenses/by-nc-nd/4.0/","  The processing and classification of electroencephalographic signals (EEG)
are increasingly performed using deep learning frameworks, such as
convolutional neural networks (CNNs), to generate abstract features from brain
data, automatically paving the way for remarkable classification prowess.
However, EEG patterns exhibit high variability across time and uncertainty due
to noise. It is a significant problem to be addressed in P300-based Brain
Computer Interface (BCI) for smart home interaction. It operates in a
non-optimal natural environment where added noise is often present. In this
work, we propose a sequential unification of temporal convolutional networks
(TCNs) modified to EEG signals, LSTM cells, with a fuzzy neural block (FNB),
which we called EEG-TCFNet. Fuzzy components may enable a higher tolerance to
noisy conditions. We applied three different architectures comparing the effect
of using block FNB to classify a P300 wave to build a BCI for smart home
interaction with healthy and post-stroke individuals. Our results reported a
maximum classification accuracy of 98.6% and 74.3% using the proposed method of
EEG-TCFNet in subject-dependent strategy and subject-independent strategy,
respectively. Overall, FNB usage in all three CNN topologies outperformed those
without FNB. In addition, we compared the addition of FNB to other
state-of-the-art methods and obtained higher classification accuracies on
account of the integration with FNB. The remarkable performance of the proposed
model, EEG-TCFNet, and the general integration of fuzzy units to other
classifiers would pave the way for enhanced P300-based BCIs for smart home
interaction within natural settings.
","[{""version"":""v1"",""created"":""Sat, 9 Apr 2022 00:35:35 GMT""}]","2022-04-12"
"2204.04339","Jane Hsieh","Jane Hsieh, Yili Hong, Gordon Burtch, Haiyi Zhu","A Little Too Personal: Effects of Standardization versus Personalization
  on Job Acquisition, Work Completion, and Revenue for Online Freelancers","CHI'22, April 29-May 5, 2022, New Orleans, LA, USA",,"10.1145/3491102.3517546",,"cs.HC","http://creativecommons.org/licenses/by/4.0/","  As more individuals consider permanently working from home, the online labor
market continues to grow as an alternative working environment. While the
flexibility and autonomy of these online gigs attracts many workers, success
depends critically upon self-management and workers' efficient allocation of
scarce resources. To achieve this, freelancers may develop alternative work
strategies, employing highly standardized schedules and communication patterns
while taking on large work volumes, or engaging in smaller numbers of jobs
whilst tailoring their activities to build relationships with individual
employers. In this study, we consider this contrast in relation to worker
communication patterns. We demonstrate the heterogeneous effects of
standardization versus personalization across different stages of a project and
examine the relative impact on job acquisition, project completion, and
earnings. Our findings can inform the design of platforms and various worker
support tools for the gig economy.
","[{""version"":""v1"",""created"":""Sat, 9 Apr 2022 00:39:10 GMT""}]","2022-04-12"
"2204.04340","Jeremy Dao","Jeremy Dao, Kevin Green, Helei Duan, Alan Fern, Jonathan Hurst","Sim-to-Real Learning for Bipedal Locomotion Under Unsensed Dynamic Loads","Accepted to ICRA 2022. Video attachment: https://youtu.be/IeSUM_ej8wE",,,,"cs.RO cs.LG","http://creativecommons.org/licenses/by/4.0/","  Recent work on sim-to-real learning for bipedal locomotion has demonstrated
new levels of robustness and agility over a variety of terrains. However, that
work, and most prior bipedal locomotion work, have not considered locomotion
under a variety of external loads that can significantly influence the overall
system dynamics. In many applications, robots will need to maintain robust
locomotion under a wide range of potential dynamic loads, such as pulling a
cart or carrying a large container of sloshing liquid, ideally without
requiring additional load-sensing capabilities. In this work, we explore the
capabilities of reinforcement learning (RL) and sim-to-real transfer for
bipedal locomotion under dynamic loads using only proprioceptive feedback. We
show that prior RL policies trained for unloaded locomotion fail for some loads
and that simply training in the context of loads is enough to result in
successful and improved policies. We also compare training specialized policies
for each load versus a single policy for all considered loads and analyze how
the resulting gaits change to accommodate different loads. Finally, we
demonstrate sim-to-real transfer, which is successful but shows a wider
sim-to-real gap than prior unloaded work, which points to interesting future
research.
","[{""version"":""v1"",""created"":""Sat, 9 Apr 2022 00:41:55 GMT""}]","2022-04-12"
"2204.04341","Yositake Takane","Yositake Takane","Phase Diagram of a Non-Hermitian Chern Insulator: Destabilization of
  Chiral Edge States and Bulk-Boundary Correspondence","10 pages, 17 figures. arXiv admin note: text overlap with
  arXiv:2103.00769","J. Phys. Soc. Jpn. 91, 054705 (2022)","10.7566/JPSJ.91.054705",,"cond-mat.mes-hall","http://creativecommons.org/licenses/by-nc-nd/4.0/","  A non-Hermitian Chern insulator with gain/loss-type non-Hermiticity shows a
peculiar gap closing; when a nontrivial Chern insulator phase changes to a
gapless phase, conduction and valence bands are combined into one band owing to
destabilization of chiral edge states. A previous recipe of non-Hermitian
bulk-boundary correspondence is insufficient for this system since such a gap
closing is beyond its scope. Here, we revise the recipe by taking the peculiar
gap closing into account and apply it to the non-Hermitian Chern insulator. We
demonstrate that the bulk-boundary correspondence holds in the system including
a destabilization of chiral edge states. A phase diagram derived from the
bulk-boundary correspondence is shown to be consistent with spectra of the
system.
","[{""version"":""v1"",""created"":""Sat, 9 Apr 2022 00:44:15 GMT""}]","2022-04-20"
"2204.04342","Jeffrey Hurchalla","Jeffrey Hurchalla","An Improved Integer Modular Multiplicative Inverse (modulo $2^w$)",,,,,"cs.DS","http://arxiv.org/licenses/nonexclusive-distrib/1.0/","  This paper presents an algorithm for the integer multiplicative inverse (mod
$2^w$) which completes in the fewest cycles known for modern microprocessors,
when using the native bit width $w$ for the modulus $2^w$. The algorithm is a
modification of a method by Dumas, and for computers it slightly increases
generality and efficiency. A proof is given, and the algorithm is shown to be
closely related to the better known Newton's method algorithm for the inverse.
Simple direct formulas, which are needed by this algorithm and by Newton's
method, are reviewed and proven for the integer inverse modulo $2^k$ with $k$ =
1, 2, 3, 4, or 5, providing the first proof of the preferred formula with $k$=4
or 5.
","[{""version"":""v1"",""created"":""Sat, 9 Apr 2022 00:46:05 GMT""},{""version"":""v2"",""created"":""Sun, 24 Apr 2022 18:42:46 GMT""}]","2022-04-26"
"2204.04343","John Russo","John D. Russo and Daniel M. Zuckerman","Simple synthetic molecular dynamics for efficient trajectory generation",,,,,"physics.comp-ph q-bio.QM","http://arxiv.org/licenses/nonexclusive-distrib/1.0/","  Synthetic molecular dynamics (synMD) trajectories from learned generative
models have been proposed as a useful addition to the biomolecular simulation
toolbox. The computational expense of explicitly integrating the equations of
motion in molecular dynamics currently is a severe limit on the number and
length of trajectories which can be generated for complex systems. Approximate,
but more computationally efficient, generative models can be used in place of
explicit integration of the equations of motion, and can produce meaningful
trajectories at greatly reduced computational cost. Here, we demonstrate a very
simple synMD approach using a fine-grained Markov state model (MSM) with states
mapped to specific atomistic configurations, which provides an exactly solvable
reference. We anticipate this simple approach will enable rapid, effective
testing of enhanced sampling algorithms in highly non-trivial models for both
equilibrium and non-equilibrium problems. We demonstrate the use of a MSM to
generate atomistic synMD trajectories for the fast-folding miniprotein
Trp-cage, at a rate of over 200 milliseconds per day on a standard workstation.
We employ a non-standard clustering for MSM generation that appears to better
preserve kinetic properties at shorter lag times than a conventional MSM. We
also show a parallelizable workflow that backmaps discrete synMD trajectories
to full-coordinate representations at dynamic resolution for efficient
analysis.
","[{""version"":""v1"",""created"":""Sat, 9 Apr 2022 00:53:35 GMT""},{""version"":""v2"",""created"":""Mon, 2 May 2022 18:50:11 GMT""},{""version"":""v3"",""created"":""Wed, 4 May 2022 16:26:38 GMT""}]","2022-05-05"
