"2204.04430","Sahibia Kaur Vohra Ms.","Sahibia Kaur Vohra, Sherin A Thomas, Mahendra Sakare and Devarshi
  Mrinal Das","CMOS Circuit Implementation of Spiking Neural Network for Pattern
  Recognition Using On-chip Unsupervised STDP Learning",,,,,"eess.IV cs.SY eess.SP eess.SY","http://arxiv.org/licenses/nonexclusive-distrib/1.0/","  Computation on a large volume of data at high speed and low power requires
energy-efficient computing architectures. Spiking neural network (SNN) with
bio-inspired spike-timing-dependent plasticity learning (STDP) is a promising
solution for energy-efficient neuromorphic systems than conventional artificial
neural network (ANN). Previous works on SNN with STDP learning primarily uses
memristive devices which are difficult to fabricate. Some reported works on SNN
makes use of memristor macro models, which are software-based and cannot give
complete insight into circuit implementation challenges. This article presents
for the first time, a full circuit-level implementation of the SNN system
featuring on-chip unsupervised STDP learning in standard CMOS technology. It
does not involve the use of FPGAs, CPUs or GPUs for training the neural
network. We demonstrated the complete circuit-level design, implementation and
simulation of SNN with on-chip training and inference for pattern
classification using 180 nm CMOS technology. A comprehensive comparison of the
proposed SNN circuit with the previous related work is also presented. To
demonstrate the versatility of the CMOS synapse circuit for application
scenarios requiring rate-based learning, we have tuned the pair-based STDP
circuit to obtain Bienenstock-Cooper-Munro (BCM) characteristics and applied it
to heart rate classification.
","[{""version"":""v1"",""created"":""Sat, 9 Apr 2022 09:07:14 GMT""}]","2022-04-12"
"2204.04431","Mikhail Kiselev","Mikhail Kiselev","A Spiking Neural Network Structure Implementing Reinforcement Learning",,,,,"cs.NE","http://creativecommons.org/licenses/by-nc-sa/4.0/","  At present, implementation of learning mechanisms in spiking neural networks
(SNN) cannot be considered as a solved scientific problem despite plenty of SNN
learning algorithms proposed. It is also true for SNN implementation of
reinforcement learning (RL), while RL is especially important for SNNs because
of its close relationship to the domains most promising from the viewpoint of
SNN application such as robotics. In the present paper, I describe an SNN
structure which, seemingly, can be used in wide range of RL tasks. The
distinctive feature of my approach is usage of only the spike forms of all
signals involved - sensory input streams, output signals sent to actuators and
reward/punishment signals. Besides that, selecting the neuron/plasticity
models, I was guided by the requirement that they should be easily implemented
on modern neurochips. The SNN structure considered in the paper includes
spiking neurons described by a generalization of the LIFAT (leaky
integrate-and-fire neuron with adaptive threshold) model and a simple spike
timing dependent synaptic plasticity model (a generalization of
dopamine-modulated plasticity). My concept is based on very general assumptions
about RL task characteristics and has no visible limitations on its
applicability. To test it, I selected a simple but non-trivial task of training
the network to keep a chaotically moving light spot in the view field of an
emulated DVS camera. Successful solution of this RL problem by the SNN
described can be considered as evidence in favor of efficiency of my approach.
","[{""version"":""v1"",""created"":""Sat, 9 Apr 2022 09:08:10 GMT""}]","2022-04-12"
"2204.04432","Lorenzo Pizzuti","Lorenzo Pizzuti","Testing Screening Mechanisms with Mass Profiles of Galaxy Clusters","Proceedings of the ALTECOSMOFUN'21 conference published in Universe,
  Issue ""Alternative Gravities and Fundamental Cosmology""","Universe 2022, 8, 157","10.3390/universe8030157",,"astro-ph.CO","http://creativecommons.org/licenses/by/4.0/","  We present \textsc{MG-MAMPOSSt}, a license-free code to constrain modified
gravity models by reconstructing the mass profile of galaxy clusters with the
kinematics of the cluster's member galaxies. We describe the main features of
the code and we show the capability of the method when the kinematic
information is combined with lensing data. We discuss recent results and
forecasts on two classes of models currently implemented in the code,
characterized by different screening mechanisms, namely, chameleon and
Vainshtein screening. We further explore the impact of possible systematics in
view of application to the data from upcoming surveys. This proceedings
summarizes the results presented at the ALTECOSMOFUN workshop in September
2021.
","[{""version"":""v1"",""created"":""Sat, 9 Apr 2022 09:15:38 GMT""}]","2022-04-12"
"2204.04433","Gholamhossein Haghighat","Gholamhossein Haghighat, Mojtaba Mohammadi Najafabadi","Search for lepton-flavor-violating decays of the tau lepton at a future
  muon collider","7 pages, 2 figures",,,,"hep-ph","http://creativecommons.org/licenses/by/4.0/","  Tau leptons can have lepton-flavor-violating (LFV) couplings to a muon or an
electron and an Axion-Like Particle (ALP). ALPs are pseudo Nambu-Goldstone
bosons associated with spontaneously broken global U(1) symmetries. LFV ALPs
have been of a great interest in the last several decades as they can address
some of the SM long-lasting problems. Assuming a future muon collider proposed
by the Muon Accelerator Program (MAP), we search for LFV decays
$\tau\rightarrow\ell a$ ($\ell=e,\mu$) of one of the tau leptons produced in
the muon-anti muon annihilation. The ALP mass is assumed to be in the range 100
eV to 1 MeV and three different chiral structures are considered for the LFV
coupling. Using a multivariate technique and performing a parameterized
simulation based on the ideal target performance, we obtain expected 95$\%$
confidence level upper limits on the LFV couplings tau-electron-ALP and
tau-muon-ALP. Limits are computed assuming the center-of-mass energies of 126,
350 and 1500 GeV which the future muon collider is supposed to operate at. We
study the two cases of unpolarized and polarized muon beams and show that
taking advantage of tau polarization-induced effects, the main background
$\tau\rightarrow e/\mu + \nu\bar{\nu}$ can be significantly reduced. Results
indicate that current limits on the LFV couplings can be improved by roughly
one order of magnitude using the present analysis.
","[{""version"":""v1"",""created"":""Sat, 9 Apr 2022 09:18:07 GMT""}]","2022-04-12"
"2204.04434","Xun Cao","Xun Cao, Weihua Jiang","On Turing-Turing bifurcation of partial functional differential
  equations and its induced superposition patterns",,,,,"math.DS","http://creativecommons.org/licenses/by/4.0/","  When two Turing modes interact, i.e., Turing-Turing bifurcation occurs,
superposition patterns revealing complex dynamical phenomena appear. In this
paper, superposition patterns resulting from Turing-Turing bifurcation are
investigated in theory. Firstly, the third-order normal form locally
topologically equivalent to original partial functional differential equations
(PFDEs) is derived. When selecting 1D domain and Neumann boundary conditions,
three normal forms describing different spatial patterns are deduced from
original third-order normal form. Also, formulas for computing coefficients of
these normal forms are given, which are expressed in explicit form of original
system parameters. With the aid of three normal forms, spatial patterns of a
diffusive predator-prey system with Crowley-Martin functional response near
Turing-Turing singularity are investigated. For one set of parameters,
diffusive system supports the coexistence of four stable steady states with
different single characteristic wavelengths, which demonstrates our previous
conjecture. For another set of parameters, superposition patterns, tri-stable
patterns that a pair of stable superposition steady states coexists with the
stable coexistence equilibrium or another stable steady state, as well as
quad-stable patterns that a pair of stable superposition steady states and
another pair of stable steady states coexist, arise. Finally, numerical
simulations are shown to support theory analysis.
","[{""version"":""v1"",""created"":""Sat, 9 Apr 2022 09:22:43 GMT""}]","2022-04-12"
"2204.04435","H. Umut Suluhan","H. Umut Suluhan, Hasan F. Ates, Bahadir K. Gunturk","HSTR-Net: High Spatio-Temporal Resolution Video Generation For Wide Area
  Surveillance",,,,,"cs.CV eess.IV","http://creativecommons.org/licenses/by-nc-nd/4.0/","  Wide area surveillance has many applications and tracking of objects under
observation is an important task, which often needs high spatio-temporal
resolution (HSTR) video for better precision. This paper presents the usage of
multiple video feeds for the generation of HSTR video as an extension of
reference based super resolution (RefSR). One feed captures video at high
spatial resolution with low frame rate (HSLF) while the other captures low
spatial resolution and high frame rate (LSHF) video simultaneously for the same
scene. The main purpose is to create an HSTR video from the fusion of HSLF and
LSHF videos. In this paper we propose an end-to-end trainable deep network that
performs optical flow estimation and frame reconstruction by combining inputs
from both video feeds. The proposed architecture provides significant
improvement over existing video frame interpolation and RefSR techniques in
terms of objective PSNR and SSIM metrics.
","[{""version"":""v1"",""created"":""Sat, 9 Apr 2022 09:23:58 GMT""}]","2022-04-12"
"2204.04436","Felix Bartel","Felix Bartel","Error Guarantees for Least Squares Approximation with Noisy Samples in
  Domain Adaptation",,,,,"math.NA cs.NA","http://creativecommons.org/publicdomain/zero/1.0/","  Given $n$ samples of a function $f\colon D\to\mathbb C$ in random points
drawn with respect to a measure $\varrho_S$ we develop theoretical analysis of
the $L_2(D, \varrho_T)$-approximation error. For a parituclar choice of
$\varrho_S$ depending on $\varrho_T$, it is known that the weighted least
squares method from finite dimensional function spaces $V_m$, $\dim(V_m) = m <
\infty$ has the same error as the best approximation in $V_m$ up to a
multiplicative constant when given exact samples with logarithmic oversampling.
If the source measure $\varrho_S$ and the target measure $\varrho_T$ differ we
are in the domain adaptation setting, a subfield of transfer learning. We model
the resulting deterioration of the error in our bounds. Further, for noisy
samples, our bounds describe the bias-variance trade off depending on the
dimension $m$ of the approximation space $V_m$. All results hold with high
probability. For demonstration, we consider functions defined on the
$d$-dimensional cube given in unifom random samples. We analyze polynomials,
the half-period cosine, and a bounded orthonormal basis of the non-periodic
Sobolev space $H_{\mathrm{mix}}^2$. Overcoming numerical issues of this
$H_{\text{mix}}^2$ basis, this gives a novel stable approximation method with
quadratic error decay. Numerical experiments indicate the applicability of our
results.
","[{""version"":""v1"",""created"":""Sat, 9 Apr 2022 09:36:19 GMT""},{""version"":""v2"",""created"":""Tue, 30 May 2023 20:50:29 GMT""}]","2023-06-01"
"2204.04437","Xinnian Liang","Xinnian Liang, Shuangzhi Wu, Mu Li, Zhoujun Li","Modeling Multi-Granularity Hierarchical Features for Relation Extraction","NAACL 2022 Long Paper",,,,"cs.CL","http://creativecommons.org/licenses/by/4.0/","  Relation extraction is a key task in Natural Language Processing (NLP), which
aims to extract relations between entity pairs from given texts. Recently,
relation extraction (RE) has achieved remarkable progress with the development
of deep neural networks. Most existing research focuses on constructing
explicit structured features using external knowledge such as knowledge graph
and dependency tree. In this paper, we propose a novel method to extract
multi-granularity features based solely on the original input sentences. We
show that effective structured features can be attained even without external
knowledge. Three kinds of features based on the input sentences are fully
exploited, which are in entity mention level, segment level, and sentence
level. All the three are jointly and hierarchically modeled. We evaluate our
method on three public benchmarks: SemEval 2010 Task 8, Tacred, and Tacred
Revisited. To verify the effectiveness, we apply our method to different
encoders such as LSTM and BERT. Experimental results show that our method
significantly outperforms existing state-of-the-art models that even use
external knowledge. Extensive analyses demonstrate that the performance of our
model is contributed by the capture of multi-granularity features and the model
of their hierarchical structure. Code and data are available at
\url{https://github.com/xnliang98/sms}.
","[{""version"":""v1"",""created"":""Sat, 9 Apr 2022 09:44:05 GMT""}]","2022-04-12"
"2204.04438","Nicolae Catain Ristea","Nicolae-Catalin Ristea, Andrei Anghel, Mihai Datcu, Bertrand Chapron","Guided deep learning by subaperture decomposition: ocean patterns from
  SAR imagery",,,,,"cs.CV","http://creativecommons.org/licenses/by-nc-nd/4.0/","  Spaceborne synthetic aperture radar can provide meters scale images of the
ocean surface roughness day or night in nearly all weather conditions. This
makes it a unique asset for many geophysical applications. Sentinel 1 SAR wave
mode vignettes have made possible to capture many important oceanic and
atmospheric phenomena since 2014. However, considering the amount of data
provided, expanding applications requires a strategy to automatically process
and extract geophysical parameters. In this study, we propose to apply
subaperture decomposition as a preprocessing stage for SAR deep learning
models. Our data centring approach surpassed the baseline by 0.7, obtaining
state of the art on the TenGeoPSARwv data set. In addition, we empirically
showed that subaperture decomposition could bring additional information over
the original vignette, by rising the number of clusters for an unsupervised
segmentation method. Overall, we encourage the development of data centring
approaches, showing that, data preprocessing could bring significant
performance improvements over existing deep learning models.
","[{""version"":""v1"",""created"":""Sat, 9 Apr 2022 09:49:05 GMT""}]","2022-04-12"
"2204.04439","Zhaozhuo Zeng","Zhaozhuo Zeng, Nasir Mehmood, Yunxu Ma, Jianing Wang, Jianbo Wang, and
  Qingfang Liu","The skyrmion bags in an anisotropy gradient","7 pages, 5 figures, 2 tables",,"10.1088/1361-648X/ac8216",,"cond-mat.mes-hall physics.app-ph","http://creativecommons.org/licenses/by/4.0/","  Skyrmion bags as spin textures with arbitrary topological charge are expected
to be the carriers in racetrack memory. Here, we theoretically and numerically
investigated the dynamics of skyrmion bags in an anisotropy gradient. It is
found that, without the boundary potential, the dynamics of skyrmion bags are
dependent on the spin textures, and the velocity of skyrmionium with $Q = 0$ is
faster than other skyrmion bags. However, when the skyrmion bags move along the
boundary, the velocities of all skyrmion bags with different $Q$ are same. This
can be attributed to the same value of $u/\eta_{xx}$, where the $u$ and
$\eta_{xx}$ are the terms related to the magnetization distribution of skyrmion
bag. In addition, we theoretically derived the dynamics of skyrmion bags in the
two cases using the Thiele approach and discussed the scope of Thiele equation.
Within a certain range, the simulation results are in good agreement with the
analytically calculated results. Our findings provide an alternative way to
manipulate the racetrack memory based on the skyrmion bags.
","[{""version"":""v1"",""created"":""Sat, 9 Apr 2022 10:05:24 GMT""},{""version"":""v2"",""created"":""Tue, 12 Apr 2022 13:54:56 GMT""}]","2022-08-10"
"2204.04440","Michael Lohaus","Michael Lohaus, Matth\""aus Kleindessner, Krishnaram Kenthapadi,
  Francesco Locatello, Chris Russell","Are Two Heads the Same as One? Identifying Disparate Treatment in Fair
  Neural Networks","Accepted at NeurIPS 2022",,,,"cs.LG","http://arxiv.org/licenses/nonexclusive-distrib/1.0/","  We show that deep networks trained to satisfy demographic parity often do so
through a form of race or gender awareness, and that the more we force a
network to be fair, the more accurately we can recover race or gender from the
internal state of the network. Based on this observation, we investigate an
alternative fairness approach: we add a second classification head to the
network to explicitly predict the protected attribute (such as race or gender)
alongside the original task. After training the two-headed network, we enforce
demographic parity by merging the two heads, creating a network with the same
architecture as the original network. We establish a close relationship between
existing approaches and our approach by showing (1) that the decisions of a
fair classifier are well-approximated by our approach, and (2) that an unfair
and optimally accurate classifier can be recovered from a fair classifier and
our second head predicting the protected attribute. We use our explicit
formulation to argue that the existing fairness approaches, just as ours,
demonstrate disparate treatment and that they are likely to be unlawful in a
wide range of scenarios under US law.
","[{""version"":""v1"",""created"":""Sat, 9 Apr 2022 10:07:02 GMT""},{""version"":""v2"",""created"":""Sat, 19 Nov 2022 17:48:10 GMT""}]","2022-11-22"
"2204.04441","Leilei Lan","Leilei Lan, Haorun Yao, Guoqun Li, Xingce Fan, Mingze Li, and Teng Qiu","Structural engineering of transition-metal nitrides for surface-enhanced
  Raman scattering chips",,"Nano Research, 15(4), 3794-3803 (2022)","10.1007/s12274-021-3904-z",,"physics.app-ph physics.optics","http://arxiv.org/licenses/nonexclusive-distrib/1.0/","  Noble-metal-free surface-enhanced Raman scattering (SERS) substrates have
attracted great attention for their abundant sources, good signal uniformity,
superior biocompatibility, and high chemical stability. However, the lack of
controllable synthesis and fabrication of noble-metal-free substrates with high
SERS activity impedes their practical applications. Herein,we propose a general
strategy to fabricate a series of planar transition-metal nitride (TMN) SERS
chips via an ambient temperature sputtering deposition route.These planar TMN
(tungsten nitride, tantalum nitride, and molybdenum nitride) chips show
remarkable Raman enhancement factors (EFs) with ~105 owing to efficient
photoinduced charge transfer process between TMN chips and probe molecules.
Further, structural engineering of these TMN chips is used to improve their
SERS activity. Benefiting from the synergistic effect of charge transfer
process and electric field enhancement by constructing nanocavity structure,
the Raman EF of WN nanocavity chips could be greatly improved to 1.29 * 107,
which is an order of magnitude higher than that of planar chips. Moreover, we
also design the WN/monolayer MoS2 heterostructure chips. With the increase of
surface electron density on the upper WN and more exciton resonance transitions
in the heterostructure, a 1.94 * 107 level EF and a 5 * 10-10 m level detention
limit could be achieved. Our results provide important guidance for the
structural design of ultrasensitive noble-metal-free SERS chips.
","[{""version"":""v1"",""created"":""Sat, 9 Apr 2022 10:10:51 GMT""},{""version"":""v2"",""created"":""Tue, 12 Apr 2022 08:06:56 GMT""},{""version"":""v3"",""created"":""Wed, 13 Apr 2022 01:24:15 GMT""}]","2022-04-14"
"2204.04442","Guodong Zhang","Zengjing Chen, Shui Feng and Guodong Zhang","Strategy-Driven Limit Theorems Associated Bandit Problems",,,,,"math.PR","http://arxiv.org/licenses/nonexclusive-distrib/1.0/","  Motivated by the study of asymptotic behaviour of the bandit problems, we
obtain several strategy-driven limit theorems including the law of large
numbers, the large deviation principle, and the central limit theorem.
Different from the classical limit theorems, we develop sampling
strategy-driven limit theorems that generate the maximum or minimum average
reward. The law of large numbers identifies all possible limits that are
achievable under various strategies. The large deviation principle provides the
maximum decay probabilities for deviations from the limiting domain. To
describe the fluctuations around averages, we obtain strategy-driven central
limit theorems under optimal strategies. The limits in these theorem are
identified explicitly, and depend heavily on the structure of the events or the
integrating functions and strategies. This demonstrates the key signature of
the learning structure. Our results can be used to estimate the maximal
(minimal) rewards, and to identify the conditions of avoiding the Parrondo's
paradox in the two-armed bandit problem. It also lays the theoretical
foundation for statistical inference in determining the arm that offers the
higher mean reward.
","[{""version"":""v1"",""created"":""Sat, 9 Apr 2022 10:23:04 GMT""},{""version"":""v2"",""created"":""Sat, 16 Apr 2022 06:03:41 GMT""},{""version"":""v3"",""created"":""Wed, 18 May 2022 07:35:58 GMT""}]","2022-05-19"
"2204.04443","Tapobroto Bhanja","Tapobroto Bhanja, Ameya Kolhatkar","Gravitational Collapse of Massless Vector Field with Positive
  Cosmological Constant","4 pages, 2 figures",,,,"gr-qc hep-th","http://creativecommons.org/licenses/by/4.0/","  We investigate the dynamics of homogeneous gravitational collapse of a
massless vector field in the presence of a positive cosmological constant
$\Lambda$. The corresponding density function $\rho (a)$ obtained for the
massless vector field is inversely proportional to the fourth power of the
scale factor $a (t)$. The variation of the scale factor shows that for $0\,
\le\Lambda < 1$, we obtain the gravitational collapse of the vector fields
leading singularity formation in a {\it finite} comoving time resulting in a
{\it Blackhole} such that with increasing $\Lambda$, the singularity formation
time, $t_s$ increases. For $\Lambda = 1$, we obtain $a(t) = 0$, thus limiting
the maximum value of $\Lambda$, (w.r.t the initial density $\rho_0$) for which
the system could collapse under gravity.
","[{""version"":""v1"",""created"":""Sat, 9 Apr 2022 10:30:05 GMT""}]","2022-04-12"
"2204.04444","Camille Phiquepal","Camille Phiquepal, Andreas Orthey, Nicolas Viennot and Marc Toussaint","Path-Tree Optimization in Discrete Partially Observable Environments
  using Rapidly-Exploring Belief-Space Graphs","Also submitted to IROS 2022 and RA-L",,,,"cs.RO","http://arxiv.org/licenses/nonexclusive-distrib/1.0/","  Robots often need to solve path planning problems where essential and
discrete aspects of the environment are partially observable. This introduces a
multi-modality, where the robot must be able to observe and infer the state of
its environment. To tackle this problem, we introduce the Path-Tree
Optimization (PTO) algorithm which plans a path-tree in belief-space. A
path-tree is a tree-like motion with branching points where the robot receives
an observation leading to a belief-state update. The robot takes different
branches depending on the observation received. The algorithm has three main
steps. First, a rapidly-exploring random graph (RRG) on the state space is
grown. Second, the RRG is expanded to a belief-space graph by querying the
observation model. In a third step, dynamic programming is performed on the
belief-space graph to extract a path-tree. The resulting path-tree combines
exploration with exploitation i.e. it balances the need for gaining knowledge
about the environment with the need for reaching the goal. We demonstrate the
algorithm capabilities on navigation and mobile manipulation tasks, and show
its advantage over a baseline using a task and motion planning approach (TAMP)
both in terms of optimality and runtime.
","[{""version"":""v1"",""created"":""Sat, 9 Apr 2022 10:33:36 GMT""},{""version"":""v2"",""created"":""Sun, 31 Jul 2022 10:56:46 GMT""}]","2022-08-02"
"2204.04445","Kilian Scheutwinkel","K.H. Scheutwinkel, E. de Lera Acedo, W. Handley","Bayesian evidence-driven diagnosis of instrumental systematics for
  sky-averaged 21-cm cosmology experiments","accepted to PASA",,"10.1017/pasa.2022.49",,"astro-ph.CO","http://creativecommons.org/publicdomain/zero/1.0/","  We demonstrate the effectiveness of a Bayesian evidence-based analysis for
diagnosing and disentangling the sky-averaged 21-cm signal from instrumental
systematic effects. As a case study, we consider a simulated REACH pipeline
with an injected systematic. We demonstrate that very poor performance or
erroneous signal recovery is achieved if the systematic remains unmodelled.
These effects include sky-averaged 21-cm posterior estimates resembling a very
deep or wide signal. However, when including parameterised models of the
systematic, the signal recovery is dramatically improved in performance. Most
importantly, a Bayesian evidence-based model comparison is capable of
determining whether or not such a systematic model is needed as the true
underlying generative model of an experimental dataset is in principle unknown.
We, therefore, advocate a pipeline capable of testing a variety of potential
systematic errors with the Bayesian evidence acting as the mechanism for
detecting their presence.
","[{""version"":""v1"",""created"":""Sat, 9 Apr 2022 10:34:06 GMT""},{""version"":""v2"",""created"":""Fri, 23 Sep 2022 14:51:14 GMT""}]","2022-10-26"
