"2204.04824","Eder Correa","Eder M. Correa","Levi-Civita Ricci-flat metrics on non-K\""{a}hler Calabi-Yau manifolds","minor corrections, 24 pages, 2 figures. Comments and suggestions are
  welcome",,,,"math.DG math.AG","http://arxiv.org/licenses/nonexclusive-distrib/1.0/","  In this paper, we provide new examples of Levi-Civita Ricci-flat Hermitian
metrics on certain compact non-K\""{a}hler Calabi-Yau manifolds, including every
compact Hermitian Weyl-Einstein manifold, every compact locally conformal
hyperK\""{a}hler manifold, certain suspensions of Brieskorn manifolds, and every
generalized Hopf manifold provided by suspensions of exotic spheres. These
examples generalize previous constructions on Hopf manifolds. Additionally, we
also construct new examples of compact Hermitian manifolds with nonnegative
first Chern class that admit constant strictly negative Riemannian scalar
curvature. Further, we remark some applications of our main results in the
study of the Chern-Ricci flow on compact Hermitian Weyl-Einstein manifolds. In
particular, we describe the Gromov-Hausdorff limit for certain explicit
finite-time collapsing solutions which generalize previous constructions on
Hopf manifolds.
","[{""version"":""v1"",""created"":""Mon, 11 Apr 2022 01:39:05 GMT""},{""version"":""v2"",""created"":""Fri, 15 Apr 2022 17:18:32 GMT""},{""version"":""v3"",""created"":""Tue, 21 Jun 2022 15:29:24 GMT""}]","2022-06-22"
"2204.04825","Derek Leinweber","Derek Leinweber, James Biddle, Waseem Kamleh (University of Adelaide)","Impact of Dynamical Fermions on Centre Vortex Structure","9 pages, 5 figures with 4 3D interactive. Proceedings of the 38th
  International Symposium on Lattice Field Theory (Lattice 2021), 26th - 30th
  July 2021, Zoom/Gather@Massachusetts Institute of Technology","PoS(LATTICE2021)197",,"ADP-22-13/T1184","hep-lat nucl-th","http://creativecommons.org/licenses/by/4.0/","  This presentation examines the centre vortex structure of Monte-Carlo
generated gauge-field configurations using modern visualisation techniques.
This time, the manner in which light dynamical fermion degrees of freedom
impact the centre-vortex structure is explored. Focusing on the thin vortices
identified by plaquettes having a non-trivial centre phase, the vortex
structure is illustrated through 3D renderings of oriented plaquettes. The
impact of light dynamical fermions is not subtle, changing both the density of
vortices and the complexity of the vortex structures observed. The role of
vortex branching points in full QCD is highlighted in the survey of results
presented.
","[{""version"":""v1"",""created"":""Mon, 11 Apr 2022 01:55:45 GMT""}]","2022-04-12"
"2204.04826","Hugh Zhang","Hugh Zhang, Adam Lerer, Noam Brown","Equilibrium Finding in Normal-Form Games Via Greedy Regret Minimization","AAAI 2022",,,,"cs.GT","http://creativecommons.org/licenses/by/4.0/","  We extend the classic regret minimization framework for approximating
equilibria in normal-form games by greedily weighing iterates based on regrets
observed at runtime. Theoretically, our method retains all previous convergence
rate guarantees. Empirically, experiments on large randomly generated games and
normal-form subgames of the AI benchmark Diplomacy show that greedy weights
outperforms previous methods whenever sampling is used, sometimes by several
orders of magnitude.
","[{""version"":""v1"",""created"":""Mon, 11 Apr 2022 02:00:21 GMT""}]","2022-04-12"
"2204.04827","Changhong Zhao","Heng Liang, Xinyang Zhou, Changhong Zhao","Hierarchical Optimal Power Flow with Improved Gradient Evaluation",,,,,"math.OC","http://creativecommons.org/licenses/by-nc-nd/4.0/","  Existing algorithms to solve alternating-current optimal power flow (AC-OPF)
often exploit linear approximations to simplify system models and accelerate
computations. In this paper, we improve a recent hierarchical OPF algorithm,
which rested on primal-dual gradients evaluated in a linearized distribution
power flow model. Specifically, we identify a risk of voltage violation arising
from the model linearization, and propose a more accurate gradient evaluation
method to eliminate that risk. We further develop a hierarchical primal-dual
algorithm to solve OPF based on the proposed gradient evaluation method.
Numerical results on IEEE networks show that our algorithm can enhance voltage
safety with satisfactory computational efficiency.
","[{""version"":""v1"",""created"":""Mon, 11 Apr 2022 02:19:29 GMT""},{""version"":""v2"",""created"":""Wed, 8 Feb 2023 14:39:56 GMT""}]","2023-02-09"
"2204.04828","Shyam Narayanan","Vincent Cohen-Addad, Hossein Esfandiari, Vahab Mirrokni, Shyam
  Narayanan","Improved Approximations for Euclidean $k$-means and $k$-median, via
  Nested Quasi-Independent Sets","74 pages. To appear in Symposium on Theory of Computing (STOC), 2022",,,,"cs.DS cs.CG cs.LG","http://arxiv.org/licenses/nonexclusive-distrib/1.0/","  Motivated by data analysis and machine learning applications, we consider the
popular high-dimensional Euclidean $k$-median and $k$-means problems. We
propose a new primal-dual algorithm, inspired by the classic algorithm of Jain
and Vazirani and the recent algorithm of Ahmadian, Norouzi-Fard, Svensson, and
Ward. Our algorithm achieves an approximation ratio of $2.406$ and $5.912$ for
Euclidean $k$-median and $k$-means, respectively, improving upon the 2.633
approximation ratio of Ahmadian et al. and the 6.1291 approximation ratio of
Grandoni, Ostrovsky, Rabani, Schulman, and Venkat.
  Our techniques involve a much stronger exploitation of the Euclidean metric
than previous work on Euclidean clustering. In addition, we introduce a new
method of removing excess centers using a variant of independent sets over
graphs that we dub a ""nested quasi-independent set"". In turn, this technique
may be of interest for other optimization problems in Euclidean and $\ell_p$
metric spaces.
","[{""version"":""v1"",""created"":""Mon, 11 Apr 2022 02:19:40 GMT""},{""version"":""v2"",""created"":""Tue, 12 Apr 2022 03:16:11 GMT""}]","2022-04-13"
"2204.04829","Denis Borisov I.","D.I. Borisov, J. Kriz","Operator estimates for non-periodically perforated domains with
  Dirichlet and nonlinear Robin conditions: vanishing limit",,,,,"math.AP math-ph math.MP math.SP","http://arxiv.org/licenses/nonexclusive-distrib/1.0/","  We consider a general second order linear elliptic equation in a finely
perforated domain. The shapes of cavities and their distribution in the domain
are arbitrary and non-periodic; they are supposed to satisfy minimal natural
geometric conditions. On the boundaries of the cavities we impose either the
Dirichlet or a nonlinear Robin condition; the choice of the type of the
boundary condition for each cavity is arbitrary. Then we suppose that for some
cavities the nonlinear Robin condition is sign-definite in certain sense.
Provided such cavities and ones with the Dirichlet condition are distributed
rather densely in the domain and the characteristic sizes of the cavities and
the minimal distances between the cavities satisfy certain simple condition, we
show that a solution to our problem tends to zero as the perforation becomes
finer. Our main result are order sharp estimates for the $L_2$- and
$W_2^1$-norms of the solution uniform in the $L_2$-norm of the right hand side
in the equation.
","[{""version"":""v1"",""created"":""Mon, 11 Apr 2022 02:20:29 GMT""},{""version"":""v2"",""created"":""Thu, 11 Aug 2022 10:33:32 GMT""},{""version"":""v3"",""created"":""Tue, 23 Aug 2022 15:13:50 GMT""}]","2022-08-24"
"2204.04830","Chunmei Wang","Chunmei Wang, Junping Wang, Shangyou Zhang","A parallel iterative procedure for weak Galerkin methods for second
  order elliptic problems","18 pages, 4 figures, 12 tables",,,,"math.NA cs.NA","http://arxiv.org/licenses/nonexclusive-distrib/1.0/","  A parallelizable iterative procedure based on domain decomposition is
presented and analyzed for weak Galerkin finite element methods for second
order elliptic equations. The convergence analysis is established for the
decomposition of the domain into individual elements associated to the weak
Galerkin methods or into larger subdomains. A series of numerical tests are
illustrated to verify the theory developed in this paper.
","[{""version"":""v1"",""created"":""Mon, 11 Apr 2022 02:22:00 GMT""}]","2022-04-12"
"2204.04831","Yi Ding","Yi Ding, Alex Renda, Ahsan Pervaiz, Michael Carbin, Henry Hoffmann","Cello: Efficient Computer Systems Optimization with Predictive Early
  Termination and Censored Regression",,,,,"cs.LG cs.AR cs.DC cs.PF","http://creativecommons.org/licenses/by/4.0/","  Sample-efficient machine learning (SEML) has been widely applied to find
optimal latency and power tradeoffs for configurable computer systems. Instead
of randomly sampling from the configuration space, SEML reduces the search cost
by dramatically reducing the number of configurations that must be sampled to
optimize system goals (e.g., low latency or energy). Nevertheless, SEML only
reduces one component of cost -- the total number of samples collected -- but
does not decrease the cost of collecting each sample. Critically, not all
samples are equal; some take much longer to collect because they correspond to
slow system configurations. This paper present Cello, a computer systems
optimization framework that reduces sample collection costs -- especially those
that come from the slowest configurations. The key insight is to predict ahead
of time whether samples will have poor system behavior (e.g., long latency or
high energy) and terminate these samples early before their measured system
behavior surpasses the termination threshold, which we call it predictive early
termination. To predict the future system behavior accurately before it
manifests as high runtime or energy, Cello uses censored regression to produces
accurate predictions for running samples. We evaluate Cello by optimizing
latency and energy for Apache Spark workloads. We give Cello a fixed amount of
time to search a combined space of hardware and software configuration
parameters. Our evaluation shows that compared to the state-of-the-art SEML
approach in computer systems optimization, Cello improves latency by 1.19X for
minimizing latency under a power constraint, and improves energy by 1.18X for
minimizing energy under a latency constraint.
","[{""version"":""v1"",""created"":""Mon, 11 Apr 2022 02:29:57 GMT""}]","2022-04-12"
"2204.04832","George Mertzios","Thekla Hamm and Nina Klobas and George B. Mertzios and Paul G.
  Spirakis","The Complexity of Temporal Vertex Cover in Small-Degree Graphs",,,,,"cs.DS cs.DM","http://arxiv.org/licenses/nonexclusive-distrib/1.0/","  Temporal graphs naturally model graphs whose underlying topology changes over
time. Recently, the problems TEMPORAL VERTEX COVER (or TVC) and SLIDING-WINDOW
TEMPORAL VERTEX COVER(or $\Delta$-TVC for time-windows of a fixed-length
$\Delta$) have been established as natural extensions of the classic problem
VERTEX COVER on static graphs with connections to areas such as surveillance in
sensor networks. In this paper we initiate a systematic study of the complexity
of TVC and $\Delta$-TVC on sparse graphs. Our main result shows that for every
$\Delta\geq 2$, $\Delta$-TVC is NP-hard even when the underlying topology is
described by a path or a cycle. This resolves an open problem from literature
and shows a surprising contrast between $\Delta$-TVC and TVC for which we
provide a polynomial-time algorithm in the same setting. To circumvent this
hardness, we present a number of exact and approximation algorithms for
temporal graphs whose underlying topologies are given by a path, that have
bounded vertex degree in every time step, or that admit a small-sized temporal
vertex cover.
","[{""version"":""v1"",""created"":""Mon, 11 Apr 2022 02:31:00 GMT""}]","2022-04-12"
"2204.04833","Hosein Rezaei","Hosein Rezaei","Word Embeddings Are Capable of Capturing Rhythmic Similarity of Words",,,,,"cs.CL cs.LG","http://creativecommons.org/licenses/by/4.0/","  Word embedding systems such as Word2Vec and GloVe are well-known in deep
learning approaches to NLP. This is largely due to their ability to capture
semantic relationships between words. In this work we investigated their
usefulness in capturing rhythmic similarity of words instead. The results show
that vectors these embeddings assign to rhyming words are more similar to each
other, compared to the other words. It is also revealed that GloVe performs
relatively better than Word2Vec in this regard. We also proposed a first of its
kind metric for quantifying rhythmic similarity of a pair of words.
","[{""version"":""v1"",""created"":""Mon, 11 Apr 2022 02:33:23 GMT""},{""version"":""v2"",""created"":""Thu, 14 Apr 2022 07:28:15 GMT""}]","2022-04-15"
"2204.04834","Xuewen Liu","Xuewen Liu, Shu-Yuan Guo, Bin Zhu, Ying Li","Correlating Gravitational Waves with $W$-boson Mass, FIMP Dark Matter,
  and Majorana Seesaw Mechanism","References updated, accepted for publication in Science Bulletin","Science Bulletin, 2022, 67(14): 1437-1442","10.1016/j.scib.2022.06.011",,"hep-ph","http://creativecommons.org/publicdomain/zero/1.0/","  We study a minimal extension of the Standard Model by introducing three
right-handed neutrinos and a new scotogenic scalar doublet, in which the mass
splittings between neutral and charged components are responsible for the
$W$-boson mass newly measured by the CDF collaboration. This model can not only
generate non-vanishing Majorana neutrino masses via the interaction of
right-handed neutrinos and scotogenic scalars, but also explain the Universe's
missing matter in the form of FIMP dark matter. We also study the influence of
the mass splitting on the first order electroweak phase transition, and find
that it can further enhance the transition strength and thus induce
gravitational waves during the phase transition, which may be detected in the
forthcoming detectors such as U-DECIGO.
","[{""version"":""v1"",""created"":""Mon, 11 Apr 2022 02:40:16 GMT""},{""version"":""v2"",""created"":""Tue, 19 Apr 2022 02:32:30 GMT""},{""version"":""v3"",""created"":""Thu, 23 Jun 2022 15:41:00 GMT""}]","2022-08-02"
"2204.04835","Yuan Zhou","Yuan Zhou, Shuang-Liang Yang, Dong-Yan Lv, Hai-Ming Huang, Xin-Ke Li,
  Guang-Hui Wang, Chang-Sheng Hu","First- and second-order gradient couplings to NV centers engineered by
  the geometric symmetry","This manuscript need to be modified",,,,"cond-mat.mes-hall physics.app-ph quant-ph","http://arxiv.org/licenses/nonexclusive-distrib/1.0/","  The magnetic fields with the first- and second-order gradient are engineered
in several mechanically controlled hybrid systems. The current-carrying
nanowires with different geometries can induce a tunable magnetic field
gradient because of their geometric symmetries, and therefore develop various
couplings to nitrogen-vacancy (NV) centers. For instance, a straight nanowire
can guarantee the Jaynes-Cummings (JC) spin-phonon interaction and may indicate
a potential route towards the application on quantum measurement. Especially,
two parallel straight nanowires can develop the coherent down-conversion
spin-phonon interaction through a second-order gradient of the magnetic field,
and it can induce a bundle emission of the antibunched phonon pairs via an
entirely different magnetic mechanism. Maybe, this investigation is further
believed to support NV's future applications in the area of quantum
manipulation, quantum sensing, and precision measurement, etc.
","[{""version"":""v1"",""created"":""Mon, 11 Apr 2022 02:40:57 GMT""},{""version"":""v2"",""created"":""Fri, 23 Sep 2022 12:32:11 GMT""}]","2022-09-26"
"2204.04836","Jihwan Park","Jihwan Park, SeungJun Lee, Hwan Heo, Hyeong Kyu Choi, Hyunwoo J.Kim","Consistency Learning via Decoding Path Augmentation for Transformers in
  Human Object Interaction Detection","CVPR2022 accepted",,,,"cs.CV","http://creativecommons.org/licenses/by/4.0/","  Human-Object Interaction detection is a holistic visual recognition task that
entails object detection as well as interaction classification. Previous works
of HOI detection has been addressed by the various compositions of subset
predictions, e.g., Image -> HO -> I, Image -> HI -> O. Recently, transformer
based architecture for HOI has emerged, which directly predicts the HOI
triplets in an end-to-end fashion (Image -> HOI). Motivated by various
inference paths for HOI detection, we propose cross-path consistency learning
(CPC), which is a novel end-to-end learning strategy to improve HOI detection
for transformers by leveraging augmented decoding paths. CPC learning enforces
all the possible predictions from permuted inference sequences to be
consistent. This simple scheme makes the model learn consistent
representations, thereby improving generalization without increasing model
capacity. Our experiments demonstrate the effectiveness of our method, and we
achieved significant improvement on V-COCO and HICO-DET compared to the
baseline models. Our code is available at https://github.com/mlvlab/CPChoi.
","[{""version"":""v1"",""created"":""Mon, 11 Apr 2022 02:45:00 GMT""}]","2022-04-12"
"2204.04837","Ziaur Rahman","Sk. Tanzir Mehedi, Adnan Anwar, Ziaur Rahman, Kawsar Ahmed and Rafiqul
  Islam","Dependable Intrusion Detection System for IoT: A Deep Transfer
  Learning-based Approach","12 pages, 13 Figures, 4 tables IEEE Transaction","IEEE Transactions on Industrial Informatics, 2022","10.1109/TII.2022.3164770",,"cs.CR cs.LG","http://creativecommons.org/licenses/by-nc-sa/4.0/","  Security concerns for IoT applications have been alarming because of their
widespread use in different enterprise systems. The potential threats to these
applications are constantly emerging and changing, and therefore, sophisticated
and dependable defense solutions are necessary against such threats. With the
rapid development of IoT networks and evolving threat types, the traditional
machine learning-based IDS must update to cope with the security requirements
of the current sustainable IoT environment. In recent years, deep learning, and
deep transfer learning have progressed and experienced great success in
different fields and have emerged as a potential solution for dependable
network intrusion detection. However, new and emerging challenges have arisen
related to the accuracy, efficiency, scalability, and dependability of the
traditional IDS in a heterogeneous IoT setup. This manuscript proposes a deep
transfer learning-based dependable IDS model that outperforms several existing
approaches. The unique contributions include effective attribute selection,
which is best suited to identify normal and attack scenarios for a small amount
of labeled data, designing a dependable deep transfer learning-based ResNet
model, and evaluating considering real-world data. To this end, a comprehensive
experimental performance evaluation has been conducted. Extensive analysis and
performance evaluation show that the proposed model is robust, more efficient,
and has demonstrated better performance, ensuring dependability.
","[{""version"":""v1"",""created"":""Mon, 11 Apr 2022 02:46:22 GMT""}]","2022-04-12"
"2204.04838","Kabir Husain","Kabir Husain, Sriram Ramaswamy, Madan Rao","Robust Molecular Computation by Active Mechanics","5 pages, 4 figures",,,,"cond-mat.soft physics.bio-ph","http://creativecommons.org/licenses/by-nc-nd/4.0/","  The living cell expends energetic and material resources to reliably process
information from its environment. To do so, it utilises unreliable molecular
circuitry that is subject to thermal and other fluctuations. Here, we argue
that active, physical processes can provide error correcting mechanisms for
information processing. We analyse a model in which fluctuating receptor
activation induces contractile stresses that recruit further receptors,
dynamically controlling resource usage and accuracy. We show that this active
scheme can outperform passive, static clusters (as formed, for instance, by
protein crosslinking). We consider simple binary environments, informative
decision trees, and chemical computations; in each case, active stresses serve
to contextually build signalling platforms that dynamically suppress error and
allows for robust cellular computation.
","[{""version"":""v1"",""created"":""Mon, 11 Apr 2022 02:54:18 GMT""}]","2022-04-12"
"2204.04839","Wataru Takeda","Maki Nakasuji, Yasuo Ohno, Wataru Takeda","An interpolation of the generalized duality formula for the Schur
  multiple zeta values to complex functions","13 pages",,,,"math.NT","http://arxiv.org/licenses/nonexclusive-distrib/1.0/","  One of the important research subjects in the study of multiple zeta
functions is to clarify the linear relations and functional equations among
them. The Schur multiple zeta functions are a generalization of the multiple
zeta functions of Euler-Zagier type. Among many relations, the duality formula
and its generalization are important families for both Euler-Zagier type and
Schur type multiple zeta values. In this paper, following the method of
previous works for multiple zeta values of Euler-Zagier type, we give an
interpolation of the sums in the generalized duality formula, called Ohno
relation, for Schur multiple zeta values. Moreover, we prove that the Ohno
relation for Schur multiple zeta values is valid for complex numbers.
","[{""version"":""v1"",""created"":""Mon, 11 Apr 2022 02:54:37 GMT""},{""version"":""v2"",""created"":""Mon, 20 Jun 2022 01:58:10 GMT""}]","2022-06-22"
"2204.04840","Chiyu Gu","Chiyu Gu, Veerabhadran Baladandayuthapani and Subharup Guha","Nonparametric Bayes Differential Analysis of Multigroup DNA Methylation
  Data",,,,,"stat.ME stat.AP","http://creativecommons.org/licenses/by/4.0/","  DNA methylation datasets in cancer studies are comprised of measurements on a
large number of genomic locations called cytosine-phosphate-guanine (CpG) sites
with complex correlation structures. A fundamental goal of these studies is the
development of statistical techniques that can identify disease genomic
signatures across multiple patient groups defined by different experimental or
biological conditions. We propose BayesDiff, a nonparametric Bayesian approach
for differential analysis relying on a novel class of first order mixture
models called the Sticky Pitman-Yor process or two-restaurant two-cuisine
franchise (2R2CF). The BayesDiff methodology flexibly utilizes information from
all CpG sites or probes, adaptively accommodates any serial dependence due to
the widely varying inter-probe distances and performs simultaneous inferences
about the differential genomic signature of the patient groups. Using
simulation studies, we demonstrate the effectiveness of the BayesDiff procedure
relative to existing statistical techniques for differential DNA methylation.
The methodology is applied to analyze a gastrointestinal (GI) cancer dataset
that displays both serial correlations and interaction patterns. The results
support and complement known aspects of DNA methylation and gene association in
upper GI cancers.
","[{""version"":""v1"",""created"":""Mon, 11 Apr 2022 02:59:13 GMT""},{""version"":""v2"",""created"":""Thu, 4 May 2023 06:02:58 GMT""}]","2023-05-05"
"2204.04841","Shaoshan Liu","Shaoshan Liu, Yuzhang Huang, Leiyu Shi","Autonomous Mobile Clinics: Empowering Affordable Anywhere Anytime
  Healthcare Access","5 pages, 1 figure",,,,"cs.CY cs.AI","http://arxiv.org/licenses/nonexclusive-distrib/1.0/","  We are facing a global healthcare crisis today as the healthcare cost is ever
climbing, but with the aging population, government fiscal revenue is ever
dropping. To create a more efficient and effective healthcare system, three
technical challenges immediately present themselves: healthcare access,
healthcare equity, and healthcare efficiency. An autonomous mobile clinic
solves the healthcare access problem by bringing healthcare services to the
patient by the order of the patient's fingertips. Nevertheless, to enable a
universal autonomous mobile clinic network, a three-stage technical roadmap
needs to be achieved: In stage one, we focus on solving the inequity challenge
in the existing healthcare system by combining autonomous mobility and
telemedicine. In stage two, we develop an AI doctor for primary care, which we
foster from infancy to adulthood with clean healthcare data. With the AI
doctor, we can solve the inefficiency problem. In stage three, after we have
proven that the autonomous mobile clinic network can truly solve the target
clinical use cases, we shall open up the platform for all medical verticals,
thus enabling universal healthcare through this whole new system.
","[{""version"":""v1"",""created"":""Mon, 11 Apr 2022 02:59:55 GMT""},{""version"":""v2"",""created"":""Wed, 29 Jun 2022 02:25:56 GMT""},{""version"":""v3"",""created"":""Tue, 6 Sep 2022 04:20:06 GMT""}]","2022-09-07"
