"2204.05090","Matthias Wessling","Felix Stockmeier, Michael Schatz, Malte Habermann, John Linkhorst, Ali
  Mani, Matthias Wessling","Direct 3D observation and unraveling of electroconvection phenomena
  during concentration polarization at ion-exchange membranes",,,"10.1016/j.memsci.2021.119846",,"physics.flu-dyn physics.app-ph","http://arxiv.org/licenses/nonexclusive-distrib/1.0/","  A decade ago, two-dimensional microscopic flow visualization proved the
theoretically predicted existence of electroconvection roles as well as their
decisive role in destabilizing the concentration polarization layer at
ion-selective fluid/membrane interfaces. Electroconvection induces chaotic flow
vortices injecting volume having bulk concentration into the ion-depleted
diffusion layer at the interface. Experimental quantification of these
important flow patterns have so far only been carried out in 2D. Numerical
direct simulations suggest 3D features, yet experimental proof is lacking. 3D
simulations are also limited in covering extended spacial and temporal scales.
  This study presents a new comprehensive experimental method for the
time-resolved recording of the 3D electroconvective velocity field near a
cation-exchange membrane. For the first time, the spatio-temporal velocity
field can be visualized in 3D at multiples of the overlimiting current density.
In contrast to today's simulations, these experiments cover length and time
scales typical for actual electrodialytic membrane processes.
  We visualize coherent vortex structures and reveal the changes in the
velocity field and its statistics during the transition from vortex rolls to
vortex rings with increasing current density. The transition is characterized
by changes in the rotational direction, mean square velocity, and temporal
energy spectrum with only little influence on the spatial spectrum. These
findings indicate a more significant impact of EC's structural change on the
mean square velocities and temporal spectra than on the spatial spectra. This
knowledge is a prerequisite for engineering ion-selective surfaces that will
enable the operation of electrically driven processes beyond the
diffusion-limited Nernst regime.
","[{""version"":""v1"",""created"":""Mon, 11 Apr 2022 13:50:31 GMT""}]","2022-04-12"
"2204.05091","Theodore Sumers","Theodore R. Sumers, Robert D. Hawkins, Mark K. Ho, Thomas L.
  Griffiths, Dylan Hadfield-Menell","Linguistic communication as (inverse) reward design","6 pages, 3 figures. Accepted at Learning from Natural Language
  Supervision workshop (ACL 2022)",,,,"cs.AI cs.CL","http://creativecommons.org/licenses/by/4.0/","  Natural language is an intuitive and expressive way to communicate reward
information to autonomous agents. It encompasses everything from concrete
instructions to abstract descriptions of the world. Despite this, natural
language is often challenging to learn from: it is difficult for machine
learning methods to make appropriate inferences from such a wide range of
input. This paper proposes a generalization of reward design as a unifying
principle to ground linguistic communication: speakers choose utterances to
maximize expected rewards from the listener's future behaviors. We first extend
reward design to incorporate reasoning about unknown future states in a linear
bandit setting. We then define a speaker model which chooses utterances
according to this objective. Simulations show that short-horizon speakers
(reasoning primarily about a single, known state) tend to use instructions,
while long-horizon speakers (reasoning primarily about unknown, future states)
tend to describe the reward function. We then define a pragmatic listener which
performs inverse reward design by jointly inferring the speaker's latent
horizon and rewards. Our findings suggest that this extension of reward design
to linguistic communication, including the notion of a latent speaker horizon,
is a promising direction for achieving more robust alignment outcomes from
natural language supervision.
","[{""version"":""v1"",""created"":""Mon, 11 Apr 2022 13:50:34 GMT""}]","2022-04-12"
"2204.05092","Silvio Traversaro","Martijn Bos, Silvio Traversaro, Daniele Pucci and Alessandro Saccon","Efficient Geometric Linearization of Moving-Base Rigid Robot Dynamics",,"AIMS Journal of Geometric Mechanics (JGM) 2022",,,"cs.RO","http://arxiv.org/licenses/nonexclusive-distrib/1.0/","  The linearization of the equations of motion of a robotics system about a
given state-input trajectory, including a controlled equilibrium state, is a
valuable tool for model-based planning, closed-loop control, gain tuning, and
state estimation. Contrary to the case of fixed based manipulators with
prismatic or rotary joints, the state space of moving-base robotic systems such
as humanoids, quadruped robots, or aerial manipulators cannot be globally
parametrized by a finite number of independent coordinates. This impossibility
is a direct consequence of the fact that the state of these systems includes
the system's global orientation, formally described as an element of the
special orthogonal group SO(3). As a consequence, obtaining the linearization
of the equations of motion for these systems is typically resolved, from a
practical perspective, by locally parameterizing the system's attitude by means
of, e.g., Euler or Cardan angles. This has the drawback, however, of
introducing artificial parameterization singularities and extra derivative
computations. In this contribution, we show that it is actually possible to
define a notion of linearization that does not require the use of a local
parameterization for the system's orientation, obtaining a mathematically
elegant, recursive, and singularity-free linearization for moving-based robot
systems. Recursiveness, in particular, is obtained by proposing a nontrivial
modification of existing recursive algorithms to allow for computations of the
geometric derivatives of the inverse dynamics and the inverse of the mass
matrix of the robotic system. The correctness of the proposed algorithm is
validated by means of a numerical comparison with the result obtained via
geometric finite difference.
","[{""version"":""v1"",""created"":""Mon, 11 Apr 2022 13:52:07 GMT""}]","2022-04-20"
"2204.05093","Michael Neumann","Lisa Rometsch, Richard Wegner, Florian Brusch, Michael Neumann, Lukas
  Linke","When is Good Good Enough? Context Factors for Good Remote Work of Agile
  Software Development Teams. The Otto Case",,,,,"cs.SE","http://arxiv.org/licenses/nonexclusive-distrib/1.0/","  The Covid-19 pandemic led to several challenges in everybody working life.
Many companies worldwide enabled comprehensive remote work settings for their
employees. Agile Software Development Teams are affected by the switch to
remote work as agile methods setting communication and collaboration in focus.
The well-being and motivation of software engineers and developers, which
impacting their performance, are influenced by specific context factors. This
paper aims to analyze identify specific context factors for a good remote work
setting. We designed a single case study at a German ecommerce company and
conducted an experiment using a gamification approach including eight
semi-structured interviews. Our results show, that the agile software
development team members to their health. Furthermore, most the team members
value the gamification approach to put more focus on physical activities and
the health well-being. We discuss several practical implications and provide
recommendations for other teams and companies.
","[{""version"":""v1"",""created"":""Mon, 11 Apr 2022 13:53:11 GMT""}]","2022-04-12"
"2204.05094","Matthias Wessling","Denis Wypysek, Anna Maria Kalde, Florian Pradellok, Matthias Wessling","In-situ investigation of wetting patterns in polymeric multibore
  membranes via magnetic resonance imaging",,,"10.1016/j.memsci.2020.119026",,"physics.app-ph","http://arxiv.org/licenses/nonexclusive-distrib/1.0/","  Wetting of the membrane to displace air or conditioning liquids is important
to exploit the complex porosity of a filtration membrane. This study reveals
the details of wetting in multibore membrane-based filtration modules. Using
magnetic resonance imaging (MRI), we quantify the fluid distribution patterns
during initial membrane wetting in dead-end permeation mode. The
spatio-temporal evolution of aqueous copper sulfate solution wetting the
membrane fibers was investigated as a function of the applied flux, packing
density, and position along the membrane module length. Three initial wetting
conditions were examined: delivery-state membranes, ethanol-washed and dried
(air-filled) membranes, and ethanol-filled membranes. Significant changes in
wetting patterns were observed due to interfacial and polymer swelling effects.
This in-situ investigation reveals a slow wetting progression over six hours
and more to obtain complete wetting, even at high fluxes of 200 LMH. However,
an increased flux leads to faster wetting kinetics as the evolving wetting
patterns are flux dependent. The packing density of the multibore fibers
additionally impacts the wetting kinetics by shifting the prevalent pressure
conditions. Although in dead-end mode, the wetting progression is non-uniform
along the membrane module length. In addition to this parameter study,
different pre-wetting agents' effect on the displacement behavior was
investigated in depth. This study helps to understand (a) complex wetting
phenomena inside multibore membranes in dead-end filtration, (b) the membranes'
interaction with their surroundings due to neighboring membranes, and (c) the
effect of the used fluid system for displacement on the resulting wetting
patterns.
","[{""version"":""v1"",""created"":""Mon, 11 Apr 2022 13:53:18 GMT""}]","2022-04-12"
"2204.05095","Maxim Ziatdinov","Sergei V. Kalinin, Maxim Ziatdinov, Bobby G. Sumpter, Andrew D. White","Physics is the New Data",,,,,"physics.data-an","http://arxiv.org/licenses/nonexclusive-distrib/1.0/","  The rapid development of machine learning (ML) methods has fundamentally
affected numerous applications ranging from computer vision, biology, and
medicine to accounting and text analytics. Until now, it was the availability
of large and often labeled data sets that enabled significant breakthroughs.
However, the adoption of these methods in classical physical disciplines has
been relatively slow, a tendency that can be traced to the intrinsic
differences between correlative approaches of purely data-based ML and the
causal hypothesis-driven nature of physical sciences. Furthermore, anomalous
behaviors of classical ML necessitate addressing issues such as explainability
and fairness of ML. We also note the sequence in which deep learning became
mainstream in different scientific disciplines - starting from medicine and
biology and then towards theoretical chemistry, and only after that, physics -
is rooted in the progressively more complex level of descriptors, constraints,
and causal structures available for incorporation in ML architectures. Here we
put forth that over the next decade, physics will become a new data, and this
will continue the transition from dot-coms and scientific computing concepts of
the 90ies to big data of 2000-2010 to deep learning of 2010-2020 to
physics-enabled scientific ML.
","[{""version"":""v1"",""created"":""Mon, 11 Apr 2022 13:54:54 GMT""}]","2022-04-12"
"2204.05096","Yuki Odaka","Yuki Odaka, Ken Kaneiwa","Block-Segmentation Vectors for Arousal Prediction using Semi-supervised
  Learning",,,,,"cs.CL","http://arxiv.org/licenses/nonexclusive-distrib/1.0/","  To handle emotional expressions in computer applications, Russell's circum-
plex model has been useful for representing emotions according to valence and
arousal. In SentiWordNet, the level of valence is automatically assigned to a
large number of synsets (groups of synonyms in WordNet) using semi-supervised
learning. However, when assigning the level of arousal, the existing method
proposed for SentiWordNet reduces the accuracy of sentiment prediction. In this
paper, we propose a block-segmentation vector for predicting the arousal levels
of many synsets from a small number of labeled words using semi-supervised
learning. We analyze the distribution of arousal and non-arousal words in a
corpus of sentences by comparing it with the distribution of valence words. We
address the problem that arousal level prediction fails when arousal and
non-arousal words are mixed together in some sentences. To capture the features
of such arousal and non-arousal words, we generate word vectors based on
inverted indexes by block IDs, where the corpus is divided into blocks in the
flow of sentences. In the evaluation experiment, we show that the results of
arousal prediction with the block-segmentation vectors outperform the results
of the previous method in SentiWordNet.
","[{""version"":""v1"",""created"":""Mon, 11 Apr 2022 13:55:21 GMT""}]","2022-04-12"
"2204.05097","Haroldo Ribeiro","Alvaro F. Martins, Bruno R. da Cunha, Quentin S. Hanley, Sebastian
  Goncalves, Matjaz Perc, Haroldo V. Ribeiro","Universality of political corruption networks","11 pages, 6 figures, supplementary information; accepted for
  publication in Scientific Reports","Sci. Rep. 12, 6858 (2022)","10.1038/s41598-022-10909-2",,"physics.soc-ph cond-mat.stat-mech","http://arxiv.org/licenses/nonexclusive-distrib/1.0/","  Corruption crimes demand highly coordinated actions among criminal agents to
succeed. But research dedicated to corruption networks is still in its infancy
and indeed little is known about the properties of these networks. Here we
present a comprehensive investigation of corruption networks related to
political scandals in Spain and Brazil over nearly three decades. We show that
corruption networks of both countries share universal structural and dynamical
properties, including similar degree distributions, clustering and
assortativity coefficients, modular structure, and a growth process that is
marked by the coalescence of network components due to a few recidivist
criminals. We propose a simple model that not only reproduces these empirical
properties but reveals also that corruption networks operate near a critical
recidivism rate below which the network is entirely fragmented and above which
it is overly connected. Our research thus indicates that actions focused on
decreasing corruption recidivism may substantially mitigate this type of
organized crime.
","[{""version"":""v1"",""created"":""Mon, 11 Apr 2022 13:57:26 GMT""}]","2022-04-28"
"2204.05098","Pierre-Fran\c{c}ois Loos Dr","Enzo Monino and Martial Boggio-Pasqua and Anthony Scemama and Denis
  Jacquemin and Pierre-Fran\c{c}ois Loos","Reference Energies for Cyclobutadiene: Automerization and Excited States","15 pages, 4 figures (supporting information available)",,"10.1021/acs.jpca.2c02480",,"physics.chem-ph cond-mat.str-el physics.comp-ph","http://arxiv.org/licenses/nonexclusive-distrib/1.0/","  Cyclobutadiene is a well-known playground for theoretical chemists and is
particularly suitable to test ground- and excited-state methods. Indeed, due to
its high spatial symmetry, especially at the $D_{4h}$ square geometry but also
in the $D_{2h}$ rectangular arrangement, the ground and excited states of
cyclobutadiene exhibit multi-configurational characters and single-reference
methods, such as adiabatic time-dependent density-functional theory (TD-DFT) or
equation-of-motion coupled cluster (EOM-CC), are notoriously known to struggle
in such situations. In this work, using a large panel of methods and basis
sets, we provide an extensive computational study of the automerization barrier
(defined as the difference between the square and rectangular ground-state
energies) and the vertical excitation energies at $D_{2h}$ and $D_{4h}$
equilibrium structures. In particular, selected configuration interaction
(SCI), multi-reference perturbation theory (CASSCF, CASPT2, and NEVPT2), and
coupled-cluster (CCSD, CC3, CCSDT, CC4, and CCSDTQ) calculations are performed.
The spin-flip formalism, which is known to provide a qualitatively correct
description of these diradical states, is also tested within TD-DFT (combined
with numerous exchange-correlation functionals) and the algebraic diagrammatic
construction [ADC(2)-s, ADC(2)-x, and ADC(3)] schemes. A theoretical best
estimate is defined for the automerization barrier and for each vertical
transition energy.
","[{""version"":""v1"",""created"":""Mon, 11 Apr 2022 13:59:01 GMT""},{""version"":""v2"",""created"":""Sun, 12 Jun 2022 14:01:20 GMT""}]","2022-10-12"
"2204.05099","Wojciech S{\l}omian","Wojciech S{\l}omian","Oscillation estimates for truncated singular Radon operators","16 pages, no figures, accepted for publication in the Journal of
  Fourier Analysis and Applications","Journal of Fourier Analysis and Applications 2023","10.1007/s00041-022-09986-8",,"math.CA","http://creativecommons.org/licenses/by/4.0/","  In this paper we prove uniform oscillation estimates on $L^p$, with
$p\in(1,\infty)$, for truncated singular integrals of the Radon type associated
with Calder\'on-Zygmund kernel, both in continuous and discrete settings. In
the discrete case we use the Ionescu-Wainger multiplier theorem and the
Rademacher-Menshov inequality to handle the number-theoretic nature of the
discrete singular integral. The result we obtained in the continuous setting
can be seen as a generalisation of the results of Campbell, Jones, Reinhold and
Wierdl for the continuous singular integrals of the Calder\'on-Zygmund type.
","[{""version"":""v1"",""created"":""Mon, 11 Apr 2022 13:59:49 GMT""},{""version"":""v2"",""created"":""Thu, 6 Oct 2022 09:15:27 GMT""}]","2022-12-20"
"2204.05100","Paola Comparin","Renee Bell, Paola Comparin, Jennifer Li, Alejandra Rinc\'on-Hidalgo,
  Alessandra Sarti, Aline Zanardini","Non-symplectic automorphisms of order multiple of seven on K3 surfaces","New version, Section 7.4 rewritten",,,,"math.AG","http://arxiv.org/licenses/nonexclusive-distrib/1.0/","  In this paper we present a classification of non-symplectic automorphisms of
K3 surfaces whose order is a multiple of seven by describing the topological
type of their fixed locus. In the case of purely non-symplectic automorphisms,
we provide new results for order 14 and alternative proofs for orders 21, 28
and 42, so that we can unify in the same paper the results on these
automorphisms. For each of these orders we also consider not purely
non-symplectic automorphisms and obtain a complete characterization of their
fixed loci. Several results of our paper were obtained independently in a
recent paper by Brandhorst and Hofmann, but the methods used in the two papers
are completely different.
","[{""version"":""v1"",""created"":""Mon, 11 Apr 2022 14:01:28 GMT""},{""version"":""v2"",""created"":""Sun, 4 Dec 2022 02:06:38 GMT""}]","2022-12-06"
"2204.05106","Shahid Sattar Sattar","Shahid Sattar, Md. Fhokrul Islam, C. M. Canali","Monolayer MnX and Janus XMnY (X, Y= S, Se, Te): A New Family of 2D
  Antiferromagnetic Semiconductors","9 pages, 8 Figures",,"10.1103/PhysRevB.106.085410",,"cond-mat.mtrl-sci cond-mat.mes-hall","http://creativecommons.org/licenses/by/4.0/","  We present first-principles results on the structural, electronic, and
magnetic properties of a new family of two-dimensional antiferromagnetic (AFM)
manganese chalcogenides, namely monolayer MnX and Janus XMnY (X, Y= S, Se, Te),
among which monolayer MnSe was recently synthesized in experiments
[\href{https://pubs.acs.org/doi/abs/10.1021/acsnano.1c05532}{ACS Nano 15
(8),13794 (2021)}]. By carrying out calculations of the phonon dispersion and
\textit{ab-initio} molecular dynamics simulations, we first confirmed that
these systems, characterized by an unconventional strongly coupled bilayer
atomic structure (consisting of Mn atoms buckled to chalcogens forming top and
bottom ferromagnetic (FM) planes with antiparallel spin orientation) are
dynamically and thermally stable. The analysis of the the magnetic properties
shows that these materials have robust AFM order, retaining a much lower energy
than the FM state even for under strain. Our electronic structure calculations
reveal that pristine MnX and their Janus counterparts are indirect-gap
semiconductors, covering a wide energy range and displaying tunable band gaps
by the application of biaxial tensile and compressive strain. Interestingly,
owing to the absence of inversion and time-reversal symmetry, and the presence
of an asymmetrical potential in the out-of-plane direction, Janus XMnY become
spin-split gapped systems, presenting a rich physics yet to be explored. Our
findings provide novel insights in this physics, and highlight the potential
for these two-dimensional manganese chalcogenides in AFM spintronics.
","[{""version"":""v1"",""created"":""Mon, 11 Apr 2022 14:04:55 GMT""}]","2022-08-31"
"2204.05108","Katsiaryna Haitsiukevich","Katsiaryna Haitsiukevich and Alexander Ilin","Improved Training of Physics-Informed Neural Networks with Model
  Ensembles",,,,,"cs.LG cs.AI stat.ML","http://creativecommons.org/licenses/by/4.0/","  Learning the solution of partial differential equations (PDEs) with a neural
network is an attractive alternative to traditional solvers due to its
elegance, greater flexibility and the ease of incorporating observed data.
However, training such physics-informed neural networks (PINNs) is notoriously
difficult in practice since PINNs often converge to wrong solutions. In this
paper, we address this problem by training an ensemble of PINNs. Our approach
is motivated by the observation that individual PINN models find similar
solutions in the vicinity of points with targets (e.g., observed data or
initial conditions) while their solutions may substantially differ farther away
from such points. Therefore, we propose to use the ensemble agreement as the
criterion for gradual expansion of the solution interval, that is including new
points for computing the loss derived from differential equations. Due to the
flexibility of the domain expansion, our algorithm can easily incorporate
measurements in arbitrary locations. In contrast to the existing PINN
algorithms with time-adaptive strategies, the proposed algorithm does not need
a pre-defined schedule of interval expansion and it treats time and space
equally. We experimentally show that the proposed algorithm can stabilize PINN
training and yield performance competitive to the recent variants of PINNs
trained with time adaptation.
","[{""version"":""v1"",""created"":""Mon, 11 Apr 2022 14:05:34 GMT""},{""version"":""v2"",""created"":""Sat, 7 Jan 2023 22:02:26 GMT""},{""version"":""v3"",""created"":""Wed, 11 Jan 2023 13:27:34 GMT""}]","2023-01-12"
"2204.05111","Alessandro Monguzzi","Steven G. Krantz, Alessandro Monguzzi, Marco M. Peloso and Caterina
  Stoppato","Irregularity of the Bergman projection on smooth unbounded worm domains","Revised version. To appear on the Mediterranean Journal of
  Mathematics","Mediterr. J. Math., 20(3):128 (2023)","10.1007/s00009-023-02331-3",,"math.CV","http://arxiv.org/licenses/nonexclusive-distrib/1.0/","  In this work we consider smooth unbounded worm domains $\mathcal Z_\lambda$
in $\mathbb C^2$ and show that the Bergman projection, densely defined on the
Sobolev spaces $H^{s,p}(\mathcal Z_\lambda)$, $p\in(1,\infty)$, $s\ge0$, does
not extend to a bounded operator $P_\lambda:H^{s,p}(\mathcal Z_\lambda)\to
H^{s,p}(\mathcal Z_\lambda)$ when $s>0$ or $p\neq2$. The same irregularity was
known in the case of the non-smooth unbounded worm. This improved result shows
that the irregularity of the projection is not a consequence of the
irregularity of the boundary but instead of the infinite windings of the worm
domain.
","[{""version"":""v1"",""created"":""Mon, 11 Apr 2022 14:07:46 GMT""},{""version"":""v2"",""created"":""Mon, 6 Feb 2023 13:43:42 GMT""}]","2023-03-28"
