"2204.04947","Fabio Camilli","Fabio Camilli and Claudio Marchi","On quasi-stationary Mean Field Games of Controls",,,,,"math.AP math.OC","http://arxiv.org/licenses/nonexclusive-distrib/1.0/","  In Mean Field Games of Controls, the dynamics of the single agent is
influenced not only by the distribution of the agents, as in the classical
theory, but also by the distribution of their optimal strategies. In this
paper, we study quasi-stationary Mean Field Games of Controls, which differs
from the standard case in the strategy-choice mechanism of the agent: it cannot
predict the evolution of the population, but chooses its strategy only on the
basis of the information available at the given instant of time, without
anticipating. We prove existence and uniqueness for the solution of the
corresponding quasi-stationary Mean Field Games system under different sets of
hypotheses and we provide some examples of models which fall within these
hypotheses.
","[{""version"":""v1"",""created"":""Mon, 11 Apr 2022 08:49:15 GMT""},{""version"":""v2"",""created"":""Tue, 31 Jan 2023 10:23:33 GMT""}]","2023-02-01"
"2204.04948","Francesco Borsa","F. Borsa, P. Giacobbe, A. S. Bonomo, M. Brogi, L. Pino, L. Fossati, A.
  F. Lanza, V. Nascimbeni, A. Sozzetti, F. Amadori, S. Benatti, K. Biazzo, A.
  Bignamini, W. Boschin, R. Claudi, R. Cosentino, E. Covino, S. Desidera, A. F.
  M. Fiorenzano, G. Guilluy, A. Harutyunyan, A. Maggio, J. Maldonado, L.
  Mancini, G. Micela, E. Molinari, M. Molinaro, I. Pagano, M. Pedani, G.
  Piotto, E. Poretti, M. Rainer, G. Scandariato, H. Stoev","The GAPS Programme at TNG XXXIII. HARPS-N detects multiple atomic
  species in emission from the dayside of KELT-20b","Accepted for publication in A&A. Submitted 27 Nov. 2021","A&A 663, A141 (2022)","10.1051/0004-6361/202142768",,"astro-ph.EP astro-ph.SR","http://arxiv.org/licenses/nonexclusive-distrib/1.0/","  The detection of lines in emission in planetary atmospheres provides direct
evidence of temperature inversion. We confirm the trend of ultra-hot Jupiters
orbiting A-type stars showing temperature inversions on their daysides, by
detecting metals emission lines in the dayside of KELT-20b. We first detect the
planetary emission by using the G2 stellar mask of the HARPS-N pipeline, which
is mainly composed of neutral iron lines, as a template. Using neutral iron
templates, we perform a retrieval of the atmospheric temperature-pressure
profile of the planet, confirming a thermal inversion. Then we create models of
planetary emission of different species using the retrieved inverted
temperature-pressure profile. By using the cross-correlation technique, we
detect FeI, FeII and CrI at signal-to-noise ratio levels of 7.1, 3.9 and 3.6,
respectively. The latter is detected for the first time in emission in the
atmosphere of an exoplanet. Contrary to FeI, FeII and CrI are detected only
after the occultation and not before, hinting for different atmospheric
properties in view on the pre- and post- occultation orbital phases. A further
retrieval of the temperature-pressure profile performed independently on the
pre- and post- occultation phases, while not highly significant, points to a
steeper thermal inversion in the post-occultation.
","[{""version"":""v1"",""created"":""Mon, 11 Apr 2022 08:50:56 GMT""}]","2022-07-27"
"2204.04949","Xingtong Wang","Chengze Zhu, Pingge Hu, Xianxu Zeng, Xingtong Wang, Zehua Ji and Li
  Shi","A Semantic Segmentation Network Based Real-Time Computer-Aided Diagnosis
  System for Hydatidiform Mole Hydrops Lesion Recognition in Microscopic View",,,,,"eess.IV cs.CV","http://creativecommons.org/licenses/by/4.0/","  As a disease with malignant potential, hydatidiform mole (HM) is one of the
most common gestational trophoblastic diseases. For pathologists, the HM
section of hydrops lesions is an important basis for diagnosis. In pathology
departments, the diverse microscopic manifestations of HM lesions and the
limited view under the microscope mean that physicians with extensive
diagnostic experience are required to prevent missed diagnosis and
misdiagnosis. Feature extraction can significantly improve the accuracy and
speed of the diagnostic process. As a remarkable diagnosis assisting
technology, computer-aided diagnosis (CAD) has been widely used in clinical
practice. We constructed a deep-learning-based CAD system to identify HM
hydrops lesions in the microscopic view in real-time. The system consists of
three modules; the image mosaic module and edge extension module process the
image to improve the outcome of the hydrops lesion recognition module, which
adopts a semantic segmentation network, our novel compound loss function, and a
stepwise training function in order to achieve the best performance in
identifying hydrops lesions. We evaluated our system using an HM hydrops
dataset. Experiments show that our system is able to respond in real-time and
correctly display the entire microscopic view with accurately labeled HM
hydrops lesions.
","[{""version"":""v1"",""created"":""Mon, 11 Apr 2022 08:51:16 GMT""}]","2022-04-12"
"2204.04950","Hyunjung Shim Dr.","Kyungjune Baek, Hyunjung Shim","Commonality in Natural Images Rescues GANs: Pretraining GANs with
  Generic and Privacy-free Synthetic Data","CVPR 2022 accepted",,,,"cs.CV cs.AI","http://arxiv.org/licenses/nonexclusive-distrib/1.0/","  Transfer learning for GANs successfully improves generation performance under
low-shot regimes. However, existing studies show that the pretrained model
using a single benchmark dataset is not generalized to various target datasets.
More importantly, the pretrained model can be vulnerable to copyright or
privacy risks as membership inference attack advances. To resolve both issues,
we propose an effective and unbiased data synthesizer, namely Primitives-PS,
inspired by the generic characteristics of natural images. Specifically, we
utilize 1) the generic statistics on the frequency magnitude spectrum, 2) the
elementary shape (i.e., image composition via elementary shapes) for
representing the structure information, and 3) the existence of saliency as
prior. Since our synthesizer only considers the generic properties of natural
images, the single model pretrained on our dataset can be consistently
transferred to various target datasets, and even outperforms the previous
methods pretrained with the natural images in terms of Fr'echet inception
distance. Extensive analysis, ablation study, and evaluations demonstrate that
each component of our data synthesizer is effective, and provide insights on
the desirable nature of the pretrained model for the transferability of GANs.
","[{""version"":""v1"",""created"":""Mon, 11 Apr 2022 08:51:17 GMT""}]","2022-04-12"
"2204.04951","Abramo Agosti","Abramo Agosti and Pierluigi Colli and Harald Garcke and Elisabetta
  Rocca","A Cahn-Hilliard model coupled to viscoelasticity with large deformations",,,,,"math.AP","http://creativecommons.org/licenses/by/4.0/","  We propose a new class of phase field models coupled to viscoelasticity with
large deformations, obtained from a diffuse interface mixture model composed by
a phase with elastic properties and a liquid phase. The model is formulated in
the Eulerian configuration and it is derived by imposing the mass balance for
the mixture components and the momentum balance that comes from a generalized
form of the principle of virtual powers. The latter considers the presence of a
system of microforces and microstresses associated to the microscopic
interactions between the mixture's constituents together with a system of
macroforces and macrostresses associated to their viscoelastic behavior, taking
into account also the friction between the phases. The free energy density of
the system is given as the sum of a Cahn-Hilliard term and an elastic
polyconvex term, with a coupling between the phase field variable and the
elastic deformation gradient in the elastic contribution. General constitutive
assumptions complying with a mechanical version of the second law of
thermodynamics in isothermal situations are taken. We study the global
existence of a weak solution for a simplified and regularized version of the
general model, which considers an incompressible elastic free energy of
Neo-Hookean type with elastic coefficients depending on the phase field
variable. The regularization is properly designed to deal with the coupling
between the phase field variable and the elastic deformation gradient in the
elastic energy density. The analysis is made both in two and three space
dimensions.
","[{""version"":""v1"",""created"":""Mon, 11 Apr 2022 08:52:39 GMT""}]","2022-04-12"
"2204.04952","Mieradilijiang Maimaiti","Jianhai Zhang, Mieradilijiang Maimaiti, Xing Gao, Yuanhang Zheng, and
  Ji Zhang","MGIMN: Multi-Grained Interactive Matching Network for Few-shot Text
  Classification","10 pages, 2 figures, 6 tabels",,,,"cs.CL","http://creativecommons.org/licenses/by-nc-sa/4.0/","  Text classification struggles to generalize to unseen classes with very few
labeled text instances per class. In such a few-shot learning (FSL) setting,
metric-based meta-learning approaches have shown promising results. Previous
studies mainly aim to derive a prototype representation for each class.
However, they neglect that it is challenging-yet-unnecessary to construct a
compact representation which expresses the entire meaning for each class. They
also ignore the importance to capture the inter-dependency between query and
the support set for few-shot text classification. To deal with these issues, we
propose a meta-learning based method MGIMN which performs instance-wise
comparison followed by aggregation to generate class-wise matching vectors
instead of prototype learning. The key of instance-wise comparison is the
interactive matching within the class-specific context and episode-specific
context. Extensive experiments demonstrate that the proposed method
significantly outperforms the existing state-of-the-art approaches, under both
the standard FSL and generalized FSL settings.
","[{""version"":""v1"",""created"":""Mon, 11 Apr 2022 08:58:55 GMT""},{""version"":""v2"",""created"":""Mon, 18 Apr 2022 06:01:41 GMT""},{""version"":""v3"",""created"":""Thu, 5 May 2022 12:16:58 GMT""}]","2022-05-06"
"2204.04953","Dongyue Li","Dongyue Li, R.L.C. Starling, R.D. Saxton, Hai-Wu Pan, and Weimin Yuan","Populations of highly variable X-ray sources in the XMM$-$Newton slew
  survey","20 pages, 18 figures, published in MNRAS","2022MNRAS.512.3858L","10.1093/mnras/stac714",,"astro-ph.HE","http://creativecommons.org/licenses/by-nc-nd/4.0/","  We present the identifications of a flux-limited sample of highly variable
X-ray sources on long time-scales from the second catalogue of the XMM$-$Newton
SLew survey (XMMSL2). The carefully constructed sample, comprising 265 sources
(2.5 per cent) selected from the XMMSL2 clean catalogue, displayed X-ray
variability of a factor of more than 10 in 0.2$-$2 keV compared to the ROSAT
All Sky Survey. Of the sample sources, 94.3 per cent are identified. The
identification procedure follows a series of cross-matches with astronomical
data bases and multiwavelength catalogues to refine the source position and
identify counterparts to the X-ray sources. Assignment of source type utilizes
a combination of indicators including counterparts offset, parallax
measurement, spectral colours, X-ray luminosity, and light-curve behaviour. We
identified 40 per cent of the variables with stars, 10 per cent with accreting
binaries, and at least 30.4 per cent with active galactic nuclei. The rest of
the variables are identified as galaxies. It is found that the mean effective
temperatures of the highly variable stars are lower than those of less variable
stars. Our sample of highly variable AGN tend to have lower black hole masses,
redshifts, and marginally lower soft X-ray luminosities compared to the less
variable ones, while no difference was found in the Eddington ratio
distributions. Five flaring events are tidal disruption events published
previously. This study has significantly increased the number of variable
sources in XMMSL2 with identifications and provides greater insight on the
nature of many of the sources, enabling further studies of highly variable
X-ray sources.
","[{""version"":""v1"",""created"":""Mon, 11 Apr 2022 09:00:25 GMT""}]","2022-04-12"
"2204.04954","Sirui Chen","Sirui Chen, Xiao Zhang, Xu Chen, Zhiyu Li, Yuan Wang, Quan Lin and Jun
  Xu","Reinforcement Re-ranking with 2D Grid-based Recommendation Panels",,,,,"cs.IR","http://arxiv.org/licenses/nonexclusive-distrib/1.0/","  Modern recommender systems usually present items as one-dimensional ranking
list. Recently there is a trend in e-commerce that the recommended items are
organized as two-dimensional grid-based panels where users can view the items
in both vertical and horizontal directions. Presenting items in grid-based
result panels poses new challenges to recommender systems because existing
models are all designed to output sequential lists while the slots in a
grid-based panel have no explicit order. Directly converting the item rankings
into grids (e.g., pre-defining an order on the slots)overlooks the
user-specific behavioral patterns on grid-based pan-els and inevitably hurts
the user experiences. To address this issue, we propose a novel Markov decision
process (MDP) to place the items in 2D grid-based result panels at the final
re-ranking stage of the recommender systems. The model, referred to as
Panel-MDP, takes an initial item ranking from the early stages as the input.
Then, it defines the MDP discrete time steps as the ranks in the initial
ranking list, and the actions as the slots in the grid-based panels, plus a
NULL action. At each time step, Panel-MDP sequentially takes an action of
selecting one slot for placing an item of the initial ranking list, or
discarding the item if NULL action is selected. The process is continued until
all of the slots are filled. The reinforcement learning algorithm of DQN is
employed to implement and learn the parameters in the Panel-MDP. Experiments on
a dataset collected from a widely-used e-commerce app demonstrated the
superiority ofPanel-MDP in terms of recommending 2D grid-based result panels.
","[{""version"":""v1"",""created"":""Mon, 11 Apr 2022 09:03:31 GMT""}]","2022-04-12"
"2204.04955","Petar \v{Z}ugec","P. \v{Z}ugec, M. Barbagallo, J. Andrzejewski, J. Perkowski, N.
  Colonna, D. Bosnar, A. Gawlik, M. Sabate-Gilarte, M. Bacak, F. Mingrone, E.
  Chiaveri","Machine learning based event classification for the energy-differential
  measurement of the $^\text{nat}$C(n,p) and $^\text{nat}$C(n,d) reactions","11 pages, 5 figures, 2 tables",,"10.1016/j.nima.2022.166686",,"physics.data-an cs.CV nucl-ex","http://arxiv.org/licenses/nonexclusive-distrib/1.0/","  The paper explores the feasibility of using machine learning techniques, in
particular neural networks, for classification of the experimental data from
the joint $^\text{nat}$C(n,p) and $^\text{nat}$C(n,d) reaction cross section
measurement from the neutron time of flight facility n_TOF at CERN. Each
relevant $\Delta E$-$E$ pair of strips from two segmented silicon telescopes is
treated separately and afforded its own dedicated neural network. An important
part of the procedure is a careful preparation of training datasets, based on
the raw data from Geant4 simulations. Instead of using these raw data for the
training of neural networks, we divide a relevant 3-parameter space into
discrete voxels, classify each voxel according to a particle/reaction type and
submit these voxels to a training procedure. The classification capabilities of
the structurally optimized and trained neural networks are found to be superior
to those of the manually selected cuts.
","[{""version"":""v1"",""created"":""Mon, 11 Apr 2022 09:03:49 GMT""}]","2022-04-12"
"2204.04956","Pingge Hu","Chengze Zhu, Pingge Hu, Xianxu Zeng, Xingtong Wang, Zehua Ji and Li
  Shi","Segmentation Network with Compound Loss Function for Hydatidiform Mole
  Hydrops Lesion Recognition",,,,,"eess.IV cs.CV","http://creativecommons.org/licenses/by/4.0/","  Pathological morphology diagnosis is the standard diagnosis method of
hydatidiform mole. As a disease with malignant potential, the hydatidiform mole
section of hydrops lesions is an important basis for diagnosis. Due to
incomplete lesion development, early hydatidiform mole is difficult to
distinguish, resulting in a low accuracy of clinical diagnosis. As a remarkable
machine learning technology, image semantic segmentation networks have been
used in many medical image recognition tasks. We developed a hydatidiform mole
hydrops lesion segmentation model based on a novel loss function and training
method. The model consists of different networks that segment the section image
at the pixel and lesion levels. Our compound loss function assign weights to
the segmentation results of the two levels to calculate the loss. We then
propose a stagewise training method to combine the advantages of various loss
functions at different levels. We evaluate our method on a hydatidiform mole
hydrops dataset. Experiments show that the proposed model with our loss
function and training method has good recognition performance under different
segmentation metrics.
","[{""version"":""v1"",""created"":""Mon, 11 Apr 2022 09:08:08 GMT""}]","2022-04-12"
"2204.04957","Friedrich Klaus","Friedrich Klaus","Wellposedness of NLS in Modulation Spaces","29 pages",,,,"math.AP","http://arxiv.org/licenses/nonexclusive-distrib/1.0/","  We prove new local and global well-posedness results for the cubic
one-dimensional nonlinear Schr\""odinger equation in modulation spaces. Local
results are obtained via multilinear interpolation. Global results are proven
using conserved quantities based on the complete integrability of the equation,
persistence of regularity, and by separating off the time evolution of finitely
many Picard iterates.
","[{""version"":""v1"",""created"":""Mon, 11 Apr 2022 09:09:37 GMT""},{""version"":""v2"",""created"":""Mon, 2 May 2022 15:08:50 GMT""}]","2022-05-03"
"2204.04958","Gerard Ghibaudo","Gerard Ghibaudo","On the fluctuation-dissipation of the oxide trapped charge in a MOSFET
  operated down to deep cryogenic temperatures","15 pages, 8 figures",,,,"physics.app-ph","http://creativecommons.org/publicdomain/zero/1.0/","  An analysis of the oxide trapped charge noise in a MOSFET operated down to
deep cryogenic temperatures is proposed. To this end, a revisited derivation of
the interface trap conductance Gp and oxide trapped charge noise SQt at the
SiO2/Si MOS interface is conducted under very low temperature condition, where
Fermi-Dirac statistics applies. A new relation between the oxide trapped charge
noise SQt and the interface trap conductance Gp is established, showing the
inadequacy of the Nyquist relation at very low temperature. Finally, a new
formula for the oxide trapped charge 1/f noise, going beyond the classical
Boltzmann expression, is developed in terms of oxide trap density and effective
temperature accounting for degenerate statistics.
","[{""version"":""v1"",""created"":""Mon, 11 Apr 2022 09:11:58 GMT""},{""version"":""v2"",""created"":""Wed, 7 Jun 2023 09:07:08 GMT""}]","2023-06-08"
"2204.04959","Yuntao Du","Yuntao Du, Xinjun Zhu, Lu Chen, Baihua Zheng and Yunjun Gao","HAKG: Hierarchy-Aware Knowledge Gated Network for Recommendation","Accept to SIGIR2022",,,,"cs.IR","http://creativecommons.org/licenses/by/4.0/","  Knowledge graph (KG) plays an increasingly important role to improve the
recommendation performance and interpretability. A recent technical trend is to
design end-to-end models based on information propagation schemes. However,
existing propagation-based methods fail to (1) model the underlying
hierarchical structures and relations, and (2) capture the high-order
collaborative signals of items for learning high-quality user and item
representations.
  In this paper, we propose a new model, called Hierarchy-Aware Knowledge Gated
Network (HAKG), to tackle the aforementioned problems. Technically, we model
users and items (that are captured by a user-item graph), as well as entities
and relations (that are captured in a KG) in hyperbolic space, and design a
hyperbolic aggregation scheme to gather relational contexts over KG. Meanwhile,
we introduce a novel angle constraint to preserve characteristics of items in
the embedding space. Furthermore, we propose a dual item embeddings design to
represent and propagate collaborative signals and knowledge associations
separately, and leverage the gated aggregation to distill discriminative
information for better capturing user behavior patterns. Experimental results
on three benchmark datasets show that, HAKG achieves significant improvement
over the state-of-the-art methods like CKAN, Hyper-Know, and KGIN. Further
analyses on the learned hyperbolic embeddings confirm that HAKG offers
meaningful insights into the hierarchies of data.
","[{""version"":""v1"",""created"":""Mon, 11 Apr 2022 09:13:19 GMT""}]","2022-04-12"
"2204.04960","Adil Erzin I","Adil Erzin, Roman Plotnikov, Ilya Ladygin","Constrained Shortest Path and Hierarchical Structures",,,,,"cs.DS cs.DM","http://creativecommons.org/licenses/by-nc-nd/4.0/","  The Constraint Shortest Path (CSP) problem is as follows. An $n$-vertex graph
is given, each edge/arc assigned two weights. Let us call them ""cost"" and
""length"" for definiteness. Finding a min-cost upper-bounded length path between
a given pair of vertices is required. The problem is NP-hard even when the
lengths of all edges are the same. Therefore, various approximation algorithms
have been proposed in the literature for it. The constraint on path length can
be accounted for by considering one edge weight equals to a linear combination
of cost and length. By varying the multiplier value in a linear combination, a
feasible solution delivers a minimum to the function with new weights. At the
same time, Dijkstra's algorithm or its modifications are used to construct the
shortest path with the current weights of the edges. However, with
insufficiently large graphs, this approach may turn out to be time-consuming.
In this article, we propose to look for a solution, not in the original graph
but specially constructed hierarchical structures (HS). We show that the
shortest path in the HS is constructed with $O(m)$-time complexity, where $m$
is the number of edges/arcs of the graph, and the approximate solution in the
case of integer costs and lengths of the edges is found with $O(m\log n)$-time
complexity. The a priori estimate of the algorithm's accuracy turned out to
depend on the parameters of the problem and can be significant. Therefore, to
evaluate the algorithm's effectiveness, we conducted a numerical experiment on
the graphs of roads of megalopolis and randomly constructed unit-disk graphs
(UDGs). The numerical experiment results show that in the HS, a solution close
to optimal one is built 10--100 times faster than in the methods which use
Dijkstra's algorithm to build a min-weight path in the original graph.
","[{""version"":""v1"",""created"":""Mon, 11 Apr 2022 09:13:43 GMT""}]","2022-04-12"
"2204.04961","Jochen Hub","Leonie Chatzimagas and Jochen S. Hub","Predicting solution scattering patterns with explicit-solvent molecular
  simulations",,,,,"physics.bio-ph","http://creativecommons.org/licenses/by/4.0/","  Small-angle X-ray or neutron scattering (SAXS/SANS/SAS) is widely used to
obtain structural information on biomolecules or soft-matter complexes in
solution. Deriving a molecular interpretation of the scattering signals
requires methods for predicting SAS patterns from a given atomistic structural
model. Such SAS predictions are non-trivial because the patterns are influenced
by the hydration layer of the solute, the excluded solvent, and by thermal
fluctuations. Many computationally efficient methods use simplified, implicit
models for the hydration layer and excluded solvent, leading to some
uncertainties and to free parameters that require fitting against experimental
data. SAS predictions based on explicit-solvent molecular dynamics (MD)
simulations overcome such limitations at the price of an increased
computational cost. To rationalize the need for explicit-solvent methods, we
first review the approximations underlying implicit-solvent methods. Next, we
describe the theory behind explicit-solvent SAS predictions that are easily
accessible via the WAXSiS web server. We present the workflow for computing SAS
pattern from a given molecular dynamics trajectory with a freely available via
a modified version of the GROMACS simulations software, coined GROMACS-SWAXS,
which implements the WAXSiS method. Practical considerations for running
routine explicit-solvent SAS predictions are discussed.
","[{""version"":""v1"",""created"":""Mon, 11 Apr 2022 09:16:59 GMT""},{""version"":""v2"",""created"":""Sat, 13 Aug 2022 15:02:42 GMT""}]","2022-08-16"
