"2204.14042","Pritam Goswami","Pritam Goswami, Avisek Sharma, Satakshi Ghosh, Buddhadeb Sau","Time Optimal Gathering of Myopic Robots on an Infinite Triangular Grid",,,,,"cs.DC","http://arxiv.org/licenses/nonexclusive-distrib/1.0/","  This work deals with the problem of gathering $n$ oblivious mobile entities,
called robots, at a point (not known beforehand) placed on an infinite
triangular grid. The robots are considered to be myopic, i.e., robots have
limited visibility. Earlier works of gathering mostly considered the robots
either on a plane or on a circle or on a rectangular grid under both full and
limited visibility. In the triangular grid, there are two works to the best of
our knowledge. The first one is by Cicerone et al. on arbitrary pattern
formation where full visibility is considered. The other one by Shibata et al.
which considers seven robots with 2- hop visibility that form a hexagon with
one robot in the center of the hexagon in a collision-less environment under a
fully synchronous scheduler .
  In this work, we first show that gathering on a triangular grid with 1-hop
vision of robots is not possible even under a fully synchronous scheduler if
the robots do not agree on any axis. So one axis agreement has been considered
in this work (i.e., the robots agree on a direction and its orientation). We
have also shown that the lower bound for time is $\Omega(n)$ epochs when $n$
number of robots are gathering on an infinite triangular grid. An algorithm is
then presented where a swarm of $n$ number of robots with 1-hop visibility can
gather within $O(n)$ epochs under a semi-synchronous scheduler. So the
algorithm presented here is time optimal.
","[{""version"":""v1"",""created"":""Fri, 29 Apr 2022 12:33:11 GMT""},{""version"":""v2"",""created"":""Tue, 14 Jun 2022 09:11:27 GMT""},{""version"":""v3"",""created"":""Thu, 30 Jun 2022 18:20:40 GMT""},{""version"":""v4"",""created"":""Wed, 28 Sep 2022 05:51:45 GMT""}]","2022-09-29"
"2204.14043","Nils Rosemann","Nils W. Rosemann, Robin C. D\""oring, Eike Dornsiepen, J\""urgen Belz,
  Johannes Haust, Felix Bernhardt, Ferdinand Ziese, Claudio Attaccalite,
  Stephan Winnerl, Harald Schneider, Manfred Helm, Stefanie Dehnen, Kerstin
  Volz, Simone Sanna, and Sangam Chatterjee","Ultra-Broadband Visible and Infrared Light Generation Driven by Far
  Infrared Light in the Broad Region from 8{\mu}m to 240{\mu}m","7 pages, 5 figures",,,,"physics.optics cond-mat.mtrl-sci physics.app-ph","http://creativecommons.org/licenses/by-nc-nd/4.0/","  The most commonly used nonlinear optical process is the conversion of
infrared light at 1064nm to green light at 532nm, as performed in common laser
pointers. However, more relevant for future applications are nonlinear optical
processes that generate a broad spectrum, a so called supercontinuum. A
desirable goal is generating a spectrum that covers the whole visible range
(400 -900nm), i.e., white light. Nowadays, white-light generation is usually
achieved in specially designed photonic fibres requiring high laser
intensities. However, in previous studies we showed that amorphous powders of
$(PhSn)_4S_6$ cluster-molecules generate white light when they are irradiated
by low-intensity near-infrared light. In this study, we use the mid- and
far-infrared radiation of a free-electron laser to investigate the same
molecules. White-light generation is observed for excitation with wavelength
between 8 and 240$\mu$ m. While the emitted radiation shows only slight
variations, its intensity strongly depends on the excitation wavelength. We
then match the wavelength dependent efficiency with the infrared absorption
spectra of the material. This comparison shows: whenever the excitation can
introduce molecular vibrations, less white light is generated. For all other
wavelengths the excitation interacts mostly with the electron system. This
shows that the electron system and the molecular backbone are decoupled to a
large extent. Our work contributes to the understanding of the nonlinear
process that underlies white-light generation in $(PhSn)_4S_6$ cluster
molecules. Additionally, it shows the high potential of this material in
applications where a broad laser spectrum is desired.
","[{""version"":""v1"",""created"":""Fri, 29 Apr 2022 12:35:00 GMT""}]","2022-05-02"
"2204.14044","Minyi Zhao","Minyi Zhao, Miao Wang, Fan Bai, Bingjia Li, Jie Wang, Shuigeng Zhou","C3-STISR: Scene Text Image Super-resolution with Triple Clues","Accepted by IJCAI 2022",,,,"cs.CV","http://creativecommons.org/licenses/by-nc-sa/4.0/","  Scene text image super-resolution (STISR) has been regarded as an important
pre-processing task for text recognition from low-resolution scene text images.
Most recent approaches use the recognizer's feedback as clues to guide
super-resolution. However, directly using recognition clue has two problems: 1)
Compatibility. It is in the form of probability distribution, has an obvious
modal gap with STISR - a pixel-level task; 2) Inaccuracy. it usually contains
wrong information, thus will mislead the main task and degrade super-resolution
performance. In this paper, we present a novel method C3-STISR that jointly
exploits the recognizer's feedback, visual and linguistical information as
clues to guide super-resolution. Here, visual clue is from the images of texts
predicted by the recognizer, which is informative and more compatible with the
STISR task; while linguistical clue is generated by a pre-trained
character-level language model, which is able to correct the predicted texts.
We design effective extraction and fusion mechanisms for the triple cross-modal
clues to generate a comprehensive and unified guidance for super-resolution.
Extensive experiments on TextZoom show that C3-STISR outperforms the SOTA
methods in fidelity and recognition performance. Code is available in
https://github.com/zhaominyiz/C3-STISR.
","[{""version"":""v1"",""created"":""Fri, 29 Apr 2022 12:39:51 GMT""}]","2022-05-02"
"2204.14045","Hairong  Yuan","Yunjuan Jin and Aifang Qu and Hairong Yuan","Radon Measure Solutions to Riemann Problems for Isentropic Compressible
  Euler Equations of Polytropic Gases","33 pages, 6 figures, 2 tables","Communications on Applied Mathematics and Computation,2022","10.1007/s42967-022-00187-0",,"math.AP math-ph math.MP physics.flu-dyn","http://arxiv.org/licenses/nonexclusive-distrib/1.0/","  We solve the Riemann problems for isentropic compressible Euler equations of
polytropic gases in the class of Radon measures, and the solutions admit the
concentration of mass. It is found that, under the requirement of satisfying
the over-compressing entropy condition: (i) there is a unique delta shock
solution, corresponding to the case that has two strong classical Lax shocks;
(ii) for the initial data that the classical Riemann solution contains a shock
wave and a rarefaction wave, or two shocks with one being weak, there are
infinitely many solutions, each consists of a delta shock and a rarefaction
wave; (iii) there is no delta shocks for the case that the classical entropy
weak solutions consist only of rarefaction waves. These solutions are
self-similar. Furthermore, for the generalized Riemann problem with mass
concentrated initially at the discontinuous point of initial data, there always
exists a unique delta shock for at least a short time. It could be prolonged to
a global solution. Not all the solutions are self-similar due to the initial
velocity of the concentrated point-mass (particle). Whether the delta shock
solutions constructed satisfy the over-compressing entropy condition is
clarified. This is the first result on the construction of singular measure
solutions to the compressible Euler system of polytropic gases, that is
strictly hyperbolic, and whose characteristics are both genuinely nonlinear. We
also discuss possible physical interpretations and applications of these new
solutions.
","[{""version"":""v1"",""created"":""Fri, 29 Apr 2022 12:41:00 GMT""}]","2022-05-02"
"2204.14047","Wei Sun","Wei Sun, Xiongkuo Min, Wei Lu, Guangtao Zhai","A Deep Learning based No-reference Quality Assessment Model for UGC
  Videos","Accepted by ACM MM 2022","Proceedings of the 30th ACM International Conference on Multimedia
  (2022) 856-865","10.1145/3503161.3548329",,"cs.CV cs.MM eess.IV","http://arxiv.org/licenses/nonexclusive-distrib/1.0/","  Quality assessment for User Generated Content (UGC) videos plays an important
role in ensuring the viewing experience of end-users. Previous UGC video
quality assessment (VQA) studies either use the image recognition model or the
image quality assessment (IQA) models to extract frame-level features of UGC
videos for quality regression, which are regarded as the sub-optimal solutions
because of the domain shifts between these tasks and the UGC VQA task. In this
paper, we propose a very simple but effective UGC VQA model, which tries to
address this problem by training an end-to-end spatial feature extraction
network to directly learn the quality-aware spatial feature representation from
raw pixels of the video frames. We also extract the motion features to measure
the temporal-related distortions that the spatial features cannot model. The
proposed model utilizes very sparse frames to extract spatial features and
dense frames (i.e. the video chunk) with a very low spatial resolution to
extract motion features, which thereby has low computational complexity. With
the better quality-aware features, we only use the simple multilayer perception
layer (MLP) network to regress them into the chunk-level quality scores, and
then the temporal average pooling strategy is adopted to obtain the video-level
quality score. We further introduce a multi-scale quality fusion strategy to
solve the problem of VQA across different spatial resolutions, where the
multi-scale weights are obtained from the contrast sensitivity function of the
human visual system. The experimental results show that the proposed model
achieves the best performance on five popular UGC VQA databases, which
demonstrates the effectiveness of the proposed model. The code will be publicly
available.
","[{""version"":""v1"",""created"":""Fri, 29 Apr 2022 12:45:21 GMT""},{""version"":""v2"",""created"":""Thu, 20 Oct 2022 07:26:06 GMT""}]","2022-10-21"
"2204.14048","Baihan Lin","Baihan Lin","Topological Data Analysis in Time Series: Temporal Filtration and
  Application to Single-Cell Genomics","Accepted and to appear in Algorithms. Codes at
  https://github.com/doerlbh/scTSA","Algorithms. 2022; 15(10):371","10.3390/a15100371",,"cs.LG math.AT q-bio.GN q-bio.QM","http://arxiv.org/licenses/nonexclusive-distrib/1.0/","  The absence of a conventional association between the cell-cell cohabitation
and its emergent dynamics into cliques during development has hindered our
understanding of how cell populations proliferate, differentiate, and compete,
i.e. the cell ecology. With the recent advancement of the single-cell
RNA-sequencing (RNA-seq), we can potentially describe such a link by
constructing network graphs that characterize the similarity of the gene
expression profiles of the cell-specific transcriptional programs, and
analyzing these graphs systematically using the summary statistics informed by
the algebraic topology. We propose the single-cell topological simplicial
analysis (scTSA). Applying this approach to the single-cell gene expression
profiles from local networks of cells in different developmental stages with
different outcomes reveals a previously unseen topology of cellular ecology.
These networks contain an abundance of cliques of single-cell profiles bound
into cavities that guide the emergence of more complicated habitation forms. We
visualize these ecological patterns with topological simplicial architectures
of these networks, compared with the null models. Benchmarked on the
single-cell RNA-seq data of zebrafish embryogenesis spanning 38,731 cells, 25
cell types and 12 time steps, our approach highlights the gastrulation as the
most critical stage, consistent with consensus in developmental biology. As a
nonlinear, model-independent, and unsupervised framework, our approach can also
be applied to tracing multi-scale cell lineage, identifying critical stages, or
creating pseudo-time series.
","[{""version"":""v1"",""created"":""Fri, 29 Apr 2022 12:46:14 GMT""},{""version"":""v2"",""created"":""Wed, 28 Sep 2022 12:55:26 GMT""}]","2022-10-11"
"2204.14049","Yong He","Yong He, Zichen Liu, Yalin Wang","Distributed Learning for Principle Eigenspaces without Moment
  Constraints",,,,,"stat.CO","http://arxiv.org/licenses/nonexclusive-distrib/1.0/","  Distributed Principal Component Analysis (PCA) has been studied to deal with
the case when data are stored across multiple machines and communication cost
or privacy concerns prohibit the computation of PCA in a central location.
However, the sub-Gaussian assumption in the related literature is restrictive
in real application where outliers or heavy-tailed data are common in areas
such as finance and macroeconomic. In this article, we propose a distributed
algorithm for estimating the principle eigenspaces without any moment
constraint on the underlying distribution. We study the problem under the
elliptical family framework and adopt the sample multivariate Kendall'tau
matrix to extract eigenspace estimators from all sub-machines, which can be
viewed as points in the Grassman manifold. We then find the ""center"" of these
points as the final distributed estimator of the principal eigenspace. We
investigate the bias and variance for the distributed estimator and derive its
convergence rate which depends on the effective rank and eigengap of the
scatter matrix, and the number of submachines. We show that the distributed
estimator performs as if we have full access of whole data. Simulation studies
show that the distributed algorithm performs comparably with the existing one
for light-tailed data, while showing great advantage for heavy-tailed data. We
also extend our algorithm to the distributed learning of elliptical factor
models and verify its empirical usefulness through real application to a
macroeconomic dataset.
","[{""version"":""v1"",""created"":""Fri, 29 Apr 2022 12:47:19 GMT""}]","2022-05-02"
"2204.14051","Abheek Ghosh","Edith Elkind, Abheek Ghosh, and Paul Goldberg","Contests to Incentivize a Target Group","IJCAI-2022",,,,"cs.GT econ.TH","http://arxiv.org/licenses/nonexclusive-distrib/1.0/","  We study how to incentivize agents in a target group to produce a higher
output in the context of incomplete information, by means of rank-order
allocation contests. We describe a symmetric Bayes--Nash equilibrium for
contests that have two types of rank-based prizes: prizes that are accessible
only to the agents in the target group; prizes that are accessible to everyone.
We also specialize this equilibrium characterization to two important
sub-cases: (i) contests that do not discriminate while awarding the prizes,
i.e., only have prizes that are accessible to everyone; (ii) contests that have
prize quotas for the groups, and each group can compete only for prizes in
their share. For these models, we also study the properties of the contest that
maximizes the expected total output by the agents in the target group.
","[{""version"":""v1"",""created"":""Fri, 29 Apr 2022 12:48:24 GMT""}]","2022-05-02"
"2204.14052","Emmanuel Artis","E. Artis, R. Adam, P. Ade, H. Ajeddig, P. Andr\'e, M. Arnaud, H.
  Aussel, I. Bartalucci, A. Beelen, A. Beno\^it, S. Berta, L. Bing, O.
  Bourrion, M. Calvo, A. Catalano, M. De Petris, F.-X. D\'esert, S. Doyle, E.
  F. C. Driessen, A. Ferragamo, A. Gomez, J. Goupy, C. Hanser, F. K\'eruzor\'e,
  C. Kramer, B. Ladjelate, G. Lagache, S. Leclercq, J.-F. Lestrade, J.-F.
  Mac\'ias-P\'erez, A. Maury, P. Mauskopf, F. Mayet, A. Monfardini, M.
  Mu\~noz-Echeverr\'ia, A. Paliwal, L. Perotto, G. Pisano, E. Pointecouteau, N.
  Ponthieu, G. W. Pratt, V. Rev\'eret, A. J. Rigby, A. Ritacco, C. Romero, H.
  Roussel, F. Ruppin, K. Schuster, S. Shu, A. Sievers, C. Tucker, G. Yepes","Massive merging cluster PSZ2G091 as seen by the NIKA2 camera","4 pages, 3 figures Contribution to the 2022 Cosmology session of the
  56th Rencontres de Moriond. arXiv admin note: substantial text overlap with
  arXiv:2111.05082",,,,"astro-ph.CO","http://creativecommons.org/licenses/by/4.0/","  PSZ2 G091.83+26.11 is a galaxy cluster with M500 = 7.43 x 10^14 Msun at z =
0.822 1. This object exhibits a complex morphology with a clear bimodality
observed in X-rays. However, it was detected and analysed in the Planck sample
as a single, spherical cluster following a universal profile 2. This model can
lead to miscalculations of thermodynamical quantities, like the pressure
profile. As future multiwavelength cluster experiments will detect more and
more objects at high redshifts, it is crucial to quantify this systematic
effect. In this work, we use high-resolution observations of the NIKA2
camera3,4,5,6 to integrate the morphological characteristics of the cluster in
our modelling. This is achieved by fitting a two-halo model to the SZ image and
then by reconstruction of the resulting projected pressure profile. We then
compare these results with the spherical assumption.
","[{""version"":""v1"",""created"":""Fri, 29 Apr 2022 12:48:30 GMT""}]","2022-05-02"
"2204.14053","Raphael Wittkowski","Michael te Vrugt, Max Philipp Holl, Aron Koch, Raphael Wittkowski, Uwe
  Thiele","Derivation and analysis of a phase field crystal model for a mixture of
  active and passive particles","25 pages, 7 figures","Modelling and Simulation in Materials Science and Engineering 30,
  084001 (2022)","10.1088/1361-651X/ac856a",,"cond-mat.soft cond-mat.mtrl-sci cond-mat.stat-mech nlin.PS","http://arxiv.org/licenses/nonexclusive-distrib/1.0/","  We discuss an active phase field crystal (PFC) model that describes a mixture
of active and passive particles. First, a microscopic derivation from dynamical
density functional theory (DDFT) is presented that includes a systematic
treatment of the relevant orientational degrees of freedom. Of particular
interest is the construction of the nonlinear and coupling terms. This allows
for interesting insights into the microscopic justification of phenomenological
constructions used in PFC models for active particles and mixtures, the
approximations required for obtaining them, and possible generalizations.
Second, the derived model is investigated using linear stability analysis and
nonlinear methods. It is found that the model allows for a rich nonlinear
behavior with states ranging from steady periodic and localized states to
various time-periodic states. The latter include standing, traveling, and
modulated waves corresponding to spatially periodic and localized traveling,
wiggling, and alternating peak patterns and their combinations.
","[{""version"":""v1"",""created"":""Fri, 29 Apr 2022 12:49:03 GMT""}]","2022-10-26"
"2204.14054","Alexander Nizovtsev P.","A. Nizovtsev, A. Pushkarchuk, S. Kuten, D. Michels, D. Lyakhov, N.
  Kargin, S. Kilin","Simulation of indirect 13C-13C J-coupling tensors in diamond clusters
  hosting the NV center","10 pages, 3 figures, proceeding paper IOCN2022",,,,"quant-ph","http://creativecommons.org/licenses/by/4.0/","  Using the ORCA 5.0.2 software package we have simulated for a first time the
full tensors nJKL (K,L=X,Y,Z), describing n-bond J-coupling of nuclear spins
13C in H-terminated diamond-like clusters C10H16 (adamantane) and C35H36 as
well as in the cluster C33[NV-]H36 hosting the negatively charged NV- center.
We found that, in addition to usually considered isotropic scalar nJ-coupling
constant the anisotropic contributions to the nJ-coupling tensor are essential.
We have also shown that the presence of the NV center affects the J-coupling
characteristics, especially in the case of 13C-13C pairs located near the
vacancy of the NV center.
","[{""version"":""v1"",""created"":""Fri, 29 Apr 2022 12:49:21 GMT""}]","2022-05-02"
"2204.14058","Hairong  Yuan","Le Gao and Aifang Qu and Hairong Yuan","Delta Shock as Free Piston in Pressureless Euler Flows","15 pages","Zeitschrift f\""{u}r angewandte Mathematik und Physik, 2022","10.1007/s00033-022-01754-4",,"math.AP math-ph math.MP","http://arxiv.org/licenses/nonexclusive-distrib/1.0/","  We establish the equivalence of free piston and delta shock, for the
one-space-dimensional pressureless compressible Euler equations. The delta
shock appearing in the singular Riemann problem is exactly the piston that may
move freely forward or backward in a straight tube, driven by the pressureless
Euler flows on two sides of it in the tube. This result not only helps to
understand the physics of the somewhat mysterious delta shocks, but also
provides a way to reduce the fluid-solid interaction problem, which consists of
several initial-boundary value problems coupled with moving boundaries, to a
simpler Cauchy problem. We show the equivalence from three different
perspectives. The first one is from the sticky particles, and derives the
ordinary differential equation (ODE) of the trajectory of the piston by a
straightforward application of conservation law of momentum, which is
physically simple and clear. The second one is to study a coupled
initial-boundary value problem of pressureless Euler equations, with the piston
as a moving boundary following the Newton's second law. It depends on a concept
of Radon measure solutions of initial-boundary value problems of the
compressible Euler equations which enables us to calculate the force on the
piston given by the flow. The last one is to solve directly the singular
Riemann problem and obtain the ODE of delta shock by the generalized
Rankine-Hugoniot conditions. All the three methods lead to the same ODE.
","[{""version"":""v1"",""created"":""Fri, 29 Apr 2022 12:54:11 GMT""}]","2022-05-18"
"2204.14063","Nicolas Jouvin","Etienne C\^ome, Nicolas Jouvin","greed: An R Package for Model-Based Clustering by Greedy Maximization of
  the Integrated Classification Likelihood",,,,,"stat.ME","http://creativecommons.org/licenses/by-nc-sa/4.0/","  The greed package implements the general and flexible framework of
arXiv:2002.11577 for model-based clustering in the R language. Based on the
direct maximization of the exact Integrated Classification Likelihood with
respect to the partition, it allows jointly performing clustering and selection
of the number of groups. This combinatorial problem is handled through an
efficient hybrid genetic algorithm, while a final hierarchical step allows
accessing coarser partitions and extract an ordering of the clusters. This
methodology is applicable in a wide variety of latent variable models and,
hence, can handle various data types as well as heterogeneous data. Classical
models for continuous, count, categorical and graph data are implemented, and
new models may be incorporated thanks to S4 class abstraction. This paper
introduces the package, the design choices that guided its development and
illustrates its usage on practical use-cases.
","[{""version"":""v1"",""created"":""Fri, 29 Apr 2022 12:58:15 GMT""}]","2022-05-02"
"2204.14066","Andrea Scharnhorst","Rick Szostak, Richard P. Smiraglia, Andrea Scharnhorst, Aida Slavic,
  Daniel Mart\'inez-\'Avila, Tobias Renwick","Classifications as Linked Open Data. Challenges and Opportunities",,,"10.5771/9783956506611-24",,"cs.DL","http://creativecommons.org/licenses/by/4.0/","  Linked Data (LD) as a web--based technology enables in principle the
seamless, machine--supported integration, interplay and augmentation of all
kinds of knowledge, into what has been labeled a huge knowledge graph. Despite
decades of web technology and, more recently, the LD approach, the task to
fully exploit these new technologies in the public domain is only commencing.
One specific challenge is to transfer techniques developed preweb to order our
knowledge into the realm of Linked Open Data (LOD) This paper illustrates two
different models in which a general analytico--synthetic classification can be
published and made available as LD. In both cases, an LD solution deals with
the intricacies of a pre--coordinated indexing language.
","[{""version"":""v1"",""created"":""Fri, 29 Apr 2022 13:03:35 GMT""}]","2022-05-02"
