"2204.13871","Pankaj Kumar","Pankaj Kumar, Judith T. Karpen, Vadim M. Uritsky, Craig E. Deforest,
  Nour E. Raouafi, C. Richard DeVore","Quasiperiodic Energy Release and Jets at the Base of Solar Coronal
  Plumes","22 pages, 14 figures, ApJ (in press)",,"10.3847/1538-4357/ac6c24",,"astro-ph.SR","http://arxiv.org/licenses/nonexclusive-distrib/1.0/","  Coronal plumes are long, ray-like, open structures, which have been
considered as possible sources for the solar wind. Their origin in the largely
unipolar coronal holes has long been a mystery. Earlier spectroscopic and
imaging observations revealed blue-shifted plasma and propagating disturbances
(PDs) in plumes that are widely interpreted in terms of flows and/or
propagating slow-mode waves, but these interpretations (flows vs waves) remain
under debate. Recently we discovered an important clue about plume internal
structure: dynamic filamentary features called plumelets, which account for
most of the plume emission. Here we present high-resolution observations from
the Solar Dynamics Observatory/Atmospheric Imaging Assembly (SDO/AIA) and the
Interface Region Imaging Spectrograph (IRIS) that revealed numerous,
quasiperiodic, tiny jets (so-called jetlets) associated with transient
brightening, flows, and plasma heating at the chromospheric footpoints of the
plumelets. By analogy to larger coronal jets, these jetlets are most likely
produced within the plume base by magnetic reconnection between closed and open
flux at stressed 3D null points. The jetlet-associated brightenings are in
phase with plumelet-associated PDs, and vary with a period of about 3 to 5
minutes, which is remarkably consistent with the photospheric/chromospheric
p-mode oscillation. This reconnection at the open-closed boundary in the
chromosphere/transition region is likely modulated or driven by local
manifestations of the global p-mode waves. The jetlets extend upward to become
plumelets, contribute mass to the solar wind, and may be sources of the
switchbacks recently detected by the Parker Solar Probe.
","[{""version"":""v1"",""created"":""Fri, 29 Apr 2022 04:12:02 GMT""},{""version"":""v2"",""created"":""Mon, 2 May 2022 01:13:50 GMT""}]","2022-07-06"
"2204.13872","Logan Stapleton","Logan Stapleton, Hao-Fei Cheng, Anna Kawakami, Venkatesh Sivaraman,
  Yanghuidi Cheng, Diana Qing, Adam Perer, Kenneth Holstein, Zhiwei Steven Wu,
  Haiyi Zhu","Extended Analysis of ""How Child Welfare Workers Reduce Racial
  Disparities in Algorithmic Decisions""",,,,,"cs.HC","http://arxiv.org/licenses/nonexclusive-distrib/1.0/","  This is an extended analysis of our paper ""How Child Welfare Workers Reduce
Racial Disparities in Algorithmic Decisions,"" which looks at racial disparities
in the Allegheny Family Screening Tool, an algorithm used to help child welfare
workers decide which families the Allegheny County child welfare agency (CYF)
should investigate. On April 27, 2022, Allegheny County CYF sent us an updated
dataset and pre-processing steps. In this extended analysis of our paper, we
show the results from re-running all quantitative analyses in our paper with
this new data and pre-processing. We find that our main findings in our paper
were robust to changes in data and pre-processing. Particularly, the Allegheny
Family Screening Tool on its own would have made more racially disparate
decisions than workers, and workers used the tool to decrease those algorithmic
disparities. Some minor results changed, including a slight increase in the
screen-in rate from before to after the implementation of the AFST reported our
paper.
","[{""version"":""v1"",""created"":""Fri, 29 Apr 2022 04:12:34 GMT""}]","2022-05-02"
"2204.13873","Juncheng Li","Juncheng Li, Hanhui Yang, Qiaosi Yi, Faming Fang, Guangwei Gao,
  Tieyong Zeng, Guixu Zhang","Multiple Degradation and Reconstruction Network for Single Image
  Denoising via Knowledge Distillation","Accepted by CVPR Workshop 2022",,,,"cs.CV eess.IV","http://creativecommons.org/licenses/by/4.0/","  Single image denoising (SID) has achieved significant breakthroughs with the
development of deep learning. However, the proposed methods are often
accompanied by plenty of parameters, which greatly limits their application
scenarios. Different from previous works that blindly increase the depth of the
network, we explore the degradation mechanism of the noisy image and propose a
lightweight Multiple Degradation and Reconstruction Network (MDRN) to
progressively remove noise. Meanwhile, we propose two novel Heterogeneous
Knowledge Distillation Strategies (HMDS) to enable MDRN to learn richer and
more accurate features from heterogeneous models, which make it possible to
reconstruct higher-quality denoised images under extreme conditions. Extensive
experiments show that our MDRN achieves favorable performance against other SID
models with fewer parameters. Meanwhile, plenty of ablation studies demonstrate
that the introduced HMDS can improve the performance of tiny models or the
model under high noise levels, which is extremely useful for related
applications.
","[{""version"":""v1"",""created"":""Fri, 29 Apr 2022 04:13:43 GMT""}]","2022-05-02"
"2204.13874","Xinyang Zhang","Xinyang Zhang, Chenwei Zhang, Xian Li, Xin Luna Dong, Jingbo Shang,
  Christos Faloutsos, Jiawei Han","OA-Mine: Open-World Attribute Mining for E-Commerce Products with Weak
  Supervision","WWW 2022",,"10.1145/3485447.3512035",,"cs.CL","http://creativecommons.org/licenses/by/4.0/","  Automatic extraction of product attributes from their textual descriptions is
essential for online shopper experience. One inherent challenge of this task is
the emerging nature of e-commerce products -- we see new types of products with
their unique set of new attributes constantly. Most prior works on this matter
mine new values for a set of known attributes but cannot handle new attributes
that arose from constantly changing data. In this work, we study the attribute
mining problem in an open-world setting to extract novel attributes and their
values. Instead of providing comprehensive training data, the user only needs
to provide a few examples for a few known attribute types as weak supervision.
We propose a principled framework that first generates attribute value
candidates and then groups them into clusters of attributes. The candidate
generation step probes a pre-trained language model to extract phrases from
product titles. Then, an attribute-aware fine-tuning method optimizes a
multitask objective and shapes the language model representation to be
attribute-discriminative. Finally, we discover new attributes and values
through the self-ensemble of our framework, which handles the open-world
challenge. We run extensive experiments on a large distantly annotated
development set and a gold standard human-annotated test set that we collected.
Our model significantly outperforms strong baselines and can generalize to
unseen attributes and product types.
","[{""version"":""v1"",""created"":""Fri, 29 Apr 2022 04:16:04 GMT""}]","2022-05-02"
"2204.13875","Shashank Karra","Shashank K. Karra, Sourabh V. Apte, Xiaoliang He and Timothy D.
  Scheibe","Pore-resolved simulations of turbulent boundary layer flow over
  permeable and impermeable sediment beds","31 pages, 18 figures, journal paper",,,,"physics.flu-dyn","http://creativecommons.org/licenses/by/4.0/","  Pore-resolved direct numerical simulations of turbulent open channel flow are
performed comparing the structure and dynamics of turbulence over impermeable
rough and smooth walls to a porous sediment bed at permeability Reynolds number
($Re_K$) of 2.6, representative of aquatic beds. Four configurations are
investigated; namely, (i) permeable bed with randomly packed sediment grains,
(ii) an impermeable-wall with full layer of roughness elements matching the top
layer of the sediment bed, (iii) an impermeable-wall with half layer of
roughness elements , and (iv) a smooth wall. A double-averaging methodology is
used to compute the mean velocity, Reynolds stresses, form-induced stresses,
and turbulent kinetic energy budget. It is observed that the mean velocity,
Reynolds stresses, and form-induced pressure-velocity correlations representing
upwelling and downwelling fluxes are similar in magnitude for the permeable-bed
and impermeable-full layer wall cases. However, for the impermeable-half layer
case, the wall blocking effect results in higher streamwise and lower
wall-normal stresses compared to the permeable-bed case. Bed roughness
increases Reynolds shear stress whereas permeability has minimal influence. Bed
permeability, in contrast to Reynolds stresses, significantly influences
form-induced shear stress. Bed shear stress statistics show that probability of
extreme events increases in permeable bed and rough wall cases as compared to
the smooth wall. Findings suggest that bed permeability can have significant
impact on modeling of hyporheic exchange and its effect on bed shear and
pressure fluctuations are better captured by considering at least the top layer
of sediment.
","[{""version"":""v1"",""created"":""Fri, 29 Apr 2022 04:26:57 GMT""}]","2022-05-02"
"2204.13876","Somnath Basu","Somnath Basu, Dhruv Bhasin, Siddhartha Lal, Siddhartha Patra","Graph Polynomial for Colored Embedded Graphs: A Topological Approach","38 pages, 49 figures; comments are welcome",,,,"math.CO math-ph math.AT math.MP","http://creativecommons.org/licenses/by/4.0/","  We study finite graphs embedded in oriented surfaces by associating a
polynomial to it. The tools used in developing a theory of such graph
polynomials are algebraic topological while the polynomial itself is inspired
from ideas arising in physics. We also analyze a variant of these polynomials
for colored embedded graphs. This is used to describe the change in the
polynomial under basic graph theoretic operations. We conclude with several
applications of this polynomial including detection of certain classes of
graphs and the connection of this polynomial with topological entanglement
entropy.
","[{""version"":""v1"",""created"":""Fri, 29 Apr 2022 04:28:22 GMT""}]","2022-05-02"
"2204.13877","Jinwoo Jeon","Jinwoo Jeon, Hyunjun Lim, Dong-Uk Seo, and Hyun Myung","Struct-MDC: Mesh-Refined Unsupervised Depth Completion Leveraging
  Structural Regularities from Visual SLAM","8 pages",,,,"cs.CV cs.RO","http://creativecommons.org/licenses/by-nc-sa/4.0/","  Feature-based visual simultaneous localization and mapping (SLAM) methods
only estimate the depth of extracted features, generating a sparse depth map.
To solve this sparsity problem, depth completion tasks that estimate a dense
depth from a sparse depth have gained significant importance in robotic
applications like exploration. Existing methodologies that use sparse depth
from visual SLAM mainly employ point features. However, point features have
limitations in preserving structural regularities owing to texture-less
environments and sparsity problems. To deal with these issues, we perform depth
completion with visual SLAM using line features, which can better contain
structural regularities than point features. The proposed methodology creates a
convex hull region by performing constrained Delaunay triangulation with depth
interpolation using line features. However, the generated depth includes
low-frequency information and is discontinuous at the convex hull boundary.
Therefore, we propose a mesh depth refinement (MDR) module to address this
problem. The MDR module effectively transfers the high-frequency details of an
input image to the interpolated depth and plays a vital role in bridging the
conventional and deep learning-based approaches. The Struct-MDC outperforms
other state-of-the-art algorithms on public and our custom datasets, and even
outperforms supervised methodologies for some metrics. In addition, the
effectiveness of the proposed MDR module is verified by a rigorous ablation
study.
","[{""version"":""v1"",""created"":""Fri, 29 Apr 2022 04:29:17 GMT""}]","2022-05-02"
"2204.13878","Cong Wang","Cong Wang, Bin Hu, Hongyi Wu","Energy Minimization for Federated Asynchronous Learning on
  Battery-Powered Mobile Devices via Application Co-running","Accepted by IEEE ICDCS 2022",,,,"cs.DC cs.LG","http://creativecommons.org/licenses/by/4.0/","  Energy is an essential, but often forgotten aspect in large-scale federated
systems. As most of the research focuses on tackling computational and
statistical heterogeneity from the machine learning algorithms, the impact on
the mobile system still remains unclear. In this paper, we design and implement
an online optimization framework by connecting asynchronous execution of
federated training with application co-running to minimize energy consumption
on battery-powered mobile devices. From a series of experiments, we find that
co-running the training process in the background with foreground applications
gives the system a deep energy discount with negligible performance slowdown.
Based on these results, we first study an offline problem assuming all the
future occurrences of applications are available, and propose a dynamic
programming-based algorithm. Then we propose an online algorithm using the
Lyapunov framework to explore the solution space via the energy-staleness
trade-off. The extensive experiments demonstrate that the online optimization
framework can save over 60% energy with 3 times faster convergence speed
compared to the previous schemes.
","[{""version"":""v1"",""created"":""Fri, 29 Apr 2022 04:34:06 GMT""}]","2022-05-02"
"2204.13879","Ben Burgess-Limerick","Ben Burgess-Limerick, Chris Lehnert, Jurgen Leitner, Peter Corke","DGBench: An Open-Source, Reproducible Benchmark for Dynamic Grasping","Dynamic Grasping Benchmark available:
  https://github.com/BenBurgessLimerick/DGBench",,,,"cs.RO","http://creativecommons.org/licenses/by/4.0/","  This paper introduces DGBench, a fully reproducible open-source testing
system to enable benchmarking of dynamic grasping in environments with
unpredictable relative motion between robot and object. We use the proposed
benchmark to compare several visual perception arrangements. Traditional
perception systems developed for static grasping are unable to provide feedback
during the final phase of a grasp due to sensor minimum range, occlusion, and a
limited field of view. A multi-camera eye-in-hand perception system is
presented that has advantages over commonly used camera configurations. We
quantitatively evaluate the performance on a real robot with an image-based
visual servoing grasp controller and show a significantly improved success rate
on a dynamic grasping task.
","[{""version"":""v1"",""created"":""Fri, 29 Apr 2022 04:37:18 GMT""},{""version"":""v2"",""created"":""Wed, 13 Jul 2022 05:21:56 GMT""}]","2022-07-14"
"2204.13880","JudyX Yang","Judy X Yang, Hui Tian, Alan Wee-Chung Liew and Ernest Foo","A hybrid privacy protection scheme for medical data","6 figures, 10 pages",,,,"cs.CR","http://creativecommons.org/licenses/by/4.0/","  Healthcare data contains sensitive information, and it is challenging to
persuade healthcare data owners to share their information for research
purposes without any privacy assurance. The proposed hybrid medical data
privacy protection scheme explores the possibility of providing adaptive
privacy protection and data utility levels. The evaluation result demonstrates
that the scheme can provide adaptive privacy and data utility levels, and the
data holder can choose their preferred risk level and data utility through the
scheme. The evaluation results on the heart disease and diabetes data
demonstrate that the scheme can provide a wide range of adaptive privacy
protection and data utility levels to meet different privacy protection and
data utility requirements.
","[{""version"":""v1"",""created"":""Fri, 29 Apr 2022 04:59:01 GMT""},{""version"":""v2"",""created"":""Mon, 9 May 2022 06:01:16 GMT""}]","2022-05-10"
"2204.13881","Yang Wang","Yi Qin, Yang Wang, Yi Li and Jian Li","Analysis of A New Adaptive Time Filter Algorithm for The Unsteady
  Stokes/Darcy Model",,,,,"math.NA cs.NA","http://creativecommons.org/licenses/by/4.0/","  In this report, we propose a new adaptive time filter algorithm for the
unsteady Stokes/Darcy model. First we present a first order ${\theta}$-scheme
with the variable time step which is one parameter family of Linear Multi-step
methods and use a time filter algorithm to increase the convergence order to
second order with almost no increasing the amount of computation. Furthermore,
we construct coupled and decoupled adaptive algorithms. Then we analyze
stabilities and the second-order accuracy of variable time-stepping algorithm
for Linear Multi-step methods plus time filter, respectively. Finally, we use
two numerical experiments to verify theoretical results including
effectiveness, convergence and efficiency with adaptive method.
","[{""version"":""v1"",""created"":""Fri, 29 Apr 2022 04:59:06 GMT""},{""version"":""v2"",""created"":""Tue, 14 Jun 2022 06:29:29 GMT""},{""version"":""v3"",""created"":""Fri, 26 Aug 2022 02:43:22 GMT""}]","2022-08-29"
"2204.13882","Victor Bovdi A.","Victor Bovdi, Adama Diene, Roman Popovych","Elements of high order in finite fields specified by binomials","8 pages",,,,"math.NT math.AC math.GR math.RA","http://creativecommons.org/licenses/by/4.0/","  Let $F_q$ be a field with $q$ elements, where $q$ is a power of a prime
number $p\geq 5$. For any integer $m\geq 2$ and $a\in F_q^*$ such that the
polynomial $x^m-a$ is irreducible in $F_q[x]$, we combine two different methods
to construct explicitly elements of high order in the field $F_q[x]/\langle
x^m-a\rangle $. Namely, we find elements with multiplicative order of at least
$5^{\sqrt[3]{m/2}}$, which is better than previously obtained bound for such
family of extension fields.
","[{""version"":""v1"",""created"":""Fri, 29 Apr 2022 04:59:10 GMT""}]","2022-05-02"
"2204.13883","Karn N Watcharasupat","Karn N. Watcharasupat, Kenneth Ooi, Bhan Lam, Trevor Wong, Zhen-Ting
  Ong, and Woon-Seng Gan","Autonomous In-Situ Soundscape Augmentation via Joint Selection of Masker
  and Gain","Accepted to IEEE Signal Processing Letters. (c) 2022 IEEE","IEEE Signal Processing Letters, Vol. 29, pp. 1749 - 1753, 2022","10.1109/LSP.2022.3194419",,"eess.AS cs.LG cs.SD","http://creativecommons.org/licenses/by-nc-nd/4.0/","  The selection of maskers and playback gain levels in a soundscape
augmentation system is crucial to its effectiveness in improving the overall
acoustic comfort of a given environment. Traditionally, the selection of
appropriate maskers and gain levels has been informed by expert opinion, which
may not representative of the target population, or by listening tests, which
can be time-consuming and labour-intensive. Furthermore, the resulting static
choices of masker and gain are often inflexible to the dynamic nature of
real-world soundscapes. In this work, we utilized a deep learning model to
perform joint selection of the optimal masker and its gain level for a given
soundscape. The proposed model was designed with highly modular building
blocks, allowing for an optimized inference process that can quickly search
through a large number of masker and gain combinations. In addition, we
introduced the use of feature-domain soundscape augmentation conditioned on the
digital gain level, eliminating the computationally expensive waveform-domain
mixing process during inference time, as well as the tedious pre-calibration
process required for new maskers. The proposed system was validated on a
large-scale dataset of subjective responses to augmented soundscapes with more
than 440 participants, ensuring the ability of the model to predict combined
effect of the masker and its gain level on the perceptual pleasantness level.
","[{""version"":""v1"",""created"":""Fri, 29 Apr 2022 04:59:56 GMT""},{""version"":""v2"",""created"":""Sat, 23 Jul 2022 13:45:19 GMT""}]","2022-08-31"
"2204.13884","Yikun Qiao","Yikun Qiao","GIT for $\hat U$-actions on algebraic $\mathbb C$-schemes",,,,,"math.AG","http://creativecommons.org/licenses/by/4.0/","  We extend the $\hat U$-theorem for projective varieties proved in
arXiv:1601.00340 and arXiv:1607.04181 to projective schemes over $\mathbb C$.
The condition ""ss=s"" required in arXiv:1601.00340 and arXiv:1607.04181 is
reformulated algebraically for our setting. We also describe a blowing up for
the condition ""ss=s"". Different from the sequence of blowing ups in
arXiv:1607.04181 , we can get ""ss=s"" in one blowing up.
","[{""version"":""v1"",""created"":""Fri, 29 Apr 2022 05:03:03 GMT""},{""version"":""v2"",""created"":""Tue, 28 Jun 2022 15:50:56 GMT""}]","2022-06-29"
"2204.13885","Syed Wajid Ali Shah","Mohammad Reza Nosouhi, Syed W. Shah, Lei Pan, Yevhen Zolotavkin,
  Ashish Nanda, Praveen Gauravaram, Robin Doss","Weak-Key Analysis for BIKE Post-Quantum Key Encapsulation Mechanism",,,,,"cs.CR","http://arxiv.org/licenses/nonexclusive-distrib/1.0/","  The evolution of quantum computers poses a serious threat to contemporary
public-key encryption (PKE) schemes. To address this impending issue, the
National Institute of Standards and Technology (NIST) is currently undertaking
the Post-Quantum Cryptography (PQC) standardization project intending to
evaluate and subsequently standardize the suitable PQC scheme(s). One such
attractive approach, called Bit Flipping Key Encapsulation (BIKE), has made to
the final round of the competition. Despite having some attractive features,
the IND-CCA security of the BIKE depends on the average decoder failure rate
(DFR), a higher value of which can facilitate a particular type of side-channel
attack. Although the BIKE adopts a Black-Grey-Flip (BGF) decoder that offers a
negligible DFR, the effect of weak-keys on the average DFR has not been fully
investigated. Therefore, in this paper, we first perform an implementation of
the BIKE scheme, and then through extensive experiments show that the weak-keys
can be a potential threat to IND-CCA security of the BIKE scheme and thus need
attention from the research community prior to standardization. We also propose
a key-check algorithm that can potentially supplement the BIKE mechanism and
prevent users from generating and adopting weak keys to address this issue.
","[{""version"":""v1"",""created"":""Fri, 29 Apr 2022 05:06:22 GMT""},{""version"":""v2"",""created"":""Thu, 14 Jul 2022 02:22:13 GMT""}]","2022-07-15"
"2204.13886","Mingdeng Cao","Mingdeng Cao, Zhihang Zhong, Jiahao Wang, Yinqiang Zheng, Yujiu Yang","Learning Adaptive Warping for Real-World Rolling Shutter Correction","To appear in CVPR2022",,,,"cs.CV","http://arxiv.org/licenses/nonexclusive-distrib/1.0/","  This paper proposes the first real-world rolling shutter (RS) correction
dataset, BS-RSC, and a corresponding model to correct the RS frames in a
distorted video. Mobile devices in the consumer market with CMOS-based sensors
for video capture often result in rolling shutter effects when relative
movements occur during the video acquisition process, calling for RS effect
removal techniques. However, current state-of-the-art RS correction methods
often fail to remove RS effects in real scenarios since the motions are various
and hard to model. To address this issue, we propose a real-world RS correction
dataset BS-RSC. Real distorted videos with corresponding ground truth are
recorded simultaneously via a well-designed beam-splitter-based acquisition
system. BS-RSC contains various motions of both camera and objects in dynamic
scenes. Further, an RS correction model with adaptive warping is proposed. Our
model can warp the learned RS features into global shutter counterparts
adaptively with predicted multiple displacement fields. These warped features
are aggregated and then reconstructed into high-quality global shutter frames
in a coarse-to-fine strategy. Experimental results demonstrate the
effectiveness of the proposed method, and our dataset can improve the model's
ability to remove the RS effects in the real world.
","[{""version"":""v1"",""created"":""Fri, 29 Apr 2022 05:13:50 GMT""}]","2022-05-02"
"2204.13887","Ade Irma Suriajaya Ph.D.","Athanasios Sourmelidis, J\""orn Steuding, and Ade Irma Suriajaya","The $a$-points of the Riemann zeta-function and the functional equation","Dedicated to the memory of Professor Eduard Wirsing, 12 pages",,,"RIKEN-iTHEMS-Report-22","math.NT","http://arxiv.org/licenses/nonexclusive-distrib/1.0/","  We prove an equivalent of the Riemann hypothesis in terms of the functional
equation (in its asymmetrical form) and the $a$-points of the zeta-function,
i.e., the roots of the equation $\zeta(s)=a$, where $a$ is an arbitrary fixed
complex number.
","[{""version"":""v1"",""created"":""Fri, 29 Apr 2022 05:24:54 GMT""}]","2022-05-02"
"2204.13888","Mitch Haslehurst","Mitch Haslehurst","Some examples of factor groupoids","Final version to appear in the Journal of Operator Theory; error in
  proofs involving C-extension property corrected",,,,"math.OA","http://arxiv.org/licenses/nonexclusive-distrib/1.0/","  We examine two classes of examples of Hausdorff \'etale factor groupoids; one
comes from taking a quotient space of the unit space of an AF-groupoid, and the
other comes from certain nonhomogeneous extensions of Cantor minimal systems
considered by Robin Deeley, Ian Putnam, and Karen Strung. The reduced
C$^*$-algebras of the factor groupoids are classifiable in the Elliott scheme,
and we describe their $K$-theory and traces.
","[{""version"":""v1"",""created"":""Fri, 29 Apr 2022 05:25:07 GMT""},{""version"":""v2"",""created"":""Tue, 7 Jun 2022 16:25:10 GMT""},{""version"":""v3"",""created"":""Sat, 29 Apr 2023 14:38:04 GMT""}]","2023-05-02"
