"2204.13588","Ryusuke Ikeda","Dai Nakashima and Ryusuke Ikeda","Vortex Lattice Melting Line in Superconductors with Paramagnetic
  Pair-Breaking","Submitted version","Phys. Rev. B106,024508 (2022)","10.1103/PhysRevB.106.024508",,"cond-mat.supr-con","http://creativecommons.org/licenses/by/4.0/","  Recent experiments on the Iron-based superconductor FeSe in a high magnetic
field have suggested the presence of both the fluctuation-induced vortex liquid
regime and a Fulde-Ferrell-Larkin-Ovchinnikov (FFLO) vortex lattice. To get a
general picture on the magnetic phase diagram in type II superconductors with
strong superconducting (SC) fluctuation and strong paramagnetic pair-breaking
(PPB) such as FeSe, the vortex lattice melting curve Hm(T) is theoretically
investigated in the situations where a FFLO state is expected to occur. In
general, the PPB tends to narrow the vortex liquid regime intervening between
Hc2(T) and Hm(T). In particular, the vortex liquid regime is found to rapidly
shrink upon entering, by cooling, the temperature range in which the FFLO state
with a periodic modulation parallel to the magnetic field is stable in the mean
field theory. Based on the present results, the high field SC phase diagrams of
FeSe in the parallel and perpendicular field configurations are discussed.
","[{""version"":""v1"",""created"":""Thu, 28 Apr 2022 16:00:33 GMT""},{""version"":""v2"",""created"":""Mon, 2 May 2022 14:34:35 GMT""},{""version"":""v3"",""created"":""Tue, 12 Jul 2022 04:46:40 GMT""}]","2022-07-13"
"2204.13590","Rui Fan","Nachuan Ma, Jiahe Fan, Wenshuo Wang, Jin Wu, Yu Jiang, Lihua Xie, Rui
  Fan","Computer Vision for Road Imaging and Pothole Detection: A
  State-of-the-Art Review of Systems and Algorithms","accepted to Transportation Safety and Environment",,"10.1093/tse/tdac026",,"cs.CV cs.AI cs.LG cs.RO","http://creativecommons.org/licenses/by/4.0/","  Computer vision algorithms have been prevalently utilized for 3-D road
imaging and pothole detection for over two decades. Nonetheless, there is a
lack of systematic survey articles on state-of-the-art (SoTA) computer vision
techniques, especially deep learning models, developed to tackle these
problems. This article first introduces the sensing systems employed for 2-D
and 3-D road data acquisition, including camera(s), laser scanners, and
Microsoft Kinect. Afterward, it thoroughly and comprehensively reviews the SoTA
computer vision algorithms, including (1) classical 2-D image processing, (2)
3-D point cloud modeling and segmentation, and (3) machine/deep learning,
developed for road pothole detection. This article also discusses the existing
challenges and future development trends of computer vision-based road pothole
detection approaches: classical 2-D image processing-based and 3-D point cloud
modeling and segmentation-based approaches have already become history; and
Convolutional neural networks (CNNs) have demonstrated compelling road pothole
detection results and are promising to break the bottleneck with the future
advances in self/un-supervised learning for multi-modal semantic segmentation.
We believe that this survey can serve as practical guidance for developing the
next-generation road condition assessment systems.
","[{""version"":""v1"",""created"":""Thu, 28 Apr 2022 16:00:39 GMT""}]","2022-04-29"
"2204.13593","Trevor Oxholm","Trevor M. Oxholm, Eric R. Switzer, Emily M. Barrentine, Thomas
  Essinger-Hileman, James P. Hays-Wehle, Philip D. Mauskopf, Omid Noroozian,
  Maryam Rahmani, Adrian K. Sinclair, Ryan Stephenson, Thomas R. Stevenson,
  Peter T. Timbie, Carolyn Volpert, Eric Weeks","Operational Optimization to Maximize Dynamic Range in EXCLAIM Microwave
  Kinetic Inductance Detectors",,,"10.1007/s10909-022-02760-6",,"astro-ph.IM","http://creativecommons.org/licenses/by/4.0/","  Microwave Kinetic Inductance Detectors (MKIDs) are highly scalable detectors
that have demonstrated nearly background-limited sensitivity in the
far-infrared from high-altitude balloon-borne telescopes and space-like
laboratory environments. In addition, the detectors have a rich design space
with many optimizable parameters, allowing highly sensitive measurements over a
wide dynamic range. For these reasons, MKIDs were chosen for the Experiment for
Cryogenic Large-Aperture Intensity Mapping (EXCLAIM), a balloon-borne telescope
targeting nearly background-limited performance in a high-altitude atmospheric
environment from 420-540 GHz. We describe MKID optimization in the specific
context of EXCLAIM and provide general results that apply to broader
applications. Extending the established approach of tone frequency tracking, we
show that readout power optimization enables significant, further improvement
in dynamic range.
","[{""version"":""v1"",""created"":""Thu, 28 Apr 2022 16:00:47 GMT""}]","2022-08-10"
"2204.13601","Ali Yazdani","Ali Yazdani, Hossein Simchi, Yasser Shekofteh","Emotion Recognition In Persian Speech Using Deep Neural Networks","5 pages, 1 figure, 3 tables","11th International Conference on Computer and Knowledge
  Engineering (ICCKE 2021)","10.1109/ICCKE54056.2021.9721504",,"cs.SD cs.AI eess.AS","http://arxiv.org/licenses/nonexclusive-distrib/1.0/","  Speech Emotion Recognition (SER) is of great importance in Human-Computer
Interaction (HCI), as it provides a deeper understanding of the situation and
results in better interaction. In recent years, various machine learning and
Deep Learning (DL) algorithms have been developed to improve SER techniques.
Recognition of the spoken emotions depends on the type of expression that
varies between different languages. In this paper, to further study important
factors in the Farsi language, we examine various DL techniques on a
Farsi/Persian dataset, Sharif Emotional Speech Database (ShEMO), which was
released in 2018. Using signal features in low- and high-level descriptions and
different deep neural networks and machine learning techniques, Unweighted
Accuracy (UA) of 65.20% and Weighted Accuracy (WA) of 78.29% are achieved.
","[{""version"":""v1"",""created"":""Thu, 28 Apr 2022 16:02:05 GMT""},{""version"":""v2"",""created"":""Sat, 12 Nov 2022 08:16:35 GMT""}]","2022-11-15"
"2204.13602","Nicholas Meadows","David Blanc and Nicholas Meadows","Localization of $(\infty, 1)$-categories and spectral sequences",,,,,"math.AT","http://arxiv.org/licenses/nonexclusive-distrib/1.0/","  We describe two types of localization for $(\infty, 1)$-categories which
determine the successive terms in the homotopy spectral sequence of a
(co)simplicial object.
","[{""version"":""v1"",""created"":""Thu, 28 Apr 2022 16:02:48 GMT""},{""version"":""v2"",""created"":""Fri, 29 Apr 2022 01:07:00 GMT""}]","2022-05-02"
"2204.13603","Daniel Steenebr\""ugge","Hannes Matt, Daniel Steenebr\""ugge, Heiko von der Mosel","Banach gradient flows for various families of knot energies","42 pages","J. Evol. Equ. 23, 31 (2023)","10.1007/s00028-022-00863-x",,"math.CA math.DG math.OC","http://arxiv.org/licenses/nonexclusive-distrib/1.0/","  We establish long-time existence of Banach gradient flows for generalised
integral Menger curvatures and tangent-point energies, and for O'Hara's
self-repulsive potentials $E^{\alpha,p}$. In order to do so, we employ the
theory of curves of maximal slope in slightly smaller spaces compactly
embedding into the respective energy spaces associated to these functionals,
and add a term involving the logarithmic strain, which controls the
parametrisations of the flowing (knotted) loops. As a prerequisite, we prove in
addition that O'Hara's knot energies $E^{\alpha,p}$ are continuously
differentiable.
","[{""version"":""v1"",""created"":""Thu, 28 Apr 2022 16:03:47 GMT""}]","2023-04-25"
"2204.13604","Xindi Wang","Xindi Wang, Robert E. Mercer, Frank Rudzicz","MeSHup: A Corpus for Full Text Biomedical Document Indexing","LREC 2022 main conference",,,,"cs.CL cs.IR","http://creativecommons.org/licenses/by/4.0/","  Medical Subject Heading (MeSH) indexing refers to the problem of assigning a
given biomedical document with the most relevant labels from an extremely large
set of MeSH terms. Currently, the vast number of biomedical articles in the
PubMed database are manually annotated by human curators, which is time
consuming and costly; therefore, a computational system that can assist the
indexing is highly valuable. When developing supervised MeSH indexing systems,
the availability of a large-scale annotated text corpus is desirable. A
publicly available, large corpus that permits robust evaluation and comparison
of various systems is important to the research community. We release a large
scale annotated MeSH indexing corpus, MeSHup, which contains 1,342,667 full
text articles in English, together with the associated MeSH labels and
metadata, authors, and publication venues that are collected from the MEDLINE
database. We train an end-to-end model that combines features from documents
and their associated labels on our corpus and report the new baseline.
","[{""version"":""v1"",""created"":""Thu, 28 Apr 2022 16:04:20 GMT""}]","2022-04-29"
"2204.13605","D\'ebora Barreiros","D.M. Barreiros, H.B. Camara, F.R. Joaquim","Flavour and dark matter in a scoto/type-II seesaw model","51 LaTeX pages; 21 figures",,"10.1007/JHEP08(2022)030",,"hep-ph","http://arxiv.org/licenses/nonexclusive-distrib/1.0/","  The neutrino mass and dark matter (DM) problems are addressed in a Standard
Model extension where the type-II seesaw and scotogenic mechanisms coexist. The
model features a flavour $\mathcal{Z}_8$ discrete symmetry which is broken down
to a $\mathcal{Z}_2$, stabilising the (scalar or fermion) DM particle.
Spontaneous CP violation is implemented through the complex vacuum expectation
value of a singlet scalar field, inducing observable CP-violating effects in
the lepton sector. The structure of the effective neutrino mass matrix leads to
constraints on the low-energy neutrino observables, namely the atmospheric
neutrino mixing angle $\theta_{23}$, the Dirac CP-violating phase $\delta$ and
the absolute neutrino mass scale $m_{\rm lightest}$. In particular, in most
cases, the model selects one $\theta_{23}$ octant with $\delta \simeq 3\pi/2$.
Moreover, the obtained lower bounds on $m_{\rm lightest}$ are typically in the
range probed by cosmology. We also analyse the constraints imposed on the model
by current experimental limits on charged lepton flavour violating (cLFV)
processes, as well as future projected sensitivities. It is shown that the
Higgs triplet and scotogenic contributions to cLFV never overlap and that the
interplay among Yukawa couplings, dark charged scalar masses and mixing leads
to a wide parameter-space region compatible with current experimental bounds.
We investigate the scalar and fermion DM parameter space of our model by
considering relic density, direct-detection (DD) and collider constraints. For
scalar DM the mass interval $68 \ \text{GeV} \lesssim m_{\text{DM}} \lesssim 90
\ \text{GeV}$ is viable and will be probed by future DD searches. In the
fermion DM case, correct relic density is always obtained for $m_{\text{DM}}
\gtrsim 45$ GeV thanks to dark fermion-scalar coannihilation channels.
","[{""version"":""v1"",""created"":""Thu, 28 Apr 2022 16:06:09 GMT""}]","2022-08-24"
"2204.13606","Pol del Aguila Pla","P. del Aguila Pla and Michael Unser","Bona fide Riesz projections for density estimation","Accepted to the 2022 IEEE International Conference on Acoustics,
  Speech and Signal Processing (ICASSP)",,,,"eess.SP cs.LG stat.ME","http://arxiv.org/licenses/nonexclusive-distrib/1.0/","  The projection of sample measurements onto a reconstruction space represented
by a basis on a regular grid is a powerful and simple approach to estimate a
probability density function. In this paper, we focus on Riesz bases and
propose a projection operator that, in contrast to previous works, guarantees
the bona fide properties for the estimate, namely, non-negativity and total
probability mass $1$. Our bona fide projection is defined as a convex problem.
We propose solution techniques and evaluate them. Results suggest an improved
performance, specifically in circumstances prone to rippling effects.
","[{""version"":""v1"",""created"":""Thu, 28 Apr 2022 16:06:17 GMT""}]","2022-04-29"
"2204.13607","Alexander Scarlatos","Alexander Scarlatos, Christopher Brinton, Andrew Lan","Process-BERT: A Framework for Representation Learning on Educational
  Process Data","10 pages, 4 figures",,,,"cs.LG","http://creativecommons.org/licenses/by/4.0/","  Educational process data, i.e., logs of detailed student activities in
computerized or online learning platforms, has the potential to offer deep
insights into how students learn. One can use process data for many downstream
tasks such as learning outcome prediction and automatically delivering
personalized intervention. However, analyzing process data is challenging since
the specific format of process data varies a lot depending on different
learning/testing scenarios. In this paper, we propose a framework for learning
representations of educational process data that is applicable across many
different learning scenarios. Our framework consists of a pre-training step
that uses BERT-type objectives to learn representations from sequential process
data and a fine-tuning step that further adjusts these representations on
downstream prediction tasks. We apply our framework to the 2019 nation's report
card data mining competition dataset that consists of student problem-solving
process data and detail the specific models we use in this scenario. We conduct
both quantitative and qualitative experiments to show that our framework
results in process data representations that are both predictive and
informative.
","[{""version"":""v1"",""created"":""Thu, 28 Apr 2022 16:07:28 GMT""}]","2022-04-29"
"2204.13608","Marc Barbar","Marc Barbar and Dharik S. Mallapragada","Representative period selection for power system planning using
  autoencoder-based dimensionality reduction",,,,,"cs.LG","http://creativecommons.org/licenses/by/4.0/","  Power sector capacity expansion models (CEMs) that are used for studying
future low-carbon grid scenarios must incorporate detailed representation of
grid operations. Often CEMs are formulated to model grid operations over
representative periods that are sampled from the original input data using
clustering algorithms. However, such representative period selection (RPS)
methods are limited by the declining efficacy of the clustering algorithm with
increasing dimensionality of the input data and do not consider the relative
importance of input data variations on CEM outcomes. Here, we propose a RPS
method that addresses these limitations by incorporating dimensionality
reduction, accomplished via neural network based autoencoders, prior to
clustering. Such dimensionality reduction not only improves the performance of
the clustering algorithm, but also facilitates using additional features, such
as estimated outputs produced from parallel solutions of simplified versions of
the CEM for each disjoint period in the input data (e.g. 1 week). The impact of
incorporating dimensionality reduction as part of RPS methods is quantified
through the error in outcomes of the corresponding reduced-space CEM vs. the
full space CEM. Extensive numerical experimentation across various networks and
range of technology and policy scenarios establish the superiority of the
dimensionality-reduction based RPS methods.
","[{""version"":""v1"",""created"":""Thu, 28 Apr 2022 16:08:06 GMT""}]","2022-04-29"
"2204.13609","Jos\'e M. Figueroa-O'Farrill","Jos\'e Figueroa-O'Farrill","Non-lorentzian spacetimes","18 pages",,,"EMPG-21-16","math.DG hep-th","http://arxiv.org/licenses/nonexclusive-distrib/1.0/","  I review some of my recent work on non-lorentzian geometry. I review the
classification of kinematical Lie algebras and their associated Klein
geometries. I then describe the Cartan geometries modelled on them and their
characterisation in terms of their intrinsic torsion. (To appear in the special
issue ""Applications of transformation groups"" to be published by the Journal of
Differential Geometry and Applications.)
","[{""version"":""v1"",""created"":""Thu, 28 Apr 2022 16:08:31 GMT""}]","2022-04-29"
"2204.13610","Ye Tian","Ye Tian, Long Wang, Francesco Bullo","How social influence affects the wisdom of crowds in influence networks",,,,,"cs.SI cs.MA cs.SY eess.SY","http://arxiv.org/licenses/nonexclusive-distrib/1.0/","  A long-standing debate is whether social influence improves the collective
wisdom of a crowd or undermines it. This paper addresses this question based on
a naive learning setting in influence systems theory: in our models individuals
evolve their estimates of an unknown truth according to the weighted-average
opinion dynamics. A formal mathematization is provided with rigorous
theoretical analysis. We obtain various conditions for improving, optimizing
and undermining the crowd accuracy, respectively. We prove that if the wisdom
of finite-size group is improved, then the collective estimate converges to the
truth as group size increases, provided individuals' variances are finite. We
show that whether social influence improves or undermines the wisdom is
determined by the social power allocation of the influence system: if the
influence system allocates relatively larger social power to relatively more
accurate individuals, it improves the wisdom; on the contrary, if the influence
system assigns less social power to more accurate individuals, it undermines
the wisdom. At a population level, individuals' susceptibilities to
interpersonal influence and network centralities are both crucial. To improve
the wisdom, more accurate individuals should be less susceptible and have
larger network centralities. Particularly, in democratic influence networks, if
relatively more accurate individuals are relatively less susceptible, the
wisdom is improved; if more accurate individuals are more susceptible, the
wisdom is undermined, which is consistent with the reported empirical evidence.
Our investigation provides a theoretical framework for understanding the role
social influence plays in the emergence of collective wisdom.
","[{""version"":""v1"",""created"":""Thu, 28 Apr 2022 16:12:17 GMT""},{""version"":""v2"",""created"":""Sat, 4 Mar 2023 14:30:10 GMT""}]","2023-03-07"
"2204.13611","Enrique Lopez-Rodriguez","Enrique Lopez-Rodriguez, Melanie Clarke, Sachin Shenoy, William Vacca,
  Simon Coude, Ryan Arneson, Peter Ashton, Sarah Eftekharzadeh, Rainer Beck,
  John E. Beckman, Alejandro S. Borlaff, Susan E. Clark, Daniel A. Dale, Sergio
  Martin-Alvarez, Evangelia Ntormousi, William T. Reach, Julia Roman-Duval,
  Konstantinos Tassis, Doyal A. Harper, Pamela M. Marcum","Extragalactic magnetism with SOFIA (SALSA Legacy Program) -- III: First
  data release and on-the-fly polarization mapping characterization","26 pages, 16 figures, 5 tables. Submitted to ApJ (Comments welcome)",,"10.3847/1538-4357/ac83ac",,"astro-ph.GA","http://creativecommons.org/licenses/by/4.0/","  We describe the data processing of the Survey on extragALactic magnetiSm with
SOFIA (SALSA Legacy Program). This first data release presents 33% (51.34h out
of 155.7h, including overheads) of the total awarded time taken from January
2020 to December 2021. Our observations were performed using the newly
implemented on-the-fly mapping (OTFMAP) technique in the polarimetric mode. We
present the pipeline steps to obtain homogeneously reduced high-level data
products of polarimetric maps of galaxies for use in scientific analysis. Our
approach has a general design and can be applied to sources smaller than the
field-of-view of the HAWC+ array in any given band. We estimate that the OTFMAP
polarimetric mode offers a reduction of observing overheads by a factor 2.34,
and an improvement in sensitivity by a factor 1.80 when compared to previously
obtained polarimetric observations using the chopping and nodding mode. The
OTFMAP is a significant optimization of the polarimetric mode of HAWC+ as it
ultimately reduces the cost of operations of SOFIA/HAWC+ by increasing the
science collected per hour of observation up to an overall factor of 2.49. The
OTFMAP polarimetric mode is the standard observing strategy of SALSA. The
results and quantitative analysis of this first data release are presented in
Papers IV and V of the series.
","[{""version"":""v1"",""created"":""Thu, 28 Apr 2022 16:13:45 GMT""}]","2022-09-07"
"2204.13612","Wenan Guo","Xuan Zou, Shuo Liu, and Wenan Guo","Surface critical properties of the three-dimensional clock model","12 pages, 8 figures","Phys. Rev. B 106, 064420 (2022)","10.1103/PhysRevB.106.064420",,"cond-mat.stat-mech cond-mat.str-el","http://arxiv.org/licenses/nonexclusive-distrib/1.0/","  Using Monte Carlo simulations and finite-size scaling analysis, we show that
the $q$-state clock model with $q=6$ on the simple cubic lattice with open
surfaces has a rich phase diagram; in particular, it has an extraordinary-log
phase, besides the ordinary and extraordinary transitions at the bulk critical
point. We prove numerically that the presence of the intermediate
extraordinary-log phase is due to the emergence of an O(2) symmetry in the
surface state before the surface enters the $Z_{q}$ symmetry-breaking region as
the surface coupling is increased at the bulk critical point, while O(2)
symmetry emerges for the bulk. The critical behaviors of the extraordinary-log
transition, as well as the ordinary and the special transition separating the
ordinary and the extraordinary-log transition are obtained.
","[{""version"":""v1"",""created"":""Thu, 28 Apr 2022 16:14:06 GMT""}]","2022-08-25"
"2204.13613","Anas Gouda","Anas Gouda, Abraham Ghanem, Christopher Reining","DoPose-6D dataset for object segmentation and 6D pose estimation","accepted for IEEE ICMLA 2022",,,,"cs.RO","http://arxiv.org/licenses/nonexclusive-distrib/1.0/","  Scene understanding is essential in determining how intelligent robotic
grasping and manipulation could get. It is a problem that can be approached
using different techniques: seen object segmentation, unseen object
segmentation, or 6D pose estimation. These techniques can even be extended to
multi-view. Most of the work on these problems depends on synthetic datasets
due to the lack of real datasets that are big enough for training and merely
use the available real datasets for evaluation.
  This encourages us to introduce a new dataset (called DoPose-6D). The dataset
contains annotations for 6D Pose estimation, object segmentation, and
multi-view annotations, which serve all the pre-mentioned techniques. The
dataset contains two types of scenes bin picking and tabletop, with the primary
motive for this dataset collection being bin picking.
  We illustrate the effect of this dataset in the context of unseen object
segmentation and provide some insights on mixing synthetic and real data for
the training. We train a Mask R-CNN model that is practical to be used in
industry and robotic grasping applications. Finally, we show how our dataset
boosted the performance of a Mask R-CNN model.
  Our DoPose-6D dataset, trained network models, pipeline code, and ROS driver
are available online.
","[{""version"":""v1"",""created"":""Thu, 28 Apr 2022 16:17:48 GMT""},{""version"":""v2"",""created"":""Mon, 28 Nov 2022 12:30:29 GMT""}]","2022-11-29"
"2204.13614","Natalia Bochkina","Natalia Bochkina","Bernstein - von Mises theorem and misspecified models: a review",,,,,"math.ST stat.TH","http://arxiv.org/licenses/nonexclusive-distrib/1.0/","  This is a review of asymptotic and non-asymptotic behaviour of Bayesian
methods under model specification. In particular we focus on consistency, i.e.
convergence of the posterior distribution to the point mass at the best
parametric approximation to the true model, and conditions for it to be locally
Gaussian around this point. For well specified regular models, variance of the
Gaussian approximation coincides with the Fisher information, making Bayesian
inference asymptotically efficient. In this review, we discuss how this is
affected by model misspecification. We also discuss approaches to adjust
Bayesian inference to make it asymptotically efficient under model
misspecification.
","[{""version"":""v1"",""created"":""Thu, 28 Apr 2022 16:19:50 GMT""}]","2022-04-29"
