"2204.13738","Jiang Liu","Jiang Liu, Srivathsa Pasumarthi, Ben Duffy, Enhao Gong, Keshav Datta,
  Greg Zaharchuk","One Model to Synthesize Them All: Multi-contrast Multi-scale Transformer
  for Missing Data Imputation","IEEE TMI accepted final version",,"10.1109/TMI.2023.3261707",,"eess.IV cs.CV","http://arxiv.org/licenses/nonexclusive-distrib/1.0/","  Multi-contrast magnetic resonance imaging (MRI) is widely used in clinical
practice as each contrast provides complementary information. However, the
availability of each imaging contrast may vary amongst patients, which poses
challenges to radiologists and automated image analysis algorithms. A general
approach for tackling this problem is missing data imputation, which aims to
synthesize the missing contrasts from existing ones. While several
convolutional neural networks (CNN) based algorithms have been proposed, they
suffer from the fundamental limitations of CNN models, such as the requirement
for fixed numbers of input and output channels, the inability to capture
long-range dependencies, and the lack of interpretability. In this work, we
formulate missing data imputation as a sequence-to-sequence learning problem
and propose a multi-contrast multi-scale Transformer (MMT), which can take any
subset of input contrasts and synthesize those that are missing. MMT consists
of a multi-scale Transformer encoder that builds hierarchical representations
of inputs combined with a multi-scale Transformer decoder that generates the
outputs in a coarse-to-fine fashion. The proposed multi-contrast Swin
Transformer blocks can efficiently capture intra- and inter-contrast
dependencies for accurate image synthesis. Moreover, MMT is inherently
interpretable as it allows us to understand the importance of each input
contrast in different regions by analyzing the in-built attention maps of
Transformer blocks in the decoder. Extensive experiments on two large-scale
multi-contrast MRI datasets demonstrate that MMT outperforms the
state-of-the-art methods quantitatively and qualitatively.
","[{""version"":""v1"",""created"":""Thu, 28 Apr 2022 18:49:27 GMT""},{""version"":""v2"",""created"":""Wed, 22 Mar 2023 18:30:11 GMT""},{""version"":""v3"",""created"":""Wed, 29 Mar 2023 19:05:39 GMT""}]","2023-03-31"
"2204.13739","Elena Queirolo Ms.","Shane Kepley, Konstantin Mischaikow, Elena Queirolo","Global analysis of regulatory network dynamics: equilibria and
  saddle-node bifurcations",,,,,"math.DS cs.NA math.NA","http://creativecommons.org/licenses/by/4.0/","  In this paper we describe a combined combinatorial/numerical approach to
studying equilibria and bifurcations in network models arising in Systems
Biology. ODE models of the dynamics suffer from high dimensional parameters
which presents a significant obstruction to studying the global dynamics via
numerical methods. The main point of this paper is to demonstrate that
combining classical techniques with recently developed combinatorial methods
provides a richer picture of the global dynamics despite the high parameter
dimension.
  Given a network topology describing state variables which regulate one
another via monotone and bounded functions, we first use the Dynamic Signatures
Generated by Regulatory Networks (DSGRN) software to obtain a combinatorial
summary of the dynamics. This summary is coarse but global and we use this
information as a first pass to identify ""interesting'' subsets of parameters in
which to focus. We construct an associated ODE model with high parameter
dimension using our {\em Network Dynamics Modeling and Analysis} (NDMA) Python
library. We introduce algorithms for efficiently investigating the dynamics in
these ODE models restricted to these parameter subsets. Finally, we perform a
statistical validation of the method and several interesting dynamical
applications including finding saddle-node bifurcations in a 54 parameter
model.
","[{""version"":""v1"",""created"":""Thu, 28 Apr 2022 18:49:44 GMT""},{""version"":""v2"",""created"":""Fri, 6 Jan 2023 13:00:23 GMT""}]","2023-01-09"
"2204.13740","Elena Panova","Elena Panova, Valentin Volokitin, Anton Gorshkov, Iosif Meyerov","Black-Scholes Option Pricing on Intel CPUs and GPUs: Implementation on
  SYCL and Optimization Techniques","15 pages, 2 figures","Lecture Notes in Computer Science, vol 13708 (Springer, Cham),
  2022, pp. 48-62","10.1007/978-3-031-22941-1_4",,"cs.DC cs.MS cs.PF","http://arxiv.org/licenses/nonexclusive-distrib/1.0/","  The Black-Scholes option pricing problem is one of the widely used financial
benchmarks. We explore the possibility of developing a high-performance
portable code using the SYCL (Data Parallel C++) programming language. We start
from a C++ code parallelized with OpenMP and show optimization techniques that
are beneficial on modern Intel Xeon CPUs. Then, we port the code to SYCL and
consider important optimization aspects on CPUs and GPUs (device-friendly
memory access patterns, relevant data management, employing vector data types).
We show that the developed SYCL code is only 10% inferior to the optimized C++
code when running on CPUs while achieving reasonable performance on Intel GPUs.
We hope that our experience of developing and optimizing the code on SYCL can
be useful to other researchers who plan to port their high-performance C++
codes to SYCL to get all the benefits of single-source programming.
","[{""version"":""v1"",""created"":""Thu, 28 Apr 2022 18:54:47 GMT""},{""version"":""v2"",""created"":""Mon, 19 Dec 2022 10:31:27 GMT""}]","2022-12-20"
"2204.13741","Yunus Inan","Mert Kayaalp, Yunus Inan, Emre Telatar, Ali H. Sayed","On the Arithmetic and Geometric Fusion of Beliefs for Distributed
  Inference","Submitted for publication",,,,"eess.SP cs.MA cs.SI","http://creativecommons.org/licenses/by/4.0/","  We study the asymptotic learning rates under linear and log-linear
combination rules of belief vectors in a distributed hypothesis testing
problem. We show that under both combination strategies, agents are able to
learn the truth exponentially fast, with a faster rate under log-linear fusion.
We examine the gap between the rates in terms of network connectivity and
information diversity. We also provide closed-form expressions for special
cases involving federated architectures and exchangeable networks.
","[{""version"":""v1"",""created"":""Thu, 28 Apr 2022 18:58:06 GMT""}]","2022-05-02"
"2204.13742","Petr Hlin\v{e}n\'y","Petr Hlin\v{e}n\'y and Filip Pokr\'yvka","Twin-width and Limits of Tractability of FO Model Checking on Geometric
  Graphs","technical corrections",,,,"cs.DM cs.LO","http://arxiv.org/licenses/nonexclusive-distrib/1.0/","  The complexity of the problem of deciding properties expressible in FO logic
on graphs -- the FO model checking problem (parameterized by the respective FO
formula), is well-understood on so-called sparse graph classes, but much less
understood on hereditary dense graph classes. Regarding the latter, a recent
concept of twin-width [Bonnet et al., FOCS 2020] appears to be very useful. For
instance, the question of these authors [CGTA 2019] about where is the exact
limit of fixed-parameter tractability of FO model checking on permutation
graphs has been answered by Bonnet et al. in 2020 quite easily, using the newly
introduced twin-width. We prove that such exact characterization of hereditary
subclasses with tractable FO model checking naturally extends from permutation
to circle graphs (the intersection graphs of chords in a circle). Namely, we
prove that under usual complexity assumptions, FO model checking of a
hereditary class of circle graphs is in FPT if and only if the class excludes
some permutation graph. We also prove a similar excluded-subgraphs
characterization for hereditary classes of interval graphs with FO model
checking in FPT, which concludes the line a research of interval classes with
tractable FO model checking started in [Ganian et al., ICALP 2013]. The
mathematical side of the presented characterizations -- about when subclasses
of the classes of circle and permutation graphs have bounded twin-width,
moreover extends to so-called bounded perturbations of these classes.
","[{""version"":""v1"",""created"":""Thu, 28 Apr 2022 19:00:12 GMT""},{""version"":""v2"",""created"":""Tue, 28 Jun 2022 18:47:31 GMT""}]","2022-06-30"
"2204.13743","Diptesh Kanojia","Rudra Murthy, Pallab Bhattacharjee, Rahul Sharnagat, Jyotsana Khatri,
  Diptesh Kanojia, Pushpak Bhattacharyya","HiNER: A Large Hindi Named Entity Recognition Dataset","Accepted at LREC 2022, 8 pages",,,,"cs.CL","http://creativecommons.org/licenses/by/4.0/","  Named Entity Recognition (NER) is a foundational NLP task that aims to
provide class labels like Person, Location, Organisation, Time, and Number to
words in free text. Named Entities can also be multi-word expressions where the
additional I-O-B annotation information helps label them during the NER
annotation process. While English and European languages have considerable
annotated data for the NER task, Indian languages lack on that front -- both in
terms of quantity and following annotation standards. This paper releases a
significantly sized standard-abiding Hindi NER dataset containing 109,146
sentences and 2,220,856 tokens, annotated with 11 tags. We discuss the dataset
statistics in all their essential detail and provide an in-depth analysis of
the NER tag-set used with our data. The statistics of tag-set in our dataset
show a healthy per-tag distribution, especially for prominent classes like
Person, Location and Organisation. Since the proof of resource-effectiveness is
in building models with the resource and testing the model on benchmark data
and against the leader-board entries in shared tasks, we do the same with the
aforesaid data. We use different language models to perform the sequence
labelling task for NER and show the efficacy of our data by performing a
comparative evaluation with models trained on another dataset available for the
Hindi NER task. Our dataset helps achieve a weighted F1 score of 88.78 with all
the tags and 92.22 when we collapse the tag-set, as discussed in the paper. To
the best of our knowledge, no available dataset meets the standards of volume
(amount) and variability (diversity), as far as Hindi NER is concerned. We fill
this gap through this work, which we hope will significantly help NLP for
Hindi. We release this dataset with our code and models at
https://github.com/cfiltnlp/HiNER
","[{""version"":""v1"",""created"":""Thu, 28 Apr 2022 19:14:21 GMT""}]","2022-05-02"
"2204.13744","Siamak Mehrkanoon","Onur Bilgin, Thomas Vergutz, Siamak Mehrkanoon","GCN-FFNN: A Two-Stream Deep Model for Learning Solution to Partial
  Differential Equations","10 pages, 10 figures",,,,"cs.LG cs.NA math.NA physics.comp-ph","http://creativecommons.org/licenses/by-sa/4.0/","  This paper introduces a novel two-stream deep model based on graph
convolutional network (GCN) architecture and feed-forward neural networks
(FFNN) for learning the solution of nonlinear partial differential equations
(PDEs). The model aims at incorporating both graph and grid input
representations using two streams corresponding to GCN and FFNN models,
respectively. Each stream layer receives and processes its own input
representation. As opposed to FFNN which receives a grid-like structure, the
GCN stream layer operates on graph input data where the neighborhood
information is incorporated through the adjacency matrix of the graph. In this
way, the proposed GCN-FFNN model learns from two types of input
representations, i.e. grid and graph data, obtained via the discretization of
the PDE domain. The GCN-FFNN model is trained in two phases. In the first
phase, the model parameters of each stream are trained separately. Both streams
employ the same error function to adjust their parameters by enforcing the
models to satisfy the given PDE as well as its initial and boundary conditions
on grid or graph collocation (training) data. In the second phase, the learned
parameters of two-stream layers are frozen and their learned representation
solutions are fed to fully connected layers whose parameters are learned using
the previously used error function. The learned GCN-FFNN model is tested on
test data located both inside and outside the PDE domain. The obtained
numerical results demonstrate the applicability and efficiency of the proposed
GCN-FFNN model over individual GCN and FFNN models on 1D-Burgers,
1D-Schr\""odinger, 2D-Burgers and 2D-Schr\""odinger equations.
","[{""version"":""v1"",""created"":""Thu, 28 Apr 2022 19:16:31 GMT""}]","2022-05-02"
"2204.13745","Eilat Glikman","E. Glikman, M. Lacy, S. LaMassa, C. Bradley, S. G. Djorgovski, T.
  Urrutia, E. L. Gates, M. J. Graham, C. M. Urry, I. Yoon","The WISE-2MASS Survey: Red Quasars Into the Radio Quiet Regime","Accepted for publication in ApJ; 35 pages, 24 Figures,6 Tables",,"10.3847/1538-4357/ac6bee",,"astro-ph.GA","http://creativecommons.org/licenses/by/4.0/","  We present a highly complete sample of broad-line (Type 1) QSOs out to z ~ 3
selected by their mid-infrared colors, a method that is minimally affected by
dust reddening. We remove host galaxy emission from the spectra and fit for
excess reddening in the residual QSOs, resulting in a Gaussian distribution of
colors for unreddened (blue) QSOs, with a tail extending toward heavily
reddened (red) QSOs, defined as having E(B - V) > 0.25. This radio-independent
selection method enables us to compare red and blue QSO radio properties in
both the FIRST (1.4 GHz) and VLASS (2 - 4 GHz) surveys. Consistent with recent
results from optically-selected QSOs from SDSS, we find that red QSOs have a
significantly higher detection fraction and a higher fraction of compact radio
morphologies at both frequencies. We employ radio stacking to investigate the
median radio properties of the QSOs including those that are undetected in
FIRST and VLASS, finding that red QSOs have significantly brighter radio
emission and steeper radio spectral slopes compared with blue QSOs. Finally, we
find that the incidence of red QSOs is strongly luminosity dependent, where red
QSOs make up > 40% of all QSOs at the highest luminosities. Overall, red QSOs
comprise ~ 40% of higher luminosity QSOs, dropping to only a few percent at
lower luminosities. Furthermore, red QSOs make up a larger percentage of the
radio-detected QSO population. We argue that dusty AGN-driven winds are
responsible for both the obscuration as well as excess radio emission seen in
red QSOs.
","[{""version"":""v1"",""created"":""Thu, 28 Apr 2022 19:22:41 GMT""}]","2022-08-17"
"2204.13746","Soham Poddar","Soham Poddar, Azlaan Mustafa Samad, Rajdeep Mukherjee, Niloy Ganguly,
  Saptarshi Ghosh","CAVES: A Dataset to facilitate Explainable Classification and
  Summarization of Concerns towards COVID Vaccines","Accepted at SIGIR'22 (Resource Track)",,,,"cs.CL cs.CY cs.IR cs.LG","http://creativecommons.org/licenses/by/4.0/","  Convincing people to get vaccinated against COVID-19 is a key societal
challenge in the present times. As a first step towards this goal, many prior
works have relied on social media analysis to understand the specific concerns
that people have towards these vaccines, such as potential side-effects,
ineffectiveness, political factors, and so on. Though there are datasets that
broadly classify social media posts into Anti-vax and Pro-Vax labels, there is
no dataset (to our knowledge) that labels social media posts according to the
specific anti-vaccine concerns mentioned in the posts. In this paper, we have
curated CAVES, the first large-scale dataset containing about 10k COVID-19
anti-vaccine tweets labelled into various specific anti-vaccine concerns in a
multi-label setting. This is also the first multi-label classification dataset
that provides explanations for each of the labels. Additionally, the dataset
also provides class-wise summaries of all the tweets. We also perform
preliminary experiments on the dataset and show that this is a very challenging
dataset for multi-label explainable classification and tweet summarization, as
is evident by the moderate scores achieved by some state-of-the-art models. Our
dataset and codes are available at: https://github.com/sohampoddar26/caves-data
","[{""version"":""v1"",""created"":""Thu, 28 Apr 2022 19:26:54 GMT""},{""version"":""v2"",""created"":""Fri, 11 Nov 2022 14:16:46 GMT""}]","2022-11-14"
"2204.13747","Luis Manzanillas","L. Manzanillas, Y. Efremenko, M. Febbraro, F. Fischer, M. Guitart
  Corominas, B. Hackett, A. Leonhardt, B. Majorovits, O. Schulz","Optical properties of low background PEN structural components for the
  LEGEND-200 experiment",,,"10.1088/1748-0221/17/09/P09007",,"physics.ins-det hep-ex","http://creativecommons.org/licenses/by/4.0/","  Polyethylene Naphthalate (PEN) plastic scintillator has been identified as
potential self-vetoing structural material in low-background physics
experiments. Scintillating components have been produced radio-pure from PEN
using injection compression molding technology. These low-background PEN
components will be used as active holders to mount the Germanium detectors in
the \legend-$200$ neutrinoless double beta decay experiment. In this paper we
present the measurement of the optical properties of these PEN components.
Thus, the emission spectrum, time constant, attenuation and bulk absorption
length as well as light output and light yield are reported. In addition, the
surface of these PEN components has been characterized and an estimation of the
surface roughness is presented. Moreover, the light output of the final
\legend-$200$ detector holders has been measured and is reported. These
measurements were used to estimate the self-vetoing efficiency of these
holders.
","[{""version"":""v1"",""created"":""Thu, 28 Apr 2022 19:33:13 GMT""},{""version"":""v2"",""created"":""Tue, 30 Aug 2022 11:33:01 GMT""}]","2022-09-21"
"2204.13748","Felix Frontini Mr","Felix Frontini, Blair W. Lebert, K. K. Cho, M. S. Song, B. K. Cho,
  Christopher J. Pollock and Young-June Kim","Intermediate Valence State in $\mathrm{YbB_4}$ Revealed by Resonant
  X-ray Emission Spectroscopy",,,"10.1088/1361-648X/ac7629",,"cond-mat.str-el","http://arxiv.org/licenses/nonexclusive-distrib/1.0/","  We report the temperature dependence of the Yb valence in the geometrically
frustrated compound $\mathrm{YbB_4}$ from 12 to 300 K using resonant X-ray
emission spectroscopy at the Yb $L_{\alpha_1}$ transition. We find that the Yb
valence, $v$, is hybridized between the $v=2$ and $v=3$ valence states,
increasing from $v=2.61\pm0.01$ at 12 K to $v=2.67\pm0.01$ at 300 K, confirming
that $\mathrm{YbB_4}$ is a Kondo system in the intermediate valence regime.
This result indicates that the Kondo interaction in $\mathrm{YbB_4}$ is
substantial, and is likely to be the reason why $\mathrm{YbB_4}$ does not order
magnetically at low temperature, rather than this being an effect of geometric
frustration. Furthermore, the zero-point valence of the system is extracted
from our data and compared with other Kondo lattice systems. The zero-point
valence seems to be weakly dependent on the Kondo temperature scale, but not on
the valence change temperature scale $T_v$.
","[{""version"":""v1"",""created"":""Thu, 28 Apr 2022 19:36:19 GMT""}]","2022-07-06"
"2204.13749","Yujia Bao","Yujia Bao, Regina Barzilay","Learning to Split for Automatic Bias Detection",,,,,"cs.LG cs.AI cs.CL cs.CV","http://arxiv.org/licenses/nonexclusive-distrib/1.0/","  Classifiers are biased when trained on biased datasets. As a remedy, we
propose Learning to Split (ls), an algorithm for automatic bias detection.
Given a dataset with input-label pairs, ls learns to split this dataset so that
predictors trained on the training split cannot generalize to the testing
split. This performance gap suggests that the testing split is
under-represented in the dataset, which is a signal of potential bias.
Identifying non-generalizable splits is challenging since we have no
annotations about the bias. In this work, we show that the prediction
correctness of each example in the testing split can be used as a source of
weak supervision: generalization performance will drop if we move examples that
are predicted correctly away from the testing split, leaving only those that
are mis-predicted. ls is task-agnostic and can be applied to any supervised
learning problem, ranging from natural language understanding and image
classification to molecular property prediction. Empirical results show that ls
is able to generate astonishingly challenging splits that correlate with
human-identified biases. Moreover, we demonstrate that combining robust
learning algorithms (such as group DRO) with splits identified by ls enables
automatic de-biasing. Compared to previous state-of-the-art, we substantially
improve the worst-group performance (23.4% on average) when the source of
biases is unknown during training and validation.
","[{""version"":""v1"",""created"":""Thu, 28 Apr 2022 19:41:08 GMT""},{""version"":""v2"",""created"":""Wed, 20 Jul 2022 23:44:01 GMT""}]","2022-07-22"
"2204.13750","Benjamin Doerr","Benjamin Doerr and Zhongdi Qu","A First Runtime Analysis of the NSGA-II on a Multimodal Problem","To appear in the Transactions on Evolutionary Computation. Extended
  version of a paper that appeared in the proceedings of PPSN 2022",,"10.1109/TEVC.2023.3250552",,"cs.NE cs.AI cs.DS math.OC","http://arxiv.org/licenses/nonexclusive-distrib/1.0/","  Very recently, the first mathematical runtime analyses of the multi-objective
evolutionary optimizer NSGA-II have been conducted. We continue this line of
research with a first runtime analysis of this algorithm on a benchmark problem
consisting of two multimodal objectives. We prove that if the population size
$N$ is at least four times the size of the Pareto front, then the NSGA-II with
four different ways to select parents and bit-wise mutation optimizes the
OneJumpZeroJump benchmark with jump size~$2 \le k \le n/4$ in time $O(N n^k)$.
When using fast mutation, a recently proposed heavy-tailed mutation operator,
this guarantee improves by a factor of $k^{\Omega(k)}$. Overall, this work
shows that the NSGA-II copes with the local optima of the OneJumpZeroJump
problem at least as well as the global SEMO algorithm.
","[{""version"":""v1"",""created"":""Thu, 28 Apr 2022 19:44:47 GMT""},{""version"":""v2"",""created"":""Thu, 21 Jul 2022 16:53:58 GMT""},{""version"":""v3"",""created"":""Fri, 29 Jul 2022 12:11:35 GMT""},{""version"":""v4"",""created"":""Wed, 1 Mar 2023 18:10:03 GMT""}]","2023-03-02"
"2204.13751","Ankit Kulshrestha","Ankit Kulshrestha and Ilya Safro","BEINIT: Avoiding Barren Plateaus in Variational Quantum Algorithms",,,,,"quant-ph cs.LG","http://creativecommons.org/licenses/by/4.0/","  Barren plateaus are a notorious problem in the optimization of variational
quantum algorithms and pose a critical obstacle in the quest for more efficient
quantum machine learning algorithms. Many potential reasons for barren plateaus
have been identified but few solutions have been proposed to avoid them in
practice. Existing solutions are mainly focused on the initialization of
unitary gate parameters without taking into account the changes induced by
input data. In this paper, we propose an alternative strategy which initializes
the parameters of a unitary gate by drawing from a beta distribution. The
hyperparameters of the beta distribution are estimated from the data. To
further prevent barren plateau during training we add a novel perturbation at
every gradient descent step. Taking these ideas together, we empirically show
that our proposed framework significantly reduces the possibility of a complex
quantum neural network getting stuck in a barren plateau.
","[{""version"":""v1"",""created"":""Thu, 28 Apr 2022 19:46:10 GMT""}]","2022-05-02"
"2204.13752","Jan-Li Lin","Jan-Li Lin","The Geometry and Combinatorics of Some Hessenberg Varieties Related to
  the Permutohedral Variety","18 pages. Significant changes: new results added, title changed to
  reflect changes in the content. Comments are welcome!",,,,"math.AG math.AT math.RT","http://creativecommons.org/licenses/by/4.0/","  We construct a concrete isomorphism from the permutohedral variety to the
regular semisimple Hessenberg variety associated to the Hessenberg function
$h_+(i)=i+1$, $1\le i\le n-1$. In the process of defining the isomorphism, we
introduce a sequence of varieties which we call the prepermutohedral varieties.
We first determine the toric structure of these varieties and compute the Euler
characteristics and the Betti numbers using the theory of toric varieties.
Then, we describe the cohomology of these varieties. We also find a natural way
to encode the one-dimensional components of the cohomology using the codes
defined by Stembridge. Applying the isomorphisms we constructed, we are also
able to describe the geometric structure of regular semisimple Hessenberg
varieties associated to the Hessenberg function represented by $h_k= (2,3,
\cdots, k+1, n,\cdots,n)$, $1\le k\le n-3$. In particular, we are able to write
down the cohomology ring of the variety. Finally, we determine the dot
representation of the permutation group ${\frak S}_n$ on these Hessenberg
varieties.
","[{""version"":""v1"",""created"":""Thu, 28 Apr 2022 20:00:37 GMT""},{""version"":""v2"",""created"":""Wed, 12 Oct 2022 01:10:46 GMT""}]","2022-10-13"
