"2203.13600","Aurelien Dantan","Ali A. Darki, Robin V. Nielsen, Jens V. Nygaard, Aur\'elien Dantan","Mechanical investigations of free-standing SiN membranes patterned with
  one-dimensional photonic crystal structures","9 pages, 13 figures","J. Appl. Phys. 131, 195101 (2022)","10.1063/5.0093016",,"physics.app-ph physics.optics","http://arxiv.org/licenses/nonexclusive-distrib/1.0/","  A detailed investigation of the structural and vibrational properties of
various prestressed silicon nitride membranes patterned with one-dimensional
photonic crystal structures is presented. The tensile stress-related
deformation of the structure in the vicinity of the patterned area is
determined by Atomic Force Microscopy scans, while the resonance frequencies
and quality factors of the out-of-plane membrane vibrations are measured using
optical interferometry. We show that these noninvasive measurements, combined
with results of finite element simulations, provide accurate knowledge on the
tensile stress, the elasticity modulus and the density of these nanostructured
thin films. The obtained results are interesting in two ways: first, they show
that such highly reflective thin membranes already exploited in various
photonics applications possess high-mechanical quality, which also makes them
attractive for optomechanics and sensing applications. Second, they represent a
nondestructive method to determine key material parameters which can be
applicable to a broad range of fragile nanostructured thin films.
","[{""version"":""v1"",""created"":""Fri, 25 Mar 2022 11:57:58 GMT""},{""version"":""v2"",""created"":""Thu, 19 May 2022 06:23:48 GMT""}]","2022-05-20"
"2203.13601","Mengzhao Wang","Mengzhao Wang, Lingwei Lv, Xiaoliang Xu, Yuxiang Wang, Qiang Yue,
  Jiongkang Ni","Navigable Proximity Graph-Driven Native Hybrid Queries with Structured
  and Unstructured Constraints","16 pages, 10 figures",,,,"cs.DB cs.CV cs.IR","http://arxiv.org/licenses/nonexclusive-distrib/1.0/","  As research interest surges, vector similarity search is applied in multiple
fields, including data mining, computer vision, and information retrieval.
{Given a set of objects (e.g., a set of images) and a query object, we can
easily transform each object into a feature vector and apply the vector
similarity search to retrieve the most similar objects. However, the original
vector similarity search cannot well support \textit{hybrid queries}, where
users not only input unstructured query constraint (i.e., the feature vector of
query object) but also structured query constraint (i.e., the desired
attributes of interest). Hybrid query processing aims at identifying these
objects with similar feature vectors to query object and satisfying the given
attribute constraints. Recent efforts have attempted to answer a hybrid query
by performing attribute filtering and vector similarity search separately and
then merging the results later, which limits efficiency and accuracy because
they are not purpose-built for hybrid queries.} In this paper, we propose a
native hybrid query (NHQ) framework based on proximity graph (PG), which
provides the specialized \textit{composite index and joint pruning} modules for
hybrid queries. We easily deploy existing various PGs on this framework to
process hybrid queries efficiently. Moreover, we present two novel navigable
PGs (NPGs) with optimized edge selection and routing strategies, which obtain
better overall performance than existing PGs. After that, we deploy the
proposed NPGs in NHQ to form two hybrid query methods, which significantly
outperform the state-of-the-art competitors on all experimental datasets
(10$\times$ faster under the same \textit{Recall}), including eight public and
one in-house real-world datasets. Our code and datasets have been released at
\url{https://github.com/AshenOn3/NHQ}.
","[{""version"":""v1"",""created"":""Fri, 25 Mar 2022 12:02:37 GMT""}]","2022-03-28"
"2203.13602","Oscar Sainz","Oscar Sainz, Haoling Qiu, Oier Lopez de Lacalle, Eneko Agirre and
  Bonan Min","ZS4IE: A toolkit for Zero-Shot Information Extraction with simple
  Verbalizations","Accepted at NAACL2022 Demo track",,,,"cs.CL","http://creativecommons.org/licenses/by-sa/4.0/","  The current workflow for Information Extraction (IE) analysts involves the
definition of the entities/relations of interest and a training corpus with
annotated examples. In this demonstration we introduce a new workflow where the
analyst directly verbalizes the entities/relations, which are then used by a
Textual Entailment model to perform zero-shot IE. We present the design and
implementation of a toolkit with a user interface, as well as experiments on
four IE tasks that show that the system achieves very good performance at
zero-shot learning using only 5--15 minutes per type of a user's effort. Our
demonstration system is open-sourced at https://github.com/BBN-E/ZS4IE . A
demonstration video is available at https://vimeo.com/676138340 .
","[{""version"":""v1"",""created"":""Fri, 25 Mar 2022 12:02:53 GMT""},{""version"":""v2"",""created"":""Mon, 28 Mar 2022 07:50:32 GMT""},{""version"":""v3"",""created"":""Tue, 3 May 2022 09:00:34 GMT""}]","2022-05-04"
"2203.13603","Kanghong Shi","Kanghong Shi, Ian R. Petersen, Igor G. Vladimirov","Making Nonlinear Systems Negative Imaginary via State Feedback","10 pages, 2 figures",,,,"eess.SY cs.SY","http://arxiv.org/licenses/nonexclusive-distrib/1.0/","  This paper provides a state feedback stabilization approach for nonlinear
systems of relative degree less than or equal to two by rendering them
nonlinear negative imaginary (NI) systems. Conditions are provided under which
a nonlinear system can be made a nonlinear NI system or a nonlinear output
strictly negative imaginary (OSNI) system. Roughly speaking, an affine
nonlinear system that has a normal form with relative degree less than or equal
to two, after possible output transformation, can be rendered nonlinear NI and
nonlinear OSNI. In addition, if the internal dynamics of the normal form are
input-to-state stable, then there exists a state feedback input that stabilizes
the system. This stabilization result is then extended to achieve stability for
systems with a nonlinear NI uncertainty.
","[{""version"":""v1"",""created"":""Fri, 25 Mar 2022 12:03:24 GMT""},{""version"":""v2"",""created"":""Mon, 5 Sep 2022 06:45:56 GMT""}]","2022-09-07"
"2203.13604","Mohammad Abdulaziz","Mohammad Abdulaziz, Lukas Koller","Formal Semantics and Formally Verified Validation for Temporal Planning",,,,,"cs.AI cs.LO","http://creativecommons.org/licenses/by/4.0/","  We present a simple and concise semantics for temporal planning. Our
semantics are developed and formalised in the logic of the interactive theorem
prover Isabelle/HOL. We derive from those semantics a validation algorithm for
temporal planning and show, using a formal proof in Isabelle/HOL, that this
validation algorithm implements our semantics. We experimentally evaluate our
verified validation algorithm and show that it is practical.
","[{""version"":""v1"",""created"":""Fri, 25 Mar 2022 12:04:03 GMT""}]","2022-03-28"
"2203.13605","Avi Marchewka","Avi Marchewka","A direct test for instantaneous collapse of wave functions in
  configuration space","12 pages, 1 figure",,,,"quant-ph","http://creativecommons.org/licenses/by/4.0/","  Wavefunction collapse is a puzzling aspect of quantum mechanics. Designing a
test to confirm the instantaneousness of collapse has turned out to be
challenging, especially for collapse in configuration space. We propose a test
using two identical, non-local, correlated photons in an interferometer in
which a post-selection measurement of one of the photons in its location
changes the statistical behavior of the other photon, which is an arbitrarily
large distance away, and thus its detectable subsequent behavior. Analysis of
the resulting correlations constitutes a test of the instantaneousness (or
non-instantaneousness) of collapse. Connections to some of the recent proposed
models of collapse are discussed
","[{""version"":""v1"",""created"":""Fri, 25 Mar 2022 12:11:25 GMT""}]","2022-03-28"
"2203.13606","Lars Pastewka","Michael C. R\""ottger, Antoine Sanner, Luke A. Thimons, Till Junge,
  Abhijeet Gujrati, Joseph M. Monti, Wolfram G. N\""ohring, Tevis D. B. Jacobs,
  Lars Pastewka","contact.engineering -- Create, analyze and publish digital surface twins
  from topography measurements across many scales","19 pages, 6 figures","Surf. Topogr.: Metrol. Prop. 10, 035032 (2022)","10.1088/2051-672X/ac860a",,"cond-mat.mtrl-sci","http://creativecommons.org/licenses/by/4.0/","  The optimization of surface finish to improve performance occurs largely
through trial and error, despite significant advancements in the relevant
science. There are three central challenges that account for this disconnect:
(1) the challenge of integration of many different types of measurement for the
same surface to capture the multi-scale nature of roughness; (2) the technical
complexity of implementing spectral analysis methods, and of applying
mechanical or numerical models to describe surface performance; (3) a lack of
consistency between researchers and industries in how surfaces are measured,
quantified, and communicated. Here we present a freely-available internet-based
application which attempts to overcome all three challenges. First, the
application enables the user to upload many different topography measurements
taken from a single surface, including using different techniques, and then
integrates all of them together to create a digital surface twin. Second, the
application calculates many of the commonly used topography metrics, such as
root-mean-square parameters, power spectral density (PSD), and autocorrelation
function (ACF), as well as implementing analytical and numerical calculations,
such as boundary element modeling (BEM) for elastic and plastic deformation.
Third, the application serves as a repository for users to securely store
surfaces, and if they choose, to share these with collaborators or even publish
them (with a digital object identifier) for all to access. The primary goal of
this application is to enable researchers and manufacturers to quickly and
easily apply cutting-edge tools for the characterization and
properties-modeling of real-world surfaces. An additional goal is to advance
the use of open-science principles in surface engineering by providing a FAIR
database where researchers can choose to publish surface measurements for all
to use.
","[{""version"":""v1"",""created"":""Fri, 25 Mar 2022 12:12:25 GMT""},{""version"":""v2"",""created"":""Sun, 18 Sep 2022 17:43:58 GMT""}]","2022-09-20"
"2203.13607","Juraj Gazda","Marek Ru\v{z}i\v{c}ka, Marcel Volo\v{s}in, Juraj Gazda, Taras
  Maksymyuk, Longzhe Han, Mischa Dohler","Fast and computationally efficient generative adversarial network
  algorithm for unmanned aerial vehicle-based network coverage optimization","International Journal of Distributed Sensor Networks. 2022",,"10.1177/15501477221075544",,"cs.LG cs.NI","http://creativecommons.org/licenses/by-sa/4.0/","  The challenge of dynamic traffic demand in mobile networks is tackled by
moving cells based on unmanned aerial vehicles. Considering the tremendous
potential of unmanned aerial vehicles in the future, we propose a new heuristic
algorithm for coverage optimization. The proposed algorithm is implemented
based on a conditional generative adversarial neural network, with a unique
multilayer sum-pooling loss function. To assess the performance of the proposed
approach, we compare it with the optimal core-set algorithm and quasi-optimal
spiral algorithm. Simulation results show that the proposed approach converges
to the quasi-optimal solution with a negligible difference from the global
optimum while maintaining a quadratic complexity regardless of the number of
users.
","[{""version"":""v1"",""created"":""Fri, 25 Mar 2022 12:13:21 GMT""}]","2022-03-28"
"2203.13608","Xiaoqing Ye","Xiaoqing Ye, Mao Shu, Hanyu Li, Yifeng Shi, Yingying Li, Guangjie
  Wang, Xiao Tan, Errui Ding","Rope3D: TheRoadside Perception Dataset for Autonomous Driving and
  Monocular 3D Object Detection Task","To appear in CVPR2022",,,,"cs.CV","http://creativecommons.org/licenses/by-nc-sa/4.0/","  Concurrent perception datasets for autonomous driving are mainly limited to
frontal view with sensors mounted on the vehicle. None of them is designed for
the overlooked roadside perception tasks. On the other hand, the data captured
from roadside cameras have strengths over frontal-view data, which is believed
to facilitate a safer and more intelligent autonomous driving system. To
accelerate the progress of roadside perception, we present the first
high-diversity challenging Roadside Perception 3D dataset- Rope3D from a novel
view. The dataset consists of 50k images and over 1.5M 3D objects in various
scenes, which are captured under different settings including various cameras
with ambiguous mounting positions, camera specifications, viewpoints, and
different environmental conditions. We conduct strict 2D-3D joint annotation
and comprehensive data analysis, as well as set up a new 3D roadside perception
benchmark with metrics and evaluation devkit. Furthermore, we tailor the
existing frontal-view monocular 3D object detection approaches and propose to
leverage the geometry constraint to solve the inherent ambiguities caused by
various sensors, viewpoints. Our dataset is available on
https://thudair.baai.ac.cn/rope.
","[{""version"":""v1"",""created"":""Fri, 25 Mar 2022 12:13:23 GMT""}]","2022-03-28"
"2203.13609","Can Zhang","Can Zhang, Tianyu Yang, Junwu Weng, Meng Cao, Jue Wang, Yuexian Zou","Unsupervised Pre-training for Temporal Action Localization Tasks","Accepted by CVPR 2022",,,,"cs.CV","http://arxiv.org/licenses/nonexclusive-distrib/1.0/","  Unsupervised video representation learning has made remarkable achievements
in recent years. However, most existing methods are designed and optimized for
video classification. These pre-trained models can be sub-optimal for temporal
localization tasks due to the inherent discrepancy between video-level
classification and clip-level localization. To bridge this gap, we make the
first attempt to propose a self-supervised pretext task, coined as Pseudo
Action Localization (PAL) to Unsupervisedly Pre-train feature encoders for
Temporal Action Localization tasks (UP-TAL). Specifically, we first randomly
select temporal regions, each of which contains multiple clips, from one video
as pseudo actions and then paste them onto different temporal positions of the
other two videos. The pretext task is to align the features of pasted pseudo
action regions from two synthetic videos and maximize the agreement between
them. Compared to the existing unsupervised video representation learning
approaches, our PAL adapts better to downstream TAL tasks by introducing a
temporal equivariant contrastive learning paradigm in a temporally dense and
scale-aware manner. Extensive experiments show that PAL can utilize large-scale
unlabeled video data to significantly boost the performance of existing TAL
methods. Our codes and models will be made publicly available at
https://github.com/zhang-can/UP-TAL.
","[{""version"":""v1"",""created"":""Fri, 25 Mar 2022 12:13:43 GMT""}]","2022-03-28"
"2203.13610","Jaeyoo Park","Jaeyoo Park, Junha Kim, Bohyung Han","Learning to Adapt to Unseen Abnormal Activities under Weak Supervision","20 pages, ACCV 2020",,,,"cs.CV","http://arxiv.org/licenses/nonexclusive-distrib/1.0/","  We present a meta-learning framework for weakly supervised anomaly detection
in videos, where the detector learns to adapt to unseen types of abnormal
activities effectively when only video-level annotations of binary labels are
available. Our work is motivated by the fact that existing methods suffer from
poor generalization to diverse unseen examples. We claim that an anomaly
detector equipped with a meta-learning scheme alleviates the limitation by
leading the model to an initialization point for better optimization. We
evaluate the performance of our framework on two challenging datasets,
UCF-Crime and ShanghaiTech. The experimental results demonstrate that our
algorithm boosts the capability to localize unseen abnormal events in a weakly
supervised setting. Besides the technical contributions, we perform the
annotation of missing labels in the UCF-Crime dataset and make our task
evaluated effectively.
","[{""version"":""v1"",""created"":""Fri, 25 Mar 2022 12:15:44 GMT""}]","2022-03-28"
"2203.13611","Jaeyoo Park","Jaeyoo Park, Minsoo Kang, Bohyung Han","Class-Incremental Learning for Action Recognition in Videos","12 pages, ICCV 2021",,,,"cs.CV","http://arxiv.org/licenses/nonexclusive-distrib/1.0/","  We tackle catastrophic forgetting problem in the context of class-incremental
learning for video recognition, which has not been explored actively despite
the popularity of continual learning. Our framework addresses this challenging
task by introducing time-channel importance maps and exploiting the importance
maps for learning the representations of incoming examples via knowledge
distillation. We also incorporate a regularization scheme in our objective
function, which encourages individual features obtained from different time
steps in a video to be uncorrelated and eventually improves accuracy by
alleviating catastrophic forgetting. We evaluate the proposed approach on
brand-new splits of class-incremental action recognition benchmarks constructed
upon the UCF101, HMDB51, and Something-Something V2 datasets, and demonstrate
the effectiveness of our algorithm in comparison to the existing continual
learning methods that are originally designed for image data.
","[{""version"":""v1"",""created"":""Fri, 25 Mar 2022 12:15:49 GMT""}]","2022-03-28"
"2203.13613","Yannick Mvondo-She","Yannick Mvondo-She","From Hurwitz numbers to Feynman diagrams: counting rooted trees in log
  gravity","Revised version, added derivation, 22 pages, 5 figures",,,,"hep-th","http://creativecommons.org/licenses/by/4.0/","  We show that the partition function of the logarithmic sector of critical
topologically massive gravity can be expressed as a sum over rooted trees. Our
work appears as a natural extension of recently obtained results on a log
partition function that finds itself at the confluence of many theories,
relating nonunitary gravity, the plethystic programme, integrable hierarchies
of KP soliton equations and $\tau$-functions, Hurwitz theory and branched
covering of Riemann surfaces to the celebrated Connes-Kreimer Hopf algebra of
rooted trees and Feynman diagrams. In particular, the Hurwitz numbers arise as
coefficients of isomorphic classes of rooted trees. A parallel is drawn between
our findings and established results in the statistical physics literature
concerning certain systems with quenched disorder on trees, associated to
nonlinear partial differential equations admitting traveling wave solutions.
This should be of particular interest in view of a further description of the
disorder observed in log gravity.
","[{""version"":""v1"",""created"":""Fri, 25 Mar 2022 12:19:34 GMT""},{""version"":""v2"",""created"":""Thu, 7 Jul 2022 15:47:12 GMT""},{""version"":""v3"",""created"":""Thu, 1 Sep 2022 11:13:55 GMT""}]","2022-09-02"
"2203.13614","Ioannis Kleftogiannis","Ioannis Kleftogiannis, Ilias Amanatidis","Energetical self-organization of a few strongly interacting particles","7 pages, 7 figures",,,,"cond-mat.str-el cond-mat.dis-nn cond-mat.mes-hall nlin.AO quant-ph","http://arxiv.org/licenses/nonexclusive-distrib/1.0/","  We study the quantum self-organization of a few interacting particles with
strong short-range interactions. The physical system is modelled via a 2D
Hubbard model with a nearest-neighbor interaction term of strength U and a
second nearest-neighbor hopping t. We find persistent many-body ground and
excited states whose structural properties are determined by the energetical
ordering occuring for vanishing hopping (t=0), when the self-organization of
the particles is determined by the interaction term only. For our analysis we
use the Euler characteristic of the network/graph grid structures formed by the
particles in real space (Fock states), which helps to quantify the energetical
ordering. We find multiple states, with integer Euler numbers whose values are
determined by the $t=0$ case, that persist/survive for $t \ne 0$ as long as the
interaction strength is large $U>>t$. The corresponding quantum phases contain
either density-wave-order (DWO) for low fillings or clustering-order (CO) for
high fillings. In addition, for the excited states we find superpositions of
Fock states whose probability amplitudes are self-tuned in a way that preserves
the integer value of the Euler characteristic from the $t=0$ case.
","[{""version"":""v1"",""created"":""Fri, 25 Mar 2022 12:23:51 GMT""}]","2022-03-28"
"2203.13615","Tsvi Tlusty","Imran Saeed, Hyuk Kyu Pak and Tsvi Tlusty","Quasiparticles, Flat Bands, and the Melting of Hydrodynamic Matter",,,"10.1038/s41567-022-01893-5",,"cond-mat.soft cond-mat.quant-gas cond-mat.str-el","http://creativecommons.org/licenses/by-nc-nd/4.0/","  The concept of quasiparticles -- long-lived low-energy particle-like
excitations -- has become a keystone of condensed quantum matter, where it
explains a variety of emergent many-body phenomena, such as superfluidity and
superconductivity. Here, we use quasiparticles to explain the collective
behavior of a classical system of hydrodynamically interacting particles in two
dimensions. In the disordered phase of this matter, measurements reveal a
sub-population of long-lived particle pairs. Modeling and simulation of the
ordered crystalline phase identify the pairs as quasiparticles, emerging at the
Dirac cones of the spectrum. The quasiparticles stimulate supersonic pairing
avalanches, bringing about the melting of the crystal. In hexagonal crystals,
where the intrinsic threefold symmetry of the hydrodynamic interaction matches
that of the crystal, the spectrum forms a flat band dense with ultra-slow,
low-frequency phonons whose collective interactions induce a much sharper
melting transition. Altogether, these findings demonstrate the usefulness of
concepts from quantum matter theory in understanding many-body physics in
classical dissipative settings.
","[{""version"":""v1"",""created"":""Thu, 24 Mar 2022 17:12:51 GMT""}]","2023-05-03"
"2203.13616","Hichem Sahbi","Hichem Sahbi","Lightweight Graph Convolutional Networks with Topologically Consistent
  Magnitude Pruning",,,,,"cs.LG cs.CV","http://arxiv.org/licenses/nonexclusive-distrib/1.0/","  Graph convolution networks (GCNs) are currently mainstream in learning with
irregular data. These models rely on message passing and attention mechanisms
that capture context and node-to-node relationships. With multi-head attention,
GCNs become highly accurate but oversized, and their deployment on cheap
devices requires their pruning. However, pruning at high regimes usually leads
to topologically inconsistent networks with weak generalization. In this paper,
we devise a novel method for lightweight GCN design. Our proposed approach
parses and selects subnetworks with the highest magnitudes while guaranteeing
their topological consistency. The latter is obtained by selecting only
accessible and co-accessible connections which actually contribute in the
evaluation of the selected subnetworks. Experiments conducted on the
challenging FPHA dataset show the substantial gain of our topologically
consistent pruning method especially at very high pruning regimes.
","[{""version"":""v1"",""created"":""Fri, 25 Mar 2022 12:34:11 GMT""}]","2022-03-28"
"2203.13617","Zheng Lian","Haiyang Sun, Zheng Lian, Bin Liu, Ying Li, Licai Sun, Cong Cai,
  Jianhua Tao, Meng Wang, Yuan Cheng","EmotionNAS: Two-stream Architecture Search for Speech Emotion
  Recognition","Submitted to Interspeech 2022",,,,"eess.AS cs.LG cs.SD","http://arxiv.org/licenses/nonexclusive-distrib/1.0/","  Speech emotion recognition (SER) is a crucial research topic in
human-computer interactions. Existing works are mainly based on manually
designed models. Despite their great success, these methods heavily rely on
historical experience, which are time-consuming but cannot exhaust all possible
structures. To address this problem, we propose a neural architecture search
(NAS) based framework for SER, called ""EmotionNAS"". We take spectrogram and
wav2vec features as the inputs, followed with NAS to optimize the network
structure for these features separately. We further incorporate complementary
information in these features through decision-level fusion. Experimental
results on IEMOCAP demonstrate that our method succeeds over existing
state-of-the-art strategies on SER.
","[{""version"":""v1"",""created"":""Fri, 25 Mar 2022 12:35:44 GMT""}]","2022-03-28"
