"2203.13312","Xuanye Zhang","Chenming Zhu, Xuanye Zhang, Yanran Li, Liangdong Qiu, Kai Han,
  Xiaoguang Han","SharpContour: A Contour-based Boundary Refinement Approach for Efficient
  and Accurate Instance Segmentation","10pages, 5 figures, accepted by CVPR 2022, project page: see this
  https://xyzhang17.github.io/SharpContour/",,,,"cs.CV","http://arxiv.org/licenses/nonexclusive-distrib/1.0/","  Excellent performance has been achieved on instance segmentation but the
quality on the boundary area remains unsatisfactory, which leads to a rising
attention on boundary refinement. For practical use, an ideal post-processing
refinement scheme are required to be accurate, generic and efficient. However,
most of existing approaches propose pixel-wise refinement, which either
introduce a massive computation cost or design specifically for different
backbone models. Contour-based models are efficient and generic to be
incorporated with any existing segmentation methods, but they often generate
over-smoothed contour and tend to fail on corner areas. In this paper, we
propose an efficient contour-based boundary refinement approach, named
SharpContour, to tackle the segmentation of boundary area. We design a novel
contour evolution process together with an Instance-aware Point Classifier. Our
method deforms the contour iteratively by updating offsets in a discrete
manner. Differing from existing contour evolution methods, SharpContour
estimates each offset more independently so that it predicts much sharper and
accurate contours. Notably, our method is generic to seamlessly work with
diverse existing models with a small computational cost. Experiments show that
SharpContour achieves competitive gains whilst preserving high efficiency
","[{""version"":""v1"",""created"":""Thu, 24 Mar 2022 19:37:20 GMT""}]","2022-03-28"
"2203.13313","Laura Laurenti","Laura Laurenti, Elisa Tinti, Fabio Galasso, Luca Franco, Chris Marone","Deep learning for laboratory earthquake prediction and autoregressive
  forecasting of fault zone stress","Published in
  https://www.sciencedirect.com/science/article/pii/S0012821X22004617","Earth and Planetary Science Letters, Volume 598 (2022), 117825","10.1016/j.epsl.2022.117825",,"physics.geo-ph cs.CV","http://arxiv.org/licenses/nonexclusive-distrib/1.0/","  Earthquake forecasting and prediction have long and in some cases sordid
histories but recent work has rekindled interest based on advances in early
warning, hazard assessment for induced seismicity and successful prediction of
laboratory earthquakes. In the lab, frictional stick-slip events provide an
analog for earthquakes and the seismic cycle. Labquakes are ideal targets for
machine learning (ML) because they can be produced in long sequences under
controlled conditions. Recent works show that ML can predict several aspects of
labquakes using fault zone acoustic emissions. Here, we generalize these
results and explore deep learning (DL) methods for labquake prediction and
autoregressive (AR) forecasting. DL improves existing ML methods of labquake
prediction. AR methods allow forecasting at future horizons via iterative
predictions. We demonstrate that DL models based on Long-Short Term Memory
(LSTM) and Convolution Neural Networks predict labquakes under several
conditions, and that fault zone stress can be predicted with fidelity,
confirming that acoustic energy is a fingerprint of fault zone stress. We
predict also time to start of failure (TTsF) and time to the end of Failure
(TTeF) for labquakes. Interestingly, TTeF is successfully predicted in all
seismic cycles, while the TTsF prediction varies with the amount of preseismic
fault creep. We report AR methods to forecast the evolution of fault stress
using three sequence modeling frameworks: LSTM, Temporal Convolution Network
and Transformer Network. AR forecasting is distinct from existing predictive
models, which predict only a target variable at a specific time. The results
for forecasting beyond a single seismic cycle are limited but encouraging. Our
ML/DL models outperform the state-of-the-art and our autoregressive model
represents a novel framework that could enhance current methods of earthquake
forecasting.
","[{""version"":""v1"",""created"":""Thu, 24 Mar 2022 19:38:32 GMT""},{""version"":""v2"",""created"":""Fri, 24 Jun 2022 14:08:02 GMT""},{""version"":""v3"",""created"":""Wed, 12 Oct 2022 13:41:16 GMT""}]","2022-10-13"
"2203.13314","Arjun Kumar","Arjun Kumar and Tobias Toll","Investigating saturation effects and the virtual pion in leading neutron
  events at HERA with the dipole model","22 pages, 9 figures",,"10.1103/PhysRevD.105.114045",,"hep-ph nucl-th","http://creativecommons.org/licenses/by/4.0/","  We investigate events with very forward neutrons in $ep$ collisions at HERA
using impact parameter dependent colour dipole models with and without
saturation. This is the first study of the leading neutron process deploying
these models. The model predictions are compared with the available HERA
measurements for $6<Q^2<100$~GeV$^2$, $70<W<245$~GeV. Our analysis shows that
the models exhibit Feynman scaling, independent of $Q^2$. Our results
demonstrate that the $W$ and $Q^2$ dependence of the cross section is
independent of the presence of a forward neutron as predicted by the limiting
fragmentation hypothesis, which is a consequence of Feynman scaling itself. We
infer that the HERA leading neutron production inclusive data is insensitive to
saturation physics and these cross sections may not be able to distinguish
gluon saturation effects in future $ep$ colliders. We provide a good
description of the leading neutron structure function $F_2^{LN}$ at small $x$
using an assumption that the small-$x$ structure of protons and pions is
universal up to a normalisation. We also show that the observables in the
exclusive diffractive measurements with a vector meson in the final state are
more sensitive to saturation physics at small $x$ than inclusive measurements.
At last, we provide a prediction for the $\hat t$ spectrum in exclusive vector
meson production in the dipole model using Yukawa theory to model the virtual
pion's spatial wave function.
","[{""version"":""v1"",""created"":""Thu, 24 Mar 2022 19:38:52 GMT""},{""version"":""v2"",""created"":""Mon, 16 May 2022 12:25:21 GMT""},{""version"":""v3"",""created"":""Fri, 17 Jun 2022 04:39:15 GMT""}]","2022-07-13"
"2203.13315","Biswajit Mitra Dr.","Biswajit Mitra and Sanjib Das","Two more characterisations of nearly pseudocompact space",,,,,"math.GN","http://arxiv.org/licenses/nonexclusive-distrib/1.0/","  In this paper we have obtained two more characterizations of nearly
pseudocompact spaces.
","[{""version"":""v1"",""created"":""Thu, 24 Mar 2022 19:44:24 GMT""}]","2022-03-28"
"2203.13316","Frank Heyen","Frank Heyen, Yannik Kohler, Sebastian Triebener, Sebastian Rigling,
  Michael Sedlmair","Immersive Visual Analysis of Cello Bow Movements","CHI 2022 IMI Workshop https://teamdarmstadt.de/imi/",,,,"cs.HC cs.GR","http://creativecommons.org/licenses/by-sa/4.0/","  We propose a 3D immersive visualization environment for analyzing the right
hand movements of a cello player. To achieve this, we track the position and
orientation of the cello bow and record audio. As movements mostly occur in a
shallow volume and the motion is therefore mostly two-dimensional, we use the
third dimension to encode time. Our concept further explores various mappings
from motion and audio data to spatial and other visual attributes. We work in
close cooperation with a cellist and plan to evaluate our prototype through a
user study with a group of cellists in the near future.
","[{""version"":""v1"",""created"":""Thu, 24 Mar 2022 19:52:03 GMT""},{""version"":""v2"",""created"":""Mon, 28 Mar 2022 15:02:08 GMT""}]","2022-03-29"
"2203.13317","Nasrin Bayat","Nasrin Bayat and Elham Rastegari and Qifeng Li","Human Gait Recognition Using Bag of Words Feature Representation Method","14 pages, 7 figures, submitted to AHFE conference",,,,"cs.CV cs.LG","http://creativecommons.org/licenses/by-nc-nd/4.0/","  In this paper, we propose a novel gait recognition method based on a
bag-of-words feature representation method. The algorithm is trained, tested
and evaluated on a unique human gait data consisting of 93 individuals who
walked with comfortable pace between two end points during two different
sessions. To evaluate the effectiveness of the proposed model, the results are
compared with the outputs of the classification using extracted features. As it
is presented, the proposed method results in significant improvement accuracy
compared to using common statistical features, in all the used classifiers.
","[{""version"":""v1"",""created"":""Thu, 24 Mar 2022 19:57:53 GMT""}]","2022-03-28"
"2203.13318","Ruslan Rakhimov","Ruslan Rakhimov, Andrei-Timotei Ardelean, Victor Lempitsky, Evgeny
  Burnaev","NPBG++: Accelerating Neural Point-Based Graphics","Accepted to CVPR 2022. The project page:
  https://rakhimovv.github.io/npbgpp/",,,,"cs.CV","http://arxiv.org/licenses/nonexclusive-distrib/1.0/","  We present a new system (NPBG++) for the novel view synthesis (NVS) task that
achieves high rendering realism with low scene fitting time. Our method
efficiently leverages the multiview observations and the point cloud of a
static scene to predict a neural descriptor for each point, improving upon the
pipeline of Neural Point-Based Graphics in several important ways. By
predicting the descriptors with a single pass through the source images, we
lift the requirement of per-scene optimization while also making the neural
descriptors view-dependent and more suitable for scenes with strong
non-Lambertian effects. In our comparisons, the proposed system outperforms
previous NVS approaches in terms of fitting and rendering runtimes while
producing images of similar quality.
","[{""version"":""v1"",""created"":""Thu, 24 Mar 2022 19:59:39 GMT""}]","2022-03-28"
"2203.13319","Pascal Weber","Pascal Weber, Daniel W\""alchli, Mustafa Zeqiri, Petros Koumoutsakos","Remember and Forget Experience Replay for Multi-Agent Reinforcement
  Learning",,,,,"cs.LG cs.AI math.OC stat.ML","http://creativecommons.org/licenses/by-nc-nd/4.0/","  We present the extension of the Remember and Forget for Experience Replay
(ReF-ER) algorithm to Multi-Agent Reinforcement Learning (MARL). ReF-ER was
shown to outperform state of the art algorithms for continuous control in
problems ranging from the OpenAI Gym to complex fluid flows. In MARL, the
dependencies between the agents are included in the state-value estimator and
the environment dynamics are modeled via the importance weights used by ReF-ER.
In collaborative environments, we find the best performance when the value is
estimated using individual rewards and we ignore the effects of other actions
on the transition map. We benchmark the performance of ReF-ER MARL on the
Stanford Intelligent Systems Laboratory (SISL) environments. We find that
employing a single feed-forward neural network for the policy and the value
function in ReF-ER MARL, outperforms state of the art algorithms that rely on
complex neural network architectures.
","[{""version"":""v1"",""created"":""Thu, 24 Mar 2022 19:59:43 GMT""},{""version"":""v2"",""created"":""Thu, 19 May 2022 19:57:42 GMT""},{""version"":""v3"",""created"":""Fri, 2 Sep 2022 08:26:23 GMT""}]","2022-09-05"
"2203.13320","Frank Heyen","Frank Heyen, Quynh Quang Ngo, Kuno Kurzhals, Michael Sedlmair","Data-Driven Visual Reflection on Music Instrument Practice","CHI 2022 IMI Workshop https://teamdarmstadt.de/imi/",,,,"cs.HC cs.GR","http://creativecommons.org/licenses/by-sa/4.0/","  We propose a data-driven approach to music instrument practice that allows
studying patterns and long-term trends through visualization. Inspired by life
logging and fitness tracking, we imagine musicians to record their practice
sessions over the span of months or years. The resulting data in the form of
MIDI or audio recordings can then be analyzed sporadically to track progress
and guide decisions. Toward this vision, we started exploring various
visualization designs together with a group of nine guitarists, who provided us
with data and feedback over the course of three months.
","[{""version"":""v1"",""created"":""Thu, 24 Mar 2022 19:59:53 GMT""}]","2022-03-28"
"2203.13321","Yeshwanth Venkatesha","Yeshwanth Venkatesha, Youngeun Kim, Hyoungseob Park, Yuhang Li,
  Priyadarshini Panda","Addressing Client Drift in Federated Continual Learning with Adaptive
  Optimization",,,,,"cs.LG cs.AI","http://arxiv.org/licenses/nonexclusive-distrib/1.0/","  Federated learning has been extensively studied and is the prevalent method
for privacy-preserving distributed learning in edge devices. Correspondingly,
continual learning is an emerging field targeted towards learning multiple
tasks sequentially. However, there is little attention towards additional
challenges emerging when federated aggregation is performed in a continual
learning system. We identify \textit{client drift} as one of the key weaknesses
that arise when vanilla federated averaging is applied in such a system,
especially since each client can independently have different order of tasks.
We outline a framework for performing Federated Continual Learning (FCL) by
using NetTailor as a candidate continual learning approach and show the extent
of the problem of client drift. We show that adaptive federated optimization
can reduce the adverse impact of client drift and showcase its effectiveness on
CIFAR100, MiniImagenet, and Decathlon benchmarks. Further, we provide an
empirical analysis highlighting the interplay between different hyperparameters
such as client and server learning rates, the number of local training
iterations, and communication rounds. Finally, we evaluate our framework on
useful characteristics of federated learning systems such as scalability,
robustness to the skewness in clients' data distribution, and stragglers.
","[{""version"":""v1"",""created"":""Thu, 24 Mar 2022 20:00:03 GMT""}]","2022-03-28"
"2203.13322","Alessandro Bravar","A. Bravar, Y. Demets","Timing Properties of Blue-emitting Scintillating Fibers","To be submitted to JINST",,"10.1088/1748-0221/17/12/P12020",,"physics.ins-det","http://arxiv.org/licenses/nonexclusive-distrib/1.0/","  Scintillating fibers are widely used in particle detectors, mainly for
tracking. We have studied the properties and have compared the performance of
different blue-emitting 250~$\mu$m diameter round double-clad scintillating
fibers from Kuraray and Saint-Gobain. Here we focus on the properties of the
fibers over short lengths ($< 50~{\rm cm}$), in particular on their timing
performances. We report on the light yield and attenuation, scintillation light
decay time and the achievable time resolution.
","[{""version"":""v1"",""created"":""Thu, 24 Mar 2022 20:02:18 GMT""}]","2023-01-11"
"2203.13323","Steven Carlip","S. Carlip","A Schwarzian on the Stretched Horizon","8 pages; v2: 9 pages, extended explanation of boundary conditions,
  other minor changes, to appear in a special issue of Gen. Rel. Grav. in
  memory of Prof. Thanu Padmanabhan (""Paddy"")",,"10.1007/s10714-022-02940-5",,"hep-th gr-qc","http://arxiv.org/licenses/nonexclusive-distrib/1.0/","  It is well known that the Euclidean black hole action has a boundary term at
the horizon proportional to the area. I show that if the horizon is replaced by
a stretched horizon with appropriate boundary conditions, a new boundary term
appears, described by a Schwarzian action similar to the recently discovered
boundary actions in ""nearly anti-de Sitter"" gravity.
","[{""version"":""v1"",""created"":""Thu, 24 Mar 2022 20:07:00 GMT""},{""version"":""v2"",""created"":""Thu, 2 Jun 2022 00:28:50 GMT""}]","2022-06-15"
"2203.13324","Aakash Khochare","Prateeksha Varshney, Shriram Ramesh, Shayal Chhabra, Aakash Khochare,
  Yogesh Simmhan","Resilient Execution of Data-triggered Applications on Edge, Fog and
  Cloud Resources",,,,,"cs.DC","http://creativecommons.org/licenses/by/4.0/","  Internet of Things (IoT) is leading to the pervasive availability of
streaming data about the physical world, coupled with edge computing
infrastructure deployed as part of smart cities and 5G rollout. These
constrained, less reliable but cheap resources are complemented by fog
resources that offer federated management and accelerated computing, and
pay-as-you-go cloud resources. There is a lack of intuitive means to deploy
application pipelines to consume such diverse streams, and to execute them
reliably on edge and fog resources. We propose an innovative application model
to declaratively specify queries to match streams of micro-batch data from
stream sources and trigger the distributed execution of data pipelines. We also
design a resilient scheduling strategy using advanced reservation on reliable
fogs to guarantee dataflow completion within a deadline while minimizing the
execution cost. Our detailed experiments on over 100 virtual IoT resources and
for $\approx 10k$ task executions, with comparison against baseline scheduling
strategies, illustrates the cost-effectiveness, resilience and scalability of
our framework.
","[{""version"":""v1"",""created"":""Thu, 24 Mar 2022 20:07:55 GMT""}]","2022-03-28"
"2203.13325","Alexei Rybkin","Sergei Grudsky, Alexei Rybkin","The inverse scattering transform for weak Wigner-von Neumann type
  potentials","To appear in Nonlinearity",,"10.1088/1361-6544/ac5f5e",,"math-ph math.MP","http://creativecommons.org/licenses/by/4.0/","  In the context of the Cauchy problem for the Korteweg-de Vries equation we
extend the inverse scattering transform to initial data that behave at plus
infinity like a sum of Wigner-von Neumann type potentials with small coupling
constants. Our arguments are based on the theory of Hankel operators.
","[{""version"":""v1"",""created"":""Thu, 24 Mar 2022 20:15:18 GMT""}]","2022-05-04"
"2203.13326","Dominique Vuillaume","K. Kondratenko, D. Guerin, X. Wallart, S. Lenfant, D. Vuillaume","Thermal and electrical cross-plane conductivity at the nanoscale in
  poly(3,4-ethylenedioxythiophene):trifuoromethanesulfonate thin films",,"Nanoscale, Royal Society of Chemistry, 2022, 14 (16), pp.6075-6084","10.1039/D2NR00819J",,"cond-mat.mtrl-sci cond-mat.mes-hall physics.app-ph","http://creativecommons.org/licenses/by-nc-nd/4.0/","  Cross-plane electrical and thermal transport in thin films of a conducting
polymer (poly(3,4-ethylenedioxythiophene), PEDOT) stabilized with
trifluoromethanesulfonate (OTf) is investigated in this study. We explore their
electrical properties by conductive atomic force microscopy (C-AFM), which
reveals the presence of highly conductive nano-domains. Thermal conductivity in
cross-plane direction is measured with Null-Point scanning thermal microscopy
(NP-SThM): PEDOT:OTf indeed demonstrates non-negligible electronic contribution
to the thermal transport. We further investigate the correlation between
electrical and thermal conductivity by applying posttreatment: chemical
reduction (de-doping) for the purpose of lowering charge carrier concentration
and hence, electrical conductivity and acid treatment (over-doping) to increase
the latter. From our measurements, we find a vibrational thermal conductivity
of 0.34 (+/- 0.04) Wm-1 K-1. From the linear dependence or the electronic
contribution of thermal conductivity vs. the electronic conductivity
(Widemann-Franz law), we infer a Lorenz number 6 times larger than the
classical Sommerfeld value as also observed in many organic materials for
in-plane thermal transport. Applying the recently proposed molecular
Widemann-Franz law, we deduced a reorganization energy of 0.53 (+/- 0.06) eV.
","[{""version"":""v1"",""created"":""Thu, 24 Mar 2022 20:16:47 GMT""}]","2022-06-16"
"2203.13327","Murat Bayraktar","Murat Bayraktar, Joan Palacios, Nuria Gonz\'alez-Prelcic, Charlie
  Jianzhong Zhang","Multidimensional Orthogonal Matching Pursuit-based RIS-aided Joint
  Localization and Channel Estimation at mmWave","Submitted to IEEE SPAWC 2022",,,,"eess.SP","http://arxiv.org/licenses/nonexclusive-distrib/1.0/","  RIS-aided millimeter wave wireless systems benefit from robustness to
blockage and enhanced coverage. In this paper, we study the ability of RIS to
also provide enhanced localization capabilities as a by-product of
communication. We consider sparse reconstruction algorithms to obtain high
resolution channel estimates that are mapped to position information. In
RIS-aided mmWave systems, the complexity of sparse recovery becomes a
bottleneck, given the large number of elements of the RIS and the large
communication arrays. We propose to exploit a multidimensional orthogonal
matching pursuit strategy for compressive channel estimation in a RIS-aided
millimeter wave system. We show how this algorithm, based on computing the
projections on a set of independent dictionaries instead of a single large
dictionary, enables high accuracy channel estimation at reduced complexity. We
also combine this strategy with a localization approach which does not rely on
the absolute time of arrival of the LoS path. Localization results in a
realistic 3D indoor scenario show that RIS-aided wireless system can also
benefit from a significant improvement in localization accuracy.
","[{""version"":""v1"",""created"":""Thu, 24 Mar 2022 20:17:32 GMT""}]","2022-03-28"
"2203.13328","Ralf Metzler","T. Doerries, A. V. Chechkin, and R. Metzler","Apparent anomalous diffusion and non-Gaussian distributions in a simple
  mobile-immobile transport model with Poissonian switching","24 pages, 9 figures, IOP LaTeX",,,,"cond-mat.stat-mech physics.bio-ph q-bio.SC","http://arxiv.org/licenses/nonexclusive-distrib/1.0/","  We analyse mobile-immobile transport of particles that switch between the
mobile and immobile phases with finite rates. Despite this seemingly simple
assumption of Poissonian switching we unveil a rich transport dynamics
including significant transient anomalous diffusion and non-Gaussian
displacement distributions. Our discussion is based on experimental parameters
for tau proteins in neuronal cells, but the results obtained here are expected
to be of relevance for a broad class of processes in complex systems.
Concretely, we obtain that when the mean binding time is significantly longer
than the mean mobile time, transient anomalous diffusion is observed at short
and intermediate time scales, with a strong dependence on the fraction of
initially mobile and immobile particles. We unveil a Laplace distribution of
particle displacements at relevant intermediate time scales. For any initial
fraction of mobile particles, the respective mean squared displacement displays
a plateau. Moreover, we demonstrate a short-time cubic time dependence of the
mean squared displacement for immobile tracers when initially all particles are
immobile.
","[{""version"":""v1"",""created"":""Thu, 24 Mar 2022 20:23:03 GMT""}]","2022-03-28"
"2203.13329","Chen Chen","Chen Chen, Gongjie Li, Cristobal Petrovich","Mutual Inclination of Ultra-Short-Period Planets with Time Varying
  Stellar J2-moment","Accepted for publication in ApJ",,"10.3847/1538-4357/ac6024",,"astro-ph.EP astro-ph.SR","http://arxiv.org/licenses/nonexclusive-distrib/1.0/","  Systems with ultra-short-period planets (USPs) tend to possess larger mutual
inclinations compared to those with planets located farther from their host
stars. This could be explained due to precession caused by stellar oblateness
at early times when the host star was rapidly spinning. However, stellar
oblateness reduces over time due to the decrease in the stellar rotation rate,
and this may further shape the planetary mutual inclinations. In this work, we
investigate in detail how the final mutual inclination varies under the effect
of a decreasing $J_2$. We find that different initial parameters (e.g., the
magnitude of $J_2$ and planetary inclinations) will contribute to different
final mutual inclinations, providing a constraint on the formation mechanisms
of USPs. In general, if the inner planets start in the same plane as the
stellar equator (or co-planar while misaligned with the stellar spin-axis), the
mutual inclination decreases (or increases then decreases) over time due to the
decay of the $J_2$ moment. This is because the inner orbit typically possesses
less orbital angular momentum than the outer ones. However, if the outer planet
is initially aligned with the stellar spin while the inner one is misaligned,
the mutual inclination nearly stays the same. Overall, our results suggest that
either the USP planets formed early and acquired significant inclinations
(e.g., $\gtrsim30^\circ$ with its companion or $\gtrsim10^\circ$ with its host
star spin-axis for Kepler-653c) or they formed late ($\gtrsim$Gyr) when their
host stars rotate slower.
","[{""version"":""v1"",""created"":""Thu, 24 Mar 2022 20:24:11 GMT""}]","2022-05-18"
