"2203.13462","Wataru Horiuchi","W. Horiuchi and T. Inakura","Pairing core swelling effect in Pb isotopes at $N>126$","9 pages, 7 figures, 2 tables, to appear in Phys. Rev. C",,"10.1103/PhysRevC.105.044303",,"nucl-th","http://arxiv.org/licenses/nonexclusive-distrib/1.0/","  We revisit a sudden increase of the isotope shift of the charge radius of Pb
isotope at $N>126$ based on a Skyrme Hartree-Fock-Bogoliubov theory. New
parametrizations of the pairing interaction optimized for selected four Skyrme
interactions greatly improve a description of this phenomenon. The
density-dependent spin-orbit interaction is also investigated and further
increases the charge radius. The pairing correlations significantly change the
properties of the neutron orbits near the Fermi level and play a vital role in
pulling out the well-bound protons in the Pb isotopes at $N>126$. Regarding
$^{208}$Pb as a ""core"" nucleus, a novel pairing core swelling effect is
proposed: The pairing interaction reduces the radius of ""valence"" neutron
orbits by the shrinkage of diffused $1g_{9/2}$ orbit and the mixing of sharp
$0i_{11/2}$ orbit. Simultaneously, the core nucleus swells, leading to the
sudden enhancement of the charge radius at $N > 126$. This characteristic
behavior appears in the density profile near the nuclear surface and its
measurement is highly desirable.
","[{""version"":""v1"",""created"":""Fri, 25 Mar 2022 05:58:57 GMT""}]","2022-04-20"
"2203.13463","Mohammad Monish","Mohammad Monish and S. S. Major","Study of residual stress in reactively sputtered epitaxial Si-doped GaN
  films",,,"10.1016/j.mssp.2022.106902",,"cond-mat.mtrl-sci","http://arxiv.org/licenses/nonexclusive-distrib/1.0/","  Si-doped GaN films were grown on $\textit{c}$-sapphire by rf magnetron
reactive co-sputtering of GaAs and Si at various partial pressures of N$_2$ in
Ar-N2 growth atmosphere and their epitaxial character was ascertained by
phi-scans. Energy dispersive x-ray spectroscopy revealed $\thicksim$2 at.% Si
in all the films, but the N/Ga ratio decreased substantially as N$_2$
percentage was reduced from 100% to 10%. High resolution x-ray diffraction
revealed the dominant presence of edge dislocations ($\thicksim$10$^{12}$
cm$^{-2}$) in the films grown at 30% - 100% N$_2$, which decreased to
$\thicksim$5 x 10$^{11}$ cm$^{-2}$ at lower N$_2$ percentages, at which, the
density of screw dislocations was found to increase and attained values
comparable to that of edge dislocations. The lattice parameters ($\textit{a}$
and $\textit{c}$) were obtained independently to determine the in-plane and
out-of-plane components of strain in films, which were analyzed to deduce the
hydrostatic and biaxial strain contributions. The film grown at 100% N$_2$
displayed large micro-strain and hydrostatic strain due to excess/interstitial
nitrogen, both of which decreased with the initial reduction of N$_2$
percentage, but increased again below 30% N$_2$ due to Ar incorporation. The
films grown above 75% N$_2$ displayed compressive biaxial stress, which is
attributed to possible nitrogen incorporation into grain boundaries and tensile
side of edge dislocations. The reversal of biaxial stress to tensile character
in films grown below 75% N$_2$ is explained by the prevalence of in-plane
tensile stress generated during coalescence. The tensile stress decreased in
films grown below 30% N$_2$, which is ascribed to the Ar incorporation and
voided morphology. The presence of Si in the films does not have a significant
influence on strain behaviour and appears to be masked by the dominant
growth-related intrinsic effects.
","[{""version"":""v1"",""created"":""Fri, 25 Mar 2022 06:04:08 GMT""},{""version"":""v2"",""created"":""Thu, 21 Apr 2022 09:47:31 GMT""}]","2022-07-05"
"2203.13464","Rui She","Rui She and Pingyi Fan","From MIM-Based GAN to Anomaly Detection:Event Probability Influence on
  Generative Adversarial Networks",,,,,"cs.LG cs.AI cs.IT math.IT","http://arxiv.org/licenses/nonexclusive-distrib/1.0/","  In order to introduce deep learning technologies into anomaly detection,
Generative Adversarial Networks (GANs) are considered as important roles in the
algorithm design and realistic applications. In terms of GANs, event
probability reflected in the objective function, has an impact on the event
generation which plays a crucial part in GAN-based anomaly detection. The
information metric, e.g. Kullback-Leibler divergence in the original GAN, makes
the objective function have different sensitivity on different event
probability, which provides an opportunity to refine GAN-based anomaly
detection by influencing data generation. In this paper, we introduce the
exponential information metric into the GAN, referred to as MIM-based GAN,
whose superior characteristics on data generation are discussed in theory.
Furthermore, we propose an anomaly detection method with MIM-based GAN, as well
as explain its principle for the unsupervised learning case from the viewpoint
of probability event generation. Since this method is promising to detect
anomalies in Internet of Things (IoT), such as environmental, medical and
biochemical outliers, we make use of several datasets from the online ODDS
repository to evaluate its performance and compare it with other methods.
","[{""version"":""v1"",""created"":""Fri, 25 Mar 2022 06:08:03 GMT""}]","2022-03-28"
"2203.13465","Philip Chikontwe","Philip Chikontwe, Soopil Kim, Sang Hyun Park","CAD: Co-Adapting Discriminative Features for Improved Few-Shot
  Classification","CVPR2022",,,,"cs.CV","http://creativecommons.org/licenses/by/4.0/","  Few-shot classification is a challenging problem that aims to learn a model
that can adapt to unseen classes given a few labeled samples. Recent approaches
pre-train a feature extractor, and then fine-tune for episodic meta-learning.
Other methods leverage spatial features to learn pixel-level correspondence
while jointly training a classifier. However, results using such approaches
show marginal improvements. In this paper, inspired by the transformer style
self-attention mechanism, we propose a strategy to cross-attend and re-weight
discriminative features for few-shot classification. Given a base
representation of support and query images after global pooling, we introduce a
single shared module that projects features and cross-attends in two aspects:
(i) query to support, and (ii) support to query. The module computes attention
scores between features to produce an attention pooled representation of
features in the same class that is later added to the original representation
followed by a projection head. This effectively re-weights features in both
aspects (i & ii) to produce features that better facilitate improved
metric-based meta-learning. Extensive experiments on public benchmarks show our
approach outperforms state-of-the-art methods by 3%~5%.
","[{""version"":""v1"",""created"":""Fri, 25 Mar 2022 06:14:51 GMT""}]","2022-03-28"
"2203.13466","Dong Xie","Dong Xie, Chunling Xu, An Min Wang","Quantum thermometry in diffraction-limited systems","9pages, 8figures","Phys. Rev. A 106, 052407 (2022)","10.1103/PhysRevA.106.052407",,"quant-ph","http://creativecommons.org/licenses/by/4.0/","  We investigate the ultimate quantum limit of resolving the temperatures of
two thermal sources affected by the diffraction. More quantum Fisher
information can be obtained with the priori information than that without the
priori information. We carefully consider two strategies: the simultaneous
estimation and the individual estimation. The simultaneous estimation of two
temperatures is proved to satisfy the saturation condition of quantum
Cram\'{e}r bound and performs better than the individual estimation in the case
of small degree of diffraction given the same resources. However, in the case
of high degree of diffraction, the individual estimation performs better. In
particular, at the maximum diffraction, the simultaneous estimation can not get
any information, which is supported by a practical measurement, while the
individual estimation can still get the information. In addition, we find that
for the individual estimation, a practical and feasible estimation strategy by
using the full Hermite-Gauss basis can saturate the quantum Cram\'{e}r bound
without being affected by the attenuation factor at the maximum diffraction.
using the full Hermite-Gauss basis can saturate the quantum Cram\'er bound
without being affected by the attenuation factor at the maximum diffraction.
","[{""version"":""v1"",""created"":""Fri, 25 Mar 2022 06:32:26 GMT""}]","2022-11-16"
"2203.13467","Seungmin Jeon","Seungmin Jeon and Jae-Han Lee and Chang-Su Kim","RD-Optimized Trit-Plane Coding of Deep Compressed Image Latent Tensors",,,,,"eess.IV cs.CV","http://arxiv.org/licenses/nonexclusive-distrib/1.0/","  DPICT is the first learning-based image codec supporting fine granular
scalability. In this paper, we describe how to implement two key components of
DPICT efficiently: trit-plane slicing and rate-distortion-optimized
(RD-optimized) coding. In DPICT, we transform an image into a latent tensor,
represent the tensor in ternary digits (trits), and encode the trits in the
decreasing order of significance. For entropy encoding, it is necessary to
compute the probability of each trit, which demands high time complexity in
both the encoder and the decoder. To reduce the complexity, we develop a
parallel computing scheme for the probabilities, which is described in detail
with pseudo-codes. Moreover, we compare the trit-plane slicing in DPICT with
the alternative bit-plane slicing. Experimental results show that the time
complexity is reduced significantly by the parallel computing and that the
trit-plane slicing provides better RD performances than the bit-plane slicing.
","[{""version"":""v1"",""created"":""Fri, 25 Mar 2022 06:33:16 GMT""},{""version"":""v2"",""created"":""Sun, 8 May 2022 07:53:19 GMT""}]","2022-05-10"
"2203.13468","Masaya Maeda","Scipio Cuccagna, Masaya Maeda","Asymptotic stability of kink with internal modes under odd perturbation","43 pages, 1 figure",,,,"math.AP","http://creativecommons.org/licenses/by/4.0/","  We give a sufficient condition, in the spirit of Kowalczyk-Martel-Munoz-Van
Den Bosch \cite{KMMvdB21AnnPDE}, for the local asymptotic stability of kinks
under odd perturbations. In particular, we allow the existence of quite general
configuration of internal modes. The extension of our result to moving kinks
remains an open problem.
","[{""version"":""v1"",""created"":""Fri, 25 Mar 2022 06:36:57 GMT""}]","2022-03-28"
"2203.13469","Andriyan Suksmono Bayu","Toufan D. Tambunan, Andriyan B. Suksmono, Ian J.M. Edward, Rahmat
  Mulyawan","Quantum Annealing for Vehicle Routing Problem with weighted Segment","11 figures",,,,"quant-ph math.OC","http://creativecommons.org/licenses/by/4.0/","  Quantum annealing technologies aim to solve computational optimization and
sampling problems. QPU (Quantum Processing Unit) machines such as the D-Wave
system use the QUBO (Quadratic Unconstrained Binary Optimization) formula to
define model optimization problems for quantum annealing. This machine uses
quantum effects to speed up computing time better than classical computers. We
propose a vehicle routing problem that can be formulated in the QUBO model as a
combinatorial problem, which gives the possible route solutions increases
exponentially. The solution aims to optimize the vehicle's journey to reach a
destination. The study presents a QUBO formulation to solve traffic congestion
problems on certain roads. The resulting route selection by optimizing the
distribution of the flow of alternative road vehicles based on the weighting of
road segments. Constraints formulated as a condition for the level of road
density. The road weight parameter influences the cost function for each road
choice. The simulations on the D-Wave quantum annealer show optimal results on
the route deployment of several vehicles. So that each vehicle will be able to
go through different road options and reduce road congestion accurately. This
solution provides an opportunity to develop QUBO modeling for more complex
vehicle routing problems for road congestion.
","[{""version"":""v1"",""created"":""Fri, 25 Mar 2022 06:38:18 GMT""}]","2022-03-28"
"2203.13470","Zheng Lin","Zheng Lin, Zhao Zhang, Kang-Rui Zhang, Bo Ren, Ming-Ming Cheng","Interactive Style Transfer: All is Your Palette","8 pages, 11 figures",,,,"cs.CV","http://creativecommons.org/licenses/by/4.0/","  Neural style transfer (NST) can create impressive artworks by transferring
reference style to content image. Current image-to-image NST methods are short
of fine-grained controls, which are often demanded by artistic editing. To
mitigate this limitation, we propose a drawing-like interactive style transfer
(IST) method, by which users can interactively create a harmonious-style image.
Our IST method can serve as a brush, dip style from anywhere, and then paint to
any region of the target content image. To determine the action scope, we
formulate a fluid simulation algorithm, which takes styles as pigments around
the position of brush interaction, and diffusion in style or content images
according to the similarity maps. Our IST method expands the creative dimension
of NST. By dipping and painting, even employing one style image can produce
thousands of eye-catching works. The demo video is available in supplementary
files or in http://mmcheng.net/ist.
","[{""version"":""v1"",""created"":""Fri, 25 Mar 2022 06:38:46 GMT""}]","2022-03-28"
"2203.13471","Inhwan Bae","Inhwan Bae, Jin-Hwi Park, Hae-Gon Jeon","Non-Probability Sampling Network for Stochastic Human Trajectory
  Prediction","Accepted at CVPR 2022",,,,"cs.CV cs.LG cs.RO","http://arxiv.org/licenses/nonexclusive-distrib/1.0/","  Capturing multimodal natures is essential for stochastic pedestrian
trajectory prediction, to infer a finite set of future trajectories. The
inferred trajectories are based on observation paths and the latent vectors of
potential decisions of pedestrians in the inference step. However, stochastic
approaches provide varying results for the same data and parameter settings,
due to the random sampling of the latent vector. In this paper, we analyze the
problem by reconstructing and comparing probabilistic distributions from
prediction samples and socially-acceptable paths, respectively. Through this
analysis, we observe that the inferences of all stochastic models are biased
toward the random sampling, and fail to generate a set of realistic paths from
finite samples. The problem cannot be resolved unless an infinite number of
samples is available, which is infeasible in practice. We introduce that the
Quasi-Monte Carlo (QMC) method, ensuring uniform coverage on the sampling
space, as an alternative to the conventional random sampling. With the same
finite number of samples, the QMC improves all the multimodal prediction
results. We take an additional step ahead by incorporating a learnable sampling
network into the existing networks for trajectory prediction. For this purpose,
we propose the Non-Probability Sampling Network (NPSN), a very small network
(~5K parameters) that generates purposive sample sequences using the past paths
of pedestrians and their social interactions. Extensive experiments confirm
that NPSN can significantly improve both the prediction accuracy (up to 60%)
and reliability of the public pedestrian trajectory prediction benchmark. Code
is publicly available at https://github.com/inhwanbae/NPSN .
","[{""version"":""v1"",""created"":""Fri, 25 Mar 2022 06:41:47 GMT""},{""version"":""v2"",""created"":""Sat, 14 May 2022 16:40:30 GMT""}]","2022-05-17"
"2203.13472","Jun-Hwa Kim","Jun-Hwa Kim, Namho Kim, Chee Sun Won","Facial Expression Recognition with Swin Transformer",,,,,"cs.CV cs.AI","http://arxiv.org/licenses/nonexclusive-distrib/1.0/","  The task of recognizing human facial expressions plays a vital role in
various human-related systems, including health care and medical fields. With
the recent success of deep learning and the accessibility of a large amount of
annotated data, facial expression recognition research has been mature enough
to be utilized in real-world scenarios with audio-visual datasets. In this
paper, we introduce Swin transformer-based facial expression approach for an
in-the-wild audio-visual dataset of the Aff-Wild2 Expression dataset.
Specifically, we employ a three-stream network (i.e., Visual stream, Temporal
stream, and Audio stream) for the audio-visual videos to fuse the multi-modal
information into facial expression recognition. Experimental results on the
Aff-Wild2 dataset show the effectiveness of our proposed multi-modal
approaches.
","[{""version"":""v1"",""created"":""Fri, 25 Mar 2022 06:42:31 GMT""}]","2022-03-28"
"2203.13473","Miho Murata","Takafumi Akahori and Miho Murata","Nondegeneracy of ground states for nonlinear scalar field equations
  involving the Sobolev-critical exponent at high frequencies in three and four
  dimensions","35 pages",,,,"math.AP","http://arxiv.org/licenses/nonexclusive-distrib/1.0/","  We consider nonlinear scalar field equations involving the Sobolev-critical
exponent at high frequencies $\omega$. Since the limiting profile of the ground
state as $\omega \to \infty$ is the Aubin-Talenti function and degenerate in a
certain sense, from the point of view of perturbation methods, the
nondegeneracy problem for the ground states at high frequencies is subtle. In
addition, since the limiting profile (Aubin-Talenti function) fails to lie in
$L^{2}(\mathbb{R}^{d})$ for $d=3,4$, the nondegeneracy problem for $d=3,4$ is
more difficult than that for $d\ge 5$ and an applicable methodology is not
known. In this paper, we solve the nondegeneracy problem for $d=3,4$ by
modifying the arguments in [2, 3]. We also show that the linearized operator
around the ground state has exactly one negative eigenvalue.
","[{""version"":""v1"",""created"":""Fri, 25 Mar 2022 06:49:44 GMT""}]","2022-03-28"
"2203.13474","Erik Nijkamp Dr.","Erik Nijkamp, Bo Pang, Hiroaki Hayashi, Lifu Tu, Huan Wang, Yingbo
  Zhou, Silvio Savarese, Caiming Xiong","CodeGen: An Open Large Language Model for Code with Multi-Turn Program
  Synthesis",,,,,"cs.LG cs.CL cs.PL","http://arxiv.org/licenses/nonexclusive-distrib/1.0/","  Program synthesis strives to generate a computer program as a solution to a
given problem specification, expressed with input-output examples or natural
language descriptions. The prevalence of large language models advances the
state-of-the-art for program synthesis, though limited training resources and
data impede open access to such models. To democratize this, we train and
release a family of large language models up to 16.1B parameters, called
CODEGEN, on natural language and programming language data, and open source the
training library JAXFORMER. We show the utility of the trained model by
demonstrating that it is competitive with the previous state-of-the-art on
zero-shot Python code generation on HumanEval. We further investigate the
multi-step paradigm for program synthesis, where a single program is factorized
into multiple prompts specifying subproblems. To this end, we construct an open
benchmark, Multi-Turn Programming Benchmark (MTPB), consisting of 115 diverse
problem sets that are factorized into multi-turn prompts. Our analysis on MTPB
shows that the same intent provided to CODEGEN in multi-turn fashion
significantly improves program synthesis over that provided as a single turn.
We make the training library JAXFORMER and model checkpoints available as open
source contribution: https://github.com/salesforce/CodeGen.
","[{""version"":""v1"",""created"":""Fri, 25 Mar 2022 06:55:15 GMT""},{""version"":""v2"",""created"":""Mon, 28 Mar 2022 17:10:30 GMT""},{""version"":""v3"",""created"":""Wed, 30 Mar 2022 06:57:04 GMT""},{""version"":""v4"",""created"":""Thu, 29 Sep 2022 20:43:54 GMT""},{""version"":""v5"",""created"":""Mon, 27 Feb 2023 21:26:48 GMT""}]","2023-03-01"
"2203.13475","Miika Hannula","Miika Hannula and Jef Wijsen","A Dichotomy in Consistent Query Answering for Primary Keys and Unary
  Foreign Keys",,,,,"cs.DB cs.LO","http://arxiv.org/licenses/nonexclusive-distrib/1.0/","  Since 2005, significant progress has been made in the problem of Consistent
Query Answering (CQA) with respect to primary keys. In this problem, the input
is a database instance that may violate one or more primary key constraints. A
repair is defined as a maximal subinstance that satisfies all primary keys.
Given a Boolean query q, the question then is whether q holds true in every
repair.
  So far, theoretical research in this field has not addressed the combination
of primary key and foreign key constraints, despite the importance of
referential integrity in database systems. This paper addresses the problem of
CQA with respect to both primary keys and foreign keys. In this setting, it is
natural to adopt the notion of symmetric-difference repairs, because foreign
keys can be repaired by inserting new tuples.
  We consider the case where foreign keys are unary, and queries are
conjunctive queries without self-joins. In this setting, we characterize the
boundary between those CQA problems that admit a consistent first-order
rewriting, and those that do not.
","[{""version"":""v1"",""created"":""Fri, 25 Mar 2022 06:56:45 GMT""}]","2022-03-28"
"2203.13476","Fred Rowley","Fred Rowley","Improved Lower Bounds for Multicolour Ramsey Numbers using SAT-Solvers","9 pages",,,,"math.CO","http://arxiv.org/licenses/nonexclusive-distrib/1.0/","  This paper sets out the results of a range of searches for linear and cyclic
graph colourings with specific Ramsey properties. The new graphs comprise
mainly 'template graphs' which can be used in a construction described by the
current author in 2021 to build linear or cyclic compound graphs with inherited
Ramsey properties. These graphs result in improved lower bounds for a wide
range of multicolour Ramsey numbers.
  Searches were carried out using relatively simple programs (written in the
language `C') to generate clauses for input to the PeneLoPe and Plingeling
parallel SAT-solvers. When solutions were found, the output from the solvers
specified the desired graph colourings.
  The majority of the graphs produced by this work are `template graphs' with
parameters in the form $(k,k,3)$ or $(k,l,3)$ with $k \ne l$. Using these
template graphs in familiar constructions, it has been possible to demonstrate
significant improvements for lower bounds for most $R_r(k)$ for $5 \le k \le 9$
and $r \ge 4$. These improvements provide correspondingly increased lower
bounds on $\Gamma(k) = \lim_{\substack{r \rightarrow \infty}} R{_r}(k)^{1/r}$.
  We also show that $R_3(8) \ge 7174$ and $R_3(9) \ge 15041$. Other new lower
bounds include $R(3,6,6) \ge 338$ and $R(3,8,8) \ge 941$, based on non-template
cyclic graphs, and the interesting particular cases $R(3,4,5,5) \ge 729$ and
$R(3,5,5,5) \ge 1429$.
  A spreadsheet containing specimens of many of the graphs mentioned here will
be attached as an ArXiv ancillary file.
","[{""version"":""v1"",""created"":""Fri, 25 Mar 2022 06:57:41 GMT""},{""version"":""v2"",""created"":""Tue, 19 Jul 2022 07:08:14 GMT""},{""version"":""v3"",""created"":""Sun, 18 Sep 2022 06:51:20 GMT""}]","2022-09-20"
"2203.13477","Wen-Di Guo","Wen-Di Guo, Shao-Wen Wei, and Yu-Xiao Liu","Shadow of a nonsingular black hole","12 pages, 3 figures, 2 tables",,,,"gr-qc","http://arxiv.org/licenses/nonexclusive-distrib/1.0/","  Seeking singularity free solutions are important for further understanding
black holes in quantum level. Recently, a five-dimensional singularity free
topology star/black hole was constructed [Phys. Rev. Lett. 126, 151101 (2021)].
Through the Kaluza-Klein reduction, an effective four-dimensional static
spherically symmetric nonsingular black hole can be obtained. In this paper, we
study shadow of this nonsingular black hole using three kinds of observers,
i.e. static observers, surrounding observers, and freely falling observers, in
four-dimensional spacetime. For a spherically symmetric black hole, the shadow
is circular for any observer, but the shadow size depends on the motion status
of the observer. The shadow size observed by a moving observer will tend to be
shrunk. On the other hand, the effect of plasma is also investigated by a
simple model. The radius of the photon sphere depends on the plasma model. Most
importantly, we find that the shadow sizes do not monotonically decrease with r
in some cases. This is a typical phenomenon for this nonsingular black hole.
","[{""version"":""v1"",""created"":""Fri, 25 Mar 2022 06:58:31 GMT""}]","2022-03-28"
