"2209.01750","Dongyuan Su","Dongyuan Su, Yipeng Zhou, Laizhong Cui","Boost Decentralized Federated Learning in Vehicular Networks by
  Diversifying Data Sources","To appear in the 30th IEEE International Conference on Network
  Protocols (IEEE ICNP 2022)",,,,"cs.LG cs.NI","http://arxiv.org/licenses/nonexclusive-distrib/1.0/","  Recently, federated learning (FL) has received intensive research because of
its ability in preserving data privacy for scattered clients to collaboratively
train machine learning models. Commonly, a parameter server (PS) is deployed
for aggregating model parameters contributed by different clients.
Decentralized federated learning (DFL) is upgraded from FL which allows clients
to aggregate model parameters with their neighbours directly. DFL is
particularly feasible for vehicular networks as vehicles communicate with each
other in a vehicle-to-vehicle (V2V) manner. However, due to the restrictions of
vehicle routes and communication distances, it is hard for individual vehicles
to sufficiently exchange models with others. Data sources contributing to
models on individual vehicles may not diversified enough resulting in poor
model accuracy. To address this problem, we propose the DFL-DDS (DFL with
diversified Data Sources) algorithm to diversify data sources in DFL.
Specifically, each vehicle maintains a state vector to record the contribution
weight of each data source to its model. The Kullback-Leibler (KL) divergence
is adopted to measure the diversity of a state vector. To boost the convergence
of DFL, a vehicle tunes the aggregation weight of each data source by
minimizing the KL divergence of its state vector, and its effectiveness in
diversifying data sources can be theoretically proved. Finally, the superiority
of DFL-DDS is evaluated by extensive experiments (with MNIST and CIFAR-10
datasets) which demonstrate that DFL-DDS can accelerate the convergence of DFL
and improve the model accuracy significantly compared with state-of-the-art
baselines.
","[{""version"":""v1"",""created"":""Mon, 5 Sep 2022 04:01:41 GMT""}]","2022-09-07"
"2209.01751","Yen Tung Yeh","Yen-Tung Yeh, Bo-Yu Chen and Yi-Hsuan Yang","Exploiting Pre-trained Feature Networks for Generative Adversarial
  Networks in Audio-domain Loop Generation","Accepted at ISMIR 2022",,,,"cs.SD eess.AS","http://arxiv.org/licenses/nonexclusive-distrib/1.0/","  While generative adversarial networks (GANs) have been widely used in
research on audio generation, the training of a GAN model is known to be
unstable, time consuming, and data inefficient. Among the attempts to
ameliorate the training process of GANs, the idea of Projected GAN emerges as
an effective solution for GAN-based image generation, establishing the
state-of-the-art in different image applications. The core idea is to use a
pre-trained classifier to constrain the feature space of the discriminator to
stabilize and improve GAN training. This paper investigates whether Projected
GAN can similarly improve audio generation, by evaluating the performance of a
StyleGAN2-based audio-domain loop generation model with and without using a
pre-trained feature space in the discriminator. Moreover, we compare the
performance of using a general versus domain-specific classifier as the
pre-trained audio classifier. With experiments on both drum loop and synth loop
generation, we show that a general audio classifier works better, and that with
Projected GAN our loop generation models can converge around 5 times faster
without performance degradation.
","[{""version"":""v1"",""created"":""Mon, 5 Sep 2022 04:06:05 GMT""}]","2022-09-07"
"2209.01752","Sebastian Lucas Velazquez","Sebastian Lucas Velazquez","Moduli spaces of Lie algebras and foliations",,,,,"math.AG math.DS","http://arxiv.org/licenses/nonexclusive-distrib/1.0/","  Let $X$ be a smooth projective variety over the complex numbers and $S(d)$
the scheme parametrizing $d$-dimensional Lie subalgebras of $H^0(X,\mathcal{T}
X)$. This article is dedicated to the study of the geometry of the moduli space
$\text{Inv}$ of involutive distributions on $X$ around the points
$\mathcal{F}\in \text{Inv}$ which are induced by Lie group actions. For every
$\mathfrak{g} \in S(d)$ one can consider the corresponding element
$\mathcal{F}(\mathfrak{g})\in \text{Inv}$, whose generic leaf coincides with an
orbit of the action of $\exp(\mathfrak{g})$ on $X$. We show that under mild
hypotheses, after taking a stratification $\coprod_i S(d)_i\to S(d)$ this
assignment yields an isomorphism $\phi:\coprod_i S(d)_i\to \text{Inv}$ locally
around $\mathfrak{g}$ and $\mathcal{F}(\mathfrak{g})$. This gives a common
explanation for many results appearing independently in the literature. We also
construct new stable families of foliations which are induced by Lie group
actions.
","[{""version"":""v1"",""created"":""Mon, 5 Sep 2022 04:18:27 GMT""},{""version"":""v2"",""created"":""Mon, 22 May 2023 02:12:30 GMT""}]","2023-05-23"
"2209.01753","Joseph Plowman","Joseph Plowman","Validation & Testing of the CROBAR 3D Coronal Reconstruction Method with
  a MURaM simulation","15 pages, 7 figures, to be submitted to ApJ",,"10.3847/1538-4357/acbc71",,"astro-ph.SR","http://creativecommons.org/licenses/by-nc-sa/4.0/","  I report on validation and testing of a novel 3D reconstruction method than
can obtain coronal plasma properties from a single snapshot perspective. I
first reported on the method in 2021, and I have since named it the Coronal
Reconstruction Onto B-Aligned Regions, or 'CROBAR', method. The testing was
carried out with a cube from a MURaM 3D MHD simulation, which affords a
coronal-like 'ground truth' against which the reconstruction method can be
applied and compared. I find that the method does quite well, recovering the
'coronal veil'-like features recently reported from the MURaM simulations, and
allaying concerns that these features would thwart recovery of valid 3D coronal
structure from a limited number of perspectives. I also find that a second
perspective at between $\sim 45$ and 90 degrees, does significantly improve the
reconstructions. Two distinct channels with Soft X-Ray like temperature
response (peaking above 5 MK) would suffice for CROBAR's optically thin
observables; barring that, a suite of AIA-like EUV passbands, with good
coverage of the 3-8 MK temperature range.
","[{""version"":""v1"",""created"":""Mon, 5 Sep 2022 04:19:06 GMT""}]","2023-04-19"
"2209.01754","Roshni Sahoo","Roshni Sahoo, Lihua Lei, Stefan Wager","Learning from a Biased Sample",,,,,"stat.ME cs.LG stat.ML","http://arxiv.org/licenses/nonexclusive-distrib/1.0/","  The empirical risk minimization approach to data-driven decision making
assumes that we can learn a decision rule from training data drawn under the
same conditions as the ones we want to deploy it in. However, in a number of
settings, we may be concerned that our training sample is biased, and that some
groups (characterized by either observable or unobservable attributes) may be
under- or over-represented relative to the general population; and in this
setting empirical risk minimization over the training set may fail to yield
rules that perform well at deployment. We propose a model of sampling bias
called $\Gamma$-biased sampling, where observed covariates can affect the
probability of sample selection arbitrarily much but the amount of unexplained
variation in the probability of sample selection is bounded by a constant
factor. Applying the distributionally robust optimization framework, we propose
a method for learning a decision rule that minimizes the worst-case risk
incurred under a family of test distributions that can generate the training
distribution under $\Gamma$-biased sampling. We apply a result of Rockafellar
and Uryasev to show that this problem is equivalent to an augmented convex risk
minimization problem. We give statistical guarantees for learning a model that
is robust to sampling bias via the method of sieves, and propose a deep
learning algorithm whose loss function captures our robust learning target. We
empirically validate our proposed method in simulations and a case study on ICU
length of stay prediction.
","[{""version"":""v1"",""created"":""Mon, 5 Sep 2022 04:19:16 GMT""},{""version"":""v2"",""created"":""Thu, 5 Jan 2023 19:59:14 GMT""}]","2023-01-09"
"2209.01755","Atsushi Kawamoto","Yuki Sato, Teppei Deguchi, Tsuyoshi Nomura and Atsushi Kawamoto","Free material optimization of thermal conductivity tensors with
  asymmetric components","12 pages, 9 figures",,,,"cs.CE","http://arxiv.org/licenses/nonexclusive-distrib/1.0/","  Free Material Optimization (FMO), a branch of topology optimization, in which
the design variables are the full constitutive tensors, can provide the most
general form of the design problems. Considering the microstructure composed of
isotropic materials, the constitutive tensors are yet positive definite and
symmetric. On the other hand, it has been reported that the symmetry of this
constitutive tensor can be broken in appearance by considering other physical
phenomena. In the present study, we focus on the thermal Hall effect, which is
explained as the phenomena that induces the temperature gradient orthogonal to
a given temperature gradient across a solid when a magnetic field is applied to
the solid. This effect makes the thermal conductivity tensor asymmetric and
justifies extending the space of the constitutive tensors to be an asymmetric
domain. We propose the FMO for asymmetric constitutive tensors, parameterizing
the design space so that the physically available property could be naturally
satisfied. Several numerical experiments are provided to show the validity and
the utility of the proposed method.
","[{""version"":""v1"",""created"":""Mon, 5 Sep 2022 04:20:58 GMT""}]","2022-09-07"
"2209.01756","Yijie Zhou","Yijie Zhou and Shi Pu","Private and Accurate Decentralized Optimization via Encrypted and
  Structured Functional Perturbation",,,,,"math.OC","http://creativecommons.org/licenses/by-nc-nd/4.0/","  We propose a decentralized optimization algorithm that preserves the privacy
of agents' cost functions without sacrificing accuracy, termed EFPSN. The
algorithm adopts Paillier cryptosystem to construct zero-sum functional
perturbations. Then, based on the perturbed cost functions, any existing
decentralized optimization algorithm can be utilized to obtain the accurate
solution. We theoretically prove that EFPSN is (epsilon, delta)-differentially
private and can achieve nearly perfect privacy under deliberate parameter
settings. Numerical experiments further confirm the effectiveness of the
algorithm.
","[{""version"":""v1"",""created"":""Mon, 5 Sep 2022 04:22:56 GMT""}]","2022-09-07"
"2209.01757","Di Wu","Di Wu, Shuang-Qing Wu","Consistent mass formulae for higher even-dimensional Taub-NUT spacetimes
  and their AdS counterparts","revtex4-1.cls; 11 pages, 6 references newly added",,,,"hep-th gr-qc","http://creativecommons.org/licenses/by/4.0/","  Currently, there is a great deal of interest in the seeking of consistent
thermodynamics of the Lorentzian Taub-NUT spacetimes. Despite a lot of
``satisfactory'' efforts have been made, all of these activities have been
restricted to the four-dimensional cases, with the higher even-dimensional
cases remaining unexplored. The aim of this article is to fill the gap, for the
first time. To the end of this subject, we first adopt our own idea that ``The
NUT charge is a thermodynamical multi-hair"" to investigate the consistent
thermodynamics of $D = 6, 8, 10$ Lorentzian Taub-NUT spacetimes without a
cosmological constant. Similarly to the $D = 4$ cases as did in our previous
works, we find that the first law and Bekenstein-Smarr mass formulas are
perfectly satisfied if we still assign the secondary hair: $J_n = Mn$ as a
conserved charge in both mass formulae. Turning to the cases with a nonzero
cosmological constant, our treatment continues to work very well and all the
results can be fairly generalized to the corresponding Taub-NUT AdS spacetimes
in higher even-dimensions, although we do not know how to define and introduce
a similar higher-dimensional version of the dual (magnetic) mass that is well
known in four dimensions. Based upon the preceding results, we will also derive
the reduced version of the mass formulae when the secondary hair $J_n$ is
viewed as a redundant thermodynamic variable.
","[{""version"":""v1"",""created"":""Mon, 5 Sep 2022 04:25:39 GMT""},{""version"":""v2"",""created"":""Sat, 1 Oct 2022 12:30:06 GMT""},{""version"":""v3"",""created"":""Sat, 18 Feb 2023 07:14:28 GMT""},{""version"":""v4"",""created"":""Mon, 15 May 2023 04:34:02 GMT""}]","2023-05-16"
"2209.01758","Shu-Xuan Wang","Shu-Xuan Wang and Shaolong Wan","Topological Classification of Gapped/Gap-preserving Rational Space-Time
  Crystal Systems","11 pages, 4 figures","Phys. Rev. B 106, 195146 (2022)","10.1103/PhysRevB.106.195146",,"cond-mat.mes-hall","http://arxiv.org/licenses/nonexclusive-distrib/1.0/","  The traditional systems researched in condensed matter physics always have
spatial translation symmetry. However for space-time crystal systems, the
spatial translation symmetry is no longer preserved and the lattice potential
have space-time translation symmetry instead. We show that a rational
space-time crystal system is equal to a traditional floquet system. Then, we
find a way to solve the floquet equation analytically and construct an
effective Hamiltonian of the rational space-time crystal system. By this
effective Hamiltonian, we obtain the topological classification of gapped and
gap-preserving rational space-time crystal systems. Our works reveal the
correlation between space-time crystal systems and floquet systems and give a
systematic method to explore the properties of rational space-time crystal
systems.
","[{""version"":""v1"",""created"":""Mon, 5 Sep 2022 04:26:43 GMT""},{""version"":""v2"",""created"":""Tue, 29 Nov 2022 07:12:01 GMT""}]","2022-11-30"
"2209.01759","Kanghong Shi","Kanghong Shi, Nastaran Nikooienejad, Ian R. Petersen, S. O. Reza
  Moheimani","A negative imaginary approach to hybrid integrator-gain system control","This paper was presented at the 61st IEEE Conference on Decision and
  Control (CDC), 2022. A short version was published in the proceedings of the
  conference",,"10.1109/CDC51059.2022.9992758",,"eess.SY cs.SY math.OC","http://arxiv.org/licenses/nonexclusive-distrib/1.0/","  In this paper, we show that a hybrid integrator-gain system (HIGS) is a
nonlinear negative imaginary (NNI) system. We prove that the positive feedback
interconnection of a linear negative imaginary (NI) system and a HIGS is
asymptotically stable. We apply the HIGS to a MEMS nanopositioner, as an
example of a linear NI system, in a single-input single-output framework. We
analyze the stability and the performance of the closed-loop interconnection in
both time and frequency domains through simulations and demonstrate the
applicability of HIGS as an NNI controller to a linear NI system.
","[{""version"":""v1"",""created"":""Mon, 5 Sep 2022 04:38:39 GMT""},{""version"":""v2"",""created"":""Thu, 23 Mar 2023 04:24:51 GMT""}]","2023-03-24"
"2209.01760","Fushuo Huo","Bingheng Li and Fushuo Huo","REQA: Coarse-to-fine Assessment of Image Quality to Alleviate the Range
  Effect","This work has been submitted to the IEEE for possible publication.
  Copyright may be transferred without notice, after which this version may no
  longer be accessible",,,,"eess.IV cs.CV","http://creativecommons.org/licenses/by/4.0/","  Blind image quality assessment (BIQA) of user generated content (UGC) suffers
from the range effect which indicates that on the overall quality range, mean
opinion score (MOS) and predicted MOS (pMOS) are well correlated; focusing on a
particular range, the correlation is lower. The reason for the range effect is
that the predicted deviations both in a wide range and in a narrow range
destroy the uniformity between MOS and pMOS. To tackle this problem, a novel
method is proposed from coarse-grained metric to fine-grained prediction.
Firstly, we design a rank-and-gradient loss for coarse-grained metric. The loss
keeps the order and grad consistency between pMOS and MOS, thereby reducing the
predicted deviation in a wide range. Secondly, we propose multi-level tolerance
loss to make fine-grained prediction. The loss is constrained by a decreasing
threshold to limite the predicted deviation in narrower and narrower ranges.
Finally, we design a feedback network to conduct the coarse-to-fine assessment.
On the one hand, the network adopts feedback blocks to process multi-scale
distortion features iteratively and on the other hand, it fuses non-local
context feature to the output of each iteration to acquire more quality-aware
feature representation. Experimental results demonstrate that the proposed
method can alleviate the range effect compared to the state-of-the-art methods
effectively.
","[{""version"":""v1"",""created"":""Mon, 5 Sep 2022 04:39:16 GMT""},{""version"":""v2"",""created"":""Tue, 18 Oct 2022 08:43:50 GMT""},{""version"":""v3"",""created"":""Fri, 13 Jan 2023 09:43:46 GMT""}]","2023-01-16"
"2209.01761","Akira Sone","Akira Sone and Naoki Yamamoto and Tharon Holdsworth and Prineha Narang","Jarzynski-like Equality of Nonequilibrium Information Production Based
  on Quantum Cross Entropy","v2: We removed the results of two-time measurement scheme, and added
  the relations of our main result of the one-time measurement scheme to the
  cost function of quantum autoencoder and maximum available work theorem","Phys. Rev. Research 5, 023039 (2023)","10.1103/PhysRevResearch.5.023039",,"quant-ph cond-mat.stat-mech","http://creativecommons.org/licenses/by/4.0/","  The two-time measurement scheme is well studied in the context of quantum
fluctuation theorem. However, it becomes infeasible when the random variable
determined by a single measurement trajectory is associated with the
von-Neumann entropy of the quantum states. We employ the one-time measurement
scheme to derive a Jarzynski-like equality of nonequilibrium information
production by proposing an information production distribution based on the
quantum cross entropy. The derived equality further enables one to explore the
roles of the quantum cross entropy in quantum communications, quantum machine
learning and quantum thermodynamics.
","[{""version"":""v1"",""created"":""Mon, 5 Sep 2022 04:47:10 GMT""},{""version"":""v2"",""created"":""Tue, 20 Dec 2022 03:19:58 GMT""}]","2023-04-20"
"2209.01762","Sunghwa Lee","Sunghwa Lee, Younghoon Shin","Movement Detection of Tongue and Related Body Parts Using IR-UWB Radar","Submitted to the 13th International Conference on ICT Convergence
  (ICTC)",,"10.1109/ICTC55196.2022.9952644",,"eess.AS","http://arxiv.org/licenses/nonexclusive-distrib/1.0/","  Because an impulse radio ultra-wideband (IR-UWB) radar can detect targets
with high accuracy, work through occluding materials, and operate without
contact, it is an attractive hardware solution for building silent speech
interfaces, which are non-audio-based speech communication devices. As tongue
movement is strongly engaged in pronunciation, detecting its movement is
crucial for developing silent speech interfaces. In this study, we attempted to
classify the motionless and moving states of an invisible tongue and its
related body parts using an IR-UWB radar whose antennas were pointed toward the
participant's chin. Using the proposed feature extraction algorithm and a
Gaussian mixture model - hidden Markov model, we classified two states of the
invisible tongue of four individual participants with a minimum accuracy of
90%.
","[{""version"":""v1"",""created"":""Mon, 5 Sep 2022 04:51:20 GMT""}]","2022-12-13"
"2209.01763","Zhongyun Hua","Kuiyuan Zhang and Zhongyun Hua and Yuanman Li and Yushu Zhang and
  Yicong Zhou","Uformer-ICS: A Specialized U-Shaped Transformer for Image Compressive
  Sensing",,,,,"eess.IV cs.CR cs.CV","http://arxiv.org/licenses/nonexclusive-distrib/1.0/","  Recently, several studies have applied deep convolutional neural networks
(CNNs) in image compressive sensing (CS) tasks to improve reconstruction
quality. However, convolutional layers generally have a small receptive field;
therefore, capturing long-range pixel correlations using CNNs is challenging,
which limits their reconstruction performance in image CS tasks. Considering
this limitation, we propose a U-shaped transformer for image CS tasks, called
the Uformer-ICS. We develop a projection-based transformer block by integrating
the prior projection knowledge of CS into the original transformer blocks, and
then build a symmetrical reconstruction model using the projection-based
transformer blocks and residual convolutional blocks. Compared with previous
CNN-based CS methods that can only exploit local image features, the proposed
reconstruction model can simultaneously utilize the local features and
long-range dependencies of an image, and the prior projection knowledge of the
CS theory. Additionally, we design an adaptive sampling model that can
adaptively sample image blocks based on block sparsity, which can ensure that
the compressed results retain the maximum possible information of the original
image under a fixed sampling ratio. The proposed Uformer-ICS is an end-to-end
framework that simultaneously learns the sampling and reconstruction processes.
Experimental results demonstrate that it achieves significantly better
reconstruction performance than existing state-of-the-art deep learning-based
CS methods.
","[{""version"":""v1"",""created"":""Mon, 5 Sep 2022 04:52:12 GMT""}]","2022-09-07"
"2209.01764","Michael Wibmer","Michael Wibmer","Regular singular differential equations and free proalgebraic groups","13 pages",,,,"math.AG math.AC","http://creativecommons.org/licenses/by/4.0/","  We determine the differential Galois group of the family of all regular
singular differential equations on the Riemann sphere. It is the free
proalgebraic group on a set of cardinality $|\mathbb{C}|$.
","[{""version"":""v1"",""created"":""Mon, 5 Sep 2022 05:02:11 GMT""}]","2022-09-07"
"2209.01765","Xiaodong Gu","Xiaodong Gu, Zhaowei Zhang, Sang-Woo Lee, Kang Min Yoo, Jung-Woo Ha","Continuous Decomposition of Granularity for Neural Paraphrase Generation","Accepted to be published in COLING 2022",,,,"cs.CL","http://creativecommons.org/licenses/by/4.0/","  While Transformers have had significant success in paragraph generation, they
treat sentences as linear sequences of tokens and often neglect their
hierarchical information. Prior work has shown that decomposing the levels of
granularity~(e.g., word, phrase, or sentence) for input tokens has produced
substantial improvements, suggesting the possibility of enhancing Transformers
via more fine-grained modeling of granularity. In this work, we propose a
continuous decomposition of granularity for neural paraphrase generation
(C-DNPG). In order to efficiently incorporate granularity into sentence
encoding, C-DNPG introduces a granularity-aware attention (GA-Attention)
mechanism which extends the multi-head self-attention with: 1) a granularity
head that automatically infers the hierarchical structure of a sentence by
neurally estimating the granularity level of each input token; and 2) two novel
attention masks, namely, granularity resonance and granularity scope, to
efficiently encode granularity into attention. Experiments on two benchmarks,
including Quora question pairs and Twitter URLs have shown that C-DNPG
outperforms baseline models by a remarkable margin and achieves
state-of-the-art results in terms of many metrics. Qualitative analysis reveals
that C-DNPG indeed captures fine-grained levels of granularity with
effectiveness.
","[{""version"":""v1"",""created"":""Mon, 5 Sep 2022 05:02:42 GMT""},{""version"":""v2"",""created"":""Fri, 16 Sep 2022 08:43:27 GMT""}]","2022-09-19"
"2209.01766","Patrick Lam","Dakota Wong, Austin Kothig and Patrick Lam","Exploring the Verifiability of Code Generated by GitHub Copilot","HATRA workshop at SPLASH 2022",,,,"cs.SE cs.PL","http://arxiv.org/licenses/nonexclusive-distrib/1.0/","  GitHub's Copilot generates code quickly. We investigate whether it generates
good code. Our approach is to identify a set of problems, ask Copilot to
generate solutions, and attempt to formally verify these solutions with Dafny.
Our formal verification is with respect to hand-crafted specifications. We have
carried out this process on 6 problems and succeeded in formally verifying 4 of
the created solutions. We found evidence which corroborates the current
consensus in the literature: Copilot is a powerful tool; however, it should not
be ""flying the plane"" by itself.
","[{""version"":""v1"",""created"":""Mon, 5 Sep 2022 05:17:07 GMT""},{""version"":""v2"",""created"":""Thu, 27 Oct 2022 08:51:03 GMT""}]","2022-10-28"
