"2209.01854","Alejandro S\'anchez-L\'opez","A. S\'anchez-L\'opez, L. Lin, I. A. G. Snellen, N. Casasayas-Barris,
  A. Garc\'ia Mu\~noz, M. Lamp\'on, and M. L\'opez-Puertas","Detection of Paschen $\beta$ absorption in the atmosphere of KELT-9 b: A
  new window into the atmospheres of ultra-hot Jupiters","7 pages, accepted for publication in A&A Letters","A&A 666, L1 (2022)","10.1051/0004-6361/202244416",,"astro-ph.EP","http://arxiv.org/licenses/nonexclusive-distrib/1.0/","  Hydrogen and helium transmission signals trace the upper atmospheres of hot
gas-giant exoplanets, where the incoming stellar extreme ultraviolet and X-ray
fluxes are deposited. Further, for the hottest stars, the near-ultraviolet
excitation of hydrogen in the Balmer continuum may play a dominant role in
controlling the atmospheric temperature and driving photoevaporation. KELT-9 b
is the archetypal example of such an environment as it is the hottest gas-giant
exoplanet known to date (T$_{eq}$ $\sim$ 4500 K) and orbits an A0V-type star.
Studies of the upper atmosphere and escaping gas of this ultra-hot Jupiter have
targeted the absorption in the Balmer series of hydrogen (n$_1$ = 2
$\rightarrow$ n$_2$ $>$ 2). Unfortunately, the lowermost metastable helium
state that causes the triplet absorption at 108.3 nm is not sufficiently
populated for detection. Here, we present evidence of hydrogen absorption in
the Paschen series in the transmission spectrum of KELT-9 b observed with
CARMENES. Specifically, we focus on the strongest line covered by its NIR
channel, Paschen-$\beta$ at 1282.16 nm (n$_1$ = 3 $\rightarrow$ n$_2$ = 5). The
observed absorption shows a contrast of (0.53 $^{+0.12}_{-0.13}$)%, a blueshift
of $-$14.8 $^{+3.5}_{-3.2}$ km/s, and a FWHM of 31.9$^{+11.8}_{-8.3}$ km/s. The
observed blueshift in the absorption feature could be explained by day-to-night
circulation within the gravitationally bound atmosphere or, alternatively, by
Paschen-$\beta$ absorption originating in a tail of escaping gas moving toward
the observer as a result of extreme atmospheric evaporation. This detection
opens a new window for investigating the atmospheres of ultra-hot Jupiters,
providing additional constraints of their temperature structure, mass-loss
rates, and dynamics for future modeling of their scorching atmospheres.
","[{""version"":""v1"",""created"":""Mon, 5 Sep 2022 09:25:19 GMT""},{""version"":""v2"",""created"":""Mon, 19 Sep 2022 15:39:11 GMT""}]","2022-09-28"
"2209.01855","Evgeny Strahov","Eugene Strahov","Multiple Partition Structures and Harmonic Functions on Branching Graphs","47 pages",,,,"math.PR math-ph math.CO math.MP math.RT","http://creativecommons.org/licenses/by/4.0/","  We introduce and study multiple partition structures which are sequences of
probability measures on families of Young diagrams subjected to a consistency
condition. The multiple partition structures are generalizations of Kingman's
partition structures, and are motivated by a problem of population genetics.
They are related to harmonic functions and coherent systems of probability
measures on a certain branching graph. The vertices of this graph are multiple
Young diagrams (or multiple partitions), and the edges depend on the Jack
parameter. Our main result establishes a bijective correspondence between the
set of harmonic functions on the graph and probability measures on the
generalized Thoma set. The correspondence is determined by a canonical integral
representation of harmonic functions. As a consequence we obtain a
representation theorem for multiple partition structures.
  We give an example of a multiple partition structure which is expected to be
relevant for a model of population genetics for the genetic variation of a
sample of gametes from a large population. Namely, we construct a probability
measure on the wreath product of a finite group with the symmetric group. The
constructed probability measure defines a multiple partition structure which is
a generalization of the Ewens partition structure studied by Kingman. We show
that this multiple partition structure can be represented in terms of a
multiple analogue of the Poisson-Dirichlet distribution called the multiple
Poisson-Dirichlet distribution in the paper.
","[{""version"":""v1"",""created"":""Mon, 5 Sep 2022 09:26:31 GMT""},{""version"":""v2"",""created"":""Sun, 11 Sep 2022 06:15:46 GMT""}]","2022-09-13"
"2209.01856","Muayad Aljafar","Muayad J. Aljafar, Florence Azais, Marie-Lise Flottes, Samuel
  Pagliarini","Leveraging Layout-based Effects for Locking Analog ICs",,,,,"cs.CR","http://creativecommons.org/licenses/by/4.0/","  While various obfuscation methods exist in the digital domain, techniques for
protecting Intellectual Property (IP) in the analog domain are mostly
overlooked. Understandably, analog components have a small footprint as most of
the surface of an Integrated Circuit (IC) is digital. Yet, since they are
challenging to design and tune, they constitute a valuable IP that ought to be
protected. This paper is the first to show a method to secure analog IP by
exploiting layout-based effects that are typically seen as undesirable
detractors in IC design. Specifically, we make use of the effects of Length of
Oxide Diffusion and Well Proximity Effect on transistors for tuning the
devices' critical parameters (e.g., gm and Vth). Such parameters are hidden
behind key inputs, akin to the logic locking approach for digital ICs. The
proposed technique is applied for locking an Operational Transconductance
Amplifier. In order to showcase the robustness of the achieved obfuscation, the
case studied circuit is simulated for a large number of key sets, i.e., >50K
and >300K, and the results show a wide range of degradation in open-loop gain
(up to 130dB), phase margin (up to 50 deg), 3dB bandwidth (approx. 2.5MHz), and
power (approx. 1mW) of the locked circuit when incorrect keys are applied. Our
results show the benefit of the technique and the incurred overheads. We also
justify the non-effectiveness of reverse engineering efforts for attacking the
proposed approach. More importantly, our technique employs only regular
transistors and requires neither changes to the IC fabrication process nor any
foundry-level coordination or trust.
","[{""version"":""v1"",""created"":""Mon, 5 Sep 2022 09:27:43 GMT""}]","2022-09-07"
"2209.01857","Christoph Jansen PhD","Christoph Jansen (1), Malte Nalenz (1), Georg Schollmeyer (1), Thomas
  Augustin (1) ((1) Ludwig-Maximilians-Universit\""at Munich)","Statistical Comparisons of Classifiers by Generalized Stochastic
  Dominance",,,,,"stat.ML cs.LG stat.ME","http://creativecommons.org/licenses/by/4.0/","  Although being a question in the very methodological core of machine
learning, there is still no unanimous consensus on how to compare classifiers.
Every comparison framework is confronted with (at least) three fundamental
challenges: the multiplicity of quality criteria, the multiplicity of data sets
and the randomness/arbitrariness of the selection of data sets. In this paper,
we add a fresh view to the vivid debate by adopting recent developments in
decision theory. Our resulting framework, based on so-called preference
systems, ranks classifiers by a generalized concept of stochastic dominance,
which powerfully circumvents the cumbersome, and often even self-contradictory,
reliance on aggregates. Moreover, we show that generalized stochastic dominance
can be operationalized by solving easy-to-handle linear programs and
statistically tested by means of an adapted two-sample
observation-randomization test. This indeed yields a powerful framework for the
statistical comparison of classifiers with respect to multiple quality criteria
simultaneously. We illustrate and investigate our framework in a simulation
study and with standard benchmark data sets.
","[{""version"":""v1"",""created"":""Mon, 5 Sep 2022 09:28:15 GMT""}]","2022-09-07"
"2209.01858","Shafa Balaram","Shafa Balaram, Cuong M. Nguyen, Ashraf Kassim, Pavitra Krishnaswamy","Consistency-Based Semi-supervised Evidential Active Learning for
  Diagnostic Radiograph Classification","Preprint submitted to MICCAI. Accepted in May 2022",,,,"cs.CV cs.AI cs.LG","http://creativecommons.org/licenses/by-nc-nd/4.0/","  Deep learning approaches achieve state-of-the-art performance for classifying
radiology images, but rely on large labelled datasets that require
resource-intensive annotation by specialists. Both semi-supervised learning and
active learning can be utilised to mitigate this annotation burden. However,
there is limited work on combining the advantages of semi-supervised and active
learning approaches for multi-label medical image classification. Here, we
introduce a novel Consistency-based Semi-supervised Evidential Active Learning
framework (CSEAL). Specifically, we leverage predictive uncertainty based on
theories of evidence and subjective logic to develop an end-to-end integrated
approach that combines consistency-based semi-supervised learning with
uncertainty-based active learning. We apply our approach to enhance four
leading consistency-based semi-supervised learning methods: Pseudo-labelling,
Virtual Adversarial Training, Mean Teacher and NoTeacher. Extensive evaluations
on multi-label Chest X-Ray classification tasks demonstrate that CSEAL achieves
substantive performance improvements over two leading semi-supervised active
learning baselines. Further, a class-wise breakdown of results shows that our
approach can substantially improve accuracy on rarer abnormalities with fewer
labelled samples.
","[{""version"":""v1"",""created"":""Mon, 5 Sep 2022 09:28:31 GMT""}]","2022-09-07"
"2209.01859","Kazumasa Shinagawa","Kazumasa Shinagawa, Reo Eriguchi, Shohei Satake, Koji Nuida","Private Simultaneous Messages Based on Quadratic Residues",,,,,"cs.CR math.NT","http://creativecommons.org/licenses/by/4.0/","  Private Simultaneous Messages (PSM) model is a minimal model for secure
multiparty computation. Feige, Kilian, and Naor (STOC 1994) and Ishai
(Cryptology and Information Security Series 2013) constructed PSM protocols
based on quadratic residues. In this paper, we define QR-PSM protocols as a
generalization of these protocols. A QR-PSM protocol is a PSM protocol whose
decoding function outputs the quadratic residuosity of what is computed from
messages. We design a QR-PSM protocol for any symmetric function $f: \{0,1\}^n
\rightarrow \{0,1\}$ of communication complexity $O(n^2)$. As far as we know,
it is the most efficient PSM protocol since the previously known best PSM
protocol was of $O(n^2\log n)$ (Beimel et al., CRYPTO 2014). We also study the
sizes of the underlying finite fields $\mathbb{F}_p$ in the protocols since the
communication complexity of a QR-PSM protocol is proportional to the bit length
of the prime $p$. In particular, we show that the $N$-th Peralta prime $P_N$,
which is used for general QR-PSM protocols, can be taken as at most
$(1+o(1))N^2 2^{2N-2}$, which improves the Peralta's known result (Mathematics
of Computation 1992) by a constant factor $(1+\sqrt{2})^2$.
","[{""version"":""v1"",""created"":""Mon, 5 Sep 2022 09:29:42 GMT""},{""version"":""v2"",""created"":""Tue, 13 Sep 2022 09:16:57 GMT""}]","2023-02-09"
"2209.01860","Zhenhua Dong","Zhenhua Dong, Zhe Wang, Jun Xu, Ruiming Tang, Jirong Wen","A Brief History of Recommender Systems",,"DLP-KDD 2022",,,"cs.IR","http://creativecommons.org/licenses/by-nc-sa/4.0/","  Soon after the invention of the Internet, the recommender system emerged and
related technologies have been extensively studied and applied by both academia
and industry. Currently, recommender system has become one of the most
successful web applications, serving billions of people in each day through
recommending different kinds of contents, including news feeds, videos,
e-commerce products, music, movies, books, games, friends, jobs etc. These
successful stories have proved that recommender system can transfer big data to
high values. This article briefly reviews the history of web recommender
systems, mainly from two aspects: (1) recommendation models, (2) architectures
of typical recommender systems. We hope the brief review can help us to know
the dots about the progress of web recommender systems, and the dots will
somehow connect in the future, which inspires us to build more advanced
recommendation services for changing the world better.
","[{""version"":""v1"",""created"":""Mon, 5 Sep 2022 09:38:23 GMT""}]","2022-09-07"
"2209.01861","Yuya Haraguchi","Yuya Haraguchi, and Hiroko Aruga Katori","Honeycomb lattice iridate on the verge of Mott-collapse","7pages, 5 figures, accepted in Journal of Physics: Condensed Matter",,"10.1088/1361-648X/ac916e",,"cond-mat.str-el cond-mat.mtrl-sci","http://creativecommons.org/licenses/by/4.0/","  A new honeycomb lattice iridate (La,Na)IrO$_3$ ($\approx$ LaNaIr$_2$O$_6$) is
successfully synthesized from the spin-orbit coupled Mott insulator
Na$_2$IrO$_3$ by replacing the interlayer Na$^+$ ions with La$^{3+}$ ions.
(La,Na)IrO$_3$ shows a finite Sommerfeld term in heat capacity and a $-\ln T$
dependence of resistivity, indicating a realization of a metallic state driven
by a Mott collapse. Furthermore, crystal structure analysis reveals the
formation of Ir zig-zag chains with metal-metal bonding, increasing kinetic
energy resulting in the Mott collapse. This observation would be due to a Mott
collapse induced in a $J_{\mathrm{eff}} = 1/2$ spin-orbit coupling Mott
insulator with an Ir honeycomb lattice by topochemical control of the ionic
configuration.
","[{""version"":""v1"",""created"":""Mon, 5 Sep 2022 09:39:26 GMT""}]","2022-10-05"
"2209.01862","Xingyu Su","Xingyu Su, Weiqi Ji, Jian An, Zhuyin Ren, Sili Deng, Chung K. Law","Kinetics Parameter Optimization via Neural Ordinary Differential
  Equations","8 pages, 9 figures",,,,"physics.chem-ph physics.flu-dyn","http://creativecommons.org/licenses/by/4.0/","  Chemical kinetics mechanisms are essential for understanding, analyzing, and
simulating complex combustion phenomena. In this study, a Neural Ordinary
Differential Equation (Neural ODE) framework is employed to optimize kinetics
parameters of reaction mechanisms. Given experimental or high-cost simulated
observations as training data, the proposed algorithm can optimally recover the
hidden characteristics in the data. Different datasets of various sizes, types,
and noise levels are tested. A classic toy problem of stiff Robertson ODE is
first used to demonstrate the learning capability, efficiency, and robustness
of the Neural ODE approach. A 41-species, 232-reactions JP-10 skeletal
mechanism and a 34-species, 121-reactions n-heptane skeletal mechanism are then
optimized with species' temporal profiles and ignition delay times,
respectively. Results show that the proposed algorithm can optimize stiff
chemical models with sufficient accuracy and efficiency. It is noted that the
trained mechanism not only fits the data perfectly but also retains its
physical interpretability, which can be further integrated and validated in
practical turbulent combustion simulations.
","[{""version"":""v1"",""created"":""Mon, 5 Sep 2022 09:46:27 GMT""}]","2022-09-07"
"2209.01863","David Fuchssteiner","Marcin Bienkowski, David Fuchssteiner, Stefan Schmid","Online B-Matchings for Reconfigurable Datacenters: The Power of
  Randomization",,,,,"cs.NI cs.DS","http://arxiv.org/licenses/nonexclusive-distrib/1.0/","  This paper studies the problem of how to dynamically optimize the topology of
a reconfigurable datacenter network in a demand-aware manner: by accounting for
the current traffic pattern and providing direct connectivity between
frequently communicating racks, the datacenter's bandwidth efficiency can be
improved. The underlying algorithmic challenge can be described as an online
maximum weight $b$-matching problem, a generalization of maximum weight
matching where each node has at most $b \geq 1$ incident matching edges.
Recently, Bienkowski et al.~presented an $O(b)$-competitive deterministic
algorithm and showed that this is asymptotically optimal. This paper initiates
the study of randomized algorithms, and we present a $O(\log b)$-competitive
solution and show that this is asymptotically optimal. We complement our
theoretical results with extensive trace-driven simulations, based on
real-world datacenter workloads.
","[{""version"":""v1"",""created"":""Mon, 5 Sep 2022 09:49:27 GMT""}]","2022-09-07"
"2209.01864","\""Ozlem Tu\u{g}fe Demir","Zinat Behdad, \""Ozlem Tu\u{g}fe Demir, Ki Won Sung, Emil Bj\""ornson,
  and Cicek Cavdar","Power Allocation for Joint Communication and Sensing in Cell-Free
  Massive MIMO","6 pages, 5 figures, to be presented at the IEEE GLOBECOM 2022
  conference",,,,"cs.IT eess.SP math.IT","http://arxiv.org/licenses/nonexclusive-distrib/1.0/","  This paper studies a joint communication and sensing (JCAS) system with
downlink communication and multi-static sensing for single-target detection in
a cloud radio access network architecture. A centralized operation of cell-free
massive MIMO is considered for communication and sensing purposes. The JCAS
transmit access points (APs) jointly serve the user equipments (UEs) and
optionally steer a beam towards the target. A maximum a posteriori ratio test
detector is derived to detect the target using signals received at distributed
APs. We propose a power allocation algorithm to maximize the sensing
signal-to-noise ratio under the condition that a minimal
signal-to-interference-plus-noise ratio value for each UE is guaranteed.
Numerical results show that, compared to the fully communication-centric power
allocation, the detection probability under a certain false alarm probability
can be increased significantly by the proposed algorithm for both JCAS setups:
i) using additional sensing symbols or ii) using only existing communication
symbols.
","[{""version"":""v1"",""created"":""Mon, 5 Sep 2022 09:52:03 GMT""}]","2022-09-07"
"2209.01865","Denis Sauvaget","Denis Sauvaget (LAGA)","A simple eversion of the 2-sphere with a unique quadruple point",,,,,"math.DG","http://arxiv.org/licenses/nonexclusive-distrib/1.0/","  We give an example of an eversion of the 2-sphere in the Euclidean 3-space,
inspired by Morse theory, with a unique quadruple point. No homotopical tool is
used.
","[{""version"":""v1"",""created"":""Mon, 5 Sep 2022 09:52:14 GMT""}]","2022-09-07"
"2209.01866","Faeze Kiani","Akshakhi Kumar Pritoonka, Faeze Kiani","Texture image analysis based on joint of multi directions GLCM and local
  ternary patterns","6 pages. 2 tables. 5 figures",,,,"cs.CV","http://creativecommons.org/licenses/by-nc-sa/4.0/","  Human visual brain use three main component such as color, texture and shape
to detect or identify environment and objects. Hence, texture analysis has been
paid much attention by scientific researchers in last two decades. Texture
features can be used in many different applications in commuter vision or
machine learning problems. Since now, many different approaches have been
proposed to classify textures. Most of them consider the classification
accuracy as the main challenge that should be improved. In this article, a new
approach is proposed based on combination of two efficient texture descriptor,
co-occurrence matrix and local ternary patterns (LTP). First of all, basic
local binary pattern and LTP are performed to extract local textural
information. Next, a subset of statistical features is extracted from
gray-level co-occurrence matrixes. Finally, concatenated features are used to
train classifiers. The performance is evaluated on Brodatz benchmark dataset in
terms of accuracy. Experimental results show that proposed approach provide
higher classification rate in comparison with some state-of-the-art approaches.
","[{""version"":""v1"",""created"":""Mon, 5 Sep 2022 09:53:00 GMT""}]","2022-09-07"
"2209.01867","Aaron Held","Aaron Held and Jun Zhang","Instability of spherically-symmetric black holes in Quadratic Gravity","10 pages, 4 figures + appendix and references",,"10.1103/PhysRevD.107.064060","Imperial/TP/2022/AH/03","gr-qc","http://arxiv.org/licenses/nonexclusive-distrib/1.0/","  We investigate the linear stability of the two known branches of
spherically-symmetric black holes in Quadratic Gravity. We extend previous work
on the long-wavelength (Gregory-Laflamme) instability of the Schwarzschild
branch to a corresponding long-wavelength instability in the non-Schwarzschild
branch. In both cases, the instability sets in below a critical horizon radius
at which the two black-hole branches intersect. This suggests that classical
perturbations enforce a lower bound on the horizon radius of
spherically-symmetric black holes in Quadratic Gravity.
","[{""version"":""v1"",""created"":""Mon, 5 Sep 2022 09:56:16 GMT""}]","2023-04-05"
"2209.01868","Yasaman Khorsandmanesh","Yasaman Khorsandmanesh, Emil Bj\""ornson, Joakim Jald\'en","Optimized Precoding for MU-MIMO With Fronthaul Quantization",,,,,"eess.SP cs.IT math.IT","http://arxiv.org/licenses/nonexclusive-distrib/1.0/","  One of the first widespread uses of multi-user multiple-input multiple-output
(MU-MIMO) is in 5G networks, where each base station has an advanced antenna
system (AAS) that is connected to the baseband unit (BBU) with a
capacity-constrained fronthaul. In the AAS configuration, multiple passive
antenna elements and radio units are integrated into a single box. This paper
considers precoded downlink transmission over a single-cell MU-MIMO system. We
study optimized linear precoding for AAS with a limited-capacity fronthaul,
which requires the precoding matrix to be quantized. We propose a new precoding
design that is aware of the fronthaul quantization and minimizes the
mean-squared error at the receiver side. We compute the precoding matrix using
a sphere decoding (SD) approach. We also propose a heuristic low-complexity
approach to quantized precoding. This heuristic is computationally efficient
enough for massive MIMO systems. The numerical results show that our proposed
precoding significantly outperforms quantization-unaware precoding and other
previous approaches in terms of the sum rate. The performance loss for our
heuristic method compared to quantization-aware precoding is insignificant
considering the complexity reduction, which makes the heuristic method feasible
for real-time applications. We consider both perfect and imperfect channel
state information.
","[{""version"":""v1"",""created"":""Mon, 5 Sep 2022 09:59:41 GMT""}]","2022-09-07"
"2209.01869","Alexander Morozov","Renato Assante and Dom Corbett and Davide Marenduzzo and Alexander
  Morozov","Active turbulence and spontaneous phase separation in inhomogeneous
  extensile active gels","9 pages, 6 figures & Supplemental Material","Soft Matter, 2023, 19, 189-198","10.1039/D2SM01188C",,"cond-mat.soft physics.flu-dyn","http://creativecommons.org/licenses/by/4.0/","  We report numerical results for the hydrodynamics of inhomogeneous lyotropic
and extensile active nematic gels. By simulating the coupled Cahn-Hilliard,
Navier-Stokes, and Beris-Edwards equation for the evolution of the composition,
flow and orientational order of an active nematic, we ask whether composition
variations are important to determine its emergent physics. As in active gels
of uniform composition, we find that increasing either activity or nematic
tendency (e.g., overall active matter concentration) triggers a transition
between an isotropic passive phase and an active nematic one. We show that
composition inhomogeneities are important in the latter phase, where we find
three types of possible dynamical regimes. First, we observe regular patterns
with defects and vortices: these exist close to the passive-active transition.
Second, for larger activity, or deeper in the nematic phase, we find active
turbulence, as in active gels of uniform composition, but with exceedingly
large composition variation. In the third regime, which is uniquely associated
with inhomogeneity and occurs for large nematic tendency and low activity, we
observe spontaneous microphase separation into active and passive domains. The
microphase separated regime is notable in view of the absence of an explicit
demixing term in the underlying free energy which we use, and we provide a
theoretical analysis based on the common tangent construction which explains
its existence. We hope this regime can be probed experimentally in the future.
","[{""version"":""v1"",""created"":""Mon, 5 Sep 2022 10:03:45 GMT""},{""version"":""v2"",""created"":""Tue, 6 Dec 2022 16:36:24 GMT""}]","2023-01-06"
