"2209.01951","Kleber Stangherlin","Kleber Stangherlin and Andrew Kennings","Hardware Architecture for Inplace Compute of Burrows-Wheeler Transform
  in a Single Iteration",,,,,"eess.SP","http://arxiv.org/licenses/nonexclusive-distrib/1.0/","  The Burrows-Wheeler transform (BWT) is used by the bzip2 family of
compressors. In this paper, we present a hardware architecture that implements
an inplace algorithm to compute the BWT. Our design does not have explicit
storage for the suffix array, or output array. The performance of our
implementation is fixed, and does not depend on the input string content. We
use a register based character buffer in a scanchain configuration, such that
the BWT is computed from right to left, as characters are loaded. Loading new
characters is done every six cycles, producing a new output character from the
previously computed block at the same rate. Our FGPA implementation does not
use block ram instances, and achieves throughput of 66, 35, 18, and 15 MB/s for
block sizes of 128 B, 1 kB, 4 kB, and 8 kB. We also report results for an ASIC
implementation in 65 nm CMOS that achieves 161 MB/s when using block size of
128 B.
","[{""version"":""v1"",""created"":""Mon, 5 Sep 2022 13:10:18 GMT""}]","2022-09-07"
"2209.01952","B\'alint T\'egl\'asy Zolt\'an","B\'alint Z. T\'egl\'asy, Emil Wengle, John R. Potter, Sokratis
  Katsikas","Authentication of Underwater Assets",,,,,"cs.CR cs.RO","http://creativecommons.org/licenses/by-nc-sa/4.0/","  Secure digital wireless communication underwater has become a key issue as
maritime operations shift towards employing a heterogeneous mix of robotic
assets and as the security of digital systems becomes challenged across all
domains. At the same time, a proliferation of underwater signal coding and
physical layer options are delivering greater bandwidth and flexibility, but
mostly without the standards necessary for interoperability. We address here an
essential requirement for security, namely a confirmation of asset identities
also known as authentication. We propose, implement, verify and validate an
authentication protocol based on the first digital underwater communications
standard. Our scheme is applicable primarily to AUVs operating around offshore
oil and gas facilities, but also to other underwater devices that may in the
future have acoustic modems. It makes communication including command and
control significantly more secure and provides a foundation for the development
of more sophisticated security mechanisms.
","[{""version"":""v1"",""created"":""Mon, 5 Sep 2022 13:14:04 GMT""}]","2022-09-07"
"2209.01953","Pujian Mao","Song He, Pujian Mao, Xin-Cheng Mao","$T\bar{T}$ deformed soft theorem","v2: Interpretation improved significantly, discussions on the
  connection between loop corrections and deformations added, extra with
  respect to the version accepted for publication in journal due to the page
  limits","Phys. Rev. D 107, L101901 (2023)","10.1103/PhysRevD.107.L101901",,"hep-th gr-qc","http://creativecommons.org/licenses/by/4.0/","  In this paper, we derive a $T\bar{T}$ deformed soft graviton theorem in the
context of celestial holography. As a concrete example, it illustrates that a
two-dimensional irrelevant deformation can be applied to a four-dimensional
theory at the level of amplitudes. We argue that the $T\bar{T}$ deformation has
a close relation to the loop-correction from the amplitude side which could
provide an alternative way to construct an ultraviolet complete quantum theory
of gravity.
","[{""version"":""v1"",""created"":""Mon, 5 Sep 2022 13:14:14 GMT""},{""version"":""v2"",""created"":""Thu, 20 Apr 2023 14:46:37 GMT""}]","2023-05-25"
"2209.01954","Jonni Lohi","Jonni Lohi","New degrees of freedom for differential forms on cubical meshes","Included a proof of the exact sequence property (Remark 4.2) and
  updated formatting",,,,"math.NA cs.NA","http://creativecommons.org/licenses/by-nc-sa/4.0/","  We consider new degrees of freedom for higher order differential forms on
cubical meshes. The approach is inspired by the idea of Rapetti and Bossavit to
define higher order Whitney forms and their degrees of freedom using small
simplices. We show that higher order differential forms on cubical meshes can
be defined analogously using small cubes and prove that these small cubes yield
unisolvent degrees of freedom. Significantly, this approach is compatible with
discrete exterior calculus and expands the framework to cover higher order
methods on cubical meshes, complementing the earlier strategy based on
simplices.
","[{""version"":""v1"",""created"":""Mon, 5 Sep 2022 13:16:32 GMT""},{""version"":""v2"",""created"":""Mon, 20 Feb 2023 13:43:51 GMT""}]","2023-02-21"
"2209.01955","Gaoping Long","Gaoping Long, Xiangdong Zhang","On the gauge reduction with respect to simplicity constraint in all
  dimensional loop quantum gravity",,,"10.1103/PhysRevD.107.046022",,"gr-qc","http://creativecommons.org/licenses/by-nc-nd/4.0/","  In this paper, we are going to discuss the gauge reduction with respect to
the simplicity constraint in both classical and quantum theory of all
dimensional loop quantum gravity. With the gauge reduction with respect to
edge-simplicity constraint being proceeded and the anomalous vertex simplicity
constraint being imposed weakly in holonomy-flux phase space, the simplicity
reduced holonomy can be established. However, we find that the simplicity
reduced holonomy can not capture the degrees of freedom of intrinsic curvature,
which leads that it fails to construct a correct scalar constraint operator in
all dimensional LQG following the standard strategy. To tackle this problem, we
establish a new type of holonomy corresponding to the simplicity reduced
connection, which captures the degrees of freedom of both intrinsic and
extrinsic curvature properly. Based on this new type of holonomy, we propose
three new strategies to construct the scalar constraint operators, which serve
as valuable candidates to study the dynamics of all dimensional LQG in the
future.
","[{""version"":""v1"",""created"":""Mon, 5 Sep 2022 13:20:08 GMT""}]","2023-03-08"
"2209.01956","Yiyan Huang","Yiyan Huang, Cheuk Hang Leung, Shumin Ma, Qi Wu, Dongdong Wang,
  Zhixiang Huang","Moderately-Balanced Representation Learning for Treatment Effects with
  Orthogonality Information","This paper was accepted and will be published at the 19th Pacific Rim
  International Conference on Artificial Intelligence (PRICAI2022)",,,,"cs.LG cs.AI stat.ME","http://arxiv.org/licenses/nonexclusive-distrib/1.0/","  Estimating the average treatment effect (ATE) from observational data is
challenging due to selection bias. Existing works mainly tackle this challenge
in two ways. Some researchers propose constructing a score function that
satisfies the orthogonal condition, which guarantees that the established ATE
estimator is ""orthogonal"" to be more robust. The others explore representation
learning models to achieve a balanced representation between the treated and
the controlled groups. However, existing studies fail to 1) discriminate
treated units from controlled ones in the representation space to avoid the
over-balanced issue; 2) fully utilize the ""orthogonality information"". In this
paper, we propose a moderately-balanced representation learning (MBRL)
framework based on recent covariates balanced representation learning methods
and orthogonal machine learning theory. This framework protects the
representation from being over-balanced via multi-task learning.
Simultaneously, MBRL incorporates the noise orthogonality information in the
training and validation stages to achieve a better ATE estimation. The
comprehensive experiments on benchmark and simulated datasets show the
superiority and robustness of our method on treatment effect estimations
compared with existing state-of-the-art methods.
","[{""version"":""v1"",""created"":""Mon, 5 Sep 2022 13:20:12 GMT""}]","2022-09-07"
"2209.01957","Chupeng Ma","Chupeng Ma, Jens Markus Melenk","Exponential convergence of a generalized FEM for heterogeneous
  reaction-diffusion equations",,,,,"math.NA cs.NA","http://arxiv.org/licenses/nonexclusive-distrib/1.0/","  A generalized finite element method is proposed for solving a heterogeneous
reaction-diffusion equation with a singular perturbation parameter
$\varepsilon$, based on locally approximating the solution on each subdomain by
solution of a local reaction-diffusion equation and eigenfunctions of a local
eigenproblem. These local problems are posed on some domains slightly larger
than the subdomains with oversampling size $\delta^{\ast}$. The method is
formulated at the continuous level as a direct discretization of the continuous
problem and at the discrete level as a coarse-space approximation for its
standard FE discretizations. Exponential decay rates for local approximation
errors with respect to $\delta^{\ast}/\varepsilon$ and $\delta^{\ast}/h$ (at
the discrete level with $h$ denoting the fine FE mesh size) and with the local
degrees of freedom are established. In particular, it is shown that the method
at the continuous level converges uniformly with respect to $\varepsilon$ in
the standard $H^{1}$ norm, and that if the oversampling size is relatively
large with respect to $\varepsilon$ and $h$ (at the discrete level), the
solutions of the local reaction-diffusion equations provide good local
approximations for the solution and thus the local eigenfunctions are not
needed. Numerical results are provided to verify the theoretical results.
","[{""version"":""v1"",""created"":""Mon, 5 Sep 2022 13:20:38 GMT""},{""version"":""v2"",""created"":""Thu, 8 Sep 2022 16:10:23 GMT""}]","2022-09-09"
"2209.01958","Kouhei Nakaji","Kouhei Nakaji, Hiroyuki Tezuka, Naoki Yamamoto","Deterministic and random features for large-scale quantum kernel machine","19 pages, 2 figures",,,,"quant-ph","http://creativecommons.org/licenses/by/4.0/","  Quantum machine learning (QML) is the spearhead of quantum computer
applications. In particular, quantum neural networks (QNN) are actively studied
as the method that works both in near-term quantum computers and fault-tolerant
quantum computers. Recent studies have shown that supervised machine learning
with QNN can be interpreted as the quantum kernel method (QKM), suggesting that
enhancing the practicality of the QKM is the key to building near-term
applications of QML. However, the QKM is also known to have two severe issues.
One is that the QKM with the (inner-product based) quantum kernel defined in
the original large Hilbert space does not generalize; namely, the model fails
to find patterns of unseen data. The other one is that the classical
computational cost of the QKM increases at least quadratically with the number
of data, and therefore, QKM is not scalable with data size. This paper aims to
provide algorithms free from both of these issues. That is, for a class of
quantum kernels with generalization capability, we show that the QKM with those
quantum kernels can be made scalable by using our proposed deterministic and
random features. Our numerical experiment, using datasets including $O(1,000)
\sim O(10,000)$ training data, supports the validity of our method.
","[{""version"":""v1"",""created"":""Mon, 5 Sep 2022 13:22:34 GMT""}]","2022-09-07"
"2209.01959","Matheus Fabri","Matheus Fabri","Hexagonalization in $AdS_3 \times S^3 \times T^4$: Mirror Corrections","13 pages, 5 figures",,"10.1103/PhysRevD.106.126008",,"hep-th","http://arxiv.org/licenses/nonexclusive-distrib/1.0/","  A big open problem in $AdS_3 \times S^3 \times T^4$ holographic duality is to
compute the CFT data of the dual theory. In this direction recently it was
introduced the hexagonalization framework in the $AdS_3$ context. It allows the
computation of the structure constants of the CFT$_2$ dual in the planar limit
non-perturbatively, however in this proposal it was introduced only the
asymptotic part of the hexagon valid for correlators with asymptotically large
bridge lengths. In this work we complete this picture by computing the so
called mirror corrections that allow to describe structure constants for finite
bridge lengths and as a byproduct we also prove that the half-BPS operators in
the theory do not receive these corrections. We end up by giving the first
steps on using hexagonalization to compute $n$-point functions in the $AdS_3
\times S^3 \times T^4$ holographic duality.
","[{""version"":""v1"",""created"":""Mon, 5 Sep 2022 13:23:37 GMT""}]","2022-12-28"
"2209.01960","Edgard Pimentel","Edgard A. Pimentel and Miguel Walker","Potential estimates for fully nonlinear elliptic equations with bounded
  ingredients",,,,,"math.AP","http://arxiv.org/licenses/nonexclusive-distrib/1.0/","  We examine $L^p$-viscosity solutions to fully nonlinear elliptic equations
with bounded-measurable ingredients. By considering $p_0<p<d$, we focus on
gradient-regularity estimates stemming from nonlinear potentials. We find
conditions for local Lipschitz-continuity of the solutions and continuity of
the gradient. We briefly survey recent breakthroughs in regularity theory
arising from (nonlinear) potential estimates. Our findings follow from -- and
are inspired by -- fundamental facts in the theory of $L^p$-viscosity
solutions, and results in the work of Panagiota Daskalopoulos, Tuomo Kuusi and
Giuseppe Mingione [10].
","[{""version"":""v1"",""created"":""Mon, 5 Sep 2022 13:27:24 GMT""}]","2022-09-07"
"2209.01961","Ricky Xiaofeng Chen","Zi-Wei Bai, Ricky X. F. Chen","New equidistributions on plane trees and decompositions of
  $132$-avoiding permutations","rewording, made some clarifications, added connection to Motzkin
  numbers. Comments are all welcome",,,,"math.CO","http://arxiv.org/licenses/nonexclusive-distrib/1.0/","  Our main results in this paper are new equidistributions on plane trees and
$132$-avoiding permutations, two closely related objects. As for the former, we
discover a characteristic for vertices of plane trees that is equally
distributed as the height for vertices. The latter is concerned with four
distinct ways of decomposing a $132$-avoiding permutation into subsequences. We
show combinatorially that the subsequence length distributions of the four
decompositions are mutually equivalent, and there is a way to group the four
into two groups such that each group is symmetric and the joint length
distribution of one group is the same as that of the other. Some consequences
are discussed. For instance, we provide a new refinement of the
equidistribution of internal vertices and leaves, and present new sets of
$132$-avoiding permutations that are counted by the Motzkin numbers and their
refinements.
","[{""version"":""v1"",""created"":""Mon, 5 Sep 2022 13:28:31 GMT""},{""version"":""v2"",""created"":""Thu, 2 Feb 2023 04:30:54 GMT""}]","2023-02-03"
"2209.01962","Han Wu","Han Wu, Syed Yunas, Sareh Rowlands, Wenjie Ruan, and Johan Wahlstrom","Adversarial Detection: Attacking Object Detection in Real Time","Accepted by IEEE Intelligent Vehicle Symposium, 2023",,,,"cs.AI cs.CV cs.RO","http://creativecommons.org/licenses/by-nc-sa/4.0/","  Intelligent robots rely on object detection models to perceive the
environment. Following advances in deep learning security it has been revealed
that object detection models are vulnerable to adversarial attacks. However,
prior research primarily focuses on attacking static images or offline videos.
Therefore, it is still unclear if such attacks could jeopardize real-world
robotic applications in dynamic environments. This paper bridges this gap by
presenting the first real-time online attack against object detection models.
We devise three attacks that fabricate bounding boxes for nonexistent objects
at desired locations. The attacks achieve a success rate of about 90% within
about 20 iterations. The demo video is available at
https://youtu.be/zJZ1aNlXsMU.
","[{""version"":""v1"",""created"":""Mon, 5 Sep 2022 13:32:41 GMT""},{""version"":""v2"",""created"":""Fri, 16 Sep 2022 01:54:33 GMT""},{""version"":""v3"",""created"":""Wed, 1 Feb 2023 10:10:02 GMT""},{""version"":""v4"",""created"":""Tue, 4 Apr 2023 14:56:39 GMT""},{""version"":""v5"",""created"":""Wed, 31 May 2023 10:54:05 GMT""}]","2023-06-01"
"2209.01963","Yuncong Li","Yuncong Li, Cunxiang Yin, Yancheng He, Guoqiang Xu, Jing Cai, Leeven
  Luo, Sheng-hua Zhong","Modeling User Repeat Consumption Behavior for Online Novel
  Recommendation","RecSys 2022",,,,"cs.IR","http://arxiv.org/licenses/nonexclusive-distrib/1.0/","  Given a user's historical interaction sequence, online novel recommendation
suggests the next novel the user may be interested in. Online novel
recommendation is important but underexplored. In this paper, we concentrate on
recommending online novels to new users of an online novel reading platform,
whose first visits to the platform occurred in the last seven days. We have two
observations about online novel recommendation for new users. First, repeat
novel consumption of new users is a common phenomenon. Second, interactions
between users and novels are informative. To accurately predict whether a user
will reconsume a novel, it is crucial to characterize each interaction at a
fine-grained level. Based on these two observations, we propose a neural
network for online novel recommendation, called NovelNet. NovelNet can
recommend the next novel from both the user's consumed novels and new novels
simultaneously. Specifically, an interaction encoder is used to obtain accurate
interaction representation considering fine-grained attributes of interaction,
and a pointer network with a pointwise loss is incorporated into NovelNet to
recommend previously-consumed novels. Moreover, an online novel recommendation
dataset is built from a well-known online novel reading platform and is
released for public use as a benchmark. Experimental results on the dataset
demonstrate the effectiveness of NovelNet.
","[{""version"":""v1"",""created"":""Mon, 5 Sep 2022 13:37:59 GMT""}]","2022-09-07"
"2209.01964","David  Garofalo","David Garofalo and Chandra B. Singh","The unusual active galaxy H1821+643 and the elusive nature of FRI
  quasars","in press","Publications of the Astronomical Society of the Pacific 2022","10.1088/1538-3873/ac883a",,"astro-ph.HE astro-ph.GA","http://creativecommons.org/licenses/by/4.0/","  The moderate spin estimate for the black hole at the center of the cool core
cluster H1821+643 motivates the completion of a story about this object's
origin and evolution that was in the making since the work by Blundell and
Rawlings over two decades ago as the first example of a massive black hole
accreting at near Eddington rates with an FRI jet. This elusive combination of
properties was explained in our 2010 model where we showed it to be part of a
small parameter space that includes X shaped radio galaxies. As an accreting
black hole that never experienced a counterrotating phase, H1821+643 is
constrained by theory to produce a jet for spin values between 0.1 and about
0.7 and an FRI jet for a slightly smaller range. The feedback from such a black
hole is not subject to a tilted jet and is why star formation rates remain high
in this cluster environment. The prediction is that H1821+643 is within
millions of years of becoming jetless.
","[{""version"":""v1"",""created"":""Mon, 5 Sep 2022 13:42:43 GMT""}]","2022-09-21"
"2209.01965","David  Garofalo","David Garofalo and Ektoras Pouliasis","Peculiar black hole accretion rates in AGN with highest star formation
  rates in the universe","in press","Publications of the Astronomical Society of the Pacific 2022","10.1088/1538-3873/ac8f70",,"astro-ph.HE astro-ph.GA","http://creativecommons.org/licenses/by/4.0/","  Pouliasis et al (2022b) explored star formation rates, black hole accretion
rates, and stellar mass of active galaxies at redshift above 3.5, uncovering a
leveling off of the star formation rate at high stellar mass, which they
consider to be evidence of AGN feedback. Their data shows that as AGN approach
the flattening of the curve in the star formation rate - stellar mass plane,
the accretion rates begin to drop. We describe the nature of the AGN feedback
responsible for this in terms of powerful FRII jets enhancing star formation
rates but eventually also triggering a shift in accretion from near-Eddington
rates to advection dominated. These systems are on the cusp of a dramatic
transition where the active galaxy goes from strong enhancement to large
suppression of star formation in a way that produces the steeper slope for
radio AGN at low redshift compared to radio AGN at higher redshift and to
jetless AGN. We argue, therefore, that the data of Pouliasis et al constitute
the high redshift objects predicted by Singh et al (2021) that connect to the
low redshift behavior of radio AGN shown in Comerford et al (2020).
","[{""version"":""v1"",""created"":""Mon, 5 Sep 2022 13:42:52 GMT""}]","2022-09-28"
"2209.01966","V. Didenko","V.E. Didenko","On holomorphic sector of higher-spin theory","37 pages. Few typos fixed. A major simplification of the projector
  identity resulted in the new form of eq. (4.11). Appendix B is extended
  correspondingly",,"10.1007/JHEP10(2022)191",,"hep-th","http://arxiv.org/licenses/nonexclusive-distrib/1.0/","  Recent investigation of locality problem for higher-spin fields led to a
vertex reconstruction procedure that involved elements of contraction of the
original Vasiliev interaction algebra. Inspired by these results we propose the
Vasiliev-like generating equations for holomorphic higher-spin interactions in
four dimensions based on the observed contracted algebra. We specify the
functional class that admits evolution on the proposed equations and brings in
a systematic procedure of extracting all-order holomorphic vertices. A simple
consequence of the proposed equations is space-time locality of the gauge field
sector. We also show that vertices come with a remarkable shift symmetry.
","[{""version"":""v1"",""created"":""Mon, 5 Sep 2022 13:43:36 GMT""},{""version"":""v2"",""created"":""Mon, 7 Nov 2022 11:33:58 GMT""},{""version"":""v3"",""created"":""Wed, 7 Dec 2022 16:38:58 GMT""}]","2022-12-08"
"2209.01967","Junkyu Jang","JunKyu Jang and Sung-Hyuk Park","HAGCN : Network Decentralization Attention Based Heterogeneity-Aware
  Spatiotemporal Graph Convolution Network for Traffic Signal Forecasting",,,,,"cs.LG","http://arxiv.org/licenses/nonexclusive-distrib/1.0/","  The construction of spatiotemporal networks using graph convolution networks
(GCNs) has become one of the most popular methods for predicting traffic
signals. However, when using a GCN for traffic speed prediction, the
conventional approach generally assumes the relationship between the sensors as
a homogeneous graph and learns an adjacency matrix using the data accumulated
by the sensors. However, the spatial correlation between sensors is not
specified as one but defined differently from various viewpoints. To this end,
we aim to study the heterogeneous characteristics inherent in traffic signal
data to learn the hidden relationships between sensors in various ways.
Specifically, we designed a method to construct a heterogeneous graph for each
module by dividing the spatial relationship between sensors into static and
dynamic modules. We propose a network decentralization attention based
heterogeneity-aware graph convolution network (HAGCN) method that aggregates
the hidden states of adjacent nodes by considering the importance of each
channel in a heterogeneous graph. Experimental results on real traffic datasets
verified the effectiveness of the proposed method, achieving a 6.35%
improvement over the existing model and realizing state-of-the-art prediction
performance.
","[{""version"":""v1"",""created"":""Mon, 5 Sep 2022 13:45:52 GMT""}]","2022-09-07"
