"2205.02303","Georgios Sidiropoulos","Georgios Sidiropoulos and Evangelos Kanoulas","Analysing the Robustness of Dual Encoders for Dense Retrieval Against
  Misspellings","Accepted at the 45th International ACM SIGIR Conference on Research
  and Development in Information Retrieval (SIGIR 2022)",,"10.1145/3477495.3531818",,"cs.IR","http://arxiv.org/licenses/nonexclusive-distrib/1.0/","  Dense retrieval is becoming one of the standard approaches for document and
passage ranking. The dual-encoder architecture is widely adopted for scoring
question-passage pairs due to its efficiency and high performance. Typically,
dense retrieval models are evaluated on clean and curated datasets. However,
when deployed in real-life applications, these models encounter noisy
user-generated text. That said, the performance of state-of-the-art dense
retrievers can substantially deteriorate when exposed to noisy text. In this
work, we study the robustness of dense retrievers against typos in the user
question. We observe a significant drop in the performance of the dual-encoder
model when encountering typos and explore ways to improve its robustness by
combining data augmentation with contrastive learning. Our experiments on two
large-scale passage ranking and open-domain question answering datasets show
that our proposed approach outperforms competing approaches. Additionally, we
perform a thorough analysis on robustness. Finally, we provide insights on how
different typos affect the robustness of embeddings differently and how our
method alleviates the effect of some typos but not of others.
","[{""version"":""v1"",""created"":""Wed, 4 May 2022 19:48:13 GMT""}]","2022-05-06"
"2205.02304","Rudy Geelen","Rudy Geelen, Stephen Wright, Karen Willcox","Operator inference for non-intrusive model reduction with quadratic
  manifolds",,,"10.1016/j.cma.2022.115717",,"math.NA cs.NA","http://arxiv.org/licenses/nonexclusive-distrib/1.0/","  This paper proposes a novel approach for learning a data-driven quadratic
manifold from high-dimensional data, then employing this quadratic manifold to
derive efficient physics-based reduced-order models. The key ingredient of the
approach is a polynomial mapping between high-dimensional states and a
low-dimensional embedding. This mapping consists of two parts: a representation
in a linear subspace (computed in this work using the proper orthogonal
decomposition) and a quadratic component. The approach can be viewed as a form
of data-driven closure modeling, since the quadratic component introduces
directions into the approximation that lie in the orthogonal complement of the
linear subspace, but without introducing any additional degrees of freedom to
the low-dimensional representation. Combining the quadratic manifold
approximation with the operator inference method for projection-based model
reduction leads to a scalable non-intrusive approach for learning reduced-order
models of dynamical systems. Applying the new approach to transport-dominated
systems of partial differential equations illustrates the gains in efficiency
that can be achieved over approximation in a linear subspace.
","[{""version"":""v1"",""created"":""Wed, 4 May 2022 19:50:43 GMT""},{""version"":""v2"",""created"":""Wed, 28 Sep 2022 04:31:06 GMT""},{""version"":""v3"",""created"":""Wed, 23 Nov 2022 17:31:10 GMT""},{""version"":""v4"",""created"":""Mon, 26 Dec 2022 20:07:02 GMT""}]","2022-12-29"
"2205.02305","Ray Osborn","Puspa Upreti, Matthew Krogstad, Charlotte Haley, Mihai Anitescu,
  Vishwas Rao, Lekh Poudel, Omar Chmaissem, Stephan Rosenkranz and Raymond
  Osborn","Order-Disorder Transitions in (Ca$_x$Sr$_{1-x}$)$_3$Rh$_4$Sn$_{13}$","5 pages, 4 figures","Phys Rev Lett 128, 095701 (2022)","10.1103/PhysRevLett.128.095701",,"cond-mat.str-el cond-mat.mtrl-sci","http://arxiv.org/licenses/nonexclusive-distrib/1.0/","  The classification of structural phase transitions as displacive or
order-disorder in character is usually based on spectroscopic data above the
transition. We use single crystal x-ray diffraction to investigate structural
correlations in the quasi-skutterudites, (Ca$_x$Sr$_{1-x}$)$_3$Rh$_4$Sn$_{13}$,
which have a quantum phase transition at $x\sim0.9$. Three-dimensional pair
distribution functions show that the amplitudes of local atomic displacements
are temperature-independent below the transition and persist to well above the
transition, a signature of order-disorder behavior. The implications for the
associated electronic transitions are discussed.
","[{""version"":""v1"",""created"":""Wed, 4 May 2022 19:52:45 GMT""}]","2022-05-11"
"2205.02306","Haifeng Wang","Hai-Feng Wang (Paris Obs.), Francois Hammer (Paris Obs.), Yan-Bin Yang
  (Paris Obs.), Jian-Ling Wang (NAOC)","The Dark Matter Tidal Stripping History of the Sagittarius Core with
  N-body simulations","9 pages, 5 figures,1 table. Accepted for publication in ApJL",,"10.3847/2041-8213/ac9ccf",,"astro-ph.GA","http://arxiv.org/licenses/nonexclusive-distrib/1.0/","  The infall of the Sagittarius (Sgr) Dwarf Spheroidal Galaxy in the Milky Way
halo is an unique opportunity to understand how the different components of a
dwarf galaxy could be tidally removed. In this work, we reconstruct the Sgr
core morphology and kinematics on the basis of a model that has already
successfully reproduced the Sgr stream. Here we use a very high resolution
model that almost resolves individual stars in the Sgr core. It reproduces most
of the observed morphology and kinematic properties, without specific
fine-tuning. We also show that the dark matter may have been almost entirely
stripped by Milky Way tides after two passages at pericenter. Finally the model
predicts that the Sgr core will be fully disrupted within the next 2 Gyr.
","[{""version"":""v1"",""created"":""Wed, 4 May 2022 19:54:19 GMT""},{""version"":""v2"",""created"":""Sat, 4 Jun 2022 10:26:04 GMT""},{""version"":""v3"",""created"":""Mon, 24 Oct 2022 15:02:26 GMT""}]","2022-11-30"
"2205.02307","Joaquim Dias Garcia","Joaquim Dias Garcia and Guilherme Bodin and Alexandre Street","BilevelJuMP.jl: Modeling and Solving Bilevel Optimization in Julia",,,,,"math.OC cs.MS","http://arxiv.org/licenses/nonexclusive-distrib/1.0/","  In this paper we present BilevelJuMP, a new Julia package to support bilevel
optimization within the JuMP framework. The package is a Julia library that
enables the user to describe both upper and lower-level optimization problems
using the JuMP algebraic syntax. Due to the generality and flexibility our
library inherits from JuMP's syntax, our package allows users to model bilevel
optimization problems with conic constraints in the lower level and all JuMP
supported constraints in the upper level (Conic, Quadratic, Non-Linear,
Integer, etc.). Moreover, the user-defined problem can be subsequently solved
by various techniques relying on mathematical program with equilibrium
constraints (MPEC) reformulations. Manipulations on the original problem data
are possible due to MathOptInterface.jl's structures and Dualization.jl
features. Hence, the proposed package allows quickly model, deploy, and thereby
experiment bilevel models based on off-the-shelf mixed integer linear
programming and nonlinear solvers.
","[{""version"":""v1"",""created"":""Wed, 4 May 2022 20:00:51 GMT""},{""version"":""v2"",""created"":""Fri, 3 Jun 2022 23:16:33 GMT""},{""version"":""v3"",""created"":""Tue, 7 Jun 2022 03:20:07 GMT""}]","2022-12-21"
"2205.02308","Kuangyin Deng","Kuangyin Deng, Xin Li, Benedetta Flebus","Exceptional points as signatures of dynamical magnetic phase transitions",,"Phys. Rev. B 107, L100402 (2023)","10.1103/PhysRevB.107.L100402",,"cond-mat.mes-hall","http://arxiv.org/licenses/nonexclusive-distrib/1.0/","  One of the most fascinating and puzzling aspects of non-Hermitian systems is
their spectral degeneracies, i.e., exceptional points (EPs), at which both
eigenvalues and eigenvectors coalesce to form a defective state space. While
coupled magnetic systems are natural hosts of EPs, the relation between the
linear and nonlinear spin dynamics in the proximity of EPs remains relatively
unexplored. Here we theoretically investigate the spin dynamics of easy-plane
magnetic bilayers in the proximity of exceptional points. We show that the
interplay between the intrinsically dissipative spin dynamics and external
drives can yield a rich dynamical phase diagram. In particular, we find that,
in antiferromagnetically coupled bilayers, a periodic oscillating dynamical
phase emerges in the region enclosed by EPs. Our results not only offer a
pathway for probing magnetic EPs and engineering magnetic nano-oscillators with
large-amplitude oscillations, but also uncover the relation between exceptional
points and dynamical phase transitions in systems displaying non-linearities.
","[{""version"":""v1"",""created"":""Wed, 4 May 2022 20:01:15 GMT""},{""version"":""v2"",""created"":""Mon, 6 Mar 2023 22:21:06 GMT""}]","2023-03-08"
"2205.02309","Sharan Narasimhan","Sharan Narasimhan, Suvodip Dey, Maunendra Sankar Desarkar","Towards Robust and Semantically Organised Latent Representations for
  Unsupervised Text Style Transfer","NAACL 2022 Main Conference paper",,,,"cs.CL","http://arxiv.org/licenses/nonexclusive-distrib/1.0/","  Recent studies show that auto-encoder based approaches successfully perform
language generation, smooth sentence interpolation, and style transfer over
unseen attributes using unlabelled datasets in a zero-shot manner. The latent
space geometry of such models is organised well enough to perform on datasets
where the style is ""coarse-grained"" i.e. a small fraction of words alone in a
sentence are enough to determine the overall style label. A recent study uses a
discrete token-based perturbation approach to map ""similar"" sentences
(""similar"" defined by low Levenshtein distance/ high word overlap) close by in
latent space. This definition of ""similarity"" does not look into the underlying
nuances of the constituent words while mapping latent space neighbourhoods and
therefore fails to recognise sentences with different style-based semantics
while mapping latent neighbourhoods. We introduce EPAAEs (Embedding Perturbed
Adversarial AutoEncoders) which completes this perturbation model, by adding a
finely adjustable noise component on the continuous embeddings space. We
empirically show that this (a) produces a better organised latent space that
clusters stylistically similar sentences together, (b) performs best on a
diverse set of text style transfer tasks than similar denoising-inspired
baselines, and (c) is capable of fine-grained control of Style Transfer
strength. We also extend the text style transfer tasks to NLI datasets and show
that these more complex definitions of style are learned best by EPAAE. To the
best of our knowledge, extending style transfer to NLI tasks has not been
explored before.
","[{""version"":""v1"",""created"":""Wed, 4 May 2022 20:04:24 GMT""}]","2022-05-06"
"2205.02310","Andrea Mario Lavezzi","Michele Battisti, Andrea Mario Lavezzi, Roberto Musotto","Organizing Crime: an Empirical Analysis of the Sicilian Mafia",,,,,"physics.soc-ph econ.GN q-fin.EC","http://arxiv.org/licenses/nonexclusive-distrib/1.0/","  In this article we study the organizational structure of a large group of
members of the Sicilian Mafia by means of social network analysis and an
econometric analysis of link formation. Our mains results are the following. i)
The Mafia network is a small-world network adjusted by its criminal nature, and
is strongly disassortative. ii) Mafia bosses are not always central in the
network. In particular, consistent with a prediction of Baccara and Bar-Isaac,
we identify a ""cell-dominated hierarchy"" in the network: a key member is not
central, but is connected to a relative with a central position. iii) The
probability of link formation between two agents is higher if the two agents
belong to the same Mandamento, if they share a high number of similar tasks,
while being a ""boss"" reduces the probability of link formation between them.
iv) The probability of link formation for an individual agent is higher if he
is in charge of keeping connections outside his Mandamento, of collecting
protection money and or having a directive role, while age has modest role.
These results are interpreted in the light of the efficiency/security trade-off
faced by the Mafia and of its known hierarchical structure.
","[{""version"":""v1"",""created"":""Wed, 4 May 2022 20:07:02 GMT""}]","2022-05-06"
"2205.02312","Di Fang","Zhenning Cai, Di Fang, Jianfeng Lu","Asymptotic analysis of diabatic surface hopping algorithm in the
  adiabatic and non-adiabatic limits",,,,,"math.NA cs.NA math-ph math.MP quant-ph","http://creativecommons.org/licenses/by-nc-nd/4.0/","  Surface hopping algorithms, as an important class of quantum dynamics
simulation algorithms for non-adiabatic dynamics, are typically performed in
the adiabatic representation, which can break down in the presence of
ill-defined adiabatic potential energy surfaces (PESs) and adiabatic coupling
term. Another issue of surface hopping algorithms is the difficulty in
capturing the correct scaling of the transition rate in the Marcus
(weak-coupling/non-adiabatic) regime. Though the first issue can be
circumvented by exploiting the diabatic representation, diabatic surface
hopping algorithms usually lack justification on the theoretical level. We
consider the diabatic surface hopping algorithm proposed in [Fang, Lu.
Multiscale Model. Simul. 16:4, 1603-1622, 2018] and provide the asymptotic
analysis of the transition rate in the Marcus regime that justifies the correct
scaling for the spin-boson model. We propose two conditions that guarantee the
correctness for general potentials. In the opposite (strong-coupling/adiabatic)
regime, we derive the asymptotic behavior of the algorithm that interestingly
matches a type of mean-field description. The techniques used here may shed
light on the analysis for other diabatic-based algorithms.
","[{""version"":""v1"",""created"":""Wed, 4 May 2022 20:13:58 GMT""}]","2022-05-06"
"2205.02313","Puru Gujrati","P.D. Gujrati","Maxwell's Conjecture of the Demon creating a Temperature Difference is
  False","4 pages, 1 figure",,,"UATP/2203","cond-mat.stat-mech physics.class-ph","http://creativecommons.org/licenses/by/4.0/","  We argue that Maxwell's demon is incapable of creating a nonzero temperature
difference. Hence, it does not destroy equilibrium and the second law is never
at risk, contrary to the claim by Maxwell and accepted by many. It is therefore
remarkable that despite this, the demon paradox has been a valuable source of
new ideas. We use two independent arguments, one using classical equilibrium
thermodynamics by extending Brillouin's approach, and the other one using
equilibrium statistical mechanics and the central limit theorem.
","[{""version"":""v1"",""created"":""Wed, 4 May 2022 20:17:13 GMT""},{""version"":""v2"",""created"":""Fri, 6 May 2022 14:09:12 GMT""}]","2022-05-09"
"2205.02314","The CMS Collaboration","CMS Collaboration","Search for CP violation using $\mathrm{t\bar{t}}$ events in the
  lepton+jets channel in pp collisions at $\sqrt{s}$ = 13 TeV","Submitted to the Journal of High Energy Physics. All figures and
  tables can be found at
  http://cms-results.web.cern.ch/cms-results/public-results/publications/TOP-20-005
  (CMS Public Pages)",,,"CMS-TOP-20-005, CERN-EP-2022-051","hep-ex","http://creativecommons.org/licenses/by/4.0/","  Results are presented on a search for CP violation in the production and
decay of top quark-antiquark pairs in the lepton+jets channel. The search is
based on data from proton-proton collisions at 13 TeV, collected with the CMS
detector, corresponding to an integrated luminosity of 138 fb$^{-1}$. Possible
CP violation effects are evaluated by measuring uncorrected asymmetries in
observables constructed from linearly independent four-momentum vectors of the
final-state particles. The dimensionless chromoelectric dipole moment of the
top quark obtained from the observed asymmetries is measured to be 0.04 $\pm$
0.10 (stat) $\pm$ 0.07 (syst), and the asymmetries exhibit no evidence for
CP-violating effects, consistent with expectations from the standard model.
","[{""version"":""v1"",""created"":""Wed, 4 May 2022 20:19:48 GMT""}]","2022-05-06"
"2205.02315","Ian Nodurft","Ian C. Nodurft, Harry C. Shaw, Ryan T. Glasser, Brian T. Kirby, and
  Thomas A. Searles","Generation of polarization entanglement via the quantum Zeno effect",,,"10.1364/OE.464550",,"quant-ph","http://arxiv.org/licenses/nonexclusive-distrib/1.0/","  The quantum Zeno effect reveals that the continuous observation of a quantum
system can result in significant alterations to its evolution. Here, we present
a method for establishing polarization entanglement between two initially
unentangled photons in coupled waveguides via the quantum Zeno effect. We
support our analytical investigation with numerical simulations of the
underlying Schrodinger equation describing the system. Further, we extend our
technique to three coupled waveguides in a planar configuration and determine
the parameter regime required to generate three-qubit W-states. Our findings
offer a powerful quantum state engineering approach for photonic quantum
information technologies.
","[{""version"":""v1"",""created"":""Wed, 4 May 2022 20:33:13 GMT""},{""version"":""v2"",""created"":""Fri, 6 May 2022 17:01:50 GMT""}]","2022-08-31"
"2205.02316","Yamir Moreno","Hugo Perez-Martinez, Carlos Gracia-Lazaro, Fabio Dercole and Yamir
  Moreno","Cooperation in costly-access environments","13 pages including 7 figures. Submitted for publication",,"10.1088/1367-2630/ac7b9d",,"physics.soc-ph","http://creativecommons.org/licenses/by/4.0/","  Understanding cooperative behavior in biological and social systems
constitutes a scientific challenge, being the object of intense research over
the past decades. Many mechanisms have been proposed to explain the presence
and persistence of cooperation in those systems, showing that there is no
unique explanation, as different scenarios have different possible driving
forces. In this paper, we propose a model to study situations in which
voluntary participation involves an access cost to the cooperative interaction,
besides the cost associated with cooperation. The proposed Costly-Access
Prisoner's Dilemma, a symmetric donation game with voluntary and costly
participation, breaks the symmetry between abstainers and participants of the
Voluntary Prisoner's Dilemma. A mean-field approach shows that, in well-mixed
populations, the dynamic always leads the system to abstention. However,
depending on the return parameter, numerical simulations in structured
populations display an alternating behavior between mono-strategic,
multi-stable, and coexistence phases. This behavior is fully explained through
a theoretical analysis of the strategic motifs, the transitions being
determined by the change in stability of those motifs.
","[{""version"":""v1"",""created"":""Wed, 4 May 2022 20:33:46 GMT""}]","2022-08-24"
"2205.02317","Ali Bagci","A. Ba\u{g}c{\i}, P. E. Hoggan","I. Complete and orthonormal sets of exponential-type orbitals with
  noninteger principal quantum numbers",,,,,"physics.chem-ph","http://creativecommons.org/licenses/by-nc-sa/4.0/","  The definition for the Slater-type orbitals is generalized. Transformation
between an orthonormal basis function and the Slater-type orbital with
non-integer principal quantum numbers is investigated. Analytical expressions
for the linear combination coefficients are derived. In order to test the
accuracy of the formulas, the numerical Gram-Schmidt procedure is performed for
the non-integer Slater-type orbitals. A closed form expression for the
orthogonalized Slater-type orbitals is achieved. It is used to generalize
complete orthonormal sets of exponential-type orbitals obtained by Guseinov in
[Int. J. Quant. Chem. 90, 114 (2002)] to non-integer values of principal
quantum numbers. Riemann-Liouville type fractional calculus operators are
considered to be use in atomic and molecular physics. It is shown that the
relativistic molecular auxiliary functions and their analytical solutions for
positive real values of parameters on arbitrary range are the natural
Riemann-Liouville type fractional operators.
","[{""version"":""v1"",""created"":""Wed, 4 May 2022 20:37:44 GMT""},{""version"":""v2"",""created"":""Wed, 11 May 2022 21:24:54 GMT""},{""version"":""v3"",""created"":""Mon, 3 Oct 2022 17:52:40 GMT""},{""version"":""v4"",""created"":""Thu, 6 Oct 2022 00:06:34 GMT""},{""version"":""v5"",""created"":""Mon, 10 Oct 2022 11:14:06 GMT""}]","2022-10-11"
"2205.02318","Stephen Bach","Ryan Smith and Jason A. Fries and Braden Hancock and Stephen H. Bach","Language Models in the Loop: Incorporating Prompting into Weak
  Supervision",,,,,"cs.LG cs.CL","http://arxiv.org/licenses/nonexclusive-distrib/1.0/","  We propose a new strategy for applying large pre-trained language models to
novel tasks when labeled training data is limited. Rather than apply the model
in a typical zero-shot or few-shot fashion, we treat the model as the basis for
labeling functions in a weak supervision framework. To create a classifier, we
first prompt the model to answer multiple distinct queries about an example and
define how the possible responses should be mapped to votes for labels and
abstentions. We then denoise these noisy label sources using the Snorkel system
and train an end classifier with the resulting training data. Our experimental
evaluation shows that prompting large language models within a weak supervision
framework can provide significant gains in accuracy. On the WRENCH weak
supervision benchmark, this approach can significantly improve over zero-shot
performance, an average 19.5% reduction in errors. We also find that this
approach produces classifiers with comparable or superior accuracy to those
trained from hand-engineered rules.
","[{""version"":""v1"",""created"":""Wed, 4 May 2022 20:42:40 GMT""}]","2022-05-06"
"2205.02319","Dylan Altschuler","Dylan J. Altschuler","Critical Window of The Symmetric Perceptron","Revised the introduction and corrected some typos",,,,"math.PR cs.DM math-ph math.CO math.MP","http://creativecommons.org/licenses/by/4.0/","  We study the critical window of the symmetric binary perceptron, or
equivalently, combinatorial discrepancy. Consider the problem of finding a
binary vector $\sigma$ satisfying $\|A\sigma\|_\infty \le K$, where $A$ is an
$\alpha n \times n$ matrix with iid Gaussian entries. For fixed $K$, at which
densities $\alpha$ is this constraint satisfaction problem (CSP) satisfiable? A
sharp threshold was recently established by Perkins and Xu, and Abbe, Li, and
Sly , answering this to first order. Namely, for each $K$ there exists an
explicit critical density $\alpha_c$ so that for any fixed $\epsilon > 0$, with
high probability the CSP is satisfiable for $\alpha n < (\alpha_c - \epsilon )
n$ and unsatisfiable for $\alpha n > (\alpha_c + \epsilon) n$. This corresponds
to a bound of $o(n)$ on the size of the critical window.
  We sharpen these results significantly, as well as provide exponential tail
bounds. Our main result is that, perhaps surprisingly, the critical window is
actually at most $O(\log n)$. More precisely, with high probability the CSP is
satisfiable for $\alpha n < \alpha_c n -O(\log n)$ and unsatisfiable for any
$\alpha n > \alpha_c n + \omega(1)$. This implies the symmetric perceptron has
nearly the ""sharpest possible transition,"" adding it to a short list of CSP for
which the critical window is rigorously known to be of near-constant width.
","[{""version"":""v1"",""created"":""Wed, 4 May 2022 20:46:39 GMT""},{""version"":""v2"",""created"":""Wed, 6 Jul 2022 12:10:22 GMT""}]","2022-07-07"
"2205.02320","Duv\'an Cardona","Duv\'an Cardona, Julio Delgado, Michael Ruzhansky","Drift diffusion equations with fractional diffusion on compact Lie
  groups","30 Pages. arXiv admin note: text overlap with arXiv:2110.00838",,,,"math.AP math.FA","http://creativecommons.org/licenses/by/4.0/","  In this work we investigate the well-posedness for difussion equations
associated to subelliptic pseudo-differential operators on compact Lie groups.
The diffusion by strongly elliptic operators is considered as a special case
and in particular the fractional diffusion with respect to the Laplacian. The
general case is studied within the H\""ormander classes associated to a
sub-Riemannian structure on the group (encoded by a H\""ormander system of
vector fields). Applications to diffusion equations for fractional
sub-Laplacians, fractional powers of more general subelliptic operators, and
the corresponding quasi-geostrophic model with drift $D$ are investigated.
Examples on SU(2) for diffusion problems with fractional diffusion are
analysed.
","[{""version"":""v1"",""created"":""Wed, 4 May 2022 20:50:00 GMT""}]","2022-05-06"
