"2205.01752","Minu Joy","Supin P Surendran, Aiswarya A, Rinsy Thomas and Minu Joy","Evolutionary optimization of cosmological parameters using metropolis
  acceptance criterion","10 figues",,,,"astro-ph.CO","http://arxiv.org/licenses/nonexclusive-distrib/1.0/","  We introduce a novel evolutionary method that takes leverage from the MCMC
method that can be used for constraining the parameters and theoretical models
of Cosmology. Unlike the MCMC technique, which is essentially a non-parallel
algorithm by design, the newly proposed algorithm is able to obtain the full
potential of multi-core machines. With this algorithm, we could obtain the
best-fit parameters of the Lambda CDM cosmological model and identify the
discrepancy in the Hubble parameter $H_0$. In the present work we discuss the
design principle of this novel approach and also the results from the analysis
of Pantheon, OHD and Planck datasets are reported here. The estimation of
parameters shows significant consistency with the previously reported values as
well as a higher computational performance compared to the other similar
exercises.
","[{""version"":""v1"",""created"":""Wed, 4 May 2022 16:07:13 GMT""}]","2022-05-05"
"2205.02148","Francesca Bisconti","Francesca Bisconti and Andrea Chiavassa","Study of water Cherenkov detector design for ground-based gamma-ray
  experiments","Prepared for submission to JINST, 16 pages",,,,"astro-ph.IM physics.ins-det","http://creativecommons.org/licenses/by/4.0/","  In the framework of the development of the SWGO experiment we have performed
a detailed study of the single unit of an extensive air shower observatory
based on an array of water Cherenkov detectors. Indeed, one of the possible
water Cherenkov detector unit configurations for SWGO consists of tanks, and to
reach a high detection efficiency and discrimination capability between
gamma-ray and hadronic air showers, different tank designs are under
investigation. In this study, we considered double-layer tanks with several
sizes, shapes and number of photo-multiplier tubes (PMTs). Muons, electrons,
and gamma-rays with energies typical of secondary particles in extensive air
showers have been simulated entering the tanks with zenith angles from 0 to 60
degrees. The tank response was evaluated considering the number of
photoelectrons produced by the PMTs, the detection efficiency, and the time
resolution of the measurement of the first photon. This analysis allowed to
compare the performance of tanks with different size, configuration of PMTs,
and with circular, hexagonal and square geometry. The method used and the
results will be discussed in this paper.
","[{""version"":""v1"",""created"":""Wed, 4 May 2022 16:02:36 GMT""}]","2022-05-05"
"2205.02149","Vladimir Lysikov","Fulvio Gesmundo, Purnata Ghosal, Christian Ikenmeyer, Vladimir Lysikov","Degree-restricted strength decompositions and algebraic branching
  programs","14 pages","42nd IARCS Annual Conference on Foundations of Software Technology
  and Theoretical Computer Science (FSTTCS 2022), pp. 20:1--20:15","10.4230/LIPIcs.FSTTCS.2022.20",,"cs.CC math.AG","http://arxiv.org/licenses/nonexclusive-distrib/1.0/","  We analyze Kumar's recent quadratic algebraic branching program size lower
bound proof method (CCC 2017) for the power sum polynomial. We present a
refinement of this method that gives better bounds in some cases.
  The lower bound relies on Noether-Lefschetz type conditions on the
hypersurface defined by the homogeneous polynomial. In the explicit example
that we provide, the lower bound is proved resorting to classical intersection
theory.
  Furthermore, we use similar methods to improve the known lower bound methods
for slice rank of polynomials. We consider a sequence of polynomials that have
been studied before by Shioda and show that for these polynomials the improved
lower bound matches the known upper bound.
","[{""version"":""v1"",""created"":""Wed, 4 May 2022 16:04:47 GMT""},{""version"":""v2"",""created"":""Thu, 25 Aug 2022 08:57:24 GMT""}]","2022-12-27"
"2205.02150","Niket Thakkar","Niket Thakkar and Mike Famulare","COVID-19 epidemiology as emergent behavior on a dynamic transmission
  forest",,,,,"q-bio.PE","http://creativecommons.org/licenses/by/4.0/","  In this paper we create a compartmental, stochastic process model of
SARS-CoV-2 transmission, where the process's mean and variance have distinct
dynamics. The model is fit to time series data from Washington from January
2020 to March 2021 using a deterministic, biologically-motivated signal
processing approach, and we show that the model's hidden states, like
population prevalence, agree with survey and other estimates. Then, in the
paper's second half, we demonstrate that the same model can be reframed as a
branching process with a dynamic degree distribution. This perspective allows
us to generate approximate transmission trees and estimate some higher order
statistics, like the clustering of cases as outbreaks, which we find to be
consistent with related observations from contact tracing and phylogenetics.
","[{""version"":""v1"",""created"":""Wed, 4 May 2022 16:10:34 GMT""}]","2022-05-05"
"2205.02151","Dong Li","Haowei Zhu, Wenjing Ke, Dong Li, Ji Liu, Lu Tian, Yi Shan","Dual Cross-Attention Learning for Fine-Grained Visual Categorization and
  Object Re-Identification","Accepted by CVPR 2022",,,,"cs.CV cs.AI cs.LG","http://arxiv.org/licenses/nonexclusive-distrib/1.0/","  Recently, self-attention mechanisms have shown impressive performance in
various NLP and CV tasks, which can help capture sequential characteristics and
derive global information. In this work, we explore how to extend
self-attention modules to better learn subtle feature embeddings for
recognizing fine-grained objects, e.g., different bird species or person
identities. To this end, we propose a dual cross-attention learning (DCAL)
algorithm to coordinate with self-attention learning. First, we propose
global-local cross-attention (GLCA) to enhance the interactions between global
images and local high-response regions, which can help reinforce the
spatial-wise discriminative clues for recognition. Second, we propose pair-wise
cross-attention (PWCA) to establish the interactions between image pairs. PWCA
can regularize the attention learning of an image by treating another image as
distractor and will be removed during inference. We observe that DCAL can
reduce misleading attentions and diffuse the attention response to discover
more complementary parts for recognition. We conduct extensive evaluations on
fine-grained visual categorization and object re-identification. Experiments
demonstrate that DCAL performs on par with state-of-the-art methods and
consistently improves multiple self-attention baselines, e.g., surpassing
DeiT-Tiny and ViT-Base by 2.8% and 2.4% mAP on MSMT17, respectively.
","[{""version"":""v1"",""created"":""Wed, 4 May 2022 16:14:26 GMT""}]","2022-05-05"
"2205.02152","Constantine Maganaris","Constantine Maganaris, Eftychios Protopapadakis, Nikolaos Bakalos,
  Nikolaos Doulamis, Dimitris Kalogeras and Aikaterini Angeli","Evaluating Transferability for Covid 3D Localization Using CT SARS-CoV-2
  segmentation models",,,,,"eess.IV cs.CV cs.LG","http://creativecommons.org/licenses/by/4.0/","  Recent studies indicate that detecting radiographic patterns on CT scans can
yield high sensitivity and specificity for Covid-19 localization. In this
paper, we investigate the appropriateness of deep learning models
transferability, for semantic segmentation of pneumonia-infected areas in CT
images. Transfer learning allows for the fast initialization/reutilization of
detection models, given that large volumes of training data are not available.
Our work explores the efficacy of using pre-trained U-Net architectures, on a
specific CT data set, for identifying Covid-19 side-effects over images from
different datasets. Experimental results indicate improvement in the
segmentation accuracy of identifying Covid-19 infected regions.
","[{""version"":""v1"",""created"":""Wed, 4 May 2022 16:15:25 GMT""},{""version"":""v2"",""created"":""Wed, 18 May 2022 06:40:37 GMT""},{""version"":""v3"",""created"":""Thu, 19 May 2022 07:18:21 GMT""},{""version"":""v4"",""created"":""Fri, 20 May 2022 10:52:27 GMT""}]","2022-05-23"
"2205.02153","Gabriele Franciolini","Gabriele Franciolini, Anshuman Maharana, Francesco Muia","Hunt for Light Primordial Black Hole Dark Matter with
  Ultra-High-Frequency Gravitational Waves","50 pages, 8 figures. v2: matching published version",,"10.1103/PhysRevD.106.103520",,"astro-ph.CO gr-qc hep-ph hep-th","http://arxiv.org/licenses/nonexclusive-distrib/1.0/","  Light primordial black holes may comprise a dominant fraction of the dark
matter in our Universe. This paper critically assesses whether planned and
future gravitational wave detectors in the ultra-high-frequency band could
constrain the fraction of dark matter composed of sub-solar primordial black
holes. Adopting the state-of-the-art description of primordial black hole
merger rates, we compare various signals with currently operating and planned
detectors. As already noted in the literature, our findings confirm that
detecting individual primordial black hole mergers with currently existing and
operating proposals remains difficult. Current proposals involving
gravitational wave to electromagnetic wave conversion in a static magnetic
field and microwave cavities feature a technology gap with respect to the
loudest gravitational wave signals from primordial black holes of various
orders of magnitude. However, we point out that one recent proposal involving
resonant LC circuits represents the best option in terms of individual merger
detection prospects in the range $(1\div 100) \, \text{MHz}$. In the same
frequency range, we note that alternative setups involving resonant cavities,
whose concept is currently under development, might represent a promising
technology to detect individual merger events. We also show that a detection of
the stochastic gravitational wave background produced by unresolved binaries is
possible only if the theoretical sensitivity of the proposed Gaussian beam
detector is achieved. Such a detector, whose feasibility is subject to various
caveats, may be able to rule-out some scenarios for asteroidal mass primordial
black hole dark matter. We conclude that pursuing dedicated studies and
developments of gravitational wave detectors in the ultra-high-frequency band
remains motivated and may lead to novel probes on the existence of light
primordial black holes.
","[{""version"":""v1"",""created"":""Wed, 4 May 2022 16:16:12 GMT""},{""version"":""v2"",""created"":""Thu, 24 Nov 2022 12:10:16 GMT""}]","2022-11-30"
"2205.02154","Du Toit Strauss","R.D. Strauss, Nigussie M. Giday, Ephrem B. Seba, Daniel A. Chekole,
  Gemechu F. Garuma, Bereket H. Kassa, Teshome Dugassa, C. Diedericks","First results from the ENTOTO neutron monitor: Quantifying the waiting
  time distribution","Submitted to Advances in Space Research spacial issue: Space and
  Geophysical Observations and Recent Results related to the African Continent",,,,"physics.ins-det astro-ph.IM astro-ph.SR","http://creativecommons.org/licenses/by/4.0/","  We discuss a newly established neutron monitor station installed at the
ENTOTO Observatory Research Center outside of Addis Ababa, Ethiopia. This is a
version of a mini-neutron monitor, recently upgraded to detect individual
neutrons and able to calculate the waiting time distribution between neutron
pulses down to $\sim 1 $ $\mu$s. From the waiting time distribution we define
and calculate a new quantity, the correlation ratio, as the ratio of correlated
to uncorrelated neutrons measured inside the monitor. We propose that this
quantity can, in future, be used as a proxy for spectral index of atmospheric
particles incident on the monitor and show that this quantity has a weak
pressure dependence. We believe that future measurements from the ENTOTO
mini-neutron monitor will contribute towards the understanding of cosmic ray
acceleration and transport in the heliosphere.
","[{""version"":""v1"",""created"":""Wed, 4 May 2022 16:19:26 GMT""}]","2022-05-05"
"2205.02155","Igor Filikhin N","Igor Filikhin, Abdennaceur Karoui and Branislav Vlahovic","Effective Mass of $\alpha$-Cluster in $^{12}$C Nucleus","13 pages, 6 figures","International Journal of Modern Physics E (2022) 2250098 (13
  pages)","10.1142/S0218301322500987",,"nucl-th","http://creativecommons.org/publicdomain/zero/1.0/","  Based on the effective-mass concept, we perform the Faddeev calculations for
a low-lying spectrum of 3$\alpha$ states in $^{12}$C nucleus. A three-body
potential is used to describe the known breaking of the 3$\alpha$-cluster
structure in the nucleus. We show that the contribution of the three-body
potential to the Hamiltonian can be compensated by increasing/decreasing the
$\alpha$-particle free mass. The effective-mass values are adjusted so that to
reproduce the experimental data for the $^{12}$C nucleus. The energy dependence
of the effective mass and the correlation to a three-body potential are
discussed. We show that the coupling between the $0^+$ ($2^+$) levels forms a
specific picture of anti-crossing on the energy/effective-mass plane.
","[{""version"":""v1"",""created"":""Wed, 4 May 2022 16:20:34 GMT""},{""version"":""v2"",""created"":""Thu, 1 Dec 2022 21:58:58 GMT""}]","2022-12-05"
"2205.02156","Yvain Bruned","Yvonne Alama Bronsard, Yvain Bruned, Katharina Schratz","Approximations of dispersive PDEs in the presence of low-regularity
  randomness","44 pages",,,,"math.PR cs.NA math.AP math.NA math.RA","http://creativecommons.org/licenses/by/4.0/","  We introduce a new class of numerical schemes which allow for low regularity
approximations to the expectation $ \mathbb{E}(|u_{k}(\tau, v^{\eta})|^2)$,
where $u_k$ denotes the $k$-th Fourier coefficient of the solution $u$ of the
dispersive equation and $ v^{\eta}(x) $ the associated random initial data.
This quantity plays an important role in physics, in particular in the study of
wave turbulence where one needs to adopt a statistical approach in order to
obtain deep insight into the generic long-time behaviour of solutions to
dispersive equations. Our new class of schemes is based on Wick's theorem and
Feynman diagrams together with a resonance based discretisation (see
arXiv:2005.01649) set in a more general context: we introduce a novel
combinatorial structure called paired decorated forests which are two decorated
trees whose decorations on the leaves come in pair. The character of the scheme
draws its inspiration from the treatment of singular stochastic partial
differential equations via Regularity Structures. In contrast to classical
approaches, we do not discretize the PDE itself, but rather its expectation.
This allows us to heavily exploit the optimal resonance structure and
underlying gain in regularity on the finite dimensional (discrete) level.
","[{""version"":""v1"",""created"":""Wed, 4 May 2022 16:22:17 GMT""},{""version"":""v2"",""created"":""Fri, 3 Jun 2022 12:37:09 GMT""}]","2022-06-06"
"2205.02157","Chengqun Pang","Ting-yan Li, Ya-rong Wang, Cheng-qun Pang","Arrangement for $K_2^*$ meson family","9 pages, 6 figures. arXiv admin note: text overlap with
  arXiv:1810.02694",,"10.1103/PhysRevD.107.074008",,"hep-ph hep-ex","http://creativecommons.org/licenses/by/4.0/","  Two observed structures with $M=1868 \pm 8^{+ 40}_{- 57}$ MeV and $M=2073 \pm
94^{+ 245}_{- 240}$ MeV are the same states ($K_2^*(1980)$) in PDG.The analysis
of the mass spectrum and the calculation of the strong decay of $K_2^*$ mesons
support the low mass state of $K_2^*(1980)$ as $2^3P_2$ and the high mass state
of $K_2^*(1980)$ as $1^3F_2$ in this letter. This analysis brings us very
important criterion for the assignment of the observed $K_2^* (1980)$ and
experimental findings for this assignment is suggested. Additionally,
prediction of some partial decay widths are made on the high excitations of
$K_2^*$ family. This study is crucial to establishing and searching for their
higher excitations in the future.
","[{""version"":""v1"",""created"":""Wed, 4 May 2022 16:27:35 GMT""},{""version"":""v2"",""created"":""Fri, 7 Oct 2022 12:26:06 GMT""}]","2023-04-26"
"2205.02158","Vladimir Rovenski","Vladimir Rovenski","On the geometry of a weakened $f$-structure","14 pages",,,,"math.DG","http://creativecommons.org/licenses/by/4.0/","  An $f$-structure, introduced by K. Yano in 1963 and subsequently studied by a
number of geometers, is a higher dimensional analog of almost complex and
almost contact structures, defined by a (1,1)-tensor field $f$ on a
$(2n+p)$-dimensional manifold, which satisfies $f^3 + f = 0$ and has constant
rank $2n$. We recently introduced the weakened (globally framed) $f$-structure
(i.e., the complex structure on $f(TM)$ is replaced by a nonsingular
skew-symmetric tensor) and its subclasses of weak $K$-, ${\cal S}$-, and ${\cal
C}$- structures on Riemannian manifolds with totally geodesic foliations, which
allow us to take a fresh look at the classical theory. We demonstrate this by
generalizing several known results on globally framed $f$-manifolds. First, we
express the covariant derivative of $f$ using a new tensor on a metric weak
$f$-structure, then we prove that on a weak $K$-manifold the characteristic
vector fields are Killing and $\ker f$ defines a totally geodesic foliation, an
${\cal S}$-structure is rigid, i.e., our weak ${\cal S}$-structure is an ${\cal
S}$-structure, and a metric weak $f$-structure with parallel tensor $f$ reduces
to a weak ${\cal C}$-structure. For $p=1$ we obtain the corresponding
corollaries for weak almost contact, weak cosymplectic, and weak Sasakian
structures.
","[{""version"":""v1"",""created"":""Wed, 4 May 2022 16:27:50 GMT""},{""version"":""v2"",""created"":""Sun, 8 May 2022 17:23:18 GMT""},{""version"":""v3"",""created"":""Sun, 18 Sep 2022 18:43:52 GMT""}]","2022-09-20"
"2205.02159","Ziming Shi","Ziming Shi and Ruixiang Zhang","Sobolev Differentiability Properties of Logarithmic Modulus of Real
  Analytic Functions","18 pages, comments welcome!",,,,"math.CA","http://creativecommons.org/licenses/by/4.0/","  Let $f$ be the germ of a real analytic function at the origin in
$\mathbb{R}^n $ for $n \geq 2$, and suppose the codimension of the zero set of
$f$ at $\mathbf{0}$ is at least $2$. We show that $\log |f|$ is
$W^{1,1}_{\operatorname{loc}}$ near $\mathbf{0}$. In particular, this implies
the differential inequality $|\nabla f |\leq V |f|$ holds with $V \in
L^1_{\operatorname{loc}}$. As an application, we derive an inequality relating
the {\L}ojasiewicz exponent and singularity exponent for such functions.
","[{""version"":""v1"",""created"":""Wed, 4 May 2022 16:29:36 GMT""},{""version"":""v2"",""created"":""Mon, 10 Oct 2022 20:03:52 GMT""}]","2022-10-12"
"2205.02160","Yair Carmon","Yair Carmon and Oliver Hinder","Making SGD Parameter-Free",,,,,"math.OC cs.LG stat.ML","http://arxiv.org/licenses/nonexclusive-distrib/1.0/","  We develop an algorithm for parameter-free stochastic convex optimization
(SCO) whose rate of convergence is only a double-logarithmic factor larger than
the optimal rate for the corresponding known-parameter setting. In contrast,
the best previously known rates for parameter-free SCO are based on online
parameter-free regret bounds, which contain unavoidable excess logarithmic
terms compared to their known-parameter counterparts. Our algorithm is
conceptually simple, has high-probability guarantees, and is also partially
adaptive to unknown gradient norms, smoothness, and strong convexity. At the
heart of our results is a novel parameter-free certificate for SGD step size
choice, and a time-uniform concentration result that assumes no a-priori bounds
on SGD iterates.
","[{""version"":""v1"",""created"":""Wed, 4 May 2022 16:29:38 GMT""},{""version"":""v2"",""created"":""Thu, 13 Apr 2023 20:01:08 GMT""}]","2023-04-17"
"2205.02161","Peter Macgregor","Ben Jourdan, Peter Macgregor, He Sun","Is the Algorithmic Kadison-Singer Problem Hard?",,,,,"cs.CC cs.DS","http://creativecommons.org/licenses/by/4.0/","  We study the following $\mathsf{KS}_2(c)$ problem: let $c \in\mathbb{R}^+$ be
some constant, and $v_1,\ldots, v_m\in\mathbb{R}^d$ be vectors such that
$\|v_i\|^2\leq \alpha$ for any $i\in[m]$ and $\sum_{i=1}^m \langle v_i,
x\rangle^2 =1$ for any $x\in\mathbb{R}^d$ with $\|x\|=1$. The
$\mathsf{KS}_2(c)$ problem asks to find some $S\subset [m]$, such that it holds
for all $x \in \mathbb{R}^d$ with $\|x\| = 1$ that \[ \left|\sum_{i \in S}
\langle v_i, x\rangle^2 - \frac{1}{2}\right| \leq c\cdot\sqrt{\alpha},\] or
report no if such $S$ doesn't exist. Based on the work of Marcus et al. and
Weaver, the $\mathsf{KS}_2(c)$ problem can be seen as the algorithmic
Kadison-Singer problem with parameter $c\in\mathbb{R}^+$.
  Our first result is a randomised algorithm with one-sided error for the
$\mathsf{KS}_2(c)$ problem such that (1) our algorithm finds a valid set $S
\subset [m]$ with probability at least $1-2/d$, if such $S$ exists, or (2)
reports no with probability $1$, if no valid sets exist. The algorithm has
running time \[ O\left(\binom{m}{n}\cdot \mathrm{poly}(m, d)\right)~\mbox{ for
}~n = O\left(\frac{d}{\epsilon^2} \log(d)
\log\left(\frac{1}{c\sqrt{\alpha}}\right)\right), \] where $\epsilon$ is a
parameter which controls the error of the algorithm. This presents the first
algorithm for the Kadison-Singer problem whose running time is quasi-polynomial
in $m$, although having exponential dependency on $d$. Moreover, it shows that
the algorithmic Kadison-Singer problem is easier to solve in low dimensions.
  Our second result is on the computational complexity of the
$\mathsf{KS}_2(c)$ problem. We show that the $\mathsf{KS}_2(1/(4\sqrt{2}))$
problem is $\mathsf{FNP}$-hard for general values of $d$, and solving the
$\mathsf{KS}_2(1/(4\sqrt{2}))$ problem is as hard as solving the
$\mathsf{NAE\mbox{-}3SAT}$ problem.
","[{""version"":""v1"",""created"":""Wed, 4 May 2022 16:30:25 GMT""},{""version"":""v2"",""created"":""Fri, 22 Jul 2022 19:01:12 GMT""},{""version"":""v3"",""created"":""Thu, 3 Nov 2022 16:25:45 GMT""}]","2022-11-04"
"2205.02162","Zhen Dong","Zhen Dong, Kaicheng Zhou, Guohao Li, Qiang Zhou, Mingfei Guo, Bernard
  Ghanem, Kurt Keutzer, and Shanghang Zhang","UnrealNAS: Can We Search Neural Architectures with Unreal Data?",,,,,"cs.CV","http://arxiv.org/licenses/nonexclusive-distrib/1.0/","  Neural architecture search (NAS) has shown great success in the automatic
design of deep neural networks (DNNs). However, the best way to use data to
search network architectures is still unclear and under exploration. Previous
work has analyzed the necessity of having ground-truth labels in NAS and
inspired broad interest. In this work, we take a further step to question
whether real data is necessary for NAS to be effective. The answer to this
question is important for applications with limited amount of accessible data,
and can help people improve NAS by leveraging the extra flexibility of data
generation. To explore if NAS needs real data, we construct three types of
unreal datasets using: 1) randomly labeled real images; 2) generated images and
labels; and 3) generated Gaussian noise with random labels. These datasets
facilitate to analyze the generalization and expressivity of the searched
architectures. We study the performance of architectures searched on these
constructed datasets using popular differentiable NAS methods. Extensive
experiments on CIFAR, ImageNet and CheXpert show that the searched
architectures can achieve promising results compared with those derived from
the conventional NAS pipeline with real labeled data, suggesting the
feasibility of performing NAS with unreal data.
","[{""version"":""v1"",""created"":""Wed, 4 May 2022 16:30:26 GMT""},{""version"":""v2"",""created"":""Sun, 8 May 2022 20:57:39 GMT""},{""version"":""v3"",""created"":""Thu, 19 May 2022 05:33:56 GMT""}]","2022-05-20"
"2205.02163","Krystal Taylor","Elizabeth Campolongo, Krystal Taylor","Lattice Points Close to the Heisenberg Spheres",,,,,"math.CA math.NT","http://creativecommons.org/licenses/by/4.0/","  We study a lattice point counting problem for spheres arising from the
Heisenberg groups. In particular, we prove an upper bound on the number of
points on and near large dilates of the unit spheres generated by the
anisotropic norms $\|(z,t)\|_\alpha = ( |z|^\alpha +
|t|^{\alpha/2})^{1/\alpha}$ for $\alpha\geq 2$. As a first step, we reduce our
counting problem to one of bounding an energy integral. The primary new
challenges that arise are the presence of vanishing curvature and uneven
dilations. In the process, we establish bounds on the Fourier transform of the
surface measures arising from these norms. Further, we utilize the techniques
developed here to estimate the number of lattice points in the intersection of
two such surfaces.
","[{""version"":""v1"",""created"":""Wed, 4 May 2022 16:31:23 GMT""}]","2022-05-05"
