"2205.02620","Xidong Mu","Xidong Mu and Yuanwei Liu and Li Guo and Naofal Al-Dhahir","Heterogeneous Semantic and Bit Communications: A Semi-NOMA Scheme","32 pages, 12 figures",,,,"cs.IT eess.SP math.IT","http://arxiv.org/licenses/nonexclusive-distrib/1.0/","  Multiple access (MA) design is investigated for facilitating the coexistence
of the emerging semantic transmission and the conventional bit-based
transmission in future networks. The semantic rate is considered for measuring
the performance of the semantic transmission. However, a key challenge is that
there is a lack of a closed-form expression for a key parameter, namely the
semantic similarity, which characterizes the sentence similarity between an
original sentence and the corresponding recovered sentence. To overcome this
challenge, we propose a data regression method, where the semantic similarity
is approximated by a generalized logistic function. Using the obtained
tractable function, we propose a heterogeneous semantic and bit communication
framework, where an access point simultaneously sends the semantic and bit
streams to one semantics-interested user (S-user) and one bit-interested user
(B-user). To realize this heterogeneous semantic and bit transmission in
multi-user networks, three MA schemes are proposed, namely orthogonal multiple
access (OMA), non-orthogonal multiple access (NOMA), and semi-NOMA. More
specifically, the bit stream in semi-NOMA is split into two streams, one is
transmitted with the semantic stream over the shared frequency sub-band and the
other is transmitted over the separate orthogonal frequency sub-band. To study
the fundamental performance limits of the three proposed MA schemes, the
semantic-versus-bit (SvB) rate region and the power region are defined. An
optimal resource allocation procedure is then derived for characterizing the
boundary of the SvB rate region and the power region achieved by each MA
scheme. The structures of the derived solutions demonstrate that semi-NOMA is
superior to both NOMA and OMA given its highly flexible transmission policy.
Our numerical results validate the analysis and show the superiority of
semi-NOMA.
","[{""version"":""v1"",""created"":""Thu, 5 May 2022 12:59:24 GMT""},{""version"":""v2"",""created"":""Wed, 14 Sep 2022 14:26:14 GMT""}]","2022-09-15"
"2205.02621","Fabian Oboril","Fabian Oboril, Cornelius Buerkle, Alon Sussmann, Simcha Bitton, Simone
  Fabris","MTBF Model for AVs -- From Perception Errors to Vehicle-Level Failures","to be published in the proceedings of the IEEE Intelligent Vehicles
  Symposium 2022",,"10.1109/IV51971.2022.9827006",,"cs.RO","http://creativecommons.org/licenses/by/4.0/","  The development of Automated Vehicles (AVs) is progressing quickly and the
first robotaxi services are being deployed worldwide. However, to receive
authority certification for mass deployment, manufactures need to justify that
their AVs operate safer than human drivers. This in turn creates the need to
estimate and model the collision rate (failure rate) of an AV taking all
possible errors and driving situations into account. In other words, there is
the strong demand for comprehensive Mean Time Between Failure (MTBF) models for
AVs. In this paper, we will introduce such a generic and scalable model that
creates a link between errors in the perception system to vehicle-level
failures (collisions). Using this model, we are able to derive requirements for
the perception quality based on the desired vehicle-level MTBF or vice versa to
obtain an MTBF value given a certain mission profile and perception quality.
","[{""version"":""v1"",""created"":""Thu, 5 May 2022 13:00:27 GMT""}]","2022-08-25"
"2205.02622","Michael Kewming","Michael J. Kewming, Mark T. Mitchison, Gabriel T. Landi","Diverging current fluctuations in critical Kerr resonators","10 pages, 7 figures","Phys. Rev. A 106, 033707 (2022)","10.1103/PhysRevA.106.033707",,"quant-ph","http://creativecommons.org/licenses/by/4.0/","  The parametrically pumped Kerr model describes a driven-dissipative nonlinear
cavity, whose nonequilibrium phase diagram features both continuous and
discontinuous quantum phase transitions. We consider the consequences of these
critical phenomena for the fluctuations of the photocurrent obtained via
continuous weak measurements on the cavity. Considering both direct
photodetection and homodyne detection schemes, we find that the current
fluctuations diverge exponentially at the discontinuous phase transition.
However, we find strikingly different current fluctuations for these two
detection schemes near the continuous transition, a behaviour which is
explained by the complementary information revealed by measurements in
different bases. To obtain these results, we develop formulas to efficiently
compute the diffusion coefficient -- which characterises the long-time current
fluctuations -- directly from the quantum master equation, thus connecting the
formalisms of full counting statistics and stochastic quantum trajectories. Our
findings highlight the rich features of current fluctuations near
nonequilibrium phase transitions in quantum-optical systems.
","[{""version"":""v1"",""created"":""Thu, 5 May 2022 13:01:33 GMT""},{""version"":""v2"",""created"":""Mon, 26 Sep 2022 10:57:29 GMT""}]","2022-10-26"
"2205.02623","Stefan Heinen","S. Heinen and G. F. von Rudorff and O. A. von Lilienfeld","Geometry Relaxation and Transition State Search throughout Chemical
  Compound Space with Quantum Machine Learning",,,,,"physics.chem-ph","http://creativecommons.org/licenses/by/4.0/","  We use energies and forces predicted within response operator based quantum
machine learning (OQML) to perform geometry optimization and transition state
search calculations with legacy optimizers. For randomly sampled initial
coordinates of small organic query molecules we report systematic improvement
of equilibrium and transition state geometry output as training set sizes
increase. Out-of-sample S$_\mathrm{N}$2 reactant complexes and transition state
geometries have been predicted using the LBFGS and the QST2 algorithm with an
RMSD of 0.16 and 0.4 \r{A} -- after training on up to 200 reactant complexes
relaxations and transition state search trajectories from the QMrxn20 data-set,
respectively. For geometry optimizations, we have also considered relaxation
paths up to 5'500 constitutional isomers with sum formula C$_7$H$_{10}$O$_2$
from the QM9-database. Using the resulting OQML models with an LBFGS optimizer
reproduces the minimum geometry with an RMSD of 0.14~\r{A}. For converged
equilibrium and transition state geometries subsequent vibrational normal mode
frequency analysis indicates deviation from MP2 reference results by on average
14 and 26\,cm$^{-1}$, respectively. While the numerical cost for OQML
predictions is negligible in comparison to DFT or MP2, the number of steps
until convergence is typically larger in either case. The success rate for
reaching convergence, however, improves systematically with training set size,
underscoring OQML's potential for universal applicability.
","[{""version"":""v1"",""created"":""Thu, 5 May 2022 13:02:09 GMT""},{""version"":""v2"",""created"":""Thu, 21 Jul 2022 12:50:27 GMT""},{""version"":""v3"",""created"":""Fri, 22 Jul 2022 06:44:34 GMT""}]","2022-07-25"
"2205.02624","Zhiguang Zhao","Zhiguang Zhao","Correspondence Theory for Generalized Modal Algebras",,,,,"math.LO","http://creativecommons.org/licenses/by/4.0/","  In the present paper, we give a systematic study of the correspondence theory
of generalized modal algebras and generalized modal spaces. The special feature
of the present paper is that in the proof of the (right-handed) topological
Ackermann lemma, the admissible valuations are not the clopen valuations
anymore, but values in the set DK(X) which are only closed and satisfy
additional properties, not necessarily open. This situation is significantly
different from existing settings using Stone/Priestley-like dualities, where
all admissible valuations are clopen valuations.
","[{""version"":""v1"",""created"":""Thu, 5 May 2022 13:04:00 GMT""}]","2022-05-06"
"2205.02625","Peizhuo Li","Peizhuo Li, Kfir Aberman, Zihan Zhang, Rana Hanocka, Olga
  Sorkine-Hornung","GANimator: Neural Motion Synthesis from a Single Sequence","SIGGRAPH 2022. Project page: https://peizhuoli.github.io/ganimator/ ,
  Video: https://www.youtube.com/watch?v=OV9VoHMEeyI",,"10.1145/3528223.3530157",,"cs.GR cs.AI cs.CV cs.LG","http://arxiv.org/licenses/nonexclusive-distrib/1.0/","  We present GANimator, a generative model that learns to synthesize novel
motions from a single, short motion sequence. GANimator generates motions that
resemble the core elements of the original motion, while simultaneously
synthesizing novel and diverse movements. Existing data-driven techniques for
motion synthesis require a large motion dataset which contains the desired and
specific skeletal structure. By contrast, GANimator only requires training on a
single motion sequence, enabling novel motion synthesis for a variety of
skeletal structures e.g., bipeds, quadropeds, hexapeds, and more. Our framework
contains a series of generative and adversarial neural networks, each
responsible for generating motions in a specific frame rate. The framework
progressively learns to synthesize motion from random noise, enabling
hierarchical control over the generated motion content across varying levels of
detail. We show a number of applications, including crowd simulation, key-frame
editing, style transfer, and interactive control, which all learn from a single
input sequence. Code and data for this paper are at
https://peizhuoli.github.io/ganimator.
","[{""version"":""v1"",""created"":""Thu, 5 May 2022 13:04:14 GMT""}]","2022-05-06"
"2205.02626","Silvia Noschese","Smahane El-Halouy, Silvia Noschese, and Lothar Reichel","Perron communicability and sensitivity of multilayer networks","20 pages, 1 figure, 7 tables","Numerical Algorithms 92 (2023), pp. 597-617","10.1007/s11075-022-01418-4","Roma01.Math.Na","math.NA cs.NA","http://creativecommons.org/licenses/by/4.0/","  Modeling complex systems that consist of different types of objects leads to
multilayer networks, where nodes in the different layers represent different
kind of objects. Nodes are connected by edges, which have positive weights. A
multilayer network is associated with a supra-adjacency matrix. This paper
investigates the sensitivity of the communicability in a multilayer network to
perturbations of the network by studying the sensitivity of the Perron root of
the supra-adjacency matrix. Our analysis sheds light on which edge weights to
make larger to increase the communicability of the network, and which edge
weights can be made smaller or set to zero without affecting the
communicability significantly.
","[{""version"":""v1"",""created"":""Thu, 5 May 2022 13:05:05 GMT""},{""version"":""v2"",""created"":""Wed, 3 Aug 2022 15:47:40 GMT""}]","2023-01-11"
"2205.02627","Gabriel Amaral","Gabriel Amaral, Odinaldo Rodrigues, Elena Simperl","WDV: A Broad Data Verbalisation Dataset Built from Wikidata",,,,,"cs.CL","http://creativecommons.org/publicdomain/zero/1.0/","  Data verbalisation is a task of great importance in the current field of
natural language processing, as there is great benefit in the transformation of
our abundant structured and semi-structured data into human-readable formats.
Verbalising Knowledge Graph (KG) data focuses on converting interconnected
triple-based claims, formed of subject, predicate, and object, into text.
Although KG verbalisation datasets exist for some KGs, there are still gaps in
their fitness for use in many scenarios. This is especially true for Wikidata,
where available datasets either loosely couple claim sets with textual
information or heavily focus on predicates around biographies, cities, and
countries. To address these gaps, we propose WDV, a large KG claim
verbalisation dataset built from Wikidata, with a tight coupling between
triples and text, covering a wide variety of entities and predicates. We also
evaluate the quality of our verbalisations through a reusable workflow for
measuring human-centred fluency and adequacy scores. Our data and code are
openly available in the hopes of furthering research towards KG verbalisation.
","[{""version"":""v1"",""created"":""Thu, 5 May 2022 13:10:12 GMT""}]","2022-05-06"
"2205.02628","Naoki Tsukamoto","Naoki Tsukamoto","Is there a trade-off relation between efficiency and power in a
  collisional Penrose process in an extreme Reissner-Nordstr\""{o}m spacetime?","5 pages, 2 figures, minor changes, added references, accepted for
  publication in Physical Review D","Phys. Rev. D 105, 104065 (2022)","10.1103/PhysRevD.105.104065",,"gr-qc","http://creativecommons.org/licenses/by/4.0/","  We investigate the power of a collisional Penrose process with an unbound
energy extraction from an extreme Reissner-Nordstr\""{o}m black hole. This
process takes infinite time in a time coordinate at a constant radial
coordinate outside of the black hole. For black holes as a power plant, the
power of the process for an observer far away from the black hole can be
useful. We define the power as energy gain from the extreme
Reissner-Nordstr\""{o}m black hole divided by the time interval of the process
in a coordinate time; we estimate the upper bound of the power in a
near-horizon limit, while the efficiency of the process can be arbitrary large
in that limit. Thus, we conclude that there is no trade-off relation between
the efficiency and power in the collisional Penrose process in extreme
Reissner-Nordstr\""{o}m spacetime.
","[{""version"":""v1"",""created"":""Thu, 5 May 2022 13:12:15 GMT""},{""version"":""v2"",""created"":""Wed, 25 May 2022 10:26:19 GMT""}]","2022-05-31"
"2205.02629","Sara Papi","Marco Gaido, Sara Papi, Dennis Fucci, Giuseppe Fiameni, Matteo Negri,
  Marco Turchi","Efficient yet Competitive Speech Translation: FBK@IWSLT2022","IWSLT 2022 System Description",,,,"cs.CL","http://creativecommons.org/licenses/by-sa/4.0/","  The primary goal of this FBK's systems submission to the IWSLT 2022 offline
and simultaneous speech translation tasks is to reduce model training costs
without sacrificing translation quality. As such, we first question the need of
ASR pre-training, showing that it is not essential to achieve competitive
results. Second, we focus on data filtering, showing that a simple method that
looks at the ratio between source and target characters yields a quality
improvement of 1 BLEU. Third, we compare different methods to reduce the
detrimental effect of the audio segmentation mismatch between training data
manually segmented at sentence level and inference data that is automatically
segmented. Towards the same goal of training cost reduction, we participate in
the simultaneous task with the same model trained for offline ST. The
effectiveness of our lightweight training strategy is shown by the high score
obtained on the MuST-C en-de corpus (26.7 BLEU) and is confirmed in
high-resource data conditions by a 1.6 BLEU improvement on the IWSLT2020 test
set over last year's winning system.
","[{""version"":""v1"",""created"":""Thu, 5 May 2022 13:13:48 GMT""}]","2022-05-06"
"2205.02630","Dmitry Svintsov","Mikhail Khavronin and Dmitry Svintsov","Signatures of non-local conductivity in near-field microscopy","6 pages, 5 figures","Phys. Rev. B 107, 205409 (2023)","10.1103/PhysRevB.107.205409",,"cond-mat.mes-hall physics.optics","http://creativecommons.org/licenses/by/4.0/","  We propose and theoretically substantiate a new method to study the non-local
conductivity of two-dimensional electron systems (2DES) using the tools of
near-field microscopy. We show that the height dependence of induced dipole
moment of illuminated near-field probe is substantially different for various
transport regimes of charge carriers in 2DES. For hydrodynamic transport
regime, the induced dipole moment scales as $z_0^{-2}$, where $z_0$ is the
elevation of probe above the 2DES. Both for Drude and classical ballistic
regimes of conduction, the dipole moment scales as $z_0^{-3}$. In the former
case, the dipole moment is carrier density-independent, while in the latter it
largely depends on carrier density. More generally, we find that the induced
dipole moment of the probe is proportional to the Laplace transform of
wave-vector dependent conductivity and inverse dielectric function of 2DES over
the wave vectors $q$. Our results should provide a simple tool for studies of
non-local conductivity in solids that was challenging to address with other
techniques.
","[{""version"":""v1"",""created"":""Thu, 5 May 2022 13:15:09 GMT""}]","2023-06-01"
"2205.02631","Maximilian Graml","Maximilian Graml, Maximilian Nitsch, Adrian Seith, Ferdinand Evers and
  Jan Wilhelm","Influence of chirp and carrier-envelope phase on non-integer
  high-harmonic generation",,,"10.1103/PhysRevB.107.054305",,"physics.optics cond-mat.mes-hall","http://creativecommons.org/licenses/by-nc-nd/4.0/","  High harmonic generation (HHG) is a versatile technique for probing ultrafast
electron dynamics. While HHG is sensitive to the electronic properties of the
target, HHG also depends on the waveform of the laser pulse. As is well known,
(peak) positions, $\omega$, in the high-harmonic spectrum can shift when the
carrier envelope phase (CEP), $\varphi$ is varied. We derive formulae
describing the corresponding parametric dependencies of CEP shifts; in
particular, we have a transparent result for the (peak) shift,
$d\omega/d\varphi = {-} 2 \bar{\mathfrak f}' \omega/\omega_0$, where $\omega_0$
describes the fundamental frequency and $\bar{\mathfrak f}'$ characterizes the
chirp of the driving laser pulse. We compare the analytical formula to
full-fledged numerical simulations finding only 17 % average relative absolute
deviation in $d\omega/d\varphi$. Our analytical result is fully consistent with
experimental observations.
","[{""version"":""v1"",""created"":""Thu, 5 May 2022 13:17:28 GMT""},{""version"":""v2"",""created"":""Tue, 10 Jan 2023 09:14:01 GMT""}]","2023-02-22"
"2205.02632","Jozefien D'haeseleer","Jozefien D'haeseleer and Klaus Metsch and Daniel Werner","On the Chromatic Number of some generalized Kneser Graphs","25 pages",,,,"math.CO","http://arxiv.org/licenses/nonexclusive-distrib/1.0/","  We determine the chromatic number of the Kneser graph q{\Gamma}_{7,{3,4}} of
flags of vectorial type {3, 4} of a rank 7 vector space over the finite field
GF(q) for large q and describe the colorings that attain the bound. This result
relies heavily, not only on the independence number, but also on the structure
of all large independent sets. Furthermore, our proof is more general in the
following sense: it provides the chromatic number of the Kneser graphs
q{\Gamma}_{2d+1,{d,d+1}} of flags of vectorial type {d, d+1} of a rank 2d+1
vector space over GF(q) for large q as long as the large independent sets of
the graphs are only the ones that are known.
","[{""version"":""v1"",""created"":""Thu, 5 May 2022 13:24:44 GMT""}]","2022-05-06"
"2205.02633","Felix Schremmer","Felix Schremmer","Affine Bruhat order and Demazure products","58 pages",,,,"math.RT","http://creativecommons.org/licenses/by/4.0/","  We give new descriptions of the Bruhat order and Demazure products of affine
Weyl groups in terms of the weight function of the quantum Bruhat graph. These
results can be understood to describe certain closure relations concerning the
Iwahori-Bruhat decomposition of an algebraic group. As an application towards
affine Deligne-Lusztig varieties, we present a new formula for generic Newton
points.
","[{""version"":""v1"",""created"":""Thu, 5 May 2022 13:26:35 GMT""}]","2022-05-06"
"2205.02634","Nima Ghanbari","Nima Ghanbari","Some results on the super domination number of a graph II","12 Pages, 4 Figures",,,,"math.CO","http://arxiv.org/licenses/nonexclusive-distrib/1.0/","  Let $G=(V,E)$ be a simple graph. A dominating set of $G$ is a subset
$S\subseteq V$ such that every vertex not in $S$ is adjacent to at least one
vertex in $S$. The cardinality of a smallest dominating set of $G$, denoted by
$\gamma(G)$, is the domination number of $G$. A dominating set $S$ is called a
super dominating set of $G$, if for every vertex $u\in \overline{S}=V-S$, there
exists $v\in S$ such that $N(v)\cap \overline{S}=\{u\}$. The cardinality of a
smallest super dominating set of $G$, denoted by $\gamma_{sp}(G)$, is the super
domination number of $G$. In this paper, we obtain more results on the super
domination number of graphs which is modified by an operation on vertices.
Also, we present some sharp bounds for super domination number of chain and
bouquet of pairwise disjoint connected graphs.
","[{""version"":""v1"",""created"":""Thu, 5 May 2022 13:26:48 GMT""}]","2022-05-06"
"2205.02635","Julia Liebert","Julia Liebert","Reduced Density Matrix Functional Theory for Bosons: Foundations and
  Applications","Master thesis, LMU Munich, 103 pages. Thesis based on
  arXiv:2010.06634, arXiv:2106.03918, arXiv:2105.06459, arXiv:2204.12715",,,,"cond-mat.quant-gas quant-ph","http://creativecommons.org/publicdomain/zero/1.0/","  Density functional theory constitutes the workhorse of modern electronic
structure calculations due to its favourable computational cost despite the
fact that it usually fails to describe strongly correlated systems. A
particularly promising approach to overcome those difficulties is reduced
density matrix functional theory (RDMFT): It abandons the complexity of the
$N$-particle wave function and at the same time explicitly allows for
fractional occupation numbers. It is the goal of this thesis to initiate and
establish a bosonic RDMFT for both ground state and excited state energy
calculations. Motivated by the Onsager and Penrose criterion which identifies
RDMFT as a particularly suitable approach to describe Bose-Einstein condensates
(BECs), we derive the universal functional for a homogeneous BEC in the
Bogoliubov regime. Remarkably, the gradient of the universal functional is
found to diverge repulsively in the regime of complete condensation. This
introduces the new concept of a BEC force, which provides a universal
explanation for quantum depletion since it is merely based on the geometry of
quantum states. In the second part of the thesis, we propose and work out an
ensemble RDMFT targeting excitations in bosonic quantum systems. This endeavour
further highlights the potential of convex analysis for the development of
functional theories in the future. Indeed by resorting to several concepts from
convex analysis, we succeeded to provide a comprehensive foundation of
$\boldsymbol{w}$-ensemble RDMFT for bosons which is further based on a
generalization of the Ritz variational principle and a constrained search
formalism. In particular, we solve the emerging $N$-representability problem
leading to a generalization of Pauli's famous exclusion principle to bosonic
mixed states.
","[{""version"":""v1"",""created"":""Thu, 5 May 2022 13:28:18 GMT""}]","2022-05-06"
"2205.02636","Lu\'is Cruz-Filipe","Luis Cruz-Filipe, Kim S. Larsen, Fabrizio Montesi, Larisa Safina","Implementing Choreography Extraction","arXiv admin note: text overlap with arXiv:1910.11741",,,,"cs.PL","http://creativecommons.org/licenses/by-nc-nd/4.0/","  Choreographies are global descriptions of interactions among concurrent
components, most notably used in the settings of verification and synthesis of
correct-by-construction software. They require a top-down approach: programmers
first write choreographies, and then use them to verify or synthesize their
programs. However, most software does not come with choreographies yet, which
prevents their application. To attack this problem, previous work investigated
choreography extraction, which automatically constructs a choreography that
describes the behaviour of a given set of programs or protocol specifications.
  We propose a new extraction methodology that improves on the state of the
art: we can deal with programs that are equipped with state and internal
computation and time complexity is dramatically better. We also implement this
theory and show that, in spite of its theoretical exponential complexity, it is
usable in practice. We discuss the data structures needed for an efficient
implementation, introduce some optimisations, and perform a systematic
practical evaluation.
","[{""version"":""v1"",""created"":""Thu, 5 May 2022 13:32:16 GMT""},{""version"":""v2"",""created"":""Fri, 6 May 2022 12:10:49 GMT""}]","2022-05-09"
