"2205.02452","Padmanabhan Balasubramanian Dr","Rakshanda Dhawan, Padmanabhan Balasubramanian, Tashi Nautiyal","Origins of multi-sublattice magnetism and superexchange interactions in
  double-double perovskite CaMnCrSbO6","29 pages, 11 figures",,,,"cond-mat.mtrl-sci cond-mat.str-el","http://creativecommons.org/licenses/by/4.0/","  We have deployed density functional theory, Wannier function analysis and
mean-field calculations to investigate the double-double perovskite compound
CaMnCrSbO_{6}. The crystallographically non-equivalent Mn atoms in the unit
cell have tetrahedral and planar oxygen coordinations (labelled as Mn(1) and
Mn(2)), while the Cr atom is in the centre of distorted oxygen octahedron.
While the bulk magnetization and neutron diffraction suggest a simpler
ferrimagnetic order (T_C=49 K) between Mn2+ and Cr3+ spins, the exchange
interactions are more complex than that expected from a two sublattice magnetic
system. The electronic structure calculations yield a ferrimagnetic insulating
ground state even in absence of Hubbard U which persists for a wide range of U.
The Mn(1)-O-Mn(2) (out of plane and in-plane), Mn(1)-O-Cr and Mn(2)-O-Cr
superexchange interactions are found to be anti-ferromagnetic, while the
Cr-O-O-Cr super-superexchange is found to be ferromagnetic. The Mn(2)-O-Cr
superexchange is weaker than the Mn(1)-O-Cr superexchange, thus effectively
resulting in ferrimagnetism. From a simple 3-site Hubbard model, we derived
expressions for the antiferromagnetic superexchange strength J_AFM and the
weaker ferromagnetic J_FM. The relative strengths of JAFM for the various
superexchange interactions are in agreement with those obtained from DFT. The
expression for Cr-O-O-Cr super-superexchange strength (J_SS), which is derived
considering a 4-site Hubbard model, predicts a ferromagnetic exchange in
agreement with DFT. Finally, our mean field calculations reveal that assuming a
set of four magnetic sub-lattice for Mn2+ spins and a single magnetic
sublattice for Cr3+ spins yields a much improved T_C, while a simple two
magnetic sublattice model yields a much higher T_C.
","[{""version"":""v1"",""created"":""Thu, 5 May 2022 05:48:09 GMT""},{""version"":""v2"",""created"":""Sun, 12 Jun 2022 08:16:46 GMT""}]","2022-06-14"
"2205.02453","Aigerim Bogyrbayeva","Aigerim Bogyrbayeva, Meraryslan Meraliyev, Taukekhan Mustakhov,
  Bissenbay Dauletbayev","Learning to Solve Vehicle Routing Problems: A Survey",,,,,"cs.LG","http://arxiv.org/licenses/nonexclusive-distrib/1.0/","  This paper provides a systematic overview of machine learning methods applied
to solve NP-hard Vehicle Routing Problems (VRPs). Recently, there has been a
great interest from both machine learning and operations research communities
to solve VRPs either by pure learning methods or by combining them with the
traditional hand-crafted heuristics. We present the taxonomy of the studies for
learning paradigms, solution structures, underlying models, and algorithms. We
present in detail the results of the state-of-the-art methods demonstrating
their competitiveness with the traditional methods. The paper outlines the
future research directions to incorporate learning-based solutions to overcome
the challenges of modern transportation systems.
","[{""version"":""v1"",""created"":""Thu, 5 May 2022 05:48:16 GMT""}]","2022-05-06"
"2205.02454","Diego Antognini","Diego Antognini, Shuyang Li, Boi Faltings, Julian McAuley","Assistive Recipe Editing through Critiquing","Accepted at EACL 2023. 10 pages, 2 figures, 6 tables, 1 algorithm",,,,"cs.CL cs.IR cs.LG","http://arxiv.org/licenses/nonexclusive-distrib/1.0/","  There has recently been growing interest in the automatic generation of
cooking recipes that satisfy some form of dietary restrictions, thanks in part
to the availability of online recipe data. Prior studies have used pre-trained
language models, or relied on small paired recipe data (e.g., a recipe paired
with a similar one that satisfies a dietary constraint). However, pre-trained
language models generate inconsistent or incoherent recipes, and paired
datasets are not available at scale. We address these deficiencies with
RecipeCrit, a hierarchical denoising auto-encoder that edits recipes given
ingredient-level critiques. The model is trained for recipe completion to learn
semantic relationships within recipes. Our work's main innovation is our
unsupervised critiquing module that allows users to edit recipes by interacting
with the predicted ingredients; the system iteratively rewrites recipes to
satisfy users' feedback. Experiments on the Recipe1M recipe dataset show that
our model can more effectively edit recipes compared to strong
language-modeling baselines, creating recipes that satisfy user constraints and
are more correct, serendipitous, coherent, and relevant as measured by human
judges.
","[{""version"":""v1"",""created"":""Thu, 5 May 2022 05:52:27 GMT""},{""version"":""v2"",""created"":""Thu, 26 Jan 2023 15:41:56 GMT""}]","2023-01-27"
"2205.02455","Ashutosh Modi","Abhinav Joshi and Ashwani Bhat and Ayush Jain and Atin Vikram Singh
  and Ashutosh Modi","COGMEN: COntextualized GNN based Multimodal Emotion recognitioN","17 pages (9 main + 8 appendix). Accepted at NAACL 2022",,,,"cs.CL cs.AI cs.LG","http://creativecommons.org/licenses/by-nc-nd/4.0/","  Emotions are an inherent part of human interactions, and consequently, it is
imperative to develop AI systems that understand and recognize human emotions.
During a conversation involving various people, a person's emotions are
influenced by the other speaker's utterances and their own emotional state over
the utterances. In this paper, we propose COntextualized Graph Neural Network
based Multimodal Emotion recognitioN (COGMEN) system that leverages local
information (i.e., inter/intra dependency between speakers) and global
information (context). The proposed model uses Graph Neural Network (GNN) based
architecture to model the complex dependencies (local and global information)
in a conversation. Our model gives state-of-the-art (SOTA) results on IEMOCAP
and MOSEI datasets, and detailed ablation experiments show the importance of
modeling information at both levels.
","[{""version"":""v1"",""created"":""Thu, 5 May 2022 05:54:24 GMT""}]","2022-05-06"
"2205.02456","Yuhang Liu","Yuhang Liu, Wei Wei, Daowan Peng and Feida Zhu","Declaration-based Prompt Tuning for Visual Question Answering","Accepted to IJCAI2022, data and codes are available at
  https://github.com/CCIIPLab/DPT",,,,"cs.CV cs.AI cs.MM","http://arxiv.org/licenses/nonexclusive-distrib/1.0/","  In recent years, the pre-training-then-fine-tuning paradigm has yielded
immense success on a wide spectrum of cross-modal tasks, such as visual
question answering (VQA), in which a visual-language (VL) model is first
optimized via self-supervised task objectives, e.g., masked language modeling
(MLM) and image-text matching (ITM), and then fine-tuned to adapt to downstream
task (e.g., VQA) via a brand-new objective function, e.g., answer prediction.
The inconsistency of the objective forms not only severely limits the
generalization of pre-trained VL models to downstream tasks, but also requires
a large amount of labeled data for fine-tuning. To alleviate the problem, we
propose an innovative VL fine-tuning paradigm (named Declaration-based Prompt
Tuning, abbreviated as DPT), which jointly optimizes the objectives of
pre-training and fine-tuning of VQA model, boosting the effective adaptation of
pre-trained VL models to the downstream task. Specifically, DPT reformulates
the objective form of VQA task via (1) textual adaptation, which converts the
given questions into declarative sentence-form for prompt-tuning, and (2) task
adaptation, which optimizes the objective function of VQA problem in the manner
of pre-training phase. Experimental results on GQA dataset show that DPT
outperforms the fine-tuned counterpart by a large margin regarding accuracy in
both fully-supervised (2.68%) and zero-shot/few-shot (over 31%) settings. All
the data and codes will be available to facilitate future research.
","[{""version"":""v1"",""created"":""Thu, 5 May 2022 05:56:55 GMT""}]","2022-05-06"
"2205.02457","Feng Sun","Feng Sun, Cong Bai","MMINR: Multi-frame-to-Multi-frame Inference with Noise Resistance for
  Precipitation Nowcasting with Radar",,,,,"cs.CV","http://creativecommons.org/licenses/by/4.0/","  Precipitation nowcasting based on radar echo maps is essential in
meteorological research. Recently, Convolutional RNNs based methods dominate
this field, but they cannot be solved by parallel computation resulting in
longer inference time. FCN based methods adopt a multi-frame-to-single-frame
inference (MSI) strategy to avoid this problem. They feedback into the model
again to predict the next time step to get multi-frame nowcasting results in
the prediction phase, which will lead to the accumulation of prediction errors.
In addition, precipitation noise is a crucial factor contributing to high
prediction errors because of its unpredictability. To address this problem, we
propose a novel Multi-frame-to-Multi-frame Inference (MMI) model with Noise
Resistance (NR) named MMINR. It avoids error accumulation and resists
precipitation noise\'s negative effect in parallel computation. NR contains a
Noise Dropout Module (NDM) and a Semantic Restore Module (SRM). NDM
deliberately dropout noise simple yet efficient, and SRM supplements semantic
information of features to alleviate the problem of semantic information
mistakenly lost by NDM. Experimental results demonstrate that MMINR can attain
competitive scores compared with other SOTAs. The ablation experiments show
that the proposed NDM and SRM can solve the aforementioned problems.
","[{""version"":""v1"",""created"":""Thu, 5 May 2022 05:57:11 GMT""}]","2022-05-06"
"2205.02458","Hairun Xie","Hairun Xie, Jing Wang and Miao Zhang","Parametric Generative Schemes with Geometric Constraints for Encoding
  and Synthesizing Airfoils",,,,,"physics.flu-dyn cs.LG","http://arxiv.org/licenses/nonexclusive-distrib/1.0/","  The modern aerodynamic optimization has a strong demand for parametric
methods with high levels of intuitiveness, flexibility, and representative
accuracy, which cannot be fully achieved through traditional airfoil parametric
techniques. In this paper, two deep learning-based generative schemes are
proposed to effectively capture the complexity of the design space while
satisfying specific constraints. 1. Soft-constrained scheme: a Conditional
Variational Autoencoder (CVAE)-based model to train geometric constraints as
part of the network directly. 2. Hard-constrained scheme: a VAE-based model to
generate diverse airfoils and an FFD-based technique to project the generated
airfoils onto the given constraints. According to the statistical results, the
reconstructed airfoils are both accurate and smooth, without any need for
additional filters. The soft-constrained scheme generates airfoils that exhibit
slight deviations from the expected geometric constraints, yet still converge
to the reference airfoil in both geometry space and objective space with some
degree of distribution bias. In contrast, the hard-constrained scheme produces
airfoils with a wider range of geometric diversity while strictly adhering to
the geometric constraints. The corresponding distribution in the objective
space is also more diverse, with isotropic uniformity around the reference
point and no significant bias. These proposed airfoil parametric methods can
break through the boundaries of training data in the objective space, providing
higher quality samples for random sampling and improving the efficiency of
optimization design.
","[{""version"":""v1"",""created"":""Thu, 5 May 2022 05:58:08 GMT""},{""version"":""v2"",""created"":""Thu, 4 May 2023 10:11:21 GMT""}]","2023-05-08"
"2205.02459","Nissim Fraija","Nissim Fraija, Antonio Galvan-Gamez, Boris Betancourt Kamenetskaia,
  Maria G. Dainotti, Simone Dichiara, P. Veres, Rosa L. Becerra and A. C.
  Caligula do E. S. Pedreira","Modeling Gamma-ray burst Afterglow observations with an Off-axis Jet
  emission","36 pages, 16 figures, accepted for publication in ApJ",,"10.3847/1538-4357/ac68e1",,"astro-ph.HE","http://arxiv.org/licenses/nonexclusive-distrib/1.0/","  Gamma-ray bursts (GRBs) are fascinating extragalactic objects. They represent
a fantastic opportunity to investigate unique properties not exhibited in other
sources. Multi-wavelength afterglow observations from some short- and
long-duration GRBs reveal an atypical long-lasting emission that evolves
differently from the canonical afterglow light curves favoring the off-axis
emission. We present an analytical synchrotron afterglow scenario, and the
hydrodynamical evolution of an off-axis top-hat jet decelerated in a stratified
surrounding environment. The analytical synchrotron afterglow model is shown
during the coasting, deceleration (off- and on-axis emission), and the
post-jet-break decay phases, and the hydrodynamical evolution is computed by
numerical simulations showing the time evolution of the Doppler factor, the
half-opening angle, the bulk Lorentz factor, and the deceleration radius. We
show that numerical simulations are in good agreement with those derived with
our analytical approach. We apply the current synchrotron model and describe
successfully the delayed non-thermal emission observed in a sample of long and
short GRBs with evidence of off-axis emission. Furthermore, we provide
constraints on the possible afterglow emission by requiring the
multi-wavelength upper limits derived for the closest Swift-detected GRBs and
promising gravitational-wave events.
","[{""version"":""v1"",""created"":""Thu, 5 May 2022 06:02:41 GMT""}]","2022-12-14"
"2205.02460","Quanming Yao","Yongqi Zhang and Zhanke Zhou and Quanming Yao and Yong Li","KGTuner: Efficient Hyper-parameter Search for Knowledge Graph Learning","Accepted to ACL 2022 (long paper)",,,,"cs.LG","http://arxiv.org/licenses/nonexclusive-distrib/1.0/","  While hyper-parameters (HPs) are important for knowledge graph (KG) learning,
existing methods fail to search them efficiently. To solve this problem, we
first analyze the properties of different HPs and measure the transfer ability
from small subgraph to the full graph. Based on the analysis, we propose an
efficient two-stage search algorithm KGTuner, which efficiently explores HP
configurations on small subgraph at the first stage and transfers the
top-performed configurations for fine-tuning on the large full graph at the
second stage. Experiments show that our method can consistently find better HPs
than the baseline algorithms within the same time budget, which achieves
{9.1\%} average relative improvement for four embedding models on the
large-scale KGs in open graph benchmark.
","[{""version"":""v1"",""created"":""Thu, 5 May 2022 06:09:14 GMT""}]","2022-05-06"
"2205.02461","Walter Kob","Zhen Zhang, Simona Ispas, Walter Kob","Fracture of silicate glasses: Micro-cavities and correlations between
  atomic-level properties",,"Phys. Rev. Mat. 6, 085601 (2022)",,,"cond-mat.dis-nn cond-mat.mtrl-sci cond-mat.stat-mech","http://creativecommons.org/licenses/by/4.0/","  We use large-scale simulations to investigate the dynamic fracture of silica
and sodium-silicate glasses under uniaxial tension. The stress-strain curves
demonstrate that silica glass is brittle whereas the glasses rich in Na show
pronounced ductility. A strong composition dependence is also seen in the crack
velocity which is on the order of 1800 m/s for glasses with low Na
concentration and decreases to 700 m/s if the concentration is high. We find
that during the fracture of Na-rich glasses very irregular cavities as large as
3-4 nm form ahead of the crack front, indicating the presence of nanoductility
in these glasses. Before fracture occurs, the local composition, structure, and
mechanical properties are heterogeneous in space and show a strong dependence
on the applied strain. Further analysis of the correlations between these local
properties allows to obtain a better microscopic understanding of the
deformation and fracture of glasses and how the local heating close to the
crack tip, up to several hundred degrees, permits the structure to relax.
","[{""version"":""v1"",""created"":""Thu, 5 May 2022 06:17:47 GMT""}]","2023-02-15"
"2205.02462","Longfei Yin","Longfei Yin, Yijie Mao, Onur Dizdar, Bruno Clerckx","Rate-Splitting Multiple Access for 6G -- Part II: Interplay with
  Integrated Sensing and Communications",,,,,"cs.IT eess.SP math.IT","http://creativecommons.org/publicdomain/zero/1.0/","  This letter is the second part of a three-part tutorial focusing on
rate-splitting multiple access (RSMA) for 6G. As Part II of the tutorial, this
letter addresses the interplay between RSMA and integrated radar sensing and
communications (ISAC). In particular, we introduce a general RSMAassisted ISAC
architecture, where the ISAC platform has a dual capability to simultaneously
communicate with downlink users and probe detection signals to a moving target.
Then, the metrics of radar sensing and communications are respectively
introduced, followed by a RSMA-assisted ISAC waveform design example which
jointly minimizes the Cramer-Rao bound (CRB) of target estimation and maximizes
the minimum fairness rate (MFR) amongst communication users subject to the
per-antenna power constraint. The superiority of RSMA-assisted ISAC is verifed
through simulation results in both terrestrial and satellite scenarios. RSMA is
demonstrated to be a powerful multiple access and interference management
strategy for ISAC, and provides a better communication-sensing trade-off
compared with the conventional benchmark strategies. Consequently, RSMA is a
promising technology for next generation multiple access (NGMA) and future
networks such as 6G and beyond.
","[{""version"":""v1"",""created"":""Thu, 5 May 2022 06:18:26 GMT""}]","2022-05-06"
"2205.02463","Alexey Gubin","Alexey I. Gubin, Irina A. Protsenko, Alexander A. Barannik, Svetlana
  Vitusevich, Alexandr A. Lavrinovich, Nickolay T. Cherpak","Quartz Whispering-Gallery-Mode Resonator with Microfluidic Chip as
  Sensor for Permittivity Measurement of Liquids",,"IEEE Sensors Journal (Volume: 19, Issue: 18, Sept.15, 2019, Pages:
  7976 - 7982)","10.1109/JSEN.2019.2920345",,"physics.app-ph physics.bio-ph physics.ins-det","http://creativecommons.org/licenses/by-nc-nd/4.0/","  Studies of biological solutions require high measurement accuracy, the
ability to detect low changes in substance concentration, and small amounts of
the liquid under test. A microwave complex permittivity measurement technique
based on a high-quality-factor whispering-gallery-mode resonator with a
microfluidic chip allows small amounts of dielectric liquids to be investigated
with high accuracy. An existing technique based on a sapphire resonator does
not provide for a low-concentration detection limit for substances with low
molecular weight. Here, we present an advanced technique based on a quartz
dielectric resonator. The detection limit obtained for glucose in water
solution was found to be about one order of magnitude lower for the quartz
resonator cell than for the sapphire-resonator-based measurement cell. The
limit is about or lower than the concentration of glucose in human blood. This
fact means that the technique can be used as the sensor for investigations of
biological solutions in the microwave range. A study of glucose, lactalbumin,
and bovine serum albumin was successfully performed in the Ka -band using the
developed sensor.
","[{""version"":""v1"",""created"":""Thu, 5 May 2022 06:19:09 GMT""}]","2022-05-06"
"2205.02464","Aleksey Buzmakov","Aleksey Buzmakov, Egor Dudyrev, Sergei O. Kuznetsov, Tatiana
  Makhalova, and Amedeo Napoli","Experimental Study of Concise Representations of Concepts and
  Dependencies",,,,,"cs.DM","http://arxiv.org/licenses/nonexclusive-distrib/1.0/","  In this paper we are interested in studying concise representations of
concepts and dependencies, i.e., implications and association rules. Such
representations are based on equivalence classes and their elements, i.e.,
minimal generators, minimum generators including keys and passkeys, proper
premises, and pseudo-intents. All these sets of attributes are significant and
well studied from the computational point of view, while their statistical
properties remain to be studied. This is the purpose of this paper to study
these singular attribute sets and in parallel to study how to evaluate the
complexity of a dataset from an FCA point of view. In the paper we analyze the
empirical distributions and the sizes of these particular attribute sets. In
addition we propose several measures of data complexity, such as
distributivity, linearity, size of concepts, size of minimum generators, for
the analysis of real-world and synthetic datasets.
","[{""version"":""v1"",""created"":""Thu, 5 May 2022 06:32:11 GMT""},{""version"":""v2"",""created"":""Thu, 24 Nov 2022 05:39:45 GMT""}]","2022-11-28"
"2205.02465","Thomas Johannes Baumgarten","Petyo Nikolov, Thomas J. Baumgarten, Shady Safwat Hassan, Nur-Deniz
  F\""ullenbach, Gerald Kircheis, Dieter H\""aussinger, Markus J\""ordens, Markus
  Butz, Alfons Schnitzler, Stefan J. Groiss","Paired associative stimulation demonstrates alterations in motor
  cortical synaptic plasticity in patients with hepatic encephalopathy","number of pages: 33; number of tables: 1; number of figures: 5;
  References: 94","Clinical Neurophysiology, Volume 132, Issue 10, October 2021,
  Pages 2332-2341","10.1016/j.clinph.2021.07.019",,"q-bio.NC","http://creativecommons.org/licenses/by-nc-nd/4.0/","  Objective: Hepatic encephalopathy (HE) is a potentially reversible brain
dysfunction caused by liver failure. Altered synaptic plasticity is supposed to
play a major role in the pathophysiology of HE. Here, we used paired
associative stimulation with an inter-stimulus interval of 25 ms (PAS25), a
transcranial magnetic stimulation (TMS) protocol, to test synaptic plasticity
of the motor cortex in patients with manifest HE. Methods: 23 HE-patients and
23 healthy controls were enrolled in the study. Motor evoked potential (MEP)
amplitudes were assessed as measure for cortical excitability. Time courses of
MEP amplitude changes after the PAS25 intervention were compared between both
groups. Results: MEP-amplitudes increased after PAS25 in the control group,
indicating PAS25-induced synaptic plasticity in healthy controls, as expected.
In contrast, MEP-amplitudes within the HE group did not change and were lower
than in the control group, indicating no induction of plasticity. Conclusion:
Our study revealed reduced synaptic plasticity of the primary motor cortex in
HE. Significance: Reduced synaptic plasticity in HE provides a link between
pathological changes on the molecular level and early clinical symptoms of the
disease. This decrease may be caused by disturbances in the glutamatergic
neurotransmission due to the known hyperammonemia in HE patients.
","[{""version"":""v1"",""created"":""Thu, 5 May 2022 06:34:29 GMT""},{""version"":""v2"",""created"":""Fri, 6 May 2022 06:53:23 GMT""}]","2022-05-09"
"2205.02466","Hilal Asi","Hilal Asi, Vitaly Feldman, Kunal Talwar","Optimal Algorithms for Mean Estimation under Local Differential Privacy",,,,,"cs.LG cs.CR","http://arxiv.org/licenses/nonexclusive-distrib/1.0/","  We study the problem of mean estimation of $\ell_2$-bounded vectors under the
constraint of local differential privacy. While the literature has a variety of
algorithms that achieve the asymptotically optimal rates for this problem, the
performance of these algorithms in practice can vary significantly due to
varying (and often large) hidden constants. In this work, we investigate the
question of designing the protocol with the smallest variance. We show that
PrivUnit (Bhowmick et al. 2018) with optimized parameters achieves the optimal
variance among a large family of locally private randomizers. To prove this
result, we establish some properties of local randomizers, and use
symmetrization arguments that allow us to write the optimal randomizer as the
optimizer of a certain linear program. These structural results, which should
extend to other problems, then allow us to show that the optimal randomizer
belongs to the PrivUnit family.
  We also develop a new variant of PrivUnit based on the Gaussian distribution
which is more amenable to mathematical analysis and enjoys the same optimality
guarantees. This allows us to establish several useful properties on the exact
constants of the optimal error as well as to numerically estimate these
constants.
","[{""version"":""v1"",""created"":""Thu, 5 May 2022 06:43:46 GMT""}]","2022-05-06"
