"2205.03841","Diego Berti","Diego Berti, Luca Bisconti, Davide Catania","A regularity criterion for a 3D tropical climate model with damping","16 pages. Amended version of the article, which has been accepted by
  J. Math. Anal. Appl",,,,"math.AP","http://creativecommons.org/licenses/by/4.0/","  In this paper we deal with the 3D tropical climate model with damping terms
in the equation of the barotropic mode $u$ and in the equation of the first
baroclinic mode $v$ of the velocity, and we establish a regularity criterion
for this system thanks to which the local smooth solution $(u, v, \theta)$ can
actually be extended globally in time.
","[{""version"":""v1"",""created"":""Sun, 8 May 2022 11:21:50 GMT""},{""version"":""v2"",""created"":""Thu, 7 Jul 2022 15:20:51 GMT""},{""version"":""v3"",""created"":""Tue, 13 Sep 2022 10:59:36 GMT""}]","2022-09-14"
"2205.03842","Shokoufe Faraji","Shokoufe Faraji, Audrey Trova, Hernando Quevedo","Relativistic equilibrium fluid configurations around rotating deformed
  compact objects",,,"10.1140/epjc/s10052-022-11075-5",,"gr-qc","http://arxiv.org/licenses/nonexclusive-distrib/1.0/","  We investigate the physical properties of equilibrium sequences of
non-self-gravitating surfaces that characterize thick disks around a rotating
deformed compact object described by a stationary generalization of the static
q-metric. The spacetime corresponds to an exact solution of Einstein's field
equations so that we can perform the analysis for arbitrary values of the
quadrupole moment and rotation parameter. To study the properties of this
disk's model, we analyze bounded trajectories in this spacetime. Further, we
find that depending on the values of the parameters, we can have various disc
structures that can easily be distinguished from the static case and also from
the Schwarzschild background. We argue that this study may be used to evaluate
the rotation and quadrupole parameters of the central compact object.
","[{""version"":""v1"",""created"":""Sun, 8 May 2022 11:55:17 GMT""}]","2023-01-04"
"2205.03843","Maria Spethmann","Maria Spethmann, Xian-Peng Zhang, Jelena Klinovaja, Daniel Loss","Coupled superconducting spin qubits with spin-orbit interaction",,"Phys. Rev. B 106, 115411 (2022)","10.1103/PhysRevB.106.115411",,"cond-mat.mes-hall quant-ph","http://creativecommons.org/licenses/by/4.0/","  Superconducting spin qubits, also known as Andreev spin qubits, promise to
combine the benefits of superconducting qubits and spin qubits defined in
quantum dots. While most approaches to control these qubits rely on controlling
the spin degree of freedom via the supercurrent, superconducting spin qubits
can also be coupled to each other via the superconductor to implement two-qubit
quantum gates. We theoretically investigate the interaction between
superconducting spin qubits in the weak tunneling regime and concentrate on the
effect of spin-orbit interaction (SOI), which can be large in
semiconductor-based quantum dots and thereby offers an additional tuning
parameter for quantum gates. We find analytically that the effective
interaction between two superconducting spin qubits consists of Ising,
Heisenberg, and Dzyaloshinskii-Moriya interactions and can be tuned by the
superconducting phase difference, the tunnel barrier strength, or the SOI
parameters. The Josephson current becomes dependent on SOI and spin
orientations. We demonstrate that this interaction can be used for fast
controlled phase-flip gates with a fidelity >99.99%. We propose a scalable
network of superconducting spin qubits which is suitable for implementing the
surface code.
","[{""version"":""v1"",""created"":""Sun, 8 May 2022 12:04:37 GMT""},{""version"":""v2"",""created"":""Mon, 12 Sep 2022 07:43:52 GMT""}]","2022-09-14"
"2205.03844","Georgi Grahovski G","Vladimir S. Gerdjikov, Georgi G. Grahovski and Alexander A. Stefanov","Real Hamiltonian forms of affine Toda field theories: spectral aspects","22 pages, LaTeX",,"10.1134/S0040577922080037",,"nlin.SI hep-th math-ph math.MP","http://creativecommons.org/licenses/by/4.0/","  The paper is devoted to real Hamiltonian forms of 2-dimensional Toda field
theories related to exceptional simple Lie algebras, and to the spectral theory
of the associated Lax operators. Real Hamiltonian forms are a special type of
""reductions"" of Hamiltonian systems, similar to real forms of semi-simple Lie
algebras. Examples of real Hamiltonian forms of affine Toda field theories
related to exceptional complex untwisted affine Kac-Moody algebras are studied.
Along with the associated Lax representations, we also formulate the relevant
Riemann-Hilbert problems and derive the minimal sets of scattering data that
determine uniquely the scattering matrices and the potentials of the Lax
operators.
","[{""version"":""v1"",""created"":""Sun, 8 May 2022 12:11:01 GMT""}]","2022-09-14"
"2205.03845","Russell Hendel","Russell Jay Hendel","A System of Four simultaneous Recursions: Generalization of the
  Ledin-Shannon-Ollerton Identity",,,,,"math.CO","http://arxiv.org/licenses/nonexclusive-distrib/1.0/","  This paper further generalizes a recent result of Shannon and Ollerton who
resurrected an old identity due to Ledin. This paper generalizes the
Ledin-Shannon-Ollerton result to all the metallic sequences. The results give
closed formulas for the sum of products of powers of the first $n$ integers
with the first $n$ members of the metallic sequence. Three key innovations of
this paper are i) reducing the proof of the generalization to the solution of a
system of 4 simultaneous recursions; ii) use of the shift operation to prove
equality of polynomials; and iii) new OEIS sequences arising from the
coefficients of the four polynomial families satisfying the 4 simultaneous
recursions.
","[{""version"":""v1"",""created"":""Sun, 8 May 2022 12:12:42 GMT""}]","2022-05-10"
"2205.03846","Mathew Thomas Mr.","Mathew Thomas Arun and Debajyoti Choudhury","Neutron oscillation and Baryogenesis from six dimensions","6 pages, 1 figure",,"10.1103/PhysRevD.106.L031701",,"hep-ph hep-th","http://creativecommons.org/licenses/by/4.0/","  Considering a six-dimensional geometry orbifolded on $S^1/Z_2\times S^1/Z_2$
with quarks and leptons localised on orthogonal branes, we show that the
construction admits observable $n-\bar{n}$ oscillation while naturally
suppressing the proton decay rates. Consistent with other low-energy
observables, the model also accommodates baryogenesis at $\mathcal{O}$(10 TeV)
scale.
","[{""version"":""v1"",""created"":""Sun, 8 May 2022 12:21:39 GMT""}]","2022-08-31"
"2205.03847","Timm Weitkamp","Alain Bourmaud, Lola Pinsard, Elouan Guillou, Emmanuel De Luycker,
  Marina Fazzini, Jonathan Perrin, Timm Weitkamp, Pierre Ouagne","Elucidating the formation of structural defects in flax fibres through
  synchrotron X-ray phase-contrast microtomography","16 pages, 8 figures, 1 table. Accepted for publication in Industrial
  Crops and Products (ISSN 0926-6690)","Industrial Crops & Products 184 (2022) 115048","10.1016/j.indcrop.2022.115048",,"physics.app-ph cond-mat.mtrl-sci","http://arxiv.org/licenses/nonexclusive-distrib/1.0/","  The creation and ultrastructure of kink-bands in flax fibres are key issues
for developing more and more performing biobased composite materials.
Nevertheless, despite many hypotheses and structural characterization, the
exact origin of kink-bands and the moment they appear remain unexplained. Here,
by using cutting-edge techniques such as microtomography, a range of flax stems
and fibres, from the green stem to stretched fibres, were morphologically
explored. The study shows that all the extracted fibres, whether scutched,
combed or stretched, contain significant amounts of kink-bands, which can be
identified by the large pores they contain. On the other hand, at the scale of
the green or retted stems, tomographic analysis does not reveal any kink-bands.
These original observations suggest that the stress undergone by the plants
during their growth is not sufficient, without major growth or lodging
accidents, to generate these structural defects; the latter are only revealed
after mechanical extraction of the fibres. Hypotheses regarding the kink-band
appearance deformation levels are also given to complete the observations.
","[{""version"":""v1"",""created"":""Sun, 8 May 2022 12:21:40 GMT""}]","2022-05-13"
"2205.03848","Michael Harris","Michael Harris","Local Langlands correspondences","For the proceedings of the conference ""Theta Series: Representation
  Theory, Geometry, and Arithmetic"" in honor of Steve Kudla's 70th birthday",,,,"math.RT math.NT","http://arxiv.org/licenses/nonexclusive-distrib/1.0/","  The first part of this article is a review of the properties expected of any
local Langlands correspondence that aims to be considered ""canonical,"" and of
known results that establish some or all of these properties for specific
groups. In the absence of compatibility with a global correspondence it is not
known in general that this list of desirable properties suffices to
characterize the correspondence. The remainder of the article outlines elements
of a strategy to prove that the $L$-packets attached to irreducible local
parameters are finite and non-empty, in particular, for the specific
parametrization constructed by Genestier and Lafforgue when $F$ is of positive
characteristic.
","[{""version"":""v1"",""created"":""Sun, 8 May 2022 12:22:37 GMT""}]","2022-05-10"
"2205.03849","Andrey Tyukhtin V.","Tatiana Yu. Alekhina and Andrey V. Tyukhtin","Radiation of a bunch in a waveguide having areas with deeply corrugated
  and smooth walls",,,,,"physics.acc-ph physics.app-ph","http://arxiv.org/licenses/nonexclusive-distrib/1.0/","  We analyze radiation from a bunch that uniformly moves in a circular
waveguide and crosses the boundary between two areas: with a corrugated wall
and with a smooth wall. It is assumed that the corrugation period is much less
than the wavelengths under consideration. However, in difference with our
pervious works, the corrugation depth is of the same order as the wavelength.
The influence of corrugation on the electromagnetic field is investigated using
the method of equivalent boundary conditions. At first, we consider a regular
corrugated waveguide. Then two cases of the waveguides with boundaries between
the corrugated and smooth regions is studied: first, when the bunch flies out
of the corrugated part into the smooth one, and second, when the bunch flies
into the corrugated part from the smooth one. We obtain and analyze the
analytical expressions for the field components in both areas and reveal the
main physical peculiarities of the bunch radiation.
","[{""version"":""v1"",""created"":""Sun, 8 May 2022 12:30:54 GMT""},{""version"":""v2"",""created"":""Sat, 6 May 2023 18:40:16 GMT""}]","2023-05-09"
"2205.03850","Jiawei Xu","Jiawei Xu and Wenxuan Fu and Haoyu Bu and Zhi Wang and Lingyun Ying","SeqNet: An Efficient Neural Network for Automatic Malware Detection",,,,,"cs.CR cs.LG cs.SY eess.SY","http://creativecommons.org/licenses/by/4.0/","  Malware continues to evolve rapidly, and more than 450,000 new samples are
captured every day, which makes manual malware analysis impractical. However,
existing deep learning detection models need manual feature engineering or
require high computational overhead for long training processes, which might be
laborious to select feature space and difficult to retrain for mitigating model
aging. Therefore, a crucial requirement for a detector is to realize automatic
and efficient detection. In this paper, we propose a lightweight malware
detection model called SeqNet which could be trained at high speed with low
memory required on the raw binaries. By avoiding contextual confusion and
reducing semantic loss, SeqNet maintains the detection accuracy when reducing
the number of parameters to only 136K. We demonstrate the effectiveness of our
methods and the low training cost requirement of SeqNet in our experiments.
Besides, we make our datasets and codes public to stimulate further academic
research.
","[{""version"":""v1"",""created"":""Sun, 8 May 2022 12:31:35 GMT""}]","2022-05-10"
"2205.03851","Yasuyuki Hamura","Yasuyuki Hamura","Bayesian Estimation of Multinomial Cell Probabilities Incorporating
  Information from Aggregated Observations","11 pages",,,,"math.ST stat.TH","http://arxiv.org/licenses/nonexclusive-distrib/1.0/","  In this note, we consider the problem of estimating multinomial cell
probabilities under the entropy loss when side information in aggregated data
is available. We use the Jeffreys prior to obtain Bayes estimators. It is shown
that by incorporating the side information, we can construct an improved
estimator.
","[{""version"":""v1"",""created"":""Sun, 8 May 2022 12:34:42 GMT""}]","2022-05-10"
"2205.03852","Apostolos Chalkis","Cyril Bachelard, Apostolos Chalkis, Vissarion Fisikopoulos, Elias
  Tsigaridas","Randomized geometric tools for anomaly detection in stock markets","39 pages, 14 figures, 9 tables",,,,"cs.CG econ.GN q-fin.EC stat.AP stat.CO","http://creativecommons.org/publicdomain/zero/1.0/","  We propose novel randomized geometric tools to detect low-volatility
anomalies in stock markets; a principal problem in financial economics. Our
modeling of the (detection) problem results in sampling and estimating the
(relative) volume of geodesically non-convex and non-connected spherical
patches that arise by intersecting a non-standard simplex with a sphere. To
sample, we introduce two novel Markov Chain Monte Carlo (MCMC) algorithms that
exploit the geometry of the problem and employ state-of-the-art continuous
geometric random walks (such as Billiard walk and Hit-and-Run) adapted on
spherical patches. To our knowledge, this is the first geometric formulation
and MCMC-based analysis of the volatility puzzle in stock markets. We have
implemented our algorithms in C++ (along with an R interface) and we illustrate
the power of our approach by performing extensive experiments on real data. Our
analyses provide accurate detection and new insights into the distribution of
portfolios' performance characteristics. Moreover, we use our tools to show
that classical methods for low-volatility anomaly detection in finance form bad
proxies that could lead to misleading or inaccurate results.
","[{""version"":""v1"",""created"":""Sun, 8 May 2022 12:39:07 GMT""},{""version"":""v2"",""created"":""Sun, 15 May 2022 11:26:00 GMT""}]","2022-05-17"
"2205.03853","Ling Luo","Ling Luo, Chih-Hsuan Wei, Po-Ting Lai, Qingyu Chen, Rezarta Islamaj
  Do\u{g}an, Zhiyong Lu","Assigning Species Information to Corresponding Genes by a Sequence
  Labeling Framework",,"Database, Volume 2022, 2022, baac090","10.1093/database/baac090",,"cs.CL cs.IR cs.LG q-bio.GN","http://creativecommons.org/licenses/by/4.0/","  The automatic assignment of species information to the corresponding genes in
a research article is a critically important step in the gene normalization
task, whereby a gene mention is normalized and linked to a database record or
identifier by a text-mining algorithm. Existing methods typically rely on
heuristic rules based on gene and species co-occurrence in the article, but
their accuracy is suboptimal. We therefore developed a high-performance method,
using a novel deep learning-based framework, to classify whether there is a
relation between a gene and a species. Instead of the traditional binary
classification framework in which all possible pairs of genes and species in
the same article are evaluated, we treat the problem as a sequence-labeling
task such that only a fraction of the pairs needs to be considered. Our
benchmarking results show that our approach obtains significantly higher
performance compared to that of the rule-based baseline method for the species
assignment task (from 65.8% to 81.3% in accuracy). The source code and data for
species assignment are freely available at
https://github.com/ncbi/SpeciesAssignment.
","[{""version"":""v1"",""created"":""Sun, 8 May 2022 12:39:45 GMT""}]","2022-10-17"
"2205.03854","John Laird","John E. Laird","Introduction to Soar","29 pages",,,,"cs.AI","http://creativecommons.org/licenses/by-nc-nd/4.0/","  This paper is the recommended initial reading for a functional overview of
Soar, version 9.6. It includes an abstract overview of the architectural
structure of Soar including its processing, memories, learning modules, their
interfaces, and the representations of knowledge used by those modules. From
there it describes the processing supported by those modules, including
decision making, impasses and substates, procedure learning via chunking,
reinforcement learning, semantic memory, episodic memory, and spatial-visual
reasoning. It then reviews the levels of decision making and variety of
learning in Soar, and analysis of Soar as an architecture supporting general
human-level AI. Following the references is an appendix that contains short
descriptions of recent Soar agents and a glossary of the terminology we use in
describing Soar.
","[{""version"":""v1"",""created"":""Sun, 8 May 2022 12:44:51 GMT""}]","2022-05-10"
"2205.03855","Mingzhe Han","Ming-Zhe Han, Shao-Peng Tang, and Yi-Zhong Fan","Nonparametric Representation of Neutron Star Equation of State Using
  Variational Auto-Encoder","9 pages, 4 figures, and 1 table",,,,"astro-ph.HE astro-ph.IM nucl-th","http://arxiv.org/licenses/nonexclusive-distrib/1.0/","  We introduce a new nonparametric representation of the neutron star (NS)
equation of state (EoS) by using the variational auto-encoder (VAE). As a deep
neural network, the VAE is widely used for dimensionality reduction since it
can compress input data to a low dimensional latent space using the encoder
component and then reconstruct the data using the decoder component. Once a VAE
is trained one can take the decoder of the VAE as a generator. We employ
100,000 EoSs generated with the nonparametric representation method in
\citet{2021ApJ...919...11H} as the training set and try different settings of
the neural network, then get an EoS generator (trained VAE's decoder) with 4
parameters. We use the mass\textendash{}tidal-deformability data of binary
neutron star (BNS) merger event GW170817, and the mass\textendash{}radius data
of PSR J0030+0451, PSR J0740-6620, PSR J0437-4715, and 4U 1702-429 to perform
the joint Bayesian inference. We find out that
$R_{1.4}=12.66^{+0.71}_{-0.54}\,\rm km$, $\Lambda_{1.4}=484^{+118}_{-90}$, and
$M_{\rm max}=2.30^{+0.30}_{-0.21}\,\rm M_\odot$ ($90\%$ credible levels), where
$R_{1.4}$/$\Lambda_{1.4}$ are the radius/tidal-deformability of a canonical
$1.4\,\rm M_\odot$ NS, and $M_{\rm max}$ is the maximum mass of a non-rotating
NS.
","[{""version"":""v1"",""created"":""Sun, 8 May 2022 12:58:58 GMT""}]","2022-05-10"
"2205.03856","Lokahith Narendra Agasthya","Lokahith Agasthya, Andreas Bartel, Luca Biferale, Matthias Ehrhardt,
  Federico Toschi","Large-scale convective flow sustained by thermally active Lagrangian
  tracers",,,"10.1017/jfm.2022.892",,"physics.flu-dyn","http://creativecommons.org/licenses/by/4.0/","  Non-isothermal particles suspended in a fluid lead to complex interactions --
the particles respond to changes in the fluid flow, which in turn is modified
by their temperature anomaly. Here, we perform a novel proof-of-concept
numerical study based on tracer particles that are thermally coupled to the
fluid. We imagine that particles can adjust their internal temperature reacting
to some local fluid properties and follow simple, hard-wired active control
protocols. We study the case where instabilities are induced by switching the
particle temperature from hot to cold depending on whether it is ascending or
descending in the flow. A macroscopic transition from a stable to unstable
convective flow is achieved, depending on the number of active particles and
their excess negative/positive temperature. The stable state is characterized
by a flow with low turbulent kinetic energy, strongly stable temperature
gradient, and no large-scale features. The convective state is characterized by
higher turbulent kinetic energy, self-sustaining large-scale convection, and
weakly stable temperature gradients. The particles individually promote the
formation of stable temperature gradients, while their aggregated effect
induces large-scale convection. When the Lagrangian temperature scale is small,
a weakly convective laminar system forms. The Lagrangian approach is also
compared to a uniform Eulerian bulk heating with the same mean injection
profile and no such transition is observed. Our empirical approach shows that
thermal convection can be controlled by pure Lagrangian forcing and opens the
way for other data-driven particle-based protocols to enhance or deplete
large-scale motion in thermal flows.
","[{""version"":""v1"",""created"":""Sun, 8 May 2022 13:01:19 GMT""},{""version"":""v2"",""created"":""Mon, 5 Dec 2022 09:41:04 GMT""}]","2022-12-06"
"2205.03857","Cy Qiu","Xiying Fan, Tianzhi Xia, Huahui Qiu, Qicheng Zhang, and Chunyin Qiu","Tracking valley topology with synthetic Weyl paths","Phys.Rev.Lett. Accepted",,"10.1103/PhysRevLett.128.216403",,"cond-mat.mes-hall cond-mat.other physics.app-ph","http://creativecommons.org/licenses/by/4.0/","  Inspired by the newly emergent valleytronics, great interest has been
attracted to the topological valley transport in classical metacrystals. The
presence of nontrivial domain-wall states is interpreted with a concept of
valley Chern number, which is well defined only in the limit of small bandgap.
Here, we propose a new visual angle to track the intricate valley topology in
classical systems. Benefiting from the controllability of our acoustic
metacrystals, we construct Weyl points in synthetic three-dimensional momentum
space through introducing an extra structural parameter (rotation angle here).
As such, the two-dimensional valley-projected band topology can be tracked with
the strictly quantized topological charge in three-dimensional Weyl crystal,
which features open surface arcs connecting the synthetic Weyl points and
gapless chiral surface states along specific Weyl paths. All theoretical
predictions are conclusively identified by our acoustic experiments. Our
findings may promote the development of topological valley physics, which is
less well-defined yet under hot debate in multiple physical disciplines.
","[{""version"":""v1"",""created"":""Sun, 8 May 2022 13:02:19 GMT""}]","2022-06-08"
"2205.03858","Dipankar Roy","Dipankar Roy, Abhishek Dhar, Herbert Spohn, Manas Kulkarni","Robustness of Kardar-Parisi-Zhang scaling in a classical integrable spin
  chain with broken integrability","10 pages, 9 figures (including supplementary material)",,"10.1103/PhysRevB.107.L100413",,"cond-mat.stat-mech math-ph math.MP nlin.CD","http://arxiv.org/licenses/nonexclusive-distrib/1.0/","  Recent investigations have observed superdiffusion in integrable classical
and quantum spin chains. An intriguing connection between these spin chains and
Kardar-Parisi-Zhang (KPZ) universality class has emerged. Theoretical
developments (e.g. generalized hydrodynamics) have highlighted the role of
integrability as well as spin-symmetry in KPZ behaviour. However understanding
their precise role on superdiffusive transport still remains a challenging
task. The widely used quantum spin chain platform comes with severe numerical
limitations. To circumvent this barrier, we focus on a classical integrable
spin chain which was shown to have deep analogy with the quantum
spin-$\frac{1}{2}$ Heisenberg chain. Remarkably, we find that KPZ behaviour
prevails even when one considers integrability-breaking but spin-symmetry
preserving terms, strongly indicating that spin-symmetry plays a central role
even in the non-perturbative regime. On the other hand, in the non-perturbative
regime, we find that energy correlations exhibit clear diffusive behaviour. We
also study the classical analog of out-of-time-ordered correlator (OTOC) and
Lyapunov exponents. We find significant presence of chaos for the
integrability-broken cases even though KPZ behaviour remains robust. The
robustness of KPZ behaviour is demonstrated for a wide class of spin-symmetry
preserving integrability-breaking terms.
","[{""version"":""v1"",""created"":""Sun, 8 May 2022 13:08:31 GMT""}]","2023-03-21"
"2205.03859","Vedant Singh","Vedant Singh, Surgan Jandial, Ayush Chopra, Siddharth Ramesh, Balaji
  Krishnamurthy, Vineeth N. Balasubramanian","On Conditioning the Input Noise for Controlled Image Generation with
  Diffusion Models","Accepted at the workshop on AI for Content Creation at CVPR 2022",,,,"cs.CV cs.LG","http://creativecommons.org/licenses/by/4.0/","  Conditional image generation has paved the way for several breakthroughs in
image editing, generating stock photos and 3-D object generation. This
continues to be a significant area of interest with the rise of new
state-of-the-art methods that are based on diffusion models. However, diffusion
models provide very little control over the generated image, which led to
subsequent works exploring techniques like classifier guidance, that provides a
way to trade off diversity with fidelity. In this work, we explore techniques
to condition diffusion models with carefully crafted input noise artifacts.
This allows generation of images conditioned on semantic attributes. This is
different from existing approaches that input Gaussian noise and further
introduce conditioning at the diffusion model's inference step. Our experiments
over several examples and conditional settings show the potential of our
approach.
","[{""version"":""v1"",""created"":""Sun, 8 May 2022 13:18:14 GMT""}]","2022-05-10"
