"2206.00589","Katherine Thompson","Benjamin Rainear, Katherine Thompson","Elementary Proofs of Representation by Ternary Quadratic Forms",,,,,"math.NT","http://creativecommons.org/licenses/by-nc-sa/4.0/","  Mordell in 1958 gave a new proof of the three squares theorem. Those
techniques were generalized by Blackwell, et al., in 2016 to characterize the
integers represented by the remaining six ""Ramanujan-Dickson ternaries"". We
continue the generalization of these techniques to four additional forms.
","[{""version"":""v1"",""created"":""Wed, 1 Jun 2022 16:01:02 GMT""}]","2022-06-02"
"2206.00590","Maria Tackett","Maria Tackett, Shira Viel, Kim Manturuk","A validation of the short-form classroom community scale for
  undergraduate mathematics and statistics students",,,,,"stat.OT","http://creativecommons.org/licenses/by-nc-nd/4.0/","  This study examines Cho and Demmans Epp's short-form adaptation of Rovai's
well-known Classroom Community Scale (CCS-SF) as a measure of classroom
community among introductory undergraduate math and statistics students. A
series of statistical analyses were conducted to investigate the validity of
the CCS-SF for this new population. Data were collected from 351 students
enrolled in 21 online classes, offered for credit in Fall 2020 and Spring 2021
at a private university in the United States. Further confirmatory analysis was
conducted with data from 128 undergraduates enrolled in 13 in-person and hybrid
classes, offered for credit in Fall 2021 at the same institution. Following
Rovai's original 20-item CCS, the 8-item CCS-SF yields two interpretable
factors, connectedness and learning. This study confirms the two-factor
structure of the CCS-SF, and concludes that it is a valid measure of classroom
community among undergraduate students enrolled in remote, hybrid, and
in-person introductory mathematics and statistics courses.
","[{""version"":""v1"",""created"":""Wed, 1 Jun 2022 16:02:55 GMT""},{""version"":""v2"",""created"":""Thu, 1 Sep 2022 18:20:03 GMT""},{""version"":""v3"",""created"":""Thu, 29 Dec 2022 21:37:31 GMT""}]","2023-01-02"
"2206.00591","Jaewoo Joo","Jaewoo Joo and Timothy P. Spiller","Commutation simulator for open quantum dynamics","11 pages and 2 figures",,,,"quant-ph","http://arxiv.org/licenses/nonexclusive-distrib/1.0/","  Recent progress in quantum simulation and algorithms has demonstrated a rapid
expansion in capabilities. The search continues for new techniques and
applications to exploit quantum advantage. Here we propose an innovative method
to investigate directly the properties of a time-dependent density operator
$\hat{\rho}(t)$. Using generalised quantum commutation simulators, we can
directly compute the expectation value of the commutation relation and thus of
the rate of change of $\hat{\rho}(t)$. The approach can be utilised as a
quantum eigen-vector solver for the von Neumann equation and a decoherence
investigator for the Lindblad equation, by using just the statistics of
single-qubit measurements. A simple but important example is demonstrated in
the single-qubit case and we discuss extension of the method for practical
quantum simulation with many qubits, towards investigation of more realistic
quantum systems.
","[{""version"":""v1"",""created"":""Wed, 1 Jun 2022 16:03:43 GMT""}]","2022-06-02"
"2206.00592","Xinshu Ma","Xinshu Ma, Florentin Rochet, Tariq Elahi","Stopping Silent Sneaks: Defending against Malicious Mixes with
  Topological Engineering",,,,,"cs.CR","http://arxiv.org/licenses/nonexclusive-distrib/1.0/","  Mixnets provide strong meta-data privacy and recent academic research and
industrial projects have made strides in making them more secure, performance,
and scalable. In this paper, we focus our work on stratified Mixnets -- a
popular design with real-world adoption -- and identify that there still exist
heretofore inadequately explored practical aspects such as: relay sampling and
topology placement, network churn, and risks due to real-world usage patterns.
We show that, due to the lack of incorporating these aspects, Mixnets of this
type are far more susceptible to user deanonymization than expected. In order
to reason and resolve these issues, we model Mixnets as a three-stage
``Sample-Placement-Forward'' pipeline, and using the results of our evaluation
propose a novel Mixnet design, Bow-Tie. Bow-Tie mitigates user deanonymization
through a novel adaption of Tor's guard design with an engineered guard layer
and client guard-logic for stratified mixnets. We show that Bow-Tie has
significantly higher user anonymity in the dynamic setting, where the Mixnet is
used over a period of time, and is no worse in the static setting, where the
user only sends a single message. We show the necessity of both the guard layer
and client guard-logic in tandem as well as their individual effect when
incorporated into other reference designs. Ultimately, Bow-Tie is a significant
step towards addressing the gap between the design of Mixnets and practical
deployment and wider adoption because it directly addresses real-world user and
Mixnet operator concerns.
","[{""version"":""v1"",""created"":""Wed, 1 Jun 2022 16:04:41 GMT""},{""version"":""v2"",""created"":""Thu, 2 Jun 2022 10:00:43 GMT""},{""version"":""v3"",""created"":""Tue, 7 Jun 2022 09:54:53 GMT""},{""version"":""v4"",""created"":""Thu, 4 Aug 2022 13:17:30 GMT""}]","2022-08-05"
"2206.00593","Steffen Schmid","Steffen A. Schmid, Uwe Niedermayer","Design Study of a Dielectric Laser Undulator",,,"10.1103/PhysRevAccelBeams.25.091301",,"physics.acc-ph physics.optics","http://creativecommons.org/licenses/by-nc-nd/4.0/","  Dielectric laser acceleration (DLA) achieves remarkable gradients from the
optical near fields of a grating structure. Tilting the dielectric grating with
respect to the electron beam leads to deflection forces and the DLA structure
can be utilized as a microchip undulator. We investigate the beam dynamics in
such structures analytically and by numerical simulations. A crucial challenge
is to keep the beam focused, especially in direction of the narrow channel. An
alternating phase focusing scheme is optimized for this purpose and matched
lattice functions are obtained. We distinguish synchronous operation with phase
jumps in the grating and asynchronous operation with a strictly periodic
grating and well-designed synchronicity mismatch. Especially the asynchronous
DLA undulator is a promising approach, since a simple, commercially available
grating suffices for the focusing lattice design. We pave the way towards
experiments of radiation generation in these structures and provide estimates
of the emitted radiation wavelength and power. The analytical models are
validated by numerical simulations in the dedicated DLA simulation tool
DLAtrack6D and Astra, where the underlying laser fields are computed by CST
Studio.
","[{""version"":""v1"",""created"":""Wed, 1 Jun 2022 16:06:21 GMT""}]","2022-09-21"
"2206.00594","Louis Esperet","Marthe Bonamy, \'Edouard Bonnet, Hugues D\'epr\'es, Louis Esperet,
  Colin Geniet, Claire Hilaire, St\'ephan Thomass\'e, and Alexandra Wesolek","Sparse graphs with bounded induced cycle packing number have logarithmic
  treewidth","29 pages, 6 figures. v4: updated intro",,,,"math.CO cs.DS","http://arxiv.org/licenses/nonexclusive-distrib/1.0/","  A graph is $O_k$-free if it does not contain $k$ pairwise vertex-disjoint and
non-adjacent cycles. We show that Maximum Independent Set and 3-Coloring in
$O_k$-free graphs can be solved in quasi-polynomial time. As a main technical
result, we establish that ""sparse"" (here, not containing large complete
bipartite graphs as subgraphs) $O_k$-free graphs have treewidth (even, feedback
vertex set number) at most logarithmic in the number of vertices. This is
proven sharp as there is an infinite family of $O_2$-free graphs without
$K_{3,3}$-subgraph and whose treewidth is (at least) logarithmic.
  Other consequences include that most of the central NP-complete problems
(such as Maximum Independent Set, Minimum Vertex Cover, Minimum Dominating Set,
Minimum Coloring) can be solved in polynomial time in sparse $O_k$-free graphs,
and that deciding the $O_k$-freeness of sparse graphs is polynomial time
solvable.
","[{""version"":""v1"",""created"":""Wed, 1 Jun 2022 16:06:38 GMT""},{""version"":""v2"",""created"":""Tue, 14 Jun 2022 10:57:46 GMT""},{""version"":""v3"",""created"":""Mon, 18 Jul 2022 08:18:18 GMT""},{""version"":""v4"",""created"":""Tue, 11 Apr 2023 12:12:39 GMT""}]","2023-04-12"
"2206.00595","Timothy Parker","Umberto Grandi, Emiliano Lorini, Timothy Parker, Rachid Alami","Logic-Based Ethical Planning",,,,,"cs.AI","http://creativecommons.org/licenses/by/4.0/","  In this paper we propose a framework for ethical decision making in the
context of planning, with intended application to robotics. We put forward a
compact but highly expressive language for ethical planning that combines
linear temporal logic with lexicographic preference modelling. This original
combination allows us to assess plans both with respect to an agent's values
and their desires, introducing the novel concept of the morality level of an
agent and moving towards multigoal, multivalue planning. We initiate the study
of computational complexity of planning tasks in our setting, and we discuss
potential applications to robotics.
","[{""version"":""v1"",""created"":""Wed, 1 Jun 2022 16:07:53 GMT""},{""version"":""v2"",""created"":""Thu, 2 Jun 2022 08:19:41 GMT""}]","2022-06-03"
"2206.00596","Victor Goryunov","J.W. Bruce, V.V. Goryunov and G.J. Haslinger","Families of skew-symmetric matrices of even size","23 pages",,,,"math.AG math.CV","http://creativecommons.org/licenses/by/4.0/","  The main result of the paper is a classification of singularities of complex
skew-symmetric matrix families of even size which are simple under a natural
equivalence relation. The classification is obtained by appropriate suspensions
of simple families of arbitrary square matrices classified by Bruce and Tari.
The suspensions we are using are based on the embedding of a space of arbitrary
square matrices into the space of skew-symmetric matrices of twice the size. We
also show that similar relations embed Bruce's classification of simple
symmetric matrix families into the Bruce-Tari simple list. Our constructions
introduce a unified approach to all three simple classifications.
","[{""version"":""v1"",""created"":""Wed, 1 Jun 2022 16:09:03 GMT""},{""version"":""v2"",""created"":""Mon, 12 Sep 2022 13:49:56 GMT""}]","2022-09-13"
"2206.00597","Anakin Dey","Anakin Dey, Melkior Ornik","Post-Disaster Repair Crew Assignment Optimization Using Minimum Latency","7 pages, 5 figures",,,,"cs.MA","http://arxiv.org/licenses/nonexclusive-distrib/1.0/","  Across infrastructure domains, physical damage caused by storms and other
weather events often requires costly and time-sensitive repairs to restore
services as quickly as possible. While recent studies have used agent-based
models to estimate the cost of repairs, the implemented strategies for
assignment of repair crews to different locations are generally human-driven or
based on simple rules. In order to find performant strategies, we continue with
an agent-based model, but approach this problem as a combinational optimization
problem known as the Minimum Weighted Latency Problem for multiple repair
crews. We apply a partitioning algorithm that balances the assignment of
targets amongst all the crews using two different heuristics that optimize
either the importance of repair locations or the travel time between them. We
benchmark our algorithm on both randomly generated graphs as well as data
derived from a real-world urban environment, and show that our algorithm
delivers significantly better assignments than existing methods.
","[{""version"":""v1"",""created"":""Wed, 1 Jun 2022 16:10:37 GMT""},{""version"":""v2"",""created"":""Sun, 26 Jun 2022 22:01:33 GMT""},{""version"":""v3"",""created"":""Sun, 7 Aug 2022 22:34:13 GMT""}]","2022-08-09"
"2206.00598","Gregorio Garc\'ia-Valladares","G. Garc\'ia-Valladares, C. A. Plata and A. Prados","Buckling in a rotationally invariant spin-elastic model","18 pages, 8 figures","Phys. Rev. E 107 (2022) 014120","10.1103/PhysRevE.107.014120",,"cond-mat.soft cond-mat.mes-hall cond-mat.stat-mech","http://creativecommons.org/licenses/by/4.0/","  Scanning tunneling microscopy experiments have revealed an spontaneous
rippled-to-buckled transition in heated graphene sheets, in absence of any
mechanical load. Several models relying on a simplified picture of the
interaction between elastic and internal, electronic, degrees of freedom have
been proposed to understand this phenomenon. Nevertheless, these models are not
fully consistent with the classical theory of elasticity, since they do not
preserve rotational invariance. Herein, we develop and analyse an alternative
classical spin-elastic model that preserves rotational invariance while giving
a qualitative account of the rippled-to-buckled transition. By integrating over
the internal degrees of freedom, an effective free energy for the elastic modes
is derived, which only depends on the curvature. Minimisation of this free
energy gives rise to the emergence of different mechanical phases, whose
thermodynamic stability is thoroughly analysed, both analytically and
numerically. All phases are characterised by a spatially homogeneous curvature,
which plays the role of the order parameter for the rippled-to-buckled
transition, in both the one- and two-dimensional cases. In the latter, our
focus is put on the honeycomb lattice, which is representative of actual
graphene.
","[{""version"":""v1"",""created"":""Wed, 1 Jun 2022 16:11:27 GMT""},{""version"":""v2"",""created"":""Mon, 30 Jan 2023 09:04:43 GMT""}]","2023-01-31"
"2206.00599","Daniel Gehberger","D\'aniel G\'ehberger, D\'avid Kov\'acs","Cooling Down FaaS: Towards Getting Rid of Warm Starts",,,,,"cs.DC cs.PF","http://creativecommons.org/licenses/by-nc-nd/4.0/","  Serverless execution and most notably the Function as a Service (FaaS) model
got quite some attention during the recent years. As of today, all commercial
and open source implementations follow the common practice of keeping the
execution environments running to achieve low function execution latency. In
this paper we compare the startup latency of different available virtualization
technologies, then we implement and benchmark an FaaS prototype system using
IncludeOS unikernels for function execution. We show that our system can start
and execute functions with essentially the same latency as AWS Lambda with its
continuously running executor units. Due to the low overhead, this approach
opens the possibility for simplified FaaS platforms without the resource waste
and extensive monitoring requirements of existing solutions.
","[{""version"":""v1"",""created"":""Wed, 1 Jun 2022 16:11:56 GMT""}]","2022-06-02"
"2206.00600","Peter Wolynes","Peter G. Wolynes","The Random First Order Transition Theory of Glasses in Real Space-Time:
  Instantons, Strings, Flames and Flows","This manuscript will appear in the book ""Spin Glass Theory and Far
  Beyond - Replica Symmetry Breaking after 40 Years""",,,,"cond-mat.dis-nn cond-mat.soft cond-mat.stat-mech","http://creativecommons.org/licenses/by/4.0/","  Understanding structural glasses using the Random First Order Transition
theory requires a description in both real space and in time, taking into
account sample history. A variety of nonlinear objects enter this description,
in field theory terms, when there is replica symmetry breaking: instantons,
strings, flames and flows. We focus on this real space description and use it
to describe the crossover to the energy landscape regime, dynamical
heterogeneity, aging and the formation of shear bands in glasses under stress.
","[{""version"":""v1"",""created"":""Wed, 1 Jun 2022 16:14:56 GMT""}]","2022-06-02"
"2206.00601","Konstantin Tikhomirov","Konstantin Tikhomirov","Quantitative invertibility of non-Hermitian random matrices","A short survey for ICM 2022 proceedings",,,,"math.PR","http://arxiv.org/licenses/nonexclusive-distrib/1.0/","  The problem of estimating the smallest singular value of random square
matrices is important in connection with matrix computations and analysis of
the spectral distribution. In this survey, we consider recent developments in
the study of quantitative invertibility in the non-Hermitian setting, and
review some applications of this line of research.
","[{""version"":""v1"",""created"":""Wed, 1 Jun 2022 16:15:08 GMT""}]","2022-06-02"
"2206.00602","Zhenbang Dai","Zhenbang Dai and Andrew M. Rappe","Recent Progress in the Theory of Bulk Photovoltaic Effect","The following article has been submitted to by Chemical Physics
  Reviews",,,,"cond-mat.mtrl-sci physics.chem-ph physics.comp-ph","http://arxiv.org/licenses/nonexclusive-distrib/1.0/","  The bulk photovoltaic effect (BPVE) occurs in solids with broken inversion
symmetry and refers to DC current generation due to uniform illumination,
without the need of heterostructures or interfaces, a feature that is distinct
from the traditional photovoltaic effect. Its existence has been demonstrated
almost 50 years ago, but predictive theories only appeared in the last ten
years, allowing for the identification of different mechanisms and the
determination of their relative importance in real materials. It is now
generally accepted that there is an intrinsic mechanism that is insensitive to
scattering, called shift current, where first-principles calculations can now
give highly accurate predictions. Another important but more extrinsic
mechanism, called ballistic current, is also attracting a lot of attention, but
due to the complicated scattering processes, its numerical calculation for real
materials is only made possible quite recently. In addition, an intrinsic
ballistic current, usually referred to as injection current, will appear under
circularly-polarized light and has wide application in experiments. In this
article, experiments that are pertinent to the theory development are reviewed,
and a significant portion is devoted to discussing the recent progress in the
theories of BPVE and their numerical implementations. As a demonstration of the
capability of the newly developed theories, a brief review of the materials
design strategies enabled by the theory development is given. Finally,
remaining questions in the BPVE field and possible future directions are
discussed to inspire further investigations.
","[{""version"":""v1"",""created"":""Wed, 1 Jun 2022 16:20:12 GMT""}]","2022-06-02"
"2206.00603","Taeho Ryu","Taeho Ryu, Rosalba Perna, Yihan Wang","Close Encounters of Stars with Stellar-mass Black Hole Binaries","14 pages, 12 figures, 2 tables. Accepted for publication in MNRAS",,"10.1093/mnras/stac2316",,"astro-ph.HE astro-ph.GA","http://creativecommons.org/licenses/by/4.0/","  Many astrophysical environments, from star clusters and globular clusters to
the disks of Active Galactic Nuclei, are characterized by frequent interactions
between stars and the compact objects that they leave behind. Here, using a
suite of $3-D$ hydrodynamics simulations, we explore the outcome of close
interactions between $1M_{\odot}$ stars and binary black holes (BBHs) in the
gravitational wave regime, resulting in a tidal disruption event (TDE) or a
pure scattering, focusing on the accretion rates, the back reaction on the BH
binary orbital parameters and the increase in the binary BH effective spin. We
find that TDEs can make a significant impact on the binary orbit, which is
often different from that of pure scattering. Binaries experiencing a prograde
(retrograde) TDE tend to be widened (hardened) by up to $\simeq 20\%$.
Initially circular binaries become more eccentric by $\lesssim 10\%$ by a
prograde or retrograde TDE, whereas the eccentricity of initially eccentric
binaries increases (decreases) by a retrograde (prograde) TDE by $\lesssim
5\%$. Overall a single TDE can generally result in changes of the gravitational
wave-driven merger time scale by order unity. The accretion rates of both black
holes are very highly super-Eddington, showing modulations (preferentially for
retrograde TDEs) on a time scale of the orbital period, which can be a
characteristic feature of BBH-driven TDEs. Prograde TDEs result in the
effective spin parameter $\chi$ to vary by $\lesssim 0.02$ while $\chi\gtrsim
-0.005$ for retrograde TDEs.
","[{""version"":""v1"",""created"":""Wed, 1 Jun 2022 16:20:42 GMT""},{""version"":""v2"",""created"":""Tue, 2 Aug 2022 09:52:51 GMT""}]","2022-08-31"
"2206.00604","Dmitry Chulkov","Dmitry Chulkov, Oleg Malkov","Visual binary stars with known orbits in Gaia EDR3","Accepted for publication in MNRAS 28.09.2022, 15 pages, 11 figures",,"10.1093/mnras/stac2827",,"astro-ph.SR astro-ph.GA","http://arxiv.org/licenses/nonexclusive-distrib/1.0/","  3350 objects from the Sixth catalog of orbits of visual binary stars (ORB6)
are investigated to validate Gaia EDR3 parallaxes and provide mass estimates
for the systems. We show that 2/3 of binaries with 0.2 - 0.5 arcsec separation
are left without a parallax solution in EDR3. A special attention is paid to
521 pairs with parallax known separately for both components. We find 16
entries that are deemed to be chance alignments of unrelated stars. At once we
show examples of high-confidence binary systems with significant differences in
the reported parallaxes of their components. Next we conclude that the reported
Gaia EDR3 parallax errors are underestimated, at least by a factor of 3 for
sources with large RUWE. Parallaxes are needed to estimate stellar masses.
Since nearly 30\% of ORB6 entries lack 5 or 6-parameter solution in EDR3, we
attempt to enrich the astrometric data. Distant companions of ORB6 entries are
revealed in EDR3 by analysis of stellar proper motions and Hipparcos
parallaxes. Notably, in 28 cases intrinsic EDR3 parallaxes of the binary
components appear to be less reliable than the parallax of the outer
companions. Gaia DR2, TGAS and Hipparcos parallaxes are used when EDR3 data is
unavailable. Synthetic mass-luminosity relation in the G band for main sequence
stars is obtained to provide mass estimates along with dynamical masses
calculated via Kepler's Third Law.
","[{""version"":""v1"",""created"":""Wed, 1 Jun 2022 16:20:46 GMT""},{""version"":""v2"",""created"":""Mon, 3 Oct 2022 12:05:23 GMT""}]","2022-10-12"
"2206.00605","Sergei Kuksin","Guan Huang and Sergei Kuksin","Averaging and mixing for stochastic perturbations of linear conservative
  systems",,,,,"math.DS","http://creativecommons.org/licenses/by/4.0/","  We study stochastic perturbations of linear systems of the form $$
dv(t)+Av(t)dt = \epsilon P(v(t))dt+\sqrt{\epsilon}B(v(t)) dW (t), v\in\R^{D},
(*) $$ where $A$ is a linear operator with non-zero imaginary spectrum. It is
assumed that the vector field $P(v)$ and the matrix-function $B(v)$ are locally
Lipschitz with at most a polynomial growth at infinity, that the equation is
well posed and first few moments of norms of solutions $v(t)$ are bounded
uniformly in $\epsilon$. We use the Khasminski approach to stochastic averaging
to show that as $\epsilon\to0$, a solution $v(t)$, written in the interaction
representation in terms of operator $A$, for $0\le t \le Const\,\epsilon^{-1}$
converges in distribution to a solution of an effective equation. The latter is
obtained from (*) by means of certain averaging. Assuming that eq.(*) and/or
the effective equation are mixing, we examine this convergence further.
","[{""version"":""v1"",""created"":""Wed, 1 Jun 2022 16:21:07 GMT""},{""version"":""v2"",""created"":""Tue, 28 Jun 2022 15:16:03 GMT""},{""version"":""v3"",""created"":""Wed, 3 Aug 2022 14:14:49 GMT""}]","2022-08-04"
