"2206.00862","Khoa D. Nguyen","Jason P. Bell and Keira Gunn and Khoa D. Nguyen and J. C. Saunders","A general criterion for the P\'{o}lya-Carlson dichotomy and application",,,,,"math.NT","http://arxiv.org/licenses/nonexclusive-distrib/1.0/","  We prove a general criterion for an irrational power series
$f(z)=\displaystyle\sum_{n=0}^{\infty}a_nz^n$ with coefficients in a number
field $K$ to admit the unit circle as a natural boundary. As an application,
let $F$ be a finite field, let $d$ be a positive integer, let $A\in M_d(F[t])$
be a $d\times d$-matrix with entries in $F[t]$, and let $\zeta_A(z)$ be the
Artin-Mazur zeta function associated to the multiplication-by-$A$ map on the
compact abelian group $F((1/t))^d/F[t]^d$. We provide a complete
characterization of when $\zeta_A(z)$ is algebraic and prove that it admits the
circle of convergence as a natural boundary in the transcendence case. This is
in stark contrast to the case of linear endomorphisms on
$\mathbb{R}^d/\mathbb{Z}^d$ in which Baake, Lau, and Paskunas prove that the
zeta function is always rational. Some connections to earlier work of Bell,
Byszewski, Cornelissen, Miles, Royals, and Ward are discussed. Our method uses
a similar technique in recent work of Bell, Nguyen, and Zannier together with
certain patching arguments involving linear recurrence sequences.
","[{""version"":""v1"",""created"":""Thu, 2 Jun 2022 04:04:09 GMT""}]","2022-06-03"
"2206.00863","Tetsuya Kobayashi","Tetsuya J. Kobayashi, Dimitri Loutchko, Atsushi Kamimura, Yuki
  Sughiyama","Geometry of Nonequilibrium Chemical Reaction Networks and Generalized
  Entropy Production Decompositions","9 figures",,,,"physics.chem-ph q-bio.MN","http://creativecommons.org/licenses/by/4.0/","  We derive the Hessian geometric structure of nonequilibrium chemical reaction
networks (CRN) on the flux and force spaces induced by the Legendre duality of
convex dissipation functions and characterize their dynamics as a generalized
flow. With this structure, we can extend theories of nonequilibrium systems
with quadratic dissipation functions to more general ones with nonquadratic
ones, which are pivotal for studying chemical reaction networks. By applying
generalized notions of orthogonality in Hessian geometry to chemical reaction
networks, we obtain two generalized decompositions of the entropy production
rate, each of which captures gradient-flow and minimum-dissipation aspects in
nonequilibrium dynamics.
","[{""version"":""v1"",""created"":""Thu, 2 Jun 2022 04:04:34 GMT""}]","2022-06-03"
"2206.00864","Yakov Greenberg","Ya. S. Greenberg and A. A. Shtygashev","Quantum phase measurement for two-qubit states in an open waveguide","10 pages, 4 figures, updated introduction and conclusion","Phys. Rev A 106, 042611 (2022)","10.1103/PhysRevA.106.042611",,"quant-ph","http://creativecommons.org/licenses/by/4.0/","  We present a new method for quantum state tomography within a
single-excitation subspace of two-qubit states in an open waveguide. The system
under investigation consists of three qubits in an open waveguide, separated by
a distance comparable to the wavelength of the electromagnetic field. We show
that the modulation of the frequency of the central ancillary qubit allows us
to obtain unambiguous information about the initial phase difference
$\varphi_1-\varphi_3$ of the edge qubits via the measurement of the evolution
of their probability amplitudes.
","[{""version"":""v1"",""created"":""Thu, 2 Jun 2022 04:18:45 GMT""},{""version"":""v2"",""created"":""Sat, 2 Jul 2022 09:31:53 GMT""}]","2022-12-12"
"2206.00865","Nobuyuki Matsumoto","Nobuyuki Matsumoto","Comment on the subtlety of defining real-time path integral in lattice
  gauge theories","21 pages, 6 figures. v2: reference added, a few arguments clarified.
  v3: major revision; to appear in PTEP",,,"RBRC-1337","hep-lat hep-th","http://creativecommons.org/licenses/by/4.0/","  Recently, Hoshina, Fujii, and Kikukawa pointed out that the naive lattice
gauge theory action in Minkowski signature does not result in a unitary theory
in the continuum limit, and Kanwar and Wagman proposed alternative lattice
actions to the Wilson action without divergences. We here show that the
subtlety can be understood from the asymptotic expansion of the modified Bessel
function, which has been discussed for path integral of compact variables in
nonrelativistic quantum mechanics. The essential ingredient for defining the
appropriate continuum theory is the $i\varepsilon$ prescription, and with the
proper implementation of the $i\varepsilon$ we show that the Wilson action can
be used for the real-time path integrals. It is here important that the
$i\varepsilon$ should be implemented for both timelike and spacelike
plaquettes. We also argue the reason why the $i\varepsilon$ becomes required
for the Wilson action from the Hamiltonian formalism. The $i\varepsilon$ is
needed to manifestly suppress the contributions from singular paths, for which
the Wilson action can give different values from those of the actual continuum
action.
","[{""version"":""v1"",""created"":""Thu, 2 Jun 2022 04:20:47 GMT""},{""version"":""v2"",""created"":""Thu, 9 Jun 2022 18:27:10 GMT""},{""version"":""v3"",""created"":""Wed, 3 Aug 2022 17:37:37 GMT""}]","2022-08-04"
"2206.00866","Bin Chen","Zhiwei Liang, Bin Chen, Yi Lei, Gabriele Liga, Alex Alvarado","Analytical SNR Prediction in Long-Haul Optical Transmission using
  General Dual-Polarization 4D Formats","4 pages",,,,"eess.SP cs.IT math.IT","http://creativecommons.org/licenses/by-sa/4.0/","  Nonlinear interference models for dual-polarization 4D (DP-4D) modulation
have only been used so far to predict signal-signal nonlinear interference. We
show that including the signal-noise term in the prediction of the effective
signal-to-noise ratio in long distance DP-4D transmission improves the accuracy
by up to 0.2 dB.
","[{""version"":""v1"",""created"":""Thu, 2 Jun 2022 04:28:51 GMT""},{""version"":""v2"",""created"":""Fri, 15 Jul 2022 09:40:05 GMT""}]","2022-07-18"
"2206.00867","Ting Wang","Ting Wang, Jaroslaw Knap","Stochastic Deep-Ritz for Parametric Uncertainty Quantification",,,,,"math.NA cs.NA","http://creativecommons.org/licenses/by/4.0/","  Scientific machine learning has become an increasingly important tool in
materials science and engineering. It is particularly well suited to tackle
material problems involving many variables or to allow rapid construction of
surrogates of material models, to name just a few. Mathematically, many
problems in materials science and engineering can be cast as variational
problems. However, handling of uncertainty, ever present in materials, in the
context of variational formulations remains challenging for scientific machine
learning. In this article, we propose a deep-learning-based numerical method
for solving variational problems under uncertainty. Our approach seamlessly
combines deep-learning approximation with Monte-Carlo sampling. The resulting
numerical method is powerful yet remarkably simple. We assess its performance
and accuracy on a number of variational problems.
","[{""version"":""v1"",""created"":""Thu, 2 Jun 2022 04:29:42 GMT""},{""version"":""v2"",""created"":""Thu, 28 Jul 2022 19:36:44 GMT""},{""version"":""v3"",""created"":""Tue, 23 May 2023 21:17:28 GMT""}]","2023-05-25"
"2206.00868","Zawar Hussain Dr","Muhammad Sajjad Akbar, Zawar Hussain, Quan Z. Sheng, Subhas
  Mukhopadhyay","6G Survey on Challenges, Requirements, Applications, Key Enabling
  Technologies, Use Cases, AI integration issues and Security aspects",,,,,"cs.NI","http://creativecommons.org/licenses/by/4.0/","  The fifth-generation (5G) network is likely to bring in high data rates, more
reliability, and low delays for mobile, personal and local area networks.
Alongside the rapid growth of smart wireless sensing and communication
technologies, data traffic has significantly risen, and existing 5G networks
are not fully capable of supporting future massive data traffic in terms of
services, storage, and processing. To meet the forthcoming challenges, the
research community is investigating the Terahertz-based sixth-generation (6G)
wireless network which is supposed to be offered for industrial usage in around
10 years. This is the right time to explore and learn about various 6G aspects
that will play a key role in the successful execution and implementation of 6G
networks in the future. This survey provides a review of specifications,
requirements, applications, enabling technologies including disruptive and
innovative, integration of 6G with advanced architectures and networks like
software-defined networks (SDN), network functions virtualization (NFV),
cloud/fog computing, etc, artificial intelligence (AI) oriented technologies,
privacy and security issues and solutions, and potential futuristic use cases:
virtual reality, smart healthcare and Industry 5.0. Furthermore, based on the
conducted review, challenges and future research directions are highlighted to
aid the deployment of 6G networks.
","[{""version"":""v1"",""created"":""Thu, 2 Jun 2022 04:34:57 GMT""}]","2022-06-03"
"2206.00869","Marco Ferreira","Marco A. R. Ferreira and Juan C. Vivar","Spatiotemporal models for Poisson areal data with an application to the
  AIDS epidemic in Rio de Janeiro","26 pages, 2 figures, 2 tables",,,,"stat.ME","http://arxiv.org/licenses/nonexclusive-distrib/1.0/","  We present a class of spatiotemporal models for Poisson areal data suitable
for the analysis of emerging infectious diseases. These models assume Poisson
observations related through a link equation to a latent random field process.
This latent random field process evolves through time with proper Gaussian
Markov random field convolutions. Our approach naturally accommodates flexible
structures such as distinct but interacting temporal trends for each region and
across-time contamination among neighboring regions. We develop a Bayesian
analysis approach with a simulation-based procedure: specifically, we construct
a Markov chain Monte Carlo algorithm based on the generalized extended Kalman
filter to obtain samples from an approximate posterior distribution. Finally,
for the comparison of Poisson spatiotemporal models, we develop a
simulation-based conditional Bayes factor. We illustrate the utility and
flexibility of our Poisson spatiotemporal framework with an application to the
number of acquired immunodeficiency syndrome (AIDS) cases during the period
1982-2007 in Rio de Janeiro.
","[{""version"":""v1"",""created"":""Thu, 2 Jun 2022 04:35:25 GMT""}]","2022-06-03"
"2206.00870","Subhra Bhattacharya","Subhra Bhattacharya","Revisiting Barrow's Graduated Inflationary Universe: A Warm perspective","Accepted for publication at Phys. Lett. B",,"10.1016/j.physletb.2022.137215",,"gr-qc","http://creativecommons.org/licenses/by/4.0/","  It is presumed that thermal fluctuations present during inflationary epoch
can make inflaton scalar field to interact with other fields resulting in the
existence of a thermal component during the inflationary period. The presence
of this thermal component assists structure formation and reduces reheating
dependence as in the contemporary inflationary paradigm. This is known as warm
inflation. In 1990 J . D. Barrow \cite{25} considered a scenario of inflation
with matter field having a phenomenological equation of state of the type
$p+\rho=\gamma\rho^{\lambda},~\gamma\neq 0$ and $\lambda$ constant. He called
such inflationary scenarios as ""graduated inflation"". In this work we
reconsider the above equation of state in a scenario of warm inflation. Our aim
would be to investigate and understand whether such matter can also act as a
viable candidate for warm inflation.
","[{""version"":""v1"",""created"":""Thu, 2 Jun 2022 04:39:31 GMT""}]","2022-06-22"
"2206.00871","Nikos Sioulas Mr","Nikos Sioulas, Zesen Huang, Marco Velli, Rohit Chhiber, Manuel E.
  Cuesta, Chen Shi, William H. Matthaeus, Riddhi Bandyopadhyay, Loukas Vlahos,
  Trevor A. Bowen, Ramiz A. Qudsi, Stuart D. Bale, Christopher J. Owen, P.
  Louarn, A. Fedorov, Milan Maksimovic, Michael L. Stevens, Justin Kasper,
  Davin Larson, Roberto Livi","Magnetic field intermittency in the solar wind: PSP and SolO
  observations ranging from the Alfven region out to 1 AU",,,"10.3847/1538-4357/ac7aa2",,"astro-ph.SR physics.plasm-ph physics.space-ph","http://creativecommons.org/licenses/by/4.0/","  $PSP$ and $SolO$ data are utilized to investigate magnetic field
intermittency in the solar wind (SW). Small-scale intermittency $(20-100d_{i})$
is observed to radially strengthen when methods relying on higher-order moments
are considered ($SF_q$, $SDK$), but no clear trend is observed at larger
scales. However, lower-order moment-based methods (e.g., PVI) are deemed more
appropriate for examining the evolution of the bulk of Coherent Structures
(CSs), $PVI \ge 3$. Using PVI, we observe a scale-dependent evolution in the
fraction of the dataset occupied by CSs, $f_{PVI \ge 3}$. Specifically,
regardless of the SW speed, a subtle increase is found in $f_{PVI\ge3}$ for
$\ell =20 d_i$, in contrast to a more pronounced radial increase in CSs
observed at larger scales. Intermittency is investigated in relation to plasma
parameters. Though, slower SW speed intervals exhibit higher $f_{PVI \geq 6}$
and higher kurtosis maxima, no statistical differences are observed for $f_{PVI
\geq 3}$. Highly Alfv\'enic intervals, display lower levels of intermittency.
The anisotropy with respect to the angle between the magnetic field and SW
flow, $\Theta_{VB}$ is investigated. Intermittency is weaker at $\Theta_{VB}
\approx 0^{\circ}$ and is strengthened at larger angles. Considering the
evolution at a constant alignment angle, a weakening of intermittency is
observed with increasing advection time of the SW. Our results indicate that
the strengthening of intermittency in the inner heliosphere is driven by the
increase in comparatively highly intermittent perpendicular intervals sampled
by the probes with increasing distance, an effect related directly to the
evolution of the Parker spiral.
","[{""version"":""v1"",""created"":""Thu, 2 Jun 2022 04:43:19 GMT""}]","2022-08-17"
"2206.00872","Nathan Jones","Nathan Jones and Sung Min Lee","On the acyclicity of reductions of elliptic curves modulo primes in
  arithmetic progressions","In the updated version, we have added more details about an
  underlying computation, including a reference to a github link where
  supporting computer code may be found. We have also added three references to
  the bibliography",,,,"math.NT","http://arxiv.org/licenses/nonexclusive-distrib/1.0/","  Let $E$ be an elliptic curve defined over $\mathbb{Q}$ and, for a prime $p$
of good reduction for $E$ let $\tilde{E}_p$ denote the reduction of $E$ modulo
$p$. Inspired by an elliptic curve analogue of Artin's primitive root
conjecture posed by S. Lang and H. Trotter in 1977, J-P. Serre adapted methods
of C. Hooley to prove a GRH-conditional asymptotic formula for the number of
primes $p \leq x$ for which the group $\tilde{E}_p(\mathbb{F}_p)$ is cyclic.
More recently, Akbal and G\""{u}lo$\breve{\text{g}}$lu considered the question
of cyclicity of $\tilde{E}_p(\mathbb{F}_p)$ under the additional restriction
that $p$ lie in an arithmetic progression. In this note, we study the issue of
which arithmetic progressions $a \bmod n$ have the property that, for all but
finitely many primes $p \equiv a \bmod n$, the group
$\tilde{E}_p(\mathbb{F}_p)$ is not cyclic, answering a question of Akbal and
G\""{u}lo$\breve{\text{g}}$lu on this issue.
","[{""version"":""v1"",""created"":""Thu, 2 Jun 2022 04:54:56 GMT""},{""version"":""v2"",""created"":""Fri, 9 Dec 2022 03:16:39 GMT""}]","2022-12-12"
"2206.00873","Shinji Ito","Shinji Ito, Taira Tsuchiya, Junya Honda","Nearly Optimal Best-of-Both-Worlds Algorithms for Online Learning with
  Feedback Graphs","Accepted at NeurIPS 2022",,,,"cs.LG","http://arxiv.org/licenses/nonexclusive-distrib/1.0/","  This study considers online learning with general directed feedback graphs.
For this problem, we present best-of-both-worlds algorithms that achieve nearly
tight regret bounds for adversarial environments as well as poly-logarithmic
regret bounds for stochastic environments. As Alon et al. [2015] have shown,
tight regret bounds depend on the structure of the feedback graph: strongly
observable graphs yield minimax regret of $\tilde{\Theta}( \alpha^{1/2} T^{1/2}
)$, while weakly observable graphs induce minimax regret of $\tilde{\Theta}(
\delta^{1/3} T^{2/3} )$, where $\alpha$ and $\delta$, respectively, represent
the independence number of the graph and the domination number of a certain
portion of the graph. Our proposed algorithm for strongly observable graphs has
a regret bound of $\tilde{O}( \alpha^{1/2} T^{1/2} ) $ for adversarial
environments, as well as of $ {O} ( \frac{\alpha (\ln T)^3 }{\Delta_{\min}} ) $
for stochastic environments, where $\Delta_{\min}$ expresses the minimum
suboptimality gap. This result resolves an open question raised by Erez and
Koren [2021]. We also provide an algorithm for weakly observable graphs that
achieves a regret bound of $\tilde{O}( \delta^{1/3}T^{2/3} )$ for adversarial
environments and poly-logarithmic regret for stochastic environments. The
proposed algorithms are based on the follow-the-regularized-leader approach
combined with newly designed update rules for learning rates.
","[{""version"":""v1"",""created"":""Thu, 2 Jun 2022 05:01:40 GMT""},{""version"":""v2"",""created"":""Tue, 27 Dec 2022 04:05:49 GMT""}]","2022-12-29"
"2206.00874","Qian Wang","Qian Wang and He Chen","Age of Information in Reservation Multi-Access Networks with Stochastic
  Arrivals","Paper accepted by IEEE ISIT 2022",,,,"cs.IT cs.NI math.IT","http://creativecommons.org/licenses/by/4.0/","  This paper investigates the Age of Information (AoI) performance of Frame
Slotted ALOHA with Reservation and Data slots (FSA-RD). We consider a symmetric
multi-access network where each user transmits its randomly generated status
updates to an access point in a framed manner. Each frame consists of one
reservation slot and several data slots. The reservation slot is made up of
some mini-slots. In each reservation slot, users, with a status update packet
to transmit, randomly send short reservation packets in one of the mini-slots
to contend for data slots of the frame. The data slots are assigned to those
users that succeed in reservation slot. To provide insights in optimizing the
information freshness of FSA-RD, we manage to derive a closed-form expression
of the average AoI under FSA-RD by applying a recursive method. Numerical
results validate the analytical expression and demonstrate the influence of the
frame size and reservation probability on the average AoI. We finally perform a
comparison between the AoI performance of FSA-RD with optimized frame size and
reservation probability, and that of slotted ALOHA with optimized transmission
probability. The comparison results show that FSA-RD can effectively reduce the
AoI performance of multi-access networks, especially when the status arrival
rate of the network becomes large.
","[{""version"":""v1"",""created"":""Thu, 2 Jun 2022 05:13:30 GMT""}]","2022-06-03"
"2206.00875","Michiya Mori","Michiya Mori","Ring isomorphisms of type II$_\infty$ locally measurable operator
  algebras","14 pages",,,"RIKEN-iTHEMS-Report-22","math.OA","http://creativecommons.org/licenses/by/4.0/","  We show that every ring isomorphism between the algebras of locally
measurable operators for type II$_\infty$ von Neumann algebras is similar to a
real $^*$-isomorphism. This together with previous results by the author and
Ayupov--Kudaybergenov completely describes ring isomorphisms between the
algebras of locally measurable operators as well as lattice isomorphisms
between the projection lattices for a general pair of von Neumann algebras
without finite type I direct summands.
","[{""version"":""v1"",""created"":""Thu, 2 Jun 2022 05:15:13 GMT""},{""version"":""v2"",""created"":""Sat, 20 May 2023 00:06:28 GMT""}]","2023-05-23"
"2206.00876","Zhimin Wang","Zhimin Wang, Min Li, Diru Wu, Jinchang Liu, Xiangcheng Meng, Caimei
  Liu, Changgen Yang","Imaging of CsI(Tl) crystal event and double-slit Young's interference by
  a single photon sensitive camera","21 pages, 12 figures",,,,"physics.ins-det hep-ex","http://arxiv.org/licenses/nonexclusive-distrib/1.0/","  We will discuss an imaging measurement with a single photon sensitive and low
noise camera aiming to a new paradigm in the optical readout of scintillation
detectors. The features of the single photon sensitive camera will be
characterized and demonstrated with a measurement on double-slit Young's
interference in single photon mode. An imaging test on CsI(Tl) crystal and
alpha source will be performed further for preliminary measurements on the
noise level and sensitivity of the system with a 1/2"", f/1.4 lens, which
reaches an sensitivity on light intensity around 1/10 of the 3-inch PMT and
shows a potential to realize an imaging of single alpha event. An application
proposal to scintillation detectors will be further discussed, where it is
usually assumed that the imaging is not possible in such a photon-starved and
large-emittance regime.
","[{""version"":""v1"",""created"":""Thu, 2 Jun 2022 05:33:18 GMT""}]","2022-06-03"
"2206.00877","Haoran You","Haoran You, Cheng Wan, Yang Zhao, Zhongzhi Yu, Yonggan Fu, Jiayi Yuan,
  Shang Wu, Shunyao Zhang, Yongan Zhang, Chaojian Li, Vivek Boominathan, Ashok
  Veeraraghavan, Ziyun Li, Yingyan Lin","EyeCoD: Eye Tracking System Acceleration via FlatCam-based Algorithm &
  Accelerator Co-Design","Accepted by ISCA 2022; Also selected as an IEEE Micro's Top Pick of
  2023",,"10.1145/3470496.3527443",,"cs.HC cs.AR","http://creativecommons.org/licenses/by-nc-nd/4.0/","  Eye tracking has become an essential human-machine interaction modality for
providing immersive experience in numerous virtual and augmented reality
(VR/AR) applications desiring high throughput (e.g., 240 FPS), small-form, and
enhanced visual privacy. However, existing eye tracking systems are still
limited by their: (1) large form-factor largely due to the adopted bulky
lens-based cameras; and (2) high communication cost required between the camera
and backend processor, thus prohibiting their more extensive applications. To
this end, we propose a lensless FlatCam-based eye tracking algorithm and
accelerator co-design framework dubbed EyeCoD to enable eye tracking systems
with a much reduced form-factor and boosted system efficiency without
sacrificing the tracking accuracy, paving the way for next-generation eye
tracking solutions. On the system level, we advocate the use of lensless
FlatCams to facilitate the small form-factor need in mobile eye tracking
systems. On the algorithm level, EyeCoD integrates a predict-then-focus
pipeline that first predicts the region-of-interest (ROI) via segmentation and
then only focuses on the ROI parts to estimate gaze directions, greatly
reducing redundant computations and data movements. On the hardware level, we
further develop a dedicated accelerator that (1) integrates a novel workload
orchestration between the aforementioned segmentation and gaze estimation
models, (2) leverages intra-channel reuse opportunities for depth-wise layers,
and (3) utilizes input feature-wise partition to save activation memory size.
On-silicon measurement validates that our EyeCoD consistently reduces both the
communication and computation costs, leading to an overall system speedup of
10.95x, 3.21x, and 12.85x over CPUs, GPUs, and a prior-art eye tracking
processor called CIS-GEP, respectively, while maintaining the tracking
accuracy.
","[{""version"":""v1"",""created"":""Thu, 2 Jun 2022 05:35:43 GMT""},{""version"":""v2"",""created"":""Sun, 5 Feb 2023 18:17:21 GMT""}]","2023-02-07"
"2206.00878","Tao Hu","Tao Hu, Shu Liu, Yilun Chen, Tiancheng Shen, Jiaya Jia","EfficientNeRF: Efficient Neural Radiance Fields",,,,,"cs.CV","http://creativecommons.org/licenses/by/4.0/","  Neural Radiance Fields (NeRF) has been wildly applied to various tasks for
its high-quality representation of 3D scenes. It takes long per-scene training
time and per-image testing time. In this paper, we present EfficientNeRF as an
efficient NeRF-based method to represent 3D scene and synthesize novel-view
images. Although several ways exist to accelerate the training or testing
process, it is still difficult to much reduce time for both phases
simultaneously. We analyze the density and weight distribution of the sampled
points then propose valid and pivotal sampling at the coarse and fine stage,
respectively, to significantly improve sampling efficiency. In addition, we
design a novel data structure to cache the whole scene during testing to
accelerate the rendering speed. Overall, our method can reduce over 88\% of
training time, reach rendering speed of over 200 FPS, while still achieving
competitive accuracy. Experiments prove that our method promotes the
practicality of NeRF in the real world and enables many applications.
","[{""version"":""v1"",""created"":""Thu, 2 Jun 2022 05:36:44 GMT""}]","2022-06-03"
