"2206.00728","Tadahiro Oh","Tadahiro Oh, Mamoru Okamoto, and Nikolay Tzvetkov","Uniqueness and non-uniqueness of the Gaussian free field evolution under
  the two-dimensional Wick ordered cubic wave equation","53 pages. A minor revision. To appear in Annales de l'Institut Henri
  Poincar\'e Probabilit\'es et Statistiques",,,,"math.AP math.PR","http://arxiv.org/licenses/nonexclusive-distrib/1.0/","  We study the nonlinear wave equation (NLW) on the two-dimensional torus
$\mathbb T^2$ with Gaussian random initial data on $H^s(\mathbb T^2) \times
H^{s-1}(\mathbb T^2)$, $s < 0$, distributed according to the base Gaussian free
field $\mu$ associated with the invariant Gibbs measure studied by Thomann and
the first author (2020). In particular, we investigate the approximation
property of the corresponding solution by smooth (random) solutions. Our main
results in this paper are two-fold. (i) We show that the solution map for the
renormalized cubic NLW defined on the Gaussian free field $\mu$ is the unique
extension of the solution map defined for smoothed Gaussian initial data
obtained by mollification, independent of mollification kernels. (ii) We also
show that there is a regularization of the Gaussian initial data so that the
corresponding smooth solutions almost surely have no limit in the natural
topology. This second result in particular states that one can not use
arbitrary smooth approximation for the renormalized cubic NLW dynamics.
  As a preliminary step for proving (ii), we establish a (deterministic) norm
inflation result at general initial data for the (unrenormalized) cubic NLW on
$\mathbb T^d$ and $\mathbb R^d$ in negative Sobolev spaces, extending the norm
inflation result by Christ, Colliander, and Tao (2003).
","[{""version"":""v1"",""created"":""Wed, 1 Jun 2022 19:41:16 GMT""},{""version"":""v2"",""created"":""Fri, 17 Feb 2023 11:13:23 GMT""}]","2023-02-20"
"2206.00729","Gopal Ramchandran Iyer","Gopal R. Iyer and Brenda M. Rubenstein","Error Cancellation in Diffusion Monte Carlo Calculations of Surface
  Chemistry",,,"10.1021/acs.jpca.2c01957",,"cond-mat.mtrl-sci","http://creativecommons.org/licenses/by/4.0/","  Diffusion Monte Carlo (DMC) is being recognized as a higher-accuracy, albeit
more computationally expensive, alternative to Density Functional Theory (DFT)
for energy predictions of catalytic systems. A major computational bottleneck
in the use of DMC for catalysis is the need to perform finite-size
extrapolations by simulating increasingly large periodic cells (supercells) to
eliminate many-body finite-size effects and obtain energies in the
thermodynamic limit. Here, we show that this computational cost can be
significantly reduced by leveraging the cancellation of many-body finite-size
errors that accompanies the evaluation of energy differences when calculating
quantities like binding energies and mapping potential energy surfaces. We test
the error cancellation and convergence in two well-known adsorbate/slab
systems, H2O/LiH(001) and CO/Pt(111). Based on this, we identify strategies for
obtaining binding energies in the thermodynamic limit that optimize error
cancellation to balance accuracy and computational efficiency. We then predict
the correct order of adsorption site preference on CO/Pt(111), a challenging
problem for DFT. Our accurate, inexpensive DMC calculations recover the top >
bridge > hollow site order, in agreement with experimental observations. We
proceed to map the potential energy surface of CO hopping between Pt(111)
adsorption sites. This reveals the existence of an L-shaped top-bridge-hollow
diffusion trajectory characterized by energy barriers that provide an
additional kinetic justification for experimental observations of CO/Pt(111)
adsorption. Overall, this work demonstrates that it is routinely possible to
achieve order-of-magnitude speedups and memory savings in DMC calculations by
taking advantage of error cancellation in the calculation of energy differences
that are ubiquitous in heterogeneous catalysis and surface chemistry more
broadly.
","[{""version"":""v1"",""created"":""Wed, 1 Jun 2022 19:44:02 GMT""}]","2022-10-12"
"2206.00730","Tom Schaul","Tom Schaul, Andr\'e Barreto, John Quan, Georg Ostrovski","The Phenomenon of Policy Churn","Published at NeurIPS 2022",,,,"cs.LG cs.AI stat.ML","http://arxiv.org/licenses/nonexclusive-distrib/1.0/","  We identify and study the phenomenon of policy churn, that is, the rapid
change of the greedy policy in value-based reinforcement learning. Policy churn
operates at a surprisingly rapid pace, changing the greedy action in a large
fraction of states within a handful of learning updates (in a typical deep RL
set-up such as DQN on Atari). We characterise the phenomenon empirically,
verifying that it is not limited to specific algorithm or environment
properties. A number of ablations help whittle down the plausible explanations
on why churn occurs to just a handful, all related to deep learning. Finally,
we hypothesise that policy churn is a beneficial but overlooked form of
implicit exploration that casts $\epsilon$-greedy exploration in a fresh light,
namely that $\epsilon$-noise plays a much smaller role than expected.
","[{""version"":""v1"",""created"":""Wed, 1 Jun 2022 19:44:18 GMT""},{""version"":""v2"",""created"":""Thu, 9 Jun 2022 15:42:47 GMT""},{""version"":""v3"",""created"":""Thu, 20 Oct 2022 19:29:24 GMT""}]","2022-10-24"
"2206.00731","Miguel Ruiz-Granda","M. Ruiz-Granda, P. Vielva","Constraining CMB physical processes using Planck 2018 data","24 pages, 10 figures, accepted for publication on JCAP","JCAP11(2022)043","10.1088/1475-7516/2022/11/043",,"astro-ph.CO","http://arxiv.org/licenses/nonexclusive-distrib/1.0/","  This paper aims to perform a phenomenological parametrisation of the standard
cosmological model, $\Lambda$CDM, to weigh the different physical processes
that define the pattern of the angular power spectra of the Cosmic Microwave
Background (CMB) anisotropies. We use six phenomenological amplitudes to
account for the Sachs-Wolfe, early and late Integrated Sachs-Wolfe,
polarization contribution, Doppler and lensing effects. To do so, we have
adapted the CLASS Boltzmann code and used the Markov Chain Monte Carlo (MCMC)
sampler of Cobaya to explore the Planck 2018 likelihood to constrain different
combinations of cosmological and phenomenological parameters. Observing
deviations of the mean values of the phenomenological amplitudes from the
predictions of the $\Lambda$CDM model could be useful to resolve existing
cosmological tensions. For the first time, a comprehensive analysis of the
physical processes of the CMB has been performed using the Planck 2018
temperature, polarization and lensing power spectra. In a previous work, the
phenomenological amplitudes were constrained using only the TT data, however,
by including the polarization and lensing data we find that the constraints on
these physical contributions are tighter. In addition, some degeneracies that
appear only when considering TT data are completely broken by taking into
account all Planck 2018 data. Consequently, models with more than three
phenomenological amplitudes can be studied, which is prohibitive when only the
temperature power spectrum is used. The results presented in this paper show
that the Planck experiment can constrain all phenomenological amplitudes except
the late Integrated Sachs-Wolfe effect. No inconsistencies were found with the
$\Lambda$CDM model, and the largest improvements were obtained for the models
that include the lensing parameter, $A_L$.
","[{""version"":""v1"",""created"":""Wed, 1 Jun 2022 19:44:53 GMT""},{""version"":""v2"",""created"":""Fri, 18 Nov 2022 13:19:13 GMT""}]","2022-11-22"
"2206.00732","Malte Jansen","Malte F. Jansen, Wanying Kang, Edwin Kite and Yaoxuan Zeng","Energetic constraints on ocean circulations of icy ocean worlds",,,,,"astro-ph.EP","http://creativecommons.org/licenses/by/4.0/","  Globally ice-covered oceans have been found on multiple moons in the solar
system and may also have been a feature of Earth's past. However, relatively
little is understood about the dynamics of these ice-covered oceans, which
affect not only the physical environment but also any potential life and its
detectability. A number of studies have simulated the circulation of icy-world
oceans, but have come to seemingly widely different conclusions. To better
understand and narrow down these diverging results, we discuss energetic
constraints for the circulation on ice-covered oceans, focusing in particular
on Snowball Earth, Europa, and Enceladus. Energy input that can drive ocean
circulation on ice-covered bodies can be associated with heat and salt fluxes
at the boundaries as well as ocean tides and librations. We show that heating
from the solid core balanced by heat loss through the ice sheet can drive an
ocean circulation, but the resulting flows would be relatively weak and
strongly affected by rotation. Salt fluxes associated with freezing and melting
at the ice sheet boundary are unlikely to energetically drive a circulation,
although they can shape the large-scale circulation when combined with
turbulent mixing. Ocean tides and librations may provide an energy source for
such turbulence, but the magnitude of this energy source remains highly
uncertain for the icy moons, which poses a major obstacle to predicting the
ocean dynamics of icy worlds and remains as an important topic for future
research.
","[{""version"":""v1"",""created"":""Wed, 1 Jun 2022 19:46:20 GMT""},{""version"":""v2"",""created"":""Wed, 31 May 2023 19:13:03 GMT""}]","2023-06-02"
"2206.00733","Marcin Witkowski","Marcin Witkowski, S{\l}awomir Bilicki, Marcin Bober, Domagoj
  Kova\v{c}i\'c, Vijay Singh, Ara Tonoyan, and Micha{\l} Zawada","Photoionization cross sections of ultracold $^{88}$Sr in $^1$P$_1$ and
  $^3$S$_1$ states at 390 nm and the resulting blue-detuned magic wavelength
  optical lattice clock constraints","Copyright 2022 Optica Publishing Group. Users may use, reuse, and
  build upon the article, or use the article for text or data mining, so long
  as such uses are for non-commercial purposes and appropriate attribution is
  maintained. All other rights are reserved","Opt. Express 30, 21423-21438 (2022)","10.1364/OE.460554",,"physics.atom-ph","http://creativecommons.org/licenses/by/4.0/","  We present the measurements of the photoionisation cross sections of the
excited $^1$P$_1$ and $^3$S$_1$ states of ultracold $^{88}$Sr atoms at 389.889
nm wavelength, which is the magic wavelength of the
$^{1}$S$_{0}$-${}^{3}$P${}_{0}$ clock transition. The photoionisation cross
section of the $^1$P$_1$ state is determined from the measured ionisation rates
of $^{88}$Sr in the magneto-optical trap in the $^1$P$_1$ state to be
2.20(50)$\times$10$^{-20}$ m$^2$, while the photoionisation cross section of
$^{88}$Sr in the $^3$S$_1$ state is inferred from the photoionisation-induced
reduction in the number of atoms transferred through the $^3\text{S}_1$ state
in an operating optical lattice clock to be $1.38(66)\times$10$^{-18}$ m$^2$.
Furthermore, the resulting limitations of employing a blue-detuned magic
wavelength optical lattice in strontium optical lattice clocks are evaluated.
We estimated photoionisation induced loss rates of atoms at 389.889 nm
wavelength under typical experimental conditions and made several suggestions
on how to mitigate these losses. In particular, the large photoionisation
induced losses for the $^3$S$_1$ state would make the use of the $^3$S$_1$
state in the optical cycle in a blue-detuned optical lattice unfeasible and
would instead require the less commonly used $^3$D$_{1,2}$ states during the
detection part of the optical clock cycle.
","[{""version"":""v1"",""created"":""Wed, 1 Jun 2022 19:48:01 GMT""}]","2022-06-03"
"2206.00734","J\'er\'emy Barbay","J\'er\'emy Barbay and Fabi\'an Ja\~na and Crist\'obal Sepulveda
  \'Alvarez","Measuring Discrimination Abilities of Monk Parakeets Between Discreet
  and Continuous Quantities Through a Digital Life Enrichment Application","Long preliminary version",,,,"cs.OH","http://creativecommons.org/publicdomain/zero/1.0/","  Ain et al. measured three African Grey (Psittacus erithacus) parrot's
discrimination abilities between discreet and continuous quantities. Some
features of their experimental protocol make it difficult to apply to other
subjects and/or species without introducing a risk for some bias, as subjects
could read cues from the experimenter (even though the study's subjects
probably did not). Can digital life enrichment techniques permit us to
replicate their results with other species with less risk for experimental
bias, with a better precision, and at lower cost? Inspired by previous informal
digital life enrichment experiments with parrots, we designed and tested a web
application to digitally replicate and extend Ain et al.'s experimental setup.
We were able to obtain similar results to theirs for two individuals from a
distinct species, Monk Parakeets (Myiopsitta Monachus), with increased
guarantees against potential experimental biases, in a way which should allow
to replicate such experiments at larger scale and at a much lower cost.
","[{""version"":""v1"",""created"":""Wed, 1 Jun 2022 19:49:31 GMT""}]","2022-06-03"
"2206.00735","Lluis Castrejon","Lluis Castrejon, Nicolas Ballas, Aaron Courville","Cascaded Video Generation for Videos In-the-Wild","Accepted to the 26th International Conference on Pattern Recognition
  (ICPR 2022). arXiv admin note: substantial text overlap with arXiv:2106.02719",,,,"cs.CV cs.LG","http://arxiv.org/licenses/nonexclusive-distrib/1.0/","  Videos can be created by first outlining a global view of the scene and then
adding local details. Inspired by this idea we propose a cascaded model for
video generation which follows a coarse to fine approach. First our model
generates a low resolution video, establishing the global scene structure,
which is then refined by subsequent cascade levels operating at larger
resolutions. We train each cascade level sequentially on partial views of the
videos, which reduces the computational complexity of our model and makes it
scalable to high-resolution videos with many frames. We empirically validate
our approach on UCF101 and Kinetics-600, for which our model is competitive
with the state-of-the-art. We further demonstrate the scaling capabilities of
our model and train a three-level model on the BDD100K dataset which generates
256x256 pixels videos with 48 frames.
","[{""version"":""v1"",""created"":""Wed, 1 Jun 2022 19:50:50 GMT""}]","2022-06-03"
"2206.00736","Wagner Barreto-Souza","Wagner Barreto-Souza, Sokol Ndreca, Rodrigo B. Silva and Roger W.C.
  Silva","Modified Galton-Watson processes with immigration under an alternative
  offspring mechanism","Paper submitted for publication",,,,"stat.ME stat.AP","http://arxiv.org/licenses/nonexclusive-distrib/1.0/","  We propose a novel class of count time series models alternative to the
classic Galton-Watson process with immigration (GWI) and Bernoulli offspring. A
new offspring mechanism is developed and its properties are explored. This
novel mechanism, called geometric thinning operator, is used to define a class
of modified GWI (MGWI) processes, which induces a certain non-linearity to the
models. We show that this non-linearity can produce better results in terms of
prediction when compared to the linear case commonly considered in the
literature. We explore both stationary and non-stationary versions of our MGWI
processes. Inference on the model parameters is addressed and the finite-sample
behavior of the estimators investigated through Monte Carlo simulations. Two
real data sets are analyzed to illustrate the stationary and non-stationary
cases and the gain of the non-linearity induced for our method over the
existing linear methods. A generalization of the geometric thinning operator
and an associated MGWI process are also proposed and motivated for dealing with
zero-inflated or zero-deflated count time series data.
","[{""version"":""v1"",""created"":""Wed, 1 Jun 2022 19:53:20 GMT""}]","2022-06-03"
"2206.00737","Ghadir Ayache","Ghadir Ayache, Venkat Dassari, Salim El Rouayheb","Walk for Learning: A Random Walk Approach for Federated Learning from
  Heterogeneous Data",,,,,"cs.LG cs.IT math.IT","http://creativecommons.org/licenses/by/4.0/","  We consider the problem of a Parameter Server (PS) that wishes to learn a
model that fits data distributed on the nodes of a graph. We focus on Federated
Learning (FL) as a canonical application. One of the main challenges of FL is
the communication bottleneck between the nodes and the parameter server. A
popular solution in the literature is to allow each node to do several local
updates on the model in each iteration before sending it back to the PS. While
this mitigates the communication bottleneck, the statistical heterogeneity of
the data owned by the different nodes has proven to delay convergence and bias
the model. In this work, we study random walk (RW) learning algorithms for
tackling the communication and data heterogeneity problems. The main idea is to
leverage available direct connections among the nodes themselves, which are
typically ""cheaper"" than the communication to the PS. In a random walk, the
model is thought of as a ""baton"" that is passed from a node to one of its
neighbors after being updated in each iteration. The challenge in designing the
RW is the data heterogeneity and the uncertainty about the data distributions.
Ideally, we would want to visit more often nodes that hold more informative
data. We cast this problem as a sleeping multi-armed bandit (MAB) to design a
near-optimal node sampling strategy that achieves variance-reduced gradient
estimates and approaches sub-linearly the optimal sampling strategy. Based on
this framework, we present an adaptive random walk learning algorithm. We
provide theoretical guarantees on its convergence. Our numerical results
validate our theoretical findings and show that our algorithm outperforms
existing random walk algorithms.
","[{""version"":""v1"",""created"":""Wed, 1 Jun 2022 19:53:24 GMT""}]","2022-06-03"
"2206.00738","Tirtharaj Dash","Ashwin Srinivasan, A Baskar, Tirtharaj Dash, Devanshu Shah","Composition of Relational Features with an Application to Explaining
  Black-Box Predictors","47 pages; Revision1 for Machine Learning Journal (MLJ)",,,,"cs.LG cs.AI cs.NE","http://arxiv.org/licenses/nonexclusive-distrib/1.0/","  Relational machine learning programs like those developed in Inductive Logic
Programming (ILP) offer several advantages: (1) The ability to model complex
relationships amongst data instances; (2) The use of domain-specific relations
during model construction; and (3) The models constructed are human-readable,
which is often one step closer to being human-understandable. However, these
ILP-like methods have not been able to capitalise fully on the rapid hardware,
software and algorithmic developments fuelling current developments in deep
neural networks. In this paper, we treat relational features as functions and
use the notion of generalised composition of functions to derive complex
functions from simpler ones. We formulate the notion of a set of
$\text{M}$-simple features in a mode language $\text{M}$ and identify two
composition operators ($\rho_1$ and $\rho_2$) from which all possible complex
features can be derived. We use these results to implement a form of
""explainable neural network"" called Compositional Relational Machines, or CRMs,
which are labelled directed-acyclic graphs. The vertex-label for any vertex $j$
in the CRM contains a feature-function $f_j$ and a continuous activation
function $g_j$. If $j$ is a ""non-input"" vertex, then $f_j$ is the composition
of features associated with vertices in the direct predecessors of $j$. Our
focus is on CRMs in which input vertices (those without any direct
predecessors) all have $\text{M}$-simple features in their vertex-labels. We
provide a randomised procedure for constructing and learning such CRMs. Using a
notion of explanations based on the compositional structure of features in a
CRM, we provide empirical evidence on synthetic data of the ability to identify
appropriate explanations; and demonstrate the use of CRMs as 'explanation
machines' for black-box models that do not provide explanations for their
predictions.
","[{""version"":""v1"",""created"":""Wed, 1 Jun 2022 19:54:16 GMT""},{""version"":""v2"",""created"":""Sat, 6 May 2023 05:08:21 GMT""}]","2023-05-09"
"2206.00739","Victor P\'eron","Philippe Angot, Gilles Carbou, Victor P\'eron","Asymptotic Study for Stokes-Brinkman model with jump embedded
  transmission conditions",,,,,"math.AP","http://arxiv.org/licenses/nonexclusive-distrib/1.0/","  In this paper, one considers the coupling of a Brinkman model and Stokes
equations with jump embedded transmission conditions. In this model, one
assumes that the viscosity in the porous region is very small. Then we derive a
Wentzel--Kramers--Brillouin (WKB) expansion in power series of the square root
of this small parameter for the velocity and the pressure which are solution of
the transmission problem. This WKB expansion is justified rigorously by proving
uniform errors estimates.
","[{""version"":""v1"",""created"":""Wed, 1 Jun 2022 19:55:01 GMT""}]","2022-06-03"
"2206.00740","Mitchell Passarelli","Mitchell L. Passarelli, Askar Kazbekov, Victor Salazar, Krishna
  Venkatesan, Adam M. Steinberg","Experimental Study of Forced Synchronization and Cross-coupling in a
  Liquid-Fuelled Gas Turbine Combustor at Elevated Pressure","Submitted to Proceedings of the Combustion Institute",,,,"physics.flu-dyn","http://arxiv.org/licenses/nonexclusive-distrib/1.0/","  The effects of external forcing on a turbulent, liquid-fuelled,
swirl-stabilized gas turbine combustor operating at a pressure of approximately
1 MPa are explored experimentally. In particular, the dynamics and coupling
between the hydrodynamics, heat release rate and acoustics are compared for
various forcing amplitudes at a fixed forcing frequency $f_f$. The
hydrodynamics were characterized via laser Mie scattering from droplets in the
fuel spray, while the heat release rate was qualitatively measured using
chemiluminescence (CL) emissions in the 312 $\pm$ 12.5 nm wavelength range,
both at 10 kHz. The dynamics at the frequencies of interest were extracted
using spectral proper orthogonal decomposition (SPOD). In the unforced case,
the spray and CL oscillations exhibited similar dynamics, dominated by
oscillations at frequency $f_0$, whereas the pressure fluctuations were
predominantly at $f_P$. As the forcing amplitude was increased from zero, the
spray and CL exhibited changes in their power spectra characteristic of the
suppression route to synchronization. The pressure fluctuations, however, were
observed to follow the phase-locking route to synchronization. In contrast with
expectations from synchronization theory, the amplitude of the pressure
fluctuations increased significantly not only after lock-on, but also as the
frequency detuning with $f_f$ decreased. It is shown that this increase in
amplitude is not due to intermittency in the frequency of the pressure
oscillations. The simultaneous occurrence of phase-locking and suppression
illustrates the rich variety of dynamics that can occur in practical combustor
systems. In addition, the amplification of the pressure oscillations based on
the frequency detuning with the forcing suggests that classical reasoning based
on the Rayleigh Index may not be sufficient to understand the high amplitude
behaviour of multimodal systems.
","[{""version"":""v1"",""created"":""Wed, 1 Jun 2022 19:56:27 GMT""}]","2022-06-03"
"2206.00741","Brian Dennis","Brian R. Dennis, Albert Y. Shih, Gordon J. Hurford, and Pascal
  Saint-Hilaire","Ramaty High Energy Solar Spectroscopic Imager (RHESSI)","To be published as a chapter in the Handbook of X-ray and Gamma-ray
  Astrophysics",,"10.1007/978-981-16-4544-0_169-1",,"astro-ph.SR astro-ph.HE","http://creativecommons.org/licenses/by-nc-sa/4.0/","  This paper describes the X-ray and gamma-ray imaging spectroscopy
capabilities of the Ramaty High Energy Solar Spectroscopic Imager (RHESSI). It
also outlines RHESSI's major scientific accomplishments during the 16 years of
operations from 2002 to 2018. These include unique contributions to solar flare
research and to other aspects of solar physics (oblateness), astrophysics
(magnetars), and Earth sciences (terrestrial gamma-ray flashes).
","[{""version"":""v1"",""created"":""Wed, 1 Jun 2022 19:57:46 GMT""}]","2023-04-05"
"2206.00742","Peter Mueller","P. M\""uller, Y. Bagdasarova, R. Hong, A. Leredde, K.G. Bailey, X.
  Fl\'echard, A. Garc\'ia, B. Graner, A. Knecht, O. Naviliat-Cuncic, T.P.
  O'Connor, M.G. Sternberg, D.W. Storm, H.E. Swanson, F. Wauters, and D.W.
  Zumwalt","$\beta$-nuclear-recoil correlation from $^6$He decay in a laser trap",,,"10.1103/PhysRevLett.129.182502",,"nucl-ex","http://arxiv.org/licenses/nonexclusive-distrib/1.0/","  We report the first precise measurement of a $\beta$-recoil correlation from
a radioactive noble gas ($^6{\rm He}$) confined via a magneto-optical trap. The
measurement is motivated by the search for exotic tensor-type contributions to
the charged weak current. Interpreted as tensor currents with right-handed
neutrinos, the measurements yield: $|C_T/C_A|^2\le 0.022$ (90\% C.L.). On the
other hand, for left-handed neutrinos the limits are $0.007< C_T/C_A
<0.111$~(90\%\ C.L.). The sensitivity of the present measurement is mainly
limited by experimental uncertainties in determining the time response
properties and the distance between the atom cloud and the micro-channel plate
used for recoil ion detection.
","[{""version"":""v1"",""created"":""Wed, 1 Jun 2022 20:05:10 GMT""}]","2022-11-09"
