"2206.01019","Yuto Hosaka","Yuto Hosaka and Shigeyuki Komura","Nonequilibrium Transport Induced by Biological Nanomachines","14 pages, 11 figures","Biophys. Rev. Lett. 17, 51 (2022)","10.1142/S1793048022310026",,"cond-mat.soft","http://arxiv.org/licenses/nonexclusive-distrib/1.0/","  Biological nanomachines are nanometer-size macromolecular complexes that
catalyze chemical reactions in the presence of substrate molecules. The
catalytic functions carried out by such nanomachines in the cytoplasm, and
biological membranes are essential for cellular metabolism and homeostasis.
During catalytic reactions, enzymes undergo conformational changes induced by
substrate binding and product release. In recent years, these conformational
dynamics have been considered to account for the nonequilibrium transport
phenomena such as diffusion enhancement, chemotaxis, and substantial change in
rheological properties, which are observed in biological systems. In this
review article, we shall give an overview of the recent theoretical and
experimental investigations that deal with nonequilibrium transport phenomena
induced by biological nanomachines such as enzymes or proteins.
","[{""version"":""v1"",""created"":""Thu, 2 Jun 2022 12:38:52 GMT""},{""version"":""v2"",""created"":""Fri, 3 Jun 2022 08:51:05 GMT""}]","2022-11-22"
"2206.01020","Tobias Lorey","Tobias Lorey, Stefan Mohacsi, Armin Beer, Michael Felderer","STORM: A Model for Sustainably Onboarding Software Testers",,,,,"cs.SE","http://arxiv.org/licenses/nonexclusive-distrib/1.0/","  Recruiting and onboarding software testing professionals are complex and cost
intensive activities. Whether onboarding is successful and sustainable depends
on both the employee as well as the organization and is influenced by a number
of often highly individual factors. Therefore, we propose the Software Testing
Onboarding Model (STORM) for sustainably onboarding software testing
professionals based on existing frameworks and models taking into account
onboarding processes, sustainability, and test processes. We provide detailed
instructions on how to use the model and apply it to real-world onboarding
processes in two industrial case studies.
","[{""version"":""v1"",""created"":""Thu, 2 Jun 2022 12:44:04 GMT""}]","2022-06-03"
"2206.01021","Klaus Scherer","Klaus Scherer, Kostas Dialynas, Horst Fichtner, Ander Galli, Elias
  Roussos","On the properties of 0.11 keV to 344 MeV ion spectra in the inner
  heliosheath using regularized $\kappa$-distributions","9 pages 2 figures, 2 tables","A&A 664, A132 (2022)","10.1051/0004-6361/202243449",,"astro-ph.SR astro-ph.HE physics.plasm-ph","http://creativecommons.org/licenses/by/4.0/","  The shape of the ion energy spectra plays a critical role toward determining
the ion energetics, the acceleration mechanisms and the possible sources of
different plasma and suprathermal ion populations. The determination of the
exact shape of the total particle spectrum, provide the necessary means to
address the inner heliosheath (IHS) dynamics. Apart from various modeling
efforts, a direct fit to the measured ion spectra for an extended energy range
of $\sim$0.11 to 344 MeV has not been performed to date.
  We use an extended set of combined 0.11-55 keV ENA measurements from the
Interstellar Boundary Explorer (IBEX-Lo and IBEX-Hi) and Cassini/Ion and
Neutral Camera (INCA), converted to protons, together with $\sim$28 keV to 344
MeV ion measurements from the Low Energy Charged Particle (LECP) and Cosmic Ray
Subsystem (CRS) experiments on Voyager 2, over the declining phase of Solar
Cyle 23 (SC23) and ascending phase Solar Cylce 24 (SC24) (2009-2016) to study
the characteristics of the particle energy spectrum.
  We fit the 0.11 keV to 344 MeV composite spectra with a set of regularized
isotropic $\kappa$-distribution functions (RKD) allowing the determination of
the macroscopic physical properties.
  We demonstrate that the 2009-2012 spectrum that corresponds to the declining
phase of SC23 is well fitted by three different RKDs, while the 2013-2016
spectrum, associated with the rise of SC24, can only be approximated with six
different RKDs.
  Our results are generally consistent with shock accelerated particles that
undergo additional acceleration inside the IHS. We identify a low energy
transmitted population of particles, a suprathermal reflected population and a
very high energy component that is modulated by GCRs. The 2013-2016 time period
is most likely associated with a mixture of particles from SC23 and SC24, which
is reflected by the need to employ six RDKs.
","[{""version"":""v1"",""created"":""Thu, 2 Jun 2022 12:44:07 GMT""}]","2022-08-17"
"2206.01022","Cheng Mingyuan","Mingyuan Cheng and Xinru Liao and Quan Liu and Bin Ma and Jian Xu and
  Bo Zheng","Learning Disentangled Representations for Counterfactual Regression via
  Mutual Information Minimization",,,,,"cs.LG stat.ML","http://arxiv.org/licenses/nonexclusive-distrib/1.0/","  Learning individual-level treatment effect is a fundamental problem in causal
inference and has received increasing attention in many areas, especially in
the user growth area which concerns many internet companies. Recently,
disentangled representation learning methods that decompose covariates into
three latent factors, including instrumental, confounding and adjustment
factors, have witnessed great success in treatment effect estimation. However,
it remains an open problem how to learn the underlying disentangled factors
precisely. Specifically, previous methods fail to obtain independent
disentangled factors, which is a necessary condition for identifying treatment
effect. In this paper, we propose Disentangled Representations for
Counterfactual Regression via Mutual Information Minimization (MIM-DRCFR),
which uses a multi-task learning framework to share information when learning
the latent factors and incorporates MI minimization learning criteria to ensure
the independence of these factors. Extensive experiments including public
benchmarks and real-world industrial user growth datasets demonstrate that our
method performs much better than state-of-the-art methods.
","[{""version"":""v1"",""created"":""Thu, 2 Jun 2022 12:49:41 GMT""}]","2022-06-03"
"2206.01023","Pinghui Huang Dr","Pinghui Huang, Xue-Ning Bai","A Multi-Fluid Dust Module in Athena++: Algorithms and Numerical Tests","32 pages, 14 figures, ApJS resubmitted after addressing referee's
  comments",,"10.3847/1538-4365/ac76cb",,"astro-ph.EP astro-ph.IM","http://creativecommons.org/publicdomain/zero/1.0/","  We describe the algorithm, implementation and numerical tests of a multifluid
dust module in the Athena++ magnetohydrodynamic (MHD) code. The module can
accommodate an arbitrary number of dust species interacting with the gas via
aerodynamic drag (characterized by the stopping time), with a number of
numerical solvers. In particular, we describe two second-order accurate,
two-stage, fully-implicit solvers that are stable in stiff regimes including
short stopping time and high dust mass loading, and they are paired with the
second-order explicit van-Leer and Runge-Kutta gas dynamics solvers in
Athena++, respectively. Moreover, we formulate a consistent treatment of dust
concentration diffusion with dust back-reaction, which incorporates momentum
diffusion and ensures Galilean invariance. The new formulation and stiff drag
solvers are implemented to be compatible with most existing features of
Athena++, including different coordinate systems, mesh refinement, shearing-box
and orbital advection. We present a large suite of test problems, including the
streaming instability in linear and nonlinear regimes, as well as local and
global setting, which demonstrate that the code achieves the desired
performance. This module will be particularly useful for studies of dust
dynamics and planet formation in protoplanetary disks.
","[{""version"":""v1"",""created"":""Thu, 2 Jun 2022 12:54:41 GMT""}]","2022-08-31"
"2206.01024","Jipeng Han","Han Jipeng, Lichen Zhihang","A Constraint and Object Oriented Fifth Generation Programming Language
  and its Compiler and Runtime System","22 pages, 8 figures, submitted to Chinese Journal of Computers",,,,"cs.PL","http://arxiv.org/licenses/nonexclusive-distrib/1.0/","  Since the advent of LISP, the fifth generation programming language has
developed for decades. However, compared with the fourth generation programming
language, the fifth generation programming language has not been widely used
because of its obscure semantics, rigorous representation of problems, and
limited inference ability. For this reason, COOL (Constraint and Object Ordered
Language), a fifth generation programming language proposed in this paper,
overcomes the problems of intuitive semantics, rigorous restrictions on
handling problem conditions, and improves the inference ability of previous
fifth generation programming languages. Specific improvements are as follows:
First, COOL supports process-oriented and object-oriented for easy application
in production projects; Second, COOL supports expression as function
declaration and function return, which improves language affinity for
mathematical formulas, and supports embedding function parameters into function
name strings to make function naming closer to natural languages. Make
mathematical problems easier to describe; Third, COOL introduces a weighting
mechanism and accelerates the inference process through cumulative weighting.
Fourth, COOL introduces the concepts of forward and reverse functions in
programming so that computers can infer and execute problems with logical
sequential constraints. Fifth, the computer can deduce the reverse solution
process by using the forward solution process through the back-tracking
algorithm and the dynamic programming algorithm, so that the computer can
deduce the problem with time-sequential constraints. Sixth, the pre-execution
step is introduced to separate the inference and function query process of the
program from the execution process, so as to improve the execution speed of the
program.
","[{""version"":""v1"",""created"":""Thu, 2 Jun 2022 12:55:03 GMT""}]","2022-06-03"
"2206.01025","Estelina Lora da Silva","E. Lora da Silva, J. M. Skelton, P. Rodr\'iguez-Hern\'andez, A.
  Mu\~noz, M. C. Santos, D. Mart\'inez-Garc\'ia, R. Vilaplana, and F. J.
  Manj\'on","Theoretical study of the stability of the tetradymite-like phases of
  Sb$_2$S$_3$, Bi$_2$S$_3$, and Sb$_2$Se$_3$","17 pages, 9 figures",,,,"cond-mat.mtrl-sci","http://creativecommons.org/licenses/by/4.0/","  We report a comparative theoretical study of the \textit{Pnma} and
\textit{R-3m} phases of Sb$_2$S$_3$, Bi$_2$S$_3$, and Sb$_2$Se$_3$ close to
ambient pressure.
  Our enthalpy calculations at 0 K show that at ambient pressure the
\textit{R-3m} (tetradymite-like) phase of Sb$_2$Se$_3$ is energetically more
stable than the \textit{Pnma} phase, contrary to what is observed for
Sb$_2$S$_3$ and Bi$_2$S$_3$, and irrespective of the exchange-correlation
functional employed in the calculations.
  The result for Sb$_2$Se$_3$ is in contradiction to experiments where all
three compounds are usually grown in the \textit{Pnma} phase.
  This result is further confirmed by free-energy calculations taking into
account the temperature dependence of the unit-cell volumes and phonon
frequencies.
  Lattice dynamics and elastic tensor calculations further show that both
\textit{Pnma} and \textit{R-3m} phases of Sb$_2$Se$_3$ are dynamically and
mechanically stable at zero applied pressure.
  Since these results suggest that the formation of the \textit{R-3m} phase for
Sb$_2$Se$_3$ should be feasible at close to ambient conditions, we provide a
theoretical crystal structure and simulated Raman and infrared spectra to help
in its identification. We also discuss the results of the two published works
that have claimed to have synthesized tetradymite-like Sb$_2$Se$_3$.
  Finally, the stability of the \textit{R-3m} phase across the three group-15
\textit{A$_2$X$_3$} sesquichalcogenides is analysed based on their van der
Waals gap and X-X in-plane geometry.
","[{""version"":""v1"",""created"":""Thu, 2 Jun 2022 12:55:12 GMT""}]","2022-06-03"
"2206.01026","Tomasz Tkocz","Giorgos Chasapis, Salil Singh, Tomasz Tkocz","Haagerup's phase transition at polydisc slicing","Final version. To appear in Analysis & PDE",,,,"math.PR math.FA math.MG","http://arxiv.org/licenses/nonexclusive-distrib/1.0/","  We establish a sharp comparison inequality between the negative moments and
the second moment of the magnitude of sums of independent random vectors
uniform on three-dimensional Euclidean spheres. This provides a probabilistic
extension of the Oleszkiewicz-Pelczy\'nski polydisc slicing result. The
Haagerup-type phase transition occurs exactly when the p-norm recovers volume,
in contrast to the real case. We also obtain partial results in higher
dimensions.
","[{""version"":""v1"",""created"":""Thu, 2 Jun 2022 12:55:27 GMT""},{""version"":""v2"",""created"":""Thu, 9 Mar 2023 16:38:19 GMT""}]","2023-03-10"
"2206.01027","Mishty Ray","Clifton Cunningham and Mishty Ray","Proof of Vogan's conjecture on Arthur packets: irreducible parameters of
  p-adic general linear groups","Main result generalized from from simple parameters to irreducible
  parameters; allowing ramification",,,,"math.RT math.NT","http://creativecommons.org/licenses/by/4.0/","  In this paper we prove Vogan's conjecture on local Arthur packets, for Arthur
parameters of $p$-adic general linear groups that are irreducible as
representations of $W_F \times SL_2(\mathbb{C}) \times SL_2(\mathbb{C})$ - we
refer to such parameters as irreducible Arthur parameters. This result shows
that these Arthur packets may be characterized by properties of simple perverse
sheaves on a moduli space of Langlands parameters.
","[{""version"":""v1"",""created"":""Thu, 2 Jun 2022 13:01:36 GMT""},{""version"":""v2"",""created"":""Sun, 9 Oct 2022 20:09:54 GMT""}]","2022-10-11"
"2206.01028","Sayan Biswas","Sayan Biswas, Graham Cormode, Carsten Maple","Impact of Sampling on Locally Differentially Private Data Collection",,,"10.1049/icp.2022.2042",,"cs.CR","http://creativecommons.org/licenses/by/4.0/","  With the recent bloom of data, there is a huge surge in threats against
individuals' private information. Various techniques for optimizing
privacy-preserving data analysis are at the focus of research in the recent
years. In this paper, we analyse the impact of sampling on the utility of the
standard techniques of frequency estimation, which is at the core of
large-scale data analysis, of the locally deferentially private data-release
under a pure protocol. We study the case in a distributed environment of data
sharing where the values are reported by various nodes to the central server,
e.g., cross-device Federated Learning. We show that if we introduce some random
sampling of the nodes in order to reduce the cost of communication, the
standard existing estimators fail to remain unbiased. We propose a new unbiased
estimator in the context of sampling each node with certain probability and
compute various statistical summaries of the data using it. We propose a way of
sampling each node with personalized sampling probabilities as a step to
further generalisation, which leads to some interesting open questions in the
end. We analyse the accuracy of our proposed estimators on synthetic datasets
to gather some insight on the trade-off between communication cost, privacy,
and utility.
","[{""version"":""v1"",""created"":""Thu, 2 Jun 2022 13:02:45 GMT""}]","2022-11-11"
"2206.01029","Kiwon Lee","Kiwon Lee, Andrew N. Cheng, Courtney Paquette and Elliot Paquette","Trajectory of Mini-Batch Momentum: Batch Size Saturation and Convergence
  in High Dimensions",,,,,"math.OC cs.LG math.PR stat.ML","http://arxiv.org/licenses/nonexclusive-distrib/1.0/","  We analyze the dynamics of large batch stochastic gradient descent with
momentum (SGD+M) on the least squares problem when both the number of samples
and dimensions are large. In this setting, we show that the dynamics of SGD+M
converge to a deterministic discrete Volterra equation as dimension increases,
which we analyze. We identify a stability measurement, the implicit
conditioning ratio (ICR), which regulates the ability of SGD+M to accelerate
the algorithm. When the batch size exceeds this ICR, SGD+M converges linearly
at a rate of $\mathcal{O}(1/\sqrt{\kappa})$, matching optimal full-batch
momentum (in particular performing as well as a full-batch but with a fraction
of the size). For batch sizes smaller than the ICR, in contrast, SGD+M has
rates that scale like a multiple of the single batch SGD rate. We give explicit
choices for the learning rate and momentum parameter in terms of the Hessian
spectra that achieve this performance.
","[{""version"":""v1"",""created"":""Thu, 2 Jun 2022 13:03:14 GMT""}]","2022-06-03"
"2206.01030","Saeed Fakhry","Mina Ghodsi Yengejeh, Saeed Fakhry, Javad T. Firouzjaee, Hojatollah
  Fathi","The Integrated Sachs-Wolfe Effect in Interacting Dark Matter-Dark Energy
  Models","13 pages, 2 tables, 8 figures, references added","Physics of the Dark Universe (2022)","10.1016/j.dark.2022.101144",,"astro-ph.CO gr-qc","http://creativecommons.org/licenses/by/4.0/","  Interacting dark matter-dark energy (IDMDE) models can be taken to account as
one of the present challenges that may affect the cosmic structures. In this
work, we study the integrated Sachs-Wolfe (ISW) effect in IDMDE models. To this
end, we initially introduce a theoretical framework for IDMDE models. Moreover,
we briefly discuss the stability conditions of IDMDE models and by specifying a
simple functional form for the energy density transfer rate, we calculate the
perturbation equations. In the following, we calculate the amplitude of the
matter power spectrum for the IDMDE model and compare it with the corresponding
result obtained from the $\Lambda$CDM model. Furthermore, we calculate the
amplitude of the ISW auto-power spectrum as a function of multipole order l for
the IDMDE model. The results indicate that the amplitude of the ISW auto-power
spectrum in the IDMDE model for different phantom dark energy equations of
state behaves similar to the one for the $\Lambda$CDM model, whereas, for the
quintessence dark energy equations of state, the amplitude of the ISW-auto
power spectrum for the IDMDE model should be higher than the one for the
$\Lambda$CDM model. Also, it turns out that the corresponding results by
different values of the coupling parameter demonstrate that $\xi$ is inversely
proportional to the amplitude of the ISW-auto power spectrum in the IDMDE
model. Finally, by employing four different surveys, we calculate the amplitude
of the ISW-cross power spectrum as a function of multipole order $l$ for the
IDMDE model. The results exhibit that the amplitude of the ISW-cross power
spectrum for the IDMDE model for all values of $\omega_{\rm x}$ is higher than
the one obtained for the $\Lambda$CDM model. Also, it turns out that the
amplitude of the ISW-cross power spectrum in the IDMDE model changes inversely
with the value of coupling parameter $\xi$.
","[{""version"":""v1"",""created"":""Thu, 2 Jun 2022 13:03:52 GMT""}]","2022-11-29"
"2206.01031","E. Ragoucy","Nicolas Crampe, Luc Frappat, Eric Ragoucy","Representations of the rank two Racah algebra and orthogonal
  multivariate polynomials","40 pages, 4 figures. Several signs corrected and some proofs
  clarified",,,"LAPTH-028/22","math.RT math-ph math.MP","http://arxiv.org/licenses/nonexclusive-distrib/1.0/","  The algebraic structure of the rank two Racah algebra is studied in detail.
We provide an automorphism group of this algebra, which is isomorphic to the
permutation group of five elements. This group can be geometrically interpreted
as the symmetry of a folded icosidodecahedron. It allows us to study a class of
equivalent irreducible representations of this Racah algebra. They can be
chosen symmetric so that their transition matrices are orthogonal. We show that
their entries can be expressed in terms of Racah polynomials. This construction
gives an alternative proof of the recurrence, difference and orthogonal
relations satisfied by the Tratnik polynomials, as well as their expressions as
a product of two monovariate Racah polynomials. Our construction provides a
generalization of these bivariate polynomials together with their properties.
","[{""version"":""v1"",""created"":""Thu, 2 Jun 2022 13:06:17 GMT""},{""version"":""v2"",""created"":""Fri, 8 Jul 2022 14:24:53 GMT""},{""version"":""v3"",""created"":""Tue, 24 Jan 2023 15:27:02 GMT""}]","2023-01-25"
"2206.01032","Yuri Gurevich","Yuri Gurevich and Tatiana Yavorskaya","A more abstract bounded exploration postulate",,,,,"cs.SE cs.LO","http://arxiv.org/licenses/nonexclusive-distrib/1.0/","  In article ""Sequential abstract state machines capture sequential
algorithms"", one of us axiomatized sequential algorithms by means of three
postulates: sequential time, abstract state, and bounded exploration
postulates. Here we give a more abstract version of the bounded exploration
postulate which is closer in spirit to the abstract state postulate. In the
presence of the sequential time and abstract state postulates, our postulate is
equivalent to the original bounded exploration postulate.
","[{""version"":""v1"",""created"":""Thu, 2 Jun 2022 13:08:33 GMT""}]","2022-06-03"
"2206.01033","Christiane Quesne","C. Quesne","Quasi-exactly solvable extensions of the Kepler-Coulomb potential on the
  sphere","28 pages, 2 figures. some changes in section 2, typos corrected,
  published version. arXiv admin note: text overlap with arXiv:1712.00329","Ann. Phys., NY 451 (2023) 169265","10.1016/j.aop.2023.169265",,"math-ph math.MP quant-ph","http://creativecommons.org/licenses/by/4.0/","  We consider a family of extensions of the Kepler-Coulomb potential on a
$d$-dimensional sphere and analyze it in a deformed supersymmetric framework,
wherein the starting potential is known to exhibit a deformed shape invariance
property. We show that the members of the extended family are also endowed with
such a property, provided some constraint conditions relating the potential
parameters are satisfied, in other words they are conditionally deformed shape
invariant. Since, in the second step of the construction of a partner potential
hierarchy, the constraint conditions change, we impose compatibility conditions
between the two sets to build quasi-exactly solvable potentials with known
ground and first-excited states. Some explicit results are obtained for the
first three members of the family. We then use a generating function method,
wherein the first two superpotentials, the first two partner potentials, and
the first two eigenstates of the starting potential are built from some
generating function $W_+(r)$ [and its accompanying function $W_-(r)$]. From the
results obtained for the latter for the first three family members, we propose
some formulas for $W_{\pm}(r)$ valid for the $m$th family member, depending on
$m+1$ constants $a_0$, $a_1$, \ldots, $a_m$. Such constants satisfy a system of
$m+1$ linear equations. Solving the latter allows us to extend the results up
to the seventh family member and then to formulate a conjecture giving the
general structure of the $a_i$ constants in terms of the parameters of the
problem.
","[{""version"":""v1"",""created"":""Thu, 2 Jun 2022 13:09:56 GMT""},{""version"":""v2"",""created"":""Tue, 13 Sep 2022 14:05:41 GMT""},{""version"":""v3"",""created"":""Tue, 14 Mar 2023 13:50:21 GMT""}]","2023-04-05"
"2206.01034","Chengyin Hu","Chengyin Hu, Yilong Wang, Kalibinuer Tiliwalidi, Wen Li","Adversarial Laser Spot: Robust and Covert Physical-World Attack to DNNs",,,,,"cs.CV cs.AI","http://arxiv.org/licenses/nonexclusive-distrib/1.0/","  Most existing deep neural networks (DNNs) are easily disturbed by slight
noise. However, there are few researches on physical attacks by deploying
lighting equipment. The light-based physical attacks has excellent covertness,
which brings great security risks to many vision-based applications (such as
self-driving). Therefore, we propose a light-based physical attack, called
adversarial laser spot (AdvLS), which optimizes the physical parameters of
laser spots through genetic algorithm to perform physical attacks. It realizes
robust and covert physical attack by using low-cost laser equipment. As far as
we know, AdvLS is the first light-based physical attack that perform physical
attacks in the daytime. A large number of experiments in the digital and
physical environments show that AdvLS has excellent robustness and covertness.
In addition, through in-depth analysis of the experimental data, we find that
the adversarial perturbations generated by AdvLS have superior adversarial
attack migration. The experimental results show that AdvLS impose serious
interference to advanced DNNs, we call for the attention of the proposed AdvLS.
The code of AdvLS is available at: https://github.com/ChengYinHu/AdvLS
","[{""version"":""v1"",""created"":""Thu, 2 Jun 2022 13:15:08 GMT""},{""version"":""v2"",""created"":""Tue, 23 May 2023 09:39:05 GMT""}]","2023-05-24"
