"2206.12863","Songbo Hou","Ruixue Chao, Songbo Hou, Jiamin Sun","Existence of solutions to a generalized self-dual Chern-Simons system on
  finite graphs","6 pages",,,,"math.AP","http://arxiv.org/licenses/nonexclusive-distrib/1.0/","  We study a system of equations arising in the Chern-Simons model on finite
graphs. Using the iteration scheme and the upper and lower solutions method, we
get existence of solutions in the non-critical case. The critical case is dealt
with by priori estimates. Our results generalize those of Huang et al. (Journal
of Functional Analysis 281(10) (2021) Paper No. 109218).
","[{""version"":""v1"",""created"":""Sun, 26 Jun 2022 12:45:47 GMT""}]","2022-06-28"
"2206.12864","Xuefei Yin","Xuefei Yin, Song Wang, Yanming Zhu, Jiankun Hu","A Novel Length-Flexible Lightweight Cancelable Fingerprint Template for
  Privacy-Preserving Authentication Systems in Resource-Constrained IoT
  Applications",,"IEEE Internet of Things Journal, 2022","10.1109/JIOT.2022.3204246",,"cs.CR","http://arxiv.org/licenses/nonexclusive-distrib/1.0/","  Fingerprint authentication techniques have been employed in various Internet
of Things (IoT) applications for access control to protect private data, but
raw fingerprint template leakage in unprotected IoT applications may render the
authentication system insecure. Cancelable fingerprint templates can
effectively prevent privacy breaches and provide strong protection to the
original templates. However, to suit resource-constrained IoT devices,
oversimplified templates would compromise authentication performance
significantly. In addition, the length of existing cancelable fingerprint
templates is usually fixed, making them difficult to be deployed in various
memory-limited IoT devices. To address these issues, we propose a novel
length-flexible lightweight cancelable fingerprint template for
privacy-preserving authentication systems in various resource-constrained IoT
applications. The proposed cancelable template design primarily consists of two
components: 1) length-flexible partial-cancelable feature generation based on
the designed re-indexing scheme; and 2) lightweight cancelable feature
generation based on the designed encoding-nested-difference-XOR scheme.
Comprehensive experimental results on public databases~FVC2002 DB1-DB4 and
FVC2004 DB1-DB4 demonstrate that the proposed cancelable fingerprint template
achieves equivalent authentication performance to state-of-the-art methods in
IoT environments, but our design substantially reduces template storage space
and computational cost. More importantly, the proposed length-flexible
lightweight cancelable template is suitable for a variety of commercial smart
cards (e.g., C5-M.O.S.T. Card Contact Microprocessor Smart Cards CLXSU064KC5).
To the best of our knowledge, the proposed method is the first length-flexible
lightweight, high-performing cancelable fingerprint template design for
resource-constrained IoT applications.
","[{""version"":""v1"",""created"":""Sun, 26 Jun 2022 12:47:28 GMT""}]","2022-12-08"
"2206.12865","Rujiang Li","Rujiang Li, Xiangyu Kong, Dongkai Hang, Guoyi Li, Hongyu Hu, Hao Zhou,
  Yongtao Jia, Pengfei Li, and Ying Liu","Topological bulk solitons in a nonlinear photonic Chern insulator",,,"10.1038/s42005-022-01058-z",,"physics.optics nlin.PS","http://creativecommons.org/licenses/by-nc-nd/4.0/","  Nonlinearities in lattices with topological band structures can induce
topological interfaces in the bulk of structures and give rise to bulk solitons
in the topological bandgaps. Here we study a photonic Chern insulator with
saturable nonlinearity and show the existence of topological bulk solitons. The
fundamental bulk solitons exhibit as semi-vortex solitons, where only one
pseudospin component has a nonzero vorticity. The bulk solitons have equal
angular momentum at different valleys. This phenomenon is a direct outcome of
the topology of the linear host lattice and the angular momentum can be changed
by switching the sign of the nonlinearity. The bulk solitons bifurcate from the
linear bulk band edge and terminate when their powers saturate. We find that
these bulk solitons are stable within the whole spectrum range. Moreover, these
bulk solitons are robust against lattice disorders both from on-site energies
and hopping amplitudes. Our work extends the study of Chern insulators into the
nonlinear regime and highlights the interplay between topology and
nonlinearity.
","[{""version"":""v1"",""created"":""Sun, 26 Jun 2022 12:47:33 GMT""},{""version"":""v2"",""created"":""Tue, 8 Nov 2022 01:33:16 GMT""}]","2022-11-09"
"2206.12866","Yuxuan Lu","Yuxuan Lu, Jingya Yan, Zhixuan Qi, Zhongzheng Ge, Yongping Du","Contextual embedding and model weighting by fusing domain knowledge on
  Biomedical Question Answering",,,"10.1145/3535508.3545508",,"cs.CL cs.AI","http://creativecommons.org/licenses/by/4.0/","  Biomedical Question Answering aims to obtain an answer to the given question
from the biomedical domain. Due to its high requirement of biomedical domain
knowledge, it is difficult for the model to learn domain knowledge from limited
training data. We propose a contextual embedding method that combines
open-domain QA model \aoa and \biobert model pre-trained on biomedical domain
data. We adopt unsupervised pre-training on large biomedical corpus and
supervised fine-tuning on biomedical question answering dataset. Additionally,
we adopt an MLP-based model weighting layer to automatically exploit the
advantages of two models to provide the correct answer. The public dataset
\biomrc constructed from PubMed corpus is used to evaluate our method.
Experimental results show that our model outperforms state-of-the-art system by
a large margin.
","[{""version"":""v1"",""created"":""Sun, 26 Jun 2022 12:47:38 GMT""}]","2022-06-29"
"2206.12867","Yang Jeong Park","Yang Jeong Park","Edge Direction-invariant Graph Neural Networks for Molecular Dipole
  Moments Prediction",,,,,"cs.LG cond-mat.mtrl-sci","http://arxiv.org/licenses/nonexclusive-distrib/1.0/","  The dipole moment is a physical quantity indicating the polarity of a
molecule and is determined by reflecting the electrical properties of
constituent atoms and the geometric properties of the molecule. Most embeddings
used to represent graph representations in traditional graph neural network
methodologies treat molecules as topological graphs, creating a significant
barrier to the goal of recognizing geometric information. Unlike existing
embeddings dealing with equivariance, which have been proposed to handle the 3D
structure of molecules properly, our proposed embeddings directly express the
physical implications of the local contribution of dipole moments. We show that
the developed model works reasonably even for molecules with extended
geometries and captures more interatomic interaction information, significantly
improving the prediction results with accuracy comparable to ab-initio
calculations.
","[{""version"":""v1"",""created"":""Sun, 26 Jun 2022 12:52:17 GMT""}]","2022-06-28"
"2206.12868","Julien Flamant","Julien Flamant, Konstantin Usevich, Marianne Clausel, David Brie","Polarimetric phase retrieval: uniqueness and algorithms","37 pages, 10 figures",,,,"eess.SP","http://arxiv.org/licenses/nonexclusive-distrib/1.0/","  This work introduces a novel Fourier phase retrieval model, called
polarimetric phase retrieval that enables a systematic use of polarization
information in Fourier phase retrieval problems. We provide a complete
characterization of uniqueness properties of this new model by unraveling
equivalencies with a peculiar polynomial factorization problem. We introduce
two different but complementary categories of reconstruction methods. The first
one is algebraic and relies on the use of approximate greatest common divisor
computations using Sylvester matrices. The second one carefully adapts existing
algorithms for Fourier phase retrieval, namely semidefinite positive relaxation
and Wirtinger-Flow, to solve the polarimetric phase retrieval problem. Finally,
a set of numerical experiments permits a detailed assessment of the numerical
behavior and relative performances of each proposed reconstruction strategy. We
further highlight a reconstruction strategy that combines both approaches for
scalable, computationally efficient and asymptotically MSE optimal performance.
","[{""version"":""v1"",""created"":""Sun, 26 Jun 2022 12:52:20 GMT""}]","2022-06-28"
"2206.12869","Koustav Ghosal","Koustav Ghosal, Aljosa Smolic","Image Aesthetics Assessment Using Graph Attention Network","International Conference on Pattern Recognition (ICPR), 2022",,,,"cs.CV","http://creativecommons.org/licenses/by/4.0/","  Aspect ratio and spatial layout are two of the principal factors determining
the aesthetic value of a photograph. But, incorporating these into the
traditional convolution-based frameworks for the task of image aesthetics
assessment is problematic. The aspect ratio of the photographs gets distorted
while they are resized/cropped to a fixed dimension to facilitate training
batch sampling. On the other hand, the convolutional filters process
information locally and are limited in their ability to model the global
spatial layout of a photograph. In this work, we present a two-stage framework
based on graph neural networks and address both these problems jointly. First,
we propose a feature-graph representation in which the input image is modelled
as a graph, maintaining its original aspect ratio and resolution. Second, we
propose a graph neural network architecture that takes this feature-graph and
captures the semantic relationship between the different regions of the input
image using visual attention. Our experiments show that the proposed framework
advances the state-of-the-art results in aesthetic score regression on the
Aesthetic Visual Analysis (AVA) benchmark.
","[{""version"":""v1"",""created"":""Sun, 26 Jun 2022 12:52:46 GMT""},{""version"":""v2"",""created"":""Tue, 28 Jun 2022 08:28:01 GMT""}]","2022-06-29"
"2206.12870","Kavita Dorai","Dileep Singh and Vaishali Gulati and Arvind and Kavita Dorai","Experimental construction of a symmetric three-qubit entangled state and
  its utility in testing the violation of a Bell inequality on an NMR quantum
  simulator","5 pages, 3 figures",,"10.1209/0295-5075/acab7e",,"quant-ph","http://creativecommons.org/licenses/by/4.0/","  We designed a quantum circuit to prepare a permutation-symmetric maximally
entangled three-qubit state called the $\vert {\rm S} \rangle$ state and
experimentally created it on an NMR quantum processor. The presence of
entanglement in the state was certified by computing two different entanglement
measures, namely negativity and concurrence. We used the $\vert {\rm S}
\rangle$ state in conjunction with a set of maximally incompatible local
measurements, to demonstrate the maximal violation of inequality number $26$ in
Sliwa's classification scheme, which is a tight Bell inequality for the (3,2,2)
scenario i.e. the three party, two measurement settings and two measurement
outcomes scenario.
","[{""version"":""v1"",""created"":""Sun, 26 Jun 2022 12:56:47 GMT""}]","2023-01-11"
"2206.12871","Srijonee Shabnam Chaudhury","Srijonee Shabnam Chaudhury","A Matrix Analogue of Schur-Siegel-Smyth Trace Problem","14 pages",,,,"math.NT math.CO","http://arxiv.org/licenses/nonexclusive-distrib/1.0/","  Let $\mathcal{S}$, $\mathcal{T}$, $\mathcal{C}$ be three sets of some special
types of connected positive definite matrices. The \textit{Absolute Trace} of a
square matrix $A$ is defined by
  $$
  \frac{\text{Trace of matrix A}}{\text{Order of A}}
  $$
  In this paper, we extend the notion of absolute trace by defining
\textit{trace-$k$ measure} of $A$ $=$ mean value of the power sums of
eigenvalues of $A$. And we obtain the greatest lower bound of this measure for
any $n \times n $ matrix in $\mathcal{S} \cup \mathcal{T} \cup \mathcal{C}$.
Using this we find some criteria which assure when an integer polynomial can
not be a characteristic or minimal polynomial of an integer symmetric matrix.
We also obtain here the smallest limit point of the set of all \textit{absolute
trace-$k$ measure} of matrices in $\mathcal{S} \cup \mathcal{T} \cup
\mathcal{C}$.
  Finally, we exhibit that the famous result of Smyth on density of absolute
trace measure of totally positive integers is also true for the set of
symmetric integer connected positive definite matrices.
","[{""version"":""v1"",""created"":""Sun, 26 Jun 2022 13:02:46 GMT""}]","2022-06-28"
"2206.12872","Erc\""ument Orta\c{c}gil","Erc\""ument Orta\c{c}gil","On Hadwiger-Alesker finiteness theorem","My Lemma is incorrect as bi-invariance does not imply my inclusion as
  I claim. However, once that inclusion holds, the rest follows",,,,"math.DG","http://creativecommons.org/licenses/by/4.0/","  We study the Hadwiger-Alesker finiteness theorem from the standpoint of Lie
theory and announce a generalization.
","[{""version"":""v1"",""created"":""Sun, 26 Jun 2022 13:07:05 GMT""},{""version"":""v2"",""created"":""Wed, 29 Jun 2022 07:35:13 GMT""}]","2022-06-30"
"2206.12873","Miner Zhong","Miner Zhong, Jiwon Kim, Zuduo Zheng","Estimating Link Flows in Road Networks with Synthetic Trajectory Data
  Generation: Reinforcement Learning-based Approaches","37 pages, 10 figures",,,,"cs.LG","http://arxiv.org/licenses/nonexclusive-distrib/1.0/","  This paper addresses the problem of estimating link flows in a road network
by combining limited traffic volume and vehicle trajectory data. While traffic
volume data from loop detectors have been the common data source for link flow
estimation, the detectors only cover a subset of links. Vehicle trajectory data
collected from vehicle tracking sensors are also incorporated these days.
However, trajectory data are often sparse in that the observed trajectories
only represent a small subset of the whole population, where the exact sampling
rate is unknown and may vary over space and time. This study proposes a novel
generative modelling framework, where we formulate the link-to-link movements
of a vehicle as a sequential decision-making problem using the Markov Decision
Process framework and train an agent to make sequential decisions to generate
realistic synthetic vehicle trajectories. We use Reinforcement Learning
(RL)-based methods to find the best behaviour of the agent, based on which
synthetic population vehicle trajectories can be generated to estimate link
flows across the whole network. To ensure the generated population vehicle
trajectories are consistent with the observed traffic volume and trajectory
data, two methods based on Inverse Reinforcement Learning and Constrained
Reinforcement Learning are proposed. The proposed generative modelling
framework solved by either of these RL-based methods is validated by solving
the link flow estimation problem in a real road network. Additionally, we
perform comprehensive experiments to compare the performance with two existing
methods. The results show that the proposed framework has higher estimation
accuracy and robustness under realistic scenarios where certain behavioural
assumptions about drivers are not met or the network coverage and penetration
rate of trajectory data are low.
","[{""version"":""v1"",""created"":""Sun, 26 Jun 2022 13:14:52 GMT""}]","2022-06-28"
"2206.12874","Lang Xie","Lang Xie, Da-Ming Wei, Yun Wang and Zhi-Ping Jin","Constraining the ellipticity of new-born magnetar with the observational
  data of Long gamma-ray bursts","15 pages, 7 figures,accepted for publication in ApJ",,"10.3847/1538-4357/ac7c13",,"astro-ph.HE","http://arxiv.org/licenses/nonexclusive-distrib/1.0/","  The X-ray plateau emission observed in many Long gamma-ray bursts (LGRBs) has
been usually interpreted as the spin-down luminosity of a rapidly spinning,
highly magnetized neutron star (millisecond magnetar). If this is true, then
the magnetar may emit extended gravitational wave (GW) emission associated with
the X-ray plateau due to non-axisymmetric deformation or various stellar
oscillations. The advanced LIGO and Virgo detectors have searched for
long-duration GW transients for several years, no evidence of GWs from any
magnetar has been found until now. In this work, we attempt to search for
signature of GW radiation in the electromagnetic observation of 30 LGRBs under
the assumption of the magnetar model.
  We utilize the observations of the LGRB plateau to constrain the properties
of the new-born magnetar, including the initial spin period $P_0$, diploe
magnetic field strength $B_p$ and the ellipticity $\epsilon$. We find that
there are some tight relations between magnetar parameters, e.g., $\epsilon
\propto B_p^{1.29}$ and $B_p\propto P_0^{1.14}$.
  In addition, we derive the GW strain for magnetar sample via their spin-down
processes, and find that the GWs from these objects may not be detectable by
the aLIGO and ET detectors. For a rapidly spinning magnetar ($P\sim 1\mbox{
ms}$, $ B \sim10^{15}\mbox{ G}$), the detection horizon for advanced LIGO O5
detector is $\sim 180\mbox{ Mpc}$. The detection of such GW signal associated
with the X-ray plateau would be a smoking gun that the central engine of GRB is
a magnetar.
","[{""version"":""v1"",""created"":""Sun, 26 Jun 2022 13:16:01 GMT""}]","2022-08-17"
"2206.12875","Yuriy Drozd","Yuriy A. Drozd","Backstr\""om algebras","24 pages","Pacific J. Math. 323 (2023) 67-88","10.2140/pjm.2023.323.67",,"math.RT","http://arxiv.org/licenses/nonexclusive-distrib/1.0/","  We introduce Backstr\""om pairs and Backstr\""om rings, study their derived
categories and construct for them a sort of categorical resolutions. For the
  latter we define the global dimension, construct a sort of semi-orthogonal
decomposition of the derived category and deduce that the derived dimension of
a Backstr\""om ring is at most $2$.
  Using this semi-orthogonal decomposition, we define a description of the
module category as the category of elements of a special bimodule.
  We also construct a partial tilting for a Backstr\""om pair to a ring of
triangular matrices and define the global dimension of the latter.
","[{""version"":""v1"",""created"":""Sun, 26 Jun 2022 13:22:32 GMT""},{""version"":""v2"",""created"":""Tue, 14 Feb 2023 18:54:13 GMT""}]","2023-05-31"
"2206.12876","Cristian Stelea","Marina-Aura Dariescu, Ciprian Dariescu, Vitalie Lungu and Cristian
  Stelea","The Kiselev solution in power-Maxwell electrodynamics","29 pages, 4 figures; v. 3 removed one section, improved the overall
  presentation",,"10.1103/PhysRevD.106.064017",,"gr-qc","http://arxiv.org/licenses/nonexclusive-distrib/1.0/","  In this work we reconsider the solution describing black holes surrounded by
a `quintessence'-like fluid. This geometry was introduced by Kiselev in 2003
and its physical source was originally modeled by an anisotropic fluid. We show
that the Kiselev geometry is actually an exact solution of the Einstein
equations coupled to nonlinear electrodynamics. More specifically, we show that
the Kiselev geometry becomes an exact solution in the context of power-Maxwell
electrodynamics, using either an electric ansatz or a magnetic one. In both
cases the physical source can be modeled by a power-Maxwell Lagrangian, albeit
with different powers corresponding to the electric or the magnetic charges. We
briefly investigate the motion of charged particles in this geometry. Finally,
we give the proper interpretation of the black-hole thermodynamics in this
context. Similarly to the Schwarzschild-de Sitter case, we note the presence of
the Schottky peaks in the heat capacity, signaling out the possibility of this
thermodynamic black hole system to function as a continuous heat machine.
","[{""version"":""v1"",""created"":""Sun, 26 Jun 2022 13:26:38 GMT""},{""version"":""v2"",""created"":""Mon, 4 Jul 2022 13:32:29 GMT""},{""version"":""v3"",""created"":""Thu, 1 Sep 2022 16:10:47 GMT""}]","2022-09-21"
"2206.12877","Daniele Musso","Alessio Caddeo, Carlos Hoyos, Daniele Musso","Emergent Dipole Gauge Fields and Fractons","9 pages (v3: improved expressions for the currents, comments added on
  sigle-valuedness of the fields)",,"10.1103/PhysRevD.106.L111903",,"cond-mat.str-el hep-th","http://creativecommons.org/licenses/by/4.0/","  We present a realization of fracton-elasticity duality purely formulated in
terms of ordinary gauge fields, encompassing standard elasticity and
incommensurate crystals as those describing twisted bilayer graphene,
quasicrystals or more general moir\'e lattices. Our construction comprises a
description of all types of two-dimensional defects: disclinations,
dislocations, discompressions and point-like defects, and takes into account
body forces and impurities. The original form of the duality in terms of tensor
gauge fields is recovered after partial gauge fixing. We identify the coupling
of each type of defect to the dual gauge fields, and from gauge invariance we
derive generalized continuity equations for the defect currents and the
expected mobility restrictions of elasticity defects.
","[{""version"":""v1"",""created"":""Sun, 26 Jun 2022 13:30:34 GMT""},{""version"":""v2"",""created"":""Sun, 17 Jul 2022 12:55:26 GMT""},{""version"":""v3"",""created"":""Sun, 31 Jul 2022 16:56:48 GMT""}]","2023-01-04"
"2206.12878","Kazumi Suematsu","Kazumi Suematsu, Haruo Ogura, Seiichi Inayama, and Toshihiko Okamoto","Segment Distribution around the Center of Gravity of Ring Polymers:
  Extension of the Kramers Method","6 pages, 3 figures",,,,"cond-mat.soft physics.chem-ph","http://arxiv.org/licenses/nonexclusive-distrib/1.0/","  The segment distribution around the center of gravity is derived for
unperturbed ring polymers. We show that, although a small difference is
observed, the exact distribution can be well approximated by the Gaussian
probability distribution function.
","[{""version"":""v1"",""created"":""Sun, 26 Jun 2022 13:39:37 GMT""}]","2022-06-28"
"2206.12879","Anna Hledikova","Anna Hl\'edikov\'a, Dominika Woszczyk, Alican Akman, Soteris
  Demetriou, Bj\""orn Schuller","Data Augmentation for Dementia Detection in Spoken Language","Accepted to INTERSPEECH 2022",,,,"cs.CL cs.LG cs.SD eess.AS","http://arxiv.org/licenses/nonexclusive-distrib/1.0/","  Dementia is a growing problem as our society ages, and detection methods are
often invasive and expensive. Recent deep-learning techniques can offer a
faster diagnosis and have shown promising results. However, they require large
amounts of labelled data which is not easily available for the task of dementia
detection. One effective solution to sparse data problems is data augmentation,
though the exact methods need to be selected carefully. To date, there has been
no empirical study of data augmentation on Alzheimer's disease (AD) datasets
for NLP and speech processing. In this work, we investigate data augmentation
techniques for the task of AD detection and perform an empirical evaluation of
the different approaches on two kinds of models for both the text and audio
domains. We use a transformer-based model for both domains, and SVM and Random
Forest models for the text and audio domains, respectively. We generate
additional samples using traditional as well as deep learning based methods and
show that data augmentation improves performance for both the text- and
audio-based models and that such results are comparable to state-of-the-art
results on the popular ADReSS set, with carefully crafted architectures and
features.
","[{""version"":""v1"",""created"":""Sun, 26 Jun 2022 13:40:25 GMT""},{""version"":""v2"",""created"":""Sat, 16 Jul 2022 17:40:14 GMT""}]","2022-07-19"
"2206.12880","Shuonan Wu","Guangwei Gao, Shuonan Wu","A $C^{0}$ finite element approximation of planar oblique derivative
  problems in non-divergence form",,,,,"math.NA cs.NA","http://arxiv.org/licenses/nonexclusive-distrib/1.0/","  This paper proposes a $C^{0}$ (non-Lagrange) primal finite element
approximation of the linear elliptic equations in non-divergence form with
oblique boundary conditions in planar, curved domains. As an extension of
[Calcolo, 58 (2022), No. 9], the Miranda-Talenti estimate for oblique boundary
conditions at a discrete level is established by enhancing the regularity on
the vertices. Consequently, the coercivity constant for the proposed scheme is
exactly the same as that from PDE theory. The quasi-optimal order error
estimates are established by carefully studying the approximation property of
the finite element spaces. Numerical experiments are provided to verify the
convergence theory and to demonstrate the accuracy and efficiency of the
proposed methods.
","[{""version"":""v1"",""created"":""Sun, 26 Jun 2022 13:41:16 GMT""}]","2022-06-28"
"2206.12881","Biagio Ricceri","Biagio Ricceri","A further multiplicity result for Lagrangian systems of relativistic
  oscillators",,,,,"math.CA","http://creativecommons.org/licenses/by/4.0/","  This is our third paper, after [4] and [5], about a joint application of the
theory developed by Brezis and Mawhin in [1] with our minimax theorems ([2],
[3]) to get multiple solutions of problems of the type
$$\cases{(\phi(u'))'=\nabla_xF(t,u) & in $[0,T]$\cr & \cr u(0)=u(T)\ , \hskip
3pt u'(0)=u'(T)\cr}$$ which are global minima of a suitable functional over a
set of Lipschitzian functions. A challenging conjecture is also formulated.
","[{""version"":""v1"",""created"":""Sun, 26 Jun 2022 13:49:19 GMT""}]","2022-06-28"
