"2206.12811","Chenyang Wang","Chenyang Wang, Yuanqing Yu, Weizhi Ma, Min Zhang, Chong Chen, Yiqun
  Liu, Shaoping Ma","Towards Representation Alignment and Uniformity in Collaborative
  Filtering","Accepted by KDD'2022",,"10.1145/3534678.3539253",,"cs.IR","http://creativecommons.org/licenses/by/4.0/","  Collaborative filtering (CF) plays a critical role in the development of
recommender systems. Most CF methods utilize an encoder to embed users and
items into the same representation space, and the Bayesian personalized ranking
(BPR) loss is usually adopted as the objective function to learn informative
encoders. Existing studies mainly focus on designing more powerful encoders
(e.g., graph neural network) to learn better representations. However, few
efforts have been devoted to investigating the desired properties of
representations in CF, which is important to understand the rationale of
existing CF methods and design new learning objectives. In this paper, we
measure the representation quality in CF from the perspective of alignment and
uniformity on the hypersphere. We first theoretically reveal the connection
between the BPR loss and these two properties. Then, we empirically analyze the
learning dynamics of typical CF methods in terms of quantified alignment and
uniformity, which shows that better alignment or uniformity both contribute to
higher recommendation performance. Based on the analyses results, a learning
objective that directly optimizes these two properties is proposed, named
DirectAU. We conduct extensive experiments on three public datasets, and the
proposed learning framework with a simple matrix factorization model leads to
significant performance improvements compared to state-of-the-art CF methods.
Our implementations are publicly available at
https://github.com/THUwangcy/DirectAU.
","[{""version"":""v1"",""created"":""Sun, 26 Jun 2022 07:32:53 GMT""}]","2022-06-28"
"2206.12812","Csilla Bujt\'as","Csilla Bujt\'as, Pakanun Dokyeesun","Fast winning strategies for Staller in the Maker-Breaker domination game","25 pages",,,,"math.CO","http://creativecommons.org/licenses/by/4.0/","  The Maker-Breaker domination game is played on a graph $G$ by two players,
called Dominator and Staller, who alternately choose a vertex that has not been
played so far. Dominator wins the game if his moves form a dominating set.
Staller wins if she plays all vertices from a closed neighborhood of a vertex
$v \in V(G)$. Dominator's fast winning strategies were studied earlier. In this
work, we concentrate on the cases when Staller has a winning strategy in the
game. We introduce the invariant $\gamma'_{\rm SMB}(G)$ (resp., $\gamma_{\rm
SMB}(G)$) which is the smallest integer $k$ such that, under any strategy of
Dominator, Staller can win the game by playing at most $k$ vertices, if Staller
(resp., Dominator) plays first on the graph $G$.
  We prove some basic properties of $\gamma_{\rm SMB}(G)$ and $\gamma'_{\rm
SMB}(G)$ and study the parameters' changes under some operators as taking the
disjoint union of graphs or deleting a cut vertex. We show that the inequality
$\delta(G)+1 \le \gamma'_{\rm SMB}(G) \le \gamma_{\rm SMB}(G)$ always holds and
that for every three integers $r,s,t$ with $2\le r\le s\le t$, there exists a
graph $G$ such that $\delta(G)+1 = r$, $\gamma'_{\rm SMB}(G) = s$, and
$\gamma_{\rm SMB}(G) = t$. We prove exact formulas for $\gamma'_{\rm SMB}(G)$
where $G$ is a path, or it is a tadpole graph which is obtained from the
disjoint union of a cycle and a path by adding one edge between them.
","[{""version"":""v1"",""created"":""Sun, 26 Jun 2022 07:48:08 GMT""}]","2022-06-28"
"2206.12813","Markus Sch\""oller","S. Hubrig, S.P. Jarvinen, I. Ilyin, M. Sch\""oller","The magnetic field of the stripped primary in the upsilon Sgr system, a
  member of the rare class of hydrogen-deficient binaries","7 pages, 2 tables, 2 figures, accepted for publication in ApJ",,"10.3847/1538-4357/ac7046",,"astro-ph.SR astro-ph.HE","http://arxiv.org/licenses/nonexclusive-distrib/1.0/","  We present the results of high-resolution spectropolarimetric observations of
the optically dominant component in the rare hydrogen-deficient binary system
upsilon Sgr. Only a small number of such systems in a very late phase of helium
shell burning are currently known. The mass transfer from the donor star in
binary systems usually leads to the stripping of its hydrogen envelope.
Consequently, since the mass of the secondary increases, it appears
rejuvenated. Using a few ESO FORS1 low-resolution spectropolarimetric
observations of this system, Hubrig et al. announced in 2009 the presence of a
magnetic field of the order of -70 - -80G. Here we report on more recent
high-resolution ESO HARPS spectropolarimetric observations showing that the
primary in upsilon Sgr is a spectrum variable star and possesses a weak
magnetic field of the order of a few tens of Gauss. The detection of a magnetic
field in this rare hydrogen-deficient binary is of particular interest, as such
systems are frequently discussed as probable progenitors of core-collapse
supernovae and gravitational-wave sources. Future magnetic studies of such
systems will be worthwhile to gain deeper insights into the role of magnetic
fields in the evolution of massive stars in binary systems.
","[{""version"":""v1"",""created"":""Sun, 26 Jun 2022 07:48:52 GMT""}]","2022-07-06"
"2206.12814","Mihaela Vajiac","Daniel Alpay, Izchak Lewkowicz, and Mihaela Vajiac","Discrete Wiener Algebra in the Bicomplex Setting, Spectral Factorization
  with Symmetry, and Superoscillations",,,,,"math.CV math-ph math.FA math.MP","http://creativecommons.org/licenses/by-nc-nd/4.0/","  In this paper we present parallel theories on constructing Wiener algebras in
the bicomplex setting. With the appropriate symmetry condition, the bicomplex
matrix valued case can be seen as a complex valued case and, in this matrix
valued case, we make the necessary connection between classical bicomplex
analysis and complex analysis with symmetry. We also write an application to
superoscillations in this case.
","[{""version"":""v1"",""created"":""Sun, 26 Jun 2022 07:49:09 GMT""}]","2022-06-28"
"2206.12815","Rizwan Ahmed Khan PhD","Unaiza Sajid, Rizwan Ahmed Khan, Shahid Munir Shah, Sheeraz Arif","Breast Cancer Classification using Deep Learned Features Boosted with
  Handcrafted Features",,,,,"eess.IV cs.CV cs.LG","http://arxiv.org/licenses/nonexclusive-distrib/1.0/","  Breast cancer is one of the leading causes of death among women across the
globe. It is difficult to treat if detected at advanced stages, however, early
detection can significantly increase chances of survival and improves lives of
millions of women. Given the widespread prevalence of breast cancer, it is of
utmost importance for the research community to come up with the framework for
early detection, classification and diagnosis. Artificial intelligence research
community in coordination with medical practitioners are developing such
frameworks to automate the task of detection. With the surge in research
activities coupled with availability of large datasets and enhanced
computational powers, it expected that AI framework results will help even more
clinicians in making correct predictions. In this article, a novel framework
for classification of breast cancer using mammograms is proposed. The proposed
framework combines robust features extracted from novel Convolutional Neural
Network (CNN) features with handcrafted features including HOG (Histogram of
Oriented Gradients) and LBP (Local Binary Pattern). The obtained results on
CBIS-DDSM dataset exceed state of the art.
","[{""version"":""v1"",""created"":""Sun, 26 Jun 2022 07:54:09 GMT""},{""version"":""v2"",""created"":""Mon, 16 Jan 2023 09:51:51 GMT""}]","2023-01-18"
"2206.12816","Lei Feng","Lei Feng","Cosmic ray-driven bioenergetics for Life in Molecular Clouds and the
  Origin of Chemiosmosis","7 pages, 1 figure",,,,"astro-ph.EP physics.pop-ph","http://arxiv.org/licenses/nonexclusive-distrib/1.0/","  Some models such as the Nebula-Relay hypothesis, predict that the ancestors
of Earth's life once lived in molecular clouds. Where does the energy come from
for creatures in molecular clouds? In this draft, we proposed a new
bioenergetic mechanism that is driven by the cosmic ray ionization of hydrogen
molecules. Protons are naturally produced in this scenario, which may be the
origin of chemiosmosis. Based on this bioenergetics mechanism, we speculate
that LUCA is one type of biological hydrogen microbe.
","[{""version"":""v1"",""created"":""Sun, 26 Jun 2022 08:09:30 GMT""},{""version"":""v2"",""created"":""Mon, 21 Nov 2022 05:23:32 GMT""}]","2022-11-22"
"2206.12817","Tommaso Marchetti","Tommaso Marchetti, Christian I. Johnson, Meridith Joyce, R. Michael
  Rich, Iulia Simion, Michael D. Young, William I. Clarkson, Catherine A.
  Pilachowski, Scott Michael, Andrea Kunder, Andreas J. Koch-Hansen","Blanco DECam Bulge Survey (BDBS) V. Cleaning the foreground populations
  from Galactic bulge colour-magnitude diagrams using Gaia EDR3","21 pages, 22 figures, accepted for publication in A&A","A&A 664, A124 (2022)","10.1051/0004-6361/202243921",,"astro-ph.GA","http://arxiv.org/licenses/nonexclusive-distrib/1.0/","  The Blanco DECam Bulge Survey (BDBS) has imaged more than 200 square degrees
of the southern Galactic bulge, providing photometry in the ugrizy filters for
$\sim 250$ million unique stars. The presence of a strong foreground disk
population, along with complex reddening and extreme image crowding, has made
it difficult to constrain the presence of young and intermediate age stars in
the bulge population. We employed an accurate cross-match of BDBS with the
latest data release (EDR3) from the Gaia mission, matching more than 140
million sources with BDBS photometry and Gaia EDR3 photometry and astrometry.
We relied on Gaia EDR3 astrometry, without any photometric selection, to
produce clean BDBS bulge colour-magnitude diagrams (CMDs). Gaia parallaxes were
used to filter out bright foreground sources, and a Gaussian mixture model fit
to Galactic proper motions could identify stars kinematically consistent with
bulge membership. We applied this method to 127 different bulge fields of $1$
deg$^2$ each, with $|\ell| \leq 9.5^\circ$ and $-9.5^\circ \leq b \leq
-2.5^\circ$. The astrometric cleaning procedure removes the majority of blue
stars in each field, especially near the Galactic plane, where the ratio of
blue to red stars is $\lesssim 10\%$, increasing to values $\sim 20\%$ at
higher Galactic latitudes. We rule out the presence of a widespread population
of stars younger than 2 Gyr. The vast majority of blue stars brighter than the
turnoff belong to the foreground population, according to their measured
astrometry. We introduce the distance between the observed red giant branch
bump and the red clump as a simple age proxy for the dominant population in the
field, and we confirm the picture of a predominantly old bulge. Further work is
needed to apply the method to estimate ages to fields at higher latitudes, and
to model the complex morphology of the Galactic bulge.
","[{""version"":""v1"",""created"":""Sun, 26 Jun 2022 08:27:32 GMT""}]","2022-08-17"
"2206.12818","Takato Tokuno","Takato Tokuno, Masao Takata","Asteroseismology of the dip structure in period-spacings of rapidly
  rotating gamma Doradus stars caused by the coupling between core and envelope
  oscillations","20 pages, 15 figures, Accepted to MNRAS",,"10.1093/mnras/stac1492",,"astro-ph.SR","http://arxiv.org/licenses/nonexclusive-distrib/1.0/","  Recent asteroseismic observations by the $\it Kepler$ space mission have
revealed the dip fine structure in the period-spacing versus period diagram of
rapidly rotating $\gamma$ Doradus stars. Following the successful reproduction
of the dip structure by numerical calculations in previous studies, we present
in this paper the physical mechanism of how the dip is formed as a result of
the interaction between the gravito-inertial waves in the radiative envelope
and the pure inertial waves in the convective core. We analytically describe
the wave solutions in both of the radiative envelope and the convective core,
and match them at the interface to construct an eigenmode. We have found from
the analysis the following points: the dip structure is mainly controlled by a
parameter that has an inverse correlation with Brunt-V\""ais\""al\""a frequency at
the interface; the depth and the width of the dip is shallower and larger,
respectively, as the parameter gets large; the shape of the dip can be
approximated by the Lorentzian function; the period at the central position of
the dip is equal to or slightly smaller than that of the involved pure inertial
mode in the convective core. We have also understood based on the evolutionary
models of main-sequence stars that the parameter is inversely correlated with
the chemical composition gradient at the convective-core boundary. The dip
structure thus would provide information about the poorly-understood physical
processes, such as diffusion, convective overshooting and rotational mixing,
around the boundary between the convective core and the radiative envelope.
","[{""version"":""v1"",""created"":""Sun, 26 Jun 2022 08:28:19 GMT""}]","2022-06-28"
"2206.12819","Oleg Gutik","Oleg Gutik and Inna Pozdniakova","On the group of automorphisms of the semigroup
  $\boldsymbol{B}_{\mathbb{Z}}^{\mathscr{F}}$ with the family $\mathscr{F}$ of
  inductive nonempty subsets of $\omega$","13 pages. 1 figure",,,,"math.GR","http://arxiv.org/licenses/nonexclusive-distrib/1.0/","  We study automorphisms of the semigroup
$\boldsymbol{B}_{Z\mathbb{}}^{\mathscr{F}}$ with the family $\mathscr{F}$ of
inductive nonempty subsets of $\omega$ and prove that the group
$\mathbf{Aut}(\boldsymbol{B}_{\mathbb{Z}}^{\mathscr{F}})$ of automorphisms of
the semigroup $\boldsymbol{B}_{Z\mathbb{}}^{\mathscr{F}}$ is isomorphic to the
additive group integers.
","[{""version"":""v1"",""created"":""Sun, 26 Jun 2022 08:34:29 GMT""},{""version"":""v2"",""created"":""Tue, 2 Aug 2022 09:12:28 GMT""},{""version"":""v3"",""created"":""Sun, 4 Dec 2022 12:14:05 GMT""}]","2022-12-06"
"2206.12820","Shijie Ma","Shi-Jie Ma, Tian-Chi Ma, Jian-Bo Deng, Xian-Ru Hu","Black hole shadow, photon ring and lensing ring in the cold dark matter
  halo","21pages. arXiv admin note: text overlap with arXiv:2105.15073 by
  other authors",,,,"gr-qc","http://arxiv.org/licenses/nonexclusive-distrib/1.0/","  The Schwarzschild black hole in the cold dark matter (CDM) halo is deeply
studied, and the radiation laws of the thin accretion disk near the black hole
is discussed and summarized. The light orbits around the black hole are
calculated. According to the number of times that the light from the north pole
passes through the equatorial plane of the black hole, the light orbits can be
divided into three categories. At the same time, the innermost stable circular
orbit of the black hole is also calculated. By analyzing the calculation
results of radiation intensity of three kinds of radiation which emitted by
thin accretion disk on the equatorial plane of black hole and observed at
infinity away from the north pole of black hole, the radiation laws of the thin
accretion disk of Schwarzschild black hole suitable for the background of the
CDM halo is obtained.
","[{""version"":""v1"",""created"":""Sun, 26 Jun 2022 08:34:51 GMT""},{""version"":""v2"",""created"":""Thu, 30 Jun 2022 07:41:31 GMT""},{""version"":""v3"",""created"":""Thu, 8 Sep 2022 03:27:24 GMT""},{""version"":""v4"",""created"":""Thu, 15 Sep 2022 06:49:10 GMT""},{""version"":""v5"",""created"":""Mon, 19 Sep 2022 04:00:46 GMT""}]","2022-09-20"
"2206.12821","Alejandra L\'opez-P\'erez","J. \'Alvarez-Li\'ebana, A. L\'opez-P\'erez, W. Gonz\'alez-Manteiga and
  M. Febrero-Bande","A goodness-of-fit test for functional time series with applications to
  Ornstein-Uhlenbeck processes",,,,,"stat.ME","http://creativecommons.org/licenses/by-nc-nd/4.0/","  High-frequency financial data can be collected as a sequence of curves over
time; for example, as intra-day price, currently one of the topics of greatest
interest in finance. The Functional Data Analysis framework provides a suitable
tool to extract the information contained in the shape of the daily paths,
often unavailable from classical statistical methods. In this paper, a novel
goodness-of-fit test for autoregressive Hilbertian (ARH) models, with unknown
and general order, is proposed. The test imposes just the Hilbert-Schmidt
assumption on the functional form of the autocorrelation operator, and the test
statistic is formulated in terms of a Cram\'er-von Mises norm. A wild bootstrap
resampling procedure is used for calibration, such that the finite sample
behavior of the test, regarding power and size, is checked via a simulation
study. Furthermore, we also provide a new specification test for diffusion
models, such as Ornstein-Uhlenbeck processes, illustrated with an application
to intra-day currency exchange rates. In particular, a two-stage methodology is
proffered: firstly, we check if functional samples and their past values are
related via ARH(1) model; secondly, under linearity, we perform a functional
F-test.
","[{""version"":""v1"",""created"":""Sun, 26 Jun 2022 08:42:26 GMT""}]","2022-06-28"
"2206.12822","Haoran Yin","Haoran Yin, Xizhang Wei, Yanqun Tang and Kai Yang","Design and Performance Analysis of AFDM with Multiple Antennas in Doubly
  Selective Channels",,,,,"cs.IT eess.SP math.IT","http://arxiv.org/licenses/nonexclusive-distrib/1.0/","  On the heels of orthogonal time frequency space (OTFS) modulation, the
recently discovered affine frequency division multiplexing (AFDM) is a
promising waveform for the sixth-generation wireless network. In this paper, we
introduce the multiple-input multiple-output AFDM (MIMO-AFDM) system, which
combines the superiorities of high multiplexing and diversity gain from MIMO
and strong delay-Doppler spread resilience from AFDM. In the case of ideal
channel state information (CSI), we first fomulate the vectorized input-output
relationship, and then prove that the MIMO-AFDM system can achieve full
diversity in doubly slective channels. Consequently, MIMO-AFDM has the bit
error ratio (BER) performance identical to MIMO-OTFS while outperforming
MIMO-OFDM significantly. Moreover, for the case of imperfect CSI, we propose a
low-complexity embedded pilot-aided diagonal reconstruction (EPA-DR) channel
estimation scheme. Simulation results show that MIMO-AFDM with estimated CSI
establishes the BER performance similar to that with ideal CSI. Finally, we
investigate the orthogonal resource allocation of affine frequency division
multiple access (AFDMA) system, which shows great potential for multiple access
in high mobility scenarios thanks to its high efficiency and flexibility.
","[{""version"":""v1"",""created"":""Sun, 26 Jun 2022 08:53:15 GMT""},{""version"":""v2"",""created"":""Sat, 24 Sep 2022 02:32:01 GMT""},{""version"":""v3"",""created"":""Tue, 27 Sep 2022 06:50:18 GMT""},{""version"":""v4"",""created"":""Wed, 23 Nov 2022 11:40:46 GMT""},{""version"":""v5"",""created"":""Mon, 5 Dec 2022 06:55:42 GMT""}]","2022-12-06"
"2206.12823","Carlo A. Trugenberger","Carlo A. Trugenberger","Oblique confinement states are superinsulators, not topological
  insulators",,,,,"cond-mat.supr-con cond-mat.str-el","http://arxiv.org/licenses/nonexclusive-distrib/1.0/","  We show that the oblique confinement states in the Cardy-Rabinovici model are
superinsulators, not topological insulators. This is because their only bulk
excitations are strings that completely prevent the separation of
charge-anticharge pairs, causing a strictly infinite resistance (below a
critical temperature and/or voltage). This is very different from the typical
activated behaviour of topological insulators, caused by a finite bulk energy
gap.
","[{""version"":""v1"",""created"":""Sun, 26 Jun 2022 08:55:31 GMT""}]","2022-06-28"
"2206.12824","Markus Sch\""oller","N.V. Kharchenko, A.E. Piskunov, S. Hubrig, M. Sch\""oller","The evolutionary state of the chemically peculiar members of the open
  cluster NGC2516","12 pages, 4 tables, 5 figures, accepted for publication in MNRAS",,"10.1093/mnras/stac1769",,"astro-ph.SR astro-ph.GA","http://arxiv.org/licenses/nonexclusive-distrib/1.0/","  We aim at establishing safe membership and evolutionary status of 11
chemically peculiar (CP) stars that are residing in the domain of the open
cluster NGC2516 and are frequently referred to as cluster members. We queried
the Gaia EDR3 catalogue in an area with a radius of 1deg and selected 37508
stars brighter than G=19mag. The cluster membership was determined in
parallax-proper motion-space and 719 probable and 764 possible members were
found. The obtained average astrometric and photometric parameters of the
cluster are in good agreement with the most recent literature data. The
evolutionary status of the target stars was determined with respect to Padova
isochrones. After minor adjustments including the metallicity, the reddening,
and the transformation scale variation, a perfect fit of the model to the
observations over the whole observed magnitude range was achieved. Only 5 of
the 11 considered CP stars could be classified as highly probable cluster
members. Among the Ap/Bp stars with previously detected magnetic fields HD65987
and HD65712 have a high membership probability and the magnetic star CPD-60
944B is a possible cluster member. Further we discuss the blue straggler nature
of HD66194 and the magnetic star HD65987. To our knowledge, HD65987 is
currently the only known blue straggler, with a field of the order of a few
hundred Gauss. The most striking result of our study is that the strongly
magnetic A0p star HD66318 with previously reported very low fractional age does
not belong to the NGC2516 cluster at a high level of confidence.
","[{""version"":""v1"",""created"":""Sun, 26 Jun 2022 08:59:52 GMT""}]","2022-07-06"
"2206.12825","Hendrik Molter","Danny Hermelin and Yuval Itzhaki and Hendrik Molter and Dvir Shabtay","Hardness of Interval Scheduling on Unrelated Machines",,,,,"cs.CC cs.DM cs.DS","http://arxiv.org/licenses/nonexclusive-distrib/1.0/","  We provide new (parameterized) computational hardness results for Interval
Scheduling on Unrelated Machines. It is a classical scheduling problem
motivated from just-in-time or lean manufacturing, where the goal is to
complete jobs exactly at their deadline. We are given $n$ jobs and $m$
machines. Each job has a deadline, a weight, and a processing time that may be
different on each machine. The goal is find a schedule that maximized the total
weight of jobs completed exactly at their deadline. Note that this uniquely
defines a processing time interval for each job on each machine.
  Interval Scheduling on Unrelated Machines is closely related to coloring
interval graphs and has been thoroughly studied for several decades. However,
as pointed out by Mnich and van Bevern [Computers \& Operations Research,
2018], the parameterized complexity for the number $m$ of machines as a
parameter remained open. We resolve this by showing that Interval Scheduling on
Unrelated Machines is W[1]-hard when parameterized by the number $m$ of
machines. To this end, we prove W[1]-hardness with respect to $m$ of the
special case where we have parallel machines with eligible machine sets for
jobs. This answers Open Problem 8 of Mnich and van Bevern's list of 15 open
problems in the parameterized complexity of scheduling [Computers \& Operations
Research, 2018].
  Furthermore, we resolve the computational complexity status of the unweighted
version of Interval Scheduling on Unrelated Machines by proving that it is
NP-complete. This answers an open question by Sung and Vlach [Journal of
Scheduling, 2005].
","[{""version"":""v1"",""created"":""Sun, 26 Jun 2022 09:03:48 GMT""}]","2022-06-28"
"2206.12826","Bai-Song Xie","Cui-Wen Zhang, Yi-Xuan Zhu, Jian-Feng Lv and Bai-Song Xie","Simulation study of a bright attosecond $\gamma$-ray source generation
  by irradiating an intense laser on a cone target","14 pages, 6 figures","Appl. Sci. 12, 4361 (2022)","10.3390/app12094361",,"physics.plasm-ph physics.app-ph","http://creativecommons.org/licenses/by/4.0/","  The interaction between an ultrastrong laser and a cone-like target is an
efficient approach to generate high power radiations like attosecond pulses and
terahertz waves. The object is to study the $\gamma$-ray generation under this
configuration with the help of 2D particle-in-cell simulations. It is
deciphered that electrons experience three stages including injection,
acceleration and scattering to emit high energy photons via nonlinear compton
scattering (NCS). These spatial-separated attosecond $\gamma$-ray pulses own
high peak brilliance ($>10^{22}$ photons/($\rm s\cdot\rm mm^2\cdot\rm
mrad^2\cdot0.1\%BW$)) and high energy (6MeV) under the case of normalized laser
intensity $a_0=30$ ($\mathrm{I=2\times10^{21}W/cm^2}$). Besides, the cone
target turns out to be an order of magnitude more efficient in energy transfer
compared with a planar one.
","[{""version"":""v1"",""created"":""Sun, 26 Jun 2022 09:07:08 GMT""}]","2022-06-28"
