"2206.12744","Mikhail Zubkov Dr","S.Bondarenko, M.A.Zubkov","Riemann-Cartan gravity with dynamical signature","Latex, 7 pages","Jetp Lett. (2022)","10.1134/S0021364022601002",,"gr-qc hep-th","http://arxiv.org/licenses/nonexclusive-distrib/1.0/","  Model of Riemann-Cartan gravity with varying signature of metric is
considered. The basic dynamical variables of the formalism are vierbein, spin
connection, and an internal metric in the tangent space. The corresponding
action contains new terms, which depend on these fields. In general case the
signature of the metric is determined dynamically. The Minkowski signature is
preferred dynamically because the configurations with the other signatures are
dynamically suppressed. We also discuss briefly the motion of particles in the
background of the modified black hole configuration, in which inside the
horizon the signature is that of Euclidean space - time.
","[{""version"":""v1"",""created"":""Sat, 25 Jun 2022 22:28:18 GMT""}]","2022-06-28"
"2206.12745","Jan Glaubitz","Yao Xiao and Jan Glaubitz","Sequential image recovery using joint hierarchical Bayesian learning","24 pages, 15 figures","J Sci Comput 96, 4 (2023)","10.1007/s10915-023-02234-1",,"cs.CV cs.NA math.NA","http://arxiv.org/licenses/nonexclusive-distrib/1.0/","  Recovering temporal image sequences (videos) based on indirect, noisy, or
incomplete data is an essential yet challenging task. We specifically consider
the case where each data set is missing vital information, which prevents the
accurate recovery of the individual images. Although some recent (variational)
methods have demonstrated high-resolution image recovery based on jointly
recovering sequential images, there remain robustness issues due to parameter
tuning and restrictions on the type of the sequential images. Here, we present
a method based on hierarchical Bayesian learning for the joint recovery of
sequential images that incorporates prior intra- and inter-image information.
Our method restores the missing information in each image by ""borrowing"" it
from the other images. As a result, \emph{all} of the individual
reconstructions yield improved accuracy. Our method can be used for various
data acquisitions and allows for uncertainty quantification. Some preliminary
results indicate its potential use for sequential deblurring and magnetic
resonance imaging.
","[{""version"":""v1"",""created"":""Sat, 25 Jun 2022 22:31:32 GMT""},{""version"":""v2"",""created"":""Fri, 19 May 2023 15:04:48 GMT""}]","2023-05-22"
"2206.12746","Marcel Barros","Caio F. D. Netto, Marcel R. de Barros, Jefferson F. Coelho, Lucas P.
  de Freitas, Felipe M. Moreno, Marlon S. Mathias, Marcelo Dottori, F\'abio G.
  Cozman, Anna H. R. Costa, Edson S. Gomi, Eduardo A. Tannuri","Modeling Oceanic Variables with Dynamic Graph Neural Networks","8 pages",,,,"cs.LG cs.AI","http://creativecommons.org/licenses/by/4.0/","  Researchers typically resort to numerical methods to understand and predict
ocean dynamics, a key task in mastering environmental phenomena. Such methods
may not be suitable in scenarios where the topographic map is complex,
knowledge about the underlying processes is incomplete, or the application is
time critical. On the other hand, if ocean dynamics are observed, they can be
exploited by recent machine learning methods. In this paper we describe a
data-driven method to predict environmental variables such as current velocity
and sea surface height in the region of Santos-Sao Vicente-Bertioga Estuarine
System in the southeastern coast of Brazil. Our model exploits both temporal
and spatial inductive biases by joining state-of-the-art sequence models (LSTM
and Transformers) and relational models (Graph Neural Networks) in an
end-to-end framework that learns both the temporal features and the spatial
relationship shared among observation sites. We compare our results with the
Santos Operational Forecasting System (SOFS). Experiments show that better
results are attained by our model, while maintaining flexibility and little
domain knowledge dependency.
","[{""version"":""v1"",""created"":""Sat, 25 Jun 2022 22:43:02 GMT""}]","2022-06-28"
"2206.12747","Khaled Mohammed Saifuddin","Khaled Mohammed Saifuddin, Briana Bumgardner, Farhan Tanvir, Esra
  Akbas","HyGNN: Drug-Drug Interaction Prediction via Hypergraph Neural Network","Some new experiments have been added. One more dataset has been
  considered. Theoretical part has been updated too",,,,"q-bio.QM cs.AI cs.LG","http://creativecommons.org/licenses/by/4.0/","  Drug-Drug Interactions (DDIs) may hamper the functionalities of drugs, and in
the worst scenario, they may lead to adverse drug reactions (ADRs). Predicting
all DDIs is a challenging and critical problem. Most existing computational
models integrate drug-centric information from different sources and leverage
them as features in machine learning classifiers to predict DDIs. However,
these models have a high chance of failure, especially for the new drugs when
all the information is not available. This paper proposes a novel Hypergraph
Neural Network (HyGNN) model based on only the SMILES string of drugs,
available for any drug, for the DDI prediction problem. To capture the drug
similarities, we create a hypergraph from drugs' chemical substructures
extracted from the SMILES strings. Then, we develop HyGNN consisting of a novel
attention-based hypergraph edge encoder to get the representation of drugs as
hyperedges and a decoder to predict the interactions between drug pairs.
Furthermore, we conduct extensive experiments to evaluate our model and compare
it with several state-of-the-art methods. Experimental results demonstrate that
our proposed HyGNN model effectively predicts DDIs and impressively outperforms
the baselines with a maximum ROC-AUC and PR-AUC of 97.9% and 98.1%,
respectively.
","[{""version"":""v1"",""created"":""Sat, 25 Jun 2022 22:48:27 GMT""},{""version"":""v2"",""created"":""Thu, 14 Jul 2022 06:31:25 GMT""},{""version"":""v3"",""created"":""Fri, 15 Jul 2022 10:14:45 GMT""},{""version"":""v4"",""created"":""Tue, 18 Apr 2023 09:57:00 GMT""}]","2023-04-19"
"2206.12748","Andr\'es Dolinko","Andres E. Dolinko, Yasmil Costales, Cecilia Carmar\'an and Esteban
  Ceriani-Nakamurakare","A novel set of algorithms to recognize galleries of ambrosia beetle in
  computerized axial tomography of trees trunks","14 pages, 10 figures",,,,"physics.bio-ph physics.ins-det","http://creativecommons.org/publicdomain/zero/1.0/","  Megaplatypus mutatus is an ambrosia beetle that attacks several species of
trees by making galleries in the trunks where its larvae and associated fungi
develop. This damage spoils the wood for commercial use and cause stem breakage
in front of strong winds. Due to the insect's cryptic lifestyle, gallery
analyses have usually been studied by destructive methods. However, they alter
the homeostasis of the insect-fungi interaction, modifies the topology of the
gallery and, more importantly, does not reveal the 100% complex structure made
by the insect. Therefore, a novel way to study this structure is by imaging the
galleries by means of computerized axial tomography (CT). This method allows
obtaining a three-dimensional representation of the gallery and the pupal
chambers to be studied, while the wood and insect sample is not disturbed and
generates a high amount of data. The isolation of the galleries and pupal
chambers from the CT background images is not simple, because there is not
enough contrast between the grey levels of the galleries and the marks
generated by internal components of the trunk itself. In this paper, we present
a robust algorithm that allows automating the isolation of the galleries and
pupal chambers from CT trunk images which can be used in a broad spectrum of
image analysis.
","[{""version"":""v1"",""created"":""Sat, 25 Jun 2022 22:51:04 GMT""}]","2022-06-28"
"2206.12749","Rodrigo de Lamare","Tao Yu, Rodrigo C. de Lamare and Yi Yu","Design and Analysis of Robust Resilient Diffusion over Multi-Task
  Networks Against Byzantine Attacks","16 pages, 22 figures",,,,"cs.LG cs.CR","http://arxiv.org/licenses/nonexclusive-distrib/1.0/","  This paper studies distributed diffusion adaptation over clustered multi-task
networks in the presence of impulsive interferences and Byzantine attacks. We
develop a robust resilient diffusion least mean Geman-McClure-estimation
(RDLMG) algorithm based on the cost function used by the Geman-McClure
estimator, which can reduce the sensitivity to large outliers and make the
algorithm robust under impulsive interferences. Moreover, the mean sub-sequence
reduced method, in which each node discards the extreme value information of
cost contributions received from its neighbors, can make the network resilient
against Byzantine attacks. In this regard, the proposed RDLMG algorithm ensures
that all normal nodes converge to their ideal states with cooperation among
nodes. A statistical analysis of the RDLMG algorithm is also carried out in
terms of mean and mean-square performances. Numerical results evaluate the
proposed RDLMG algorithm in applications to multi-target localization and
multi-task spectrum sensing.
","[{""version"":""v1"",""created"":""Sat, 25 Jun 2022 22:58:51 GMT""}]","2022-06-28"
"2206.12750","Xuesong Bai","Xuesong Bai, Elena Cherkaev, Dong Wang","A two-stage method for reconstruction of parameters in diffusion
  equations",,,,,"math.NA cs.NA math.OC","http://creativecommons.org/licenses/by/4.0/","  Parameter reconstruction for diffusion equations has a wide range of
applications. In this paper, we proposed a two-stage scheme to efficiently
solve conductivity reconstruction problems for steady-state diffusion equations
with solution data measured inside the domain. The first stage is based on
total variation regularization of the log diffusivity and the split Bregman
iteration method. In the second stage, we apply the K-means clustering for the
reconstruction of ``blocky'' conductivity functions. The convergence of the
scheme is theoretically proved and extensive numerical examples are shown to
demonstrate the performance of the scheme.
","[{""version"":""v1"",""created"":""Sat, 25 Jun 2022 23:01:02 GMT""}]","2022-06-28"
"2206.12751","Diomadson Belfort","Mariana Villarim, Jo\~ao Marcos Costa and Diomadson Belfort","Implementation of SquashFS Support in U-Boot",,,,,"cs.OS","http://creativecommons.org/licenses/by-nc-nd/4.0/","  U-Boot is a notorious bootloader and Open Source project. This work had as
objective adding support for the SquashFS filesystem to U-Boot and the support
developed was submitted as a contribution to the project. The bootloader is
responsible, in this context, for loading the kernel and the device tree blob
into RAM. It needs to be capable of reading a storage device's partition
formatted with a specific filesystem type. Adding this support allows U-Boot to
read from SquashFS partitions. The source code was submitted to U-Boot's
mailing list through a series of patches to be reviewed by one of the project's
maintainer. Once it gets merged, the support will be used and modified by
U-Boot's international community.
","[{""version"":""v1"",""created"":""Sat, 25 Jun 2022 23:56:45 GMT""}]","2022-06-28"
"2206.12752","Craig Cowan T","Craig Cowan and Abbas Moameni","On supercritical elliptic problems: existence, multiplicity of positive
  and symmetry breaking solutions",,,,,"math.AP","http://arxiv.org/licenses/nonexclusive-distrib/1.0/","  The main thrust of our current work is to exploit very specific
characteristics of a given problem in order to acquire improved compactness for
supercritical problems and to prove existence of new types of solutions. To
this end, we shall develop a variational machinery in order to construct a new
type of classical solutions for a large class of supercritical elliptic partial
differential equations.\\ The issue of symmetry and symmetry breaking is
challenging and fundamental in mathematics and physics. Symmetry breaking is
the source of many interesting phenomena namely phase transitions,
instabilities, segregation, etc.
  As a consequence of our results we shall establish the existence of several
symmetry breaking solutions when the underlying problem is fully symmetric. Our
methodology is variational, and we are not seeking non symmetric solutions
which bifurcate from the symmetric one. Instead, we construct many new positive
solutions by developing a minimax principle for general semilinear elliptic
problems restricted to a given convex subset instead of the whole space. As a
byproduct of our investigation, several new Sobolev embeddings are established
for functions having a mild monotonicity on symmetric monotonic domains.
","[{""version"":""v1"",""created"":""Sun, 26 Jun 2022 00:07:28 GMT""}]","2022-06-28"
"2206.12753","Arun Sharma","Arun Sharma, Zhe Jiang and Shashi Shekhar","Spatiotemporal Data Mining: A Survey",,,,,"cs.DB cs.CV cs.DC cs.LG","http://creativecommons.org/licenses/by/4.0/","  Spatiotemporal data mining aims to discover interesting, useful but
non-trivial patterns in big spatial and spatiotemporal data. They are used in
various application domains such as public safety, ecology, epidemiology, earth
science, etc. This problem is challenging because of the high societal cost of
spurious patterns and exorbitant computational cost. Recent surveys of
spatiotemporal data mining need update due to rapid growth. In addition, they
did not adequately survey parallel techniques for spatiotemporal data mining.
This paper provides a more up-to-date survey of spatiotemporal data mining
methods. Furthermore, it has a detailed survey of parallel formulations of
spatiotemporal data mining.
","[{""version"":""v1"",""created"":""Sun, 26 Jun 2022 00:08:06 GMT""}]","2022-06-28"
"2206.12754","Brian S. Y. Kim","Brian S. Y. Kim, Aaron J. Sternbach, Min Sup Choi, Zhiyuan Sun,
  Francesco L. Ruta, Yinming Shao, Alexander S. McLeod, Lin Xiong, Yinan Dong,
  Anjaly Rajendran, Song Liu, Ankur Nipane, Sang Hoon Chae, Amirali Zangiabadi,
  Xiaodong Xu, Andrew J. Millis, P. James Schuck, Cory. R. Dean, James C. Hone,
  D. N. Basov","Atomically imprinted graphene plasmonic cavities","17 pages, 4 figures",,,,"physics.optics cond-mat.mes-hall","http://creativecommons.org/licenses/by/4.0/","  Plasmon polaritons in van der Waals (vdW) materials hold promise for
next-generation photonics. The ability to deterministically imprint spatial
patterns of high carrier density in cavities and circuitry with nanoscale
features underlies future progress in nonlinear nanophotonics and strong
light-matter interactions. Here, we demonstrate a general strategy to
atomically imprint low-loss graphene plasmonic structures using
oxidation-activated charge transfer (OCT). We cover graphene with a monolayer
of WSe$_2$, which is subsequently oxidized into high work-function WOx to
activate charge transfer. Nano-infrared imaging reveals low-loss plasmon
polaritons at the WOx/graphene interface. We insert WSe$_2$ spacers to
precisely control the OCT-induced carrier density and achieve a near-intrinsic
quality factor of plasmons. Finally, we imprint canonical plasmonic cavities
exhibiting laterally abrupt doping profiles with single-digit nanoscale
precision via programmable OCT. Specifically, we demonstrate technologically
appealing but elusive plasmonic whispering-gallery resonators based on
free-standing graphene encapsulated in WOx. Our results open avenues for novel
quantum photonic architectures incorporating two-dimensional materials.
","[{""version"":""v1"",""created"":""Sun, 26 Jun 2022 00:12:14 GMT""}]","2022-06-28"
"2206.12755","Ajay Jaiswal","Ajay Jaiswal, Haoyu Ma, Tianlong Chen, Ying Ding, Zhangyang Wang","Training Your Sparse Neural Network Better with Any Mask","Accepted by ICML 2022",,,,"cs.CV","http://creativecommons.org/licenses/by-nc-sa/4.0/","  Pruning large neural networks to create high-quality, independently trainable
sparse masks, which can maintain similar performance to their dense
counterparts, is very desirable due to the reduced space and time complexity.
As research effort is focused on increasingly sophisticated pruning methods
that leads to sparse subnetworks trainable from the scratch, we argue for an
orthogonal, under-explored theme: improving training techniques for pruned
sub-networks, i.e. sparse training. Apart from the popular belief that only the
quality of sparse masks matters for sparse training, in this paper we
demonstrate an alternative opportunity: one can carefully customize the sparse
training techniques to deviate from the default dense network training
protocols, consisting of introducing ``ghost"" neurons and skip connections at
the early stage of training, and strategically modifying the initialization as
well as labels. Our new sparse training recipe is generally applicable to
improving training from scratch with various sparse masks. By adopting our
newly curated techniques, we demonstrate significant performance gains across
various popular datasets (CIFAR-10, CIFAR-100, TinyImageNet), architectures
(ResNet-18/32/104, Vgg16, MobileNet), and sparse mask options (lottery ticket,
SNIP/GRASP, SynFlow, or even randomly pruning), compared to the default
training protocols, especially at high sparsity levels. Code is at
https://github.com/VITA-Group/ToST
","[{""version"":""v1"",""created"":""Sun, 26 Jun 2022 00:37:33 GMT""},{""version"":""v2"",""created"":""Tue, 28 Jun 2022 01:41:17 GMT""}]","2022-06-29"
"2206.12756","Arun Sharma","Arun Sharma, Jayant Gupta and Subhankar Ghosh","Towards a Tighter Bound on Possible-Rendezvous Areas: Preliminary
  Results",,,,,"cs.DB cs.CG cs.DS","http://creativecommons.org/licenses/by/4.0/","  Given trajectories with gaps, we investigate methods to tighten spatial
bounds on areas (e.g., nodes in a spatial network) where possible rendezvous
activity could have occurred. The problem is important for reducing the onerous
amount of manual effort to post-process possible rendezvous areas using
satellite imagery and has many societal applications to improve public safety,
security, and health. The problem of rendezvous detection is challenging due to
the difficulty of interpreting missing data within a trajectory gap and the
very high cost of detecting gaps in such a large volume of location data. Most
recent literature presents formal models, namely space-time prism, to track an
object's rendezvous patterns within trajectory gaps on a spatial network.
However, the bounds derived from the space-time prism are rather loose,
resulting in unnecessarily extensive post-processing manual effort. To address
these limitations, we propose a Time Slicing-based Gap-Aware Rendezvous
Detection (TGARD) algorithm to tighten the spatial bounds in spatial networks.
We propose a Dual Convergence TGARD (DC-TGARD) algorithm to improve
computational efficiency using a bi-directional pruning approach. Theoretical
results show the proposed spatial bounds on the area of possible rendezvous are
tighter than that from related work (space-time prism). Experimental results on
synthetic and real-world spatial networks (e.g., road networks) show that the
proposed DC-TGARD is more scalable than the TGARD algorithm.
","[{""version"":""v1"",""created"":""Sun, 26 Jun 2022 00:59:07 GMT""}]","2022-06-28"
"2206.12757","Ebtsam Taha","Ebtsam H. Taha","Harmonic Finsler manifolds of $({\alpha}, \beta)$-type","8 pages, Comments are welcomed!","Balkan Journal of Geometry and Its Applications, Vol.27, No.2,
  2022, pp. 138-143",,,"math.DG","http://creativecommons.org/licenses/by-nc-nd/4.0/","  In this paper we construct a new class of harmonic and asymptotically
harmonic Finsler manifolds of $({\alpha},\beta)$-type. This class is defined by
a Riemannian metric ${\alpha}$ and a special 1-form $\beta$.
","[{""version"":""v1"",""created"":""Sun, 26 Jun 2022 01:08:42 GMT""}]","2022-06-28"
"2206.12758","Ryan McCulloch","William Cocke and Ryan McCulloch","Central Products and the Chermak-Delgado Lattice",,,,,"math.GR","http://creativecommons.org/licenses/by/4.0/","  The Chermak-Delgado lattice of a finite group is a modular, self-dual
sublattice of the lattice of subgroups. We prove that the Chermak-Delgado
lattice of a central product contains the product of the Chermak-Delgado
lattices of the relevant central factors. Furthermore, we obtain information
about heights of elements in the Chermak-Delgado lattice relative to their
heights in the Chermak-Delgado lattices of central factors. We also explore how
the central product can be used as a tool in investigating Chermak-Delgado
lattices.
","[{""version"":""v1"",""created"":""Sun, 26 Jun 2022 01:15:15 GMT""},{""version"":""v2"",""created"":""Mon, 15 Aug 2022 17:14:15 GMT""},{""version"":""v3"",""created"":""Tue, 27 Sep 2022 18:54:54 GMT""}]","2022-09-29"
"2206.12759","Qingcheng Zeng","Qingcheng Zeng, Dading Chong, Peilin Zhou, Jie Yang","Low-resource Accent Classification in Geographically-proximate Settings:
  A Forensic and Sociophonetics Perspective","INTERSPEECH 2022",,,,"cs.CL cs.SD eess.AS","http://arxiv.org/licenses/nonexclusive-distrib/1.0/","  Accented speech recognition and accent classification are relatively
under-explored research areas in speech technology. Recently, deep
learning-based methods and Transformer-based pretrained models have achieved
superb performances in both areas. However, most accent classification tasks
focused on classifying different kinds of English accents and little attention
was paid to geographically-proximate accent classification, especially under a
low-resource setting where forensic speech science tasks usually encounter. In
this paper, we explored three main accent modelling methods combined with two
different classifiers based on 105 speaker recordings retrieved from five urban
varieties in Northern England. Although speech representations generated from
pretrained models generally have better performances in downstream
classification, traditional methods like Mel Frequency Cepstral Coefficients
(MFCCs) and formant measurements are equipped with specific strengths. These
results suggest that in forensic phonetics scenario where data are relatively
scarce, a simple modelling method and classifier could be competitive with
state-of-the-art pretrained speech models as feature extractors, which could
enhance a sooner estimation for the accent information in practices. Besides,
our findings also cross-validated a new methodology in quantifying
sociophonetic changes.
","[{""version"":""v1"",""created"":""Sun, 26 Jun 2022 01:25:17 GMT""},{""version"":""v2"",""created"":""Wed, 29 Jun 2022 03:11:05 GMT""}]","2022-06-30"
"2206.12760","Jinniu Hu","Kaixuan Huang, Jinniu Hu, Ying Zhang, Hong Shen","The Hadron-Quark Crossover in Neutron Star within Gaussian Process
  Regression Method","18 pages, 4 figures, 6 tables, accepted by Astrophysical Journal",,"10.3847/1538-4357/ac7f3c",,"nucl-th","http://arxiv.org/licenses/nonexclusive-distrib/1.0/","  The equations of state of the neutron star at the hadron-quark crossover
region are interpolated with the Gaussian process regression (GPR) method,
which can reduce the randomness of present interpolation schemes. The
relativistic mean-field (RMF) model and Nambu-Jona-Lasinio (NJL) model are
employed to describe the hadronic phase and quark phase, respectively. In the
RMF model, the coupling term between $\omega$ and $\rho$ mesons is considered
to control the density-dependent behaviors of symmetry energy, i.e. the slope
of symmetry energy, $L$. Furthermore, the vector interaction between quarks is
included in the NJL model to obtain the additional repulsive contributions.
Their coupling strengths and the crossover windows are discussed in the present
framework under the constraints on the neutron star from gravitational wave
detections, massive neutron star measurements, mass-radius simultaneous
observation of NICER collaboration, and the neutron skin thickness of
$^{208}$Pb from PREX-II. It is found that the slope of symmetry energy, $L$
should be around $50-90$ MeV and the crossover window is $(0.3,~0.6)~\rm
fm^{-3}$ with these observables. Furthermore, the uncertainties of neutron star
masses and radii in the hadron-quark crossover regions are also predicted by
the GPR method.
","[{""version"":""v1"",""created"":""Sun, 26 Jun 2022 01:44:13 GMT""}]","2022-08-31"
