"2208.01713","Qihao Zhang","Qihao Zhang, Soumendra N. Lahiri and Daniel J. Nordman","On optimal block resampling for Gaussian-subordinated long-range
  dependent processes",,,,,"math.ST stat.ME stat.TH","http://arxiv.org/licenses/nonexclusive-distrib/1.0/","  Block-based resampling estimators have been intensively investigated for
weakly dependent time processes, which has helped to inform implementation
(e.g., best block sizes). However, little is known about resampling performance
and block sizes under strong or long-range dependence. To establish guideposts
in block selection, we consider a broad class of strongly dependent time
processes, formed by a transformation of a stationary long-memory Gaussian
series, and examine block-based resampling estimators for the variance of the
prototypical sample mean; extensions to general statistical functionals are
also considered. Unlike weak dependence, the properties of resampling
estimators under strong dependence are shown to depend intricately on the
nature of non-linearity in the time series (beyond Hermite ranks) in addition
the long-memory coefficient and block size. Additionally, the intuition has
often been that optimal block sizes should be larger under strong dependence
(say $O(n^{1/2})$ for a sample size $n$) than the optimal order $O(n^{1/3})$
known under weak dependence. This intuition turns out to be largely incorrect,
though a block order $O(n^{1/2})$ may be reasonable (and even optimal) in many
cases, owing to non-linearity in a long-memory time series. While optimal block
sizes are more complex under long-range dependence compared to short-range, we
provide a consistent data-driven rule for block selection, and numerical
studies illustrate that the guides for block selection perform well in other
block-based problems with long-memory time series, such as distribution
estimation and strategies for testing Hermite rank.
","[{""version"":""v1"",""created"":""Tue, 2 Aug 2022 19:52:02 GMT""}]","2022-08-04"
"2208.01714","Ian Van Buskirk","Ian Van Buskirk, Aaron Clauset, Daniel B. Larremore","An Open-Source Cultural Consensus Approach to Name-Based Gender
  Classification",,,,,"cs.SI","http://creativecommons.org/licenses/by-nc-sa/4.0/","  Name-based gender classification has enabled hundreds of otherwise infeasible
scientific studies of gender. Yet, the lack of standardization, proliferation
of ad hoc methods, reliance on paid services, understudied limitations, and
conceptual debates cast a shadow over many applications. To address these
problems we develop and evaluate an ensemble-based open-source method built on
publicly available data of empirical name-gender associations. Our method
integrates 36 distinct sources-spanning over 150 countries and more than a
century-via a meta-learning algorithm inspired by Cultural Consensus Theory
(CCT). We also construct a taxonomy with which names themselves can be
classified. We find that our method's performance is competitive with paid
services and that our method, and others, approach the upper limits of
performance; we show that conditioning estimates on additional metadata (e.g.
cultural context), further combining methods, or collecting additional
name-gender association data is unlikely to meaningfully improve performance.
This work definitively shows that name-based gender classification can be a
reliable part of scientific research and provides a pair of tools, a
classification method and a taxonomy of names, that realize this potential.
","[{""version"":""v1"",""created"":""Tue, 2 Aug 2022 19:55:32 GMT""}]","2022-08-04"
"2208.01715","Juan Marquez","Juan Manuel M\'arquez, Gabriel L\'opez Castro and Pablo Roig","Michel parameters in the presence of massive Dirac and Majorana
  neutrinos","37 pages, 6 figures. Matches published version, wording corrections
  were made and a realistic example was added, (see new Fig. 5)","JHEP 11 (2022) 117","10.1007/JHEP11(2022)117",,"hep-ph","http://arxiv.org/licenses/nonexclusive-distrib/1.0/","  We analyse the effects of Dirac and Majorana neutrinos on leptonic decays of
muon and tau leptons using the most general four-lepton effective interaction
Hamiltonian of dimension six. We calculate the specific energy and angular
distribution of the final charged lepton, including the polarizations of the
initial and final charged leptons. We discuss the new generalized Michel
parameters and focus on the effects of the heavy neutrino masses that would
lead to sizable contributions on scenarios where the new sterile neutrinos have
non-negligible mixing. Specifically, the most promising scenario is found for
the case of $\tau$ decay with one heavy final-state neutrino with a mass around
$10^2 - 10^3$ MeV, where the linear term suppression could be of order
$10^{-4}$, low enough to be measured in current and forthcoming experiments.
","[{""version"":""v1"",""created"":""Tue, 2 Aug 2022 19:57:29 GMT""},{""version"":""v2"",""created"":""Wed, 18 Jan 2023 23:24:13 GMT""}]","2023-01-20"
"2208.01716","Szil\'ard K\'alm\'an","Szil\'ard K\'alm\'an, Gyula M. Szab\'o, Szil\'ard Csizmadia","Power of wavelets in analyses of transit and phase curves in the
  presence of stellar variability and instrumental noise. II. Accuracy of the
  transit parameters","Accepted for publication in A&A, 11 pages, 8 figures",,,,"astro-ph.EP astro-ph.IM","http://creativecommons.org/licenses/by/4.0/","  Context. Correlated noise in exoplanet light curves, such as noise from
stellar activity, convection noise, and instrumental noise, distorts the
exoplanet transit light curves and leads to biases in the best-fit transit
parameters. An optimal fitting algorithm can provide stability against the
presence of correlated noises and lead to statistically consistent results,
namely, the actual biases are usually within the error interval. This is not
automatically satisfied by most of the algorithms in everyday use and the
testing of the algorithms is necessary. Aims. In this paper, we describe a
bootstrapping-like test to handle with the general case and we apply it to the
wavelet-based Transit and Light Curve Modeller (TLCM) algorithm, testing it for
the stability against the correlated noise. We compare and contrast the results
with regard to the FITSH algorithm, which is based on an assumption of white
noise. Methods. We simulated transit light curves with previously known
parameters in the presence of a correlated noise model generated by an
Autoregressive Integrated Moving Average (ARIMA) process. Then we solved the
simulated observations and examined the resulting parameters and error
intervals. Results. We have found that the assumption of FITSH, namely, that
only white noise is present, has led to inconsistencies in the results: the
distribution of best-fit parameters is then broader than the determined error
intervals by a factor of 3-6. On the other hand, the wavelet-based TLCM
algorithm handles the correlated noise properly, leading to both properly
determined parameter and error intervals that are perfectly consistent with the
actual biases
","[{""version"":""v1"",""created"":""Tue, 2 Aug 2022 20:00:24 GMT""},{""version"":""v2"",""created"":""Wed, 3 May 2023 10:44:47 GMT""}]","2023-05-04"
"2208.01717","Jonathan Weare","John Strahan, Justin Finkel, Aaron R. Dinner, and Jonathan Weare","Predicting rare events using neural networks and short-trajectory data","21 pages, 12 figures",,,,"physics.comp-ph","http://arxiv.org/licenses/nonexclusive-distrib/1.0/","  Estimating the likelihood, timing, and nature of events is a major goal of
modeling stochastic dynamical systems. When the event is rare in comparison
with the timescales of simulation and/or measurement needed to resolve the
elemental dynamics, accurate prediction from direct observations becomes
challenging. In such cases a more effective approach is to cast statistics of
interest as solutions to Feynman-Kac equations (partial differential
equations). Here, we develop an approach to solve Feynman-Kac equations by
training neural networks on short-trajectory data. Our approach is based on a
Markov approximation but otherwise avoids assumptions about the underlying
model and dynamics. This makes it applicable to treating complex computational
models and observational data. We illustrate the advantages of our method using
a low-dimensional model that facilitates visualization, and this analysis
motivates an adaptive sampling strategy that allows on-the-fly identification
of and addition of data to regions important for predicting the statistics of
interest. Finally, we demonstrate that we can compute accurate statistics for a
75-dimensional model of sudden stratospheric warming. This system provides a
stringent test bed for our method.
","[{""version"":""v1"",""created"":""Tue, 2 Aug 2022 20:01:05 GMT""},{""version"":""v2"",""created"":""Thu, 2 Mar 2023 20:45:48 GMT""}]","2023-03-06"
"2208.01718","Ashik Ikbal Sheikh","Ashik Ikbal Sheikh (for the STAR Collaboration)","The splitting of directed flow for identified light hadrons ($K$ and
  $p$) and strange baryons ($\Xi$ and $\Omega$) in Au+Au collisions at STAR","Proceedings of Quark Matter 2022",,,,"nucl-ex hep-ex hep-ph nucl-th","http://creativecommons.org/licenses/by-sa/4.0/","  The first measurements for rapidity-odd directed flow of $\Xi$ and $\Omega$
in Au+Au collisions at $\sqrt{s_{\mathrm {NN}}}=$ 27 and 200 GeV are reported.
The coalescence sum rule is examined with various combinations of hadrons where
all constituent quarks are produced, such as $K^{\!^-}\!\!({ \bar{u}}{s})$,
$\bar{p}({\bar{u}\bar{u}}{\bar{d}})$, $\bar{\Lambda}(\bar{u}\bar{d}\bar{s})$,
$\phi({s}{\bar{s}})$, $\bar{\Xi}^{+}(\bar{d}\bar{s}\bar{s})$,
${\Omega}^{-}(sss)$, and $\bar{\Omega}^{+}(\bar{s}\bar{s}\bar{s})$. For such
combinations, a systematic violation of the sum rule is observed with
increasing difference in the electric charge and the strangeness content of the
combinations. Measurements are compared with the calculations of A Multi-Phase
Transport (AMPT) model and Parton-Hadron String Dynamics (PHSD) model with
electromagnetic (EM) field. The PHSD model with EM field agrees with the
measurements within uncertainties.
","[{""version"":""v1"",""created"":""Tue, 2 Aug 2022 20:02:00 GMT""}]","2022-08-04"
"2208.01719","Justin Romberg","Justin Romberg","Streaming Reconstruction from Non-uniform Samples",,,,,"eess.SP","http://creativecommons.org/licenses/by/4.0/","  We present an online algorithm for reconstructing a signal from a set of
non-uniform samples. By representing the signal using compactly supported basis
functions, we show how estimating the expansion coefficients using
least-squares can be implemented in a streaming manner: as batches of samples
over subsequent time intervals are presented, the algorithm forms an initial
estimate of the signal over the sampling interval then updates its estimates
over previous intervals. We give conditions under which this reconstruction
procedure is stable and show that the least-squares estimates in each interval
converge exponentially, meaning that the updates can be performed with finite
memory with almost no loss in accuracy. We also discuss how our framework
extends to more general types of measurements including time-varying
convolution with a compactly supported kernel.
","[{""version"":""v1"",""created"":""Tue, 2 Aug 2022 20:05:53 GMT""}]","2022-08-04"
"2208.01720","Arnaud Casteigts","Arnaud Casteigts, Timoth\'ee Corsini, Writika Sarkar","Simple, strict, proper, happy: A study of reachability in temporal
  graphs","20 pages, 6 figures",,,,"cs.DM cs.DC","http://arxiv.org/licenses/nonexclusive-distrib/1.0/","  Dynamic networks are a complex topic. Not only do they inherit the complexity
of static networks (as a particular case) while making obsolete many techniques
for these networks; they also happen to be deeply sensitive to specific
definitional subtleties, such as strictness (can several consecutive edges be
used at the same time instant?), properness (can adjacent edges be present at
the same time?) and simpleness (can an edge be present more than once?). These
features, it turns out, have a significant impact on the answers to various
questions, which is a frequent source of confusion and incomparability among
results. In this paper, we explore the impact of these notions, and of their
interactions, in a systematic way. Our conclusions show that these aspects
really matter. In particular, most of the combinations of the above properties
lead to distinct levels of expressivity of a temporal graph in terms of
reachability. Then, we advocate the study of an extremely simple model -- happy
graphs -- where all these distinctions vanish. Happy graphs suffer from a loss
of expressivity; yet, we show that they remain expressive enough to capture
(and strengthen) interesting features of general temporal graphs. A number of
questions are proposed to motivate the study of these objects further.
","[{""version"":""v1"",""created"":""Tue, 2 Aug 2022 20:07:38 GMT""},{""version"":""v2"",""created"":""Mon, 8 Aug 2022 14:09:27 GMT""}]","2022-08-09"
"2208.01721","Aresh Dadlani","Sarina Jami, Iman Sahebi, Mohammad M. Sabermahani, Seyed P.
  Shariatpanahi, Aresh Dadlani, Behrouz Maham","Rumor Stance Classification in Online Social Networks: The
  State-of-the-Art, Prospects, and Future Challenges","16 pages, 3 figures, journal",,,,"cs.SI cs.NI","http://creativecommons.org/licenses/by/4.0/","  The emergence of the Internet as a ubiquitous technology has facilitated the
rapid evolution of social media as the leading virtual platform for
communication, content sharing, and information dissemination. In spite of
revolutionizing the way news is delivered to people, this technology has also
brought along with itself inevitable demerits. One such drawback is the spread
of rumors expedited by social media platforms, which may provoke doubt and
fear. Therefore, it is essential to debunk rumors before their widespread use.
Over the years, many studies have been conducted to develop effective rumor
verification systems. One aspect of such studies focuses on rumor stance
classification, which involves the task of utilizing user viewpoints regarding
a rumorous post to better predict the veracity of a rumor. Relying on user
stances in rumor verification has gained significant importance, for it has
resulted in significant improvements in the model performance. In this paper,
we conduct a comprehensive literature review of rumor stance classification in
complex online social networks (OSNs). In particular, we present a thorough
description of these approaches and compare their performances. Moreover, we
introduce multiple datasets available for this purpose and highlight their
limitations. Finally, challenges and future directions are discussed to
stimulate further relevant research efforts.
","[{""version"":""v1"",""created"":""Tue, 2 Aug 2022 20:07:49 GMT""},{""version"":""v2"",""created"":""Mon, 31 Oct 2022 19:37:10 GMT""}]","2022-11-02"
"2208.01722","Carlos Tejero Prieto","Carlos Tejero Prieto","The meaning of the Sky of Salamanca","11 pages, 8 figures",,,,"physics.hist-ph astro-ph.EP","http://creativecommons.org/licenses/by/4.0/","  After presenting the main characteristics of the Sky of Salamanca, we analyse
whether what is represented in it is motivated by astrological or astronomical
considerations. We will see that the astrological explanation based on the
system of planetary houses described in Claudius Ptolemy's Tetrabiblos does not
correspond to the planetary configuration we see in the salmantine vault.
Finally, we will conclude that the astronomical interpretation of the Sky of
Salamanca is justified by the representation of the Universe known in the 15th
century according to the Almagest, by the placement of the stars in the
constellations according to that work and by the dating of the painted
planetary configuration, which circumstantial evidence places in August 1475.
","[{""version"":""v1"",""created"":""Tue, 2 Aug 2022 20:09:28 GMT""}]","2022-08-04"
"2208.01723","Lara Bossinger","Lara Bossinger","Tropical totally positive cluster varieties","Comments are very welcome",,,,"math.AG math.AC math.RT","http://arxiv.org/licenses/nonexclusive-distrib/1.0/","  We study the relation between the integer tropical points of a cluster
variety (satisfying the full Fock-Goncharov conjecture) and the totally
positive part of the tropicalization of an ideal presenting the corresponding
cluster algebra. Suppose we are given a presentation of the cluster algebra by
a Khovanskii basis for a collection of ${\bf g}$-vector valuations associated
with several seeds related by mutations. In presence of a full rank fully
extended exchange matrix we construct the rays of a subfan of the totally
positive part of the tropicalization of the ideal that coincides
combinatorially with the subgraph of the exchange graph of the cluster algebra
corresponding to the collection of seeds. Moreover, geometric information about
Gross-Hacking-Keel-Kontsevich's toric degenerations associated with seeds gets
identified with the Gr\""obner toric degenerations obtained from maximal cones
in the tropicalization. As application we prove a conjecture about the relation
between Rietsch-Williams' valuations for Grassmannians arising from plabic
graphs \cite{RW17} to Kaveh-Manon's work on valuations from the tropicalization
of an ideal \cite{KM16}. In a second application we give a partial answer to
the question if the Feigin-Fourier-Littelmann-Vinberg degeneration of the full
flag variety in type $\mathtt A$ is isomorphic to a degeneration obtained from
the cluster structure.
","[{""version"":""v1"",""created"":""Tue, 2 Aug 2022 20:17:51 GMT""},{""version"":""v2"",""created"":""Sun, 27 Nov 2022 14:20:09 GMT""}]","2022-11-29"
"2208.01724","Peter Macgregor","Peter Macgregor and He Sun","A Tighter Analysis of Spectral Clustering, and Beyond","A preliminary version of this work appeared at ICML 2022",,,,"cs.DS cs.LG stat.ML","http://creativecommons.org/licenses/by/4.0/","  This work studies the classical spectral clustering algorithm which embeds
the vertices of some graph $G=(V_G, E_G)$ into $\mathbb{R}^k$ using $k$
eigenvectors of some matrix of $G$, and applies $k$-means to partition $V_G$
into $k$ clusters. Our first result is a tighter analysis on the performance of
spectral clustering, and explains why it works under some much weaker condition
than the ones studied in the literature. For the second result, we show that,
by applying fewer than $k$ eigenvectors to construct the embedding, spectral
clustering is able to produce better output for many practical instances; this
result is the first of its kind in spectral clustering. Besides its conceptual
and theoretical significance, the practical impact of our work is demonstrated
by the empirical analysis on both synthetic and real-world datasets, in which
spectral clustering produces comparable or better results with fewer than $k$
eigenvectors.
","[{""version"":""v1"",""created"":""Tue, 2 Aug 2022 20:18:07 GMT""}]","2022-08-04"
"2208.01725","Jonathan Sorenson","Chloe Makdad and Jonathan P. Sorenson","An Algorithm for Ennola's Second Theorem and Counting Smooth Numbers in
  Practice",,,,,"math.NT cs.DS","http://creativecommons.org/licenses/by-nc-nd/4.0/","  Let $\Psi(x,y)$ count the number of positive integers $n\le x$ such that
every prime divisor of $n$ is at most $y$. Given inputs $x$ and $y$, what is
the best way to estimate $\Psi(x,y)$? We address this problem in three ways:
with a new algorithm to estimate $\Psi(x,y)$, with a performance improvement to
an established algorithm, and with empirically based advice on how to choose an
algorithm to estimate $\Psi$ for the given inputs.
  Our new algorithm to estimate $\Psi(x,y)$ is based on Ennola's second theorem
[Ennola69], which applies when $y< (\log x)^{3/4-\epsilon}$ for $\epsilon>0$.
It takes $O(y^2/\log y)$ arithmetic operations of precomputation and $O(y\log
y)$ operations per evaluation of $\Psi$.
  We show how to speed up Algorithm HT, which is based on the saddle-point
method of Hildebrand and Tenenbaum [1986], by a factor proportional to
$\log\log x$, by applying Newton's method in a new way.
  And finally we give our empirical advice based on five algorithms to compute
estimates for $\Psi(x,y)$.The challenge here is that the boundaries of the
ranges of applicability, as given in theorems, often include unknown constants
or small values of $\epsilon>0$, for example, that cannot be programmed
directly.
","[{""version"":""v1"",""created"":""Tue, 2 Aug 2022 20:18:32 GMT""}]","2022-08-04"
"2208.01726","Elmehdi Illi","Elmehdi Illi, Marwa K. Qaraqe, Faissal El Bouanani, Saif M. Al-Kuwari","Can Artificial Noise Boost Further the Secrecy of Dual-hop RIS-aided
  Networks?",,,,,"cs.IT math.IT","http://arxiv.org/licenses/nonexclusive-distrib/1.0/","  In this paper, we quantify the physical layer security of a dual-hop
regenerative relaying-based wireless communication system assisted by
reconfigurable intelligent surfaces (RISs). In particular, the setup consists
of a source node communicating with a destination node via a regenerative
relay. In this setup, a RIS is installed in each hop to increase the
source-relay and relay-destination communications reliability, where the RISs'
phase shifts are subject to quantization errors. The legitimate transmission is
performed under the presence of a malicious eavesdropper attempting to
compromise the legitimate transmissions by overhearing the broadcasted signal
from the relay. To overcome this problem, we incorporate a jammer to increase
the system's secrecy by disrupting the eavesdropper through a broadcasted
jamming signal. Leveraging the well-adopted Gamma and Exponential distributions
approximations, the system's secrecy level is quantified by deriving
approximate and asymptotic expressions of the secrecy intercept probability
(IP) metric in terms of the main network parameters. The results show that the
secrecy is enhanced significantly by increasing the jamming power and/or the
number of reflective elements (REs). In particular, an IP of approximately
$10^{-4}$ can be reached with $40$ REs and $10$ dB of jamming power-to-noise
ratio even when the legitimate links' average signal-to-noise ratios are
$10$-dB less than the eavesdropper's one. We show that cooperative jamming is
very helpful in strong eavesdropping scenarios with a fixed number of REs, and
the number of quantization bits does not influence the secrecy when exceeding
$3$ bits. All the analytical results are endorsed by Monte Carlo simulations.
","[{""version"":""v1"",""created"":""Tue, 2 Aug 2022 20:24:41 GMT""}]","2022-08-04"
"2208.01727","Sergey Zelik V.","Anna Kostianko and Sergey Zelik","Attractors for semigroups with multi-dimensional time and PDEs in
  unbounded domains",,,,,"math.AP","http://arxiv.org/licenses/nonexclusive-distrib/1.0/","  We develop the attractors theory for the semigroups with multidimensional
time belonging to some closed cone in an Euclidean space and apply the obtained
general results to partial differential equations (PDEs) in unbounded domains.
The main attention is payed to elliptic boundary problems in general unbounded
domains. In contrast to the previous works in this direction our theory does
not require the underlying domain to be cylindrical or cone-like or to be shift
semi-invariant with respect to some direction. In particular, the theory is
applicable to the exterior domains.
","[{""version"":""v1"",""created"":""Tue, 2 Aug 2022 20:27:26 GMT""}]","2022-08-04"
"2208.01728","Marta Sanz-Sol\'e","Davar Khoshnevisan and Marta Sanz-Sol\'e","Optimal regularity of SPDEs with additive noise","27 pages",,,,"math.PR","http://arxiv.org/licenses/nonexclusive-distrib/1.0/","  The sample-function regularity of the random-field solution to a stochastic
partial differential equation (SPDE) depends naturally on the roughness of the
external noise, as well as on the properties of the underlying
integro-differential operator that is used to define the equation. In this
paper, we consider parabolic and hyperbolic SPDEs on
$0,\infty)\times\mathbb{R}^d$ of the form $\partial_t u = \mathcal{L} u + g(u)
+ \dot{F} \qquad\text{and}\qquad \partial^2_t u = \mathcal{L} u + c + \dot{F},
$ with suitable initial data, forced with a space-time homogeneous Gaussian
noise $\dot{F}$ that is white in its time variable and correlated in its space
variable, and driven by the generator $\mathcal{L}$ of a genuinely
$d$-dimensional L\'evy process $X$. We find optimal H\""older conditions for the
respective random-field solutions to these SPDEs. Our conditions are stated in
terms of indices that describe thresholds on the integrability of some
functionals of the characteristic exponent of the process $X$ with respect to
the spectral measure of the spatial covariance of $\dot F$. Those indices are
suggested by references [45, 46] on the particular case that $\mathcal{L}$ is
the Laplace operator on $\mathbb{R}^d$.
","[{""version"":""v1"",""created"":""Tue, 2 Aug 2022 20:31:38 GMT""}]","2022-08-08"
