"2208.01553","Elias Rego","Elias Rego and Kendry J. Vivas","On Chaotic Behavior of ASH Attractors","20 pages, 1 figure",,,,"math.DS","http://arxiv.org/licenses/nonexclusive-distrib/1.0/","  The asymptotic sectional hyperbolicity is a weak notion of hyperbolicity that
extends properly the sectional-hyperbolicity and includes the Rovella attractor
as a archetypal example. The main feature of this definition is the existence
of arbitrarily large hyperbolic times for points outside the stable manifolds
of the singularities. In this paper we will prove that any attractor associated
to a $C^1$ vector field $X$ on a three-dimensional manifold satisfying this
kind of hyperbolicity is rescaling-expansive and presents sensitiveness respect
to initial conditions.
","[{""version"":""v1"",""created"":""Tue, 2 Aug 2022 16:00:04 GMT""}]","2022-08-03"
"2208.01554","Thomas Becher","Thomas Becher, Samuel Favrod, Xiaofeng Xu","QCD anatomy of photon isolation","38 pages, 13 figures. v2: journal version, corrected (A.2)",,"10.1007/JHEP01(2023)005",,"hep-ph","http://arxiv.org/licenses/nonexclusive-distrib/1.0/","  To separate the energetic photons produced in hard scattering processes from
those from other sources, measurements impose isolation requirements which
restrict the hadronic radiation inside a cone around the photon. In this paper,
we perform a detailed factorization analysis of the QCD effects associated with
photon isolation. We show that for small cone radius $R$, photon isolation
effects can be captured by a fragmentation function describing the decay of a
parton into a photon accompanied by hadronic radiation. We compute this
fragmentation function for different isolation criteria and solve the
associated renormalization group equations to resum logarithms of $R$. For
small isolation energy, the cone fragmentation function factorizes further,
into collinear functions describing energetic quarks and gluons near the cone
boundary and functions encoding their soft radiation emitted into the cone.
Based on this factorization we also resum the non-global logarithms of the
ratio of the photon energy and the isolation energy, so that we control all
logarithmically enhanced terms in the cross section. Finally, we provide a
simple formula to convert NNLO cross section results from smooth-cone isolation
to fixed-cone isolation.
","[{""version"":""v1"",""created"":""Tue, 2 Aug 2022 16:01:07 GMT""},{""version"":""v2"",""created"":""Tue, 14 Feb 2023 16:54:12 GMT""}]","2023-02-15"
"2208.01555","Arshdeep Singh","Arshdeep Singh, James A King, Xubo Liu, Wenwu Wang, Mark D. Plumbley","Low-complexity CNNs for Acoustic Scene Classification","Technical Report DCASE 2022 TASK 1. arXiv admin note: substantial
  text overlap with arXiv:2207.11529",,,,"eess.AS cs.LG cs.SD","http://creativecommons.org/licenses/by/4.0/","  This technical report describes the SurreyAudioTeam22s submission for DCASE
2022 ASC Task 1, Low-Complexity Acoustic Scene Classification (ASC). The task
has two rules, (a) the ASC framework should have maximum 128K parameters, and
(b) there should be a maximum of 30 millions multiply-accumulate operations
(MACs) per inference. In this report, we present low-complexity systems for ASC
that follow the rules intended for the task.
","[{""version"":""v1"",""created"":""Tue, 2 Aug 2022 16:02:41 GMT""}]","2022-08-03"
"2208.01556","Mohamed Akrout","Mohamed Akrout, Volodymyr Shyianov, Faouzi Bellili, Amine Mezghani,
  Robert W. Heath","Super-Wideband Massive MIMO","Accepted to IEEE JSAC special issue on Beyond Shannon Communications:
  A Paradigm Shift to Catalyze 6G",,,,"cs.IT eess.SP math.IT","http://creativecommons.org/licenses/by-nc-sa/4.0/","  We present a unified model for connected antenna arrays with a large number
of tightly integrated (i.e., coupled) antennas in a compact space within the
context of massive multiple-input multiple-output (MIMO) communication. We
refer to this system as tightly-coupled massive MIMO. From an
information-theoretic perspective, scaling the design of tightly-coupled
massive MIMO systems in terms of the number of antennas, the operational
bandwidth, and form factor was not addressed in prior art. We investigate this
open research problem using a physically consistent modeling approach for
far-field (FF) MIMO communication based on multi-port circuit theory. In doing
so, we turn mutual coupling (MC) from a foe to a friend of MIMO systems design,
thereby challenging a basic percept in antenna systems engineering that
promotes MC mitigation/compensation. We show that tight MC widens the
operational bandwidth of antenna arrays thereby unleashing a missing MIMO gain
that we coin ""bandwidth gain"". Furthermore, we derive analytically the
asymptotically optimum spacing-to-antenna-size ratio by establishing a
condition for tight coupling in the limit of large-size antenna arrays with
quasi-continuous apertures. We also optimize the antenna array size while
maximizing the achievable rate under fixed transmit power and inter-element
spacing. Then, we study the impact of MC on the achievable rate of MIMO systems
under line-of-sight (LoS) and Rayleigh fading channels. These results reveal
new insights into the design of tightly-coupled massive antenna arrays as
opposed to the widely-adopted ""disconnected"" designs that disregard MC by
putting faith in the half-wavelength spacing rule.
","[{""version"":""v1"",""created"":""Tue, 2 Aug 2022 16:03:12 GMT""},{""version"":""v2"",""created"":""Sat, 6 May 2023 15:37:15 GMT""}]","2023-05-09"
"2208.01557","Nancy Abdallah Dr","Nancy Abdallah and Hal Schenck","Nets in $\mathbb P^2$ and Alexander Duality","15pp",,,,"math.CO math.AC math.AG","http://arxiv.org/licenses/nonexclusive-distrib/1.0/","  A net in $\mathbb{P}^2$ is a configuration of lines $\mathcal A$ and points
$X$ satisfying certain incidence properties. Nets appear in a variety of
settings, ranging from quasigroups to combinatorial design to classification of
Kac-Moody algebras to cohomology jump loci of hyperplane arrangements. For a
matroid $M$ and rank $r$, we associate a monomial ideal (a monomial variant of
the Orlik-Solomon ideal) to the set of flats of $M$ of rank $\le r$. In the
context of line arrangements in $\mathbb{P}^2$, applying Alexander duality to
the resulting ideal yields insight into the combinatorial structure of nets.
","[{""version"":""v1"",""created"":""Tue, 2 Aug 2022 16:03:18 GMT""},{""version"":""v2"",""created"":""Mon, 19 Sep 2022 06:36:15 GMT""}]","2022-09-20"
"2208.01558","Vsevolod Nedora","Vsevolod Nedora, Tim Dietrich, Masaru Shibata, Martin Pohl, Ludovica
  Crosato Menegazzi","Modeling kilonova afterglows: Effects of the thermal electron population
  and interaction with GRB outflows","20 pages, 14 figures",,"10.1093/mnras/stad175",,"astro-ph.HE gr-qc","http://arxiv.org/licenses/nonexclusive-distrib/1.0/","  Given an increasing number of gamma-ray bursts accompanied by potential
kilonovae there is a growing importance to advance modelling of kilonova
afterglows. In this work, we investigate how the presence of two electron
populations that follow a Maxwellian (thermal) and a power-law (non-thermal)
distributions affect kilonova afterglow light curves. We employ semi-analytic
afterglow model, $\texttt{PyBlastAfterglow}$. We consider kilonova ejecta
profiles from ab-initio numerical relativity binary neutron star merger
simulations, targeted to GW170817. We do not perform model selection. We find
that the emission from thermal electrons dominates at early times. If the
interstellar medium density is high (${\simeq}0.1\,\ccm$) it adds an early time
peak to the light curve. As ejecta decelerates the spectral and temporal
indexes change in a characteristic way that, if observed, can be used to
reconstruct the ejecta velocity distribution. For the low interstellar medium
density, inferred for GRB 170817A, the emission from the non-thermal electron
population generally dominates. We also assess how kilonova afterglow light
curves change if the interstellar medium has been partially removed and
pre-accelerated by laterally expanding gamma-ray burst ejecta. We find that the
main effect is the emission suppression at early time ${\lesssim}10^{3}\,$days,
and at its maximum it reaches ${\sim}40\%$ when the fast tail of the kilonova
ejecta moves subsonically through the wake of laterally spreading gamma-ray
burst ejecta. The subsequent rebrightening, when these ejecta break through and
shocks form, is very mild (${\lesssim}10\%$), and may not be observable.
","[{""version"":""v1"",""created"":""Tue, 2 Aug 2022 16:03:48 GMT""},{""version"":""v2"",""created"":""Fri, 13 Jan 2023 08:55:48 GMT""}]","2023-02-01"
"2208.01559","Shihui Yu","Shihui Yu, Chen Gong, and Zhengyuan Xu","The design and optimization of synchronization sequence for Ultraviolet
  communication",,,,,"eess.SP","http://arxiv.org/licenses/nonexclusive-distrib/1.0/","  In the ultraviolet (UV) scattering communication, the received signals
exhibit the characteristics of discrete photoelectrons due to path loss. The
synchronization is based on maximum Pulse Number-Sequence correlation problem.
First of all, the accuracy of synchronization is vital to channel estimation
and decoding. This article focuses on improving synchronization accuracy by
designing and optimizing synchronization sequences. As for the maximum Pulse
Number-Sequence correlation problem, it is assumed that the correlation values
satisfy the Gaussian distribution and their mathematical expectation, variance
and covariance are derived to express the upper bound of synchronization
offset. The synchronization sequence we designed has two equilong RANDOM parts
(Symbols meet Bernoulli distribution with equal probability.) and a
$\{1,0,1,0,1,0,...,1,0,1,0\}$ part between them with $ \alpha $ as its
proportion of entire sequence. On the premise of ensuring the synchronization
reliability, the synchronization deviation can be reduced by optimizing $
\alpha $.
  There are simulation experiments to verify correctness of the derivation,
reasonableness of the hypothesis and reliability of optimization. Compared with
equilong random sequence, the synchronization accuracy of the optimized
synchronization sequence is significantly improved.
","[{""version"":""v1"",""created"":""Tue, 2 Aug 2022 16:03:58 GMT""}]","2022-08-03"
"2208.01560","Elliot Kaplan","Antongiulio Fornasiero and Elliot Kaplan","Hilbert polynomials for finitary matroids","19 pages, comments are welcome",,,,"math.CO math.AC math.LO","http://arxiv.org/licenses/nonexclusive-distrib/1.0/","  We consider a tuple $\Phi = (\phi_1,\ldots,\phi_m)$ of commuting maps on a
finitary matroid $X$. We show that if $\Phi$ satisfies certain conditions, then
for any finite set $A\subseteq X$, the rank of
$\{\phi_1^{r_1}\cdots\phi_m^{r_m}(a):a \in A\text{ and }r_1+\cdots+r_m = t\}$
is eventually a polynomial in $t$ (we also give a multivariate version of the
polynomial). This allows us easily recover Khovanskii's theorem on the growth
of sumsets, the existence of the classical Hilbert polynomial, and the
existence of the Kolchin polynomial. We also prove some new Kolchin polynomial
results for differential exponential fields and derivations on o-minimal
fields, as well as a new result on the growth of Betti numbers in simplicial
complexes.
","[{""version"":""v1"",""created"":""Tue, 2 Aug 2022 16:05:21 GMT""},{""version"":""v2"",""created"":""Mon, 6 Mar 2023 19:21:07 GMT""}]","2023-03-08"
"2208.01561","Cassandra Jacobs","Cassandra L. Jacobs and Yuval Pinter","Lost in Space Marking","Submission to SIGMORPHON 2021",,,,"cs.CL","http://creativecommons.org/licenses/by/4.0/","  We look at a decision taken early in training a subword tokenizer, namely
whether it should be the word-initial token that carries a special mark, or the
word-final one. Based on surface-level considerations of efficiency and
cohesion, as well as morphological coverage, we find that a Unigram LM
tokenizer trained on pre-tokenized English text is better off marking the
word-initial token, while one trained on raw text benefits from marking word
ends. Our findings generalize across domains.
","[{""version"":""v1"",""created"":""Tue, 2 Aug 2022 16:07:31 GMT""}]","2022-08-03"
"2208.01562","Di Wu","Feilong Chen, Di Wu, Jie Yang, Yi He","An Online Sparse Streaming Feature Selection Algorithm",,,,,"cs.LG","http://arxiv.org/licenses/nonexclusive-distrib/1.0/","  Online streaming feature selection (OSFS), which conducts feature selection
in an online manner, plays an important role in dealing with high-dimensional
data. In many real applications such as intelligent healthcare platform,
streaming feature always has some missing data, which raises a crucial
challenge in conducting OSFS, i.e., how to establish the uncertain relationship
between sparse streaming features and labels. Unfortunately, existing OSFS
algorithms never consider such uncertain relationship. To fill this gap, we in
this paper propose an online sparse streaming feature selection with
uncertainty (OS2FSU) algorithm. OS2FSU consists of two main parts: 1) latent
factor analysis is utilized to pre-estimate the missing data in sparse
streaming features before con-ducting feature selection, and 2) fuzzy logic and
neighborhood rough set are employed to alleviate the uncertainty between
estimated streaming features and labels during conducting feature selection. In
the experiments, OS2FSU is compared with five state-of-the-art OSFS algorithms
on six real datasets. The results demonstrate that OS2FSU outperforms its
competitors when missing data are encountered in OSFS.
","[{""version"":""v1"",""created"":""Tue, 2 Aug 2022 16:08:22 GMT""},{""version"":""v2"",""created"":""Wed, 3 Aug 2022 14:34:11 GMT""}]","2022-08-04"
"2208.01563","Niclas Boehmer","Niclas Boehmer, Klaus Heeger, Rolf Niedermeier","Deepening the (Parameterized) Complexity Analysis of Incremental Stable
  Matching Problems","Accepted to MFCS'22",,,,"cs.GT cs.DM","http://arxiv.org/licenses/nonexclusive-distrib/1.0/","  When computing stable matchings, it is usually assumed that the preferences
of the agents in the matching market are fixed. However, in many realistic
scenarios, preferences change over time. Consequently, an initially stable
matching may become unstable. Then, a natural goal is to find a matching which
is stable with respect to the modified preferences and as close as possible to
the initial one. For Stable Marriage/Roommates, this problem was formally
defined as Incremental Stable Marriage/Roommates by Bredereck et al. [AAAI
'20]. As they showed that Incremental Stable Roommates and Incremental Stable
Marriage with Ties are NP-hard, we focus on the parameterized complexity of
these problems. We answer two open questions of Bredereck et al. [AAAI '20]: We
show that Incremental Stable Roommates is W[1]-hard parameterized by the number
of changes in the preferences, yet admits an intricate XP-algorithm, and we
show that Incremental Stable Marriage with Ties is W[1]-hard parameterized by
the number of ties. Furthermore, we analyze the influence of the degree of
""similarity"" between the agents' preference lists, identifying several
polynomial-time solvable and fixed-parameter tractable cases, but also proving
that Incremental Stable Roommates and Incremental Stable Marriage with Ties
parameterized by the number of different preference lists are W[1]-hard.
","[{""version"":""v1"",""created"":""Tue, 2 Aug 2022 16:09:01 GMT""},{""version"":""v2"",""created"":""Tue, 8 Nov 2022 12:07:32 GMT""}]","2022-11-09"
"2208.01564","Daniil Rudenko","Andrei Matveiakin and Daniil Rudenko","Cluster Polylogarithms I: Quadrangular Polylogarithms",,,,,"math.AG math.NT","http://creativecommons.org/licenses/by/4.0/","  We suggest a definition of cluster polylogarithms on an arbitrary cluster
variety and classify them in type $A$. We find functional equations for
multiple polylogarithms which generalize equations discovered by Abel, Kummer,
and Goncharov to an arbitrary weight. As an application, we prove a part of the
Goncharov depth conjecture in weight six.
","[{""version"":""v1"",""created"":""Tue, 2 Aug 2022 16:10:18 GMT""},{""version"":""v2"",""created"":""Fri, 4 Nov 2022 23:57:02 GMT""}]","2022-11-08"
"2208.01565","Emilia Magnani","Emilia Magnani, Nicholas Kr\""amer, Runa Eschenhagen, Lorenzo Rosasco,
  Philipp Hennig","Approximate Bayesian Neural Operators: Uncertainty Quantification for
  Parametric PDEs",,,,,"cs.LG cs.NA math.NA","http://arxiv.org/licenses/nonexclusive-distrib/1.0/","  Neural operators are a type of deep architecture that learns to solve (i.e.
learns the nonlinear solution operator of) partial differential equations
(PDEs). The current state of the art for these models does not provide explicit
uncertainty quantification. This is arguably even more of a problem for this
kind of tasks than elsewhere in machine learning, because the dynamical systems
typically described by PDEs often exhibit subtle, multiscale structure that
makes errors hard to spot by humans. In this work, we first provide a
mathematically detailed Bayesian formulation of the ''shallow'' (linear)
version of neural operators in the formalism of Gaussian processes. We then
extend this analytic treatment to general deep neural operators using
approximate methods from Bayesian deep learning. We extend previous results on
neural operators by providing them with uncertainty quantification. As a
result, our approach is able to identify cases, and provide structured
uncertainty estimates, where the neural operator fails to predict well.
","[{""version"":""v1"",""created"":""Tue, 2 Aug 2022 16:10:27 GMT""}]","2022-08-03"
"2208.01566","Mohsen Hafez-Torbati","Mohsen Hafez-Torbati, Frithjof B. Anders, G\""otz S. Uhrig","Simplified approach to the magnetic blue shift of Mott gaps","17 pages, 13 figures","Phys. Rev. B 106, 205117 (2022)","10.1103/PhysRevB.106.205117",,"cond-mat.str-el","http://creativecommons.org/licenses/by/4.0/","  The antiferromagnetic ordering in Mott insulators upon lowering the
temperature is accompanied by a transfer of the single-particle spectral weight
to lower energies and a shift of the Mott gap to higher energies (magnetic blue
shift, MBS). The MBS is governed by the double exchange and the exchange
mechanisms. Both mechanisms enhance the MBS upon increasing the number of
orbitals. By performing a polynomial fit to numerical dynamical mean-field
theory data we provide an expansion for the MBS in terms of hopping and
exchange coupling of a prototype Hubbard-Kondo-Heisenberg model and discuss how
the results can be generalized for application to realistic Mott or
charge-transfer insulator materials. This allows estimating the MBS of the
charge gap in real materials in an extremely simple way avoiding extensive
theoretical calculations. The approach is exemplarily applied to $\alpha$-MnTe,
NiO, and BiFeO$_3$ and an MBS of about $130$ meV, $360$ meV, and $157$ meV is
found, respectively. The values are compared with the previous theoretical
calculations and the available experimental data. Our ready-to-use formula for
the MBS simplifies the future studies searching for materials with a strong
coupling between the antiferromagnetic ordering and the charge excitations,
which is paramount to realize a coupled spin-charge coherent dynamics at a
femtosecond time scale.
","[{""version"":""v1"",""created"":""Tue, 2 Aug 2022 16:12:16 GMT""},{""version"":""v2"",""created"":""Thu, 10 Nov 2022 17:03:40 GMT""}]","2022-11-11"
"2208.01567","Laura Baldelli","Laura Baldelli, Valentina Brizi, Roberta Filippucci","Existence and nonexistence of positive radial solutions of a quasilinear
  Dirichlet problem with diffusion",,,,,"math.AP","http://creativecommons.org/licenses/by-nc-nd/4.0/","  In this paper existence and nonexistence results of positive radial solutions
of a Dirichlet $m$-Laplacian problem with different weights and a diffusion
term inside the divergence of the form $\big(a(|x|)+g(u)\big)^{-\gamma}$, with
$\gamma>0$ and $a$, $g$ positive functions satisfying natural growth
conditions, are proved. Precisely, we obtain a new critical exponent
$m^*_{\alpha,\beta,\gamma}$, which extends the one relative to case with no
diffusion and it divides existence from nonexistence of positive radial
solutions. The results are obtained via several tools such as a suitable
modification of the celebrated blow up technique, Liouville type theorems, a
fixed point theorem and a Poho\v zaev-Pucci-Serrin type identity.
","[{""version"":""v1"",""created"":""Tue, 2 Aug 2022 16:13:13 GMT""}]","2022-08-03"
"2208.01568","Lineu Alberto Cavazani de Freitas","Lineu Alberto Cavazani de Freitas and Wagner Hugo Bonat","Hypothesis tests for multiple responses regression models in R: The
  htmcglm Package","arXiv admin note: substantial text overlap with arXiv:2208.00027",,,,"stat.CO","http://creativecommons.org/licenses/by/4.0/","  This article describes the R package htmcglm implemented for performing
hypothesis tests on regression and dispersion parameters of multivariate
covariance generalized linear models (McGLMs). McGLMs provide a general
statistical modeling framework for normal and non-normal multivariate data
analysis along with a wide range of correlation structures. The proposed
package considers the Wald statistics to perform general hypothesis tests and
build tailored ANOVAs, MANOVAs and multiple comparison tests. The goal of the
package is to provide tools to improve the interpretation of regression and
dispersion parameters. We assess the effects of the covariates on the response
variables by testing the regression coefficients. Similarly, we perform tests
on the dispersion coefficients in order to assess the correlation between study
units. It could be of interest in situations where the data observations are
correlated with each other, such as in longitudinal, times series, spatial and
repeated measures studies. The htmcglm package provides a user friendly
interface to perform MANOVA like tests as well as multivariate hypothesis tests
for models of the mcglm class. We describe the package implementation and
illustrate it through the analysis of two data sets. The first deals with an
experiment on soybean yield; the problem has three response variables of
different types (continuous, counting and binomial) and three explanatory
variables (amount of water, fertilization and block). The second dataset
addresses a problem where responses are longitudinal bivariate counts of
hunting animals; the explanatory variables used are the hunting method and sex
of the animal. With these examples we were able to illustrate several tests in
which the proposal proves to be useful for the evaluation of regression and
dispersion parameters both in problems with dependent or independent
observations.
","[{""version"":""v1"",""created"":""Tue, 2 Aug 2022 16:15:11 GMT""}]","2022-08-03"
"2208.01569","Lyle Poley","Lyle Poley, Joseph W. Baron, Tobias Galla","Generalised Lotka-Volterra model with hierarchical interactions","10 pages, 6 Figures",,"10.1103/PhysRevE.107.024313",,"q-bio.PE cond-mat.dis-nn","http://arxiv.org/licenses/nonexclusive-distrib/1.0/","  In the analysis of complex ecosystems it is common to use random interaction
coefficients, often assumed to be such that all species are statistically
equivalent. In this work we relax this assumption by choosing interactions
according to the cascade model, which we incorporate into a generalised
Lotka-Volterra dynamical system. These interactions impose a hierarchy in the
community. Species benefit more, on average, from interactions with species
further below them in the hierarchy than from interactions with those above.
Using dynamic mean-field theory, we demonstrate that a strong hierarchical
structure is stabilising, but that it reduces the number of species in the
surviving community, as well as their abundances. Additionally, we show that
increased heterogeneity in the variances of the interaction coefficients across
positions in the hierarchy is destabilising. We also comment on the structure
of the surviving community and demonstrate that the abundance and probability
of survival of a species is dependent on its position in the hierarchy.
","[{""version"":""v1"",""created"":""Tue, 2 Aug 2022 16:16:50 GMT""}]","2023-03-08"
"2208.01570","Juergen Lisenfeld","J\""urgen Lisenfeld, Alexander Bilmes, and Alexey V. Ustinov","Enhancing the Coherence of Superconducting Quantum Bits with Electric
  Fields","5.5 pages and 4 figures (main Text), plus 11 pages with supplementary
  figures discussing additional loss via the DC-electrode, how the T1
  improvement reduces over time after E-field optimization, and plots of the
  complete data set","npj Quantum information 9, 8 (2023)","10.1038/s41534-023-00678-9",,"quant-ph cond-mat.supr-con","http://creativecommons.org/licenses/by-nc-sa/4.0/","  In the endeavour to make quantum computers a reality, integrated
superconducting circuits have become a promising architecture. A major
challenge of this approach is decoherence originating from spurious atomic
tunneling defects at the interfaces of qubit electrodes, which may resonantly
absorb energy from the qubit's oscillating electric field and reduce the
qubit's energy relaxation time $T_1$. Here, we show that qubit coherence can be
improved by tuning dominating defects away from the qubit resonance using an
applied DC-electric field. We demonstrate a method that optimizes the applied
field bias and enhances the 30-minute averaged qubit $T_1$ time by 23\%. We
also discuss how local gate electrodes can be implemented in superconducting
quantum processors to enable simultaneous in-situ coherence optimization of
individual qubits.
","[{""version"":""v1"",""created"":""Tue, 2 Aug 2022 16:18:30 GMT""},{""version"":""v2"",""created"":""Thu, 30 Mar 2023 13:31:34 GMT""}]","2023-03-31"
