"2208.01870","Mintaek Oh","Mintaek Oh, Jeonghun Park, Jinseok Choi","Joint Optimization for Secure and Reliable Communications in Finite
  Blocklength Regime","30 pages, 8 figures",,,,"cs.IT eess.SP math.IT","http://creativecommons.org/licenses/by/4.0/","  To realize ultra-reliable low latency communications with high spectral
efficiency and security, we investigate a joint optimization problem for
downlink communications with multiple users and eavesdroppers in the finite
blocklength (FBL) regime. We formulate a multi-objective optimization problem
to maximize a sum secrecy rate by developing a secure precoder and to minimize
a maximum error probability and information leakage rate. The main challenges
arise from the complicated multi-objective problem, non-tractable back-off
factors from the FBL assumption, non-convexity and non-smoothness of the
secrecy rate, and the intertwined optimization variables. To address these
challenges, we adopt an alternating optimization approach by decomposing the
problem into two phases: secure precoding design, and maximum error probability
and information leakage rate minimization. In the first phase, we obtain a
lower bound of the secrecy rate and derive a first-order Karush-Kuhn-Tucker
(KKT) condition to identify local optimal solutions with respect to the
precoders. Interpreting the condition as a generalized eigenvalue problem, we
solve the problem by using a power iteration-based method. In the second phase,
we adopt a weighted-sum approach and derive KKT conditions in terms of the
error probabilities and leakage rates for given precoders. Simulations validate
the proposed algorithm.
","[{""version"":""v1"",""created"":""Wed, 3 Aug 2022 06:45:54 GMT""}]","2022-08-04"
"2208.01871","Tryambak Gangopadhyay","Tryambak Gangopadhyay, Somnath De, Qisai Liu, Achintya Mukhopadhyay,
  Swarnendu Sen, Soumik Sarkar","A Deep Learning Approach to Detect Lean Blowout in Combustion Systems",,,,,"cs.LG","http://arxiv.org/licenses/nonexclusive-distrib/1.0/","  Lean combustion is environment friendly with low NOx emissions and also
provides better fuel efficiency in a combustion system. However, approaching
towards lean combustion can make engines more susceptible to lean blowout. Lean
blowout (LBO) is an undesirable phenomenon that can cause sudden flame
extinction leading to sudden loss of power. During the design stage, it is
quite challenging for the scientists to accurately determine the optimal
operating limits to avoid sudden LBO occurrence. Therefore, it is crucial to
develop accurate and computationally tractable frameworks for online LBO
detection in low NOx emission engines. To the best of our knowledge, for the
first time, we propose a deep learning approach to detect lean blowout in
combustion systems. In this work, we utilize a laboratory-scale combustor to
collect data for different protocols. We start far from LBO for each protocol
and gradually move towards the LBO regime, capturing a quasi-static time series
dataset at each condition. Using one of the protocols in our dataset as the
reference protocol and with conditions annotated by domain experts, we find a
transition state metric for our trained deep learning model to detect LBO in
the other test protocols. We find that our proposed approach is more accurate
and computationally faster than other baseline models to detect the transitions
to LBO. Therefore, we recommend this method for real-time performance
monitoring in lean combustion engines.
","[{""version"":""v1"",""created"":""Wed, 3 Aug 2022 06:48:30 GMT""}]","2022-08-04"
"2208.01872","Laur J\""arv","Sebastian Bahamonde, Laur J\""arv","Coincident gauge for static spherical field configurations in symmetric
  teleparallel gravity","24 pages, version submitted to EPJC","Eur. Phys. J. C 82, 963 (2022)","10.1140/epjc/s10052-022-10922-9",,"gr-qc hep-th","http://arxiv.org/licenses/nonexclusive-distrib/1.0/","  In symmetric teleparallel gravities, where the independent connection is
characterized by nonmetricity while curvature and torsion are zero, it is
possible to find a coordinate system whereby the connection vanishes globally
and covariant derivatives reduce to partial derivatives -- the coincident
gauge. In this paper we derive general transformation rules into the coincident
gauge for spacetime configurations where the both the metric and connection are
static and spherically symmetric, and write out the respective form of the
coincident gauge metrics. Taking different options in fixing the freedom in the
connection allowed by the symmetry and the field equations, the Schwarzschild
metric in the coincident gauge can take for instance the Cartesian,
Kerr-Schild, and diagonal (isotropic-like) forms, while the BBMB black hole
metric in symmetric teleparallel scalar-tensor theory a certain diagonal form
fits the coincident gauge requirements but the Cartesian and Kerr-Schild forms
do not. Different connections imply different value for the boundary term which
could in principle be physically relevant, but simple arguments about the
coincident gauge do not seem to be sufficient to fix the connection uniquely.
As a byproduct of the investigation we also point out that only a particular
subset of static spherically symmetric connections has vanishing nonmetricity
in the Minkowski limit.
","[{""version"":""v1"",""created"":""Wed, 3 Aug 2022 06:52:50 GMT""},{""version"":""v2"",""created"":""Mon, 31 Oct 2022 09:48:36 GMT""}]","2022-11-01"
"2208.01873","Sean McCurdy","Sean McCurdy","Non-existence of cusps for a Free-boundary Problem for Water Waves",,,,,"math.AP","http://creativecommons.org/licenses/by-nc-nd/4.0/","  In arXiv:0908.1031, Varvaruca and Weiss eliminate the existence of cusps for
a free-boundary problem for two-dimensional water waves under assumptions that
hold for solutions such that $\{u>0\}$ is a ""strip-like"" domain in the sense of
arXiv:0708.4371. In this paper it is proven that cusps do not exists in the
natural setting for these free-boundary problems. In particular, non strip-like
domains are also allowed. This builds upon recent work on non-existence of
cusps in arXiv:2202.00616.
","[{""version"":""v1"",""created"":""Wed, 3 Aug 2022 06:55:19 GMT""}]","2022-08-04"
"2208.01874","Haitao Lin","Haitao Lin, Lirong Wu, Guojiang Zhao, Pai Liu, Stan Z. Li","Exploring Generative Neural Temporal Point Process",,,,,"cs.LG","http://creativecommons.org/licenses/by/4.0/","  Temporal point process (TPP) is commonly used to model the asynchronous event
sequence featuring occurrence timestamps and revealed by probabilistic models
conditioned on historical impacts.
  While lots of previous works have focused on `goodness-of-fit' of TPP models
by maximizing the likelihood, their predictive performance is unsatisfactory,
which means the timestamps generated by models are far apart from true
observations.
  Recently, deep generative models such as denoising diffusion and score
matching models have achieved great progress in image generating tasks by
demonstrating their capability of generating samples of high quality.
  However, there are no complete and unified works exploring and studying the
potential of generative models in the context of event occurence modeling for
TPP.
  In this work, we try to fill the gap by designing a unified
\textbf{g}enerative framework for \textbf{n}eural \textbf{t}emporal
\textbf{p}oint \textbf{p}rocess (\textsc{GNTPP}) model to explore their
feasibility and effectiveness, and further improve models' predictive
performance.
  Besides, in terms of measuring the historical impacts, we revise the
attentive models which summarize influence from historical events with an
adaptive reweighting term considering events' type relation and time intervals.
  Extensive experiments have been conducted to illustrate the improved
predictive capability of \textsc{GNTPP} with a line of generative probabilistic
decoders, and performance gain from the revised attention.
  To the best of our knowledge, this is the first work that adapts generative
models in a complete unified framework and studies their effectiveness in the
context of TPP.
  Our codebase including all the methods given in Section.5.1.1 is open in
\url{https://github.com/BIRD-TAO/GNTPP}. We hope the code framework can
facilitate future research in Neural TPPs.
","[{""version"":""v1"",""created"":""Wed, 3 Aug 2022 06:56:28 GMT""},{""version"":""v2"",""created"":""Thu, 4 Aug 2022 08:21:20 GMT""}]","2022-08-05"
"2208.01875","Avi Shmidman","Avi Shmidman, Joshua Guedalia, Shaltiel Shmidman, Cheyn Shmuel
  Shmidman, Eli Handel, Moshe Koppel","Introducing BEREL: BERT Embeddings for Rabbinic-Encoded Language",,,,,"cs.CL","http://creativecommons.org/licenses/by/4.0/","  We present a new pre-trained language model (PLM) for Rabbinic Hebrew, termed
Berel (BERT Embeddings for Rabbinic-Encoded Language). Whilst other PLMs exist
for processing Hebrew texts (e.g., HeBERT, AlephBert), they are all trained on
modern Hebrew texts, which diverges substantially from Rabbinic Hebrew in terms
of its lexicographical, morphological, syntactic and orthographic norms. We
demonstrate the superiority of Berel on Rabbinic texts via a challenge set of
Hebrew homographs. We release the new model and homograph challenge set for
unrestricted use.
","[{""version"":""v1"",""created"":""Wed, 3 Aug 2022 06:59:04 GMT""}]","2022-08-04"
"2208.01876","Md Shahriar Tasjid","Md Shahriar Tasjid, Ahmed Al Marouf","Leveraging Smartphone Sensors for Detecting Abnormal Gait for Smart
  Wearable Mobile Technologies",,"International Journal of Interactive Mobile Technologies (iJIM);
  Volume 15 Number 24; Page 167-175; 2021","10.3991/ijim.v15i24.25891.",,"cs.HC cs.CV cs.LG","http://creativecommons.org/licenses/by/4.0/","  Walking is one of the most common modes of terrestrial locomotion for humans.
Walking is essential for humans to perform most kinds of daily activities. When
a person walks, there is a pattern in it, and it is known as gait. Gait
analysis is used in sports and healthcare. We can analyze this gait in
different ways, like using video captured by the surveillance cameras or depth
image cameras in the lab environment. It also can be recognized by wearable
sensors. e.g., accelerometer, force sensors, gyroscope, flexible goniometer,
magneto resistive sensors, electromagnetic tracking system, force sensors, and
electromyography (EMG). Analysis through these sensors required a lab
condition, or users must wear these sensors. For detecting abnormality in gait
action of a human, we need to incorporate the sensors separately. We can know
about one's health condition by abnormal human gait after detecting it.
Understanding a regular gait vs. abnormal gait may give insights to the health
condition of the subject using the smart wearable technologies. Therefore, in
this paper, we proposed a way to analyze abnormal human gait through smartphone
sensors. Though smart devices like smartphones and smartwatches are used by
most of the person nowadays. So, we can track down their gait using sensors of
these intelligent wearable devices.
","[{""version"":""v1"",""created"":""Wed, 3 Aug 2022 07:00:16 GMT""}]","2022-08-04"
"2208.01877","Willem Fouch\'e","Willem Fouche, Safari Mukeru","Local time of Martin-Lof Brownian motion",,,,,"cs.CC math.PR","http://creativecommons.org/publicdomain/zero/1.0/","  In this paper we study the local times of Brownian motion from the point of
view of algorithmic randomness. We introduce the notion of effective local time
and show that any path which is Martin-L\""of random with respect to the Wiener
measure has continuous effective local times at every computable point. Finally
we obtain a new simple representation of classical Brownian local times,
computationally expressed.
","[{""version"":""v1"",""created"":""Wed, 3 Aug 2022 07:02:12 GMT""}]","2022-08-04"
"2208.01878","Nagarajan Sinthuja","N. Sinthuja, S. Rajasekar and M. Senthilvelan","Instability of single- and double-periodic waves in the fourth-order
  nonlinear Schr\""odinger equation","21 pages, 9 figures, Submitted to Journal",,,,"nlin.SI nlin.PS","http://arxiv.org/licenses/nonexclusive-distrib/1.0/","  We compute the instability rate for single- and double-periodic wave
solutions of a fourth-order nonlinear Schr\""odinger equation. The single- and
double-periodic solutions of a fourth-order nonlinear Schr\""odinger equation
are derived in terms of Jacobian elliptic functions such as $dn$, $cn$, and
$sn$. From the spectral problem, we compute Lax and stability spectrum of
single-periodic waves. We then calculate the instability rate of
single-periodic waves (periodic in the spatial variable). We also obtain the
Lax and stability spectrum of double-periodic wave solutions for different
values of the elliptic modulus parameter. We also highlight certain novel
features exhibited by the considered system. We then compute instability rate
for two families of double-periodic wave solutions of the considered equation
for different values of the system parameter. Our results reveal that the
instability growth rate is higher for the double-periodic waves due to the
fourth-order dispersion parameter when compared to single-periodic waves.
","[{""version"":""v1"",""created"":""Wed, 3 Aug 2022 07:05:30 GMT""}]","2022-08-04"
"2208.01879","Jun He Prof.","Dan Song, Lin-Qing Song, Shu-Yi Kong, Jun He","Possible molecular states from interactions of charmed baryons","7 pages, 5 figures","Phys. Rev. D 106, 074030 (2022)","10.1103/PhysRevD.106.074030",,"hep-ph nucl-th","http://arxiv.org/licenses/nonexclusive-distrib/1.0/","  In this work, we perform a systematic study of possible molecular states
composed of two charmed baryons including hidden-charm systems
$\Lambda_c\bar{\Lambda}_c$, $\Sigma_c^{(*)}\bar{\Sigma}_c^{(*)}$, and
$\Lambda_c\bar{\Sigma}_c^{(*)}$, and corresponding double-charm systems
$\Lambda_c\Lambda_c$, $\Sigma_c^{(*)}\Sigma_c^{(*)}$, and
$\Lambda_c\Sigma_c^{(*)}$. With the help of the heavy quark chiral effective
Lagrangians, the interactions are described with $\pi$, $\rho$, $\eta$,
$\omega$, $\phi$, and $\sigma$ exchanges. The potential kernels are
constructed, and inserted into the quasipotential Bethe-Salpeter equation. The
bound states from the interactions considered is studied by searching for the
poles of the scattering amplitude. The results suggest that strong attractions
exist in both hidden-charm and double-charm systems considered in the current
work, and bound states can be produced in most of the systems. More experiment
studies about these molecular states are suggested though the nucleon-nucleon
collison at LHC and nucleon-antinucleon collison at $\rm \bar{P}ANDA$.
","[{""version"":""v1"",""created"":""Wed, 3 Aug 2022 07:06:01 GMT""},{""version"":""v2"",""created"":""Mon, 8 Aug 2022 03:18:05 GMT""},{""version"":""v3"",""created"":""Tue, 3 Jan 2023 12:11:40 GMT""}]","2023-01-04"
"2208.01880","Hao Zhou Mr","Yujie Yao, Hao Zhou, Melike Erol-Kantarci","Joint Sensing and Communications for Deep Reinforcement Learning-based
  Beam Management in 6G",,,,,"eess.SY cs.SY","http://creativecommons.org/publicdomain/zero/1.0/","  User location is a piece of critical information for network management and
control. However, location uncertainty is unavoidable in certain settings
leading to localization errors. In this paper, we consider the user location
uncertainty in the mmWave networks, and investigate joint vision-aided sensing
and communications using deep reinforcement learning-based beam management for
future 6G networks. In particular, we first extract pixel characteristic-based
features from satellite images to improve localization accuracy. Then we
propose a UK-medoids based method for user clustering with location
uncertainty, and the clustering results are consequently used for the beam
management. Finally, we apply the DRL algorithm for intra-beam radio resource
allocation. The simulations first show that our proposed vision-aided method
can substantially reduce the localization error. The proposed UK-medoids and
DRL based scheme (UKM-DRL) is compared with two other schemes: K-means based
clustering and DRL based resource allocation (K-DRL) and UK-means based
clustering and DRL based resource allocation (UK-DRL). The proposed method has
17.2% higher throughput and 7.7% lower delay than UK-DRL, and more than doubled
throughput and 55.8% lower delay than K-DRL.
","[{""version"":""v1"",""created"":""Wed, 3 Aug 2022 07:20:33 GMT""}]","2022-08-04"
"2208.01881","YuLi Sun","Yuli Sun, Lin Lei, Dongdong Guan, Gangyao Kuang, Li Liu","Graph Signal Processing for Heterogeneous Change Detection Part I:
  Vertex Domain Filtering",,,,,"cs.CV eess.IV","http://arxiv.org/licenses/nonexclusive-distrib/1.0/","  This paper provides a new strategy for the Heterogeneous Change Detection
(HCD) problem: solving HCD from the perspective of Graph Signal Processing
(GSP). We construct a graph for each image to capture the structure
information, and treat each image as the graph signal. In this way, we convert
the HCD into a GSP problem: a comparison of the responses of the two signals on
different systems defined on the two graphs, which attempts to find structural
differences (Part I) and signal differences (Part II) due to the changes
between heterogeneous images. In this first part, we analyze the HCD with GSP
from the vertex domain. We first show that for the unchanged images, their
structures are consistent, and then the outputs of the same signal on systems
defined on the two graphs are similar. However, once a region has changed, the
local structure of the image changes, i.e., the connectivity of the vertex
containing this region changes. Then, we can compare the output signals of the
same input graph signal passing through filters defined on the two graphs to
detect changes. We design different filters from the vertex domain, which can
flexibly explore the high-order neighborhood information hidden in original
graphs. We also analyze the detrimental effects of changing regions on the
change detection results from the viewpoint of signal propagation. Experiments
conducted on seven real data sets show the effectiveness of the vertex domain
filtering based HCD method.
","[{""version"":""v1"",""created"":""Wed, 3 Aug 2022 07:22:45 GMT""},{""version"":""v2"",""created"":""Mon, 8 Aug 2022 02:32:15 GMT""}]","2022-08-09"
"2208.01882","Shigeo Kimura","Shigeo S. Kimura, Kenji Toma, Hirofumi Noda, Kazuhiro Hada","Magnetic Reconnection in Black-Hole Magnetospheres: Lepton Loading into
  Jets, Superluminal Radio Blobs, and Multi-wavelength Flares","14 pages, 5 figures, 1 table, accepted for publication in ApJL",,"10.3847/2041-8213/ac8d5a",,"astro-ph.HE","http://arxiv.org/licenses/nonexclusive-distrib/1.0/","  Supermassive black holes in active galactic nuclei launch relativistic jets,
as indicated by observed superluminal radio blobs. The energy source of these
jets is widely discussed in the theoretical framework of Blandford-Znajek
process, the electromagnetic energy extraction from rotating black holes (BHs),
while formation mechanism of the radio blobs in the
electromagnetically-dominated jets has been a long-standing problem. Recent
high-resolution magnetohydrodynamic simulations of magnetically arrested disks
exhibited magnetic reconnection in a transient magnetically-dominated part of
the equatorial disk near the BH horizon, which led to a promising scenario of
efficient MeV gamma-ray production and subsequent electron-positron pair
loading into BH magnetosphere. We develop this scenario to build a theoretical
framework on energetics, timescales and particle number density of the
superluminal radio blobs and discuss observable signatures in other wavebands.
We analytically show that the non-thermal electrons emit broadband photons from
optical to multi-MeV bands. The electron-positron pairs produced in the
magnetosphere are optically thick for synchrotron-self absorption, so that the
injected energy is stored in the plasma. The stored energy is enough to power
the superluminal radio blobs observed in M87. This scenario predicts rather dim
radio blobs around Sgr A*, which are consistent with no clear detection by
current facilities. In addition, this scenario inevitably produces strong X-ray
flares in a short timescale, which will be detectable by future X-ray
satellites.
","[{""version"":""v1"",""created"":""Wed, 3 Aug 2022 07:23:31 GMT""},{""version"":""v2"",""created"":""Wed, 31 Aug 2022 14:27:52 GMT""}]","2022-10-05"
"2208.01883","Daniela Pagnani","Daniela Pagnani, {\L}ukasz H. Kocewiak, Jesper Hjerrild, Frede
  Blaabjerg and Claus Leth Bak","Integrating Black Start Capabilities into Offshore Wind Farms by
  Grid-Forming Batteries","12 pages, 11 figures, journal (submitted to IET Renewable Power
  Generation)","IET Renewable Power Generation, 2023","10.1049/rpg2.12667",,"eess.SY cs.SY","http://creativecommons.org/licenses/by-nc-nd/4.0/","  Power systems are currently experiencing a transition towards decarbonisation
of electrical generation through large-scale deployment of renewable energy
sources. These are gradually replacing conventional thermal power plants which
today are the main providers of black start (BS) services. Consequently, in
case of a total/partial blackout, conventional black-start resources are not
ready for operation. Offshore wind farms (OWFs), with their large capacity and
fast controllers, have potential as novel BS units. This new service introduces
a need for a new design for wind power systems to be able to fulfil the black
start requirements for non-traditional generation units. In this paper,
challenges, and possible solutions in integrating BS services into OWFs will be
presented. A first challenge is represented by the implementation of a BS unit.
The BS unit should be capable of firstly forming the wind farm power island and
withstanding transient phenomena due to energisation. There could be several
different solutions, e.g., the integration of grid-forming converters in the
wind farm design which could be battery energy storage systems (BESSs). In this
paper, specific challenges are analysed using simulations on a wind farm
equipped with a grid-forming BESS, and the proposed solutions discussed. It can
be concluded that a hybrid system comprised of a BESS and an OWF, in
combination with novel technologies such as grid-forming control,
soft-charging, etc. represents a feasible proposal for being able to provide BS
services with OWFs.
","[{""version"":""v1"",""created"":""Wed, 3 Aug 2022 07:24:41 GMT""},{""version"":""v2"",""created"":""Fri, 11 Nov 2022 10:08:13 GMT""}]","2023-02-27"
"2208.01884","Avdhesh Kumar Dr","Wojciech Florkowski, Avdhesh Kumar, Aleksas Mazeliauskas, Radoslaw
  Ryblewski","Longitudinal spin polarization of $\Lambda-$hyperons in a thermal model","6 pages, 2 figures, 1 table, Contribution to the proceedings of
  XXIXth International Conference on Ultra-relativistic Nucleus-Nucleus
  Collisions (QM 2022)",,,,"hep-ph nucl-th","http://arxiv.org/licenses/nonexclusive-distrib/1.0/","  We briefly review the thermal model predictions related to longitudinal spin
polarization of $\Lambda-$hyperons emitted from a hot and rotating hadronic
medium produced in the non-central relativistic heavy ion collisions.
","[{""version"":""v1"",""created"":""Wed, 3 Aug 2022 07:27:03 GMT""}]","2022-08-04"
"2208.01885","Min Sha","Bernard Mans, Min Sha, Igor E. Shparlinski, Daniel Sutantyo","Functional graphs of families of quadratic polynomials","30 pages",,,,"math.NT math.CO","http://arxiv.org/licenses/nonexclusive-distrib/1.0/","  We study functional graphs generated by several quadratic polynomials, acting
simultaneously on a finite field of odd characteristic. We obtain several
results about the number of leaves in such graphs. In particular, in the case
of graphs generated by three polynomials, we relate the distribution of leaves
to the Sato-Tate distribution of Frobenius traces of elliptic curves. We also
present extensive numerical results which we hope may shed some light on the
distribution of leaves for larger families of polynomials.
","[{""version"":""v1"",""created"":""Wed, 3 Aug 2022 07:32:19 GMT""},{""version"":""v2"",""created"":""Thu, 2 Feb 2023 12:41:48 GMT""}]","2023-02-03"
"2208.01886","Majid Rafiei","Majid Rafiei, Gamal Elkoumy, Wil M.P. van der Aalst","Quantifying Temporal Privacy Leakage in Continuous Event Data Publishing",,,,,"cs.CR","http://creativecommons.org/licenses/by/4.0/","  Process mining employs event data extracted from different types of
information systems to discover and analyze actual processes. Event data often
contain highly sensitive information about the people who carry out activities
or the people for whom activities are performed. Therefore, privacy concerns in
process mining are receiving increasing attention. To alleviate privacy-related
risks, several privacy preservation techniques have been proposed. Differential
privacy is one of these techniques which provides strong privacy guarantees.
However, the proposed techniques presume that event data are released in only
one shot, whereas business processes are continuously executed. Hence, event
data are published repeatedly, resulting in additional risks. In this paper, we
demonstrate that continuously released event data are not independent, and the
correlation among different releases can result in privacy degradation when the
same differential privacy mechanism is applied to each release. We quantify
such privacy degradation in the form of temporal privacy leakages. We apply
continuous event data publishing scenarios to real-life event logs to
demonstrate privacy leakages.
","[{""version"":""v1"",""created"":""Wed, 3 Aug 2022 07:32:26 GMT""},{""version"":""v2"",""created"":""Thu, 29 Sep 2022 16:07:45 GMT""}]","2022-09-30"
