"2208.02039","Lars Bojer Madsen","Lars Bojer Madsen","Disappearance and reappearance of above-threshold-ionization peaks","5 pages, 2 figures",,,,"physics.atom-ph quant-ph","http://arxiv.org/licenses/nonexclusive-distrib/1.0/","  It is shown that above-threshold ionization peaks disappear when the kinetic
energy associated with the nondipole radiation-pressure-induced photoelectron
momentum in the laser propagation direction becomes comparable to the photon
energy, and how peaks can be made reappear if knowledge of the length and
direction of the photoelectron momentum is at hand and an
emission-direction-dependent momentum shift is accounted for. The reported
findings should be observable with intense mid-infrared laser pulses.
","[{""version"":""v1"",""created"":""Wed, 3 Aug 2022 13:02:37 GMT""}]","2022-08-04"
"2208.02040","Alberto Maspero","Emanuele Haus and Beatrice Langella and Alberto Maspero and Michela
  Procesi","Reducibility and nonlinear stability for a quasi-periodically forced NLS",,,,,"math.AP","http://creativecommons.org/licenses/by/4.0/","  Motivated by the problem of long time stability vs. instability of KAM tori
of the Nonlinear cubic Schr\""odinger equation (NLS) on the two dimensional
torus $\mathbb T^2:= (\mathbb R/2\pi \mathbb Z)^2$, we consider a
quasi-periodically forced NLS equation on $\mathbb T^2$ arising from the
linearization of the NLS at a KAM torus. We prove a reducibility result as well
as long time stability of the origin. The main novelty is to obtain the precise
asymptotic expansion of the frequencies which allows us to impose Melnikov
conditions at arbitrary order.
","[{""version"":""v1"",""created"":""Wed, 3 Aug 2022 13:07:33 GMT""}]","2022-08-04"
"2208.02041","Adam Peters","Adam B. Peters, Chuhong Wang, Dajie Zhang, Alberto Hernandez, Dennis
  C. Nagle, Tim Mueller, James B. Spicer","Reactive Laser Synthesis of Ultra-high-temperature Ceramics HfC, ZrC,
  TiC, HfN, ZrN, and TiN for Additive Manufacturing","58 pages, 17 figures",,,,"cond-mat.mtrl-sci","http://creativecommons.org/licenses/by-nc-nd/4.0/","  Ultra-high-temperature ceramics (UHTCs) are optimal structural materials for
applications that require extreme temperature resilience, resistance to
chemically aggressive environments, wear, and mechanical stress. Processing
UHTCs with laser-based additive manufacturing (AM) has not been fully realized
due to a variety of obstacles. In this work, selective laser reaction sintering
(SLRS) techniques were investigated for the production of near net-shape UHTC
ceramics such as HfC, ZrC, TiC, HfN, ZrN, and TiN. Group IV transition metal
and metal oxide precursor materials were chemically converted and
reaction-bonded into layers of UHTCs using single-step selective laser
processing in CH4 or NH3 gas that might be compatible with prevailing powder
bed fusion techniques. Conversion of either metals (Hf, Zr and Ti) or metal
oxides (HfO2, ZrO2, and TiO2) particles was first investigated to examine
reaction mechanisms and volume changes associated with SLRS of single-component
precursor systems. SLRS processing of metal or metal oxide alone produced near
stoichiometric UHTC phases with yields up to 100 wt% total for carbides and
nitrides. However, for single component precursors, gas-solid reactivity
induced volumetric changes resulted in residual stresses and cracking in the
product layer. To mitigate conversion-induced stresses, composite metal/metal
oxide precursors were employed to compensate for the volume changes of either
the metal (which expands during conversion) or the metal oxide precursor (which
contracts).
","[{""version"":""v1"",""created"":""Wed, 3 Aug 2022 13:08:31 GMT""},{""version"":""v2"",""created"":""Wed, 7 Dec 2022 02:38:58 GMT""}]","2022-12-08"
"2208.02042","Tim Finin","Ramin Ayanzadeh, John E Dorband, Milton Halem, Tim Finin","Quantum-Assisted Greedy Algorithms","in Proceedings of the 2022 International Geoscience and Remote
  Sensing Symposium (IGARSS)",,,,"quant-ph cs.ET","http://creativecommons.org/licenses/by/4.0/","  We show how to leverage quantum annealers (QAs) to better select candidates
in greedy algorithms. Unlike conventional greedy algorithms that employ
problem-specific heuristics for making locally optimal choices at each stage,
we use QAs that sample from the ground state of problem-dependent Hamiltonians
at cryogenic temperatures and use retrieved samples to estimate the probability
distribution of problem variables. More specifically, we look at each spin of
the Ising model as a random variable and contract all problem variables whose
corresponding uncertainties are negligible. Our empirical results on a D-Wave
2000Q quantum processor demonstrate that the proposed quantum-assisted greedy
algorithm (QAGA) scheme can find notably better solutions compared to the
state-of-the-art techniques in the realm of quantum annealing
","[{""version"":""v1"",""created"":""Wed, 3 Aug 2022 13:09:17 GMT""}]","2022-08-04"
"2208.02043","Jonathan Grizou","Emma Poliakova, Fraser Dempster, Abubakr Mahmood, Jonathan Grizou","SmartControllerJS: A JavaScript library to turn smartphones into
  controllers for web-based interactive experiments",,,,,"cs.HC","http://creativecommons.org/licenses/by-nc-sa/4.0/","  We introduce SmartControllerJS, a new JavaScript library for fast,
cost-effective designing of web applications controlled via everyday
smartphones. At its core, SmartControllerJS establishes a connection between
two webpages, one page running on a desktop browser and the other on the user's
smartphone. The smartphone webpage loads a controller interface allowing users
to control a web application running on their computer's browser. The
SmartControllerJS framework enables fast iteration loops when designing
interactive user experiments because it has minimal friction and allows for
scaling, while having no running costs. We first describe how this library is
built, how it can be used, and provide interactive examples. We then present
two games designed for public screens along with results from user studies
evaluating acceptability and ease of use. Finally, we implement a custom
controller based on user feedback and introduce connection monitoring tools. We
believe SmartControllerJS can accelerate the design of interactive experiments
for researchers in Human-Computer Interaction, and be a useful tool for
educational projects. All our code is available at
https://github.com/SmartControllerJS and links to all demos can be found in
Table I. To explore our demos, we recommend reading this work on a desktop
computer with your smartphone in hand.
","[{""version"":""v1"",""created"":""Wed, 3 Aug 2022 13:11:42 GMT""},{""version"":""v2"",""created"":""Mon, 8 Aug 2022 14:05:43 GMT""}]","2022-08-09"
"2208.02044","Pranab Parimal Biswas","Pranab Parimal Biswas, Cosme Milesi-Brault, Alfredo Bl\'azquez
  Mart\'inez, Naveen Aruchamy, Longfei Song, Veronika Kovacova, Sebastjan
  Glinsek, Torsten Granzow, Emmanuel Defay, Mael Guennou","Birefringence induced by antiferroelectric switching in transparent
  polycrystalline $PbZr_{0.95}Ti_{0.05}O_{3}$ film","15 pages, 5 figures","Phys. Rev. Materials 6, L091403 (2022)","10.1103/PhysRevMaterials.6.L091403",,"cond-mat.mtrl-sci","http://arxiv.org/licenses/nonexclusive-distrib/1.0/","  The most characteristic functional property of antiferroelectric materials is
the possibility to induce a phase transition from a non-polar to a polar phase
by an electric field. Here, we investigate the effect of this field-induced
phase transition on the birefringence change of $PbZr_{0.95}Ti_{0.05}O_{3}$. We
use a transparent polycrystalline $PbZr_{0.95}Ti_{0.05}O_{3}$ film grown on
$PbTiO_{3}/HfO_{2}/SiO_{2}$ with interdigitated electrodes to directly
investigate changes in birefringence in a simple transmission geometry. In
spite of the polycrystalline nature of the film and its moderate thickness, the
field-induced transition produces a sizeable effect observable under a
polarized microscope. The film in its polar phase is found to behave like a
homogeneous birefringent medium. The time evolution of this field-induced
birefringence provides information about irreversibilities in the
antiferroelectric switching process and its slow dynamics. The change in
birefringence has two main contributions, one that responds briskly (~ 0.5 s),
and a slower one that rises and saturates over a period of as long as 30
minutes. Possible origins for this long saturation and relaxation times are
discussed.
","[{""version"":""v1"",""created"":""Wed, 3 Aug 2022 13:12:28 GMT""}]","2022-09-21"
"2208.02045","Jonathan Noel","Natalie Behague and Natasha Morrison and Jonathan A. Noel","Common Pairs of Graphs","50 pages",,,,"math.CO cs.DM","http://creativecommons.org/licenses/by/4.0/","  A graph $H$ is said to be common if the number of monochromatic labelled
copies of $H$ in a red/blue edge colouring of a large complete graph is
asymptotically minimized by a random colouring with an equal proportion of each
colour. We extend this notion to an asymmetric setting. That is, we define a
pair $(H_1,H_2)$ of graphs to be $(p,1-p)$-common if a particular linear
combination of the density of $H_1$ in red and $H_2$ in blue is asymptotically
minimized by a random colouring in which each edge is coloured red with
probability $p$ and blue with probability $1-p$. We extend many of the results
on common graphs to this asymmetric setting. In addition, we obtain several
novel results for common pairs of graphs with no natural analogue in the
symmetric setting. We also obtain new examples of common graphs in the
classical sense and propose several open problems.
","[{""version"":""v1"",""created"":""Wed, 3 Aug 2022 13:15:35 GMT""},{""version"":""v2"",""created"":""Thu, 1 Dec 2022 19:20:00 GMT""}]","2022-12-05"
"2208.02047","Xuchen Wang","Xuchen Wang, Mohammad Sajjad Mirmoosa, Sergei A. Tretyakov","Controlling surface waves with temporal discontinuities of metasurfaces","19 pages, 10 figures",,,,"physics.app-ph","http://arxiv.org/licenses/nonexclusive-distrib/1.0/","  In this paper, we investigate the scattering of surface waves on reactive
impedance boundaries when the surface impedance undergoes a sudden change in
time. We report three exotic wave phenomena. First, it is shown that by
switching the value of the surface capacitance of the boundary, the velocity of
surface waves can be fully controlled, and the power of reflected and
transmitted surface waves are amplified. Second, we show that when a capacitive
boundary is switched to an inductive one, the surface wave stops completely,
with a ""frozen"" static magnetic field distribution. The static magnetic fields
are ""melt"" and restore propagating surface waves when the boundary is switched
back to a capacitive one. Third, we show that temporal jumps of the boundary
impedance couple free-space propagating waves to the surface wave, which is an
analog to a spatial prism. These interesting effects enabled by temporal jumps
of metasurface properties open up new possibilities for the generation and
control of surface waves.
","[{""version"":""v1"",""created"":""Wed, 3 Aug 2022 13:17:08 GMT""}]","2022-08-04"
"2208.02048","Jary Pomponi","Jary Pomponi, Simone Scardapane, Aurelio Uncini","Centroids Matching: an efficient Continual Learning approach operating
  in the embedding space","Submitted to Transactions on Machine Learning Research (TMLR)",,,,"cs.LG stat.ML","http://creativecommons.org/licenses/by/4.0/","  Catastrophic forgetting (CF) occurs when a neural network loses the
information previously learned while training on a set of samples from a
different distribution, i.e., a new task. Existing approaches have achieved
remarkable results in mitigating CF, especially in a scenario called task
incremental learning. However, this scenario is not realistic, and limited work
has been done to achieve good results on more realistic scenarios. In this
paper, we propose a novel regularization method called Centroids Matching,
that, inspired by meta-learning approaches, fights CF by operating in the
feature space produced by the neural network, achieving good results while
requiring a small memory footprint. Specifically, the approach classifies the
samples directly using the feature vectors produced by the neural network, by
matching those vectors with the centroids representing the classes from the
current task, or all the tasks up to that point. Centroids Matching is faster
than competing baselines, and it can be exploited to efficiently mitigate CF,
by preserving the distances between the embedding space produced by the model
when past tasks were over, and the one currently produced, leading to a method
that achieves high accuracy on all the tasks, without using an external memory
when operating on easy scenarios, or using a small one for more realistic ones.
Extensive experiments demonstrate that Centroids Matching achieves accuracy
gains on multiple datasets and scenarios.
","[{""version"":""v1"",""created"":""Wed, 3 Aug 2022 13:17:16 GMT""},{""version"":""v2"",""created"":""Sat, 10 Sep 2022 14:38:27 GMT""}]","2022-09-13"
"2208.02049","Ziyi Wang","Ziyi Wang, Bo Lu, Yonghao Long, Fangxun Zhong, Tak-Hong Cheung, Qi
  Dou, Yunhui Liu","AutoLaparo: A New Dataset of Integrated Multi-tasks for Image-guided
  Surgical Automation in Laparoscopic Hysterectomy","Accepted at MICCAI 2022",,,,"cs.CV","http://arxiv.org/licenses/nonexclusive-distrib/1.0/","  Computer-assisted minimally invasive surgery has great potential in
benefiting modern operating theatres. The video data streamed from the
endoscope provides rich information to support context-awareness for
next-generation intelligent surgical systems. To achieve accurate perception
and automatic manipulation during the procedure, learning based technique is a
promising way, which enables advanced image analysis and scene understanding in
recent years. However, learning such models highly relies on large-scale,
high-quality, and multi-task labelled data. This is currently a bottleneck for
the topic, as available public dataset is still extremely limited in the field
of CAI. In this paper, we present and release the first integrated dataset
(named AutoLaparo) with multiple image-based perception tasks to facilitate
learning-based automation in hysterectomy surgery. Our AutoLaparo dataset is
developed based on full-length videos of entire hysterectomy procedures.
Specifically, three different yet highly correlated tasks are formulated in the
dataset, including surgical workflow recognition, laparoscope motion
prediction, and instrument and key anatomy segmentation. In addition, we
provide experimental results with state-of-the-art models as reference
benchmarks for further model developments and evaluations on this dataset. The
dataset is available at https://autolaparo.github.io.
","[{""version"":""v1"",""created"":""Wed, 3 Aug 2022 13:17:23 GMT""}]","2022-08-04"
"2208.02050","Xuding Zhu","Jialu Zhu and Xuding Zhu","Minimum non-chromatic-$\lambda$-choosable graphs","13 pages",,,,"math.CO","http://arxiv.org/licenses/nonexclusive-distrib/1.0/","  For a multi-set $\lambda=\{k_1,k_2, \ldots, k_q\}$ of positive integers, let
$k_{\lambda} = \sum_{i=1}^q k_i$.
  A $\lambda$-list assignment of $G$ is a list assignment $L$ of $G$ such that
the colour set $\bigcup_{v \in V(G)}L(v)$ can be partitioned into the disjoint
union $C_1 \cup C_2 \cup \ldots \cup C_q$ of $q$ sets so that for each $i$ and
each vertex $v$ of $G$, $|L(v) \cap C_i| \ge k_i$. We say $G$ is
$\lambda$-choosable if $G$ is $L$-colourable for any $\lambda$-list assignment
$L$ of $G$. The concept of $\lambda$-choosability puts $k$-colourability and
$k$-choosability in the same framework: If $\lambda = \{k\}$, then
$\lambda$-choosability is equivalent to $k$-choosability; if $\lambda$ consists
of $k $ copies of $1$, then $\lambda$-choosability is equivalent to $k
$-colourability. If $G$ is $\lambda$-choosable, then $G$ is
$k_{\lambda}$-colourable. On the other hand, there are $k_{\lambda}$-colourable
graphs that are not $\lambda$-choosable, provided that $\lambda$ contains an
integer larger than $1$. Let $\phi(\lambda)$ be the minimum number of vertices
in a $k_{\lambda}$-colourable non-$\lambda$-choosable graph. This paper
determines the value of $\phi(\lambda)$ for all $\lambda$.
","[{""version"":""v1"",""created"":""Wed, 3 Aug 2022 13:18:14 GMT""}]","2022-08-04"
"2208.02051","Leonid Levitov","Zhiyu Dong, Leonid Levitov","Chiral Stoner magnetism in Dirac bands","9 pgs, 1 fig",,,,"cond-mat.mes-hall","http://creativecommons.org/licenses/by/4.0/","  We argue that Stoner magnetism in bands endowed with Berry curvature is
profoundly influenced by the chiral interaction between Berry's orbital
magnetization and spin chirality density. The key effect is that carriers
moving in the presence of a spin texture see it as a source of a
pseudo-magnetic field coupled to their orbital motion through a chiral
Aharonov-Bohm effect. This interaction favors chiral spin textures such as
skyrmions -- the topologically protected objects with particle-like properties,
stabilized in the ground state. The chiral interaction softens the threshold
for Stoner instability, rendering chiral spin-ordered phases readily accessible
under realistic conditions. We illustrate this effect for a graphene multilayer
model, with magnetization and pseudo-magnetic fields taking different values in
different valleys, yet the results are applicable to generic Stoner magnets.
","[{""version"":""v1"",""created"":""Wed, 3 Aug 2022 13:18:42 GMT""},{""version"":""v2"",""created"":""Wed, 16 Nov 2022 11:45:11 GMT""}]","2022-11-17"
"2208.02052","Lorenzo Betti","Lorenzo Betti, Carlo Abrate, Andreas Kaltenbrunner","Large scale analysis of gender bias and sexism in song lyrics",,"EPJ Data Sci. 12, 10 (2023)","10.1140/epjds/s13688-023-00384-8",,"cs.CY cs.CL","http://arxiv.org/licenses/nonexclusive-distrib/1.0/","  We employ Natural Language Processing techniques to analyse 377808 English
song lyrics from the ""Two Million Song Database"" corpus, focusing on the
expression of sexism across five decades (1960-2010) and the measurement of
gender biases. Using a sexism classifier, we identify sexist lyrics at a larger
scale than previous studies using small samples of manually annotated popular
songs. Furthermore, we reveal gender biases by measuring associations in word
embeddings learned on song lyrics. We find sexist content to increase across
time, especially from male artists and for popular songs appearing in Billboard
charts. Songs are also shown to contain different language biases depending on
the gender of the performer, with male solo artist songs containing more and
stronger biases. This is the first large scale analysis of this type, giving
insights into language usage in such an influential part of popular culture.
","[{""version"":""v1"",""created"":""Wed, 3 Aug 2022 13:18:42 GMT""},{""version"":""v2"",""created"":""Tue, 30 Aug 2022 14:12:58 GMT""},{""version"":""v3"",""created"":""Sun, 2 Apr 2023 21:13:59 GMT""},{""version"":""v4"",""created"":""Thu, 20 Apr 2023 20:05:09 GMT""},{""version"":""v5"",""created"":""Tue, 2 May 2023 16:52:30 GMT""}]","2023-05-03"
"2208.02053","Travis Driver","Travis Driver, Katherine Skinner, Mehregan Dor, Panagiotis Tsiotras","AstroVision: Towards Autonomous Feature Detection and Description for
  Missions to Small Bodies Using Deep Learning",,,"10.1016/j.actaastro.2023.01.009",,"astro-ph.IM astro-ph.EP cs.CV cs.RO","http://arxiv.org/licenses/nonexclusive-distrib/1.0/","  Missions to small celestial bodies rely heavily on optical feature tracking
for characterization of and relative navigation around the target body. While
deep learning has led to great advancements in feature detection and
description, training and validating data-driven models for space applications
is challenging due to the limited availability of large-scale, annotated
datasets. This paper introduces AstroVision, a large-scale dataset comprised of
115,970 densely annotated, real images of 16 different small bodies captured
during past and ongoing missions. We leverage AstroVision to develop a set of
standardized benchmarks and conduct an exhaustive evaluation of both
handcrafted and data-driven feature detection and description methods. Next, we
employ AstroVision for end-to-end training of a state-of-the-art, deep feature
detection and description network and demonstrate improved performance on
multiple benchmarks. The full benchmarking pipeline and the dataset will be
made publicly available to facilitate the advancement of computer vision
algorithms for space applications.
","[{""version"":""v1"",""created"":""Wed, 3 Aug 2022 13:18:44 GMT""}]","2023-01-16"
"2208.02054","Daniel Gray","Dmitriy Dmitrishin and Daniel Gray and Alexander Stokolos and Iryna
  Tarasenko","An extremal problem for odd univalent polynomials","2 figures",,,,"math.CV","http://creativecommons.org/licenses/by/4.0/","  For the univalent polynomials $F(z) = \sum\limits_{j=1}^{N} a_j z^{2j-1}$
with real coefficients and normalization \(a_1 = 1\) we solve the extremal
problem \[
  \min_{a_j:\,a_1=1} \left( -iF(i) \right) = \min_{a_j:\,a_1=1}
\sum\limits_{j=1}^{N} {(-1)^{j+1} a_j}. \] We show that the solution is
$\frac12 \sec^2{\frac{\pi}{2N+2}},$ and the extremal polynomial \[
  \sum_{j = 1}^N \frac{U'_{2(N-j+1)} \left(
\cos\left(\frac{\pi}{2N+2}\right)\right)}{U'_{2N} \left(
\cos\left(\frac{\pi}{2N+2}\right)\right)}z^{2j-1} \] is unique and univalent,
where the $U_j(x)$ are the Chebyshev polynomials of the second kind and
$U'_j(x)$ denotes the derivative. As an application, we obtain the estimate of
the Koebe radius for the odd univalent polynomials in $\mathbb D$ and formulate
several conjectures.
","[{""version"":""v1"",""created"":""Wed, 3 Aug 2022 13:18:49 GMT""}]","2022-08-04"
"2208.02055","Angelica Albertini","Angelica Albertini, Alessandro Nagar, Adam Pound, Niels Warburton,
  Barry Wardell, Leanne Durkan, and Jeremy Miller","Comparing second-order gravitational self-force and effective one body
  waveforms from inspiralling, quasi-circular and nonspinning black hole
  binaries II: the large-mass-ratio case","14 pages, 8 figures, published on Phys. Rev. D","Phys.Rev.D 106 (2022) 8, 084062","10.1103/PhysRevD.106.084062",,"gr-qc","http://arxiv.org/licenses/nonexclusive-distrib/1.0/","  We compare recently computed waveforms from second-order gravitational
self-force (GSF) theory to those generated by a new, GSF-informed, effective
one body (EOB) waveform model for (spin-aligned, eccentric) inspiralling black
hole binaries with large mass ratios. We focus on quasi-circular, nonspinning,
configurations and perform detailed GSF/EOB waveform phasing comparisons,
either in the time domain or via the gauge-invariant dimensionless function
$Q_\omega\equiv \omega^2/\dot{\omega}$, where $\omega$ is the gravitational
wave frequency. The inclusion of high-PN test-mass terms within the EOB
radiation reaction (notably, up to 22PN) is crucial to achieve an EOB/GSF
phasing agreement below 1~rad up to the end of the inspiral for mass ratios up
to 500. For larger mass ratios, up to $5\times 10^4$, the contribution of
horizon absorption becomes more and more important and needs to be accurately
modeled. Our results indicate that our GSF-informed EOB waveform model is a
promising tool to describe waveforms generated by either intermediate or
extreme mass ratio inspirals for future gravitational wave detectors
","[{""version"":""v1"",""created"":""Wed, 3 Aug 2022 13:24:02 GMT""},{""version"":""v2"",""created"":""Wed, 2 Nov 2022 11:10:37 GMT""}]","2022-11-03"
"2208.02056","A. Feder Cooper","A. Feder Cooper and Karen Levy","Fast or Accurate? Governing Conflicting Goals in Highly Autonomous
  Vehicles","Vol. 20, pp. 249-277","Colorado Technology Law Journal 2022",,,"cs.CY","http://creativecommons.org/licenses/by/4.0/","  The tremendous excitement around the deployment of autonomous vehicles (AVs)
comes from their purported promise. In addition to decreasing accidents, AVs
are projected to usher in a new era of equity in human autonomy by providing
affordable, accessible, and widespread mobility for disabled, elderly, and
low-income populations. However, to realize this promise, it is necessary to
ensure that AVs are safe for deployment, and to contend with the risks AV
technology poses, which threaten to eclipse its benefits. In this Article, we
focus on an aspect of AV engineering currently unexamined in the legal
literature, but with critical implications for safety, accountability,
liability, and power. Specifically, we explain how understanding the
fundamental engineering trade-off between accuracy and speed in AVs is critical
for policymakers to regulate the uncertainty and risk inherent in AV systems.
We discuss how understanding the trade-off will help create tools that will
enable policymakers to assess how the trade-off is being implemented. Such
tools will facilitate opportunities for developing concrete, ex ante AV safety
standards and conclusive mechanisms for ex post determination of accountability
after accidents occur. This will shift the balance of power from manufacturers
to the public by facilitating effective regulation, reducing barriers to tort
recovery, and ensuring that public values like safety and accountability are
appropriately balanced.
","[{""version"":""v1"",""created"":""Wed, 3 Aug 2022 13:24:25 GMT""}]","2022-08-04"
