"2208.06725","Dean Baskin","Dean Baskin and Kiril Datchev","Propagation of singularities for the wave equation","9 pages, 2 figures; version 2: corrected a subtle mistake in Lemma 2
  and the regularization argument",,,,"math.AP","http://arxiv.org/licenses/nonexclusive-distrib/1.0/","  This expository note gives a digest version of Hormander's propagation of
singularities theorem for the wave equation.
","[{""version"":""v1"",""created"":""Sat, 13 Aug 2022 20:21:22 GMT""},{""version"":""v2"",""created"":""Mon, 20 Feb 2023 19:09:09 GMT""}]","2023-02-22"
"2208.06726","Yanmeng Xing","Chongxin Zhong, Yanmeng Xing, Ying Fan, and An Zeng","Predicting the cascading dynamics in complex networks via the bimodal
  failure size distribution",,,"10.1063/5.0119902",,"physics.soc-ph","http://creativecommons.org/publicdomain/zero/1.0/","  Cascading failure as a systematic risk occurs in a wide range of real-world
networks. Cascade size distribution is a basic and crucial characteristic of
systemic cascade behaviors. Recent research works have revealed that the
distribution of cascade sizes is a bimodal form indicating the existence of
either very small cascades or large ones. In this paper, we aim to understand
the properties and formation of such bimodal distribution of cascade sizes in
complex networks, and further predict the final cascade size. We first find
that the bimodal distribution of cascade sizes is ubiquitous in both synthetic
and real networks. Moreover, the large cascade sizes distributed in the right
peak of bimodal distribution are resulted from either the failure of nodes with
high load at the first step of the cascade or multiple rounds of cascades
triggered by the initial failure. Accordingly, we propose a hybrid load metric
(HLM), which combines the load of the initial broken node and the load of
failed nodes triggered by the initial failure, to predict the final size of
cascading failures. Finally, we validate the effectiveness of HLM by computing
the accuracy of identifying the cascades belonging to the right and left peaks
of the bimodal distribution. The results show that HLM is a better predictor
than commonly used network centrality metrics in both synthetic and real-world
networks.
","[{""version"":""v1"",""created"":""Sat, 13 Aug 2022 20:23:48 GMT""}]","2023-03-08"
"2208.06727","Mengyang Gu","Xinyi Fang, Mengyang Gu, Jianzhong Wu","Reliable emulation of complex functionals by active learning with error
  control","15 pages, 10 figures",,"10.1063/5.0121805",,"physics.chem-ph stat.AP","http://arxiv.org/licenses/nonexclusive-distrib/1.0/","  A statistical emulator can be used as a surrogate of complex physics-based
calculations to drastically reduce the computational cost. Its successful
implementation hinges on an accurate representation of the nonlinear response
surface with a high-dimensional input space. Conventional ``space-filling''
designs, including random sampling and Latin hypercube sampling, become
inefficient as the dimensionality of the input variables increases, and the
predictive accuracy of the emulator can degrade substantially for a test input
distant from the training input set. To address this fundamental challenge, we
develop a reliable emulator for predicting complex functionals by active
learning with error control (ALEC). The algorithm is applicable to
infinite-dimensional mapping with high-fidelity predictions and a controlled
predictive error. The computational efficiency has been demonstrated by
emulating the classical density functional theory (cDFT) calculations, a
statistical-mechanical method widely used in modeling the equilibrium
properties of complex molecular systems. We show that ALEC is much more
accurate than conventional emulators based on the Gaussian processes with
``space-filling'' designs and alternative active learning methods. Besides, it
is computationally more efficient than direct cDFT calculations. ALEC can be a
reliable building block for emulating expensive functionals owing to its
minimal computational cost, controllable predictive error, and fully automatic
features.
","[{""version"":""v1"",""created"":""Sat, 13 Aug 2022 20:47:14 GMT""},{""version"":""v2"",""created"":""Thu, 3 Nov 2022 05:45:20 GMT""}]","2022-12-21"
"2208.06728","Jamal Mimouni","Jamal Mimouni","On making physics relevant to society in general and to scientists in
  particular: Closing the epistemic gap","12 pages, 7 figures, ACP2021, ASFAP",,,,"physics.ed-ph physics.hist-ph physics.soc-ph","http://creativecommons.org/licenses/by/4.0/","  Physics has a bad press: it is seen by a majority of people as a boring
discipline ever since their High School days. There is no glamour to it, just
toil and pain, and for many who engaged in it, the end sight is often
unemployment. Could it be that physicists don't know how to communicate what
their discipline entails to? I will be tackling the problematic of making
physics relevant to society and to the scientists in general. I will also be
dealing with the methodological and educational aspects of teaching and
practicing physics, and the need to close the epistemic gap between physics
teaching and the physicist's understanding ... By the way, do physicists
understand physics?
","[{""version"":""v1"",""created"":""Sat, 13 Aug 2022 20:53:33 GMT""}]","2022-08-16"
"2208.06729","Ibtihal Ferwana","Ibtihal Ferwana, Lav R. Varshney","Optimal Recovery for Causal Inference",,,,,"stat.ME econ.EM eess.SP","http://creativecommons.org/licenses/by/4.0/","  It is crucial to successfully quantify causal effects of a policy
intervention to determine whether the policy achieved the desired outcomes. We
present a deterministic approach to a classical method of policy evaluation,
synthetic control (Abadie and Gardeazabal, 2003), to estimate the unobservable
outcome of a treatment unit using ellipsoidal optimal recovery (EOpR). EOpR
provides policy evaluators with ""worst-case"" outcomes and ""typical"" outcomes to
help in decision making. It is an approximation-theoretic technique that also
relates to the theory of principal components, which recovers unknown
observations given a learned signal class and a set of known observations. We
show that EOpR can improve pre-treatment fit and bias of the post-treatment
estimation relative to other econometrics methods. Beyond recovery of the unit
of interest, an advantage of EOpR is that it produces worst-case estimates over
the estimations produced by the recovery. We assess our approach on
artificially-generated data, on datasets commonly used in the econometrics
literature, and also derive results in the context of the COVID-19 pandemic.
Such an approach is novel in the econometrics literature for causality and
policy evaluation.
","[{""version"":""v1"",""created"":""Sat, 13 Aug 2022 20:59:59 GMT""},{""version"":""v2"",""created"":""Wed, 15 Feb 2023 17:19:20 GMT""}]","2023-02-16"
"2208.06730","Andr\'es C\'ordoba","Andr\'es C\'ordoba, Jay D. Schieber and Tsutomu Indei","A simple micro-swimmer model inspired by the general equation for
  nonequilibrium reversible-irreversible coupling",,"J. Chem. Phys. 152, 194902 (2020)","10.1063/5.0003430",,"cond-mat.soft","http://creativecommons.org/licenses/by/4.0/","  A simple mean-field micro-swimmer model is presented. The model is inspired
by the nonequilibrium thermodynamics of multi-component fluids that undergo
chemical reactions. These thermodynamics can be rigorously described in the
context of the GENERIC (general equation for the nonequilibrium
reversible-irreversible coupling) framework. More specifically this approach
was recently applied to non-ideal polymer solutions (Indei and Schieber, J.
Chem. Phys, 146, 184902, 2017). One of the species of the solution is an
unreactive polymer chain represented by the bead-spring model. Using this
detailed description as inspiration we then make several simplifying
assumptions to obtain a mean-field model for a Janus micro-swimmer. The swimmer
model considered here consists of a polymer dumbbell in a sea of reactants. One
of the beads of the dumbbell is allowed to act as a catalyst for a chemical
reaction between the reactants. We show that the mean-squared displacement,
MSD, of the center of mass of this Janus dumbbell exhibits ballistic behavior
at time scales at which the concentration of reactant is large. The time scales
at which the ballistic behavior is observed in the MSD coincides with the time
scales at which the cross-correlation between the swimmer's orientation and the
direction of its displacement exhibit a maximum. Since the swimmer model was
inspired by the GENERIC framework it is possible to ensure that the entropy
generation is always positive and therefore the second law of thermodynamics is
obeyed.
","[{""version"":""v1"",""created"":""Sat, 13 Aug 2022 21:03:50 GMT""}]","2022-08-16"
"2208.06731","Stanley Deser","S.Deser","All identically conserved gravitational tensors are metric variations of
  an action","Published version","Annals of Physics 448,169162(2023)",,"BRX-TH-6709; Caltech 2022-028","gr-qc hep-th","http://creativecommons.org/licenses/by/4.0/","  I prove an old unsolved conjecture, the hard part of its obvious sufficiency,
namely that all identically conserved symmetric two-tensors are necessarily
metric variations of invariant actions, thus sparing the world more alternative
gravity theories. The proof is reasonably simple, if perhaps a physicist's.
","[{""version"":""v1"",""created"":""Sat, 13 Aug 2022 21:06:31 GMT""},{""version"":""v2"",""created"":""Tue, 16 Aug 2022 02:46:48 GMT""},{""version"":""v3"",""created"":""Fri, 16 Dec 2022 00:16:23 GMT""}]","2022-12-20"
"2208.06732","Ian Christen","Ian Christen, Madison Sutula, Thomas Propson, Hamed Sattari, Gregory
  Choong, Christopher Panuski, Alexander Melville, Justin Mallek, Scott
  Hamilton, P. Benjamin Dixon, Adrian J. Menssen, Danielle Braje, Amir H.
  Ghadimi, Dirk Englund","An integrated photonic engine for programmable atomic control","16 pages, 15 figures",,,,"quant-ph physics.app-ph physics.optics","http://creativecommons.org/licenses/by/4.0/","  Solutions for scalable, high-performance optical control are important for
the development of scaled atom-based quantum technologies. Modulation of many
individual optical beams is central to the application of arbitrary gate and
control sequences on arrays of atoms or atom-like systems. At telecom
wavelengths, miniaturization of optical components via photonic integration has
pushed the scale and performance of classical and quantum optics far beyond the
limitations of bulk devices. However, these material platforms for high-speed
telecom integrated photonics are not transparent at the short wavelengths
required by leading atomic systems. Here, we propose and implement a scalable
and reconfigurable photonic architecture for multi-channel quantum control
using integrated, visible-light modulators based on thin-film lithium niobate.
Our approach combines techniques in free-space optics, holography, and control
theory together with a sixteen-channel integrated photonic device to stabilize
temporal and cross-channel power deviations and enable precise and uniform
control. Applying this device to a homogeneous constellation of silicon-vacancy
artificial atoms in diamond, we present techniques to spatially and spectrally
address a dynamically-selectable set of these stochastically-positioned point
emitters. We anticipate that this scalable and reconfigurable optical
architecture will lead to systems that could enable parallel individual
programmability of large many-body atomic systems, which is a critical step
towards universal quantum computation on such hardware.
","[{""version"":""v1"",""created"":""Sat, 13 Aug 2022 21:12:37 GMT""}]","2022-08-16"
"2208.06733","Adwait Godbole","Adwait Godbole, Yatin A. Manerkar and Sanjit A. Seshia","Automated Conversion of Axiomatic to Operational Models: Theory and
  Practice","16 pages, 14 pages",,,,"cs.LO cs.AR","http://creativecommons.org/licenses/by-sa/4.0/","  A system may be modelled as an operational model (which has explicit notions
of state and transitions between states) or an axiomatic model (which is
specified entirely as a set of invariants). Most formal methods techniques
(e.g., IC3, invariant synthesis, etc) are designed for operational models and
are largely inaccessible to axiomatic models. Furthermore, no prior method
exists to automatically convert axiomatic models to operational ones, so
operational equivalents to axiomatic models had to be manually created and
proven equivalent.
  In this paper, we advance the state-of-the-art in axiomatic to operational
model conversion. We show that general axioms in the $\mu$spec axiomatic
modelling framework cannot be translated to equivalent finite-state operational
models. We also derive restrictions on the space of $\mu$spec axioms that
enable the feasible generation of equivalent finite-state operational models
for them. As for practical results, we develop a methodology for automatically
translating $\mu$spec axioms to equivalent finite-state automata-based
operational models. We demonstrate the efficacy of our method by using the
models generated by our procedure to prove the correctness of ordering
properties on three RTL designs.
","[{""version"":""v1"",""created"":""Sat, 13 Aug 2022 21:12:49 GMT""}]","2022-08-16"
"2208.06734","Endri Kacupaj","Endri Kacupaj, Kuldeep Singh, Maria Maleshkova, Jens Lehmann","An Answer Verbalization Dataset for Conversational Question Answerings
  over Knowledge Graphs",,,,,"cs.CL","http://creativecommons.org/licenses/by/4.0/","  We introduce a new dataset for conversational question answering over
Knowledge Graphs (KGs) with verbalized answers. Question answering over KGs is
currently focused on answer generation for single-turn questions (KGQA) or
multiple-tun conversational question answering (ConvQA). However, in a
real-world scenario (e.g., voice assistants such as Siri, Alexa, and Google
Assistant), users prefer verbalized answers. This paper contributes to the
state-of-the-art by extending an existing ConvQA dataset with multiple
paraphrased verbalized answers. We perform experiments with five
sequence-to-sequence models on generating answer responses while maintaining
grammatical correctness. We additionally perform an error analysis that details
the rates of models' mispredictions in specified categories. Our proposed
dataset extended with answer verbalization is publicly available with detailed
documentation on its usage for wider utility.
","[{""version"":""v1"",""created"":""Sat, 13 Aug 2022 21:21:28 GMT""}]","2022-08-16"
"2208.06735","Kiwamu Watanabe","Kiwamu Watanabe","Positivity of the exterior power of the tangent bundles","6 pages",,,,"math.AG math.CV math.DG","http://arxiv.org/licenses/nonexclusive-distrib/1.0/","  Let $X$ be a complex smooth projective variety such that the exterior power
of the tangent bundle $\bigwedge^{r} T_X$ is nef for some $1\leq r<\dim X$. We
prove that, up to an \'etale cover, $X$ is a Fano fiber space over an Abelian
variety. This gives generalizations of the structure theorem of varieties with
nef tangent bundle by Demailly, Peternell and Schneider and that of varieties
with nef $\bigwedge^{2} T_X$ by the author. Our result also gives an answer to
a question raised by Li, Ou and Yang for varieties with strictly nef
$\bigwedge^{r} T_X$ when $r < \dim X$.
","[{""version"":""v1"",""created"":""Sat, 13 Aug 2022 21:32:05 GMT""}]","2022-08-16"
"2208.06736","King Ming Lam","King Ming Lam","Linear Stability of liquid Lane-Emden stars","Made some minor changes in wordings and updated the introduction with
  references to recent works",,,,"math.AP math-ph math.MP","http://arxiv.org/licenses/nonexclusive-distrib/1.0/","  We establish various qualitative properties of liquid Lane-Emden stars in
$\mathbb{R}^d$, including bounds for its density profile $\rho$ and radius $R$.
Using them we prove that against radial perturbations, the liquid Lane-Emden
stars are linearly stable when $\gamma\geq 2(d-1)/d$; linearly stable when
$\gamma<2(d-1)/d$ for stars with small relative central density
$\rho(0)-\rho(R)$; and linearly unstable when $\gamma<2(d-1)/d$ for stars with
large central density. Such dependence on central density is not seen in the
gaseous Lane-Emden stars.
","[{""version"":""v1"",""created"":""Sat, 13 Aug 2022 21:34:23 GMT""},{""version"":""v2"",""created"":""Tue, 9 May 2023 19:12:23 GMT""}]","2023-05-11"
"2208.06737","Andr\'es C\'ordoba","Andr\'es C\'ordoba","The Effects of the Interplay Between Motor and Brownian Forces on the
  Rheology of Active Gels",,"J. Phys. Chem. B 2018, 122, 15, 4267-4277","10.1021/acs.jpcb.8b00238",,"cond-mat.soft","http://creativecommons.org/licenses/by/4.0/","  Active gels perform key mechanical roles inside the cell, such as cell
division, motion and force sensing. The unique mechanical properties required
to perform such functions arise from the interactions between molecular motors
and semi-flexible polymeric filaments. Molecular motors can convert the energy
released in the hydrolysis of ATP into forces of up to pico-Newton magnitudes.
Moreover, the polymeric filaments that form active gels are flexible enough to
respond to Brownian forces, but also stiff enough to support the large tensions
induced by the motor-generated forces. Brownian forces are expected to have a
significant effect especially at motor activities at which stable
non-contractile in vitro active gels are prepared for rheological measurements.
Here, a microscopic mean-field theory of active gels originally formulated in
the limit of motor-dominated dynamics is extended to include Brownian forces.
In the model presented here Brownian forces are included accurately, at real
room temperature, even in systems with high motor activity. It is shown that a
subtle interplay, or competition, between motor-generated forces and Brownian
forces has an important impact in the mass transport and rheological properties
of active gels. The model predictions show that at low frequencies the dynamic
modulus of active gels is determined mostly by motor protein dynamics. However,
Brownian forces significantly increase the breadth of the relaxation spectrum
and can affect the shape of the dynamic modulus over a wide frequency range
even for ratios of motor to Brownian forces of more than a hundred. Since the
ratio between motor and Brownian forces is sensitive to ATP concentration, the
results presented here shed some light on how the transient mechanical response
of active gels changes with varying ATP concentration.
","[{""version"":""v1"",""created"":""Sat, 13 Aug 2022 21:43:59 GMT""}]","2022-08-16"
"2208.06738","Marco Gramatica","Marco Gramatica, Silvia Liverani, Peter Congdon","Structure induced by a multiple membership transformation on the
  Conditional Autoregressive model",,,,,"stat.ME","http://creativecommons.org/licenses/by/4.0/","  The objective of disease mapping is to model data aggregated at the areal
level. In some contexts, however, (e.g. residential histories, general
practitioner catchment areas) when data is arising from a variety of sources,
not necessarily at the same spatial scale, it is possible to specify spatial
random effects, or covariate effects, at the areal level, by using a multiple
membership principle (MM) (Petrof et al. 2020, Gramatica et al. 2021). A
weighted average of conditional autoregressive (CAR) spatial random effects
embeds spatial information for a spatially-misaligned outcome and estimate
relative risk for both frameworks (areas and memberships). In this paper we
investigate the theoretical underpinnings of these application of the multiple
membership principle to the CAR prior, in particular with regard to
parameterisation, properness and identifiability. We carry out simulations
involving different numbers of memberships as compared to number of areas and
assess impact of this on estimating parameters of interest. Both analytical and
simulation study results show under which conditions parameters of interest are
identifiable, so that we can offer actionable recommendations to practitioners.
Finally, we present the results of an application of the multiple membership
model to diabetes prevalence data in South London, together with strategic
implications for public health considerations
","[{""version"":""v1"",""created"":""Sat, 13 Aug 2022 21:53:36 GMT""},{""version"":""v2"",""created"":""Wed, 21 Dec 2022 20:02:20 GMT""}]","2022-12-23"
"2208.06739","Sevcan Turk","Sevcan Turk, Kaya Oguz, Mehmet Orman, Emre Caliskan, Yesim Ertan,
  Erkin Ozgiray, Taner Akalin, Ashok Srinivasan, Omer Kitis","Machine Learning Based Radiomics for Glial Tumor Classification and
  Comparison with Volumetric Analysis",,,,,"eess.IV cs.CV cs.LG physics.med-ph","http://arxiv.org/licenses/nonexclusive-distrib/1.0/","  Purpose; The purpose of this study is to classify glial tumors into grade II,
III and IV categories noninvasively by application of machine learning to
multi-modal MRI features in comparison with volumetric analysis. Methods; We
retrospectively studied 57 glioma patients with pre and postcontrast T1
weighted, T2 weighted, FLAIR images, and ADC maps acquired on a 3T MRI. The
tumors were segmented into enhancing and nonenhancing portions, tumor necrosis,
cyst and edema using semiautomated segmentation of ITK-SNAP open source tool.
We measured total tumor volume, enhancing-nonenhancing tumor, edema, necrosis
volume and the ratios to the total tumor volume. Training of a support vector
machine (SVM) classifier and artificial neural network (ANN) was performed with
labeled data designed to answer the question of interest. Specificity,
sensitivity, and AUC of the predictions were computed by means of ROC analysis.
Differences in continuous measures between groups were assessed by using
Kruskall Wallis, with post hoc Dunn correction for multiple comparisons.
Results; When we compared the volume ratios between groups, there was
statistically significant difference between grade IV and grade II-III glial
tumors. Edema and tumor necrosis volume ratios for grade IV glial tumors were
higher than that of grade II and III. Volumetric ratio analysis could not
distinguish grade II and III tumors successfully. However, SVM and ANN
correctly classified each group with accuracies up to 98% and 96%. Conclusion;
Application of machine learning methods to MRI features can be used to classify
brain tumors noninvasively and more readily in clinical settings.
","[{""version"":""v1"",""created"":""Sat, 13 Aug 2022 22:09:53 GMT""}]","2022-08-16"
"2208.06740","Jared Krandel","Jared Krandel","Finding Lipschitz domains in the complements of bilaterally flat sets","60 pages. Minor revisions and title change",,,,"math.CA","http://creativecommons.org/licenses/by/4.0/","  We study classes of sufficiently flat ``$d$-dimensional'' sets in
$\mathbb{R}^{d+1}$ whose complements are covered by star-shaped Lipschitz
domains with bounded overlap and controlled total boundary measure. This study
is motivated by the following result proved by Peter Jones as a piece of his
proof of the Analyst's Traveling Salesman Theorem in the complex plane: Any
simply connected domain $\Omega\subseteq\mathbb{C}$ with finite boundary length
$\ell(\partial\Omega)$ can be decomposed into Lipschitz domains with total
boundary length bounded above by $M\ell(\partial\Omega)$ for some $M$
independent of $\Omega$. In considering higher-dimensional sets, we use
concepts from the theory of uniformly rectifiable sets such as the bilateral
weak geometric lemma (BWGL) and prove a version of David and Toro's result on
Reifenberg parameterizations for sets with holes assuming global angle control.
Our main result shows that a $d$-dimensional set $E$ satisfying a BWGL which
has good control on the turning of its best approximating planes has a
complement which is covered by a family of star-shaped Lipschitz domains with
bounded overlap and controlled total boundary measure. We also show how this
result applies to uniformly rectifiable sets and Reifenberg flat sets in
particular.
","[{""version"":""v1"",""created"":""Sat, 13 Aug 2022 22:25:05 GMT""},{""version"":""v2"",""created"":""Wed, 26 Oct 2022 19:06:51 GMT""}]","2022-10-28"
"2208.06741","Santiago Ram\'irez","Santiago Ram\'irez","Indecomposable solutions of the Yang-Baxter equation with permutation
  group of sizes $pq$ and $p^2q$",,,,,"math.QA math.GR math.RA","http://arxiv.org/licenses/nonexclusive-distrib/1.0/","  In this paper we study the problem of classification of indecomposable
solutions of the Yang-Baxter equation. Using a scheme proposed by Bachiller,
Ced\'o, and Jespers, and recent advances in the classification of braces we
classify all indecomposable solutions with some particular permutation groups.
We do this for all groups of size $pq$, all abelian groups of size $p^2q$ and
all dihedral groups of size $p^2q$.
","[{""version"":""v1"",""created"":""Sat, 13 Aug 2022 22:43:28 GMT""}]","2022-08-16"
