"2208.06774","Chengqing Li","Chengqing Li, Xianhui Shen, Sheng Liu","Cryptanalyzing an Image Encryption Algorithm Underpinned by 2D
  Lag-Complex Logistic Map","10 pages, 3 figures",,,,"cs.CR","http://arxiv.org/licenses/nonexclusive-distrib/1.0/","  This paper analyzes security performance of an image encryption algorithm
using 2D lag-complex Logistic map (LCLM), which adopts it as a pseudo-random
number generator, and uses the sum of all pixel values of the plain-image as
its initial value to control the random combination of the basic encryption
operations. However, multiple factors make the final pseudo-random sequences
controlling the encryption process may be the same for different plain-images.
Based on this point, we proposed a chosen-plaintext attack by attacking the six
encryption steps with a strategy of divide and conquer. Using the pitfalls of
2D-LCLM, the number of required chosen plain-images is further reduced to
$5\cdot\log_2(MN)+95$, where $\mathit{MN}$ is the number of pixels of the
plain-image.
","[{""version"":""v1"",""created"":""Sun, 14 Aug 2022 04:08:22 GMT""}]","2022-08-16"
"2208.06775","Dean Huang","Dean Huang, Anna E. Johnson, Brandon S. Sim, Teresa Lo, Houra Merrikh,
  Paul A. Wiggins","The high-resolution in vivo measurement of replication fork velocity and
  pausing by lag-time analysis","37 pages, 24 figures",,,,"physics.bio-ph","http://creativecommons.org/licenses/by/4.0/","  An important step towards understanding the mechanistic basis of the central
dogma is the quantitative characterization of the dynamics of
nucleic-acid-bound molecular motors in the context of the living cell, where a
crowded cytoplasm as well as competing and potentially antagonistic processes
may significantly affect their rapidity and reliability. To capture these
dynamics, we develop a novel method, lag-time analysis, for measuring in vivo
dynamics. The approach uses exponential growth as the stopwatch to resolve
dynamics in an asynchronous culture and therefore circumvents the difficulties
and potential artifacts associated with synchronization or fluorescent
labeling. Although lag-time analysis has the potential to be widely applicable
to the quantitative analysis of in vivo dynamics, we focus on an important
application: characterizing replication dynamics. To benchmark the approach, we
analyze replication dynamics in three different species and a collection of
mutants. We provide the first quantitative locus-specific measurements of fork
velocity, in units of kb per second, as well as replisome-pause durations, some
with the precision of seconds. The measured fork velocity is observed to be
both locus and time dependent, even in wild-type cells. In addition to
quantitatively characterizing known phenomena, we detect brief, locus-specific
pauses at rDNA in wild-type cells for the first time. We also observe temporal
fork velocity oscillations in three highly-divergent bacterial species.
Lag-time analysis not only has great potential to offer new insights into
replication, as demonstrated in the paper, but also has potential to provide
quantitative insights into other important processes.
","[{""version"":""v1"",""created"":""Sun, 14 Aug 2022 04:11:44 GMT""},{""version"":""v2"",""created"":""Tue, 6 Sep 2022 23:34:19 GMT""}]","2022-09-08"
"2208.06776","Haiyang Xiong","Haibin Zheng, Haiyang Xiong, Haonan Ma, Guohan Huang, Jinyin Chen","Link-Backdoor: Backdoor Attack on Link Prediction via Node Injection",,,,,"cs.SI cs.AI","http://arxiv.org/licenses/nonexclusive-distrib/1.0/","  Link prediction, inferring the undiscovered or potential links of the graph,
is widely applied in the real-world. By facilitating labeled links of the graph
as the training data, numerous deep learning based link prediction methods have
been studied, which have dominant prediction accuracy compared with non-deep
methods. However,the threats of maliciously crafted training graph will leave a
specific backdoor in the deep model, thus when some specific examples are fed
into the model, it will make wrong prediction, defined as backdoor attack. It
is an important aspect that has been overlooked in the current literature. In
this paper, we prompt the concept of backdoor attack on link prediction, and
propose Link-Backdoor to reveal the training vulnerability of the existing link
prediction methods. Specifically, the Link-Backdoor combines the fake nodes
with the nodes of the target link to form a trigger. Moreover, it optimizes the
trigger by the gradient information from the target model. Consequently, the
link prediction model trained on the backdoored dataset will predict the link
with trigger to the target state. Extensive experiments on five benchmark
datasets and five well-performing link prediction models demonstrate that the
Link-Backdoor achieves the state-of-the-art attack success rate under both
white-box (i.e., available of the target model parameter)and black-box (i.e.,
unavailable of the target model parameter) scenarios. Additionally, we testify
the attack under defensive circumstance, and the results indicate that the
Link-Backdoor still can construct successful attack on the well-performing link
prediction methods. The code and data are available at
https://github.com/Seaocn/Link-Backdoor.
","[{""version"":""v1"",""created"":""Sun, 14 Aug 2022 04:30:54 GMT""}]","2022-08-16"
"2208.06777","Romyar Sharifi","Romyar T. Sharifi","An extension of the Fukaya-Kato method","59 pages",,,,"math.NT","http://arxiv.org/licenses/nonexclusive-distrib/1.0/","  In a groundbreaking paper, T. Fukaya and K. Kato proved a slight weakening of
a conjecture of the author's relating modular symbols and cup products of
cyclotomic units under an assumption that a Kubota-Leopoldt p-adic L-function
has no multiple zeros. This article describes a refinement of their method that
sheds light on the role of the p-adic L-function.
","[{""version"":""v1"",""created"":""Sun, 14 Aug 2022 05:06:55 GMT""}]","2022-08-16"
"2208.06778","Hao Wu","Zemiao Peng, Hao Wu","$\beta$-Divergence-Based Latent Factorization of Tensors model for QoS
  prediction",,,,,"cs.LG","http://arxiv.org/licenses/nonexclusive-distrib/1.0/","  A nonnegative latent factorization of tensors (NLFT) model can well model the
temporal pattern hidden in nonnegative quality-of-service (QoS) data for
predicting the unobserved ones with high accuracy. However, existing NLFT
models' objective function is based on Euclidean distance, which is only a
special case of $\beta$-divergence. Hence, can we build a generalized NLFT
model via adopting $\beta$-divergence to achieve prediction accuracy gain? To
tackle this issue, this paper proposes a $\beta$-divergence-based NLFT model
($\beta$-NLFT). Its ideas are two-fold 1) building a learning objective with
$\beta$-divergence to achieve higher prediction accuracy, and 2) implementing
self-adaptation of hyper-parameters to improve practicability. Empirical
studies on two dynamic QoS datasets demonstrate that compared with
state-of-the-art models, the proposed $\beta$-NLFT model achieves the higher
prediction accuracy for unobserved QoS data.
","[{""version"":""v1"",""created"":""Sun, 14 Aug 2022 05:14:50 GMT""}]","2022-08-20"
"2208.06779","Zahra Fazel","Jean-Pierre Rozelot, Ali Kilcik, Zahra Fazel","An outlook on the estimate of the solar quadrupole moment from
  relativistic gravitation contributions",,,,,"astro-ph.SR astro-ph.EP gr-qc","http://arxiv.org/licenses/nonexclusive-distrib/1.0/","  Of all the solar fundamental parameters (mass, diameter, gravity at the
surface,...), the gravitational moments have been quite often ignored in the
past, mainly due to the great difficulty to get a reliable estimate. Even
though the order of magnitude of the solar quadrupole moment $J_2$ is now known
to be $10^{-7}$, its accurate value is still discussed. Indeed, the expansion
in multipoles $J_{(l,~ l = 2, ...)}$ of the gravitational potential of a
rotating body affects the orbital motion of planets at a relativistic level. We
will recall here the recent progresses made in testing General Relativity
through the contribution of the first solar quadrupole moment. Using the
Eddington-Robertson parameters, we recall the constraints both on a theoretical
and experimental point of view. Together with $\gamma$, which encodes the
amount of curvature of space-time per unit rest-mass, the Post--Newtonian
Parameter $\beta$ contributes to the relativistic precession of planets. The
latter parameter encodes the amount of non-linearity in the superposition law
of gravitation. Even though in principle, it would be possible to extract $J_2$
from planetary ephemerides, we observe that it is significantly correlated with
other solution parameters (semi-major axis of planets, mass of asteroids...).
Focusing on the $J_2$ correlations, we show that in general, when ~$\beta$ and
~$\gamma$ are freed, the correlations ~[$\beta, J_2$] and ~[$\gamma, J_2$] are
$\approx$ 45\% and $\approx$ 55\% respectively. Moreover, all the planetary
dynamics-based values are biased by the Lense--Thiring effect, which has never
been modeled and solved for so far, but can be estimated to $\approx$ 7\%. It
is thus possible to get a good estimate of the solar quadrupole
moment:$1.66\times10^{-7}$$\leq$$J_2$$\leq$$2.32\times10^{-7}$.
","[{""version"":""v1"",""created"":""Sun, 14 Aug 2022 05:26:12 GMT""}]","2022-08-16"
"2208.06780","Zhaoqi Wu","Cong Xu, Zhaoqi Wu, Shao-Ming Fei","Uncertainty of quantum channels via modified generalized variance and
  modified generalized Wigner-Yanase-Dyson skew information","24 pages, 6 figures","Quantum Information Processing (2022) 21:292","10.1007/s11128-022-03633-3",,"quant-ph","http://arxiv.org/licenses/nonexclusive-distrib/1.0/","  Uncertainty relation is a fundamental issue in quantum mechanics and quantum
information theory. By using modified generalized variance (MGV), and modified
generalized Wigner-Yanase-Dyson skew information (MGWYD), we identify the total
and quantum uncertainty of quantum channels. The elegant properties of the
total uncertainty of quantum channels are explored in detail. In addition, we
present a trade-off relation between the total uncertainty of quantum channels
and the entanglement fidelity and establish the relationships between the total
uncertainty and entropy exchange/coherent information. Detailed examples are
given to the explicit formulas of the total uncertainty and the quantum
uncertainty of quantum channels. Moreover, utilizing a realizable experimental
measurement scheme by using the Mach-Zehnder interferometer proposed in Nirala
et al. (Phys Rev A 99:022111, 2019), we discuss how to measure the
total/quantum uncertainty of quantum channels for pure states.
","[{""version"":""v1"",""created"":""Sun, 14 Aug 2022 05:29:14 GMT""}]","2022-08-16"
"2208.06781","Muye Li","Muye Li, Shun Zhang, Yao Ge, Feifei Gao, and Pingzhi Fan","Joint Channel Estimation and Data Detection for Hybrid RIS aided
  Millimeter Wave OTFS Systems","16 pages, 13 figures, accepted by IEEE Transactions on Communications",,,,"eess.SP","http://creativecommons.org/licenses/by/4.0/","  For high mobility communication scenario, the recently emerged orthogonal
time frequency space (OTFS) modulation introduces a new delay-Doppler domain
signal space, and can provide better communication performance than traditional
orthogonal frequency division multiplexing system. This article focuses on the
joint channel estimation and data detection (JCEDD) for hybrid reconfigurable
intelligent surface (HRIS) aided millimeter wave (mmWave) OTFS systems.
Firstly, a new transmission structure is designed. Within the pilot durations
of the designed structure, partial HRIS elements are alternatively activated.
The time domain channel model is then exhibited. Secondly, the received signal
model for both the HRIS over time domain and the base station over
delay-Doppler domain are studied. Thirdly, by utilizing channel parameters
acquired at the HRIS, an HRIS beamforming design strategy is proposed. For the
OTFS transmission, we propose a JCEDD scheme over delay-Doppler domain. In this
scheme, message passing (MP) algorithm is designed to simultaneously obtain the
equivalent channel gain and the data symbols. On the other hand, the channel
parameters, i.e., the Doppler shift, the channel sparsity, and the channel
variance, are updated through expectation-maximization (EM) algorithm. By
iteratively executing the MP and EM algorithm, both the channel and the unknown
data symbols can be accurately acquired. Finally, simulation results are
provided to validate the effectiveness of our proposed JCEDD scheme.
","[{""version"":""v1"",""created"":""Sun, 14 Aug 2022 05:34:25 GMT""}]","2022-08-16"
"2208.06782","Yujie Qin","Yujie Qin, Mustafa A. Kishk, and Mohamed-Slim Alouini","Performance Analysis of Charging Infrastructure Sharing in UAV and
  EV-involved Networks",,,,,"eess.SY cs.SY","http://creativecommons.org/licenses/by/4.0/","  Electric vehicles (EVs) and unmanned aerial vehicles (UAVs) show great
potential in modern transportation and communication networks, respectively.
However, with growing demands for such technologies, the limited energy
infrastructure becomes the bottleneck for their future growth. It might be of
high cost and low energy efficiency for all the operators to each have their
own dedicated energy infrastructure, such as charging stations. In this paper,
we analyze a wireless charging infrastructure sharing strategy in UAV and
EV-involved networks. We consider a scenario where UAVs can charge in EV
charging stations and pay for the sharing fee. On the EVs' side, sharing
infrastructure can earn extra profit but their service quality, such as waiting
time, might slightly reduce. On the UAVs' side, if renting EV charging stations
can achieve an acceptable system performance, say high coverage probability,
while considering the cost, they may not need to build their dedicated charging
stations. In this case, we use tools from stochastic geometry to model the
locations and propose an optimization problem that captures the aforementioned
trade-offs between cost or profit and quality of service. Our numerical results
show that sharing infrastructure slightly increases the waiting time of EVs,
say within $5$ min, but dramatically decreases the waiting time of drones, say
more than $50$ min, and deploying more charging stations do achieve better
performances, but all these better performances are expected to cost more.
","[{""version"":""v1"",""created"":""Sun, 14 Aug 2022 05:46:22 GMT""}]","2022-08-16"
"2208.06783","Kaveh Safavigerdini","Bahram Yaghooti, Kaveh Safavigerdini, Reza Hajiloo, Hassan Salarieh","Stabilizing Unstable Periodic Orbit of Unknown Fractional-Order Systems
  via Adaptive Delayed Feedback Control",,,,,"eess.SY cs.SY","http://arxiv.org/licenses/nonexclusive-distrib/1.0/","  This paper presents an adaptive nonlinear delayed feedback control scheme for
stabilizing the unstable periodic orbit of unknown fractional-order chaotic
systems. The developed control framework uses the Lyapunov approach and sliding
mode control technique to ensure that the closed-loop control system is
asymptotically stable on a periodic trajectory sufficiently close to the
unstable periodic orbit of the fractional-order chaotic system. The presented
method has two major advantages. First, this framework makes use of a direct
adaptive control method, making it simple to apply to systems with unknown
parameters without deriving the dynamics of the system. Moreover, the suggested
framework requires only the period of the unstable periodic orbit. It is
ensured that the closed-loop system will be robust to external disturbances
with unknowable bounds. Finally, the proposed method is used to stabilize the
unstable periodic orbit of the fractional-order Duffing and Gyro systems, and
its performance is evaluated by using extensive numerical simulation results.
","[{""version"":""v1"",""created"":""Sun, 14 Aug 2022 05:47:34 GMT""},{""version"":""v2"",""created"":""Sun, 2 Oct 2022 20:03:42 GMT""},{""version"":""v3"",""created"":""Fri, 20 Jan 2023 00:14:05 GMT""}]","2023-01-23"
"2208.06784","Hakop Hakopian","Hakop Hakopian, Gagik Vardanyan, Navasard Vardanyan","On the Gasca-Maeztu conjecture for $n=6$","25 pages, 3 figures",,,,"math.AG cs.NA math.NA","http://creativecommons.org/licenses/by/4.0/","  A two-dimensional $n$-correct set is a set of nodes admitting unique
bivariate interpolation with polynomials of total degree at most ~$n$. We are
interested in correct sets with the property that all fundamental polynomials
are products of linear factors. In 1982, M.~Gasca and J.~I.~Maeztu conjectured
that any such set necessarily contains $n+1$ collinear nodes. So far, this had
only been confirmed for $n\leq 5.$ In this paper, we make a step for proving
the case $n=6.$
","[{""version"":""v1"",""created"":""Sun, 14 Aug 2022 05:53:28 GMT""}]","2022-08-16"
"2208.06785","Fabrizio Leisen","Patrizia Berti, Emanuela Dreassi, Fabrizio Leisen, Pietro Rigo, Luca
  Pratelli","A probabilistic view on predictive constructions for Bayesian learning",,,,,"stat.ME math.PR math.ST stat.TH","http://arxiv.org/licenses/nonexclusive-distrib/1.0/","  Given a sequence $X=(X_1,X_2,\ldots)$ of random observations, a Bayesian
forecaster aims to predict $X_{n+1}$ based on $(X_1,\ldots,X_n)$ for each $n\ge
0$. To this end, in principle, she only needs to select a collection
$\sigma=(\sigma_0,\sigma_1,\ldots)$, called ``strategy"" in what follows, where
$\sigma_0(\cdot)=P(X_1\in\cdot)$ is the marginal distribution of $X_1$ and
$\sigma_n(\cdot)=P(X_{n+1}\in\cdot\mid X_1,\ldots,X_n)$ the $n$-th predictive
distribution. Because of the Ionescu-Tulcea theorem, $\sigma$ can be assigned
directly, without passing through the usual prior/posterior scheme. One main
advantage is that no prior probability is to be selected. In a nutshell, this
is the predictive approach to Bayesian learning. A concise review of the latter
is provided in this paper. We try to put such an approach in the right
framework, to make clear a few misunderstandings, and to provide a unifying
view. Some recent results are discussed as well. In addition, some new
strategies are introduced and the corresponding distribution of the data
sequence $X$ is determined. The strategies concern generalized P\'olya urns,
random change points, covariates and stationary sequences.
","[{""version"":""v1"",""created"":""Sun, 14 Aug 2022 05:58:52 GMT""},{""version"":""v2"",""created"":""Fri, 27 Jan 2023 10:01:43 GMT""}]","2023-01-30"
"2208.06786","Vladimir Annenkov","Vladimir Annenkov and Evgeniia Volchok","Numerical simulations of a continuously injected relativistic electron
  beam relaxation into a plasma with large-scale density gradients",,,"10.1016/j.asr.2022.08.036",,"physics.plasm-ph astro-ph.SR","http://arxiv.org/licenses/nonexclusive-distrib/1.0/","  In this paper the influence of large-scale decreasing and increasing
gradients of the density of magnetized plasma on the relaxation process of a
continuously injected relativistic electron beam with an energy of 611 keV
($v_b=0.9c$) and a pitch-angle distribution is studied using particle-in-cell
numerical simulations. It is found that for the selected parameters in the case
of a smoothly decreasing gradient and in a homogeneous plasma the formation of
spatially limited plasma oscillations of large amplitude occurs. In such cases,
modulation instability develops and a long-wave longitudinal modulation of the
ion density is formed. In addition, the large amplitude of plasma waves
accelerates plasma electrons to energies on the order of the beam energy. In
the case of increasing and sharply decreasing gradients, a significant decrease
in the amplitude of plasma oscillations and the formation of a turbulent ion
density spectrum are observed. The possibility of acceleration of beam
electrons to energies more than 2 times higher than the initial energy of the
beam particles is also demonstrated. This process takes place not only during
beam propagation in growing plasma density, but also in homogeneous plasma due
to interaction of beam particles with plasma oscillations of large amplitude.
","[{""version"":""v1"",""created"":""Sun, 14 Aug 2022 06:05:00 GMT""},{""version"":""v2"",""created"":""Sun, 28 Aug 2022 07:46:58 GMT""}]","2022-08-30"
"2208.06787","Kim Yu-Ji","Kim Jun-Seong, Kim Yu-Ji, Moon Ye-Bin, Tae-Hyun Oh","HDR-Plenoxels: Self-Calibrating High Dynamic Range Radiance Fields","Accepted at ECCV 2022. [Project page] https://hdr-plenoxels.github.io
  [Code] https://github.com/postech-ami/HDR-Plenoxels",,,,"cs.CV cs.AI cs.GR","http://arxiv.org/licenses/nonexclusive-distrib/1.0/","  We propose high dynamic range (HDR) radiance fields, HDR-Plenoxels, that
learn a plenoptic function of 3D HDR radiance fields, geometry information, and
varying camera settings inherent in 2D low dynamic range (LDR) images. Our
voxel-based volume rendering pipeline reconstructs HDR radiance fields with
only multi-view LDR images taken from varying camera settings in an end-to-end
manner and has a fast convergence speed. To deal with various cameras in
real-world scenarios, we introduce a tone mapping module that models the
digital in-camera imaging pipeline (ISP) and disentangles radiometric settings.
Our tone mapping module allows us to render by controlling the radiometric
settings of each novel view. Finally, we build a multi-view dataset with
varying camera conditions, which fits our problem setting. Our experiments show
that HDR-Plenoxels can express detail and high-quality HDR novel views from
only LDR images with various cameras.
","[{""version"":""v1"",""created"":""Sun, 14 Aug 2022 06:12:22 GMT""},{""version"":""v2"",""created"":""Fri, 18 Nov 2022 13:32:35 GMT""}]","2022-11-21"
"2208.06788","Chao Liu","Chao Liu","Blowups for a class of second order nonlinear hyperbolic equations: A
  reduced model of nonlinear Jeans instability","33 pages",,,,"math.AP","http://arxiv.org/licenses/nonexclusive-distrib/1.0/","  Due to the importance of understanding the formation of the nonlinear
structures in the universe and stellar systems, the nonlinear Jeans instability
which plays the key role in these formation problems is a long-standing open
problem presented by astrophysics more than one hundred years. In this article,
we focus on a reduced model of the nonlinear Jeans instability for the
expanding Newtonian universe which is characterized by a class of second order
nonlinear hyperbolic equations
  \begin{equation*}
  \Box \varrho(x^\mu) +\frac{\mathcal{a} }{t} \partial_{t}\varrho(x^\mu) -
  \frac{\mathcal{b}}{t^2} \varrho(x^\mu) (1+ \varrho(x^\mu) )
-\frac{\mathcal{c}-\mathcal{k}}{1+\varrho(x^\mu)}
(\partial_{t}\varrho(x^\mu))^2= \mathcal{k} F(t).
  \end{equation*} We establish a family of nonlinear self-increase blowup
solution (the solution itself becomes infinite, stable ODE-type blowup) to this
equation and give estimates on the growth rate of $\varrho$ which may explain
the much faster growth rate of the nonlinear structures of universe in
astrophysical observations than the rate given by the classical Jeans
instability.
","[{""version"":""v1"",""created"":""Sun, 14 Aug 2022 06:20:15 GMT""}]","2022-08-16"
"2208.06789","Antonio Di Domenico","Antonio Di Domenico","Entanglement, CPT and neutral kaons","Presented at the Ninth Meeting on CPT and Lorentz Symmetry,
  Bloomington, Indiana, May 17-26, 2022",,,,"hep-ph","http://creativecommons.org/licenses/by/4.0/","  Direct tests of T, CP, CPT symmetries in transitions using entangled neutral
kaons produced at a $\phi$-factory are briefly reviewed.
","[{""version"":""v1"",""created"":""Sun, 14 Aug 2022 06:23:12 GMT""}]","2022-08-16"
"2208.06790","Wenyuan Li","Yalchin Efendiev (Texas A&M University), Wing Tat Leung (City
  University of Hong Kong), Wenyuan Li (Texas A&M University), Zecheng Zhang
  (Carnegie Mellon University)","Hybrid explicit-implicit learning for multiscale problems with time
  dependent source","18 pages, 9 figures",,"10.1016/j.cnsns.2022.107081",,"math.NA cs.NA","http://creativecommons.org/licenses/by/4.0/","  The splitting method is a powerful method for solving partial differential
equations. Various splitting methods have been designed to separate different
physics, nonlinearities, and so on. Recently, a new splitting approach has been
proposed where some degrees of freedom are handled implicitly while other
degrees of freedom are handled explicitly. As a result, the scheme contains two
equations, one implicit and the other explicit. The stability of this approach
has been studied. It was shown that the time step scales as the coarse spatial
mesh size, which can provide a significant computational advantage. However,
the implicit solution part can still be expensive, especially for nonlinear
problems. In this paper, we introduce modified partial machine learning
algorithms to replace the implicit solution part of the algorithm. These
algorithms are first introduced in arXiv:2109.02147, where a homogeneous source
term is considered along with the Transformer, which is a neural network that
can predict future dynamics. In this paper, we consider time-dependent source
terms which is a generalization of the previous work. Moreover, we use the
whole history of the solution to train the network. As the implicit part of the
equations is more complicated to solve, we design a neural network to predict
it based on training. Furthermore, we compute the explicit part of the solution
using our splitting strategy. In addition, we use Proper Orthogonal
Decomposition based model reduction in machine learning. The machine learning
algorithms provide computational saving without sacrificing accuracy. We
present three numerical examples which show that our machine learning scheme is
stable and accurate.
","[{""version"":""v1"",""created"":""Sun, 14 Aug 2022 06:27:16 GMT""}]","2023-03-22"
