"2208.06826","R. C. Penner","Robert Penner","Angle Defect for Super Triangles","27 pages, Festschrift for Athanase Papadopoulos; revision corrects
  silly insignificant error",,,,"math.GT hep-th","http://creativecommons.org/licenses/by-nc-sa/4.0/","  We prove that the angle defect minus the area of a super hyperbolic triangle
is not identically zero and explicitly compute the purely fermionic difference.
This disproves the Angle Defect Theorem for N=1 super hyperbolic geometry and
provides a novel non-trivial additive function of super triangles. The proof
techniques involve the real orthosymplectic group OSp(1|2) in its action on the
real super Minkowski space of dimension 2,1|1 and brute-force computation.
","[{""version"":""v1"",""created"":""Sun, 14 Aug 2022 10:37:38 GMT""},{""version"":""v2"",""created"":""Wed, 5 Oct 2022 00:23:37 GMT""}]","2022-10-06"
"2208.06827","Molla Rashied Hussein","Ayman Hasib, Saqib Sizan Khan, Jannatul Ferdous Eva, Mst. Nipa Khatun,
  Ashraful Haque, Nishat Shahrin, Rashik Rahman, Hasan Murad, Md. Rajibul
  Islam, Molla Rashied Hussein","BDSL 49: A Comprehensive Dataset of Bangla Sign Language","16 pages; 6 figures; Submitted to Data in Brief, a multidisciplinary,
  open-access and peer-reviewed journal for reviewing",,,,"cs.CV","http://creativecommons.org/publicdomain/zero/1.0/","  Language is a method by which individuals express their thoughts. Each
language has its own set of alphabetic and numeric characters. People can
communicate with one another through either oral or written communication.
However, each language has a sign language counterpart. Individuals who are
deaf and/or mute communicate through sign language. The Bangla language also
has a sign language, which is called BDSL. The dataset is about Bangla hand
sign images. The collection contains 49 individual Bangla alphabet images in
sign language. BDSL49 is a dataset that consists of 29,490 images with 49
labels. Images of 14 different adult individuals, each with a distinct
background and appearance, have been recorded during data collection. Several
strategies have been used to eliminate noise from datasets during preparation.
This dataset is available to researchers for free. They can develop automated
systems using machine learning, computer vision, and deep learning techniques.
In addition, two models were used in this dataset. The first is for detection,
while the second is for recognition.
","[{""version"":""v1"",""created"":""Sun, 14 Aug 2022 10:54:49 GMT""}]","2022-08-16"
"2208.06828","Li-Yue Sun","John Chiang","Multinomial Logistic Regression Algorithms via Quadratic Gradient","There is a good chance that the enhanced gradient methods for
  multiclass LR could be used in the classisation neural-network training via
  the softmax activation and the cross-entropy loss",,,,"cs.LG math.OC","http://arxiv.org/licenses/nonexclusive-distrib/1.0/","  Multinomial logistic regression, also known by other names such as multiclass
logistic regression and softmax regression, is a fundamental classification
method that generalizes binary logistic regression to multiclass problems. A
recently work proposed a faster gradient called $\texttt{quadratic gradient}$
that can accelerate the binary logistic regression training, and presented an
enhanced Nesterov's accelerated gradient (NAG) method for binary logistic
regression.
  In this paper, we extend this work to multiclass logistic regression and
propose an enhanced Adaptive Gradient Algorithm (Adagrad) that can accelerate
the original Adagrad method. We test the enhanced NAG method and the enhanced
Adagrad method on some multiclass-problem datasets. Experimental results show
that both enhanced methods converge faster than their original ones
respectively.
","[{""version"":""v1"",""created"":""Sun, 14 Aug 2022 11:00:27 GMT""},{""version"":""v2"",""created"":""Wed, 29 Mar 2023 12:10:09 GMT""}]","2023-03-30"
"2208.06829","Christian Anti\'c","Christian Anti\'c","Analogical proportions in monounary algebras and difference proportions",,,,,"cs.AI cs.DM cs.LO","http://arxiv.org/licenses/nonexclusive-distrib/1.0/","  This paper studies analogical proportions in monounary algebras consisting
only of a universe and a single unary function. We show that the analogical
proportion relation is characterized in the infinite monounary algebra formed
by the natural numbers together with the successor function via difference
proportions.
","[{""version"":""v1"",""created"":""Sun, 14 Aug 2022 11:06:56 GMT""},{""version"":""v2"",""created"":""Sun, 12 Feb 2023 16:08:06 GMT""}]","2023-02-14"
"2208.06830","De-Cheng Zou","Chao-Ming Zhang, Ming Zhang and De-Cheng Zou","Gravitational decoupling for hairy black holes in asymptotically AdS
  spacetimes","22 pages, 1 figures","Chinese Physics C Vol. 47, No. 1 (2023) 015106","10.1088/1674-1137/ac9b2c",,"gr-qc","http://arxiv.org/licenses/nonexclusive-distrib/1.0/","  In this study, the gravitational decoupling approach via extended geometric
deformation is utilized to generate analytical black hole solutions owing to
its simplicity and effectiveness. Considering the external fields surrounding
Schwarzschild AdS black holes, we derive hairy black hole solutions in
asymptotic AdS spacetime, satisfying the strong and dominant energy conditions.
Moreover, we find that if the black hole spacetime is a fluid system, the fluid
under each of these conditions is anisotropic.
","[{""version"":""v1"",""created"":""Sun, 14 Aug 2022 11:07:49 GMT""},{""version"":""v2"",""created"":""Fri, 9 Dec 2022 02:13:15 GMT""}]","2022-12-12"
"2208.06831","\'Etienne Fodor","Yiwei Zhang, \'Etienne Fodor","Pulsating active matter","6 pages, 4 figures",,,,"cond-mat.soft cond-mat.stat-mech physics.bio-ph","http://arxiv.org/licenses/nonexclusive-distrib/1.0/","  Cells in tissues consume fuel to sustain periodic mechanical deformation. The
combination of individual deformation and local interactions yields contraction
waves, propagating throughout tissues with only negligible cell displacement.
We consider a model of dense repulsive particles whose activity drives periodic
change in size of each individual. It reveals that, in dense environments,
pulsation of synchronised particles is a generic route to contraction waves.
The competition between repulsion and synchronisation triggers an instability
which promotes a wealth of dynamical patterns, ranging from spiral waves to
defect turbulence. We identify the mechanisms underlying the emergence of
patterns, and characterize the corresponding transitions. We derive the
hydrodynamics of our model, and propose an analogy with that of
reaction-diffusion systems.
","[{""version"":""v1"",""created"":""Sun, 14 Aug 2022 11:24:38 GMT""},{""version"":""v2"",""created"":""Mon, 12 Dec 2022 16:28:25 GMT""}]","2022-12-13"
"2208.06832","Nuh Aydin","Nuh Aydin, Yiang Lu, Vishad R. Onta","An Updated Database of $\mathbb{Z}_4$ Codes",,,,,"cs.IT math.IT","http://creativecommons.org/licenses/by-nc-sa/4.0/","  Research on codes over finite rings has intensified since the discovery in
1994 of the fact that some best binary non-linear codes can be obtained as
images of $\mathbb{Z}_4$-linear codes. Codes over many different finite rings
has been a subject of much research in coding theory after this discovery. Many
of these rings are extensions of $\mathbb{Z}_4$. As a result, an online
database of $\mathbb{Z}_4$ was created in 2008. The URL of the original
database on $\mathbb{Z}_4$ codes has recently changed. The purpose of this
paper is to introduce the new, updated database of $\mathbb{Z}_4$ codes. We
have made major updates to the database by adding 8701 new linear codes over
$\mathbb{Z}_4$. These codes have been found through exhaustive computer
searches on cyclic codes and by an implementation of the ASR search algorithm
that has been remarkably fruitful to obtain new linear codes from the class of
quasi-cyclic (QC) and quasi-twisted (QT) codes over finite fields. We made
modifications to the ASR algorithm to make it work over $\mathbb{Z}_4$. The
initial database contained few codes that were not free. We have added a large
number of non-free codes. In fact, of the 8701 codes we have added, 7631 of
them are non-free.
","[{""version"":""v1"",""created"":""Sun, 14 Aug 2022 11:33:47 GMT""}]","2022-08-16"
"2208.06833","Guanglei Zhang","Tianyi Zhang, Youdan Feng, Yunlu Feng, Yu Zhao, Yanli Lei, Nan Ying,
  Zhiling Yan, Yufang He, Guanglei Zhang","Shuffle Instances-based Vision Transformer for Pancreatic Cancer ROSE
  Image Classification","arXiv admin note: substantial text overlap with arXiv:2206.03080",,,,"eess.IV cs.CV","http://arxiv.org/licenses/nonexclusive-distrib/1.0/","  The rapid on-site evaluation (ROSE) technique can signifi-cantly accelerate
the diagnosis of pancreatic cancer by im-mediately analyzing the fast-stained
cytopathological images. Computer-aided diagnosis (CAD) can potentially address
the shortage of pathologists in ROSE. However, the cancerous patterns vary
significantly between different samples, making the CAD task extremely
challenging. Besides, the ROSE images have complicated perturbations regarding
color distribution, brightness, and contrast due to different staining
qualities and various acquisition device types. To address these challenges, we
proposed a shuffle instances-based Vision Transformer (SI-ViT) approach, which
can reduce the perturbations and enhance the modeling among the instances. With
the regrouped bags of shuffle instances and their bag-level soft labels, the
approach utilizes a regression head to make the model focus on the cells rather
than various perturbations. Simultaneously, combined with a classification
head, the model can effectively identify the general distributive patterns
among different instances. The results demonstrate significant improvements in
the classification accuracy with more accurate attention regions, indicating
that the diverse patterns of ROSE images are effectively extracted, and the
complicated perturbations are significantly reduced. It also suggests that the
SI-ViT has excellent potential in analyzing cytopathological images. The code
and experimental results are available at https://github.com/sagizty/MIL-SI.
","[{""version"":""v1"",""created"":""Sun, 14 Aug 2022 11:37:04 GMT""}]","2022-08-16"
"2208.06834","Guohe Yang","Guo-He Yang, En-Pei Liang, Qin Qin, and Kang-Kang Shao","Inclusive weak-annihilation decays and lifetimes of beauty-charmed
  baryons","7 pages, 4 figures",,"10.1103/PhysRevD.106.093013",,"hep-ph","http://creativecommons.org/licenses/by/4.0/","  Imbalanced beauty-charmed baryons $ \Xi_{bc}^{+,0} $ are of great
significance to the development of heavy flavor physics. In this work, we study
the inclusive weak-annihilation decays of $\Xi_{bc}^{+,0}$ and their
contributions to the $\Xi_{bc}^{+,0}$ lifetimes. For the calculation of the
inclusive $\Xi_{bc}^{+,0}\to X_{cs}$ decay width where $X_{cs}$ stands for the
sum of the final states with charm number +1 and strange number -1, we work in
the heavy diquark effective theory which provides us with a convenient
technical tool to construct the operator product expansion. The
$\Xi_{bc}^{+,0}$ is considered to be a superposition of two states with one
containing a spin-0 $bc$ diquark and the other one containing a spin-1 $bc$
diquark. It is found that both the $\Xi_{bc}^{+,0}$ lifetimes and the
$\Xi_{bc}^{+,0}\to X_{cs}$ branching ratios are very sensitive to the $bc$ spin
in $\Xi_{bc}^{+,0}$. The $\Xi_{bc}^{+,0}\to X_{cd}$ results are also presented.
As $\Xi_{bc}^+$ has a longer lifetime than $\Xi_{bc}^{0}$ and bigger branching
ratios of similar decay channels, the exclusive decays $\Xi_{bc}^+\to
D^{(*)+}\Lambda$, $\Xi_{bc}^+\to \Lambda_c^+\bar{K}^{(*)0}$, $\Xi_{bc}^+\to
D^{(*)+}K^-p$, and $\Xi_{bc}^+\to D^{0}\bar{K}^{(*)0}p$ are more promising for
experimental searches of $\Xi_{bc}^{+,0}$ at the LHC comparing with exclusive
decay $\Xi_{b c} ^{0} \to D^0pK^-$.
","[{""version"":""v1"",""created"":""Sun, 14 Aug 2022 11:44:38 GMT""},{""version"":""v2"",""created"":""Mon, 19 Sep 2022 02:45:05 GMT""},{""version"":""v3"",""created"":""Thu, 17 Nov 2022 03:06:08 GMT""}]","2022-12-14"
"2208.06835","Namyoon Lee","Donghwa Han, Jeonghun Park, Youngjoo Lee, H. Vincent Poor, and Namyoon
  Lee","Block Orthogonal Sparse Superposition Codes for Ultra-Reliable
  Low-Latency Communications","30 pages, 8 figures",,,,"cs.IT math.IT","http://arxiv.org/licenses/nonexclusive-distrib/1.0/","  Low-rate and short-packet transmissions are important for ultra-reliable
low-latency communications (URLLC). In this paper, we put forth a new family of
sparse superposition codes for URLLC, called block orthogonal sparse
superposition (BOSS) codes. We first present a code construction method for the
efficient encoding of BOSS codes. The key idea is to construct codewords by the
superposition of the orthogonal columns of a dictionary matrix with a
sequential bit mapping strategy. We also propose an approximate maximum a
posteriori probability (MAP) decoder with two stages. The approximate MAP
decoder reduces the decoding latency significantly via a parallel decoding
structure while maintaining a comparable decoding complexity to the successive
cancellation list (SCL) decoder of polar codes. Furthermore, to gauge the code
performance in the finite-blocklength regime, we derive an exact analytical
expression for block-error rates (BLERs) for single-layered BOSS codes in terms
of relevant code parameters. Lastly, we present a cyclic redundancy check
aided-BOSS (CA-BOSS) code with simple list decoding to boost the code
performance. Our experiments verify that CA-BOSS with the simple list decoder
outperforms CA-polar codes with SCL decoding in the low-rate and
finite-blocklength regimes while achieving the finite-blocklength capacity
upper bound within one dB of signal-to-noise ratio.
","[{""version"":""v1"",""created"":""Sun, 14 Aug 2022 11:44:42 GMT""}]","2022-08-16"
"2208.06836","Yuyao Wang","Yuyao Wang, Andrew Ying, Ronghui Xu","Doubly Robust Estimation under Covariate-Induced Dependent Left
  Truncation",,,,,"stat.ME","http://arxiv.org/licenses/nonexclusive-distrib/1.0/","  In prevalent cohort studies with follow-up, the time-to-event outcome is
subject to left truncation leading to selection bias. For estimation of the
distribution of time-to-event, conventional methods adjusting for left
truncation tend to rely on the (quasi-)independence assumption that the
truncation time and the event time are ""independent"" on the observed region.
This assumption is violated when there is dependence between the truncation
time and the event time possibly induced by measured covariates. Inverse
probability of truncation weighting leveraging covariate information can be
used in this case, but it is sensitive to misspecification of the truncation
model. In this work, we apply the semiparametric theory to find the efficient
influence curve of an expected (arbitrarily transformed) survival time in the
presence of covariate-induced dependent left truncation. We then use it to
construct estimators that are shown to enjoy double-robustness properties. Our
work represents the first attempt to construct doubly robust estimators in the
presence of left truncation, which does not fall under the established
framework of coarsened data where doubly robust approaches are developed. We
provide technical conditions for the asymptotic properties that appear to not
have been carefully examined in the literature for time-to-event data, and
study the estimators via extensive simulation. We apply the estimators to two
data sets from practice, with different right-censoring patterns.
","[{""version"":""v1"",""created"":""Sun, 14 Aug 2022 11:49:30 GMT""},{""version"":""v2"",""created"":""Mon, 13 Mar 2023 04:19:02 GMT""}]","2023-03-14"
"2208.06837","Dariush Jahani","D. Jahani, O. Akhavan and A. Alidoust Ghatar","Quantum Hall Goos-H\""anchen effect in graphene","6 figures",,"10.1016/j.physleta.2023.128700",,"cond-mat.mes-hall","http://creativecommons.org/licenses/by/4.0/","  Strong Goos-H\""anchen (GH) effect at a prism-graphene interface in the
quantum Hall effect (QHE) condition is reported. Based on the full quantum
description of the temperature-dependent surface conductivity of graphene
present in the unconventional quantum Hall regime, magnetically strong tunable
QHE GH shifts emerge. Our approach is based on deriving the generalized Fresnel
coefficients with antisymmetric conductivity tensor for the Kerr phase of the
incident linearly polarized light. Moreover, it is demonstrated that at low
temperatures, GH shifts map plateaus as the intensity of the magnetic field
grows. This quantum modulation of the GH effect in graphene by an applied
magnetostatic bias may open doors to new opportunities for optical devices and
QHE sensing applications in 2D materials.
","[{""version"":""v1"",""created"":""Sun, 14 Aug 2022 11:57:17 GMT""}]","2023-03-22"
"2208.06838","He HaoYuan","Haoyuan He, Wangzhou Dai, Ming Li, Yu Liu, Yongchang Ma","Reduced Implication-bias Logic Loss for Neuro-Symbolic Learning",,,,,"cs.AI cs.LG cs.LO","http://creativecommons.org/licenses/by/4.0/","  Integrating logical reasoning and machine learning by approximating logical
inference with differentiable operators is a widely used technique in
Neuro-Symbolic systems.
  However, some differentiable operators could bring a significant bias during
backpropagation and degrade the performance of Neuro-Symbolic learning.
  In this paper, we reveal that this bias, named \textit{Implication Bias} is
common in loss functions derived from fuzzy logic operators.
  Furthermore, we propose a simple yet effective method to transform the biased
loss functions into \textit{Reduced Implication-bias Logic Loss (RILL)} to
address the above problem.
  Empirical study shows that RILL can achieve significant improvements compared
with the biased logic loss functions, especially when the knowledge base is
incomplete, and keeps more robust than the compared methods when labelled data
is insufficient.
","[{""version"":""v1"",""created"":""Sun, 14 Aug 2022 11:57:46 GMT""}]","2022-08-16"
"2208.06839","Giuliano Giacalone","Giuliano Giacalone","There and Sharp Again: The Circle Journey of Nucleons and Energy
  Deposition","9 pages; 1 figure",,,,"nucl-th hep-ex hep-ph nucl-ex","http://arxiv.org/licenses/nonexclusive-distrib/1.0/","  A central question in high-energy nuclear phenomenology is how the geometry
of the quark-gluon plasma (QGP) formed in relativistic nuclear collisions is
precisely shaped. In our understanding of such processes, two features are
especially crucial for the determination of the QGP geometry, respectively, the
nucleon size and the energy deposition scheme. This contribution reports on the
(circular) evolution of such features in state-of-the-art model incarnations of
heavy-ion collisions over the past seven years. Ideas for future directions of
investigation are pointed out.
","[{""version"":""v1"",""created"":""Sun, 14 Aug 2022 12:01:55 GMT""}]","2022-08-16"
"2208.06840","Anna Vershynina","Anna Vershynina","Coherence as entropy increment for Tsallis and Renyi entropies","3 figures",,,,"quant-ph math-ph math.MP","http://arxiv.org/licenses/nonexclusive-distrib/1.0/","  Relative entropy of coherence can be written as an entropy difference of the
original state and the incoherent state closest to it when measured by relative
entropy. The natural question is, if we generalize this situation to Tsallis or
R\'enyi entropies, would it define good coherence measures? In other words, we
define a difference between Tsallis entropies of the original state and the
incoherent state closest to it when measured by Tsallis relative entropy.
Taking R\'enyi entropy instead of the Tsallis entropy, leads to the well-known
distance-based R\'enyi coherence, which means this expression defined a good
coherence measure. Interestingly, we show that Tsallis entropy does not
generate even a genuine coherence monotone, unless it is under a very
restrictive class of operations. Additionally, we provide continuity estimates
for both Tsallis and R\'enyi coherence expressions. Furthermore, we present two
coherence measures based on the closest incoherent state when measures by
Tsallis or R\'enyi relative entropy.
","[{""version"":""v1"",""created"":""Sun, 14 Aug 2022 12:14:08 GMT""},{""version"":""v2"",""created"":""Thu, 1 Dec 2022 18:01:26 GMT""}]","2022-12-02"
"2208.06841","Houyi Yu","Da Xu, Houyi Yu","On the cancellation-free antipode formula for the Malvenuto-Reutenauer
  Hopf Algebra","19 pages","European J. Combin.113 (2023) 103745",,,"math.CO math.RA","http://creativecommons.org/licenses/by-nc-nd/4.0/","  For the Malvenuto-Reutenauer Hopf algebra of permutations, we provide a
cancellation-free antipode formula for any permutation of the form
$ab1\cdots(b-1)(b+1)\cdots(a-1)(a+1)\cdots n$, which starts with the decreasing
sequence $ab$ and ends with the increasing sequence
$1\cdots(b-1)(b+1)\cdots(a-1)(a+1)\cdots n$, where $1\leq b<a\leq n$. As a
consequence, we confirm two conjectures posed by Carolina Benedetti and Bruce
E. Sagan.
","[{""version"":""v1"",""created"":""Sun, 14 Aug 2022 12:15:53 GMT""},{""version"":""v2"",""created"":""Wed, 31 May 2023 23:06:54 GMT""}]","2023-06-02"
"2208.06842","Melanie Birke Prof.Dr.","Manuela Dorn, Melanie Birke and Carsten Jentsch","Testing exogeneity in the functional linear regression model",,,,,"math.ST stat.TH","http://arxiv.org/licenses/nonexclusive-distrib/1.0/","  We propose a novel test statistic for testing exogeneity in the functional
linear regression model. In contrast to Hausman-type tests in finite
dimensional linear regression setups, a direct extension to the functional
linear regression model is not possible. Instead, we propose a test statistic
based on the sum of the squared difference of projections of the two estimators
for testing the null hypothesis of exogeneity in the functional linear
regression model. We derive asymptotic normality under the null and consistency
under general alternatives. Moreover, we prove bootstrap consistency results
for residual-based bootstraps. In simulations, we investigate the finite sample
performance of the proposed testing approach and illustrate the superiority of
bootstrap-based approaches. In particular, the bootstrap approaches turn out to
be much more robust with respect to the choice of the regularization parameter.
","[{""version"":""v1"",""created"":""Sun, 14 Aug 2022 12:24:48 GMT""}]","2022-08-16"
"2208.06843","Weikang Lin","Weikang Lin and Tsutomu T. Yanagida","Consistency of the string inspired electroweak axion with cosmic
  birefringence","5 pages, 1 figure, 1 table. Comments welcome",,"10.1103/PhysRevD.107.L021302",,"hep-ph astro-ph.CO","http://arxiv.org/licenses/nonexclusive-distrib/1.0/","  We revisit the constraint from the recently reported cosmic birefringence on
axion-like particles with a general decay constant. A particular attention is
paid to the naturalness of the model parameter space, which has been overlooked
in the literature. We show that the observed cosmic birefringence is naturally
explained by the electroweak axion with a string-theory inspired decay constant
$F_A\simeq 10^{16}$ GeV.
","[{""version"":""v1"",""created"":""Sun, 14 Aug 2022 12:26:55 GMT""},{""version"":""v2"",""created"":""Tue, 7 Feb 2023 11:28:32 GMT""}]","2023-02-08"
"2208.06844","Jafar Khodagholizadeh","J. Khodagholizadeh","Gravitational Waves with Dark Energy","19 pages, 3 Figure","JHEA, 36 (2022) 48","10.1016/j.jheap.2022.07.003",,"gr-qc astro-ph.HE","http://creativecommons.org/licenses/by/4.0/","  In this article, we study the tensor mode equation of perturbation in the
presence of nonzero-Lambda as dark energy, the dynamic nature of which depends
on the Hubble parameter H and/or its time derivative. Dark energy, according to
the total vacuum contribution, has a slight effect during the
radiation-dominated era, but it reduces the squared amplitude of gravitational
waves (GWs) up to 60% for the wavelengths that enter the horizon during the
matter-dominated era.
","[{""version"":""v1"",""created"":""Sun, 14 Aug 2022 12:49:10 GMT""}]","2022-08-17"
"2208.06845","Yao-Bei Liu","Jin-Zhong Han, Yao-Bei Liu, Lu Xing, Shuai Xu","Search for single production of vectorlike $B$-quarks at the LHC","16 pages, 7 figures. This is the version accepted by Chinese Physics
  C",,"10.1088/1674-1137/ac79ab",,"hep-ph","http://creativecommons.org/licenses/by/4.0/","  New vectorlike quarks have been proposed in many scenarios of new physics
beyond the Standard Model, which address the hierarchy problem and may be
potentially discovered at the Large Hadron Collider~(LHC). Based on a
model-independent framework, we propose to search for the vectorlike
$B$-quark~(VLQ-$B$) and focus on resonant production via $b$-gluon fusion
through chromomagnetic interactions. We then explore the possible signals of
the VLQ-$B$ through the $B\to tW$ decay mode at the 14 TeV LHC. After a rapid
simulation of signal and background events, the $2\sigma$ excluded regions and
the $5\sigma$ discovery reach in the parameter plane of $\kappa_{B}-M_B$ are
obtained at the LHC with an integrated luminosity of 300~(3000) fb$^{-1}$ in
the dilepton final states.
","[{""version"":""v1"",""created"":""Sun, 14 Aug 2022 12:55:40 GMT""},{""version"":""v2"",""created"":""Tue, 16 Aug 2022 10:27:58 GMT""}]","2022-08-17"
